,id,ticker,title,category,content,date,provider,url,article_id
156962,378478,NRG,The Zacks Analyst Blog Highlights  TransDigm  Keysight  Bristol Myers Squibb  NRG And Arconic,opinion,For Immediate ReleaseChicago  IL  September 4  2019   Zacks com announces the list of stocks featured in the Analyst Blog  Every day the Zacks Equity Research analysts discuss the latest news and events impacting stocks and the financial markets  Stocks recently featured in the blog include  TransDigm Group Inc    NYSE TDG    Keysight Technologies Inc    NYSE KEYS    Bristol Myers Squibb Co    NYSE BMY    NRG Energy Inc    NYSE NRG   and Arconic Inc    NYSE ARNC   Here are highlights from Tuesday s Analyst Blog 5 Top S P 500 Stocks Soaring Despite Worst August in 4 YearsWall Street just completed a disappointing August  which historically remains weak in stock market performance  However  this August dented investors  confidence a little bit more with heightened trade conflict between United States and China  global economic slowdown and various geopolitical unrests However  despite the presence of severe volatility  a few stocks  within the broad market S P 500 Index  climbed in August Major Indexes Plummet in AugustAll three major stock indexes      the S P 500  the Dow and the Nasdaq Composite      finished in negative territory in August  So far in 2019  August was the second month after May  when all three major stock indexes closed in the red Notably  the S P 500  the Dow and the Nasdaq Composite lost 1 8   1 7  and 2 6  in August  marking the worst ever performance in August since 2015 for all the three indexes  These indexes posted four successive weekly losses starting from the last week of July to the third week of August  It was only in the fourth week of August that these indexes rallied on hopes of renewed trade talks between the United States and China Volatility Mars Stock PerformanceAfter two consecutive months of bull run  volatility resurfaced on Wall Street from the beginning of August owing to a less than expected dovish monetary stance adopted by the Fed and President Trump s tweet expressing desire to impose a 10  tariff on a new set of Chinese goods worth  300 billion Moreover  China started manipulating its currency by setting its mid point to below 7 a U S  dollar  a key psychological barrier  for the first time in more than a decade  Meanwhile  Eurozone continued to suffer from manufacturing wooed and several major emerging market central banks reduced the benchmark interest rate to steady their economies in order to combat a global economic slowdown Meanwhile  the tariff war between the two largest trading nations of the world heightened on Aug 23 after China announced that it will impose 5  to 10  tariff on another  75 billion of U S  goods in two tranches  on Sep 1 and Dec 15  Additionally  a 25  tariff on U S  auto products and auto parts will be imposed effective Dec 15 In retaliation  President Donald Trump decided to raise tariff to 30  from the existing 25  on  250 billion Chinese goods  Moreover  he also raised the tariff from 10  to 15   which is to be levied on an additional  300 billion of Chinese exports effective Sep 1 Additionally  several geopolitical crises such as the possibility of a no deal Brexit in Britain  political turmoil in Italy  political unrest for democracy in Hong Kong and the ongoing oil conflict between the United States and China also jeopardized investors  confidence Treasury Yield Curve InversionAll these negatives resulted in inversion of yields on 2 year and 10 year U S  Treasury Notes on Aug 14  for the first time since December 2005  Thereafter  on Aug 28  yield on the 10 year Note plummeted below the psychological barrier of 1 5  to 1 45  and below the 2 year Note s yield of 1 5   The spread registered its lowest level since 2007  Similarly  the yield on 30 year U S  Treasury Note fell below its psychological barrier of 2  to as low as 1 907  Meanwhile  the yield on short term 3 month Treasury Bill stayed at 1 992   reflecting inversion with the yields of mid term 2 year  benchmark 10 year and long term 30 year Notes  Several economists and financial experts consider this bond market phenomenon as a clear indication of an impending recession 5 S P 500 Stocks Surge in AugustThe recent concerns about a U S  China trade deal and consequently global economic slowdown have not stalled the entire market  We have been able to narrow down our search to five S P 500 stocks  which have popped in the past month and still have upside left  All five stocks currently sport a Zacks Rank  1  Strong Buy   You can see  TransDigm Group Inc  is a leading global designer  producer and supplier of highly engineered aircraft components for use on nearly all commercial and military aircraft in service today  It operates in three segments  Power   Control  Airframe and Non aviation The company has expected earnings growth of 1  for the current year  The Zacks Consensus Estimate for current year earnings has moved up 5 8  over the last 30 days  TransDigm Group has jumped 12 3  in the past month Keysight Technologies Inc  provides electronic design and test solutions to commercial communications  networking  aerospace  defense and government  automotive  energy  semiconductor and electronic industries in the Americas and the Asia Pacific The company has expected earnings growth of 38 9  for the current year  The Zacks Consensus Estimate for current year earnings has moved up 6 4  over the last 30 days  Keysight Technologies has climbed 8 1  in the past month Bristol Myers Squibb Co  discovers  develops  licenses  manufactures  markets  distributes and sells biopharmaceutical products worldwide  The company offers drugs in oncology  immunoscience  cardiovascular and fibrotic diseases The company has expected earnings growth of 7 5  for the current year  The Zacks Consensus Estimate for current year earnings has moved up 0 5  over the last 30 days  Bristol Myers Squibb has soared 6 3  in the past month NRG Energy Inc  is the leading integrated power company in the United States  built on the strength of their diverse competitive electric generation portfolio and leading retail electricity platform  It is involved in the producing  selling and delivering electricity and related products and services residential  industrial and commercial consumers The company has expected earnings growth of 67 6  for the current year  The Zacks Consensus Estimate for current year earnings has moved up 4 9  over the last 30 days  NRG Energy has surged 6  in the past month Arconic Inc  is a global leader in multi material  precision engineered products and solutions for a variety of industries  It operates in three segments  Engineered Products and Solutions  Global Rolled Products  and Transportation and Construction Solutions The company has expected earnings growth of 50  for the current year  The Zacks Consensus Estimate for current year earnings has moved up 8 5  over the last 30 days  Arconic has surged 6  in the past month The Hottest Tech Mega Trend of AllLast year  it generated  8 billion in global revenues  By 2020  it s predicted to blast through the roof to  47 billion  Famed investor Mark Cuban says it will produce  the world s first trillionaires   but that should still leave plenty of money for regular investors who make the right trades early Media ContactZacks Investment Research800 767 3771 ext  9339 Past performance is no guarantee of future results  Inherent in any investment is the potential for loss  This material is being provided for informational purposes only and nothing herein constitutes investment  legal  accounting or tax advice  or a recommendation to buy  sell or hold a security  No recommendation or advice is being given as to whether any investment is suitable for a particular investor  It should not be assumed that any investments in securities  companies  sectors or markets identified and described were or will be profitable  All information is current as of the date of herein and is subject to change without notice  Any views or opinions expressed may not reflect those of the firm as a whole  Zacks Investment Research does not engage in investment banking  market making or asset management activities of any securities  These returns are from hypothetical portfolios consisting of stocks with Zacks Rank   1 that were rebalanced monthly with zero transaction costs  These are not the returns of actual portfolios of stocks  The S P 500 is an unmanaged index  Visit  for information about the performance numbers displayed in this press release ,2019-09-03,Zacks Investment Research,https://www.investing.com/analysis/the-zacks-analyst-blog-highlights-transdigm-keysight-bristolmyers-squibb-nrg-and-arconic-200461398,200461398
156963,378479,NRG,The Zacks Analyst Blog Highlights  NRG  Unitil  General Mills  Boston Beer And Penn National,opinion,For Immediate ReleaseChicago  IL  September 4  2019   Zacks com announces the list of stocks featured in the Analyst Blog  Every day the Zacks Equity Research analysts discuss the latest news and events impacting stocks and the financial markets  Stocks recently featured in the blog include  NRG Energy  Inc    NYSE NRG    Unitil Corp    NYSE UTL    General Mills  Inc    NYSE GIS    The Boston Beer Company  Inc    NYSE SAM   and Penn National Gaming  Inc    NASDAQ PENN   Here are highlights from Tuesday s Analyst Blog 5 Rock Solid Stocks to Buy as September Looks ToughSummer is unofficially over and traders are back in business after an extended Labor Day break  But  September is historically the worst month for the stock market  And this September  particularly  can be a tough one as it follows a volatile August Trade related uncertainties and economic slowdown are primarily responsible for the market s volatile streak  Given such bearishness  investors should pick stocks that have a steady stream of customers  irrespective of market conditions September  Typically Rocky for StocksStocks tend to wobble in September  According to Dow Jones Market Data  since 1937  both the S P 500 and the Dow averaged a loss of 1   The Nasdaq Composite  as incepted in 1971  averaged a loss of 0 5   CFRA added that the broader S P 500 has averaged a 1  decline  particularly  in September since 1946 What s more  September is gloomier after a downbeat August  It was a wild month for the stock market  with the S P 500  the Dow and the Nasdaq registering a loss of 1 8   1 7  and 2 6   respectively  By the way  this marked the worst August performance for the bourses since 2015 And whenever S P 500 has lost more than 1 5  in August  the Dow declined an average 1 1  in September  while the Nasdaq has saw an average drop of 0 8   The S P 500  itself  continued its losing run  falling 0 9  What Happened in August Escalating trade tensions and signs of a recession dealt a heavy blow to stocks during August  The S P 500 declined at least 2 6  three times during August  while the Cboe Volatility Index  VIX   better known as fear gauge index  traded as high as 24 81 before pulling back to around 18 The U S  China trade tussle intensified last month after President Trump urged American firms to start looking for an  alternative to China   Trouble began after China announced plans of imposing tariffs of 5  and 10  on nearly  75 billion of U S  products Beijing clarified that the move was due to the Trump administration s intention to impose 10  tariffs on  300 billion of Chinese imports  Trump  in the meantime  reacted to China s decision by saying that the United States will increase tariffs on  250 billion of Chinese goods to 30  from an earlier 25   And tariffs on additional  300 billion imports from China would go up to 15  from 10  Meanwhile  the benchmark 10 year Treasury yield s fall below the 2 year Treasury yield added to the bearish sentiments  With the 10 year rate below the 2 year note  fixed income traders are expecting a slowdown in the near term  Lest we forget  the 2 year yield has always surpassed the 10 year note in every slowdown over the past 50 years So  what led to the inverted yield curve  Thanks to the ever changing China trade narrative  the stock market continues to gyrate  compelling investors to pull money out of equities and opt for safe haven government bonds  eventually leading to a decline in the 10 year Treasury yield  After all  bond yields tend to move opposite to prices Things Not Rosy This SeptemberU S  China trade war  in fact  shows no signs of cooling down this month  Tariffs of 15  on  112 billion of Chinese goods have been put into effect on Sep 1  as did retaliatory Chinese tariffs on U S  commodities  including crude oil imports Now  nearly two thirds of the consumer goods that the United States imports from China will face higher taxes  Americans have to pay more for items like shoes  clothes and sporting goods  Trump s higher tariffs will now impact consumer spending  which has been one of the driving factors for the economy  Needless to say  business houses have lowered spending and exports have slowed down in the face of weak global growth Both Washington and Beijing are struggling to de escalate the trade war  with the United States accusing China of stealing trade secrets and unfairly subsidizing its own companies to make headway into high tech fields such as AI and electric cars 5 Best Stocks to Buy in SeptemberWith things not looking up on the trade front and yield curve remaining inverted  choppy trading sessions are expected to persist this September  However  contrary to popular belief  there are stocks that do well during market gyrations Prominent among them are defensive stocks  These stocks are generally non cyclical  or companies whose business performance and sales are not highly correlated with activities in the larger market  Their products are in constant demand  irrespective of market volatility  and such names include companies from the utilities and consumer staples sectors The idea of investing in  vice  stocks can also be considered  After all  products or services in this space are relatively inelastic  and business is slowdown proof  The very nature of their business ensures a stable stream of consumers  irrespective of market conditions  which eventually leads to higher margins and solid profits  Noteworthy vice stocks include beer and gaming companies We have  thus  selected five solid stocks from the aforesaid areas that flaunt a Zacks Rank  1  Strong Buy  or 2  Buy  NRG Energy  Inc is involved in producing  selling  and delivering electricity and related products and services  It has a Zacks Rank  1  The Zacks Consensus Estimate for its current year earnings has moved up 4 9  in the past 30 days  The stock s expected earnings growth rate for the current year is 67 7  versus the  industry s estimated rally of 3 2  Unitil Corp   a public utility holding company  engages in the distribution of electricity and natural gas in the United States  It has a Zacks Rank  2  The Zacks Consensus Estimate for its current year earnings has risen 0 9  in the past 60 days  The stock s expected earnings growth rate for the current year is 4  versus the Utility   Electric Power industry s projected rally of 3 2  General Mills  Inc manufactures and markets branded consumer foods  It has a Zacks Rank  2  The Zacks Consensus Estimate for its current year earnings has increased 0 9  in the past 90 days  The stock  which is part of the  industry  is expected to record earnings growth of 8 5  and 4 7  in the current quarter and year  respectively  You can see  The Boston Beer Company  Inc  produces and sells alcohol beverages  primarily in the United States  It has a Zacks Rank  2  The Zacks Consensus Estimate for its current year earnings has moved up nearly 4  in the past 60 days  The stock s expected earnings growth rate for the current year is 19 5  versus the  industry s anticipated decline of 1 8  Penn National Gaming  Inc owns and manages gaming and racing facilities  and operates video gaming terminals with a focus on slot machine entertainment  It has a Zacks Rank  1  The Zacks Consensus Estimate for its current year earnings has increased 10 5  in the past 60 days  The stock s expected earnings growth rate for the current year is 69 9  versus the industry s projected rally of 7 7  In fact  shares of NRG Energy  Unitil  General Mills  The Boston Beer Company and Penn National Gaming have gained 20 1   88 1   0 6   99 9  and 67 4   respectively  over the past five year period  Take a look  Legalizing THIS Could Be Even Bigger than MarijuanaAmericans spend an estimated  150 billion in this industry every year  more than twice as much as they spend on marijuana Now that 8 states have fully legalized it  with several more states following close behind   Zacks has identified 5 stocks that could soar in response to the powerful demand  One industry insider described the future as  mind blowing    and early investors can still get in ahead of the surge Media ContactZacks Investment Research800 767 3771 ext  9339 Past performance is no guarantee of future results  Inherent in any investment is the potential for loss  This material is being provided for informational purposes only and nothing herein constitutes investment  legal  accounting or tax advice  or a recommendation to buy  sell or hold a security  No recommendation or advice is being given as to whether any investment is suitable for a particular investor  It should not be assumed that any investments in securities  companies  sectors or markets identified and described were or will be profitable  All information is current as of the date of herein and is subject to change without notice  Any views or opinions expressed may not reflect those of the firm as a whole  Zacks Investment Research does not engage in investment banking  market making or asset management activities of any securities  These returns are from hypothetical portfolios consisting of stocks with Zacks Rank   1 that were rebalanced monthly with zero transaction costs  These are not the returns of actual portfolios of stocks  The S P 500 is an unmanaged index  Visit  for information about the performance numbers displayed in this press release ,2019-09-03,Zacks Investment Research,https://www.investing.com/analysis/the-zacks-analyst-blog-highlights-nrg-unitil-general-mills-boston-beer-and-penn-national-200461345,200461345
156965,378481,NRG,NRG  NRG  Up 7 1  Since Last Earnings Report  Can It Continue ,opinion,"It has been about a month since the last earnings report for NRG Energy  NYSE NRG   Shares have added about 7 1  in that time frame  outperforming the S P 500 
Will the recent positive trend continue leading up to its next earnings release  or is NRG due for a pullback  Before we dive into how investors and analysts have reacted as of late  let s take a quick look at the most recent earnings report in order to get a better handle on the important drivers  NRG Energy Q2 Earnings Lag Estimates  Revenues Rise Y YNRG Energy delivered earnings of 70 cents per share from continuing operations in second quarter 2019  which missed the Zacks Consensus Estimate of 78 cents by 10 3   However  the figure improved significantly when compared with a penny registered in the year ago quarter   RevenuesNRG Energy s revenues of  2 465 million in the quarter inched up 0 2  from the year ago quarter s figure Highlights of the ReleaseSecond quarter adjusted EBITDA was  469 million compared with  517 million in the year ago quarter As part of the Transformation Plan  the company realized  261 million in the second quarter of its 2019 cost savings target Through Aug 7  2019  the company completed share repurchases of  1 25 billion that includes the  1 billion share repurchase program announced on the fourth quarter of 2018 Moreover  the Board of Directors has authorized an incremental share repurchase program of  250 million  which is expected to be executed in 2019 The company executed approximately 1 3 gigawatts of solar power purchase agreements in the Electric Reliability Council of Texas  ERCOT  Financial HighlightsAs of Jun 30  2019  the company had cash and cash equivalents of  294 million compared with  563 million as of Dec 31  2018 As of Jun 30  the company s long term debt and capital leases amounted to  5 794 million compared with  6 449 million as of Dec 31  2018 The company s net cash provided by operating activities in the first six months of 2019 was  389 million compared with  513 million generated in the first six months of 2018 Capital expenditure in the first six months of 2019 was  107 million compared with  282 million in the year ago period GuidanceThe company reaffirmed 2019 adjusted EBITDA guidance in the range of  1 850  2 050 million and free cash flow before growth investments in the band of  1 250  1 450 million  
How Have Estimates Been Moving Since Then 
It turns out  estimates revision have trended upward during the past month 
VGM Scores
At this time  NRG has a strong Growth Score of A  though it is lagging a lot on the Momentum Score front with a D  However  the stock was allocated a grade of A on the value side  putting it in the top 20  for this investment strategy 
Overall  the stock has an aggregate VGM Score of A  If you aren t focused on one strategy  this score is the one you should be interested in 
Outlook
Estimates have been trending upward for the stock  and the magnitude of this revision looks promising  It comes with little surprise NRG has a Zacks Rank  2  Buy   We expect an above average return from the stock in the next few months ",2019-09-05,Zacks Investment Research,https://www.investing.com/analysis/nrg-nrg-up-71-since-last-earnings-report-can-it-continue-200462346,200462346
156967,378483,NRG,Is NRG Energy  NRG  A Great Growth Stock  ,opinion,Growth stocks can be some of the most exciting picks in the market  as these high flyers can captivate investors  attention  and produce big gains as well  However  they can also lead on the downside when the growth story is over  so it is important to find companies which are still seeing strong growth prospects in their businesses One such company that might be well positioned for future earnings growth is NRG Energy  Inc    NYSE NRG    This firm  which is in the Utility   Electric Power industry  saw a significant EPS growth last year  and is looking great for this year too In fact  the current growth estimate for this year calls for earnings per share growth of 67 6   Furthermore  the long term growth rate is currently an impressive 36 3   suggesting pretty good prospects for the long haul NRG Energy  Inc  Price and Consensus    And if this wasn t enough  the stock has actually seen estimates rise over the past month for the next fiscal year by about 3 4   Thanks to this rise in earnings estimates  NRG has a Zacks Rank  2  Buy  which further underscores the potential for outperformance in this company  You can see  So if you are looking for a fast growing stock that is still seeing plenty of opportunities on the horizon  make sure to consider NRG  Not only does it have double digit earnings growth prospects  but its impressive Zacks Rank suggests that analysts believe better days are ahead for NRG as well Today s Best Stocks from ZacksWould you like to see the updated picks from our best market beating strategies  From 2017 through 2018  while the S P 500 gained  15 8   five of our screens returned  38 0    61 3    61 6    68 1   and  98 3  This outperformance has not just been a recent phenomenon  From 2000   2018  while the S P averaged  4 8  per year  our top strategies averaged up to  56 2  per year ,2019-09-08,Zacks Investment Research,https://www.investing.com/analysis/is-nrg-energy-nrg-a-great-growth-stock-200462944,200462944
