,id,ticker,title,category,content,date,provider,url,article_id
33261,254776,ORLY,The S P 500 Wavers Its Way Into A Close Call,opinion,"AT40   57 2  of stocks are trading above their respective 40 day moving averages  DMAs AT200   56 8  of stocks are trading above their respective 200DMAsVIX   11 2  was as high as 13 2 Short term Trading Call  cautiously bullish
Commentary It took three days for the volatility faders to show up again  Nerves in volatility trading stretched for a third day with the VIX trading as high as 13 2 and a 18 3  gain  The VIX ended the action with a fraction of a percent to call a gain 

The volatility index  the VIX  has not traded three straight days to the upside since the first surge in August 
Always wary of the fleeting gains in going long volatility  I locked in a double on my call options on ProShares Ultra VIX Short Term Futures  NYSE UVXY   While this gain on my latest tranche of UVXY calls was gratifying it ended a losing streak in place since September  The month was surprisingly placid and laid consistent waste to my once every two week UVXY hedges  It was a marked contrast to the small profits I eked out in August and the beginning of September 
The surge in volatility was large enough to flag a major sell off  Yet  the S P 500 barely lost 1  at its lowest point on the day  The index closed with a 0 5  loss  The recovery was important for my trading call  As I indicated in my last Above the 40 post  I planned to flip the short term trading call all the way to cautiously bearish if the S P 500 closed below last week s low  As the chart below shows  the S P 500 turned in a close call 

The S P 500  via SPDR S P 500  NYSE SPY   sliced through the previous week s low before buyers rushed in to avoid a bearish breakdown 
Given the major fade of volatility  I am inclined to believe that sellers have exhausted themselves  However  the underlying weakness in the market remains  AT40  T2108   the percentage of stocks trading above their respective 40 day moving averages  DMAs   dropped from 62 8  to 57 2   This level is still far from oversold  20   or  close enough  to oversold  low 30 s   The new bearish turning point is now a close for the S P 500 below today s intraday low  2 544   AT200  T2107   the percentage of stocks trading above their respective 200 DMAs  dropped to a 1 month low 
I find it instructive to note how another bearish divergence resolved into a sell off  It was shallow  again  but sharp enough to  feel  significant  This time around I changed my approach from trying to anticipate the timing of the imminent selling and instead prepared to buy in the wake of that selling 
The NASDAQ and the PowerShares QQQ ETF  PowerShares QQQ Trust Series 1  NASDAQ QQQ   each tumbled similarly  The intraday recovery for QQQ was a bit more convincing 
The NASDAQ recovered sharply off its low but still closed below its 20DMA uptrend 


The PowerShares QQQ ETF  QQQ  recovered sharply to regain its 20DMA uptrend 
The selling was strong enough to push the Financial Select Sector SPDR ETF  NYSE XLF  into its own bearish engulfing topping pattern  I promptly closed out my XLF call options to preserve my remaining profits on the position 

The Financial Select Sector SPDR ETF  XLF  printed its own topping pattern 
STOCK CHART REVIEWS
Chipotle Mexican Grill  NYSE CMG  CMG was my biggest pain of the day  Earnings finally arrived  and the response was far uglier than I feared  I was hoping  300 established itself as a relatively strong support  Instead  it will likely now serve as resistance  I will once again stop out of a small position in shares  Per plan  I did not attempt a pre earnings play with options  a simple put spread would have been quite profitable   
The bad news just keeps gushing out for Chipotle Mexican Grill  CMG   It closed with a 14 6  post earnings loss 
International Business Machines  NYSE IBM  Investors greeted IBM s earnings last week with great cheer  It was enough to erase the loss from July s earnings and challenge the April gap down all in one swoop  The shine came off big time this week as IBM has suffered three days of sharp losses  Its bullish 200DMA breakout is over and now I wonder whether it will close its up gap to earn an award for relief rally of the year 
The tremendous relief in International Business Machines  IBM  is proving quite temporary 
Caterpillar  NYSE CAT  The day s selling was even strong enough to take CAT off its post earnings perch  At its low of the day  I thought CAT was on its way to filling in its incredible up gap  The stock remains quite stretched as it sits on its upper Bollinger Band  BB  

Can Caterpillar  CAT  hold onto its latest post earnings celebration  The stock may be a buy near or at the lower edge of its upper BB trading channel 
Whirlpool  NYSE WHR  Despite continued momentum in housing stocks  WHR stumbled mightily post earnings  A second day of post earnings selling stretched the stock further below its lower BB  This selling looks like it confirmed a top in WHR as the stock separates downward from a head and shoulders type of pattern  not shown in the chart below  

Whirlpool  WHR  trades in wild swings  The latest downward push my be the beginning of more selling to come as the stock prints a topping pattern on the double breakdown from 200 and 50DMA supports 
3M Company  NYSE MMM  MMM defied the sellers and gravity as the stock pushed further beyond its upper BB  The post earnings surge and follow through makes MMM a buy on the dip whenever THAT happens 
3M Company  MMM  now stands out as an old line industrial stock that stubbornly resisted the wave of sellers and displayed great relative strength 
In other news  O Reilly Auto Parts  NASDAQ ORLY  got hammered in after hours post earnings trading  The 7  loss will no doubt take down peers and throw into question the nascent comeback for these stocks 

 Above the 40  uses the percentage of stocks trading above their respective 40 day moving averages  DMAs  to assess the technical health of the stock market and to identify extremes in market sentiment that are likely to reverse  Abbreviated as AT40  Above the 40 is an alternative label for  T2108  which was created by   Learn more about T2108 on my   AT200  or T2107  measures the percentage of stocks trading above their respective 200DMAs 
Active AT40  T2108  periods  Day  420 over 20   Day  234 over 30   Day  34 over 40   Day  33 over 50   overperiod   Day  1 under 60   underperiod ending 28 days above 60    Day  8 under 70 
Daily AT40  T2108 
Black line  AT40  T2108     measured on the right 
Red line  Overbought threshold  70    Blue line  Oversold threshold  20  
Weekly AT40  T2108 
Be careful out there 
Full disclosure  long CMG shares  short CAT call spread
 Charting notes  FreeStockCharts com uses midnight U S  Eastern time as the close for currencies  Stock prices are not adjusted for dividends ",2017-10-26,Dr. Duru,https://www.investing.com/analysis/the-sp-500-wavers-its-way-into-a-close-call-200221118,200221118
33265,254780,ORLY,O Reilly Automotive  ORLY  Catches Eye  Stock Jumps 5 6 ,opinion,"O Reilly Automotive  Inc    NASDAQ ORLY   was a big mover last session  as the company saw its shares rise nearly 6  on the day  The move came on solid volume too with far more shares changing hands than in a normal session  This stock  which remained volatile and traded within the range of  202 72  215 40 in the past one month time frame  witnessed a sharp increase yesterday The move came after the company reported better than expected third quarter 2017 results The company has seen one negative estimate revision in the past few weeks  while its Zacks Consensus Estimate for the current quarter has also moved lower over the past few weeks  suggesting there may be trouble down the road  So make sure to keep an eye on this stock going forward  to see if this recent move higher can last O Reilly Automotive currently has a Zacks Rank  3  Hold  while its  is negative  A better ranked stock in the Automotive   Retail and Wholesale   Parts industry is CarMax Inc    NYSE KMX    holding a Zacks Rank  2  Buy   You can see  
Is ORLY going up  Or down  Predict to see what others think  or Wall Street s Next Amazon  NASDAQ AMZN  Zacks EVP Kevin Matras believes this familiar stock has only just begun its climb to become one of the greatest investments of all time  It s a once in a generation opportunity to invest in pure genius ",2017-10-27,Zacks Investment Research,https://www.investing.com/analysis/oreilly-automotive-orly-catches-eye-stock-jumps-56-200221458,200221458
33300,254815,ORLY,Jazz Pharmaceuticals  O Reilly Automotive And Tesla Highlighted As Zacks Bull And Bear Of The Day ,opinion,For Immediate ReleaseChicago  IL   September 5  2017    Jazz Pharmaceuticals  NASDAQ    NASDAQ JAZZ     as the Bull of the Day  O Reilly Automotive  NASDAQ    NASDAQ ORLY      as the Bear of the Day  In addition  Zacks Equity Research provides analysis onTesla Inc   NASDAQ    NASDAQ TSLA      Here is a synopsis of all three stocks   Jazz Pharmaceuticals  NASDAQ     is a  9 billion drug company focused on developing and commercializing innovative products to meet unmet medical needs in neurology  psychiatry  and oncology On August 8  Jazz reported a weaker than expected quarter and guidance which knocked the shares down from  155 to  140  But I was licking my chops at the opportunity to buy this key franchise trading at just 11X next year s projected EPS of  13  This article will explain why First  you have to understand where JAZZ has been successful  Their top commercially successful drug is Xyrem for the treatment of narcolepsy  Xyrem will comprise nearly 75  of JAZZ s total projected sales this year of  1 64 billion JAZZ s second most important revenue generator is Erwinaze  part of a chemotherapy program to treat patients who have acute lymphoblastic leukemia  or ALL  a type of blood cancer that affects the white blood cells that help fight infection  Erwinaze is used in patients who have had an allergic reaction to a different type of asparaginase treatment Erwinaze is an alternate form of asparaginase  It is thought to help prevent leukemia cells from surviving and works in a similar way as other asparaginase treatments And Erwinaze is part of the oncology pipeline that JAZZ is expanding rapidly and holds the most promise as JAZZ brings new drugs to market and reduces dependence on Xyrem for growth Reaction to Q2 Report Overwhelmed by New FDA ApprovalWells Fargo  NYSE WFC  analyst Ike Bucherow reiterated his Outperform rating on shares of JAZZ and trimmed his price target just a half percent  to  177 from  178  after the company reported Q2 EPS of  2 56  missing the consensus of  2 75  and missing on the top line too by about  10 million The analyst stated  revenues were lighter than what we expected  spending in line with our expectations  resulting in EPS lower than we forecast  but nothing seems to be significantly astray  Jazz reaffirmed its full year revenue guidance of  1 625 billion to  1 7 billion  But it was the news of August 3 that most large biopharma investors were focused on That day  the U S  Food and Drug Administration  FDA  approved the Jazz Pharmaceuticals drug Vyxeos for the treatment of adults with two types of acute myeloid leukemia  AML   a rapidly progressing and life threatening blood cancer  Vyxeos is a fixed combination of chemotherapy drugs daunorubicin and cytarabine Designed with Jazz s CombiPlex proprietary technology  Vyxeos is a unique liposomal formulation that delivers a fixed ratio of daunorubicin and cytarabine to the bone marrow that has been shown to have synergistic effects at killing leukemia cells in vitro and in animal models   Vyxeos is the first product developed with the company s proprietary CombiPlex platform  which enables the design and rapid evaluation of various combinations of therapies  Vyxeos is the first new chemotherapy advance in more than 40 years for adults with newly diagnosed therapy related AML or AML with myelodysplasia related changes   said Bruce Cozadd  chairman and chief executive officer of Jazz Pharmaceuticals   The FDA approval of Vyxeos reflects our commitment to addressing unmet needs within the hematology oncology community   O Reilly Automotive  NASDAQ     is one of the largest specialty retailers of automotive aftermarket parts  tools  supplies  equipment  and accessories in the US  serving both professional service providers and do it yourself customers Since I m a Chicago boy who grew up with NAPA auto parts stores  I ve still never set foot in an O Reilly shop and was surprised to find they now operate 4 935 stores in 47 states  And  as further testament to my ignorance of this great business story  they started in Springfield  MO in 1957  going public in 1993   History of a Great American Immigrant SuccessWhile ORLY is a Zacks  5 Rank Strong Sell because estimates dropped sharply after weak sales comps in July  I want to share a little about this amazing growth story in case you were as ignorant as I was  We ll come back to the company and stock outlook in a moment I borrow this little bit of history from the company website   Michael Byrne O Reilly immigrated to America in 1849  escaping from the hard times of the potato famine  which struck Ireland in 1845 46  Settling in St  Louis  he worked his way through school to earn a law degree  and then pursued a career as a title examiner  His son  Charles Francis O Reilly  attended college in St  Louis and went to work in 1914 as a traveling salesman for Fred Campbell Auto Supply in St  Louis By 1924  Charles had become familiar with the Springfield area  having traveled by train to sell auto parts throughout the territory  He recognized the region as an area of growth and opportunity and asked to be transferred there  By 1932  he had become manager of Link Motor Supply in Springfield  One of his sons  Charles H   Chub  O Reilly  had also joined the company  Together they provided the leadership and management that made Link the predominant auto parts store in the area In 1957  Link planned a reorganization  which would have included the retirement of 72 year old Charles F  O Reilly  and the transfer of C  H  O Reilly to Kansas City  Since neither agreed with these plans  they made the decision to form their own company  O Reilly Automotive  Inc  end of history excerpt from O Reilly website From those humble beginnings  father and son created a business legacy that an any immigrant patriarch would be proud of Now  let s get back to why this company  whose shares have soared from  80 to  290 in four years  summer 2012 to summer 2016   are down 29  YTD  My colleague Neena Mishra wrote about ORLY as the Bull of the Day back in July after their sales comps report and before their Q2 earnings report  Here s what she said then   Shares Plunge After Weak Sales ResultsOn July 5  the company reported its Q2 comparable store sales results  which were much weaker than expected   The stock fell almost 20  and is down about 34  year to date  actually trading down to  170 after that report   After exiting the first quarter and entering April on an improved sales trend  we faced a more challenging sales environment than we expected for the remainder of the quarter  Our second quarter comparable store sales results of 1 7  represent an improvement over our first quarter  but fell below our guidance of 3  to 5   due to what we believe were continued headwinds from a second consecutive mild winter and overall weak consumer demand   said the CEO Falling EstimatesAnalysts have slashed their estimates for the company after weak guidance   Zacks Consensus Estimates for the current and next fiscal year have fallen to  11 83 per share and  13 10 per share from  12 26 and  13 73 respectively  30 days back The company has missed in three out of past four quarters  The average negative quarterly surprise for the past four quarters is 2 3  Additional content Tesla Hit with Labor Board ComplaintThe Oakland regional office of the National Labor Relations Board filed a complaint against electric car giant Tesla Inc   NASDAQ      on Thursday  claiming the automaker interfered with its employees  union activities at Tesla s Fremont  California manufacturing factory The NLRB complaint reaches back to claims made in April  when the United Automobile Workers union filed four separate charges with the board claiming that Tesla had  illegally surveilled and coerced factory workers attempting to distribute information about the union drive   The complaint filed yesterday by the NLRB provides more details on what happened earlier this year  noting things like security guards asking employees distributing pamphlets to show employee ID cards  then proceeding to tell them to leave factory premises  to naming three individual Tesla managers who questioned employees about union activities or tries to prevent employees from talking about union activities NLRB s complaint also cites Tesla s restrictive confidentiality agreement  a document that prohibited employees from organizing or discussing their work condition   While Tesla argues that this document is typical of any tech company  California lawmakers  the company back in February that the agreement was overreaching Based on these findings  NLRB regional director Valerie Hardy Mahoney wrote that the automaker  has been interfering with  restraining and coercing employees in the exercise of their rights  Tesla has stood firm in its dismissal of the UAW s allegations  saying  For seven years  the UAW has used every tool in its playbook  misleading and outright false communications  unsolicited and unwelcomed visits to the homes of our employees  attempts to discredit Tesla publicly in the media  and now another tactic that has been used in every union campaign since the beginning of time    These allegations  which have been filed by the same contingent of union organizers who have been so outspoken with media  are entirely without merit  We will obviously be responding as part of the NLRB process   Tesla continued The NLRB s complaint is likely the last thing Tesla wants  especially as production on its highly anticipated Model 3 begins to ramp up  CEO Elon Musk already warned investors  however  that the electric car maker may face some manufacturing challenges in the coming months The board s complaint is set to be reviewed by an administrative law judge at a hearing next week One Simple Trading IdeaSince 1988  the Zacks system has more than doubled the S P 500 with an average gain of  25  per year  With compounding  rebalancing  and exclusive of fees  it can turn thousands into millions of dollars This proven stock picking system is grounded on a single big idea that can be fortune shaping and life changing  You can apply it to your portfolio starting today  About the Bull and Bear of the DayEvery day  the analysts at Zacks Equity Research select two stocks that are likely to outperform  Bull  or underperform  Bear  the markets over the next 3 6 months About Zacks Equity ResearchZacks Equity Research provides the best of quantitative and qualitative analysis to help investors know what stocks to buy and which to sell for the long term Continuous analyst coverage is provided for a universe of 1 150 publicly traded stocks  Our analysts are organized by industry which gives them keen insights to developments that affect company profits and stock performance  Recommendations and target prices are six month time horizons Strong Stocks that Should Be in the NewsMany are little publicized and fly under the Wall Street radar  They re virtually unknown to the general public  Yet today s 220 Zacks Rank  1  Strong Buys  were generated by the stock picking system that has nearly tripled the market from 1988 through 2015  Its average gain has been a stellar  26  per year  Follow us on Twitter   Join us on Facebook  NASDAQ FB    Zacks Investment Research is under common control with affiliated entities  including a broker dealer and an investment adviser   which may engage in transactions involving the foregoing securities for the clients of such affiliates Media ContactZacks Investment Research800 767 3771 ext  9339Zacks com provides investment resources and informs you of these resources  which you may choose to use in making your own investment decisions  Zacks is providing information on this resource to you subject to the Zacks  Terms and Conditions of Service  disclaimer   Past performance is no guarantee of future results  Inherent in any investment is the potential for loss  This material is being provided for informational purposes only and nothing herein constitutes investment  legal  accounting or tax advice  or a recommendation to buy  sell or hold a security  No recommendation or advice is being given as to whether any investment is suitable for a particular investor  It should not be assumed that any investments in securities  companies  sectors or markets identified and described were or will be profitable  All information is current as of the date of herein and is subject to change without notice  Any views or opinions expressed may not reflect those of the firm as a whole  Zacks Investment Research does not engage in investment banking  market making or asset management activities of any securities  These returns are from hypothetical portfolios consisting of stocks with Zacks Rank   1 that were rebalanced monthly with zero transaction costs  These are not the returns of actual portfolios of stocks  The S P 500 is an unmanaged index  Visit for information about the performance numbers displayed in this press release ,2017-09-04,Zacks Investment Research,https://www.investing.com/analysis/jazz-pharmaceuticals-oreilly-automotive-and-tesla-highlighted-as-zacks-bull-and-bear-of-the-day-200211600,200211600
33329,254844,ORLY,Here s Why I Bought This Retail Auto Play,opinion,"I grabbed shares of O Reilly Automotive  NASDAQ ORLY  Wednesday as the stock collapsed 20  on the back of poor same store sales numbers  The drop caused the stock to fall into major technical support at  175  In addition  the stock has been trading sharply lower in 2017  falling from a high of  277  This correction  including Wednesday s  has already factored in the fall in store sales and the technical chart level signals the bounce swing trade 
I m looking for a bounce back to  205 in the coming weeks ",2017-07-05,Gareth Soloway,https://www.investing.com/analysis/here's-why-i-bought-this-retail-auto-play-200199314,200199314
33330,254845,ORLY,Company News For July 06  2017,opinion,     Shares of O Reilly Automotive Inc   NASDAQ ORLY   tanked 41 6  after the company s same store sales grew 1 7  during second quarter  well below its projections of 3  to 5  growth     Bristol Myers Squibb Co s   NYSE BMY   shares rose 0 8  after the company declared promising results from its Phase III clinical trial of Opdivo drug     Shares of Monogram Residential Trust Inc    NYSE MORE   surged 21 3  following news that Greystar Real Estate Partners led fund decided to purchase the company for  12 per share in cash     Precipio Inc  s   NASDAQ PRPO   shares skyrocketed 66 1  following news that the company agreed to offer its ICE COLD PCR  ICP  technology in Clearbridge Health s network of laboratories,2017-07-05,Zacks Investment Research,"https://www.investing.com/analysis/company-news-for-july-06,-2017-200199559",200199559
33331,254846,ORLY,Chop Down The  Dollar  Tree,opinion,"My infatuation with retail shorts is aided greatly by the collapse in auto retailers    for instance  is my first post about shorting O Reilly  NASDAQ ORLY   It has fallen 35  in the half year since that post  Of course  in typical Sloper fashion  instead of thanking me effusively for a great idea offering for free  I get this   
Bitch  bitch  bitch  No surprise that I confine my best ideas to  these days   Whose  idea offered a couple of days ago  incidentally  is doing great  
In any case  I ll be stupid and again offer  for free  a retail short idea  I ve mentioned this one before  but I want to re emphasize it    Dollar Tree  NASDAQ DLTR  ",2017-07-06,Tim Knight,https://www.investing.com/analysis/chop-down-the-tree-200199379,200199379
33332,254847,ORLY,O Reilly Automotive For The Win,opinion,I just wanted one parting shot about our success with auto retail stocks  NASDAQ ORLY      it seems to me that  for now  this play is over and done with  The measured moved       ambitious at the time  but reality now     has played out beautifully  How I envy those who had puts on this monster ,2017-07-09,Tim Knight,https://www.investing.com/analysis/radar-oreilly-200199827,200199827
