,id,ticker,title,category,content,date,provider,url,article_id
23023,244538,CORE,ISM Services Index Remains Robust In October  5 Top Picks ,opinion,On Nov 5  the Institute for Supply Management  ISM  announced fresh figures for its service index for the month of October   Notably  the reading exceeded expectations  The ISM Services index clearly reflects that the U S  economy has sustained its momentum going into the fourth quarter   Gains were broad based and occurred across 17 industries Service oriented businesses remain strong in October  improving for 105 consecutive months  and the momentum is likely to remain robust indicating a solid upcoming holiday season  At this stage  it will be a prudent move to invest in stocks from the services sector with a favorable Zacks Rank and strong growth potential Strong October ReadingsThe ISM reported that its service index was pegged at 60 3  for the month of October  surpassing the consensus estimate of 58 8   Although the October reading trailed the September reading of 61 6   an all time high   it achieved the second highest level of the index s 21 year old history  Notably  any reading above 50  indicates expansion of the services sector and a reading of above 55  reflects outstanding performance by the services sector A strong bunch of 17 industries have expanded in October  The sole exception was Educational Services  The Business Activity Index came in at 62 5   and has now increased for 111 consecutive months  Additionally  the New Orders Index hit 61 5  while the Employment Index came in at 59 7  Healthy Fundamentals of the U S  EconomyISM chair Anthony Nieves said  The non manufacturing sector has again reflected strong growth despite a slight cooling off after a record month in September   This impressive result was predominately buoyed by a strong U S  economy which is currently in the 10th year of expansion   U S  GDP increased 3 3  in the first nine months of 2018  surpassing the target of 3  set by President Trump  On Oct 30  the Conference Board reported that U S  consumer confidence for the month of October was pegged at 137 9  the highest reading since September 2000 Additionally  the future expectations index    reflecting what Americans think the economy will look like in the next six months   increased to 114 6 from 112 5  signaling strong growth at least up to first quarter of 2019 Our Top PicksA substantial expansion in the services sector is indicative of its continuing attractiveness as an investment option  Additionally  encouraging economic data  like the latest report on non firm pay roll  bears out the optimism expressed by respondents in the ISM survey This is why it makes good sense to add stocks from this sector to your portfolio  We have narrowed down our search on five such stocks each carrying a Zacks Rank  1  Strong Buy  and strong growth potential  You can see  The chart below shows price performance of our five picks year to date SPS Commerce Inc    NASDAQ SPSC   is a provider of on demand supply chain management solutions servicing its customers worldwide  The company has expected earnings growth of 93 8  for current year  The Zacks Consensus Estimate for the current year has improved by 10 7  over the last 30 days Core Mark Holding Co  Inc    NASDAQ CORE   is one of the largest marketers of fresh and broad line supply solutions to the retail industry in North America  The company has expected earnings growth of 28  for current year  The Zacks Consensus Estimate for the current year has improved by 2 4  over the last 30 days Clean Harbors Inc    NYSE CLH   is a leading provider of environmental  energy and industrial services in North America  The company has expected earnings growth of 260 6  for current year  The Zacks Consensus Estimate for the current year has improved by 17 8  over the last 30 days FTI Consulting Inc    NYSE FCN   provides business advisory services to manage change  mitigate risk  and resolve disputes worldwide  The company has expected earnings growth of 61 6  for current year  The Zacks Consensus Estimate for the current year has improved by 14 7  over the last 30 days General Finance Corp    NASDAQ GFN   provides mobile storage  liquid containment and modular space solutions  The company has expected earnings growth of 283 3  for current year  The Zacks Consensus Estimate for the current year has improved by 8 7  over the last 30 days Today s Stocks from Zacks  Hottest StrategiesIt s hard to believe  even for us at Zacks  But while the market gained  21 9  in 2017  our top stock picking screens have returned  115 0    109 3    104 9    98 6   and  67 1  And this outperformance has not just been a recent phenomenon  Over the years it has been remarkably consistent  From 2000   2017  the composite yearly average gain for these strategies has beaten the market more than 19X over  Maybe even more remarkable is the fact that we re willing to share their latest stocks with you without cost or obligation ,2018-11-06,Zacks Investment Research,https://www.investing.com/analysis/ism-services-index-remains-robust-in-october-5-top-picks-200355270,200355270
23024,244539,CORE,The Zacks Analyst Blog Highlights  SPS Commerce  Core Mark Holding  Clean Harbors  FTI Consulting And General Finance,opinion,For Immediate ReleaseChicago  IL   November 7  2018   Zacks com announces the list of stocks featured in the Analyst Blog  Every day the Zacks Equity Research analysts discuss the latest news and events impacting stocks and the financial markets  Stocks recently featured in the blog include SPS Commerce Inc    NASDAQ SPSC    Core Mark Holding Co  Inc    NASDAQ CORE    Clean Harbors Inc    NYSE CLH    FTI Consulting Inc    NYSE FCN   and General Finance Corp    NASDAQ GFN   Today  Zacks is promoting its   Buy   stock recommendations    Here are highlights from Tuesday s Analyst Blog ISM Services Index Remains Robust in October  5 Top PicksOn Nov 5  the Institute for Supply Management  ISM  announced fresh figures for its service index for the month of October   Notably  the reading exceeded expectations  The ISM Services index clearly reflects that the U S  economy has sustained its momentum going into the fourth quarter   Gains were broad based and occurred across 17 industries Service oriented businesses remain strong in October  improving for 105 consecutive months  and the momentum is likely to remain robust indicating a solid upcoming holiday season  At this stage  it will be a prudent move to invest in stocks from the services sector with a favorable Zacks Rank and strong growth potential Strong October ReadingsThe ISM reported that its service index was pegged at 60 3  for the month of October  surpassing the consensus estimate of 58 8   Although the October reading trailed the September reading of 61 6   an all time high   it achieved the second highest level of the index s 21 year old history  Notably  any reading above 50  indicates expansion of the services sector and a reading of above 55  reflects outstanding performance by the services sector A strong bunch of 17 industries have expanded in October  The sole exception was Educational Services  The Business Activity Index came in at 62 5   and has now increased for 111 consecutive months  Additionally  the New Orders Index hit 61 5  while the Employment Index came in at 59 7  Healthy Fundamentals of the U S  EconomyISM chair Anthony Nieves said  The non manufacturing sector has again reflected strong growth despite a slight cooling off after a record month in September   This impressive result was predominately buoyed by a strong U S  economy which is currently in the 10th year of expansion   U S  GDP increased 3 3  in the first nine months of 2018  surpassing the target of 3  set by President Trump  On Oct 30  the Conference Board reported that U S  consumer confidence for the month of October was pegged at 137 9  the highest reading since September 2000 Additionally  the future expectations index    reflecting what Americans think the economy will look like in the next six months   increased to 114 6 from 112 5  signaling strong growth at least up to first quarter of 2019 Our Top PicksA substantial expansion in the services sector is indicative of its continuing attractiveness as an investment option  Additionally  encouraging economic data  like the latest report on non firm pay roll  bears out the optimism expressed by respondents in the ISM survey This is why it makes good sense to add stocks from this sector to your portfolio  We have narrowed down our search on five such stocks each carrying a Zacks Rank  1  Strong Buy  and strong growth potential  You can see  SPS Commerce Inc  is a provider of on demand supply chain management solutions servicing its customers worldwide  The company has expected earnings growth of 93 8  for current year  The Zacks Consensus Estimate for the current year has improved by 10 7  over the last 30 days Core Mark Holding Co  Inc  is one of the largest marketers of fresh and broad line supply solutions to the retail industry in North America  The company has expected earnings growth of 28  for current year  The Zacks Consensus Estimate for the current year has improved by 2 4  over the last 30 days Clean Harbors Inc  is a leading provider of environmental  energy and industrial services in North America  The company has expected earnings growth of 260 6  for current year  The Zacks Consensus Estimate for the current year has improved by 17 8  over the last 30 days FTI Consulting Inc  provides business advisory services to manage change  mitigate risk  and resolve disputes worldwide  The company has expected earnings growth of 61 6  for current year  The Zacks Consensus Estimate for the current year has improved by 14 7  over the last 30 days General Finance Corp  provides mobile storage  liquid containment and modular space solutions  The company has expected earnings growth of 283 3  for current year  The Zacks Consensus Estimate for the current year has improved by 8 7  over the last 30 days Today s Stocks from Zacks  Hottest StrategiesIt s hard to believe  even for us at Zacks  But while the market gained  21 9  in 2017  our top stock picking screens have returned  115 0    109 3    104 9    98 6   and  67 1  And this outperformance has not just been a recent phenomenon  Over the years it has been remarkably consistent  From 2000   2017  the composite yearly average gain for these strategies has beaten the market more than 19X over  Maybe even more remarkable is the fact that we re willing to share their latest stocks with you without cost or obligation About Zacks Equity ResearchZacks Equity Research provides the best of quantitative and qualitative analysis to help investors know what stocks to buy and which to sell for the long term Continuous coverage is provided for a universe of 1 150 publicly traded stocks  Our analysts are organized by industry which gives them keen insights to developments that affect company profits and stock performance  Recommendations and target prices are six month time horizons Strong Stocks that Should Be in the NewsMany are little publicized and fly under the Wall Street radar  They re virtually unknown to the general public  Yet today s 220 Zacks Rank  1  Strong Buys  were generated by the stock picking system that has nearly tripled the market from 1988 through 2015  Its average gain has been a stellar  26  per year Follow us on Twitter  Join us on Facebook  NASDAQ FB   Zacks Investment Research is under common control with affiliated entities  including a broker dealer and an investment adviser   which may engage in transactions involving the foregoing securities for the clients of such affiliates Media ContactZacks Investment Research800 767 3771 ext  9339Past performance is no guarantee of future results  Inherent in any investment is the potential for loss  This material is being provided for informational purposes only and nothing herein constitutes investment  legal  accounting or tax advice  or a recommendation to buy  sell or hold a security  No recommendation or advice is being given as to whether any investment is suitable for a particular investor  It should not be assumed that any investments in securities  companies  sectors or markets identified and described were or will be profitable  All information is current as of the date of herein and is subject to change without notice  Any views or opinions expressed may not reflect those of the firm as a whole  Zacks Investment Research does not engage in investment banking  market making or asset management activities of any securities  These returns are from hypothetical portfolios consisting of stocks with Zacks Rank   1 that were rebalanced monthly with zero transaction costs  These are not the returns of actual portfolios of stocks  The S P 500 is an unmanaged index  Visit  for information about the performance numbers displayed in this press release ,2018-11-06,Zacks Investment Research,https://www.investing.com/analysis/the-zacks-analyst-blog-highlights-sps-commerce-coremark-holding-clean-harbors-fti-consulting-and-general-finance-200356107,200356107
23025,244540,CORE,5 Dividend Growth Stocks Poised For Outperformance,opinion,"The Fed s shift to a patient approach on interest rates after lifting off rates for three years has brought back the lure for dividend investing this year  While there are several dividend stocks that could provide capital appreciation  honing in on stocks having a history of dividend growth leads to a healthy portfolio  with a greater scope of capital appreciation as opposed to simple dividend paying stocks or those with high yields Further  dividend paying securities are the major sources of consistent income when returns from the equity market are at risk Dividend Growth  A Winning StrategyStocks that have a strong history of dividend growth belong to mature companies  which are less susceptible to large swings in the market  and thus act as a hedge against economic or political uncertainty as well as stock market volatility  At the same time  these offer downside protection with their consistent increase in payouts Additionally  these stocks have superior fundamentals that make dividend growth a quality and promising investment for the long term  These include a sustainable business model  a long track of profitability  rising cash flows  good liquidity  a strong balance sheet and some value characteristics  Further  a history of strong dividend growth indicates that dividend increase is likely in the future Although these stocks do not necessarily have the highest yields  they have outperformed for a longer period than the broader stock market or any other dividend paying stock As a result  picking dividend growth stocks appear as winning strategies when some other parameters are also included 5 Year Historical Dividend Growth greater than zero  This selects stocks with a solid dividend growth history 5 Year Historical Sales Growth greater than zero  This represents stocks with a strong record of growing revenue 5 Year Historical EPS Growth greater than zero  This represents stocks with a solid earnings growth history Next 3 5 Year EPS Growth Rate greater than zero  This represents the rate at which a company s earnings are expected to grow  Improving earnings should help companies sustain dividend payments Price Cash Flow less than M Industry  A ratio less than M industry indicates that the stock is undervalued in that industry and that an investor needs to pay less for better cash flow generated by the company 52 Week Price Change greater than S P 500  Market Weight   This ensures that the stock appreciated more than the S P 500 over the past one year Top Zacks Rank  Stocks having a Zacks Rank  1  Strong Buy  and 2  Buy  generally outperform their peers in all types of market environment  of B or better  Our research shows that stocks with a Growth Score of A or B when combined with a Zacks Rank  1 or 2 offer the best upside potential Here are five of the 13 stocks that fit the bill California based Core Mark Holding Company Inc    NASDAQ CORE   is one of the largest marketers of fresh and broad line supply solutions to the convenience retail industry in North America  The company saw solid earnings estimate revision of eight cents over the past 30 days for this year  with an expected earnings growth rate of 12 23   The stock has a Zacks Rank  1 and Growth Score of A  You can see  Ohio based The Progressive Corporation   NYSE PGR   provides personal and commercial auto insurance  residential property insurance  and other specialty property casualty insurance and related services primarily in the United States  The company saw solid earnings estimate revision of six cents over the last 30 days for this year and has an expected earnings growth rate of 14 78   The stock carries a Zacks Rank  2 and has a Growth Score of B Lowa based Caseys General Stores Inc    NASDAQ CASY   operates convenience stores under the Casey s and Casey s General Store names  The company has an estimated earnings growth rate of 32 25  for this year  It has a Zacks Rank  2 and Growth Score of A Michigan based Stryker Corporation   NYSE SYK   operates as a medical technology company  The company has an estimated earnings growth rate of 11 20  for this year and delivered an average positive earnings surprise of 2 18  in the past four quarters  The stock has a Zacks Rank  2 and Growth Score of B California based Intuit Inc    NASDAQ INTU   provides financial management and compliance products and services for small businesses  consumers  self employed and accounting professionals  The company saw positive earnings estimate revision of a couple of cents over the last 30 days for fiscal year  ended August 2019  and has an expected earnings growth rate of 16 46   The stock has a Zacks Rank  2 and Growth Score of A You can get the rest of the stocks on this list by signing up now for your 2 week free trial to the Research Wizard and start using this screen in your own trading  Further  you can also create your own strategies and test them first before taking the investment plunge 
The Research Wizard is a great place to begin  It s easy to use  Everything is in plain language  And it s very intuitive  Start your Research Wizard trial today  And the next time you read an economic report  open up the Research Wizard  plug your finds in  and see what gems come out 
 
Disclosure  Officers  directors and or employees of Zacks Investment Research may own or have sold short securities and or hold long and or short positions in options that are mentioned in this material  An affiliated investment advisory firm may own or have sold short securities and or hold long and or short positions in options that are mentioned in this material  
Disclosure  Performance information for Zacks  portfolios and strategies are available at   ",2019-03-05,Zacks Investment Research,https://www.investing.com/analysis/5-dividend-growth-stocks-poised-for-outperformance-200395150,200395150
23071,244586,CORE,Wall Street Outperforms Global Markets In 2018  5 Top Picks ,opinion,Wall Street has witnessed its monthly worst performance this year in October  All three major stock indexes   the Dow  S P 500 and Nasdaq Composite   are in the red this month  However  a closer look at global stock markets  performance paints a different picture  Despite October stock market rout  U S  stock markets are still providing positive returns year to date while all major international stock markets are witnessing significant downtrend A robust U S  economy  strong consumer and business confidences and soaring corporate earnings driven by massive tax cut will act as near term catalysts for Wall Street s bull run to continue in the rest of 2018  Consequently  it will be a prudent move to invest in stocks with favorable Zacks Rank and strong growth potential Wall Street Still Remains the Best Market to InvestOn Oct 30  the Wall Street recovered slightly from the slump it suffered in October  The Dow  S P 500 and Nasdaq Composite advanced 1 8   1 6  and 1 6   respectively  In fact  all three major stock indexes returned to positive territory year to date on Oct 30  So far in 2018  the Dow  S P 500 and Nasdaq Composite returned 0 6   0 3  and 3 7   respectively In comparison with U S  stock indexes  internationally recognized stock indexes have performed rather poorly  Year to date  Stoxx Europe 600  UK  FTSE 100  Japan  Nikkei 225 and China  Shanghai Composite is down 7 3   7 2   3 7  and 23 3   respectively   Robust U S  Economic FundamentalsThe U S  GDP s recorded growth of 3 3  in the first nine months of 2018  surpassing the target of 3  set by President Trump  On Oct 29  the Department of Commerce reported that U S  consumer spending increased  53 billion or 0 4  in September  marking the seventh consecutive month of gain by this margin  Notably  consumer spending constitutes nearly 70  of the U S  GDP On Oct 30  the Conference Board reported that U S  consumer confidence for the month of October was pegged at 137 9  the highest reading since September 2000  The future expectations index   reflecting what Americans think the economy will look like in the next six months   increased to 114 6 from 112 5  indicating strong growth at least up to first quarter of 2019 Current unemployment rate of 3 7  is at its lowest since December 1969  Core PCE inflation   the Fed s favorite gauge of inflation   rose 0 2  but its year over year growth rate remains flat at 2  Healthy Earnings DataU S  corporates earned record high profits in the first two quarters of 2018  As of Oct 30  279 S P 500 members have reported third quarter earnings  Total earnings for these companies are up 22 3  year over year on 8 4  higher revenues  For the third quarter  total earnings of S P 500 companies are likely to be up by 22 4  on 7 5  higher revenues   Read More   Our Top PicksAt this stage  investment in stocks which are member of any of these three indexes having strong growth potential and providing solid year to date return despite severe volatility  will be lucrative  We have narrowed down our search to four such stocks each carrying a Zacks Rank  1  Strong Buy   You can see  The chart below shows price performance of our five picks year to date Twitter Inc    NYSE TWTR   offers various products and services  including Twitter that enables users to consume  create  distribute  and discover content and Periscope  a mobile application that enables user to broadcast and watch video live with others  The company has expected earnings growth of 70 5  for the current year  The Zacks Consensus Estimate for the current year has improved 5 6  over the past 30 days CSX Corp    NASDAQ CSX   is a premier transportation company providing rail  intermodal and rail to truck trans load services and solutions to customers  The company has expected earnings growth of 65 2  for the current year  The Zacks Consensus Estimate for the current year has improved by 5 2  over the last 30 days NetApp Inc    NASDAQ NTAP   provides a full range of hybrid cloud data services that simplify management of applications and data across cloud and on premises environments  The company has expected earnings growth of 27 7  for the current year  The Zacks Consensus Estimate for the current year has improved 1 6  over the past 30 days Core Mark Holding Co  Inc    NASDAQ CORE   is one of the largest marketers of fresh and broad line supply solutions to the convenience retail industry in North America  The company has expected earnings growth of 28  for the current year  The Zacks Consensus Estimate for the current year has improved 2 4  over the past 30 days Viavi Solutions Inc    NASDAQ VIAV   provides network test  monitoring  and assurance solutions to communications service providers  enterprises  network equipment manufacturers  civil government  military and avionics customers worldwide  The company has expected earnings growth of 28 3  for the current year  The Zacks Consensus Estimate for the current year has improved 3 5  over the past 30 days 3 Medical Stocks to Buy NowThe greatest discovery in this century of biology is now at the flashpoint between theory and realization  Billions of dollars in research have poured into it  Companies are already generating revenue  and cures for a variety of deadly diseases are in the pipeline So are big potential profits for early investors  Zacks has released an updated Special Report that explains this breakthrough and names the best 3 stocks to ride it ,2018-10-30,Zacks Investment Research,https://www.investing.com/analysis/wall-street-outperforms-global-markets-in-2018-5-top-picks-200352288,200352288
