,id,ticker,title,category,content,date,provider,url,article_id
174374,395890,WDC,SK Hynix CEO s stake stand off muddies Toshiba chip sale,news,"By Joyce Lee SEOUL  Reuters     SK Hynix Inc   KS 000660  still wants an equity stake in Toshiba Corp s  T 6502  chip unit  it said on Wednesday  complicating a bid for the business by a consortium it is part of  Talks with a Japanese government backed group chosen by Toshiba as a preferred bidder for its chip business have stalled due to what sources say are proposals by SK Hynix that its financing be done via convertible bonds  In the first public acknowledgement that it wants a stake in the world s No  2 NAND producer  SK Hynix chief executive Park Sung wook told reporters that it is continuing to negotiate the purchase and will not drop its equity plan  The preferred bidder group also includes the state backed fund Innovation Network Corp of Japan  the Development Bank of Japan and U S  private equity firm Bain Capital  But the stand off resulted on Tuesday in Toshiba saying it was again talking with suitors  Western Digital  Corp  O WDC  and Foxconn  TW 2317  due to the lack of progress  The embattled conglomerate does not want its South Korean rival to have an equity or management influence in the chip unit   a stance it has taken to satisfy a government that wants the technology to remain under domestic control  Some Japanese officials had hoped SK Hynix may back down from its demand for a stake  sources have said   Hit by massive cost overruns at its now bankrupt U S  nuclear unit Westinghouse  Toshiba needs billions of dollars in fresh loans to tide it over before it can complete the  18 billion sale of the memory chip unit  It sold its medical equipment business to Canon Inc for  6 billion last year and its Landis Gyr smart meters unit aims to raise up to  2 5 billion  but that will not be enough to plug the hole in its balance sheet  And although Japanese banking sources said on Tuesday that Toshiba has regained access to a  6 billion credit line  lenders have also imposed tough conditions   Toshiba has told creditors it will need 1 trillion yen in fresh loans during the current financial year through March  banking sources have said previously  Sources said Toshiba s banks  which include Sumitomo Mitsui Banking Corp  T 8316  and Mizuho Bank  T 8411   allowed it to withdraw 100 billion yen   880 million  in loans late last month but must seek permission every week to extend the loan  despite a previously agreed commitment line of 680 billion yen  Another obstacle in the chip unit auction has been Toshiba s strained ties with Western Digital  which bought SanDisk  Toshiba s memory chip business partner  in May last year   Last month  Western Digital sought a U S  court injunction to prevent Toshiba selling the chip unit without its consent  A hearing on that request is scheduled for Friday  
The banking sources said they were worried the conflict could end up scuppering the sale as well as the chip business  long term prospects  One said he hoped that Toshiba and Western Digital would work to resolve their conflict ",2017-07-12,Reuters,https://www.investing.com/news/stock-market-news/sk-hynix-ceo-says-no-plans-to-give-up-seeking-equity-in-toshiba-chip-business-504620,504620
174376,395892,WDC,U S  judge postpones decision in bid to block Toshiba memory unit sale,news,"By Stephen Nellis  Reuters    A U S  judge did not reach a decision Friday in  Western Digital   NASDAQ WDC  Corp s bid to temporarily block Toshiba Corp from selling its flash memory business in an  18 billion deal but proposed requiring Toshiba to give Western Digital two weeks  notice before closing  Toshiba is scrambling to sell its flash memory unit to cover losses from its nuclear reactor business   In late June  Toshiba announced its preferred bidder was a group made up of Bain Capital  South Korean chip maker SK Hynix and Japanese government backed banks that offered  18 billion  Western Digital  which is also bidding  sued Toshiba in San Francisco County Superior Court in mid June  saying it believed a joint venture with Toshiba means Toshiba needs its consent to sell the flash business  Western Digital s joint venture with Toshiba helps finance equipment at Toshiba s plants in exchange for some of their output   Separately from the California lawsuit  Western Digital is also contesting its consent rights in an international arbitration tribunal  Western Digital filed its lawsuit in San Francisco to prevent Toshiba from closing the sale of its memory unit before arbitration has a chance to play out  At the hearing  Judge Kahn proposed requiring Toshiba to give Western Digital two weeks notice if it believed it would close the sale before the arbitration finished  Toshiba s attorney said they were concerned about agreeing to be bound by the San Francisco court s jurisdiction  Toshiba has argued that because it is a Japanese company and the deal is taking place mostly in Japan  the court should not have jurisdiction  Attorneys for Western Digital subsidiary SanDisk  which is formally party to the case  expressed concern that any order in which Toshiba did not agree to the court s jurisdiction would not be enforceable  The two sides could not agree  so Judge Kahn instructed them to come up with final language for his proposed order and set a new hearing for July 28  when a related dispute between the two will be heard  In a statement  Western Digital CEO Steve Milligan called the proposed order and postponement a  victory    Our entire goal was to preserve and protect our rights through the binding arbitration process  and that s precisely what the court has done today   Milligan said  
Toshiba called Judge Kahn s proposed order  a  finessed  alternative to issuing a preliminary injunction  and confirmed it agreed not to close a sale before July 28 ",2017-07-14,Reuters,https://www.investing.com/news/stock-market-news/u.s.-judge-postpones-decision-in-bid-to-block-toshiba-memory-unit-sale-505937,505937
174378,395894,WDC,Toshiba issues statement regarding postponed injunction decision,news,Toshiba    OTCPK TOSBF  OTCPK TOSYY  issues a statement regarding a judge postponing an injunction decision last Friday The judge ordered Toshiba and  Western Digital  back to court on June 29 and suggested the companies work out an agreement on Toshiba selling its chip unit  which Western Digital wants to block Toshiba issues a statement through email to Seeking Alpha   California Superior Court Judge Kahn proposed a  finessed  alternative to issuing a preliminary injunction motion filed by SanDisk  a unit of Western Digital Corporation  NASDAQ WDC   In accordance with the judge s proposed order  Toshiba Corporation agreed that there would be no closing of any sale of its memory business before a hearing set for July 28  2017      Previously  Judge postpones decision on blocking Toshiba Memory sale  July 14 Now read ,2017-07-17,Seeking Alpha,https://www.investing.com/news/stock-market-news/toshiba-issues-statement-regarding-postponed-injunction-decision-506516,506516
174389,395905,WDC,Sirius XM  SIRI  To Report Q1 Earnings  What s In Store ,opinion,Sirius XM Holdings   NASDAQ SIRI   is scheduled to report first quarter 2018 results on Apr 25 The company has beaten the Zacks Consensus Estimate in one of the trailing four quarters  with an average positive earnings surprise of 12 50   In the last reported quarter  the company s adjusted earnings of 5 cents were in line with the Zacks Consensus Estimate The Zacks Consensus Estimate for first quarter earnings and revenues is currently pegged at 5 cents and  1 38 billion  respectively Let s see how things are shaping up prior to this announcement Factors to ConsiderSirius XM s healthy net subscriber growth is likely to drive first quarter 2018 results  In the last quarter  the company added 569K net new subscribers  Sirius XM Holdings Inc  Price and EPS Surprise     Moreover  the company s improving position in the automotive market is a key catalyst  Sirius also expanded partnership with CDK Global   NASDAQ CDK   to develop new and innovative connected vehicle solutions Additionally  Sirius  effort to reward shareholders through aggressive share buyback is positive  In January 2018  the company s board of directors cleared an additional buyback program to the tune of  2 billion However  the company s high debt level is a concern  Moreover  increased leverage along with stiff competition might act as headwinds for the company in the yet to be reported quarter What Our Model SaysAccording to the Zacks model  a company with a Zacks Rank  1  Strong Buy   2  Buy  or 3  Hold  along with a positive  has a good chance of beating estimates  The Sell rated stocks  Zacks Rank  4 or 5  are best avoided Sirius has a Zacks Rank  4  Sell  and an Earnings ESP of  2 78   which indicates an unlikely positive surprise  You can uncover the best stocks to buy or sell before they re reported with our  Stocks to ConsiderHere are few stocks you may consider as our proven model shows that these have the right combination of elements to post an earnings beat this quarter Western Digital   NASDAQ WDC   has an Earnings ESP of  2 30  and a Zacks Rank  1  You can see  Paycom Software   NYSE PAYC   has an Earnings ESP of  0 33  and a Zacks Rank  1 Will You Make a Fortune on the Shift to Electric Cars Here s another stock idea to consider  Much like petroleum 150 years ago  lithium power may soon shake the world  creating millionaires and reshaping geo politics  Soon electric vehicles  EVs  may be cheaper than gas guzzlers  Some are already reaching 265 miles on a single charge With battery prices plummeting and charging stations set to multiply  one company stands out as the  1 stock to buy according to Zacks research It s not the one you think ,2018-04-23,Zacks Investment Research,https://www.investing.com/analysis/sirius-xm-siri-to-report-q1-earnings-whats-in-store-200308541,200308541
174394,395910,WDC,Western Digital announces 96 layer 3D NAND technology,news,Western Digital   NYSE WDC  announces BiCS4  next generation 3D NAND technology with 96 layers of vertical storage                Developed with partner Toshiba  BiCS4 will initially come in a 256 gibabit chip before shipping in various capacities including a terabit chip                 OEM sampling expected in 2H17 with production output next year                     Our successful development of the industry s first 96 layer 3D NAND technology demonstrates Western Digital s continued leadership in NAND flash and solid execution to our technology roadmap   says Dr  Siva Sivaram  executive VP of memory technology at Western Digital  Now read ,2017-06-27,Seeking Alpha,https://www.investing.com/news/stock-market-news/western-digital-announces-96-layer-3d-nand-technology-499869,499869
174395,395911,WDC,Toshiba says suing Western Digital for  1 billion,news,"TOKYO  Reuters    Japan s Toshiba Corp said on Wednesday it is filing a lawsuit against joint venture partner  Western Digital  Corp  NASDAQ WDC    Toshiba is claiming 120 billion yen   1 07 billion  in damages  saying in a statement that Western Digital is interfering with the sale of its memory chip division   
Toshiba also said it has decided to shut out Western Digital employees based outside the Yokkaichi chip plant from accessing information relating to the two companies  joint venture ",2017-06-28,Reuters,https://www.investing.com/news/stock-market-news/toshiba-says-suing-western-digital-for-$1-billion-499923,499923
174396,395912,WDC,Toshiba misses self imposed deadline for chip unit sale  sues Western Digital,news,"By Makiko Yamazaki CHIBA  Japan  Reuters    Japan s Toshiba Corp  T 6502  has pushed back its timeline to clinch a sale of its prized flash memory chip unit  saying the  18 billion deal was being held up due to differences of opinion within the consortium chosen as preferred bidder  The delay came as the conglomerate sued its chip business partner  Western Digital  Corp  O WDC  for interfering in the sale  one day after the U S  firm resubmitted a bid for the unit  The lawsuit pushes acrimony between the two to new heights and further complicates prospects for a deal  Scrambling to cover billions of dollars in cost overruns at its bankrupt Westinghouse nuclear unit  Toshiba had pledged to have a signed agreement for the sale of the unit   the world s No  2 producer of NAND chips   by Wednesday  the day of its annual shareholders meeting  The hotly contested auction has seen a consortium  led by Japanese government investors and including U S  private equity firm Bain Capital  chosen as preferred bidder but the group s offer was only hastily and awkwardly put together this month  That bid has been largely orchestrated by Japan s trade ministry  which is keen to keep semiconductor technology under domestic control  Chief Executive Satoshi Tsunakawa said the firm was now aiming for an agreement with the preferred bidder consortium as early as possible and a completed transaction by the end of the financial year in March   It is taking time to smooth out differences in opinion among members of the consortium   he said  after apologising for a string of humiliating setbacks that include Toshiba s demotion to the second section of the Tokyo bourse  There appears  however  to be little likelihood of a quick and smooth conclusion to the deal  Western Digital  which jointly runs Toshiba s main semiconductor plant  claims that its partner is breaching joint venture contracts and is seeking a U S  court injunction to prevent any deal that does not have its consent   actions that prompted Toshiba s lawsuit on Wednesday  Toshiba executives continued to offer a string of mixed messages on their willingness to resolve the spat with the California based firm  On one hand  Tsunakawa lambasted the Western Digital at the shareholders meeting  saying it had been interfering in the sale  But the head of Toshiba s chip unit also said the Japanese company was prepared to make concessions and hoped to resolve the dispute as soon as possible  Toshiba argues that Western Digital s bid for the memory unit presents anti trust issues and is too low in price  Western Digital has said it offer meets the 2 trillion yen   18 billion  minimum demanded by Toshiba   a figure that appears to match the amount offered by the preferred bidder  WESTERN DIGITAL TRIES AGAIN It is not clear if the terms of the bid that Western Digital resubmitted on Tuesday with partner U S  private equity firm KKR   Co LP  N KKR  had significantly changed  Western Digital said it will provide debt financing to facilitate a sale  Sources with knowledge of the matter have said a state backed fund  the Innovation Network Corp of Japan  INCJ   and the Development Bank of Japan  DBJ  which are currently part of preferred bidder consortium   would be invited to join the resubmitted offer  While it was not immediately clear what parts of Toshiba s talks with the preferred bidder consortium were taking time  sources have said some Toshiba board members are concerned about technology leaks to South Korean chip rival  SK Hynix Inc   KS 000660   which is part of the consortium and will provide Bain with financing  Western Digital has also said it is strongly opposed to SK Hynix s participation and has threatened further legal action  Toshiba s lawsuit  filed with the Tokyo District Court  seeks around  1 billion in damages  The Japanese firm also said it had shut out Western Digital employees based outside their Yokkaichi chip plant from accessing information relating to the two companies  joint venture   a move that threatens to impede R D work on next generation NAND memory chips  Western Digital declined to comment on the lawsuit  It said in statement it had reiterated its concerns about the sale process and SK Hynix s participation to Toshiba   The U S  court hearing for its injunction request is scheduled for July 14  
  1   112 3600 yen ",2017-06-28,Reuters,"https://www.investing.com/news/stock-market-news/toshiba-misses-self-imposed-deadline-for-chip-unit-sale,-sues-western-digital-499889",499889
174399,395915,WDC,Western Digital says Toshiba s actions in chip spat harm customers,news,TOKYO  Reuters     Western Digital  Corp  NASDAQ WDC  said on Thursday that legal action and other moves taken by Toshiba Corp in their dispute over the sale of its prized memory chip unit were harming Toshiba s stakeholders and customers  The two have been feuding bitterly over the  18 billion sale  particularly after Toshiba chose a different consortium as it is preferred bidder  Western Digital  which jointly runs Toshiba s main semiconductor plant  has sought a U S  court injunction to prevent the inking of any deal without its consent   On Wednesday Toshiba struck back with a lawsuit  saying Western Digital had interfered in the sale without due cause  adding that it is seeking 120 billion yen   1 billion  in damages  It also blocked certain Western Digital employees from accessing databases related to their joint ventures and  in some cases  facilities as well   This action will have the consequence of harming not only Toshiba s stakeholders  but also our respective customers   Western Digital said in a statement  The U S  firm called Toshiba s lawsuit a bid to pressure it to relinquish its consent rights  and added it was confident it would succeed on the legal merits of its arbitration request  Western Digital also reiterated its commitment to invest in their joint ventures  including the Fab 6 production line in Yokkaichi  central Japan   Toshiba is rushing to sell the unit to cover billions of dollars in cost overruns at its bankrupt Westinghouse nuclear unit ,2017-06-29,Reuters,https://www.investing.com/news/stock-market-news/western-digital-says-toshiba's-actions-in-chip-spat-harm-customers-500383,500383
174400,395916,WDC,SK Hynix convertible bond proposal clouds prospects for Toshiba chip deal,news,By Se Young Lee and Kentaro Hamada SEOUL TOKYO  Reuters     SK Hynix Inc   KS 000660  has proposed that its financing for a consortium picked as preferred bidder for Toshiba Corp s  T 6502  chip unit be done via convertible bonds  two sources said  providing it with a path towards an equity interest in the world s No 2 NAND chip maker   But such an arrangement would fly in the face of Toshiba s assertions that its South Korean rival will have no equity or management influence in the  18 billion chip unit   a stance it has taken to satisfy a government that wants the business to remain under domestic control and for key technology to be kept out of the hands of foreign rivals  The potential for SK Hynix to hold equity would also only harden already trenchant opposition from  Western Digital   O WDC   Toshiba s chip business partner  which is claiming breach of contract and seeking to an injunction to prevent any deal that does not have its consent  The South Korean chipmaker is part of a Japan government led consortium that also includes Bain Capital and which was hastily cobbled together last month by Japan s trade ministry  While it has the government s implicit stamp of approval  the unusual structure of the offer has raised questions over whether can feasibly clinch a deal   New details coming out through the media such as the convertible bonds suggest there may be some flaws in the scheme  Toshiba must now explain its exact structure   said Masahiko Ishino  an analyst at Tokai Tokyo Research Center   Reaching a deal is now looking difficult   he added  Sources familiar with the matter have said a state backed fund  the Innovation Network Corp of Japan  INCJ   would hold the biggest equity interest despite putting up only 300 billion yen   2 7 billion  of the planned 2 trillion yen  Bain plans to put up 850 billion yen   half of that amount to be provided by SK Hynix in the form of financing  the sources have said   The South Korean chipmaker plans to buy convertible debt in a special purpose company being created by Bain for the Toshiba acquisition  said one of the sources who spoke on Monday  adding that terms were still being negotiated  SK Hynix was unlikely to convert the debt into equity in the near term  the source said   SK Hynix declined to comment while representatives for Bain could not be immediately reached for comment  A Toshiba spokesman said the company cannot comment on the specifics of the deal  The sources declined to be identified as the talks were confidential  Toshiba is scrambling to get a deal done as fast as possible as it needs funds to cover billions in cost overruns at now bankrupt unit Westinghouse  But last week  the Japanese conglomerate missed a self imposed deadline of having a signed agreement for the chip business in hand  saying more time was needed to smooth out opinions between members of the preferred bidder consortium  Officials within Toshiba s board and INCJ are also concerned about the potential for technology leaks and are demanding the final contract specify that the South Korean firm s financing will never be translated into equity  separate sources have said  SK Hynix has only briefly explained its rationale for being part of the consortium  saying that it sees further business opportunities with Toshiba  It is relatively weak in NAND memory chips although it is the world s No  2 maker of DRAM chips  which help electronic devices multitask  Toshiba said separately it had made a filing outlining its arguments to Western Digital s request for a preliminary injunction to block the sale of the chip business sale  A hearing on the issue is scheduled for July 14 and Western Digital has said it believes a decision will come on the same day ,2017-07-03,Reuters,https://www.investing.com/news/technology-news/sk-hynix-proposes-financing-toshiba-chip-deal-via-convertible-bonds:-sources-501433,501433
174403,395919,WDC,Toshiba seeks dismissal of Western Digital injunction request over chip unit,news,TOKYO  Reuters    Toshiba Corp has asked a U S  court to dismiss a  Western Digital  Corp  NASDAQ WDC  request for an injunction to prevent a sale of the Japanese firm s chip business  saying the court has no jurisdiction and that an injunction would cause irreparable harm  Western Digital  which jointly runs Toshiba s main semiconductor plant  has claimed that its partner has breached joint venture contracts as it pursues an  18 billion sale of the unit and is seeking an injunction to prevent any deal without its consent  nL3N1JC082  In its filing with the Superior Court of California  Toshiba argued that their joint venture interests only cover a small portion of its flash memory semiconductor business and that the court has no jurisdiction as its primary place of business was Japan  Toshiba is scrambling to get a deal done as fast as possible as it needs funds to cover billions in cost overruns at now bankrupt unit Westinghouse  It is currently negotiating with a preferred bidder consortium that includes Japan government investors and U S  private equity firm Bain Capital   Even if an agreement is reached with a bidder   if Toshiba is prevented from moving forward on implementing that transaction  the harm to an overall deal would be severe   and may well make the implementation of a transaction impossible   said in its filing  which was made on Friday  Western Digital has tabled its own bid for the chip unit   the world s No  2 producer of NAND chips   but the offer has gained little traction with Toshiba  which says it raises anti trust concerns  The Japanese firm is also reluctant to engage with Western Digital as its U S  partner has said in the past it wants to take control of the unit  Western Digital argues that an injunction will ensure that an international arbitration court will be given an appropriate opportunity to resolve their dispute  The court hearing on the issue is scheduled for July 14 and Western Digital has said it believes a decision could come on the same day  Western Digital is expected to file a response to Toshiba s opposition before the hearing ,2017-07-03,Reuters,https://www.investing.com/news/technology-news/toshiba-seeks-dismissal-of-western-digital-injunction-request-over-chip-unit-501817,501817
