,id,ticker,title,category,content,date,provider,url,article_id
3861,225376,WDC,Top Stock Reports For Estee Lauder  BNY Mellon   Canadian Pacific Railway,opinion,"Wednesday  January 15  2020
The Zacks Research Daily presents the best research output of our analyst team  Today s Research Daily features new research reports on 16 major stocks  including Estee Lauder  EL   Bank of New York   Mellon  BK  and Canadian Pacific Railway  CP   These research reports have been hand picked from the roughly 70 reports published by our analyst team today 
You can see 
Estee Lauder s shares have outperformed the Zacks Cosmetics industry over the past year   72 3  vs   58 6    The Zacks analyst believes that the company has been gaining from growth across most brands and sales channels  The trend continued in first quarter fiscal 2020  wherein both top and bottom lines surpassed estimates and rose year on year 
Performance was supported by growth in emerging markets  travel retail and online sales  Further  management provided an optimistic view for fiscal 2020  However  the company is witnessing certain headwinds such as soft retail trends in the United States and the U K   costs related to Brexit and tariff impacts in China 
Additionally  challenges in Hong Kong s retail environment are expected to continue through fiscal 2020  Moreover  adverse currency movements are a concern 
 You can  
Shares of BNY Mellon have gained  14 8  in the past three months against the Zacks Major Regional Banks industry s rise of  12 6   The Zacks analyst believes that global diversification efforts and prudent cost management initiatives will aid the bank s financials 
The company has an impressive earnings surprise history  having surpassed the Zacks Consensus Estimate in three of the trailing four quarters  Moreover  earnings estimates have been going up ahead of its fourth quarter 2019 results 
Impressive capital deployment actions reflect a strong balance sheet position  Yet  the Federal Reserve s accommodative monetary policy along with reduced client activities and low volatility are likely to hurt revenues going forward  Concentration risk arising from significant dependence on fee based revenues could alter BNY Mellon s financial position if there is any change in individual investment preferences 
 You can  
Canadian Pacific Railway s shares have gained  6 3  over the past six months against the Zacks Rail industry s rise of  0 9   The Zacks analyst believes that this was mainly due to prudent cost management  With consistent cost containment  the company s operating ratio has been improving 
Its measures to add shareholder value are also appreciative  Under a normal course issuer bid  for which it received acceptance in December 2019   the company can purchase up to 4 8 million shares  Canadian Pacific s buyout of Central Maine   Quebec Railway is a further positive 
However  Canadian Pacific experienced weak volumes in the fourth quarter amid macroeconomic headwinds and geopolitical tensions  Moreover  poor harvest weather in Canada is hurting grain volumes significantly  The company s high debt levels and capital expenditures also add to its woes  Capex is projected to have been C 1 6 billion in 2019 
 You can  
Other noteworthy reports we are featuring today include AvalonBay  AVB   McKesson  MCK  and Ameriprise Financial  NYSE AMP   AMP  
Today s Best Stocks from Zacks
Would you like to see the updated picks from our best market beating strategies  From 2017 through Q3 2019  while the S P 500 gained  39 6   five of our strategies returned  51 8    57 5    96 9    119 0   and even  158 9  
This outperformance has not just been a recent phenomenon  From 2000   Q3 2019  while the S P averaged  5 6  per year  our top strategies averaged up to  54 1  per year 

Mark VickerySenior Editor
Note  Sheraz Mian heads the Zacks Equity Research department and is a well regarded expert of aggregate earnings  He is frequently quoted in the print and electronic media and publishes the weekly and reports  If you want an email notification each time Sheraz publishes a new article  please 
Today s Must Read
Solid Travel Retail Business to Fuel Estee Lauder  EL  Sales


Cost Savings Efforts Support BNY Mellon  BK  Amid Low Rates


Cost Cuts Aid Canadian Pacific  CP  Amid Volume Softness


Featured Reports
Rising Household Formation Boosts AvalonBay s  AVB  Leasing 
Per the Zacks Analyst  AvalonBay leasing will benefit from its high quality assets  favorable demographics and rising household formation trends 

U S  Pharmaceutical Arm Aids McKesson  MCK   Competition Rife
Solid prospects in the core U S  Pharmaceutical unit aids McKesson  The Zacks Analyst is however apprehensive about the stiff competition in the MedTech space 

Restructuring Efforts Aid Ameriprise  AMP   High Costs a Woe
Per the Zacks analyst  Ameriprise s well diversified portfolio  and its restructuring and streamlining efforts will aid revenues 

Wynn Resorts  NASDAQ WYNN  Rides on Non Gaming Revenues Amid Debt
The Zacks analyst believes that Wynn Resorts is likely to gain from robust non gaming business and increasing visitation pattern in Las Vegas 

Solid Digital Business  Acquisitions Aid DXC Technology  DXC 
Per the Zacks analyst  DXC Technology is gaining from solid digital business  which was boosted by the acquisition of Luxoft 

Loan Growth Supports BOK Financial  BOKF   High Costs A Woe
Per the Zacks analyst  BOK Financial reflects organic growth with escalating loan balances  Moreover  expansion moves bolster its growth prospects 

Returns Focused Growth Strategies to Benefit KB Home  KBH 
Per the Zacks analyst  continued progress of the Returns Focused Growth plan  land acquisitions along with declining mortgage rates and steady economic growth are expected to drive growth for KB Home 

New Upgrades
Imperial  IMO  to Gain from Cold Lake and Syncrude Projects
The Zacks analyst likes Imperial Oil s strong execution and ramped up activities in Cold Lake and Syncrude and expects it to deliver solid production growth thereby boosting its future earnings  

New Mines  Low Debt   High Gold Prices Aid Royal Gold  RGLD 
Per the Zacks analyst  Royal Gold will benefit from higher gold prices  ramping up of new mines as well as efforts to cut down debt levels 

Strong Demand in Infrastructure Segment to Aid Lindsay  LNN 
Per the Zacks analyst  Lindsay will gain from the momentum in infrastructure segment backed by demand for Road Zipper projects and the Foundation for Growth initiative 

New Downgrades
High Debt   Pricing Pressure Hurts Western Digital  NASDAQ WDC 
Per the Zacks analyst  Western Digital is grappling with sluggishness in client compute hard drives demand  ballooning debt levels and stiff competition from storage peers like Seagate 

Rising Cost Impact LendingTree s  TREE  Bottom line Growth
Per the Zacks analyst  LendingTree s bottom line remains under pressure due to persistent rise in expenses on account of investments in product development  and advertising related costs 

Higher Promotions to Hurt Urban Outfitters   NASDAQ URBN  Margins
Urban Outfitters cautioned about weaker than expected fourth quarter gross profit margin  Per the Zacks analyst  higher promotional activity in apparel is likely to have weighed upon gross margin 
undefined undefined",2020-01-15,Zacks Investment Research,https://www.investing.com/analysis/top-stock-reports-for-estee-lauder-bny-mellon--canadian-pacific-railway-200499106,200499106
3872,225387,WDC,Top Analyst Reports For AbbVie  Union Pacific   CSX,opinion,"Wednesday  September 18  2019
The Zacks Research Daily presents the best research output of our analyst team  Today s Research Daily features new research reports on 16 major stocks  including AbbVie  ABBV   Union Pacific  UNP  and CSX  CSX   These research reports have been hand picked from the roughly 70 reports published by our analyst team today 
You can see 
AbbVie s shares have underperformed the Zacks Large Cap Pharmaceuticals industry over the past three months   7 8  vs   5 5    The Zacks analyst thinks that AbbVie s key drug  Humira  is performing well based on strong demand trends despite new competition  Imbruvica has multibillion dollar potential 
AbbVie has been successful in expanding approvals for its cancer drugs  Imbruvica and Venclexta  Moreover  AbbVie has an impressive late stage pipeline  comprising several products with multibillion dollar potential that are expected to be launched in the near term  The acquisition of Allergan  NYSE AGN   if successful  should diversify AbbVie s revenue base and accelerate its non Humira business 
Sales erosion due to direct biosimilar competition to Humira in international markets is a big headwind in 2019  Also  costs to support expected new product line extension launches should hurt profits in 2019 
 You can  
Shares of Union Pacific have gained 3 9  in the past six months  outperforming the Zacks Rail industry s rise of 3 5   The Zacks analyst is impressed with Union Pacific s initiatives to reward its shareholders  Since November 2017  the company has raised its quarterly dividend payout five times 
It is also active on the buyback front  Initiatives to control costs in a bid to drive the bottom line are also impressive  The company s operating ratio has been improving mainly due to its cost cut plans  The metric is expected to improve further going forward  However  sluggish freight volumes  down 3  in first half 2019  represent a major headwind 
Anticipating the dull scenario to persist  Union Pacific trimmed its volume growth outlook for the second half of the year  Its high debt levels are an added concern  In addition  the massive capex might play spoilsport 
 You can   
CSX s shares have gained 14 6  year to date  underperforming the Zacks Rail industry s rise of 21 2  over the same period  The Zacks analyst believes that this was primarily due to sluggish intermodal revenues 
Dismal performance of the intermodal segment is affecting the company s growth prospects  Segmental revenues declined in the first half of 2019 due to lower volumes  In fact  this coupled with factors like weak domestic coal demand and sluggish crude by rail volumes forced the company to trim its current year top line forecast 
However  we are impressed by the company s efforts to control costs  CSX s operating ratio has improved in the first half of the year  courtesy of its cost reduction efforts  The company s initiatives to reward its shareholders are encouraging as well  During the first half of 2019  the company returned  2 billion to shareholders through a combination of dividends and share buybacks 
  You can   
Other noteworthy reports we are featuring today include PetroChina  PTR   Danaher  DHR  and ONEOK  NYSE OKE   OKE  
Biggest Tech Breakthrough in a Generation
Be among the early investors in the new type of device that experts say could impact society as much as the discovery of electricity  Current technology will soon be outdated and replaced by these new devices  In the process  it s expected to create 22 million jobs and generate  12 3 trillion in activity 
A select few stocks could skyrocket the most as rollout accelerates for this new tech  Early investors could see gains similar to buying Microsoft  NASDAQ MSFT  in the 1990s  Zacks  just released special report reveals 7 stocks to watch  The report is only available for a limited time 

Mark VickerySenior Editor
Note  Sheraz Mian heads the Zacks Equity Research department and is a well regarded expert of aggregate earnings  He is frequently quoted in the print and electronic media and publishes the weekly and reports  If you want an email notification each time Sheraz publishes a new article  please 
Today s Must Read
AbbVie s  ABBV  Humira U S  Sales Strong  Pipeline Solid


Cost Cuts Boost Union Pacific  UNP  Amid Freight Weakness


Cost Reduction Efforts Support CSX s Growth Prospects


Featured Reports
Higher Production in Productive Regions to Aid ONEOK  OKE 
Per the Zacks analyst  capital growth projects in the Permian Basin  STACK and SCOOP will increase ONEOK s natural gas and NGLs production volumes 

World Wrestling  WWE  New Content Creation to Lift Revenues
Per the Zacks analyst World Wrestling s focus on content creation  driving subscriber count  raising TV rights fees and monetization of video content across digital and DTC platforms bodes well 

Solid Insurance Business Drives W R  Berkley  WRB 
Per the Zacks analyst  W R  Berkley is poised to grow from its solid insurance operations driving lion s share of premium 

Rising Loans Aid First Republic  FRC   Capital Level Solid
Per the Zacks analyst  organic growth remains a key strength at First Republic  Higher revenues reflect improving loan and deposit balances 

High Shipments Aid Martin Marietta  MLM   Weather Woes Stay
Per the Zacks analyst  Martin Marietta is poised to benefit from higher shipments  strong pricing and cost management efforts 

Domain  Hosting and Presence Segments Benefit GoDaddy  GDDY 
Per the Zacks analyst  GoDaddy banks on strong liquid domain aftermarket and renewals  and growing adoption of GoCentral 

SemGroup  SEMG  Aided by Energy Transfer Deal Amid High Debt
The Zacks analyst believes that SemGroup shareholders stand to gain from the substantial premium they will get as part of the Energy Transfer buyout 

New Upgrades
Standard Motors  SMP  Rides High on Pollak Acquisition
Solid revenue growth from the Engine Management unit on the back of the Pollack buyout prompts the Zacks analyst to turn bullish on Standard Motors  SMP  

USB Flash Drive Product Rollouts Aid Western Digital  NASDAQ WDC 
Per the Zacks analyst  new product additions will enhance the Western Digital s existing product portfolio and aid it in securing a strong foothold in the global SSD market 

Inorganic Moves   Innovative Products to Aid Danaher  DHR 
Per the Zacks analyst  Danaher s  DHR  buyout of GE s BioPharma business  pending  and separation of its dental unit will be boon  High demand for innovative products also adds value 

New Downgrades
Natural Gas Import Losses Weigh on PetroChina  PTR 
The Zacks analyst is worried over PetroChina s losses on the domestic resale of imported natural gas below cost  The drop in the company s downstream segment earnings is also a concern 

Weak Pressure Pumping Market to Hurt ProPetro  PUMP 
The Zacks analyst is concerned over the weak market sentiment and lower pricing with respect to pressure pumping services in the Permian Basin  which is expected to weigh on ProPetro s revenues 

Weak End Markets  Economic Volatility to Hurt Amphenol  NYSE APH 
Per the Zacks analyst the geopolitical uncertainty  particularly related to the U S  China relationship  and a sluggish macro economic environment in China doesn t bode well for the company 
undefined undefined",2019-09-18,Zacks Investment Research,https://www.investing.com/analysis/top-analyst-reports-for-abbvie-union-pacific--csx-200465905,200465905
173875,395391,WDC,Better Buy  Western Digital vs  Texas Instruments,news,"Western Digital  NASDAQ WDC  and Texas Instruments  NASDAQ TXN  both sell key components of electronic devices  WD is one of the world s top makers of platter based HDDs  hard disk drives  and flash based SSDs  solid state drives   and TI produces analog  embedded  and other types of chips for various end markets 
WD and TI have both been struggling with cyclical headwinds  WD faced sluggish PC sales  weak enterprise spending  and cyclically low flash memory  NAND  prices over the past year  TI s growth slowed as macro headwinds throttled spending from its automotive and industrial customers 

But some of those headwinds are gradually waning  and investors expect both companies  declines to bottom out in the near future  As a result  shares of WD and TI rose about 75  and 33  over the past 12 months  respectively  compared to the S P 500 s 24  gain 
WD was clearly a better buy than TI over the past year  but will it maintain that lead  Let s take a closer look at the growth of both companies to find out 
Western Digital s strengths and weaknesses
WD generated 60  of its revenue from HDDs last quarter  and the remaining 40  came from sales of SSDs and NAND chips  Its total revenue has fallen annually for five straight quarters 

YOY   Year over year  Source  WD quarterly reports 
Sluggish PC sales and data center spending hurt its HDD business  and tumbling NAND prices slammed its SSD and flash memory business  Lower NAND prices also reduced the price gap between cheaper HDDs and pricier SSDs  resulting in softer demand for lower capacity HDDs 
But during last quarter s conference call  CEO Steve Milligan declared that the NAND market had  passed a cyclical trough   and expects WD s revenue to stay nearly flat annually and rise 4  sequentially in the second quarter  Wall Street expects WD s revenue to stay roughly flat this year and rise 9  next year  which indicates that its business has finally bottomed out 
Texas Instruments  strengths and weaknesses
TI generated 75  of its revenue from analog chips last quarter  Embedded chips accounted for 19  of its revenue  while  other  chips accounted for the rest  TI s revenue has also declined annually for five straight quarters 

YOY   Year over year  Source  TI quarterly reports 
During last quarter s conference call  TI s investor relations chief Dave Pahl noted that the company s sales to the industrial  personal electronics  and communications markets dipped sequentially  automotive sales remained  about even   and enterprise sales rose in the  low single digits   However  Pahl also noted that demand was  stabilizing  across all sectors except the communications equipment market 
For the first quarter  TI expects its revenue to decline 10  annually and 3  sequentially  at the midpoint   That tepid guidance indicates that TI s declines are bottoming out  but it s not primed for a rebound yet  TI s revenue fell 9  for the full year  and analysts expect a 1  decline in 2020 
Margins and profitability
WD s non GAAP gross margin plunged from 38  to 24 8  between the first quarters of 2019 and 2020  due to the aforementioned pressures in the HDD and SSD markets  However  it expects its gross margin to expand sequentially to 25  26  in the second quarter 

TI s gross margin fell from 64 8  to 62 6  between the fourth quarters of 2018 and 2019  Its gross margin remains high since it shifted its analog chip production from the 200mm manufacturing process to the less capital intensive 300mm process  but it ll likely keep contracting until its revenue growth rebounds 
Analysts expect WD s earnings to decline 45  this year  but rebounding HDD and SSD demand could boost its earnings 153  next year  That growth is lumpy  but WD s low forward P E of 10 and forward dividend yield of 2 9  indicate should set a floor under the stock 
TI s earnings declined 6  in 2019  and analysts expect a milder drop of 2  in 2020  However  the stock s forward P E of 26 makes it significantly pricier than WD  and it pays a slightly lower forward yield of 2 8   Another key difference is that TI consistently repurchases its stock  while WD hasn t bought back any shares over the past four quarters 
The winner  Western Digital
WD should continue outperforming TI this year  for three reasons  Its revenue and margins are rising sequentially  it trades at a lower valuation  and it pays a slightly higher dividend  TI s diverse business and traditional of returning  all  its free cash flow via dividends and buybacks still make it a good long term investment    but investors should wait for clearer signs of a bottom before starting a new position ",2020-01-24,The Motley Fool,https://invst.ly/pmhgq,2067324
173877,395393,WDC,Western Digital Offers Sunnier Outlook on Memory Demand as Earnings Beat in Q2,news,"Investing com     Western Digital    NASDAQ WDC  reported on Thursday second quarter results that beat analysts  forecasts and offered up a sunnier outlook on chip demand for the year ahead  
 

 Western Digital   NASDAQ WDC  announced earnings per share of  0 62 on revenue of  4 23B  Analysts polled by Investing com anticipated EPS of  0 57 on revenue of  4 22B  That with comparison to EPS of  1 45 on revenue of  4 23B in the same period a year before  Western Digital had reported EPS of  0 34 on revenue of  4 04B in the previous quarter  Analysts are expecting EPS of  0 7 and revenue of  4 06B in the upcoming quarter 
The beat on the top line comes as falling memory prices appear to have bottomed  spurring improved margins   
 The December quarter results reflect strong execution in our product roadmap  success in increasing our hard drive gross margin  and an improving flash market   said Steve Milligan  chief executive officer  Western Digital 
Western Digital shares are up 5 47  from the beginning of the year and are trading at  71 05   still down 7 03  from its 52 week high of  72 00 set on January 23  They are outperforming the Nasdaq which is up 2 87  year to date 

Looking ahead  the company said   We expect an accelerated recovery in our flash gross margins  which coupled with ongoing strength in demand for both hard drives and flash  positions us well for continued profitable growth in calendar year 2020  
 Western Digital   NASDAQ WDC  shares gained 6 14  in after hours trade following the report 
Stay up to date on all of the upcoming earnings reports by visiting Investing com s earnings calendar",2020-01-30,Investing.com,https://www.investing.com/news/stock-market-news/western-digital-offers-sunnier-outlook-on-memory-demand-as-earnings-beat-in-q2-2072270,2072270
