,id,ticker,title,category,content,date,provider,url,article_id
4017,225532,POLYP,Premarket London  Greggs Raises Profit Guidance  Rightmove Loses CFO,news,"Investing com    Here is a summary of regulatory news releases from the London Stock Exchange on Monday  11th November  Please refresh for updates 
FTSE 250 restaurant chain   Greggs    LON GRG  raised its guidance for full year pretax profit  before exceptional charges   without giving much else away  It said trading performance  has continued to be very strong  despite the strengthening comparators seen in 2018    In the six weeks to 9 November 2019  total sales grew by 12 4  and like for like sales in company managed shops increased by 8 3   up from 4  a year earlier  
It noted increased customer visits and and  well controlled  operational costs  
In the year to date  total sales have grown by 13 4 per cent and like for like sales have increased by 9 2 per cent  
Online estate agent   Rightmove    LON RMV  said its chief financial officer Robyn Perriss is to step down as chief financial officer  probably during the second quarter of 2020   She ll stay on until then while the company looks for a successor

Russian focused gold miner   Polymetal    LON POLYP  raised its assessment of gold reserves at its flagship mine Kyzyl by 18  to 8 5 million troy ounces  That equates to 41 7 million tons of ore at an average grade of 6 3 grams a ton  
Just under half of the reserves  4 2 million oz  can be mined in open pit fashion  an upgrade of 37    
The update extends the mine s life by eight years to 2047  and the life of the open pit by five years to 2031 ",2019-11-11,Investing.com,https://www.investing.com/news/stock-market-news/premarket-london-greggs-raises-profit-guidance-rightmove-loses-cfo-2017499,2017499
4018,225533,POLYP,Silver Producers Mine Supply Continues To Decline,opinion,"Three of the largest silver producers in the world saw their combined mine supply continue to weaken in the first seven months of 2019   While Mexico and Chile experienced declines in their silver production  Peru was by far the biggest loser  Peru  which is the second largest silver producer in the world  suffered an 11  decline in the country s domestic mine supply Jan Jul 2019 
Even though the decline of silver mine supply at these leading producers isn t impacting the current silver market price currently  it will likely do so as the Fed and central banks lose control of their QE money printing and asset purchase policy  In less than two weeks  the total U S  debt has increased by another COOL  85 billion  With total U S  public debt now at  22 92 trillion  it s only a matter of time  maybe just a few weeks before we reach another record of  23 trillion 
With the global silver mine supply this year to reach an estimated 850 million oz of production  the total value based on the Kitco  16 average for the year would only be  13 6 billion   Thus  the U S  Government has increased the public debt in the past two weeks by more than SIX TIMES the value of the Global silver production this year 




Yes  I do realize that comparing the value of silver to the increase in U S  debt hasn t mattered to the markets  but it will   What will happen with silver  and gold  will be very similar to the investor reaction to ENRON when the market realized that the company was a fraud   And  let s not forget that several top Wall Street analysts  in their glorious  Let s continue to bamboozle investors  fashion  continued to put out BUY recommendations days before ENRON collapsed 
So  the market will continue to be BAMBOOZLED by Wall Street and central banks right up until the time that the GIG IS OVER  This means the time to acquire Gold and Silver physical insurance is likely much wiser to purchase BEFORE than the day AFTER the GIG is up 
Okay  let s look at the Top silver producers decline in silver mine supply Jan Jul 2019 




In the first seven months of the year  Peru s domestic mine supply is down a whopping 278 metric tons  11    while Mexico is down 146 metric tons  4    followed by Chile down 57 metric tons  8    The total decline in silver production from these three countries is 481 metric tons  mt  or 15 5 million oz 

Furthermore   Polymetal  International  LON POLYP   Russia s largest silver producer  which accounted for 58  of the country s total mine supply last year  is down 14  in the first half of 2019   Russia is the fourth largest silver producer in the world  followed by Chile   So  four of the top five silver producers in the world are showing considerable declines in mine supply 

I get a laugh at the analysis put forth by some members of the precious metals community  Trey Reik  a managing member of Bristal Gold Group  was interviewed by Kitco at the October Mining Conference in New York   Here was the summary of Reik s gold analysis 

When it comes to gold s price performance  while monetary policy is an important driver  the long term key force remains the overall debt to gross domestic product  GDP  ratio  this according to Trey Reik  managing member of Bristol Gold Group 

In my view  gold s all about monetary imbalances 

When Reik was asked a question about silver  he stated that he wasn t interested in silver because it was not a monetary metal  and it was likely to see a higher 100 1 Gold Silver ratio going forward    This is the typical reply from a precious metal analyst who believes the world is run by ENERGY TOOTH FAIRIES  

These analysts who state that silver is not a monetary metal fail to realize the ENERGY DYNAMIC that drives the MONETARY SYSTEM won t matter if gold is used to back all the debt   That is their M O  or modus operandi   If we found another 4 5 Saudi Arabia s worth of oil in the world  then what Trey Reik states  makes some sense   However  we haven t found 4 5 Saudi Arabia s worth of oil  as the world s new oil discoveries are at a 70 year low   That is not a good sign  indeed 
Lastly  we got some BIG PROBLEMS ahead with that ENERGY TOOTH FAIRY as U S  shale oil production seems to be struggling to keep production at 7 million barrels per day   There s a lot more interesting stuff coming up that should wake up the DEAD ",2019-10-24,Steve St. Angelo,https://www.investing.com/analysis/silver-producers-mine-supply-continues-to-decline-200477214,200477214
4019,225534,POLYP,Russia stocks lower at close of trade  MOEX Russia down 0 43 ,news,"Investing com   Russia stocks were lower after the close on Thursday  as losses in the Power  Oil   Gas and Telecoms sectors led shares lower 
At the close in Moscow  the MOEX Russia fell 0 43  to hit a new 1 month low 
The best performers of the session on the MOEX Russia were  X5 Retail  Group NV  MCX FIVEDR   which rose 2 56  or 53 0 points to trade at 2126 0 at the close  Meanwhile  Surgut pref  MCX SNGS p  added 1 92  or 0 610 points to end at 32 345 and  Polymetal International PLC   MCX POLY  was up 1 65  or 14 00 points to 864 00 in late trade 
The worst performers of the session were MMK  MCX MAGN   which fell 3 20  or 1 265 points to trade at 38 220 at the close  SG mechel  MCX MTLR  declined 2 69  or 1 66 points to end at 60 00 and FSK EES  MCX FEES  was down 2 12  or 0 0037 points to 0 1704 
Falling stocks outnumbered advancing ones on the Moscow Stock Exchange by 141 to 81 and 18 ended unchanged 
Shares in MMK  MCX MAGN  fell to 52 week lows  losing 3 20  or 1 265 to 38 220  Shares in SG mechel  MCX MTLR  fell to 52 week lows  falling 2 69  or 1 66 to 60 00  Shares in Polymetal International PLC  MCX POLY  rose to 52 week highs  up 1 65  or 14 00 to 864 00  
The Russian VIX  which measures the implied volatility of MOEX Russia options  was down 5 20  to 23 870 
Gold Futures for December delivery was up 0 21  or 3 25 to  1531 05 a troy ounce  Elsewhere in commodities trading  Crude oil for delivery in September fell 1 70  or 0 94 to hit  54 29 a barrel  while the October Brent oil contract fell 2 37  or 1 41 to trade at  58 07 a barrel 
USD RUB was up 0 00  to 66 0545  while EUR RUB fell 0 34  to 73 3119 
The US Dollar Index Futures was up 0 23  at 98 050 ",2019-08-15,Investing.com,https://www.investing.com/news/stock-market-news/russia-stocks-lower-at-close-of-trade-moex-russia-down-043-1956397,1956397
4020,225535,POLYP,Russia stocks higher at close of trade  MOEX Russia up 0 04 ,news,"Investing com   Russia stocks were higher after the close on Wednesday  as gains in the Power  Telecoms and Manufacturing sectors led shares higher 
At the close in Moscow  the MOEX Russia added 0 04  
The best performers of the session on the MOEX Russia were  Rosseti ao   MCX RSTI   which rose 3 89  or 0 0417 points to trade at 1 1136 at the close  Meanwhile   X5 Retail  Group NV  MCX FIVEDR  added 3 33  or 71 5 points to end at 2218 0 and AFK Sistema  MCX AFKS  was up 2 74  or 0 298 points to 11 165 in late trade 
The worst performers of the session were  PhosAgro  ao  MCX PHOR   which fell 1 81  or 45 0 points to trade at 2440 0 at the close  Surgut pref  MCX SNGS p  declined 1 36  or 0 435 points to end at 31 465 and  Polymetal International PLC   MCX POLY  was down 1 08  or 9 60 points to 880 10 
Rising stocks outnumbered declining ones on the Moscow Stock Exchange by 114 to 94 and 20 ended unchanged 
The Russian VIX  which measures the implied volatility of MOEX Russia options  was down 0 72  to 20 770 
Gold Futures for December delivery was up 0 03  or 0 45 to  1516 15 a troy ounce  Elsewhere in commodities trading  Crude oil for delivery in October fell 0 43  or 0 24 to hit  55 89 a barrel  while the October Brent oil contract rose 0 62  or 0 37 to trade at  60 40 a barrel 
USD RUB was down 1 17  to 65 7688  while EUR RUB fell 1 13  to 73 0192 
The US Dollar Index Futures was down 0 04  at 98 025 ",2019-08-21,Investing.com,https://www.investing.com/news/stock-market-news/russia-stocks-higher-at-close-of-trade-moex-russia-up-004-1960430,1960430
4021,225536,POLYP,Russia stocks higher at close of trade  MOEX Russia up 0 04 ,news,"Investing com   Russia stocks were higher after the close on Tuesday  as gains in the Mining  Power and Manufacturing sectors led shares higher 
At the close in Moscow  the MOEX Russia added 0 04  
The best performers of the session on the MOEX Russia were  Polymetal International PLC   MCX POLY   which rose 5 97  or 54 60 points to trade at 969 60 at the close  Meanwhile  Safmar Finansovye Investitsii PAO  MCX SFIN  added 4 29  or 20 8 points to end at 505 2 and Inter rao ees  MCX IRAO  was up 3 49  or 0 1415 points to 4 1915 in late trade 
The worst performers of the session were SG mechel  MCX MTLR   which fell 4 41  or 2 85 points to trade at 61 75 at the close  MVideo  MCX MVID  declined 2 91  or 13 00 points to end at 434 20 and NOVATEK  MCX NVTK  was down 1 96  or 25 20 points to 1258 80 
Falling stocks outnumbered advancing ones on the Moscow Stock Exchange by 118 to 98 and 20 ended unchanged 
Shares in Polymetal International PLC  MCX POLY  rose to 3 years highs  rising 5 97  or 54 60 to 969 60  
The Russian VIX  which measures the implied volatility of MOEX Russia options  was up 0 91  to 23 240 
Gold Futures for December delivery was up 1 00  or 15 35 to  1552 55 a troy ounce  Elsewhere in commodities trading  Crude oil for delivery in October rose 0 41  or 0 22 to hit  53 86 a barrel  while the November Brent oil contract rose 0 03  or 0 02 to trade at  58 14 a barrel 
USD RUB was up 0 93  to 66 6761  while EUR RUB rose 0 93  to 73 9779 
The US Dollar Index Futures was down 0 11  at 97 877 ",2019-08-27,Investing.com,https://www.investing.com/news/stock-market-news/russia-stocks-higher-at-close-of-trade-moex-russia-up-004-1964566,1964566
4022,225537,POLYP,Russia stocks lower at close of trade  MOEX Russia down 1 61 ,news,"Investing com   Russia stocks were lower after the close on Wednesday  as losses in the Oil   Gas  Power and Telecoms sectors led shares lower 
At the close in Moscow  the MOEX Russia lost 1 61  to hit a new 1 month low 
The best performers of the session on the MOEX Russia were Polyus OAO  MCX PLZL   which rose 2 42  or 170 0 points to trade at 7194 0 at the close  Meanwhile  NMTP  MCX NMTP  added 2 18  or 0 1750 points to end at 8 1950 and  Polymetal International PLC   MCX POLY  was up 2 16  or 18 00 points to 850 00 in late trade 
The worst performers of the session were AFK Sistema  MCX AFKS   which fell 4 46  or 0 514 points to trade at 11 000 at the close  Trubnaya Metallurgicheskaya Kompaniya OAO  MCX TRMK  declined 3 76  or 2 08 points to end at 53 24 and United Company Rusal Plc  MCX RUAL  was down 3 25  or 0 865 points to 25 745 
Falling stocks outnumbered advancing ones on the Moscow Stock Exchange by 164 to 61 and 15 ended unchanged 
Shares in Polyus OAO  MCX PLZL  rose to all time highs  rising 2 42  or 170 0 to 7194 0  
The Russian VIX  which measures the implied volatility of MOEX Russia options  was up 2 56  to 25 640 a new 6 months high 
Gold Futures for December delivery was up 1 30  or 19 75 to  1533 85 a troy ounce  Elsewhere in commodities trading  Crude oil for delivery in September fell 5 34  or 3 05 to hit  54 05 a barrel  while the October Brent oil contract fell 4 88  or 2 99 to trade at  58 31 a barrel 
USD RUB was up 1 79  to 66 0728  while EUR RUB rose 1 48  to 73 6157 
The US Dollar Index Futures was up 0 15  at 97 782 ",2019-08-14,Investing.com,https://www.investing.com/news/stock-market-news/russia-stocks-lower-at-close-of-trade-moex-russia-down-161-1955156,1955156
