,id,ticker,title,category,content,date,provider,url,article_id
21632,243147,RDWR,Radware  RDWR  Is Overbought  Is A Drop Coming 	,opinion,"Radware Ltd    NASDAQ RDWR   has moved higher as of late  but there could definitely be trouble on the horizon for this company  That is because RDWR is now in overbought territory with an RSI value of 78 88 
What is RSI  
RSI stands for  Relative Strength Index  and it is a popular indicator used by technically focused investors  It compares the average of gains in days that closed up to the average of losses in days that closed down  readings above 70 suggest an asset is overbought  while an RSI below 30 suggests undervalued conditions are present 
Other Factors
Yet RDWR s high RSI value isn t the only reason for investors to be concerned  as there has been some decidedly negative earnings estimate revisions in Radware s stock as of late  This is especially true when investors dive into some of these revisions in order to get a better picture of RDWR s prospects for the near term 
Over the past two months  investors have witnessed 2 earnings estimate revision lower compared to none higher for the current year  The consensus estimate for RDWR has also been on a downward trend over the same time period too  as the estimate has fallen from  0 26 share two months ago to just  0 09 share today 
If this wasn t enough  Radware also has a Zacks Rank  4  Sell  which puts it into unfortunate company among its peers  So  given all of these factors  investors may want to consider exiting this stock now before it falls back to Earth ",2016-06-01,Zacks Investment Research,https://www.investing.com/analysis/radware-(rdwr)-is-overbought:-is-a-drop-coming-200133718,200133718
21633,243148,RDWR,Internet Earnings Preview For Jul 26  TWTR  AKAM   Others,opinion,We are in the thick of the second quarter earnings season  As many as 1000 companies are scheduled to post their financial numbers this week  including 189 S P 500 members Results till now have shown a modest improvement from the extremely weak levels over the last couple of quarters  However  growth is still non existent  As of Friday  Jul 22  we saw Q2 results from 126 S P 500 members that together account for 32 7  of the index s total market capitalization  Total earnings for these members are down 1 1  from the same period last year on 2 6  lower revenues  with 70 6  beating EPS estimates and 55 6  coming ahead of top line expectations Just like the other sectors  Technology is also likely to fall prey to earnings decline from the year earlier level  Total earnings in the tech sector are expected to be down 3 0  on 2 7  higher revenues  compared to last quarter s 4 5  earnings decline on 0 4  higher revenues  Excluding Apple  NASDAQ AAPL   the tech sector s earnings are anticipated to be up 3 5    Read more   However  given the surge in the adoption of smartphones  tablets and other mobile devices  Internet is still an attractive segment  Also  exponential growth in consumer spending online and continued advancement in technology is keeping investors  interest in the sector alive  Among all the companies slated to reveal second quarter figures this week  let s see what s in store for these five Internet stocks on Jul 26 Twitter  Inc    NYSE TWTR   recorded a positive earnings surprise of 46 15  last quarter  In fact  Twitter outperformed the Zacks Consensus Estimate in each of the trailing four quarters  with an average positive surprise of 38 28  Notably  our proven model shows that Twitter is likely to beat the Zacks Consensus Estimate this quarter  This is because a stock needs to have both a positive  and a Zacks Rank  1  Strong Buy   2  Buy  or 3  Hold  for this to happen  This holds true for Twitter as elaborated below The Earnings ESP for Twitter is  6 67   This is because the Most Accurate estimate stands at a loss of 14 cents while the Zacks Consensus Estimate is pegged at a loss of 15 cents  Meanwhile  the company has a Zacks Rank  3  which increases the predictive power of ESP  Therefore  the combination of Twitter s Zacks Rank  3 and  6 67  ESP makes us reasonably confident in looking for an earnings beat TWITTER INC Price and EPS Surprise   Match Group  Inc    NASDAQ MTCH   went public last November  and in its first earnings announcement as a publicly traded entity missed earnings estimates by 5 3   The succeeding quarter was better  with the company s earnings beating estimates by 20  For the current quarter  Match Group has an Earnings ESP of 0 00  as the Most Accurate estimate and the Zacks Consensus Estimate are both pegged at 13 cents  Match Group has a Zacks Rank  2  which increases the predictive power of ESP  However  a 0 00  ESP makes surprise prediction difficult   Read more   MATCH GROUP INC Price and EPS Surprise   Zix Corporation   NASDAQ ZIXI   recorded in line results last quarter  Zix Corporation outperformed the Zacks Consensus Estimate just once in the last four quarters  with an average negative surprise of 0 42  For the second quarter  Zix has an Earnings ESP of  0 00  as the Most Accurate estimate and the Zacks Consensus Estimate are both pegged at 6 cents  It currently carries a Zacks Rank  3  So  in this case  we can t say whether the company will beat estimates this time around ZIX CORP Price and EPS Surprise   Akamai Technologies  Inc    NASDAQ AKAM   recorded a positive earnings surprise of 1 96  last quarter  Also  Akamai outperformed the Zacks Consensus Estimate in three of the trailing four quarters  with an average positive surprise of 4 05  For the current quarter  Akamai has an Earnings ESP of  0 00  as the Most Accurate estimate and the Zacks Consensus Estimate are both pegged at 50 cents  It currently carries a Zacks Rank  3  So  we can t say whether the company will beat estimates this time around   Read more   AKAMAI TECH Price and EPS Surprise   Radware Ltd    NASDAQ RDWR   delivered a negative earnings surprise of 120 0  last quarter  Notably  Radware outperformed the Zacks Consensus Estimate just once out of the trailing four quarters  with an average negative surprise of 35 65  For the second quarter  Radware has an Earnings ESP of 0 00  as the Most Accurate estimate and the Zacks Consensus Estimate are both pegged at a breakeven  The company has a Zacks Rank  2  which increases the predictive power of ESP  However  a 0 00  ESP makes surprise prediction difficult RADWARE LTD Price and EPS Surprise  ,2016-07-25,Zacks Investment Research,"https://www.investing.com/analysis/internet-earnings-preview-for-jul-26:-twtr,-akam---others-200143851",200143851
21634,243149,RDWR,Radware  RDWR  Enters Overbought Territory,opinion,"Radware Ltd    NASDAQ RDWR   has moved higher as of late  but there could definitely be trouble on the horizon for this company  That is because RDWR is now in overbought territory with an RSI value of 72 37 
What is RSI  
RSI stands for  Relative Strength Index  and it is a popular indicator used by technically focused investors  It compares the average of gains in days that closed up to the average of losses in days that closed down  readings above 70 suggest an asset is overbought  while an RSI below 30 suggests undervalued conditions are present 
Other Factors
Yet RDWR s high RSI value isn t the only reason for investors to be concerned  as there has been some decidedly negative earnings estimate revisions in Radware s stock as of late  This is especially true when investors dive into some of these revisions in order to get a better picture of RDWR s prospects for the near term 
Over the past two months  investors have witnessed 2 earnings estimate revisions lower compared to none higher for the current year  The consensus estimate for RDWR has also been on a downward trend over the same time period too  as the estimate has fallen from  0 12 share two months ago to just  0 09 share today 
If this wasn t enough  Radware also has a Zacks Rank  4  Sell which puts it into unfortunate company among its peers  So  given all of these factors  investors may want to consider exiting this stock now before it falls back to Earth ",2016-08-16,Zacks Investment Research,https://www.investing.com/analysis/radware-(rdwr)-enters-overbought-territory-200148531,200148531
21635,243150,RDWR,Here s Why Radware  RDWR  Stock Soared Today,opinion,"Shares of Radware Ltd    NASDAQ RDWR   closed Tuesday trading with a 7 46  gain to  16 57 per share after posting a loss of  4 1 million in its first quarter 
The Israel based company is a leading provider of cyber security and application delivery solutions  The company reported  48 9 million in revenues for the first quarter of 2017  up 1  from a year ago  While sales in the Americas region dropped 8 5  from last year  the gap was made up by the 16 1  and 1 1  revenue growth from the EMEA and APAC regions  respectively 
Following the earnings report  Radware received a  Buy  upgrade from Dougherty   Company  The firm s analyst justified the rating upgrade on the earnings beat and more importantly  the new one year plan to buy back  40 million worth of shares 
Radware s revenue figures beat the Zacks Consensus Estimate of  47 9 million 
 We are pleased with the trends underlying the results for the first quarter and with the positive momentum that continued into the second quarter   said Roy Zisapel  Radware President   CEO   Positioning us well to meet our plans for 2017  
The company is looking to repurchase up to  40 million of its issued and outstanding ordinary shares by the end of 2017  On the one hand  the company could believe its stock is undervalued  and it will grow much stronger in the future  By purchasing now at a lower price  then releasing them again at a higher market price  the company will be able to make a return 
On the other hand  buying back the company s shares is an easy way to make the business look more attractive to investors  By reducing the number of shares  the company s earnings per share automatically go up  which attracts short term investors 
The revenue beat and sales growth in the EMEA and APAC regions certainly explained the company s and Dougherty s confidence in the future  However  whether you are a short term or long term investor  you should be cautious and pay attention to any sudden movement to the market 
More Stock News  This Is Bigger than the iPhone It could become the mother of all technological revolutions  Apple  NASDAQ AAPL  sold a mere1 billion iPhones in 10 years but a new breakthrough is expected to generate morethan 27 billion devices in just 3 years  creating a  1 7 trillion market Zacks has just released a Special Report that spotlights this fast emergingphenomenon and 6 tickers for taking advantage of it  If you don t buy now  you maykick yourself in 2020 ",2017-04-25,Zacks Investment Research,https://www.investing.com/analysis/here's-why-radware-(rdwr)-stock-soared-today-200185150,200185150
21636,243151,RDWR,Which Security Stock Could Be The Fortinet  FTNT  Of 2019 ,opinion,"Fortinet   NASDAQ FTNT   has been one of the outstanding performers in the cyber security space this year  The stock has appreciated 61  in the year to date period  outperforming the  s 19 1  rally  primarily driven by strong quarterly results Notably  this Zacks Rank  2  Buy  company surpassed the Zacks Consensus Estimate in each of the trailing four quarters  with the average positive surprise being 17 4   Fortinet also recorded significant top  and bottom line year over year growth in these quarters The company is benefiting from strength in overall product suite of Security Fabric  which provides unified security across the entire digital attack surface  The digital transformation and security refresh cycle across most industries are tailwinds  Growing adoption of its Software Define Wide Area Network  SD WAN  solutions is also a positive We note that Fortinet s experience in the security space and mission critical solutions is helping it maintain and grow its market share in the booming cyber security space   What s Driving Security Stocks Frequent cyber attacks have increased the demand for cyber security software  Protection against spear phishing  credential based attack  account takeover and ransomware attacks among others is the need of the hour Moreover  although artificial intelligence  AI  is considered to be a key tool for countering cyber attacks  its growing application across major sectors has made it vulnerable  Per cyber security firm Symantec   NASDAQ SYMC    in 2019 and beyond  attackers are going to exploit AI systems and use the technology to aid assaults 
Encouragingly  cybersecurity companies will be the ultimate gainers due to the elevated spending on security by government and other enterprises  Notably  for cybersecurity related activities in 2019  the U S  government has allocated  15 billion  up  583 4 million from 2018    It is anticipated that spending on cybersecurity will continue to outpace other tech verticals next year A new survey report by Thales eSecurity points out that given the bigger threats and more sophisticated attacks  U S  banks and other financial firms are likely to increase their cybersecurity spending in 2019 Furthermore  per Gartner  global cyber security spending is expected to grow 8 7  to  124 billion in 2019 due to higher spending on General Data Protection Regulation  GDPR  and other privacy legislation Other Cyber Security Players to Watch Out ForFortinet faces competition from numerous big and small players in the security application market  The competing firms are delivering prompt and advanced technologies to suit customer requirements and expediting product introduction in order to grow We have picked four stocks that have a Zacks Rank  1  Strong Buy  or  2  Buy  and Growth Score of A or B as the combination offers the best investment opportunities  You can see  Our first choice is Qualys  Inc    NASDAQ QLYS    a leader in the worldwide security and vulnerability management market  The company provides enterprises instant visibility of their IT assets and global security practices through its QualysGuard Cloud Platform  The company s new cloud based security and compliance stack is getting positive reception from new and existing customers The stock sports a Zacks Rank  1 and has a Growth Score of B  The company delivered average four quarter positive earnings surprise of 38 3   The Zacks Consensus Estimate for its 2019 earnings has increased 3 4  to  1 85 over the past 60 days Qualys  Inc  Price and EPS Surprise    CyberArk Software  NASDAQ CYBR   is another security stock  which seems to be a lucrative option at the moment  The company is benefiting from growing adoption of its solutions  which is helping it win deals in new as well as add on businesses  Increasing demand for privileged access security on the back of digital transformation and cloud migration strategies is a key growth driver This Zacks  2 Ranked company has a Growth Score of A and delivered average four quarter positive earnings surprise of 48 5   The Zacks Consensus Estimate for 2019 earnings has increased 9 3  to  1 88 over the past 60 days CyberArk Software Ltd  Price and EPS Surprise    The next stock that makes it to our list is Radware   NASDAQ RDWR    The company is working toward expanding its market share in application delivery controllers  The company s focus on availability of security solutions for the private  hybrid  and public cloud to address their customer needs is a positive  Moreover  OEM partnership with Cisco  NASDAQ CSCO   Check Point and Nokia  HE NOKIA  bodes well for the company This Zacks Rank  2 stock has a Growth Score of A and delivered average four quarter positive earnings surprise of 23 5   The Zacks Consensus Estimate for 2019 earnings has increased 12 7  to 62 cents over the past 60 days Radware Ltd  Price and EPS Surprise    Another pick is FireEye   NASDAQ FEYE    which is benefiting from its diversified product portfolio and increasing clientele  The company s turnaround efforts  which include shifting the business model to a subscription based one  are apparently paying off  FireEye is gaining customer accounts and increasing penetration of existing customers  which is driving revenue growth The stock carries a Zacks Rank  2 and has a Growth Score of B  The company delivered average four quarter positive earnings surprise of 125   The Zacks Consensus Estimate for its 2019 earnings has increased 12  to 19 cents over the past 60 days FireEye  Inc  Price and EPS Surprise    In addition to the stocks discussed above  would you like to know about our 10 top tickers to buy and hold for the entirety of 2019 These 10 are painstakingly handpicked from over 4 000 companies covered by the Zacks Rank  They are our primary picks poised to outperform in the year ahead ",2018-12-27,Zacks Investment Research,https://www.investing.com/analysis/which-security-stock-could-be-the-fortinet-ftnt-of-2019-200371552,200371552
21637,243152,RDWR,5 Cybersecurity Stocks To Buy On Simmering US Iran Tensions  ,opinion,On Jun 21  news emerged that a day earlier the United States Cyber Command had carried out online attacks on Iranian targets  The operation  first revealed by a report from Yahoo  NASDAQ AABA  News  was carried out on the same when President Trump decided not to go ahead with military strikes against Iran  The attacks were retaliation for Iran s destruction of an American surveillance drone The choice of cyberwarfare as low level response opens up a whole new world of possibilities  Iran s ability to retaliate in kind has improved radically over the last decade   This would only boost the demand for cybersecurity solutions among U S  companies of all sizes  Investing in these stocks from this sector would make for a smart choice now Cyberattacks Replace Military Strikes on IranOn Jun 21  President Trump said that he had called off the military attack on Iran 10 minutes before the strike because he thought that it would be a disproportionate response  Trump said on Jun 22 that he was  getting a lot of praise  for averting an attack  which would have caused multiple deaths Instead  the United States decided to press ahead with online attacks  planned carefully over the past few weeks  They were a response to both the downing of the American drone as well as the tanker attacks that took place earlier this month A number of systems were targeted  including an Iranian intelligence group  which apparently helped in planning the attacks on tankers in the Strait of Hormuz  Other targets include computer systems  which control the launch stages of Iranian missiles Retaliation Likely  Cybersecurity Stocks to GainInvestors should keep in mind that the threat of Iranian retaliation to these cyberattacks is both real and credible  Iran s capability in this area has improved considerably over the last decade as borne out by the attacks on American banks in 2012 and 2013  In fact  Iran s cyber forces has had years of experience in attacking U S  targets  including the attack on a Las Vegas Casino in 2015 It comes as no surprise then that cybersecurity stocks will gain in an environment already brimming with online threats  The Prime Cyber Security ETF  HACK  is already up 17 9  year to date  evidence of the field s growing importance in corporate America  As cyberattacks grow  spending on cybersecurity will only increase Another reason for changing security priorities is the growing popularity of cloud computing  As more and more companies embrace this trend  legacy security solutions such as antiviruses and firewalls are losing market share to cloud based options such as Web security gateways  This is likely to spark off a new trend of spending on fresh cybersecurity options Our ChoicesThe American attack on Iranian computer systems is perhaps the first shot fired into cyberspace in the ongoing conflict between the two countries  Likely retaliation will further boost spending on cybersecurity by U S  companies  Cloud based options will gain the most from this trend as they seem to represent the future Investing in cybersecurity stocks looks prudent  We have narrowed our search to the following stocks based on a good Zacks Rank and other relevant metrics Qualys  Inc    NASDAQ QLYS   is a provider of cloud security and compliance solutions that enable organizations to identify security risks to their information technology infrastructure  and help protect their IT systems and applications from cyberattacks Qualys s expected earnings growth for the current year is 10 3   The Zacks Consensus Estimate for current year earnings has improved 3 2  over the past 60 days  It sports a Zacks Rank  1  You can see Cisco Systems   NASDAQ CSCO   is benefiting from its expanding footprint in the rapidly growing security market  In fact  its comeback story has been largely fueled by strong contributions from security  Infrastructure Platforms and applications Cisco has a Zacks Rank  2  Buy   The company s expected earnings growth for the current year is 18 4   The Zacks Consensus Estimate for current year earnings has moved north by 0 7  over the past 60 days Fortinet Inc    NASDAQ FTNT   is a provider of network security appliances and Unified Threat Management  UTM  network security solutions to enterprises  service providers and government entities worldwide Fortinet has a Zacks Rank  2  The company has expected earnings growth of 15 9  for the current year  The Zacks Consensus Estimate for current year earnings has improved by 2 4  over the past 60 days Radware Ltd    NASDAQ RDWR   is a developer  manufacturer and marketer of cyber security and application delivery solutions Radware has a Zacks Rank  2  The company has expected earnings growth of 21 8  for the current year  The Zacks Consensus Estimate for current year earnings has moved 5 8  north over the past 30 days   Zscaler  Inc    NASDAQ ZS   is a cloud security company with global operations Zscaler has a Zacks Rank  2  The company s expected earnings growth for the current year is more than 100   The Zacks Consensus Estimate for current year earnings has moved 36 6  north over the past 30 days More Stock News  This Is Bigger than the iPhone                    It could become the mother of all technological revolutions  Apple  NASDAQ AAPL  sold a mere 1 billion iPhones in 10 years but a new breakthrough is expected to generate more than 27 billion devices in just 3 years  creating a  1 7 trillion market Zacks has just released a Special Report that spotlights this fast emerging phenomenon and 6 tickers for taking advantage of it  If you don t buy now  you may kick yourself in 2020 ,2019-06-23,Zacks Investment Research,https://www.investing.com/analysis/5-cybersecurity-stocks-to-buy-on-simmering-usiran-tensions-200434186,200434186
21642,243157,RDWR,Why Radware  RDWR  Stock Might Be A Great Pick ,opinion,One stock that might be an intriguing choice for investors right now is Radware Ltd    NASDAQ RDWR    This is because this security in the Security space is seeing solid earnings estimate revision activity  and is in great company from a Zacks Industry Rank perspective This is important because  often times  a rising tide will lift all boats in an industry  as there can be broad trends taking place in a segment that are boosting securities across the board  This is arguably taking place in the Security space as it currently has a Zacks Industry Rank of 28 out of more than 250 industries  suggesting it is well positioned from this perspective  especially when compared to other segments out there Meanwhile  Radware is actually looking pretty good on its own too  The firm has seen solid earnings estimate revision activity over the past month  suggesting analysts are becoming a bit more bullish on the firm s prospects in both the short and long term Radware Ltd  Price and Consensus   In fact  over the past two months  current quarter estimates have risen from 12 cents per share to 13 cents per share  while current year estimates have risen from 58 cents per share to 67 cents per share  This has helped RDWR to earn a Zacks Rank  2  Buy   further underscoring the company s solid position  You can see the complete list of today s Zacks  1 Rank  Strong Buy  stocks here So  if you are looking for a decent pick in a strong industry  consider Radware  Not only is its industry currently in the top third  but it is seeing solid estimate revisions as of late  suggesting it could be a very interesting choice for investors seeking a name in this great industry segment Today s Best Stocks from Zacks Would you like to see the updated picks from our best market beating strategies  From 2017 through 2018  while the S P 500 gained  15 8   five of our screens returned  38 0    61 3    61 6    68 1   and  98 3  This outperformance has not just been a recent phenomenon  From 2000   2018  while the S P averaged  4 8  per year  our top strategies averaged up to  56 2  per year ,2019-06-27,Zacks Investment Research,https://www.investing.com/analysis/why-radware-rdwr-stock-might-be-a-great-pick-200435630,200435630
