,id,ticker,title,category,content,date,provider,url,article_id
200402,421918,BSX,Abaxis  ABAX  Q2 Earnings   Revenues Miss  Margins Slide,opinion,Abaxis  Inc    NASDAQ ABAX     a global provider of point of care blood analyzers   reported second quarter fiscal 2017 adjusted earnings per share  EPS  of 34 cents  which missed the Zacks Consensus Estimate by 5 5   However  adjusted EPS was flat with the year ago figure The bottom line miss can be primarily attributed to a 20  increase in operating expenses  a result of management s decision to increase investments in research and development  R D  and international sales and marketing  S M  Reported EPS from continued operations was 51 cents  up 50  year over year ABAXIS INC Price  Consensus and EPS Surprise    Total RevenueIn the fiscal second quarter  Abaxis recorded revenues of  58 6 million  reflecting a 4 6  year over year increase  The top line however missed the Zacks Consensus Estimate of  61 million Notably  the mid single digit growth witnessed in medical market and the double digit growth in veterinary market collectively drove the year over year upside in Abaxis  overall revenues Foreign currency exchange rate fluctuations had a negligible impact on Abaxis  top line as currencies dented total revenue by only 0 5  in the quarter Segments in DetailIn the quarter  on a geographic basis  revenues from North America  accounting for 80 2  of total revenue  grew 4  to  47 0 million  while revenues from the international market  accounting for the rest  rose 7  to  11 5 million Abaxis operates under three main segments  namely  Veterinary  Medical and Other  In the reported quarter  Veterinary sales accounted for 82 4  of total sales  Medical sales contributed 16  while the remaining 1 5  was generated from  Other  Veterinary market revenues improved 4  year over year to  48 3 million  driven by an 8  improvement in veterinary consumable revenues  offset by a14  decline in veterinary instrument revenues  Revenues from the medical market grew 9  year over year to  9 4 million  on account of a 19  increase in medical rotor revenues while Piccolo instrument revenues dropped 22   Revenues from the Other segment increased 18 3  to  0 88 million Abaxis also exhibited strong consumable growth  up 9  year over year to  45 5 million  accounting for approximately 77 6  of the company s total worldwide revenues in the quarter However  total Instruments sales decreased 15  to  9 8 million Operational UpdatesFiscal second quarter gross profit rose 0 9  to  32 3 million However  gross margin contracted 201 basis points  bps  to 55 1  Research and development expenses increased 4 6  year over year to  4 9 million  while Sales and marketing expenses rose 4 3  to  11 2 million  General and administrative expenses escalated 21 5  to  4 35 million  Although the resultant operating income was almost flat at  11 7 million forthe quarter  operating margin declined 168 bps to 20 1  owing to higher operating expenses Financial UpdateAbaxis exited fiscal second quarter with cash  cash equivalents and short term investments of  145 5 million  up from  129 7 million in the prior quarter Our TakeAbaxis  second quarter fiscal 2017 results failed to impress with the company squarely missing the Zacks Consensus Estimate  However  on a year over year basis  global sales improved across all segments as well as geographical bases  Moreover  global sales of medical rotors crossed the 1 million unit threshold for the first time  which marks a major milestone Abaxis faced challenging year over year comparisons in North America in terms of veterinary rotors this quarter   Meanwhile  for the remaining quarters of fiscal 2017  management offered an improved outlook for veterinary rotor sales in the region  Also  Abaxis  strong cash position buoys optimism on the stock Zacks Rank   Key PicksResMed currently carries a Zacks Rank  3  Hold   Better ranked stocks in the medical sector are GW Pharmaceuticals plc   NASDAQ GWPH    Quidel Corp    NASDAQ QDEL   and Boston Scientific Corporation   NYSE BSX    GW Pharmaceuticals sports a Zacks Rank  1  Strong Buy   while Quidel and Boston Scientific carry a Zacks Rank  2  Buy   You can see GW Pharmaceuticals surged 69 6  year to date compared to the S P 500 s 4 7  over the same period  The company s four quarter average earnings surprise is 41 6  Quidel rallied 23 5  in the past one year  above the S P 500 s 2 4   Over the next five years  the stock is estimated to record earnings growth of 20   higher than the industry average of 14 8  Boston Scientific recorded 20 1  gain in the past one year  higher than the S P 500 s 2 4   The company has a trailing four quarter average earnings surprise of 6 3  Confidential from ZacksBeyond this Analyst Blog  would you like to see Zacks  best recommendations that are not available to the public  Our Executive VP  Steve Reitmeister  knows when key trades are about to be triggered and which of our experts has the hottest hand ,2016-10-26,Zacks Investment Research,"https://www.investing.com/analysis/abaxis-(abax)-q2-earnings---revenues-miss,-margins-slide-200161149",200161149
200403,421919,BSX,NuVasive  NUVA  Earnings   Revenues Miss Estimates In Q3,opinion,NuVasive  Inc    NASDAQ NUVA   reported third quarter 2016 adjusted earnings per share  EPS  of 40 cents  reflecting a 14 3  rise from the year ago quarter  However  the figure missed the Zacks Consensus Estimate by a penny Solid revenue growth primarily led to the year over year improvement in earnings Including one time items  the company reported third quarter 2016 net income per share of 7 cents  highlighting a 71  rise from earnings of 24 cents in the year ago quarter NUVASIVE INC Price  Consensus and EPS Surprise    Revenues in the reported quarter increased 16 4  year over year to  239 6 million  up 18 9  at constant exchange rate or CER  but fell short of the Zacks Consensus Estimate of  244 million  The upside was driven by strong procedural growth in the U S  as well as solid performance in Europe and Australia  In the reported quarter  International business grew 37 6  year over year  up 23  at CER   Growth was significantly backed by strong contributions from core direct markets including Japan  Australia  New Zealand  the U K   Italy and Germany The company reported an 18 basis point  bps  contraction in gross margin to 75 3  in the third quarter with a 20 4  increase in cost of goods sold  Sales  marketing and administrative expenses went up 19 3  to  131 9 million  while research and development expenses increased 36 2  to  12 5 million NuVasive posted adjusted operating income of  36 1 million in the reported quarter  reflecting a 14  rise from the year ago number  Adjusted operating margin contracted 73 bps to 15  in the reported quarter The company exited the third quarter with cash  cash equivalents and short term investments of  203 8 million  down from  317 1 million in the prior quarter OutlookNuVasive has provided an update on its full year 2016 guidance  This latest guidance takes into consideration the integration effect of NSO and Biotronic The company currently expects 2016 revenues of approximately  952 million  a decrease from the earlier guidance of  962 million   up 17 4  from 2015 The current Zacks Consensus Estimate of  962 5 million is above the projected range NuVasive has also provided its guidance for full year 2016 adjusted earnings per share at  1 64  unchanged   up approximately 1 31  from the 2015 EPS number  The current Zacks Consensus Estimate of  1 65 is above the company s guidance  Additionally  adjusted operating margin for the year is projected at 16   15 5    up 60 bps on a year over year basis Our TakeNuVasive posted a disappointing third quarter  with both earnings and revenues missing the consensus mark On a positive note  the company saw double digit growth in both Spinal Hardware and Surgical Support businesses  including NuVasive Specialized Orthopedics  or NSO  and Biotronic NeuroNetwork  Growth in the Spinal Hardware business reflects the strong acceptance of the platform across product areas within the Integrated Global Alignment  iGA  strategy  including Reline posterior fixation system  ALIF  Bendini and IOS Results were also driven by strength in NuVasive s procedural offerings including posterior lumbar  anterior  lateral and cervical  and the integration of NSO portfolio which includes MAGEC for early onset scoliosis  The PRECICE technology for limb lengthening acquired with Ellipse Technologies is presently part of NSO which also witnessed strong sales in the quarter Surgical Support business results were driven by the inclusion of Biotronic  which was acquired in July  Results benefited from the inclusion of NSO and Biotronic  both acquired in 2016 as part of the company s strategy to fortify its position in the spine market with complementary technologies In addition  the company witnessed growing U S  MAGEC sales and is working closely with hospitals on opportunities for longer term contracts Zacks Rank   Key PicksNuVasive currently holds a Zacks Rank  3  Hold   Better ranked medical stocks are GW Pharmaceuticals plc   NASDAQ GWPH    Quidel Corp    NASDAQ QDEL   and Boston Scientific Corporation   NYSE BSX    GW Pharmaceuticals sports a Zacks Rank  1  Strong Buy   while Quidel and Boston Scientific carry a Zacks Rank  2  Buy   You can see GW Pharmaceuticals surged 69 6  year to date compared to the S P 500 s 4 7  over the same period  The company s four quarter average earnings surprise is 41 6  Quidel rallied 23 5  in the past one year  higher than the S P 500 s 2 4   Over the next five years  the stock is estimated to record earnings growth rate of 20   higher than the industry average of 14 8   Boston Scientific recorded 20 1  gain in the past one year  above the S P 500 s 2 4   The company has a trailing four quarter average earnings surprise of 6 3 Confidential from ZacksBeyond this Analyst Blog  would you like to see Zacks  best recommendations that are not available to the public  Our Executive VP  Steve Reitmeister  knows when key trades are about to be triggered and which of our experts has the hottest hand ,2016-10-26,Zacks Investment Research,https://www.investing.com/analysis/nuvasive-(nuva)-earnings---revenues-miss-estimates-in-q3-200161136,200161136
200411,421927,BSX,St  Jude  STJ  Launches PressureWire X After FDA Clearance,opinion,Global medical device company  St  Jude Medical  Inc    NYSE STJ   recently announced that it has launched the PressureWire X Guidewire fractional flow reserve  FFR  measurement system following the receipt of the U S  clearance  This system is the latest in the PressureWire Guidewire series and is designed to offer better shapeability and shape retention for reducing vessel trauma  It also provides better accuracy and simplicity when treating patients during percutaneous coronary intervention  PCI   especially those with complex anatomies A PCI procedure  or coronary angioplasty  is a non surgical procedure designed to open coronary blood flow blockages and restore blood flow to the hearts of patients living with coronary artery disease  PressureWire Guidewire FFR measurements are used by physicians to identify the severity of narrowings in the coronary arteries  which can result in more accurate diagnoses and better treatment decisions Headquartered in St  Paul  MN  St  Jude Medical has approximately 18 000 employees worldwide and focuses on five major areas that include heart failure  atrial fibrillation  neuron modulation  traditional cardiac rhythm management and cardiovascular St  Jude s performance in the near term is likely to be dampened by the sluggish Cardiac Rhythm Management  CRM  market  The downside would stem from pricing pressures  austerity measures and health care reforms in the market  Moreover  lower demand for capital equipment owing to a tough hospital budget environment remains a major headwind for the company  ST JUDE MEDICAL Price   St  Jude currently has a Zacks Rank  4  Sell  Key PicksSome better ranked stocks in the broader medical sector are Boston Scientific Corporation   NYSE BSX    The Cooper Companies Inc    NYSE COO   and NuVasive  Inc    NASDAQ NUVA    All the three stocks carry a Zacks Rank  2  Buy   You can see  Boston Scientific has gained 25 7  year to date  much better than the S P 500 s 4 3  over the same period  Over the past three months  the company s earnings estimates for the current year have inched up 0 9  to  1 10 per share Cooper has seen eight estimates move higher for the current fiscal over the past 60 days  compared to no downward movement  Accordingly  earnings estimates for the year have moved up by 1 2  to  8 42 per share  The stock recorded a gain of 33 6  year to date NuVasive recorded an impressive 31 96  gain over the past one year compared to the S P 500 s 5 8   Over the next five years  the stock is expected to see 16 7  earnings growth compared to the industry average of 14 8  Confidential from ZacksBeyond this Analyst Blog  would you like to see Zacks  best recommendations that are not available to the public  Our Executive VP  Steve Reitmeister  knows when key trades are about to be triggered and which of our experts has the hottest hand ,2016-10-13,Zacks Investment Research,https://www.investing.com/analysis/st.-jude-(stj)-launches-pressurewire-x-after-fda-clearance-200158865,200158865
200412,421928,BSX,Veeva Launches Vault EDC And Vault ESource Applications,opinion,"Global provider of cloud software and data solutions  Veeva Systems Inc    NYSE VEEV   recently launched Veeva Vault EDC and Veeva Vault eSource  These are the very first applications for clinical data management on a single cloud platform  The new applications along with Vault CTMS  Vault eTMF  and Vault Study Startup  are part of the company s Veeva Vault Clinical Suite  It is a suite of unified cloud applications to streamline clinical operations and data management  from study startup to archive The focus of the company in this space is evident from the fact that it has added more than 120 clinical operations customers in less than four years  This includes the deployment of Veeva Vault eTMF at seven of the top 20 pharma companies in the world We note that volume of data in a Phase III study has risen by more than 50  since 2000 and as a result the cost per patient for a clinical trial has also increased  Traditional electronic data capture  EDC  systems add to the difficulties and expenses as these necessitate site staff to spend a significant amount of time managing clinical data  System set up  maintenance  inflexibility  and a lack of integration have slackened the pharmaceutical industry s ability to get data and quickly make decisions during trials  Hence  Veeva aims to expand its customer base through a modern cloud approach for clinical data management with Vault EDC and Vault eSource Vault EDC is a modern and adaptive cloud application and is built specifically for trial processes to accelerate critical workflows and enable real time feedback  It will provide an intuitive  customer friendly experience for quick and easy access to data VEEVA SYSTEMS A Price
    Consumers can use Vault EDC either as a standalone application or to integrate electronic source data or eSource with Vault eSource to record patient data directly into a user friendly mobile application  Vault EDC and Vault eSource are based on an open cloud architecture that allows them to be used with other third party clinical systems Our TakeVeeva Systems has ensured a strong recurring revenue mix through its focus on significant growth in subscription revenues  which are higher than service revenues Moreover  the latest launches are highly encouraging in our view  These applications are likely to fortify the company s position and enhance its long term growth prospects Key PicksVeeva Systems currently has a Zacks Rank  3  Hold   Some better ranked stocks in the broader medical sector are Boston Scientific Corporation   NYSE BSX    The Cooper Companies Inc    NYSE COO   and NuVasive  Inc    NASDAQ NUVA    All the three stocks carry a Zacks Rank  2  Buy   You can see  Boston Scientific has gained 25 7  year to date  much better than the S P 500 s 4 3  over the same period  Over the past three months  the company s earnings estimates for the current year have inched up 0 9  to  1 10 per share Cooper has seen eight estimates move higher for the current fiscal over the past 60 days but has witnessed no downward movement  Accordingly  earnings estimates for the year have moved up by 1 2  to  8 42 per share  The stock recorded a gain of 33 6  year to date NuVasive recorded an impressive 31 96  gain over the past one year compared with the S P 500 s 5 8   Over the next five years  the stock is expected to see 16 7  earnings growth compared with the industry average of 14 8  Confidential from ZacksBeyond this Analyst Blog  would you like to see Zacks  best recommendations that are not available to the public  Our Executive VP  Steve Reitmeister  knows when key trades are about to be triggered and which of our experts has the hottest hand ",2016-10-13,Zacks Investment Research,https://www.investing.com/analysis/veeva-launches-vault-edc-and-vault-esource-applications-200158920,200158920
200417,421933,BSX,FDA Approves Boston Scientific s Emblem MRI S ICD System,opinion,The U S  Food and Drug Administration  FDA  recently granted marketing approval for Boston Scientific Corporation s   NYSE BSX   Emblem MRI Subcutaneous Implantable Defibrillator  S ICD  System  in line with management s expectations  This approval added another device to this medical technology giant s expanding product line of magnetic resonance imaging  MRI    safe devices The approval also included magnetic resonance  MR  labeling for all previously implanted Emblem S ICD Systems of the company  so that going forward all patients will be receive a MRI enabled S ICD system from Boston Scientific Notably  Boston Scientific s Emblem S ICD System safeguards patients  at risk of sudden cardiac arrest by not touching their hearts and vasculatures  Therefore this device has the potential to reduce the risk of complications associated with conventional transvenous implantable cardioverter defibrillator leads Moreover  the Emblem S ICD is 20  thinner and projected to last 40  longer than the company s previous generation of S ICD We believe the recent FDA approval for the next generation version of this device   the one enabled for undergoing MRI  should enhance Boston Scientific s position in the global multi billion dollar cardiac rhythm management  CRM  devices market Apart from being MRI safe  the device introduces two new features to the market   Smart Pass technology and Atrial Fibrillation  AF  Monitor  The Smart Pass technology  also being added to the earlier version through a software update  facilitates more enhanced therapy for patients only when necessary  The AF Monitor feature is a detection tool designed to alert physicians after the identification of AF so they can make more informed treatment decisions for their patients Per management  Emblem S ICD has been a key contributor of the company s top line growth during the recently reported second quarter of 2016  following the international launch of the Emblem MRI S ICD system in Europe in Apr 2016   Going ahead  the company plans to expand global utilization of its S ICD systems with more long term data from the Effortless Registry  growing physician implant experience and widespread expansion in demand for S ICD systems Besides  the company expects this FDA approval will aid in neutralizing the near term headwinds it has been suffering from the U S  MRI high voltage segment With the CRM Devices market value currently expected to reach  20 9 billion by 2017  we expect Boston Scientific to capture larger shares of this market going ahead  banking on the recent FDA as well as CE Mark approvals for the Emblem MRI S ICD  Additionally the growing demand for MRI safe devices and the strong performance this medical device major has exhibited so far further buoys this optimism Some of the notable players in the medical space include NuVasive  Inc    NASDAQ NUVA    Quidel Corp    NASDAQ QDEL   and Lantheus Holdings  Inc    NASDAQ LNTH   ,2016-08-14,Zacks Investment Research,https://www.investing.com/analysis/fda-approves-boston-scientific's-emblem-mri-s-icd-system-200147966,200147966
200418,421934,BSX,Boston Scientific s LOTUS Edge Valve System Gets CE Mark,opinion,Medical device major Boston Scientific Corporation   NYSE BSX   recently announced the receipt of the European CE mark for its LOTUS Edge Valve System  This device is the latest of the company s next generation transcatheter valve implantation  TAVI  technology  Following the approval  the LOTUS Edge device will be available in selected centers in Europe The LOTUS Edge valve system is used for aortic valve replacement in patients suffering from severe aortic stenosis and in need of surgical valve replacement  Unlike the traditional systems  which require open heart surgery  under this latest system  the replacement valve is delivered via transcatheter percutaneous delivery  a minimally invasive procedure involving a small incision to gain access to a blood vessel Like the earlier Lotus Valve system  this edge valve system accurately relocates the device and prevents paravalvular leak  However the new system carries a more flexible and lower profile catheter for easy use  It also includes Depth Guard technology  which reduces the use of permanent pacemakers  PPM  BOSTON SCIENTIF Price   According to Monash Medical Centre in Melbourne  Australia  Boston Scientific s LOTUS Edge device is a better version of its predecessor  Recent studies have shown that the new one incorporates the Adaptive Seal technology  which minimizes paravalvular regurgitation  leaking  in most of the patients  LOTUS Edge continues to be the sole TAVI device  which allows physicians to perform valve replacement in an easier and convenient procedure for best results As per Research and Markets report  the global heart valves market is estimated to grow at a CAGR of 14 28  during 2016 2020  This growing trend is primarily based on the increasing awareness about modern valve technology in treating heart diseases by physicians  This trend reveals huge opportunity for the interventional cardiology business of Boston Scientific  helping the company in capturing the untapped potential of the heart valves market Further  Boston Scientific has recently recorded a significant 12  revenue growth in its interventional cardiology segment  The approval will encourage Boston Scientific to continuously develop technology for clinicians to effectively treat patients with severe aortic stenosis Zacks Rank   Key PicksBoston Scientific currently has a Zacks Rank  3  Hold   Better ranked stocks in the medical product sector are GW Pharmaceuticals plc   NASDAQ GWPH    NuVasive  Inc    NASDAQ NUVA   and Quidel Corp    NASDAQ QDEL    All these stocks sport a Zacks Rank  1  Strong Buy   You can see Confidential from ZacksBeyond this Analyst Blog  would you like to see Zacks  best recommendations that are not available to the public  Our Executive VP  Steve Reitmeister  knows when key trades are about to be triggered and which of our experts has the hottest hand    ,2016-09-19,Zacks Investment Research,https://www.investing.com/analysis/boston-scientific's-lotus-edge-valve-system-gets-ce-mark-200154567,200154567
200419,421935,BSX,Company News For September 28  2016,opinion,"     Shares of Deutsche Bank AG  DE DBKGn     gained 0 6  after the U S  Justice Department s third highest ranking official said banks can reduce penalties by cooperating with authorities
	     Shares of Carnival  LON CCL  Corp    surged 4 1  after the company raised its earnings per share for the fiscal year ending in November to  3 33 to  3 37 from an earlier view of  3 25 to  3 35
	     Shares of EndoChoice Holdings Inc    soared 88 4  after Boston Scientific Corporation  NYSE BSX     said that it will acquire EndoChoice for about  210 million
	     Kite Pharma Inc s    shares increased 9 2  after the company released positive test results for its non Hodgkin lymphoma drug",2016-09-27,Zacks Investment Research,"https://www.investing.com/analysis/company-news-for-september-28,-2016-200155997",200155997
