,id,ticker,title,category,content,date,provider,url,article_id
188330,409846,PPL,PPL  PPL  Up 7 2  Since Last Earnings Report  Can It Continue ,opinion,"It has been about a month since the last earnings report for PPL  PPL   Shares have added about 7 2  in that time frame  outperforming the S P 500 
Will the recent positive trend continue leading up to its next earnings release  or is PPL due for a pullback  Before we dive into how investors and analysts have reacted as of late  let s take a quick look at the most recent earnings report in order to get a better handle on the important drivers  PPL Corporation  NYSE PPL  s Q4 Earnings Top  Revenues Miss EstimatesPPL Corporation delivered fourth quarter 2018 adjusted earnings per share of 52 cents  beating the Zacks Consensus Estimate of 49 cents by 6 1   The figure declined 5 4  year over year  primarily due to lower earnings in the Pennsylvania and Kentucky Regulated segments On a GAAP basis  the company generated EPS of 57 cents compared with 11 cents in the year ago quarter  The difference between GAAP and operating earnings in the reported quarter was due to a gain in U K  Regulated segment In 2018  the company delivered adjusted earnings of  2 40 per share  up from  2 25 in 2017 Total RevenuesPPL Corporation posted revenues of  1 939 million in the fourth quarter  which missed the Zacks Consensus Estimate of  1 950 million by 0 6   Nevertheless  the figure improved 0 7  year over year In 2018  the company posted revenues of  7 785 million  up from  7 447 million in 2017 Segment ResultsU K  Regulated  Adjusted earnings increased 10 3  from the prior year quarter s tally to 32 cents per share  The upside was primarily supported by higher foreign currency exchange rates  increased pension income and hiked prices effective from Apr 1  2018 Kentucky Regulated  Adjusted earnings were 11 cents  down from 14 cents in the year ago quarter   The decline was primarily caused by higher operation and maintenance expense as well as other factors Pennsylvania Regulated  Adjusted earnings fell 7  from the prior year quarter s tally to 13 cents  The results were affected by higher operation and maintenance expense  higher depreciation expense as well as the effect of share dilution Corporate and Other  The segment reported a loss of 4 cents in the quarter  which was wider that a loss of 2 cents in the prior year quarter Operational HighlightsPPL Corporation s total operating expenses increased 8 9  year over year to   1 282 million in the reported quarter The company reported operating income of  657 million  lower than  749 million in the prior year quarter Interest expenses increased 5 6  to  245 million from the year ago quarter s tally of  232 million Financial PositionAs of Dec 31  2018  the company had cash and cash equivalents of  621 million compared with  485 million as of Dec 31  2017 Long term debt  excluding debts due within a year  was  20 069 million as of Dec 31  2018 compared with  19 847 million at the end of 2017 Net cash flow from operating activities at the end of 2018 was  2 821 million compared with  2 461 million a year ago GuidancePPL Corporation announced guidance for 2019 EPS from ongoing operations in the range of  2 30  2 50 with a midpoint of  2 40 which is lower than the Zacks Consensus Estimate of  2 44 
How Have Estimates Been Moving Since Then 
In the past month  investors have witnessed a downward trend in fresh estimates 
VGM Scores
At this time  PPL has a poor Growth Score of F  however its Momentum Score is doing a lot better with a C  Following the exact same course  the stock was allocated a grade of C on the value side  putting it in the middle 20  for this investment strategy 
Overall  the stock has an aggregate VGM Score of D  If you aren t focused on one strategy  this score is the one you should be interested in 
Outlook
Estimates have been broadly trending downward for the stock  and the magnitude of this revision indicates a downward shift  Notably  PPL has a Zacks Rank  3  Hold   We expect an in line return from the stock in the next few months ",2019-03-15,Zacks Investment Research,https://www.investing.com/analysis/ppl-ppl-up-72-since-last-earnings-report-can-it-continue-200398376,200398376
188331,409847,PPL,Why PPL  PPL  Could Beat Earnings Estimates Again,opinion,"Looking for a stock that has been consistently beating earnings estimates and might be well positioned to keep the streak alive in its next quarterly report  PPL  PPL   which belongs to the Zacks Utility   Electric Power industry  could be a great candidate to consider 
This energy and utility holding company has seen a nice streak of beating earnings estimates  especially when looking at the previous two reports  The average surprise for the last two quarters was 5 74  
For the most recent quarter  PPL was expected to post earnings of  0 49 per share  but it reported  0 52 per share instead  representing a surprise of 6 12   For the previous quarter  the consensus estimate was  0 56 per share  while it actually produced  0 59 per share  a surprise of 5 36  
Price and EPS Surprise

Thanks in part to this history  there has been a favorable change in earnings estimates for PPL lately  In fact  the Zacks Earnings ESP  Expected Surprise Prediction  for the stock is positive  which is a great indicator of an earnings beat  particularly when combined with its solid Zacks Rank 
Our research shows that stocks with the combination of a positive Earnings ESP and a Zacks Rank  3  Hold  or better produce a positive surprise nearly 70  of the time  In other words  if you have 10 stocks with this combination  the number of stocks that beat the consensus estimate could be as high as seven 
The Zacks Earnings ESP compares the Most Accurate Estimate to the Zacks Consensus Estimate for the quarter  the Most Accurate Estimate is a version of the Zacks Consensus whose definition is related to change  The idea here is that analysts revising their estimates right before an earnings release have the latest information  which could potentially be more accurate than what they and others contributing to the consensus had predicted earlier 
PPL has an Earnings ESP of  2 82  at the moment  suggesting that analysts have grown bullish on its near term earnings potential  When you combine this positive Earnings ESP with the stock s Zacks Rank  3  Hold   it shows that another beat is possibly around the corner 
With the Earnings ESP metric  it s important to note that a negative value reduces its predictive power  however  a negative Earnings ESP does not indicate an earnings miss 
Many companies end up beating the consensus EPS estimate  but that may not be the sole basis for their stocks moving higher  On the other hand  some stocks may hold their ground even if they end up missing the consensus estimate 
Because of this  it s really important to check a company s Earnings ESP ahead of its quarterly release to increase the odds of success  Make sure to utilize our Earnings ESP Filter to uncover the best stocks to buy or sell before they ve reported ",2019-04-17,Zacks Investment Research,https://www.investing.com/analysis/why-ppl-ppl-could-beat-earnings-estimates-again-200408521,200408521
188351,409867,PPL,Why PPL  PPL  Is A Top Dividend Stock For Your Portfolio,opinion,"Getting big returns from financial portfolios  whether through stocks  bonds  ETFs  other securities  or a combination of all  is an investor s dream  But when you re an income investor  your primary focus is generating consistent cash flow from each of your liquid investments 
While cash flow can come from bond interest or interest from other types of investments  income investors hone in on dividends  A dividend is the distribution of a company s earnings paid out to shareholders  it s often viewed by its dividend yield  a metric that measures a dividend as a percent of the current stock price  Many academic studies show that dividends make up large portions of long term returns  and in many cases  dividend contributions surpass one third of total returns 
PPL in Focus
PPL  PPL  is headquartered in Allentown  and is in the Utilities sector  The stock has seen a price change of  0 65  since the start of the year  The energy and utility holding company is currently shelling out a dividend of  0 41 per share  with a dividend yield of 5 33   This compares to the Utility   Electric Power industry s yield of 3 22  and the S P 500 s yield of 1 96  
In terms of dividend growth  the company s current annualized dividend of  1 64 is up 3 8  from last year  Over the last 5 years  PPL has increased its dividend 5 times on a year over year basis for an average annual increase of 2 30   Looking ahead  future dividend growth will be dependent on earnings growth and payout ratio  which is the proportion of a company s annual earnings per share that it pays out as a dividend  PPL s current payout ratio is 68   meaning it paid out 68  of its trailing 12 month EPS as dividend 
Looking at this fiscal year  PPL expects solid earnings growth  The Zacks Consensus Estimate for 2018 is  2 34 per share  with earnings expected to increase 4  from the year ago period 
Bottom Line
Investors like dividends for a variety of different reasons  from tax advantages and decreasing overall portfolio risk to considerably improving stock investing profits  It s important to keep in mind that not all companies provide a quarterly payout 
For instance  it s a rare occurrence when a tech start up or big growth business offers their shareholders a dividend  It s more common to see larger companies with more established profits give out dividends  Income investors must be conscious of the fact that high yielding stocks tend to struggle during periods of rising interest rates  With that in mind  PPL is a compelling investment opportunity  Not only is it a strong dividend play  but the stock currently sits at a Zacks Rank of 3  Hold  ",2018-10-30,Zacks Investment Research,https://www.investing.com/analysis/why-ppl-ppl-is-a-top-dividend-stock-for-your-portfolio-200352290,200352290
188352,409868,PPL,PPL  PPL  Q3 Earnings And Revenues Beat Estimates,opinion,"PPL  PPL  came out with quarterly earnings of  0 59 per share  beating the Zacks Consensus Estimate of  0 56 per share  This compares to earnings of  0 56 per share a year ago  These figures are adjusted for non recurring items 
This quarterly report represents an earnings surprise of 5 36   A quarter ago  it was expected that this energy and utility holding company would post earnings of  0 54 per share when it actually produced earnings of  0 55  delivering a surprise of 1 85  
Over the last four quarters  the company has surpassed consensus EPS estimates four times 
PPL  which belongs to the Zacks Utility   Electric Power industry  posted revenues of  1 87 billion for the quarter ended September 2018  surpassing the Zacks Consensus Estimate by 0 68   This compares to year ago revenues of  1 85 billion  The company has topped consensus revenue estimates four times over the last four quarters 
The sustainability of the stock s immediate price movement based on the recently released numbers and future earnings expectations will mostly depend on management s commentary on the earnings call 
PPL shares have lost about 1 8  since the beginning of the year versus the S P 500 s gain of 1 4  
What s Next for PPL 
While PPL has underperformed the market so far this year  the question that comes to investors  minds is  what s next for the stock 
There are no easy answers to this key question  but one reliable measure that can help investors address this is the company s earnings outlook  Not only does this include current consensus earnings expectations for the coming quarter s   but also how these expectations have changed lately 
Empirical research shows a strong correlation between near term stock movements and trends in earnings estimate revisions  Investors can track such revisions by themselves or rely on a tried and tested rating tool like the Zacks Rank  which has an impressive track record of harnessing the power of earnings estimate revisions 
Ahead of this earnings release  the estimate revisions trend for PPL was mixed  While the magnitude and direction of estimate revisions could change following the company s just released earnings report  the current status translates into a Zacks Rank  3  Hold  for the stock  So  the shares are expected to perform in line with the market in the near future  You can see the complete list of today s Zacks  1 Rank  Strong Buy  stocks here 
It will be interesting to see how estimates for the coming quarters and current fiscal year change in the days ahead  The current consensus EPS estimate is  0 51 on  1 95 billion in revenues for the coming quarter and  2 34 on  7 65 billion in revenues for the current fiscal year 
Investors should be mindful of the fact that the outlook for the industry can have a material impact on the performance of the stock as well  In terms of the Zacks Industry Rank  Utility   Electric Power is currently in the top 29  of the 250 plus Zacks industries  Our research shows that the top 50  of the Zacks ranked industries outperform the bottom 50  by a factor of more than 2 to 1 ",2018-10-31,Zacks Investment Research,https://www.investing.com/analysis/ppl-ppl-q3-earnings-and-revenues-beat-estimates-200353060,200353060
188353,409869,PPL,PPL  PPL  Down 0 3  Since Last Earnings Report  Can It Rebound ,opinion,"A month has gone by since the last earnings report for PPL  PPL   Shares have lost about 0 3  in that time frame  underperforming the S P 500 
Will the recent negative trend continue leading up to its next earnings release  or is PPL due for a breakout  Before we dive into how investors and analysts have reacted as of late  let s take a quick look at the most recent earnings report in order to get a better handle on the important catalysts  PPL Corp s Earnings and Revenues Beat Estimates in Q3PPL Corporation  NYSE PPL  reported third quarter 2018 adjusted earnings per share of 59 cents  beating the Zacks Consensus Estimate of 56 cents by 5 4   Earnings improved 5 4  year over year  primarily driven by higher earnings in the U K  and Pennsylvania segments On a GAAP basis  the company reported earnings per share of 62 cents in the quarter compared with 51 cents a year ago  The difference between GAAP and operating earnings in the reported quarter was due to the adjustment of special items Total RevenuesPPL Corp posted revenues of  1 872 million in the third quarter  beating the Zacks Consensus Estimate of  1 859 million by 0 7    Revenues also improved 1 5  year over year Segment ResultsU K  Regulated  Adjusted earnings increased 25  from the prior year quarter to 30 cents per share  The upside was primarily supported by higher foreign currency exchange rates  increased pension income  improved sales volumes and hiked prices effective Apr 1  2018 Kentucky Regulated  Adjusted earnings were 17 cents  down from 18 cents in the year ago quarter  Higher operation and maintenance expenses and the effect of share dilution hurt segment results Pennsylvania Regulated  Adjusted earnings increased 23  from the prior year quarter to 16 cents per share  The results benefited from returns on additional capital investments in transmission  higher sales volumes primarily due to favorable weather  and lower operation and maintenance expenses Corporate and Other  The segment reported a loss of 4 cents in the quarter against 1 cent earnings in the prior year quarter  The deterioration was due to income taxes and financing costs Operational HighlightsPPL Corp s total operating expenses increased 7  year over year to   1 186 million in the reported quarter The company reported operating income of  686 million  lower than  736 million in the prior year quarter Interest expenses increased 6  to  244 million from the year ago quarter s  230 million Financial PositionAs of Sep 30  2018  PPL Corp had cash and cash equivalents of  842 million compared with  485 million as of Dec 31  2017 Long term debt  excluding debts due within a year  was  19 924 million as of Sep 30  2018  compared with  19 847 million at the end of 2017 Net cash flow from operating activities at the end of the first nine months of 2018 was  2 210 million compared with  1 754 million in the year ago period GuidancePPL Corp lifts guidance for 2018 earnings per share from ongoing operations to  2 30  2 40 from the earlier expectation of  2 25  2 40 with an increased midpoint of  2 35 per share The company continues to expect 5  to 6  compound annual earnings growth per share from 2018 through 2020 off its original 2018 ongoing earnings forecast midpoint of  2 30 per share  
How Have Estimates Been Moving Since Then 
Fresh estimates followed a downward path over the past two months 
VGM Scores
At this time  PPL has a subpar Growth Score of D  however its Momentum Score is doing a lot better with an A  However  the stock was allocated a grade of C on the value side  putting it in the middle 20  for this investment strategy 
Overall  the stock has an aggregate VGM Score of C  If you aren t focused on one strategy  this score is the one you should be interested in 
Outlook
PPL has a Zacks Rank  3  Hold   We expect an in line return from the stock in the next few months ",2018-11-30,Zacks Investment Research,https://www.investing.com/analysis/ppl-ppl-down-03-since-last-earnings-report-can-it-rebound-200364219,200364219
188354,409870,PPL,Earnings Preview  PPL  PPL  Q4 Earnings Expected To Decline,opinion,"The market expects PPL  PPL  to deliver a year over year decline in earnings on higher revenues when it reports results for the quarter ended December 2018  This widely known consensus outlook is important in assessing the company s earnings picture  but a powerful factor that might influence its near term stock price is how the actual results compare to these estimates 
The earnings report  which is expected to be released on February 14  2019  might help the stock move higher if these key numbers are better than expectations  On the other hand  if they miss  the stock may move lower 
While the sustainability of the immediate price change and future earnings expectations will mostly depend on management s discussion of business conditions on the earnings call  it s worth handicapping the probability of a positive EPS surprise 
Zacks Consensus Estimate
This energy and utility holding company is expected to post quarterly earnings of  0 49 per share in its upcoming report  which represents a year over year change of  10 9  
Revenues are expected to be  1 95 billion  up 1 3  from the year ago quarter 
Estimate Revisions Trend
The consensus EPS estimate for the quarter has remained unchanged over the last 30 days  This is essentially a reflection of how the covering analysts have collectively reassessed their initial estimates over this period 
Investors should keep in mind that an aggregate change may not always reflect the direction of estimate revisions by each of the covering analysts 
Price  Consensus and EPS Surprise

Earnings Whisper
Estimate revisions ahead of a company s earnings release offer clues to the business conditions for the period whose results are coming out  Our proprietary surprise prediction model    the Zacks Earnings ESP  Expected Surprise Prediction     has this insight at its core 
The Zacks Earnings ESP compares the Most Accurate Estimate to the Zacks Consensus Estimate for the quarter  the Most Accurate Estimate is a more recent version of the Zacks Consensus EPS estimate  The idea here is that analysts revising their estimates right before an earnings release have the latest information  which could potentially be more accurate than what they and others contributing to the consensus had predicted earlier 
Thus  a positive or negative Earnings ESP reading theoretically indicates the likely deviation of the actual earnings from the consensus estimate  However  the model s predictive power is significant for positive ESP readings only 
A positive Earnings ESP is a strong predictor of an earnings beat  particularly when combined with a Zacks Rank  1  Strong Buy   2  Buy  or 3  Hold   Our research shows that stocks with this combination produce a positive surprise nearly 70  of the time  and a solid Zacks Rank actually increases the predictive power of Earnings ESP 
Please note that a negative Earnings ESP reading is not indicative of an earnings miss  Our research shows that it is difficult to predict an earnings beat with any degree of confidence for stocks with negative Earnings ESP readings and or Zacks Rank of 4  Sell  or 5  Strong Sell  
How Have the Numbers Shaped Up for PPL 
For PPL  the Most Accurate Estimate is lower than the Zacks Consensus Estimate  suggesting that analysts have recently become bearish on the company s earnings prospects  This has resulted in an Earnings ESP of  1 03  
On the other hand  the stock currently carries a Zacks Rank of  3 
So  this combination makes it difficult to conclusively predict that PPL will beat the consensus EPS estimate 
Does Earnings Surprise History Hold Any Clue 
Analysts often consider to what extent a company has been able to match consensus estimates in the past while calculating their estimates for its future earnings  So  it s worth taking a look at the surprise history for gauging its influence on the upcoming number 
For the last reported quarter  it was expected that PPL would post earnings of  0 56 per share when it actually produced earnings of  0 59  delivering a surprise of  5 36  
Over the last four quarters  the company has beaten consensus EPS estimates four times 
Bottom Line
An earnings beat or miss may not be the sole basis for a stock moving higher or lower  Many stocks end up losing ground despite an earnings beat due to other factors that disappoint investors  Similarly  unforeseen catalysts help a number of stocks gain despite an earnings miss 
That said  betting on stocks that are expected to beat earnings expectations does increase the odds of success  This is why it s worth checking a company s Earnings ESP and Zacks Rank ahead of its quarterly release  Make sure to utilize our Earnings ESP Filter to uncover the best stocks to buy or sell before they ve reported 
PPL doesn t appear a compelling earnings beat candidate  However  investors should pay attention to other factors too for betting on this stock or staying away from it ahead of its earnings release ",2019-02-06,Zacks Investment Research,https://www.investing.com/analysis/earnings-preview-ppl-ppl-q4-earnings-expected-to-decline-200385066,200385066
188373,409889,PPL,PPL Corporation  PPL  Tops Q1 Earnings And Revenue Estimates,opinion,"PPL Corporation   NYSE PPL    a diversified utility holding company  has operations in the U S  and the UK  PPL Corp  s organic growth strategy  systematic investments in utility infrastructure development projects and focus on enhancing customer service are commendable Estimate Trend   Surprise HistoryInvestors should note that the first quarter Zacks Consensus Estimate of 66 cents per share has gone down by 4 3  over the last 60 days Coming to the earnings surprise  PPL Corp  has surpassed the Zacks Consensus Estimate in the last four trailing quarters  resulting in a positive average surprise of 6 06  PPL Corporation Price and EPS Surprise 
   Zacks Rank  Currently  PPL Corp  has a Zacks Rank  3  Hold   You can see  However  since the latest earnings performance is yet to be reflected in the estimate revisions  the rank is subject to change We have mentioned below some of the vital information from this just revealed announcement Earnings  PPL Corp  reported first quarter 2018 earnings of 74 cents per share  beating the Zacks Consensus Estimate of 66 cents by 12 1  Revenue  PPL Corp  posted revenues of  2 126 million in the first quarter  beating the Zacks Consensus Estimate of  1 983 million by 7 2  Stock Price  It would be interesting to see how the market reacts to the results during the trading session today Check back later for our full write up on this PPL Corporation earnings report later 5 Medical Stocks to Buy NowZacks names 5 companies poised to ride a medical breakthrough that is targeting cures for leukemia  AIDS  muscular dystrophy  hemophilia  and other conditions New products in this field are already generating substantial revenue and even more wondrous treatments are in the pipeline  Early investors could realize exceptional profits ",2018-05-02,Zacks Investment Research,https://www.investing.com/analysis/ppl-corporation-ppl-tops-q1-earnings-and-revenue-estimates-200312324,200312324
