,id,ticker,title,category,content,date,provider,url,article_id
23120,244635,CORE,Zacks Industry Outlook Highlights  Western Union Company  MoneyGram International  Acacia Research  Fang Holdings And Core Mark Holding Company,opinion,For Immediate ReleaseChicago  IL   October 2  2017   Today  Zacks Equity Research discusses the Industry  Business Services  Part 3  including The Western Union Company  NYSE    NYSE WU        MoneyGram International Inc   Nasdaq    NASDAQ MGI        Acacia Research Corp   Nasdaq    NASDAQ ACTG        Fang Holdings Ltd   NYSE    NYSE SFUN       and Core Mark Holding Company  Inc   Nasdaq    NASDAQ CORE       Industry  Business Services  Part 3Link   Despite the positives in the Business Services  we cannot ignore the headwinds limiting the positives mentioned in                   Discussed below are some inherent challenges faced by the Business Services sector Continuous Spending on Research and Development  Importantly  consulting service providers need to stay abreast with the latest technologies through continuous spending on research and development  The performance of these providers can be hampered if they do not acclimatize to or adopt new services to cope with the latest developments Maintaining Skilled Workforce Involves High Costs  Since skilled workers are always in demand  there is a possibility of a high turnover rate in the sector  The training of unskilled workers or taking in new skilled workers increases operational costs  in turn affecting margins  This space needs to have a more skilled workforce to take advantage of technology that develops at a rapid pace Competition  Maintaining or increasing market share remains challenging for business service providers  As discussed earlier  the main business of one company can be a business service for another  So target customers for both may at times be the same Therefore  a business service provider needs to be adequately equipped to win over customers  While larger providers bank on the broad variety of service offerings and can effectively take up difficult ventures  relatively smaller players compete in an industry backed by specialized services Regulatory Hurdles  By virtue of having operations across the globe  service providers face regulatory hurdles and compliance related issues  The Western Union Company  NYSE       expects compliance costs to be at the higher end of 3 5   4  in 2017 MoneyGram International Inc   Nasdaq       is being probed by a federal grand jury in relation to its consumer anti fraud and anti money laundering programs from 2003 to early 2009  The company is also involved in many other government investigations and litigations  Any adverse results might lead to potential liability against damages  which could put pressure on margins and cash flows Taking into consideration an unfavorable Zacks Rank  we prefer to avoid Acacia Research Corp   Nasdaq        Fang Holdings Ltd   NYSE       and Core Mark Holding Company  Inc   Nasdaq       carrying a Zacks Rank  5  Strong Sell  You can see  To ConcludeThe dearth of skilled labor in the business services sector can affect its prospects  Non availability of quality workforce at a reasonable rate might increase overall operational costs In addition  the highly fragmented nature of the industry makes it difficult for such companies to set a distinct trend or predict a concrete future for it 4 Stocks to Watch After the Massive Equifax  NYSE EFX  HackCybersecurity stocks spiked on recent news of a data breach affecting 143 million Americans  But which stocks are the best buy candidates right now  And what does the future hold for the cybersecurity industry Equifax is just the most recent victim  Computer hacking and identity theft are more common than ever  Zacks has just released Cybersecurity  An Investor s Guide to inform Zacks com readers about this  170 billion year space  More importantly  it highlights 4 cybersecurity picks with strong profit potential Strong Stocks that Should Be in the NewsMany are little publicized and fly under the Wall Street radar  They re virtually unknown to the general public  Yet today s 220 Zacks Rank  1  Strong Buys  were generated by the stock picking system that has nearly tripled the market from 1988 through 2015  Its average gain has been a stellar  26  per year Follow us on Twitter   Join us on Facebook  NASDAQ FB    Zacks Investment Research is under common control with affiliated entities  including a broker dealer and an investment adviser   which may engage in transactions involving the foregoing securities for the clients of such affiliates Media ContactZacks Investment Research800 767 3771 ext  9339Past performance is no guarantee of future results  Inherent in any investment is the potential for loss  This material is being provided for informational purposes only and nothing herein constitutes investment  legal  accounting or tax advice  or a recommendation to buy  sell or hold a security  No recommendation or advice is being given as to whether any investment is suitable for a particular investor  It should not be assumed that any investments in securities  companies  sectors or markets identified and described were or will be profitable  All information is current as of the date of herein and is subject to change without notice  Any views or opinions expressed may not reflect those of the firm as a whole  Zacks Investment Research does not engage in investment banking  market making or asset management activities of any securities  These returns are from hypothetical portfolios consisting of stocks with Zacks Rank   1 that were rebalanced monthly with zero transaction costs  These are not the returns of actual portfolios of stocks  The S P 500 is an unmanaged index  Visit for information about the performance numbers displayed in this press release ,2017-10-01,Zacks Investment Research,https://www.investing.com/analysis/zacks-industry-outlook-highlights-western-union-company-moneygram-international-acacia-research-fang-holdings-and-coremark-holding-company-200216507,200216507
23121,244636,CORE,Should You Get Rid Of Core Mark Holding  CORE  Now ,opinion,Similar to wise buying decisions  exiting certain underperformers at the right time helps maximize portfolio returns  Selling off losers can be difficult  but if both the share price and estimates are falling  it could be time to get rid of the security before more losses hit your portfolio One such stock that you may want to consider dropping is Core Mark Holding Company  Inc    NASDAQ CORE    which has witnessed a significant price decline in the past four weeks  and it has seen negative earnings estimate revisions for the current quarter and the current year  A Zacks Rank  5  Strong Sell  further confirms weakness in CORE A key reason for this move has been the negative trend in earnings estimate revisions  For the full year  we have seen one estimate moving down in the past 30 days  compared with no upward revisions  This trend has caused the consensus estimate to trend lower  going from  1 21 a share a month ago to its current level of  1 08 Also  for the current quarter  Core Mark Holding has seen one downward estimate revision versus no revisions in the opposite direction  dragging the consensus estimate down to 27 cents a share from 45 cents over the past 30 days The stock has also seen some pretty dismal trading lately  as the share price has dropped 20 4  in the past month Core Mark Holding Company  Inc  Price and Consensus   So it may not be a good decision to keep this stock in your portfolio anymore  at least if you don t have a long time horizon to wait If you are still interested in the Business   Services industry  you may instead consider a better ranked stock   Vectrus  Inc    NYSE VEC    The stock currently sports a Zacks Rank  1  Strong Buy  and may be a better selection at this time  You can see  Wall Street s Next Amazon  NASDAQ AMZN Zacks EVP Kevin Matras believes this familiar stock has only just begun its climb to become one of the greatest investments of all time  It s a once in a generation opportunity to invest in pure genius ,2018-01-22,Zacks Investment Research,https://www.investing.com/analysis/should-you-get-rid-of-coremark-holding-core-now-200282657,200282657
23122,244637,CORE,Air Products  Core Mark Holding  Amazon com  Edwards Lifesciences And Canada Goose As Zacks Bull And Bear Of The Day,opinion,For Immediate ReleaseChicago  IL   February 5  2018    highlights Air Products   NYSE APD   as the Bull of the Day and Core Mark Holding   NASDAQ CORE   as the Bear of the Day  In addition  Zacks Equity Research provides analysis onAmazon com  Inc    NASDAQ AMZN    Edwards Lifesciences Corporation   NYSE EW   and Canada Goose Holdings Inc    NYSE GOOS   Here is a synopsis of all five stocks   Air Products  a Zacks Rank  2  Buy   is a world leading Industrial Gases company  The Company s core industrial gases business provides atmospheric and process gases and related equipment to manufacturing markets  including refining and petrochemical  metals  electronics  and food and beverage  Air Products is also the world s leading supplier of liquefied natural gas process technology and equipment  The Company is the world s largest supplier of hydrogen and has built leading positions in growth markets such as helium and natural gas liquefaction Earnings DataAir Products recently reported earnings results where they easily beat both the Zacks consensus earnings and revenue estimates   The report showed that revenues improved by  17 7   volumes were up  13   and pricing increased by  2    All three gas segments saw increases in total volume On a segment basis  sales improved in each segment  Americas  5  due to higher volumes  and strong hydrogen demand   EMEA  29   with volumes rising by  17   mostly due to its new hydrogen plant in India   Asia  47  due to new plants  strong merchant business  and increased pricing   Air Products also has the best balance sheet in the industry which has enabled them to make several recent key acquisitions in China  India  and Korea   Management Increases GuidanceDue to the strong earnings report  and high expectations for 2018  management issued upside guidance for Q2 18  and increased FY EPS guidance as well   Now APD expects Q2 18 EPS in a range of  1 65 1 70 per share  just above the Zacks consensus estimate of  1 67   For FY 18  management expects EPS to be in a range of  7 15 7 35 per share  well above the previous Zacks consensus estimate of  7 00   Management s TakeAccording to Seifi Ghasemi  Chairman  President  and CEO   The committed and motivated team at Air Products delivered another excellent quarter of safety and financial results  Adjusted EPS of  1 79 was another quarterly record  This is also the 15th consecutive quarter that we have reported adjusted EPS growth  In addition  we are winning new projects and delivering on our growth strategy  We generated a significant amount of investable cash and announced a 16 percent increase to our quarterly dividend  making our annual dividend  4 40 per share   Core Mark Holding  a Zacks Rank  5  Strong Sell    is one of the largest marketers of fresh and broad line supply solutions to the convenience retail industry in North America  Core Mark Holding Company  Inc is one of the largest marketers of fresh and broad line supply solutions to the convenience retail industry in North America  Core Mark offers a full range of products  marketing programs  and technology solutions  Core Mark services traditional convenience retailers  grocers  drug  liquor and specialty stores  and other stores that carry convenience products Recent Earnings DataThe company reported Q3 earnings data in early November where they missed the Zacks consensus earnings estimate for the fifth consecutive quarter  but beat on the top line   The earnings data was mostly positive where they saw year over year gains in Net sales  7 9   Non cigarette sales  18 8   cigarette sales  3 6   Candy sales  50   and Food category  15 4    The company also saw gross profits improve by  11 7   and operating expenses fell by 11 4    But on January 5th  the company preannounced Q4 earnings data  and lowered expectations for FY 18   Management stated that fourth quarter EBITDA would be  41 million  down from the  56 million expected in November   The decline is attributed to cigarette carton sale slow down  cost overruns  and weak retail sales   Another factor in the decreased guidance was the loss of both Kroger  NYSE KR   and Circle K customers  a loss of about 1 700 stores    To make matters worse  management also lowered FY 18 EBITDA guidance below the consensus estimate of  176 million to  162 million  a  14 million decline   This decreased guidance could become worse as the company is factoring in both the retail and cigarette segments to move back to a breakeven point   So this guidance could be viewed as high  with a potential of falling even further during the year Additional content Markets Down  but These Stocks Surged to All Time HighsFriday has been a rough day on Wall Street  with several major indexes including the Dow  Nasdaq  and S P 500 hovering deep in the red during early afternoon trading hours Through about 2 p m  EST  the S P 500 was down about 1 45   while the Nasdaq Composite was about 1 22  lower  Meanwhile  the Dow Jones Industrial Average was down more than 400 points  or roughly 1 74  putting the popular indicator on track for its worst week in two years Friday s slump comes on the back of the Bureau of Labor Statistics  first jobs report of 2018  According to the latest data  the U S  added about 200 000 jobs in January  outpacing estimates that called for growth of 180 000 jobs  The report also noted that wages rose 2 9  on an annualized basis The new jobs info sent interest rates higher on Friday morning  The benchmark 10 year yield moved to 2 85   a four year high  The 30 year yield touched its highest level since March But it has not been all bad news today  According to   at least 44 stocks surged to new all time highs  with several positive moves stemming from strong earnings results Among these companies was Amazon com  Inc  Shares of the e commerce king gained as much as 5  to touch a new intraday peak of  1 498 00 in morning trading after the company posted robust earnings and revenue growth on Thursday Amazon surpassed analyst estimates on both the top and bottom line  The Jeff Bezos led company notched revenue growth of 38   while operating income soared 69   Amazon said that sales in its budding Web Services division reached  5 11 billion in the quarter Another company that witnessed a strong post earnings move was Edwards Lifesciences Corporation  Edwards posted its fourth quarter 2017 report on Thursday afternoon  reporting adjusted earnings of  0 97 per share and revenues of  888 5 million  Both of these results beat the respective Zacks Consensus Estimates Edwards said that adjusted earnings grew 25 3  and total revenues expanded 15 7  on the back of strong sales growth in the company s transcatheter heart valves business  Management also acknowledged strong performance from the Surgical Heart Valve Therapy and Critical Care product lines Shares of Edwards Lifesciences moved as much as 6  higher to touch a new all time high of  138 48 in morning trading hours Finally  investors should note that popular recent IPO Canada Goose Holdings Inc  surged to a new peak of  37 10 per share in early afternoon trading  We will not see Canada Goose s latest results until next week  but Wall Street is clearly getting excited about the trendy winter apparel maker Based on our current consensus estimates  we expect Canada Goose to report earnings of  0 36 per share and revenues of  188 million  The company said yesterday that it will release its latest results before the bell opens on Feb  8 Want more analysis from this author  Make sure to follow   on Twitter Breaking News  Cryptocurrencies Now Bigger than VisaThe total market cap of all cryptos recently surpassed  700 billion   more than a 3 800  increase in the previous 12 months  They re now bigger than Morgan Stanley  NYSE MS   Goldman Sachs  NYSE GS  and even Visa  The new asset class may expand even more rapidly in 2018 as new investors continue pouring in and Wall Street becomes increasingly involved Zacks  has just named 4 companies that enable investors to take advantage of the explosive growth About the Bull and Bear of the DayEvery day  the analysts at Zacks Equity Research select two stocks that are likely to outperform  Bull  or underperform  Bear  the markets over the next 3 6 months About Zacks Equity ResearchZacks Equity Research provides the best of quantitative and qualitative analysis to help investors know what stocks to buy and which to sell for the long term Continuous analyst coverage is provided for a universe of 1 150 publicly traded stocks  Our analysts are organized by industry which gives them keen insights to developments that affect company profits and stock performance  Recommendations and target prices are six month time horizons Strong Stocks that Should Be in the NewsMany are little publicized and fly under the Wall Street radar  They re virtually unknown to the general public  Yet today s 220 Zacks Rank  1  Strong Buys  were generated by the stock picking system that has more than doubled the market from 1988 through 2016  Its average gain has been a stellar  25  per year  Follow us on Twitter   Join us on Facebook  NASDAQ FB    Zacks Investment Research is under common control with affiliated entities  including a broker dealer and an investment adviser   which may engage in transactions involving the foregoing securities for the clients of such affiliates Media ContactZacks Investment Research800 767 3771 ext  9339Zacks com provides investment resources and informs you of these resources  which you may choose to use in making your own investment decisions  Zacks is providing information on this resource to you subject to the Zacks  Terms and Conditions of Service  disclaimer   Past performance is no guarantee of future results  Inherent in any investment is the potential for loss  This material is being provided for informational purposes only and nothing herein constitutes investment  legal  accounting or tax advice  or a recommendation to buy  sell or hold a security  No recommendation or advice is being given as to whether any investment is suitable for a particular investor  It should not be assumed that any investments in securities  companies  sectors or markets identified and described were or will be profitable  All information is current as of the date of herein and is subject to change without notice  Any views or opinions expressed may not reflect those of the firm as a whole  Zacks Investment Research does not engage in investment banking  market making or asset management activities of any securities  These returns are from hypothetical portfolios consisting of stocks with Zacks Rank   1 that were rebalanced monthly with zero transaction costs  These are not the returns of actual portfolios of stocks  The S P 500 is an unmanaged index  Visit for information about the performance numbers displayed in this press release ,2018-02-04,Zacks Investment Research,https://www.investing.com/analysis/air-products-coremark-holding-amazoncom-edwards-lifesciences-and-canada-goose-as-zacks-bull-and-bear-of-the-day-200286985,200286985
23123,244638,CORE,SouFun  SFUN  Q2 Loss Narrower Than Expected  View Intact,opinion,SouFun Holdings Ltd    NYSE SFUN   reported operating net loss of 9 cents per share in the second quarter of 2016  narrower than the Zacks Consensus Estimate of a loss of 10 cents  The company had earned 4 cents per share in the year ago quarter A higher level of expense offset revenue improvement  resulting in a loss in the quarter Behind the HeadlinesTotal revenue of SouFun was  287 million in the quarter  up 34 2  year over year on an increase in e commerce services On a year over year basis  revenues from e Commerce services  contributing nearly 66  to total revenue  surged 77 4  to  189 5 million on higher real estate brokerage services for secondary homes  Internet financial services revenues skyrocketed 176 4  on increased financial services to the real estate brokerage services  Other value added services revenues improved 2 6   Listing services revenues decreased 23  to  26 9 million and marketing services revenues declined 15 2  to  51 4 million Operating expenses increased 4 8  while selling expenses decreased 4 7   General and administrative expenses also increased 22 4  due to higher staff cost and operating lease The company incurred an operating loss of  32 8 million in the reported quarter  The year ago quarter on the other hand had seen an operating income of  22 3 million Before income tax  interest expenses  interest income  depreciation and amortization  the company suffered an adjusted loss of  24 6 million  In the year ago quarter  the company s adjusted earnings before income tax  interest expenses  interest income  depreciation and amortization  EBITDA  was  28 4 million Financial UpdateSouFun exited the second quarter with cash and cash equivalents of  759 5 million  down 31  year over year  Convertible senior notes totaled  288 7 million  up 0 3  from the Dec 31  2015 level Cash from operating activities of  36 5 million compared favorably with  4 1 million in the year ago quarter GuidanceSouFun affirmed its revenue guidance of  1 15 billion for 2016 that translates into a 30  year over year increase SOUFUN HLDG ADR Price  Consensus and EPS Surprise    Zacks RankSouFun presently carries a Zacks Rank  3  Hold  Performance of Other Business Service ProvidersThe bottom line at Core Mark Holding Company  Inc    NASDAQ CORE   came in line with the Zacks Consensus Estimate  Performant Financial Corporation   NASDAQ PFMT   outperformed the same in its last reported quarter  while Avis Budget Group  Inc   NASDAQ CAR   missed the expectation ,2016-08-26,Zacks Investment Research,"https://www.investing.com/analysis/soufun-(sfun)-q2-loss-narrower-than-expected,-view-intact-200150275",200150275
23125,244640,CORE,Can Avis   CAR  Initiatives Help Revive Its Stock Price ,opinion,Avis Budget Group Inc    NASDAQ CAR    a global car rental company  is witnessing a low phase as the company s stock price has declined about 18  in one year and is down 4 2  year to date  The impact of foreign currency fluctuations besides unfavorable pricing and high fleet costs are reasons behind this Zacks Rank  5  Strong Sell  company s doom Avis Budget continues to face hurdles like high fleet costs and lower pricing  Evidently  both the Americas and International segment revenues were adversely affected by lower pricing to an extent of 5   on a currency neutral basis  in first quarter 2016  This  along with higher fleet expenses and foreign currency headwinds  also weighed on the company s earnings and earnings before interest  taxes  depreciation and amortization  EBITDA   which slumped 62  in the quarter Further  management expects 2016 to witness an increase in fleet costs  for both the Americas and International segments  thus causing a threat to EBITDA  Additionally  the company s significant presence in the international market exposes it to foreign currency headwinds  which are expected to continue posing hurdles in 2016  though it is anticipated to have a lesser effect now Avis Budget has seen a downtrend in estimates since it posted an adjusted loss for first quarter 2016  wider than the Zacks Consensus Estimate and in sharp contrast to the year ago earnings figure  Moreover  the top line lagged expectations for the seventh straight quarter  Results were mainly hampered by lower pricing  foreign currency headwinds and seasonal factors   which usually lead to soft first quarter outcome Nonetheless  the company s expansion strategy has been moving in full swing via alliances  acquisitions and joint ventures  Also  we commend Avis  focus on expanding its Budget brand  taking its multi brand strategy to the next level  Sustained productivity growth  several pricing initiatives and potential revenue generating synergies from its acquisitions also bode well While we note that this New Jersey based car rental giant has been persistently implementing disciplined pricing initiatives in order to offset the rising fleet costs  we would wait to see more pronounced results on this front before turning optimistic Zacks RankBetter ranked stocks in the business services industry include Core Mark Holding Company Inc    NASDAQ CORE    WageWorks Inc    NYSE WAGE   and Sajan Inc    NASDAQ SAJA    each holding a Zacks Rank  2  Buy  ,2016-07-12,Zacks Investment Research,https://www.investing.com/analysis/can-avis'-(car)-initiatives-help-revive-its-stock-price-200141271,200141271
