,id,ticker,title,category,content,date,provider,url,article_id
24334,245849,LAMR,Ventas Announces R I Development Commitments Worth  0 8B ,opinion,Ventas  Inc    NYSE VTR   recently announced four new developments  totaling approximately  0 8 billion in its university based Research   Innovation  R I  segment  These investments are part of the  1 5 billion R I investment pipeline announced by the company this February All the projects were announced in partnership with Wexford Science   Technology  LLC   a well known developer of university focused real estate solutions  The developments consist of two projects in the Philadelphia University City  uCity  submarket   a new development in association with the University of Pennsylvania and The College of Nursing and Health Professions  Drexel University   totaling  400 million It also includes the Pitt immune transplant and therapy center with the University of Pittsburgh as well as expansion of the dynamic Cortex Innovation Community  along with Washington University in St  Louis  The projects are expected to open in 2021 2022 With the previously announced development at Arizona State University  Ventas has commitment to its R I pipeline amounts to  0 9 billion  These projects expand the company s R I portfolio by 1 5 million square feet and are 40  pre leased  Further  it is anticipated to drive value accretion at stabilization  with unlevered cash yield of more than 7  and GAAP yield of more than 8  Notably  such investments offer Ventas the opportunity to capitalize on the growing healthcare driven research and development  supported by top tier research universities  In fact  pro forma for announced developments  the company s R I portfolio will span approximately eight million square feet and likely generate around  230 million in annual net operating income  when the projects stabilize Furthermore  with relationships with more than 15 leading research universities in its R I portfolio  the company is well poised to cater the rapidly aging population Over the past three months  shares of this Zacks Rank  3  Hold  company have rallied 11 3  compared with the  s growth of 9 3  Key PicksInvestors can also consider some better ranked stocks from the same space like Host Hotels   Resorts  Inc    NYSE HST    Lamar Advertising Company   NASDAQ LAMR   and Duke Realty Corporation   NYSE DRE    carrying a Zacks Rank of 2  Buy   currently  You can see Host Hotels   Resorts  funds from operations  FFO  per share estimates for 2019 moved marginally north to  1 82 over the past month Lamar Advertising s FFO per share estimates for the ongoing year have been revised slightly upward to  5 83 in 30 days  time Duke Realty s FFO per share estimates for the current year moved up to  1 41 in the past month This Could Be the Fastest Way to Grow Wealth in 2019Research indicates one sector is poised to deliver a crop of the best performing stocks you ll find anywhere in the market  Breaking news in this space frequently creates quick double  and triple digit profit opportunities These companies are changing the world   and owning their stocks could transform your portfolio in 2019 and beyond  Recent trades from this sector have generated  98    119  and  164  gains in as little as 1 month ,2019-06-19,Zacks Investment Research,https://www.investing.com/analysis/ventas-announces-ri-development-commitments-worth-08b-200432810,200432810
24356,245871,LAMR,Alexandria Prices Upsized Public Offering Of 3 850 000 Shares ,opinion,Alexandria Real Estate Equities  Inc    NYSE ARE   recently priced an upsized public offering of 3 850 000 common shares at a price of  145 00 per share  The underwriters have been granted a 30 day option to purchase up to an additional 577 500 common shares The offering  subject to fulfillment of customary closing conditions  is expected to close on Jun 25  2019 This offering is in connection to forward sale agreements  per which the forward purchasers are likely to borrow and sell 3 850 000 shares to the underwriters  Subject to Alexandria s right to elect cash or net share settlement  the company projects to deliver the shares no later than Jun 26  2020  in exchange for cash proceeds amounting to the applicable forward sale price  However  the company will not receive any proceeds through forward sales in the initial phase  The common stock offering will boost the company s financial flexibility and help meet its financial obligations efficiently  Moreover  it provides ample scope for deploying capital for long term growth opportunities and rewarding higher returns to stockholders  at the same time Furthermore  a forward sale arrangement will enable the company to lock in the price of such shares at the time of offering pricing  while at the same time delaying share issuance and the receipt of net proceeds until a funding requirement has occurred Net proceeds from the offering will be used to fund pending acquisition  while the remaining proceeds will be used for general working capital needs and other corporate purposes  This may include reducing any outstanding balance on the company s unsecured senior line of credit Over the past six months  shares of this Zacks Rank  2  Buy  company have rallied 36   outperforming the  s growth of 29 5  Other Key PicksInvestors can also consider some better ranked stocks from the same space like Host Hotels   Resorts  Inc    NYSE HST    Lamar Advertising Company   NASDAQ LAMR   and PS Business Parks  Inc    NYSE PSB    carrying a Zacks Rank of 2  currently  You can see Host Hotels   Resorts  funds from operations  FFO  per share estimates for 2019 moved marginally north to  1 82 over the past month Lamar Advertising s FFO per share estimates for the ongoing year have been revised slightly upward to  5 83 in 30 days  time PS Business Parks  current year FFO per share estimate moved up marginally to  6 71 in the past week Today s Best Stocks from ZacksWould you like to see the updated picks from our best market beating strategies  From 2017 through 2018  while the S P 500 gained  15 8   five of our screens returned  38 0    61 3    61 6    68 1   and  98 3  This outperformance has not just been a recent phenomenon  From 2000   2018  while the S P averaged  4 8  per year  our top strategies averaged up to  56 2  per year ,2019-06-20,Zacks Investment Research,https://www.investing.com/analysis/alexandria-prices-upsized-public-offering-of-3850000-shares-200433760,200433760
24357,245872,LAMR,Innovative Industrial  IIPR  Acquires Property In Michigan,opinion,Innovative Industrial Properties   NYSE IIPR   has completed the acquisition of a Michigan property and entered into a long term  triple net lease agreement with an affiliate of Emerald Growth Partners Specifically  Innovative Industrial Properties shelled out  6 9 million  excluding transaction costs  for this property in Harrison  which comprises around 45 000 square feet of industrial space  The affiliate of Emerald Growth Partners will use the property as licensed medical use cannabis cultivation and processing facility following some redevelopment efforts Innovative Industrial Properties has also committed to provide up to approximately  3 1 million as reimbursement for the tenant improvements  resulting in its total investment in the property reaching around  10 million The expansion in Michigan is a strategic fit for Innovative Industrial Properties which is focused on cannabis centered real estate portfolio  This is because Michigan is one of the largest medical use cannabis markets in the United States  including around 270 000 medical use cannabis cardholders as of the end of 2017  per ArcView Market Research Also  last year  the state legalized adult use cannabis and according to ArcView projections  by 2022  Michigan is set emerge as one of the top 10 regulated cannabis markets  with total regulated cannabis sales of  1 4 billion Moreover  according to Innovative Industrial Properties  press release  Emerald Growth Partners obtained pre qualification status for comprehensive vertical incorporation by the Michigan Marijuana Regulatory Agency for four  Class C  cultivation licenses  one  Class A  cultivation license  one processor license  as well as 12 provisioning center licenses Amid these  the expansion of portfolio in the state and its lease with an affiliate of Emerald Growth Partners is expected to help Innovative Industrial Properties bank on the favorable trends and boost its top line Innovative Industrial Properties currently carries a Zacks Rank  3  Hold   In the year to date period  shares of the company have outperformed the   While the stock has surged 158 9   the industry has increased 21 8  during this period Stocks to ConsiderSome better ranked stocks from the real estate space include Duke Realty Corp    NYSE DRE    Lamar Advertising Company   NASDAQ LAMR   and PS Business Parks  Inc    NYSE PSB    each carrying a Zacks Rank of 2  Buy   at present  You can see  Duke Realty s Zacks Consensus Estimate for 2019 funds from operations  FFO  per share moved marginally north to  1 41 in the past two months Lamar s FFO per share estimates for the current year inched up 0 3  to  5 83 over the past month PS Business Parks  Zacks Consensus Estimate for the ongoing year s FFO per share moved up 1 5  to  6 71 in the past month Note  Anything related to earnings presented in this write up represents funds from operations  FFO    a widely used metric to gauge the performance of REITs More Stock News  This Is Bigger than the iPhone It could become the mother of all technological revolutions  Apple  NASDAQ AAPL  sold a mere 1 billion iPhones in 10 years but a new breakthrough is expected to generate more than 27 billion devices in just 3 years  creating a  1 7 trillion market Zacks has just released a Special Report that spotlights this fast emerging phenomenon and 6 tickers for taking advantage of it  If you don t buy now  you may kick yourself in 2020 ,2019-06-23,Zacks Investment Research,https://www.investing.com/analysis/innovative-industrial-iipr-acquires-property-in-michigan-200434128,200434128
24358,245873,LAMR,American Assets Trust Acquires San Diego s La Jolla Commons,opinion,"American Assets Trust   NYSE AAT   recently enhanced its portfolio with the acquisition of La Jolla Commons in San Diego  CA  The company has used cash on hand and funds from its existing credit facility to pay the purchase price of  525 million  less a seller credit of around  11 5 million Positioned in the University Town Center submarket  the property includes two trophy office towers  an entitled development parcel as well as two parking structures  Built in 2008 and 2014  respectively  the two office towers comprise a total 724 000 square feet of space Out of the two towers  the 421 000 square foot tower is fully leased to LPL Financial  The other tower  having approximately 303 000 square feet of space  is around 72  leased and its tenant roster has names like U S  Bank National Association  Thornton   Baird LLP  among others The above mentioned acquisition seems a strategic fit  This is because La Jolla Commons has a variety of high end destination dining  high scale retail and entertainment destinations in its proximity  Moreover  it has ready access to San Diego s main freeways  together with Mid Coast Trolley line  which is anticipated to be completed soon  Therefore  demand for space at this property is likely to be high American Assets Trust has an experience of more than 50 years in acquisition  development and management of premier retail  office  and residential properties in the nation  Its diversified asset base help in mitigating the risks associated with a single property type Additionally  the company s assets are located in high barrier to entry markets  mainly in Southern  NYSE SO  California  Northern California  Oregon  Washington and Hawaii  The solid demographics high population density and household income in its operating markets offer scope for decent growth  Nonetheless  strong competition and choppy retail real estate market are concerns for the company Currently  American Assets Trust carries a Zacks Rank  3  Hold   Shares of American Assets Trust have outperformed its  in the year to date period  gaining 18 2   while the industry increased 13  
Stocks to ConsiderSome better ranked stocks from the real estate space include Duke Realty Corp    NYSE DRE    Lamar Advertising Co    NASDAQ LAMR   and PS Business Parks  Inc    NYSE PSB    each carrying a Zacks Rank of 2  Buy   at present  You can see  Duke Realty s Zacks Consensus Estimate for 2019 funds from operations  FFO  per share moved marginally north to  1 41 in the past two months Lamar s FFO per share estimates for the current year inched up 0 3  to  5 83 over the past month PS Business Parks  Zacks Consensus Estimate for the ongoing year s FFO per share moved up 1 5  to  6 71 in the past month Note  Anything related to earnings presented in this write up represents funds from operations  FFO    a widely used metric to gauge the performance of REITs More Stock News  This Is Bigger than the iPhone It could become the mother of all technological revolutions  Apple  NASDAQ AAPL  sold a mere 1 billion iPhones in 10 years but a new breakthrough is expected to generate more than 27 billion devices in just 3 years  creating a  1 7 trillion market Zacks has just released a Special Report that spotlights this fast emerging phenomenon and 6 tickers for taking advantage of it  If you don t buy now  you may kick yourself in 2020 ",2019-06-24,Zacks Investment Research,https://www.investing.com/analysis/american-assets-trust-acquires-san-diegos-la-jolla-commons-200434268,200434268
24359,245874,LAMR,Is A Hold Strategy Appropriate For Ventas  VTR  Stock Now ,opinion,After a period of strategic dispositions and portfolio restructuring  Ventas Inc    NYSE VTR   is moving toward core portfolio stabilization and renewed growth  However  as the company s seniors housing segment remains under pressure  given the elevated level of new supply  near term earnings growth might be challenging The company recently announced a number of transaction activities  including the acquisition of Le Groupe Maurice for  1 8 billion  refinancing of the Colony Capital secured loan and development spend of  0 8 billion of four new developments  These transactions highlight the company s efforts to boost its portfolio and pursue growth opportunities across developments  buyouts and financings The company also outlined an encouraging five year  2019 2024  outlook to 5 7  of funds from operations  FFO  growth in its June 2019 Investor Day presentation  During the same time period  seniors housing operating portfolio s same store cash NOI growth is projected to be 4 6   while the core portfolio  consisting of research and innovation  medical office building and seniors housing triple net  same store cash NOI growth is expected to be 2 2 5  Additionally  the company has a robust external growth strategy in place that will strengthen its portfolio  In fact  management s five year plan outlines annual acquisition spend of  2 billion  at a blended cap rate of 6 5   However  this is lower than the  3 billion annual investments the company has completed since 2009  While strategic transaction and an encouraging outlook indicate Ventas  strength over the long term  near term headwinds remain concerns  Specifically  higher supply of seniors housing assets in certain markets is a concern for Ventas  This is because elevated supply curtails landlords  pricing power and limits growth in occupancy level Further  the initial drag from development spending is expected to weigh on its earnings  Additionally  the company s loan lending activities are viewed as lower quality source of income as compared to asset ownership and also lend higher bottom line volatility Lastly  Ventas operates in a cut throat market  and competes with national and local healthcare operators on a number of factors  including quality  price and range of services provided  reputation  location and demographics of the population in the surrounding area  as well as the financial condition of its tenants and operators  This impacts the company s pricing power Over the past three months  shares of this Zacks Rank  3  Hold  company have rallied 8 3   outperforming the  s growth of 7 5  Key PicksInvestors can also consider some better ranked stocks from the same space like Host Hotels   Resorts  Inc    NYSE HST    Lamar Advertising Company   NASDAQ LAMR   and PS Business Parks  Inc    NYSE PSB    carrying a Zacks Rank of 2  Buy   currently  You can see Host Hotels   Resorts  FFO per share estimates for 2019 moved marginally north to  1 82 over the past month Lamar Advertising s FFO per share estimates for the ongoing year have been revised slightly upward to  5 83 in 30 days  time PS Business Parks  current year FFO per share estimate moved up marginally to  6 71 in the past week More Stock News  This Is Bigger than the iPhone It could become the mother of all technological revolutions  Apple  NASDAQ AAPL  sold a mere 1 billion iPhones in 10 years but a new breakthrough is expected to generate more than 27 billion devices in just 3 years  creating a  1 7 trillion market Zacks has just released a Special Report that spotlights this fast emerging phenomenon and 6 tickers for taking advantage of it  If you don t buy now  you may kick yourself in 2020 ,2019-06-24,Zacks Investment Research,https://www.investing.com/analysis/is-a-hold-strategy-appropriate-for-ventas-vtr-stock-now-200434106,200434106
24360,245875,LAMR,Pebblebrook Executes Sale Contract Of Rouge Hotel For  42M,opinion,Pebblebrook Hotel Trust   NYSE PEB   recently executed a contract to sell Rouge Hotel in Washington  D C  for  42 million to a third party The sale of the 137 room hotel indicates an EBITDA multiple of 17 4x and net operating income  NOI  capitalization rate of 5   based on the property s operating performance in 2018 Further  the sale price reflects a 17 7x EBITDA multiple and NOI capitalization rate of 4 9   based on the trailing 12 month period ended March 2019  Notably  the NOI capitalization rate is after considering an assumed annual capital reserve of 4  of total hotel revenues This sale is estimated to close in third quarter 2019  Subsequent to the sale  Pebblebrook s estimated total net debt to trailing 12 month corporate EBITDA ratio will be around 4 6 times Additionally  early this June  the company executed a contract to dispose Hotel Amarano Burbank in Los Angeles  CA  for nearly  72 9 million to a third party These asset sales are part of the company s strategic disposition plan commenced on Nov 30  2018  Such dispositions will boost its portfolio s growth profile and aid the company to repay debt and reduce leverage ratio to a target of 4 4 25 times  In addition  Pebblebrook is reinvesting the sale proceeds for additional renovation and repositioning projects throughout its portfolio However  asset sales will likely result in near term earnings dilution  This may also impact near term profitability margins  Moreover  shares of the company have declined 3 8  over the past six months  underperforming the  s rally of 22   Short term disruption aside  the company s transition to new operators and timely execution of strategic changes will likely improve long term operating profitability and value creation for the company Pebblebrook currently carries a Zacks Rank  2  Buy   You can see Other Key PicksInvestors can also consider other top ranked stocks from the same space like Host Hotels   Resorts  Inc    NYSE HST    Lamar Advertising Company   NASDAQ LAMR   and PS Business Parks  Inc    NYSE PSB    carrying a Zacks Rank of 2  currently Host Hotels   Resorts  funds from operations  FFO  per share estimates for 2019 moved marginally north to  1 82 over the past two months Lamar Advertising s FFO per share estimates for the ongoing year have been revised slightly upward to  5 83 in 30 days  time PS Business Parks  current year FFO per share estimate moved up marginally to  6 71 in the past month Looking for Stocks with Skyrocketing Upside Zacks has just released a Special Report on the booming investment opportunities of legal marijuana Ignited by new referendums and legislation  this industry is expected to blast from an already robust  6 7 billion to  20 2 billion in 2021  Early investors stand to make a killing  but you have to be ready to act and know just where to look ,2019-06-25,Zacks Investment Research,https://www.investing.com/analysis/pebblebrook-executes-sale-contract-of-rouge-hotel-for-42m-200434404,200434404
24361,245876,LAMR,W  P  Carey  WPC  Registers Industrial Investments Worth  53M,opinion,W  P  Carey Inc    NYSE WPC   is making concerted efforts to enhance its position in the market and recently announced industrial investments worth  53 million  These include mission critical industrial properties that are triple net leased to tenants with solid private equity sponsorship With built in rent escalations and a weighted average lease term of 20 years  the investments seem a strategic fit for W  P  Carey  The asset class is experiencing high demand and the latest move reflects the company s ability to secure accretive transactions efficiently Specifically  the transactions included a  19 million sale leaseback of a 301 000 square foot warehouse and light manufacturing facility in Statesville  NC  Net leased to Founder Sport Group for 20 years with annual uncapped CPI rent raises  the property operates as Founder Sport Group s main fulfillment center in the United States as well as its corporate headquarters The other one is a  24 million sale leaseback of eight production facilities located across the United States and Mexico  Aggregating 525 000 square feet  these facilities are triple net leased for a period of 20 years  with annual rent escalations to a global manufacturer of electrical wire harnesses  control boxes and other value added components Moreover  there is a  10 million sale leaseback of two manufacturing and distribution facilities in Westerville  OH and North Wales  PA  Aggregating 147 000 square feet  the facilities are net leased to Integrated Warehouse Solutions which is a manufacturer of specialty heavy duty industrial material handling equipment and provides warehouse safety solutions as well With a high quality portfolio of critical corporate real estate  diversified net lease REIT  W  P  Carey will likely witness high occupancy  growing rent and healthy lease revenues in the near term  The company focuses on investing in high quality single tenant industrial  warehouse  offices and retail properties  which it leases back to creditworthy tenants on a long term basis  with built in rent escalators W  P  Carey currently carries a Zacks Rank  3  Hold   In the year to date period  shares of the company have outperformed the   While the stock has appreciated 31 1   the industry has increased 21 8  during this period Stocks to ConsiderSome better ranked stocks from the real estate space include Host Hotels   Resorts  Inc    NYSE HST    Lamar Advertising Company   NASDAQ LAMR   and PS Business Parks  Inc    NYSE PSB    each carrying a Zacks Rank of 2  Buy   at present  You can see  Host Hotels  Zacks Consensus Estimate for 2019 funds from operations  FFO  per share moved 2 8  north to  1 82 in the past two months Lamar s FFO per share estimates for the current year inched up 0 3  to  5 83 over the past month PS Business Parks  Zacks Consensus Estimate for the ongoing year s FFO per share moved up 1 5  to  6 71 in the past month Note  Anything related to earnings presented in this write up represents funds from operations  FFO    a widely used metric to gauge the performance of REITs Looking for Stocks with Skyrocketing Upside Zacks has just released a Special Report on the booming investment opportunities of legal marijuana Ignited by new referendums and legislation  this industry is expected to blast from an already robust  6 7 billion to  20 2 billion in 2021  Early investors stand to make a killing  but you have to be ready to act and know just where to look ,2019-06-25,Zacks Investment Research,https://www.investing.com/analysis/w-p-carey-wpc-registers-industrial-investments-worth-53m-200434403,200434403
