,id,ticker,title,category,content,date,provider,url,article_id
137703,359218,TMO,The Zacks Analyst Blog Highlights  AT T  Thermo Fisher  Schwab  Veeva And PVH,opinion,For Immediate ReleaseChicago  IL  September 4  2019   Zacks com announces the list of stocks featured in the Analyst Blog  Every day the Zacks Equity Research analysts discuss the latest news and events impacting stocks and the financial markets  Stocks recently featured in the blog include  AT T   NYSE T    Thermo Fisher   NYSE T    Schwab   NYSE SCHW    Veeva Systems   NYSE VEEV   and PVH Corp    NYSE PVH   Here are highlights from Tuesday s Analyst Blog Top Stock Reports for AT T  Thermo Fisher and SchwabThe Zacks Research Daily presents the best research output of our analyst team  Today s Research Daily features updated research reports on 16 major stocks  including AT T  Thermo Fisher and Schwab  These research reports have been hand picked from roughly 70 reports published by our analyst team today You can see AT T s shares have gained  10 7  over the past year  outperforming the Zacks Wireless National industry s increase of  7 7   AT T is improving critical services that support Public Safety and first responders using the FirstNet communications platform The wireless carrier s LTE network reaches more than 400 million people in North America  It aims to deploy a standards based  nationwide mobile 5G network in early 2020  AT T s 5G Evolution technology is live in more than 200 markets  and is expected to reach more than 400 markets by the end of 2019  It is on track to achieve its target of 2 5x debt to EBITDA range by 2019 However  the Zacks analyst thinks the company is witnessing a steady decline in linear TV subscribers and legacy services  Its wireline division is facing loss in access line due to competitive pressure from Voice over Internet Protocol service providers  As the company tries to woo customers with discounts  freebies and cash credits  margin pressures tend to soar  You can   Shares of Thermo Fisher have outperformed the Zacks Medical Instruments industry in the past three months   7 1  vs   5 6    The Zacks analyst thinks Thermo Fisher has recently been demonstrating strength in all end markets categorized by customer type or geography  In the second quarter  the company registered solid international performance with growth in Europe and Asia Pacific including China A series of product launches aided its performance  The company s recent purchase of Brammer Bio in the field of Gene and Cell Therapy is a major positive  Thermo Fisher s Specialty Diagnostics business  even in the face of the divestment of its anatomical pathology unit  holds immense potential The company s raised 2019 guidance looks encouraging  On the flip side  Thermo Fisher s operating segments are getting impacted by unfavorable business mix  Competitive headwinds and escalating costs pose threat  You can   Schwab s shares have underperformed the Zacks Investment Brokers industry over the past six months  declining  16 2  vs   7 5   However  the Zacks analyst thinks the company has a decent earnings surprise history  Its earnings have surpassed expectations in three of the trailing four quarters The company s planned acquisition of USAA s Investment Management Company  efforts to strengthen trading business and improvement in operating efficiency bode well for the future  Additionally  the company s steady capital deployment actions are commendable and are expected to continue to enhance shareholder value Nevertheless  a dismal rate scenario remains a major concern for the company and will likely hamper margin and top line growth in the upcoming quarters  Rising operating expenses  mainly related to compensation costs and regulatory charges  are likely to hurt bottom line growth to some extent  You can   Other noteworthy reports we are featuring today include Veeva Systems and PVH Corp Legalizing THIS Could Be Even Bigger than MarijuanaAmericans spend an estimated  150 billion in this industry every year  more than twice as much as they spend on marijuana Now that 8 states have fully legalized it  with several more states following close behind   Zacks has identified 5 stocks that could soar in response to the powerful demand  One industry insider described the future as  mind blowing    and early investors can still get in ahead of the surge Media ContactZacks Investment Research800 767 3771 ext  9339 Past performance is no guarantee of future results  Inherent in any investment is the potential for loss  This material is being provided for informational purposes only and nothing herein constitutes investment  legal  accounting or tax advice  or a recommendation to buy  sell or hold a security  No recommendation or advice is being given as to whether any investment is suitable for a particular investor  It should not be assumed that any investments in securities  companies  sectors or markets identified and described were or will be profitable  All information is current as of the date of herein and is subject to change without notice  Any views or opinions expressed may not reflect those of the firm as a whole  Zacks Investment Research does not engage in investment banking  market making or asset management activities of any securities  These returns are from hypothetical portfolios consisting of stocks with Zacks Rank   1 that were rebalanced monthly with zero transaction costs  These are not the returns of actual portfolios of stocks  The S P 500 is an unmanaged index  Visit  for information about the performance numbers displayed in this press release ,2019-09-03,Zacks Investment Research,https://www.investing.com/analysis/the-zacks-analyst-blog-highlights-att-thermo-fisher-schwab-veeva-and-pvh-200461406,200461406
137730,359245,TMO,Atlassian  TEAM  To Report Q4 Earnings  What s In The Cards ,opinion,Atlassian Corporation Plc   NASDAQ TEAM   is scheduled to report fourth quarter fiscal 2019 results on Jul 25 Notably  the company s earnings surpassed the Zacks Consensus Estimate in each of the trailing four quarters  the average being 12 33  In the last reported quarter  the company s earnings per share of 21 cents beat the Zacks Consensus Estimate of 18 cents and were also much higher than 9 cents reported in the year ago period Moreover  Atlassian s revenues surged 38  year over year to  309 3 million and surpassed the Zacks Consensus Estimate of  304 million as well Outlook and Estimates for Q4For the fiscal fourth quarter  Atlassian anticipates revenues of  329  331 million  The Zacks Consensus Estimate is pegged at  330 1 million  up 35 6  from the year ago reported figure On a non IFRS basis  International Financial Reporting Standards   the company expects earnings per share to be 16 cents  indicating a 23 1  rise from the prior year reported number Atlassian Corporation PLC Price and EPS Surprise   Let s see  how things are shaping up prior to this announcement Factors to ConsiderAtlassian s fourth quarter fiscal 2019 results are likely to benefit from solid customer wins on the back of a diverse product portfolio Notably  the company added more than 5 800 net customers during the last reported quarter  which took the total customer count to 144 038 Robust growth in the subscription revenues  aided by higher uptake of the company s cloud service offerings or the data center suite  will remain a key driver in the fiscal fourth quarter  In the last reported quarter  the metric soared 57  year over year Healthy demand for core products like Jira and Confluence coupled with the growing adoption of new products like Jira Service Desk  Jira Ops and Bitbucket is expected to remain a tailwind  Moreover  the launch of premium versions of Jira Software and Confluence in the cloud coupled with the addition of cloud features is an upside for the quarter to be reported The company envisions the acquisition of AgileCraft to boost its top line in the June quarter However  the AgileCraft buyout expenses and increasing investments in research and development are likely to hurt the operating margins in the to be reported quarter What Our Model Says The proven Zacks model shows that a company with a Zacks Rank  1  Strong Buy   2  Buy  or 3  Hold  has maximum chances of beating estimates if it also has a positive   Zacks Rank  4  Sell  or 5  Strong Sell  stocks are best avoided  You can uncover the best stocks to buy or sell before they re reported with our Atlassian currently carries a Zacks Rank  2  which increases the predictive power of ESP  However  its Earnings ESP of 0 00  in the combination makes surprise prediction difficult for the stock this time around Stocks to ConsiderHere are some stocks worth considering as our model shows that these have the right combination of elements to beat on earnings in their upcoming releases Helix Energy Solutions Group  Inc    NYSE HLX   has an Earnings ESP of  15 66  and a Zacks Rank of 1  You can see  CGI Group  Inc    NYSE GIB   has an Earnings ESP of  1 27  and a Zacks Rank of 2 Thermo Fisher Scientific Inc    NYSE TMO   has an Earnings ESP of  0 54  and is a Zacks  2 Ranked player Breakout Biotech Stocks with Triple Digit Profit PotentialThe biotech sector is projected to surge beyond  775 billion by 2024 as scientists develop treatments for thousands of diseases  They re also finding ways to edit the human genome to literally erase our vulnerability to these diseases Zacks has just released Century of Biology  7 Biotech Stocks to Buy Right Now to help investors profit from 7 stocks poised for outperformance  Our recent biotech recommendations have produced gains of  98    119  and  164  in as little as 1 month  The stocks in this report could perform even better ,2019-07-21,Zacks Investment Research,https://www.investing.com/analysis/atlassian-team-to-report-q4-earnings-whats-in-the-cards-200442652,200442652
137731,359246,TMO,What s In Store For STMicroelectronics   STM  Q2 Earnings ,opinion,"STMicroelectronics N V    NYSE STM   is slated to report second quarter 2019 results on Jul 25 Notably  the company topped the Zacks Consensus Estimate in two of the trailing four quarters  delivering average positive surprise of 1 82  In the last reported quarter  STMicroelectronics reported non GAAP earnings of 20 cents per share  which missed the Zacks Consensus Estimate by a penny First quarter net revenues also decreased 6 7  year over year to  2 1 billion due to weakness in analog  MEMS and sensors group For the second quarter  the company expects net revenues to increase approximately 2 4  and gross margin to grow about 38 5  on a sequential basis Let s see how things are shaping up prior to the earnings announcement 
STMicroelectronics N V  Price and EPS Surprise
    Factors to ConsiderIn the to be reported quarter  the company s well performing products are likely to have aided its performance across all end markets served  Moreover  the company s higher value products will likely contribute to top line growth in the quarter For the second quarter  STMicroelectronics remains optimistic about strong momentum across industrial  automotive and personal electronics markets  thanks to growing demand for smartphone applications The company has been witnessing growing contract wins in areas of braking  body control and engine management  This is expected to help STMicroelectronics to sustain momentum in the automotive market In the soon to be reported quarter  the company s robust microcontrollers  sensors  power  analog and other connectivity products will likely aid the top line in the industrial market The increasing usage of electronic applications in cars  especially smart cars and autonomous vehicles  remains a positive for the company s growth in the automotive market  STMicroelectronics  expanding design wins for silicon carbide products will likely be a majordriver of top line growth in this particular market ConcernsWeak pricing power pressure on the chip market  especially for the NAND flash memory  and increasing levels of inventory continue to be overhangs The ongoing trade tension regarding tariffs between the United States and China  and growing U S  protectionism are major headwinds that have been raising volatility in the semiconductor market These pose a challenge to the upcoming quarterly results What Our Model SaysAccording to the Zacks model  a company with a Zacks Rank  1  Strong Buy   2  Buy  or 3  Hold  has good chance of beating estimates if it also has a positive   The Sell rated stocks  Zacks Rank  4 or 5  are best avoided  You can uncover the best stocks to buy or sell before they re reported with our  STMicroelectronics currently has a Zacks Rank  3 and an Earnings ESP of 0 00   making surprise prediction difficult Stocks That Warrant a LookHere are a couple of stocks that you may want to consider  as our model shows that these have the right combination of elements to post a positive earnings surprise in the quarter to be reported Amazon com  Inc    NASDAQ AMZN   has an Earnings ESP of  15 56  and carries a Zacks Rank  1  You can see Facebook  Inc    NASDAQ FB   has an Earnings ESP of  0 61  and a Zacks Rank  2 Thermo Fisher Scientific Inc    NYSE TMO   has an Earnings ESP of  0 54  and holds a Zacks Rank  2 Breakout Biotech Stocks with Triple Digit Profit PotentialThe biotech sector is projected to surge beyond  775 billion by 2024 as scientists develop treatments for thousands of diseases  They re also finding ways to edit the human genome to literally erase our vulnerability to these diseases Zacks has just released Century of Biology  7 Biotech Stocks to Buy Right Now to help investors profit from 7 stocks poised for outperformance  Our recent biotech recommendations have produced gains of  98    119  and  164  in as little as 1 month  The stocks in this report could perform even better ",2019-07-22,Zacks Investment Research,https://www.investing.com/analysis/whats-in-store-for-stmicroelectronics-stm-q2-earnings-200442539,200442539
137732,359247,TMO,Fortive  FTV  Gears Up For Q2 Earnings  What s In The Cards ,opinion,Fortive Corporation   NYSE FTV   is slated to report second quarter 2019 results on Jul 25 The company topped the Zacks Consensus Estimate in three of the trailing four quarters  recording average positive surprise of 1 82  In the last reported quarter  Fortive delivered a positive earnings surprise of 1 47   First quarter earnings of 69 cents per share decreased 11 5  from the year ago period Robust product portfolio  solid momentum across all its platforms and benefits from acquisitions are likely to drive the upcoming results  However  end market cyclicality and higher expenses might impact earnings For second quarter 2019  Fortive anticipates adjusted net earnings between 86 cents and 90 cents per share  The Zacks Consensus Estimate for earnings per share is pegged at 89 cents Further  the Zacks Consensus Estimate for revenues is pegged at  1 93 billion Let s see how things are shaping up for the upcoming quarterly results Fortive Corporation Price and EPS Surprise    Acquisitions   Portfolio Strength   Key CatalystsFortive s strong endeavors toward innovation and expansion of key offerings on the back of strong and accretive acquisitions will likely drive top line growth in the quarter to be reported During the second quarter  the company completed the acquisition of Advanced Sterilization Products   ASP   from Johnson   Johnson s  JNJ  subsidiary  Ethicon  Inc   for approximately  2 7 billion  The ASP deal should help the company to expand its product portfolio and aid the upcoming results Also  the company s acquisitions of eMaint  Orpak  Landauer and Industrial Scientific  which aided the expansion of Fortive s product portfolio  are expected to drive core revenues in the to be reported quarter However  higher expenses incurred on these acquisitions and integration issues may impact the upcoming quarterly results The Zacks Consensus Estimate for revenues from Professional Instrumentation and Industrial Technologies segments for the to be reported quarter is pegged at  1 2 billion and  734 million  respectively What Our Model SaysAccording to the Zacks model  a company with a Zacks Rank  1  Strong Buy   2  Buy  or 3  Hold  along with a positive  has a good chance of beating estimates  The Sell rated stocks  Zacks Rank  4 or 5  are best avoided  You can uncover the best stocks to buy or sell before they re reported with our  Fortive currently has a Zacks Rank  4 and an Earnings ESP of  0 64   Hence  our proven model indicates that the company is unlikely to beat estimates in the second quarter Stocks That Warrant a LookHere are a few stocks worth considering as our model shows that these have the right combination of elements to deliver an earnings beat in the upcoming releases Amazon com  Inc    NASDAQ AMZN   has an Earnings ESP of  15 56  and carries a Zacks Rank  3  You can see Facebook  Inc    NASDAQ FB   has an Earnings ESP of  0 61  and a Zacks Rank  2 Thermo Fisher Scientific Inc    NYSE TMO   has an Earnings ESP of  0 54  and holds a Zacks Rank  3 Today s Best Stocks from ZacksWould you like to see the updated picks from our best market beating strategies  From 2017 through 2018  while the S P 500 gained  15 8   five of our screens returned  38 0    61 3    61 6    68 1   and  98 3  This outperformance has not just been a recent phenomenon  From 2000   2018  while the S P averaged  4 8  per year  our top strategies averaged up to  56 2  per year ,2019-07-23,Zacks Investment Research,https://www.investing.com/analysis/fortive-ftv-gears-up-for-q2-earnings-whats-in-the-cards-200442983,200442983
137733,359248,TMO,What To Expect From Cypress Semiconductor s  CY  Q2 Earnings,opinion,Cypress Semiconductor Corporation   NASDAQ CY   is slated to release second quarter 2019 results on Jul 25 Notably  the company surpassed the Zacks Consensus Estimate in each of the trailing four quarters  with the average being 9 40  In the last reported quarter  its earnings and revenues surpassed the respective Zacks Consensus Estimate For the second quarter  Cypress Semiconductor anticipates revenues in the range of  515  545 million  The Zacks Consensus Estimate for revenues is pegged at  531 9 million Non GAAP earnings for the quarter are anticipated in the range of 22 26 cents  The Zacks Consensus Estimate for the same is pegged at 24 cents The company anticipates non GAAP gross margin between 47  and 47 5  Let s see how things are shaping up prior to this announcement Cypress Semiconductor Corporation Price and EPS Surprise    Factors to ConsiderCypress Semiconductor s strength in the industrial and automotive segment  as well as expanding presence in the IoT market   driven by acquisitions  product launches and consistent execution   are anticipated to boost the top line in the to be reported quarter Improving demand from industrial and Internet infrastructure  especially 4 5G and 5G customers  for the company s flash memory products is likely to keep up the momentum in the Memory Products Division  MPD  The Zacks Consensus Estimate for MPD revenues is pegged at  199 million Growth in the microcontroller business and strong demand for PSoC products are expected to be tailwinds for the Microcontroller and Connectivity Division  MCD  business in the quarter to be reported  However  slowdown across various MCD business units may impact this business unit The Zacks Consensus Estimate for MCD revenues is currently pegged at  334 million Softness in the consumer end market and sluggishness in the MCD business are concerns for its upcoming results  Further  the ongoing trade tension between the United States and China is an overhang What Our Model SaysAccording to the Zacks model  a company with a Zacks Rank  1  Strong Buy   2  Buy  or 3  Hold  has a good chance of beating estimates if it also has a positive   Zacks Rank  4 or 5  Sell rated  stocks are best avoided  You can uncover the best stocks to buy or sell before they re reported with our  Cypress has an Earnings ESP of 0 00  and carries a Zacks Rank  3  which makes surprise prediction difficult Stocks That Warrant a LookYou may consider the following stocks with a positive Earnings ESP and a favorable Zacks Rank Amazon com  Inc    NASDAQ AMZN   has an Earnings ESP of  15 56  and carries a Zacks Rank  3  You can see Facebook  Inc    NASDAQ FB   has an Earnings ESP of  0 61  and a Zacks Rank  2 Thermo Fisher Scientific Inc    NYSE TMO   has an Earnings ESP of  0 54  and holds a Zacks Rank  3 Today s Best Stocks from ZacksWould you like to see the updated picks from our best market beating strategies  From 2017 through 2018  while the S P 500 gained  15 8   five of our screens returned  38 0    61 3    61 6    68 1   and  98 3  This outperformance has not just been a recent phenomenon  From 2000   2018  while the S P averaged  4 8  per year  our top strategies averaged up to  56 2  per year ,2019-07-23,Zacks Investment Research,https://www.investing.com/analysis/what-to-expect-from-cypress-semiconductors-cy-q2-earnings-200442981,200442981
