,id,ticker,title,category,content,date,provider,url,article_id
3742,225257,BOSC,U S  stocks mixed at close of trade  Dow Jones Industrial Average down 0 48 ,news,"Investing com   U S  stocks were mixed after the close on Tuesday  as gains in the Utilities  Telecoms and Technology sectors led shares higher while losses in the Oil   Gas  Basic Materials and Consumer Goods sectors led shares lower 
At the close in NYSE  the Dow Jones Industrial Average lost 0 48   while the S P 500 index declined 0 10   and the NASDAQ Composite index climbed 0 29  
The best performers of the session on the Dow Jones Industrial Average were Microsoft Corporation  NASDAQ MSFT   which rose 1 30  or 0 68 points to trade at 53 00 at the close  Meanwhile   Caterpillar  Inc  NYSE CAT  added 0 76  or 0 55 points to end at 72 51 and International Business Machines  NYSE IBM  was up 0 59  or 0 90 points to 153 74 in late trade 
The worst performers of the session were EI du Pont de Nemours and Company  NYSE DD   which fell 2 62  or 1 76 points to trade at 65 41 at the close  Boeing Company  NYSE BA  declined 2 38  or 3 07 points to end at 126 15 and  Nike  Inc  NYSE NKE  was down 1 73  or 0 97 points to 55 22 
The top performers on the S P 500 were Southwestern Energy Company  NYSE SWN  which rose 4 67  to 13 67  Seagate Technology PLC  NASDAQ STX  which was up 4 16  to settle at 22 56 and  Western Digital  Corporation  NASDAQ WDC  which gained 3 45  to close at 46 54 
The worst performers were Coca Cola Enterprises Inc  NYSE CCE  which was down 24 68  to 38 83 in late trade  Constellation Brands Inc  NYSE STZ  which lost 2 97  to settle at 153 15 and EI du Pont de Nemours and Company  NYSE DD  which was down 2 62  to 65 41 at the close 
The top performers on the NASDAQ Composite were BOS Better Online Solutions  NASDAQ BOSC  which rose 87 56  to 4 070   Celator Pharm   NASDAQ CPXX  which was up 71 59  to settle at 30 08 and Immune Pharmaceuticals Inc  NASDAQ IMNP  which gained 57 14  to close at 0 3300 
The worst performers were  StemCells  Inc  NASDAQ STEM  which was down 81 19  to 0 5700 in late trade   Paragon Shipping Inc   NASDAQ PRGN  which lost 18 49  to settle at 0 7499 and Sears Canada Inc  NASDAQ SRSC  which was down 16 37  to 2 810 at the close 
Rising stocks outnumbered declining ones on the New York Stock Exchange by 1780 to 1541 and 34 ended unchanged  on the Nasdaq Stock Exchange  1430 rose and 1142 declined  while 65 ended unchanged 
Shares in Coca Cola Enterprises Inc  NYSE CCE  fell to 52 week lows  down 24 68  or 12 72 to 38 83  Shares in BOS Better Online Solutions  NASDAQ BOSC  rose to 52 week highs  gaining 87 56  or 1 900 to 4 070  Shares in StemCells Inc  NASDAQ STEM  fell to all time lows  losing 81 19  or 2 4600 to 0 5700  Shares in Celator Pharm  NASDAQ CPXX  rose to all time highs  up 71 59  or 12 55 to 30 08  
The CBOE Volatility Index  which measures the implied volatility of S P 500 options  was up 9 15  to 14 32 
Gold for August delivery was up 0 07  or 0 80 to  1217 50 a troy ounce  Elsewhere in commodities trading  Crude oil for delivery in July fell 0 83  or 0 41 to hit  48 92 a barrel  while the August Brent oil contract fell 1 41  or 0 71 to trade at  49 65 a barrel 
EUR USD was down 0 08  to 1 1130  while USD JPY fell 0 38  to 110 70 
The US Dollar Index was up 0 11  at 95 83 ",2016-05-31,Investing.com,https://www.investing.com/news/stock-market-news/u.s.-stocks-mixed-at-close-of-trade;-dow-jones-industrial-average-down-0.48-405616,405616
3743,225258,BOSC,U S  stocks higher at close of trade  Dow Jones Industrial Average up 0 01 ,news,"Investing com   U S  stocks were higher after the close on Wednesday  as gains in the Basic Materials  Healthcare and Utilities sectors led shares higher 
At the close in NYSE  the Dow Jones Industrial Average gained 0 01   while the S P 500 index climbed 0 11   and the NASDAQ Composite index climbed 0 08  
The best performers of the session on the Dow Jones Industrial Average were EI du Pont de Nemours and Company  NYSE DD   which rose 1 51  or 0 99 points to trade at 66 40 at the close  Meanwhile  Procter   Gamble Company  NYSE PG  added 0 93  or 0 75 points to end at 81 79 and JPMorgan Chase   Co  NYSE JPM  was up 0 64  or 0 42 points to 65 69 in late trade 
The worst performers of the session were Apple Inc  NASDAQ AAPL   which fell 1 40  or 1 40 points to trade at 98 46 at the close   Verizon Communications  Inc  NYSE VZ  declined 0 92  or 0 47 points to end at 50 43 and International Business Machines  NYSE IBM  was down 0 80  or 1 23 points to 152 51 
The top performers on the S P 500 were  Michael Kors Holdings  Limited  NYSE KORS  which rose 6 59  to 45 55  Endo International PLC  NASDAQ ENDP  which was up 5 12  to settle at 16 62 and Whole Foods Market Inc  NASDAQ WFM  which gained 4 92  to close at 33 94 
The worst performers were Freeport McMoran Copper   Gold Inc  NYSE FCX  which was down 4 33  to 10 60 in late trade  Equity Residential  NYSE EQR  which lost 4 10  to settle at 66 37 and  Under Armour  Inc  NYSE UA  which was down 3 92  to 36 25 at the close 
The top performers on the NASDAQ Composite were Ocean Power Technologies Inc  NASDAQ OPTT  which rose 294 77  to 6 040  SemiLEDS Corporation  NASDAQ LEDS  which was up 69 06  to settle at 2 3500 and  Hercules Offshore Inc   NASDAQ HERO  which gained 37 72  to close at 1 5700 
The worst performers were  Daktronics  Inc  NASDAQ DAKT  which was down 19 57  to 6 41 in late trade   Cymabay Therapeu   NASDAQ CBAY  which lost 18 85  to settle at 1 980 and BOS Better Online Solutions  NASDAQ BOSC  which was down 17 94  to 3 340 at the close 
Rising stocks outnumbered declining ones on the New York Stock Exchange by 2162 to 1143 and 36 ended unchanged  on the Nasdaq Stock Exchange  1597 rose and 969 declined  while 65 ended unchanged 
Shares in Daktronics Inc  NASDAQ DAKT  fell to 3 years lows  losing 19 57  or 1 56 to 6 41  
The CBOE Volatility Index  which measures the implied volatility of S P 500 options  was up 0 07  to 14 19 
Gold for August delivery was down 0 23  or 2 75 to  1214 75 a troy ounce  Elsewhere in commodities trading  Crude oil for delivery in July rose 0 20  or 0 10 to hit  49 20 a barrel  while the August Brent oil contract rose 0 06  or 0 03 to trade at  49 92 a barrel 
EUR USD was up 0 50  to 1 1188  while USD JPY fell 1 05  to 109 54 
The US Dollar Index was down 0 44  at 95 41 ",2016-06-01,Investing.com,https://www.investing.com/news/stock-market-news/u.s.-stocks-higher-at-close-of-trade;-dow-jones-industrial-average-up-0.01-405926,405926
3744,225259,BOSC,B O S  Better Online reports Q3 results,news,B O S  Better Online  NASDAQ BOSC   Q3 EPS of  0 04Revenue of  7 2M   14 3  Y Y Press ReleaseNow read ,2017-11-30,Seeking Alpha,https://www.investing.com/news/stock-market-news/bos-better-online-reports-q3-results-932518,932518
3745,225260,BOSC,Midday Gainers   Losers  08 21 2018 ,news,Gainers  TAT  21   KOSS  21   UXIN  18   LLEX  17   AGFS  16   AGEN  16   RNN  16   BLFS  15   PINC  15   GSB  15   Losers  SEAC  42   NEWA  38   SITO  17   GRIN  13   COCP  12   DAKT  10   COTY  10   BOSC  10   ALRN  10   MOXC  9   Now read ,2018-08-21,Seeking Alpha,https://www.investing.com/news/stock-market-news/midday-gainers--losers-08212018-1582078,1582078
3746,225261,BOSC,U S  stocks mixed at close of trade  Dow Jones Industrial Average down 0 38 ,news,"Investing com   U S  stocks were mixed after the close on Tuesday  as gains in the Oil   Gas  Healthcare and Technology sectors led shares higher while losses in the Industrials  Consumer Goods and Consumer Services sectors led shares lower 
At the close in NYSE  the Dow Jones Industrial Average declined 0 38   while the S P 500 index climbed 0 30   and the NASDAQ Composite index climbed 0 44  
The best performers of the session on the Dow Jones Industrial Average were UnitedHealth Group Incorporated  NYSE UNH   which rose 1 12  or 2 73 points to trade at 245 88 at the close  Meanwhile  Apple Inc  NASDAQ AAPL  added 1 12  or 2 01 points to end at 180 91 and  Home Depot  Inc  NYSE HD  was up 0 86  or 1 56 points to 184 00 in late trade 
The worst performers of the session were  Boeing Co   NYSE BA   which fell 6 15  or 24 60 points to trade at 375 41 at the close  United Technologies Corporation  NYSE UTX  declined 1 06  or 1 34 points to end at 124 67 and 3M Company  NYSE MMM  was down 0 63  or 1 30 points to 205 80 
The top performers on the S P 500 were Range Resources Corporation  NYSE RRC  which rose 5 48  to 10 39   EQT Corporation   NYSE EQT  which was up 5 08  to settle at 19 65 and Chesapeake Energy Corporation  NYSE CHK  which gained 4 73  to close at 2 880 
The worst performers were  F5 Networks Inc   NASDAQ FFIV  which was down 7 67  to 149 65 in late trade  Boeing Co  NYSE BA  which lost 6 15  to settle at 375 41 and  American Airlines Group   NASDAQ AAL  which was down 3 53  to 30 92 at the close 
The top performers on the NASDAQ Composite were  VivoPower International PLC   NASDAQ VVPR  which rose 126 50  to 2 65   Aileron Therapeutics Inc   NASDAQ ALRN  which was up 51 43  to settle at 2 12 and  ENDRA Life Sciences  Inc  NASDAQ NDRA  which gained 38 95  to close at 2 640 
The worst performers were  Zafgen Inc   NASDAQ ZFGN  which was down 37 17  to 2 89 in late trade   Castor Maritime  Inc  NASDAQ CTRM  which lost 30 00  to settle at 6 3000 and BOS Better Online Solutions  NASDAQ BOSC  which was down 20 30  to 3 140 at the close 
Rising stocks outnumbered declining ones on the New York Stock Exchange by 1746 to 1229 and 126 ended unchanged  on the Nasdaq Stock Exchange  1340 fell and 1262 advanced  while 111 ended unchanged 
Shares in Zafgen Inc  NASDAQ ZFGN  fell to all time lows  down 37 17  or 1 71 to 2 89  
The CBOE Volatility Index  which measures the implied volatility of S P 500 options  was down 3 91  to 13 77 
Gold Futures for April delivery was up 0 84  or 10 85 to  1301 95 a troy ounce  Elsewhere in commodities trading  Crude oil for delivery in April rose 0 26  or 0 15 to hit  56 94 a barrel  while the May Brent oil contract rose 0 17  or 0 11 to trade at  66 69 a barrel 
EUR USD was up 0 44  to 1 1296  while USD JPY rose 0 09  to 111 28 
The US Dollar Index Futures was down 0 26  at 96 917 ",2019-03-12,Investing.com,https://www.investing.com/news/stock-market-news/us-stocks-mixed-at-close-of-trade-dow-jones-industrial-average-down-038-1805389,1805389
