,id,ticker,title,category,content,date,provider,url,article_id
34567,256082,MIDD,Industrial Stocks Q2 Earnings Due On Aug 9  MIDD  WBT   SITE ,opinion,"The Q2 earnings season is in its last leg  with only 16  of the S P 500 members left to report their quarterly figures Our latest  reconfirms broad based expectations of better than expected results in the reporting cycle  As of Aug 4  420 S P 500 companies have released earnings  accounting for 86 7  of the index s total market capitalization  with 74 3  topping earnings per share estimates and 68 3  coming in ahead of top line expectations As of Aug 4  roughly 91 7  of the Industrial stocks in the S P 500 Group have reported results for this quarter  recording 19 3  rise in earnings and 14 9  upside in revenues on a year over year basis We believe that improved job market picture  upbeat consumer confidence  recovery of U S  housing market scenario  improving oil prices and growth friendly policies of the new U S  administration will bolster industrial spending and hence improve performance of industrial stocks  moving ahead What s in the Cards for these 3 Industrial Stocks The Middleby Corporation   NASDAQ MIDD   is scheduled to report second quarter 2017 results  after the market closes  The company s average positive earnings surprise for the last four quarters is 13 39   However  our proven model does not conclusively show that Middleby will likely beat estimates in this quarter  That is because a stock needs to have both a positive  and a Zacks Rank  1  Strong Buy   2  Buy  or at least 3  Hold  for an earnings beat You can uncover the best stocks to buy or sell before they re reported with our  That is not the case here as we will see below Middleby s Earnings ESP is  0 73   as the Most Accurate estimate of  1 37 per share comes below the Zacks Consensus Estimate of  1 38  
The Middleby Corporation Price and EPS Surprise
    Though the company carries a favorable Zacks Rank  3  we also need to have a positive ESP to be confident of an earnings beat  Notably  the quarterly estimate remained unchanged over the last seven days You can see  Welbilt  Inc    NYSE WBT   is scheduled to report quarterly numbers  after the market closes  The company witnessed an average negative earnings surprise of 8 31  over the trailing four quarters  Also  our proven model does not conclusively show that Welbilt will likely beat on earnings in the quarter The company carries a Zacks Rank  3  but an Earnings ESP of 0 00  makes surprise prediction inconclusive  The stock s Most Accurate estimate of 18 cents is in line with the Zacks Consensus Estimate  Notably  there has been no change in the quarterly estimate over the last seven days SiteOne Landscape Supply  Inc    NYSE SITE   is slated to report quarterly figures  before the market opens  The company recorded an average negative earnings surprise of 139 67  over the last four quarters  Our proven model does not conclusively show that the company will likely beat estimates this quarter SiteOne Landscape Supply carries a Zacks Rank  3  but an Earnings ESP of 0 00  makes surprise prediction inconclusive  The stock s Most Accurate estimate of  1 09 per share is in line with the Zacks Consensus Estimate SiteOne Landscape Supply  Inc  Price and EPS Surprise
    Notably  the quarterly estimate remained unchanged over the last seven days Looking for Stocks with Skyrocketing Upside Zacks has just released a Special Report on the booming investment opportunities of legal marijuana Ignited by new referendums and legislation  this industry is expected to blast from an already robust  6 7 billion to  20 2 billion in 2021  Early investors stand to make a killing  but you have to be ready to act and know just where to look ",2017-08-08,Zacks Investment Research,https://www.investing.com/analysis/industrial-stocks-q2-earnings-due-on-aug-9-midd-wbt--site-200206000,200206000
34593,256108,MIDD,Emerson  EMR  Q2 Earnings In Line  Guidance Raised Again,opinion,Emerson Electric Co    NYSE EMR   reported second quarter fiscal 2017 adjusted earnings of 58 cents per share  in line with the Zacks Consensus Estimate  Notably  the figure reflected growth of 2  year over year An improving macro environment  restructuring benefits and lower expenses boosted the bottom line Inside the HeadlinesNet sales remained flat year over year at  3 574 million  on both a net and underlying basis  Revenues surpassed the Zacks Consensus Estimate of  3 489 million  Underlying sales growth for the quarter was down 3  and currency translation also affected the top line adversely  Consistent improvement in key end markets and growth in the U S   Europe and Asia drove sales  However  challenging macroeconomic conditions and significant decline in spending by global customers in the oil   gas and industrial markets hurt the top line performance  resulting in flat growth The company s Automation Solutions platform reported a 3  year over year decline in net sales to  2 117 million  Underlying sales also dipped 3  as restrained spending in energy related and general industrial markets hurt operations  Underlying sales in North America declined 2   while Asia was also down 2   Europe was flat  while Latin America and Middle East Africa were down 16  and 9  respectively Despite soft spending by the oil and gas clients  MRO activity levels in energy related markets are gathering momentum  particularly in North America  driven by shale and downstream customers  Power and life sciences markets also remained favorable Margins contracted 10 basis points to 15 5   primarily due to deleverage on lower volume  In light of current and expected order trends  the company anticipates the second half of the fiscal year to gain momentum  driven by MRO and small project activity In contrast  the Commercial   Residential Solutions platform witnessed a 5  increase in net sales to  1 460 million  supported by robust demand in global HVAC and refrigeration markets  and encouraging conditions in construction related markets  Asia witnessed particularly strong growth as it rose 13  year over year  driven by 20  growth in China  which is enjoying major demand acceleration  Europe was up 6  led by solid growth in air conditioning and professional construction tools  while North America grew 4   stemmed by growth in the U S  residential and commercial air conditioning Latin America went up 7   while Middle East Africa was down 3  Under the platform  the Climate Technologies business grew 6 5  year over year to  1 058 million  while Tools   Home Products unit grew 2  year over year at  402 million Margins expanded 80 basis points to 23 7   largely due to savings from restructuring actions across the new platform structure and leverage on higher volume Emerson Electric Company Price  Consensus and EPS Surprise   Other DevelopmentsDuring the reported quarter  the company completed the acquisition of Pentair Valves   Controls  a business unit of Pentair plc  for  3 15 billion  in order to drive efficiency and growth Integrating Pentair s Valves   Controls business will enable Emerson to fortify its automation portfolio  and help it in offering complete valve solutions portfolio and sturdy service network  thereby elevating the company s brand value Last quarter  Emerson also expanded its global capabilities in fresh food monitoring  on the back of Locus Traxx and PakSense buyouts  These two companies will assist Emerson in facilitating steady and safe control of food and other temperature sensitive goods In third quarter fiscal 2016  Emerson had announced agreements to sell its Network Power  Leroy Somer and Control Techniques businesses  for an aggregate value of  5 2 billion  The deals are part of the company s portfolio repositioning strategy  as it seeks to enhance focus on its core Automation Solutions and Commercial   Residential Solutions businesses  The restructuring will help Emerson leverage on its growth platforms and drive profitable growth Emerson is now reporting the entire Network Power segment as discontinued operations Liquidity   Cash FlowExiting the quarter  the company had cash and cash equivalents of  5 billion  with long term debt of  3 8 billion  Net cash provided by operating activities in the quarter plunged 66  from the prior year quarter to  410 million OutlookIn light of the recent optimistic order trends and recovering end markets  Emerson raised its outlook for fiscal 2017 for the second time  It now expects net sales for the year to be approximately flat with underlying sales to be up about 1   excluding unfavorable currency translation of approximately 1    This is comparable to the prior projections of net sales for the year to be down 1 3   with underlying sales flat to down 2   Further  Emerson projects earnings per share for fiscal 2017 to be in the range of  2 55  2 65  earlier guidance   2 47  2 62  Emerson now expects Automation Solutions net sales to be down 3 4   earlier projection  down 5 7    while Commercial   Residential Solutions net sales are now anticipated to be up 5 6   earlier projection  up 3 5   To ConcludeEmerson expects the challenging global market environment to recover gradually  as it sees improving economic conditions and positive trends in capital spending  Solid order trends  successful multi year restructuring initiatives  and momentum in both its platforms should drive results for the company in the coming quarters  Emerson s cost cutting and restructuring initiatives are likely to boost the company s profitability significantly  going forward However  a strong U S  dollar  low industrial spending  and weakness in emerging and mature economies remain major concerns Emerson currently carries a Zacks Rank  3  Hold  Stocks to ConsiderSome better ranked stocks in the broader sector include Applied Industrial Technologies Inc    NYSE AIT    Donaldson Company  Inc    NYSE DCI   and The Middleby Corp    NASDAQ MIDD    While Applied Industrial sports a Zacks Rank  1  Strong Buy   Donaldson and Middleby carry a Zacks Rank  2  You can see  Applied Industrial Technologies managed to beat estimates thrice in the trailing four quarters  for a positive earnings surprise of 9 8  With three beats over the trailing four quarters  Donaldson has a positive average earnings surprise of 5 9  Middleby Corporation surpassed earnings estimates in each of the trailing four quarters  resulting in an average surprise of 14 1  5 Trades Could Profit  Big League  from Trump Policies If the stocks above spark your interest  wait until you look into companies primed to make substantial gains from Washington s changing course Today Zacks reveals 5 tickers that could benefit from new trends like streamlined drug approvals  tariffs  lower taxes  higher interest rates  and spending surges in defense and infrastructure ,2017-05-01,Zacks Investment Research,"https://www.investing.com/analysis/emerson-(emr)-q2-earnings-in-line,-guidance-raised-again-200186572",200186572
34625,256140,MIDD,Donaldson  DCI  Posts Q1 Earnings Beat  Shares Up 10 8 ,opinion,Premium filtration products provider  Donaldson Company  Inc    NYSE DCI   reported adjusted earnings per share of 38 cents for first quarter fiscal 2017  which beat the Zacks Consensus Estimate of 35 cents by 8 6  Investors cheered the strong beat  with Donaldson s shares climbing 10 8  in the trading session following the release The bottom line figure was even more impressive compared with the prior year quarter tally of 45 cents  reflecting an increase of 11 8  Earnings were driven by sturdy top line growth  manufacturing efficiencies and streamlined operations Inside the HeadlinesDonaldson reported total sales of  553 million  up 2 8  on a year over year basis  Also  revenues came ahead of the Zacks Consensus Estimate of  534 million  Strong performance in both the Industrial Products and Engine Products segments drove top line growth  Moreover  currency fluctuations resulted in a 0 3  increase in the fiscal first quarter sales Revenues at the Engine Products segment were up 2 1  year over year to  353 9 million The On Road sub segment under Engine Products recorded a huge decline of 25 8   which constrained the overall performance of the segment  However  both Aftermarket and Aerospace and Defense showed robust growth  increasing 6 7  and 4 2   respectively  Further  demand in Off Road also looks stable Revenues at the Industrial Product segment fared even better  rising 4 1  year over year to  119 1 million Impressive performance of the Gas Turbines Systems  which rose a whopping 34 4  year over year  supported the segment s revenues  Both Industrial Filtration Solutions and Special Applications business were marginally down Donaldson s adjusted operating margin expanded 160 basis points  bps  year over year to 15 8   In addition  the company s Earnings Before Interest  Taxes  Depreciation and Amortization   EBITDA   were  103 4 million as against  77 million recorded a year ago Liquidity   Cash FlowDonaldson exited the quarter with cash and equivalents of  262 2 million as against  197 9 million as on Oct 31  2015  The company had long term debt of  324 7 million as on Oct 31  2016  compared with  350 2 million as on Jul 31  2016 Share Repurchase Program DividendsDuring fiscal first quarter  the company returned  23 million to shareholders through share dividends  Additionally  Donaldson repurchased shares worth  41 million  which represents 0 8  of its outstanding shares DONALDSON CO Price and Consensus   2017 GuidanceConcurrent with the earnings release  the company reiterated its guidance for fiscal 2017  Donaldson projects fiscal 2017 adjusted earnings in the range of  1 50  1 66 per share compared with the fiscal 2016 adjusted earnings of  1 52  Based on the current market scenario  the company expects full year sales growth in between a 2  decline and a 2  increase from 2016 In terms of segments  Donaldson estimates both Engine Products and Industrial Products sales to be a range of a 2  decline to a 2  increase compared with the prior year While solid aftermarket sales are likely to act as tailwind  poor sales of heavy duty equipment  both off road and on road products  and commercial helicopters are anticipated to act as headwinds for Engine Products  For the Industrial Products segment  the company expects Industrial Filtration Solutions to act as growth catalyst  primarily driven by sales of replacement parts  However  the upside can be largely offset by sluggish Gas Turbine Systems and Special Applications businesses  sales ConclusionDonaldson s financials remain vulnerable to mixed recovery signals in broader markets  leading the company to give cautious guidance for fiscal 2017  On the positive side  factors including focus on operational efficiency  like implementation of the global ERP system   robust replacement part sales  winning new first fit programs and steady market expansion are expected to drive growth  Further  this quarter recorded stability in some of Donaldson s businesses Factors such as decline in heavy duty on road transportation business  sluggish global agriculture  mining equipment and construction markets are anticipated to play spoilsport  Moreover  waning U S  defense spending  softness in the commercial aerospace and major project deferrals are expected to worsen the company s prospects  Further  recent exchange rate volatility remains a concern for the company On the positive side  Donaldson expects good prospects in the aftermarket business  despite tepid equipment utilization market  The company is optimistic about its innovative technology and past investments  particularly the recently acquired Partmo in South America  which is estimated to contribute  12  13 million in fiscal 2017 We believe that despite having sturdy growth prospects and a sound business structure  Donaldson remains vulnerable to macroeconomic and cyclical weaknesses  which limits its prospects for now Donaldson currently carries a Zacks Rank  3  Hold  Stocks to ConsiderSome better ranked stocks in the broader sector includeII VI Incorporated   NASDAQ IIVI    Applied Industrial Technologies Inc    NYSE AIT   and The Middleby Corporation   NASDAQ MIDD    While II VI Incorporated sports a Zacks Rank  1  Strong Buy   Applied Industrial and Middleby Corporation carry a Zacks Rank  2  Buy   You can see  II VI Incorporated has registered a remarkable positive average surprise of over 39 8  in the four trailing quarters  driven by four strong consecutive beats Applied Industrial Technologies has managed to beat estimates twice in the trailing four quarters and has a positive earnings surprise of 4 9  Middleby Corporation beat earnings in each of the trailing four quarters  resulting in an average surprise of 15 9  Zacks  Best Private Investment Ideas In addition to the recommendations that are available to the public on our website  how would you like to follow all Zacks  private buys and sells in real time Our experts cover all kinds of trades  from value to momentum       from stocks under  10 to ETF and option moves       from stocks that corporate insiders are buying up to companies that are about to report positive earnings surprises  You can even look inside exclusive portfolios that are normally closed to new investors  Starting today  for the next month  you can have unrestricted access ,2016-12-01,Zacks Investment Research,"https://www.investing.com/analysis/donaldson-(dci)-posts-q1-earnings-beat,-shares-up-10.8-200167966",200167966
34626,256141,MIDD,KBR Continues To Face Macro Challenges  Should You Hold ,opinion,Prolonged softness in the energy related markets has severely crippled the growth potential of companies operating in this domain  Over the past six months  premium engineering  procurement  and construction company  KBR  Inc  s   NYSE KBR   shares recorded an average return of 10 5   underperforming the Zacks categorized Engineering R D Services industry average of 14 3  KBR has managed to beat estimates twice for the trailing four quarters  boasting an average positive earnings surprise of 3 9   However  the company s earnings estimates have moved south in the past couple of months  Analysts have become increasingly bearish on the stock  as they have revised the Zacks Consensus Estimate for fiscal 2016 earnings downward in the past 60 days  from  1 33 to  1 17  a move of 12 0  What s Thwarting Growth Reduced capital budget of clients and lower operational expenditure budgets over the past few quarters have largely thwarted the company s growth momentum  Volatile oil and gas markets  with oversupply continuing to strain the prices and spending levels  have marred KBR s projects and orders Revenues were down 10 5  year over year to  1 073 million during third quarter 2016  hit by depressed oil prices  As a matter of fact  over the eight quarters  the company recorded precipitous decline in revenues  largely attributable to macroeconomic woes  In addition to this  foreign currency fluctuations have been impacting the company s backlog levels  Moreover  slower activity on the LNG project in Australia as well as reduced capital expenditure by key clients including Pemex  have been weighing on the company s profits About a year ago  the company had three EPC power plants under construction  which is now down to one  In addition  a large LNG project in Australia  which is approaching completion  is likely to hurt the Engineering and Construction segment s revenues  Going forward  we expect softness in the energy related markets to affect both Engineering   Construction and Technology   Consulting businesses for the rest of fiscal 2016  thus weighing down on the company s financials Silver LiningDespite tough times  we believe that the company s Government Services business will continue to act as a key profit churner for the upcoming quarters  battling some of these headwinds  Government services work  which is mostly low risk  helps in reducing volatility associated with the bottom line  This apart  the company s solid prospects in the hydrocarbon projects are adding to its strength  A healthy balance between hydrocarbon and government projects will enable KBR to offset the softness in Engineering and Construction segment  boosting growth Additionally  the company s recently completed acquisitions  namely Wyle Inc  and Honeywell International Inc  s   NYSE HON   technology development and engineering unit   Honeywell Technology Solutions  Inc    HTSI      are proving conducive to the growth of the company s Government business  Particularly  the acquisition of HTSI has assisted KBR to expand lifecycle service capabilities  such as cyber security and IT expertise  enabling it to take care of all the steps involved in the life cycle of aerospace and defense programs Further  it unlocks opportunities to foray into new services in the aerospace logistics and intelligence domain  These acquisitions contributed  200 million to the Government Services revenues during the fiscal third quarter Zacks Rank and Stocks to ConsiderKBR currently carries a Zacks Rank  3  Hold  Better ranked stocks in the industry include Applied Industrial Technologies  Inc    NYSE AIT   and Middleby Corporation   NASDAQ MIDD    Both the stocks currently hold a Zacks Rank  2  Buy   You can see Applied Industrial Technologies managed to beat estimates thrice over the trailing four quarters and has a positive earnings surprise of 4 9  Middleby Corporation beat earnings in each of the trailing four quarters  resulting in an average surprise of 15 9  Zacks  Top Investment Ideas for Long Term ProfitHow would you like to see our best recommendations to help you find today s most promising long term stocks  Starting now  you can look inside our portfolios featuring stocks under  10  income stocks  value investments and more  These picks  which have double and triple digit profit potential  are rarely available to the public  But you can see them now ,2016-12-05,Zacks Investment Research,https://www.investing.com/analysis/kbr-continues-to-face-macro-challenges:-should-you-hold-200168407,200168407
