,id,ticker,title,category,content,date,provider,url,article_id
117809,339324,IAC,IAC InterActiveCorp  IAC  Q3 Earnings  What s In The Cards ,opinion,"IAC InterActiveCorp   NASDAQ IAC   is set to report third quarter 2018 results on Nov 7 The company topped the Zacks Consensus Estimate in the trailing four quarters with average beat of 36 39  In the last reported quarter  IAC delivered a positive earnings surprise of 182 93   Further  its net revenues of  1 06 billion surpassed the Zacks Consensus Estimate of  1 02 billion Coming to the price performance  share of IAC have returned 64 6  on a year to date basis  outperforming the  s rally of 3 3  Let s see how things are shaping up for this announcement Factors at PlayIAC s vast portfolio of online businesses is a major positive and is expected to continue aiding the top line The company s strong hold in Match Group   NASDAQ MTCH    which continues to be a significant driver of its top line  is expected to benefit third quarter results  Growing Tinder subscriber base  owing to its strong monetization efforts will continue to aid the company s revenue generation from this segment Further  the integration of HomeAdvisor and Angie s List   NASDAQ ANGI   is expected to boost the services request and engagement from the service professionals on IAC s network in the to be reported quarter Additionally  Vimeo with its subscription software continues to gain momentum in the market  Expanding subscriber base and growing SaaS revenues are anticipated to drive the company s top line Moreover  the company s growing publishing segment is likely to benefit its results in the to be reported quarter  due to the execution of key strategies of displaying few but effective ads  building strong content and offering fast sites All these strong endeavors of IAC are expected to boost top line growth in third quarter  Price and EPS Surprise    What Our Model Says
According to the Zacks model  a company with a Zacks Rank  1  Strong Buy   2  Buy  or 3  Hold  has good chance of beating estimates if it also has a positive   The Sell rated stocks  Zacks Rank  4 or 5  are best avoided  You can uncover the best stocks to buy or sell before they re reported with our  IAC has a Zacks Rank  2 but an Earnings ESP of  8 7   which makes surprise prediction difficult Other Stocks That Warrant a LookHere is another stock worth considering as our model shows that it too has the right combination of elements to deliver an earnings beat in the upcoming releases Adobe Systems   NASDAQ ADBE   has an Earnings ESP of  0 19  and Zacks Rank  2  You can see Today s Stocks from Zacks  Hottest StrategiesIt s hard to believe  even for us at Zacks  But while the market gained  21 9  in 2017  our top stock picking screens have returned  115 0    109 3    104 9    98 6   and  67 1  And this outperformance has not just been a recent phenomenon  Over the years it has been remarkably consistent  From 2000   2017  the composite yearly average gain for these strategies has beaten the market more than 19X over  Maybe even more remarkable is the fact that we re willing to share their latest stocks with you without cost or obligation ",2018-11-01,Zacks Investment Research,https://www.investing.com/analysis/iacinteractivecorp-iac-q3-earnings-whats-in-the-cards-200354109,200354109
117810,339325,IAC,Wayfair  W  Q3 Loss Wider Than Anticipated  Revenues Beat ,opinion,"Wayfair Inc    NYSE W   reported non GAAP loss of  1 28 per share in the third quarter of 2018  wider than the Zacks Consensus Estimate of  1 12  The company had incurred a loss of 77 cents in the last reported quarter Total revenues were  1 71 billion in the third quarter  up 42  year over year  The figure also outpaced the Zacks Consensus Estimate of  1 67 billion The year over year increase in revenues was driven by strengthening of the direct retail business across the United States and international regions Following the company s earnings release  its shares declined 12 8   However  Wayfair s shares have returned 19 8  on a year to date basis against the  s decline of 1 3    Quarter in DetailThe company s direct retail net revenues  which include sales generated primarily through Wayfair s sites  were  1 7 billion in the third quarter  increasing 43 3  year over year Active customers increased 35  to 13 9 million  Also  LTM net revenues per active customer increased 8 6  year over year to  443 million Wayfair s total number of orders delivered in the reported quarter came in at 6 9 million  up 47  year over year  Orders per customer in the quarter were 1 84 million  reflecting an increase of 5 1  from the year ago quarter  Further  repeat customers placed 4 6 million orders in the third quarter  up 59 7  year over year Operating ResultsIn the third quarter  Wayfair s gross margin was 23   down 40 basis points on a year over year basis Adjusted EBITDA margin was  4 5   million compared with  1 9   in the year ago quarter  This was led by increasing investments  mainly in the international regions Wayfair s operating expenses of  538 million increased 51 9  year over year  Operating loss came in at  145 3 million  which was wider than the prior year quarter s  74 million Balance Sheet   Cash FlowAs of Sep 30  2018  cash  cash equivalents and short term investments were  518 7 million  down from  575 4 million in the second quarter  Accounts receivables were  41 million  up from  34 8 million in the last reported quarter Cash from operations was  7 8 million in the third quarter and capital expenditure totaled  49 4 million  Free cash flow was   58 8  million compared with   7 5  million in the last reported quarter GuidanceFor the fourth quarter of 2018  Wayfair anticipates total revenues in the range of  1 92  1 968 billion  The Zacks Consensus Estimate for revenues is currently pegged at  1 93 billion The company expects direct retail revenues in the range of  1 905  1 950 billion  reflecting year over year growth of 34 37   This includes expected growth in U S  direct retail revenues of 32 35  and international segment sales between 50  and 55  Further  other revenues are expected between  15 million and  18 million Wayfair Inc  Price  Consensus and EPS Surprise
    Zacks Rank and Stocks to ConsiderWayfair currently carries a Zacks Rank  3  Hold   Some better ranked stocks in the broader technology sector are boohoo group plc   OTC BHOOY    IAC InterActiveCorp   NASDAQ IAC   and AMETEK  Inc    NYSE AME    each carrying a Zacks Rank  2  Buy   You can see Long term earnings growth rate for boohoo group  IAC InterActiveCorp and AMETEK is currently pegged at 25   15  and 10 97   respectively Today s Stocks from Zacks  Hottest StrategiesIt s hard to believe  even for us at Zacks  But while the market gained  21 9  in 2017  our top stock picking screens have returned  115 0    109 3    104 9    98 6   and  67 1  And this outperformance has not just been a recent phenomenon  Over the years it has been remarkably consistent  From 2000   2017  the composite yearly average gain for these strategies has beaten the market more than 19X over  Maybe even more remarkable is the fact that we re willing to share their latest stocks with you without cost or obligation ",2018-11-01,Zacks Investment Research,https://www.investing.com/analysis/wayfair-w-q3-loss-wider-than-anticipated-revenues-beat-200354153,200354153
117811,339326,IAC,Trimble s  TRMB  Q3 Earnings Beat Estimates  Revenues Lag ,opinion,"Trimble Inc    NASDAQ TRMB   delivered non GAAP earnings of 49 cents per share in the third quarter of 2018  which surpassed the Zacks Consensus Estimate by 4 cents The figure increased 25 6  on a year over year basis but decreased 13 6  sequentially Coming to price performance  the stock has lost6 5  on a year to date basis compared with the  s decline of 8 5    RevenuesRevenues in the third quarter increased 19  year over year to  804 7 million  However  the figure missed the Zacks Consensus Estimate of  807 million The year over year growth in revenues was driven by the strong performance of its segments  Further  the company recorded robust organic growth of more than 10   Moreover  acquisitions contributed 9  to the top line growth of the company Product revenues  62 8  of the total revenues  came in at  499 7 million  up 11 2  on a year over year basis  Services revenues  25 9  of revenues  came in at  156 5 million  up 25 9  year over year  Subscription revenues  17 5  of revenues  increased 35 6  from the year ago quarter to  139 million Operating DetailsIn the third quarter  gross margin came in at 57 9   expanding 200 basis points  bps  year over year  The increase was attributed to a favorable product mix Operating expenses were  325 4 million in the third quarter  expanding 22 1 from the year ago quarter Non GAAP operating margin came in at 20 8   expanding 210 bps year over year  driven by strong organic growth Balance Sheet   Cash FlowAs of Sep 30  2018  cash and cash equivalents were  205 4 million  decreasing from  571 million in the last reported quarter  Inventories were  286 3 million  increasing from  282 4 million in the second quarter Long term debt was  1 79 billion at the end of third quarter compared with  1 29 billion at the end of second quarter Cash flow from operations was  117 million in the quarter under review versus  185 million in the last reported quarter GuidanceFor fourth quarter 2018  Trimble expects non GAAP earnings between 44 cents and 48 cents per share  The Zacks Consensus Estimate for the same is pegged at 46 cents per share The company expects non GAAP revenues between  791 million and  821 million  The corresponding Zacks Consensus Estimate stands at  827 5 million Trimble Inc  Price  Consensus and EPS Surprise
    Zacks Rank and Stocks to ConsiderTrimble currently carries a Zacks Rank  3  Hold   Some better ranked stocks in the broader technology sector are boohoo group plc   OTC BHOOY    IAC InterActiveCorp   NASDAQ IAC   and AMETEK  Inc    NYSE AME    each carrying a Zacks Rank  2  Buy   You can see Long term earnings growth rate for boohoo group  IAC InterActiveCorp and AMETEK is currently pegged at 25   15  and 10 97   respectively Today s Stocks from Zacks  Hottest Strategies It s hard to believe  even for us at Zacks  But while the market gained  21 9  in 2017  our top stock picking screens have returned  115 0    109 3    104 9    98 6   and  67 1  And this outperformance has not just been a recent phenomenon  Over the years it has been remarkably consistent  From 2000   2017  the composite yearly average gain for these strategies has beaten the market more than 19X over  Maybe even more remarkable is the fact that we re willing to share their latest stocks with you without cost or obligation ",2018-11-01,Zacks Investment Research,https://www.investing.com/analysis/trimbles-trmb-q3-earnings-beat-estimates-revenues-lag-200354152,200354152
117844,339359,IAC,Groupon  GRPN  Looks Good  Stock Adds 7 3  In Session,opinion,Groupon  Inc    NASDAQ GRPN   was a big mover last session  as the company saw its shares rise more than 7  on the day  The move came on solid volume too with far more shares changing hands than in a normal session  This stock  which remained volatile and traded within the range of  4 61   5 28 in the past one month time frame  witnessed a sharp increase yesterday The move came after the company reported better than expected third quarter 2017 results Though the company has seen one negative estimate revision over the past few weeks  the Zacks Consensus Estimate for the current quarter remained unchanged  The recent price action is encouraging though  so make sure to keep a close watch on this firm in the near future Groupon currently has a Zacks Rank  3  Hold  while its  is negative   Groupon  Inc  Price   A better ranked stock in the Internet   Commerce industry is IAC InterActiveCorp   NASDAQ IAC    which currently carries a Zacks Rank  1  Strong Buy   You can see  Is GRPN going up  Or down  Predict to see what others think   or Zacks  Best Private Investment Ideas While we are happy to share many articles like this on the website  our best recommendations and most in depth research are not available to the public Starting today  for the next month  you can follow all Zacks  private buys and sells in real time  Our experts cover all kinds of trades  from value to momentum       from stocks under  10 to ETF and option moves       from stocks that corporate insiders are buying up to companies that are about to report positive earnings surprises  You can even look inside exclusive portfolios that are normally closed to new investors ,2017-11-02,Zacks Investment Research,https://www.investing.com/analysis/groupon-grpn-looks-good-stock-adds-73-in-session-200257889,200257889
117845,339360,IAC,Expedia  EXPE  Q4 Earnings Miss Estimates  Revenues Up Y Y,opinion,Expedia Inc    NASDAQ EXPE   reported fourth quarter 2017 non GAAP earnings of 84 cents  down 28 2  from the year ago quarter and 66 5  from the previous quarter  The figure also missed the Zacks Consensus Estimate by 32 cents Revenues were up 10 8  year over year but declined 21 8  sequentially to  2 32 billion and lagged the Zacks Consensus Estimate of  2 37 billion  Gross bookings increased 13 6  year over year but declined 11  sequentially to  19 77 billion Revenues by SegmentCore OTA segment revenues were up 9 6  year over year but fell 19 7  on a sequential basis to  1 86 billion  Management noted that OTA lodging supply portfolio is at about 590 000 properties  up 69  on a year over year basis Moreover  trivago revenues declined 36 4  sequentially but increased 17 5  from the year ago quarter to  215 million  Expedia  Inc  Price  Consensus and EPS Surprise     Egencia increased 8 7  on a sequential basis and 18 1  on a year over year basis to  137 million HomeAway increased 16 3  from the year ago quarter but declined 36 7  sequentially to  193 million  HomeAway room nights stayed rose 30  year over year Core OTA  trivago  Egencia and HomeAway contributed 80 1   9 3   5 9  and 8 3  of gross revenues  before inter company eliminations   respectively Revenues by ChannelAround 55 3  of total revenues were generated through the merchant business  direct sales   another 27 1  came through the agency model  where Expedia operates as an agent of the supplier   Roughly 8 2  came from Advertising   Media with Home Away  accounting for the remaining 8 3   Expedia  Inc  Revenue  TTM      Merchant  Agency  Advertising   Media and Home Away were up 9 7   10 9   12 6  and 16 3   respectively  on a year over year basis  Sequentially  Merchant  Agency  Advertising   Media and Home Away plunged 17 7   21 7   28 4  and 36 7   respectively Revenues by GeographyAround 54  of Expedia s quarterly revenues were generated domestically  with the remaining 46  coming from international sources  The domestic business climbed 4 4  from the year ago quarter but declined 20 6  sequentially  The international business grew 19 5  from the year ago quarter but declined 23 2  sequentially Revenues by Product LineLodging revenues  69  of total revenues   which include hotel and HomeAway revenues  increased 11  in the quarter based on a 15  increase in room nights stayed driven by growth in Brand Expedia  Hotels com  EAN and HomeAway Air revenues were flat  Almost 3  increase in air tickets sold was offset by a 3  decrease in revenues per ticket The 13  year over year growth advertising   media revenue reflected continued growth in trivago and Expedia Media Solutions  All other revenues increased 14   reflecting growth in travel insurance and car rental products Operating DetailsAdjusted gross margin contracted 310 basis points  bps  on a sequential basis and 80 bps on year over year basis to 82 4  Adjusted EBITDA plunged 43 3  sequentially and 9  year over year to  402 million  Notably  trivago  Egencia and Home Away EBITDA decreased 164 3   9 5  and 26 2   respectively  on a year over year basis  However  core OTA EBITDA increased 0 9  from the year ago quarter On a sequential basis Core OTA  Egencia and Home Away EBITDA were down 27 1   5  and 75 4   respectively  However  trivago EBITDA increased 12 5  in the reported quarter Operating expenses  as percentage of revenues  were 65 1  compared with 51 2  in the previous quarter and 62 5  in the year ago quarter  The year over year and sequential increase can be attributed to higher adjusted selling and marketing expenses Balance Sheet   Cash FlowAs of Dec 31  2017  cash and short term investments totaled  3 38 billion  down from  3 83 billion as of Sep 30  2017  The total debt balance was  4 25 billion compared with net debt of  4 24 billion in the previous quarter During 2017  Expedia generated nearly  1 1 billion in free cash flow Expedia repurchased nearly 1 3 million shares for a total of  156 million GuidanceExpedia forecasts 2018 adjusted EBITDA growth in the range of 6 11   most of which is expected to come in the second half of the year For the first quarter  management expects adjusted EBITDA to decline significantly on a year over year basis  Both HomeAway and trivago are projected to report adjusted loss  Continuing investments on accelerated supply acquisition and cloud migration as well as incremental spending on selling   marketing are expected to hurt profits Expedia expects cost of revenues to grow slightly faster than revenues  Management also expects technology and content expense to grow significantly faster than revenues  primarily due to an increase in cloud and the impact of key investments Expedia expects cloud spending of  170 million for 2018 Zacks Rank   Stocks to ConsiderExpedia carries a Zacks Rank  3  Hold  A few better ranked stocks in the same sector are Petmed Express   NASDAQ PETS    MercadoLibre   NASDAQ MELI   and IAC InterActiveCorp   NASDAQ IAC    While Petmed sports a Zacks Rank  1  Strong Buy   MercadoLibre and IAC InterActiveCorp have a Zacks Rank  2  Buy   You can see  Long term earnings growth rate for Petmed  MercadoLibre and IAC InterActiveCorp is projected at 10   25  and 8 33   respectively The Hottest Tech Mega Trend of AllLast year  it generated  8 billion in global revenues  By 2020  it s predicted to blast through the roof to  47 billion  Famed investor Mark Cuban says it will produce  the world s first trillionaires   but that should still leave plenty of money for regular investors who make the right trades early ,2018-02-08,Zacks Investment Research,https://www.investing.com/analysis/expedia-expe-q4-earnings-miss-estimates-revenues-up-yy-200288978,200288978
