,id,ticker,title,category,content,date,provider,url,article_id
217344,438860,TEVA,Stocks  U S  Futures Rise Ahead of Fed Confirmation Hearing,news,"Investing com   U S  futures edged higher on Tuesday  as investors wait for the confirmation hearing of Fed Governor Jerome Powell 
The S P 500 futures inched forward two points or 0 09  as of 6 51 AM ET  11 51 AM GMT  while Dow futures rose 38 points or 0 16   Meanwhile tech heavy Nasdaq 100 futures increased three and a half points or 0 05  
Fed Governor Jerome Powell  who was nominated by U S  President Donald Trump to lead the Federal Reserve  is set to appear before the Senate Banking Committee at 9 45AM ET  2 45 PM GMT  for his confirmation hearing  Investors will be listening for clues as to how he will lead the central bank 
Investors have also turned their attention to the tax reform bill  with Trump expected to discuss the bill with Senate Republicans at their weekly luncheon  The Senate is expected to vote on the highly anticipated bill on Thursday  Republicans are rushing to pass a tax bill before the end of the year  which could include cutting corporate taxes to 20  from 35  
Oil companies were among the biggest gainers in pre market trading   BP   LON BP  PLC ADR  NYSE BP  oil firm rose 0 99  while Royal Dutch Shell  LON RDSa  PLC ADR  NYSE RDSa  increased 2 94  after it restored its all cash dividend  Meanwhile pharmaceutical firm Teva Pharma Industries Ltd ADR  NYSE TEVA  rose 1 85  
Elsewhere Lloyds Banking Group  LON LLOY  PLC ADR  NYSE LYG  slipped 1 98  despite passing the Bank of England s stress test while Marathon Patent Group Inc  NASDAQ MARA   a cryptocurrency player  slumped 26 88  after surging nearly 10  in trading on Monday 
Meanwhile in Europe stocks rose  Germany s DAX surged 42 points or 0 33  while in France the CAC 40 increased 33 points or 0 63  and in London  the FTSE 100 rose 47 points or 0 65   Meanwhile the pan European Euro Stoxx 50 inched forward 17 points or 0 49  while Spain s IBEX 35 was up 46 points or 0 46  
In commodities  gold futures rose 0 01  to  1 294 49 a troy ounce while crude oil futures slipped 1 00  to  57 53 a barrel  The U S  dollar index  which measures the greenback against a basket of six major currencies  rose 0 12  to 92 96 ",2017-11-28,Investing.com,https://www.investing.com/news/stock-market-news/stocks-us-futures-rise-ahead-of-fed-confirmation-hearing-920250,920250
217345,438861,TEVA,Stocks  U S  Futures Point to Higher Opening Ahead of GDP  Yellen Testimony,news,"Investing com   Wall Street was set to open higher on Wednesday as investors wait for Federal Reserve Chair Janet Yellen s last congressional testimony 
The S P 500 futures inched forward three and a half points or 0 13  as of 6 42 AM ET  11 42 AM GMT  while Dow futures rose 77 points or 0 32   Meanwhile tech heavy Nasdaq 100 futures increased seven points or 0 11  
Yellen is expected to testify on the outlook of the U S  economy before the Congressional Joint Economic Committee  It s her last testimony before she leaves as head of the central bank in February 
Banking stocks were up in pre market trading  Lloyds Banking Group  LON LLOY  PLC ADR  NYSE LYG  surged 2 56  while  Banco Santander   MC SAN  SA ADR  NYSE SAN  increased 0 75   Telecommunications firm Nokia  HE NOKIA  rose 0 99  and pharmaceutical firm Teva Pharma Industries Ltd ADR  NYSE TEVA  jumped 1 43  
Elsewhere financial services firm  ING Group NV  ADR  NYSE ING  fell 0 44  and Chinese education firm  RYB Education  Inc  NYSE RYB  slipped 8 85  amid child abuse allegations at a Beijing school 
U S  gross domestic product data  is set for release at 8 30 AM ET  1 30 PM GMT   which investors will be watching to see if the American economy has strengthened  A stronger economy could give the Fed reason to increase interest rates into 2018 
Meanwhile investors are awaiting a vote on the tax reform bill  which could happen this week  On Tuesday  the Senate Budget Committee approved the Senate s tax plan  bringing it closer to a floor vote  Doubts remain however on whether Congress can pass the bill before the end of the year 
Stocks in Europe were mixed  Germany s DAX surged 123 points or 0 96  while in France the CAC 40 increased 38 points or 0 71  and in London  the FTSE 100 slipped 42 points or 0 57   Meanwhile the pan European Euro Stoxx 50 inched forward 27 points or 0 76  while Spain s IBEX 35 was up 132 points or 1 31  
In commodities  gold futures inched down 0 04  to  1 294 41 a troy ounce while crude oil futures slipped 0 45  to  57 73 a barrel  The U S  dollar index  which measures the greenback against a basket of six major currencies  was flat at 93 20 ",2017-11-29,Investing.com,https://www.investing.com/news/stock-market-news/stocks-us-futures-point-to-higher-opening-ahead-of-gdp-yellen-testimony-926483,926483
217346,438862,TEVA,Teva considering cutting up to 10 000 jobs  Bloomberg,news," Reuters    Teva Pharmaceutical Industries Ltd  TA TEVA   N TEVA   the world s largest maker of generic drugs  is considering cutting up to 10 000 jobs  Bloomberg News reported on Friday  
Israel based Teva wants to cut costs by  1 5 billion to  2 billion over the next two years  Bloomberg said  citing people with knowledge of the matter    ",2017-12-08,Reuters,https://www.investing.com/news/stock-market-news/teva-considering-cutting-up-to-10000-jobs-bloomberg-971221,971221
217347,438863,TEVA, Stocks   Wall Street Set for Higher Opening as Bitcoin Futures Surge,news,"Investing com   U S  futures pointed to higher opening on Monday as investors look to bitcoin futures 
The S P 500 futures was up two points or 0 08  as of 6 48 AM ET  11 48 GMT  while Dow futures increased 48 points or 0 20  Meanwhile tech heavy Nasdaq 100 futures rose seven points or 0 12  
Bitcoin will be on investors minds today  after the cryptocurrency started trading on the CBOE Futures Exchange on Sunday  The new Bitcoin Futures surged over 20  within hours of launching  causing a temporary outage to the trading website  The futures price has already surged over  17 000 
Chinese e commerce firm  Alibaba   NYSE BABA  was among the biggest gainers in pre market trading  rising 0 67  while banking firm Santander  MC SAN  was up 0 15  and mining company  Rio Tinto   LON RIO  surged 1 76   Steel firm Arcelormittal  AS MT  increased 1 18  
Elsewhere  telecommunications firm Nokia  HE NOKIA  was flat after it announced its chief operating officer would step down  Pharmaceutical stocks were mostly down  with firm Teva Pharma Industries Ltd ADR  NYSE TEVA  dipping down 0 37  while  VistaGen Therapeutics Inc   NASDAQ VTGN  slipped 22 22  and Zealand Pharma A S ADR  NASDAQ ZEAL  was down 1 21  
On the data front  the Job Openings and Labor Turnover Survey   JOLTS  data comes out at 10 00 AM ET  15 00 GMT   Meanwhile investors are looking ahead to the Federal Open Market Committee meeting  which starts on Tuesday  An interest rate hike is highly anticipated 
Stocks in Europe were mostly down  Germany s DAX fell five points or 0 04  while in France the CAC 40 decreased six points or 0 11  and in London  the FTSE 100 was up 41 points or 0 57   Meanwhile the pan European Euro Stoxx 50 fell nine points or 0 26  while Spain s IBEX 35 slumped 27 points or 0 26  
In commodities  gold futures rose 0 30  to  1 252 20 a troy ounce while crude oil futures was down 0 35  to  57 16 a barrel  The U S  dollar index  which measures the greenback against a basket of six major currencies  inched down 0 07  to 93 77 ",2017-12-11,Investing.com,https://www.investing.com/news/stock-market-news/stocks--wall-street-set-for-higher-opening-as-bitcoin-futures-surge-975987,975987
217348,438864,TEVA,Stocks   Wall Street Set for Higher Opening After Fed Rate Hike,news,"Investing com   U S  futures were higher on Thursday after the Federal Reserve increased hikes for the third time this year 
The S P 500 futures rose two points or 0 08  as of 6 49 AM ET  11 49 GMT  while Dow futures increased 37 points or 0 15   Meanwhile tech heavy Nasdaq 100 futures was up seven points or 0 12  
The Federal Open Market Committee on Wednesday raised rates for the third time in 2017 as expected  Fed officials also hiked their projection for economic growth in 2017 to 2 5   while growth in 2018 was expected to rise to 2 5   a 0 4  increase from the Fed s September projection 
Power solution provider Digital Power Corporation  NYSE DPW  was among the top performers in pre market trading  The company rose 11 68  after it announced it was creating a cryptocurrency mining division  Meanwhile IT firm Helios and Matheson Analytics Inc  NASDAQ HMNY  recovered 2 36   The firm dropped 32 64  on Wednesday amid news that the firm was selling shares to raise funds to increase its stake in ticketing platform MoviePass 
Elsewhere HSBC slipped 0 76  while telecommunications firm Nokia  HE NOKIA  was down 0 64  and pharmaceutical firm Teva Pharma Industries Ltd ADR  NYSE TEVA  fell 1 02  
In economic news  retail sales  jobless claims and import and export price indexes come out at 8 30 AM ET  13 30 GMT  
Investors will be looking to Europe today  as both the Bank of England and European Central Bank are expected to announce their monetary policy decisions  Both banks are expected to hold rates steady  Traders will be listening to what ECB President Mario Draghi says about the economic state of the euro zone while Brexit will be on their minds during the BOE decision 
Stocks in Europe were down  Germany s DAX lost 72 points or 0 57  while in France the CAC 40 decreased 12 points or 0 23  and in London  the FTSE 100 was down 22 points or 0 28   Meanwhile the pan European Euro Stoxx 50 fell 14 points or 0 39  while Spain s IBEX 35 slipped 37 points or 0 37  
In commodities  gold futures rose 0 84  to  1 259 10 a troy ounce while crude oil futures fell 0 27  to  56 45 a barrel  The U S  dollar index  which measures the greenback against a basket of six major currencies  inched forward 0 01  to 93 41 ",2017-12-14,Investing.com,https://www.investing.com/news/stock-market-news/stocks--wall-street-set-for-higher-opening-after-fed-rate-hike-990956,990956
217349,438865,TEVA,Netanyahu asks Teva Pharm to minimize job loss in Israel,news,"JERUSALEM  Reuters    Israeli Prime Minister Benjamin Netanyahu said on Thursday he spoke with the chief executive of Teva Pharmaceutical Industries  TA TEVA  and asked that the company keeps layoffs in Israel to a minimum  Israel based Teva  N TEVA   the world s largest generic drugmaker  is due to unveil a major restructuring on Thursday to help pay off its debt  
Netanyahu in a statement said he requested from CEO Kare Schultz to  maintain the identity of Teva as an Israeli company   and Schultz promised to do so ",2017-12-14,Reuters,https://www.investing.com/news/stock-market-news/netanyahu-asks-teva-pharm-to-minimize-job-loss-in-israel-990972,990972
217360,438876,TEVA,Teva Pharmaceutical Industries Ltd   TEVA  Dips More Than Broader Markets  What You Should Know,opinion,"Teva Pharmaceutical Industries Ltd   NYSE TEVA  closed the most recent trading day at  8 11  moving  1 1  from the previous trading session  This change lagged the S P 500 s 0 65  loss on the day  Elsewhere  the Dow lost 0 42   while the tech heavy Nasdaq lost 0 46  
Coming into today  shares of the company had lost 1 91  in the past month  In that same time  the Medical sector lost 0 52   while the S P 500 gained 4 11  
Investors will be hoping for strength from TEVA as it approaches its next earnings release  which is expected to be August 7  2019  On that day  TEVA is projected to report earnings of  0 58 per share  which would represent a year over year decline of 25 64   Meanwhile  our latest consensus estimate is calling for revenue of  4 27 billion  down 9 15  from the prior year quarter 
For the full year  our Zacks Consensus Estimates are projecting earnings of  2 38 per share and revenue of  17 16 billion  which would represent changes of  18 49  and  9 01   respectively  from the prior year 
Any recent changes to analyst estimates for TEVA should also be noted by investors  Recent revisions tend to reflect the latest near term business trends  As such  positive estimate revisions reflect analyst optimism about the company s business and profitability 
Based on our research  we believe these estimate revisions are directly related to near team stock moves  To benefit from this  we have developed the Zacks Rank  a proprietary model which takes these estimate changes into account and provides an actionable rating system 
The Zacks Rank system ranges from  1  Strong Buy  to  5  Strong Sell   It has a remarkable  outside audited track record of success  with  1 stocks delivering an average annual return of  25  since 1988  Over the past month  the Zacks Consensus EPS estimate remained stagnant  TEVA is holding a Zacks Rank of  3  Hold  right now 
Valuation is also important  so investors should note that TEVA has a Forward P E ratio of 3 45 right now  This valuation marks a discount compared to its industry s average Forward P E of 6 74 
We can also see that TEVA currently has a PEG ratio of 0 94  The PEG ratio is similar to the widely used P E ratio  but this metric also takes the company s expected earnings growth rate into account  TEVA s industry had an average PEG ratio of 0 95 as of yesterday s close 
The Medical   Generic Drugs industry is part of the Medical sector  This group has a Zacks Industry Rank of 148  putting it in the bottom 43  of all 250  industries 
The Zacks Industry Rank gauges the strength of our individual industry groups by measuring the average Zacks Rank of the individual stocks within the groups  Our research shows that the top 50  rated industries outperform the bottom half by a factor of 2 to 1 
You can find more information on all of these metrics  and much more  on Zacks com ",2019-07-17,Zacks Investment Research,https://www.investing.com/analysis/teva-pharmaceutical-industries-ltd-teva-dips-more-than-broader-markets-what-you-should-know-200441044,200441044
217361,438877,TEVA,Teva climbing from recent low  shares up 7 ,news,Bargain hunters are driving up the price of Teva Pharmaceutical Industries  TEVA  6 9    Shares have rallied over 26  since the low of  10 85 on November 2 after its Q3 miss and rash of downgrades Previously  Analysts weigh in on Teva after Q3 miss  shares down 20   Nov  2 Now read ,2017-11-17,Seeking Alpha,https://www.investing.com/news/stock-market-news/teva-climbing-from-recent-low-shares-up-7-880308,880308
217362,438878,TEVA,Stocks  U S  Futures Fall as Tax Reform Uncertainty Sets In,news,"Investing com   U S  futures pointed to a lower open on Monday as investors remain on edge over the tax reform bill 
The S P 500 futures fell half a point or 0 03  as of 6 53 AM ET  11 53 AM GMT  while Dow futures slipped four and a half points or 0 02   Meanwhile tech heavy Nasdaq 100 futures decreased two and a half points or 0 04  
U S  Treasury Secretary Steven Mnuchin said on Friday that he foresaw the tax reform bill being sent to President Donald Trump by the end of 2017  but concerns remain about what whether the bill will be finalized  The House passed its version of the tax bill on Thursday and now has to go through the Senate 
Among the biggest movers before the morning bell were banking firm  Barclays   LON BARC  PLC ADR  NYSE BCS   which rose 1 43  and Chinese e commerce giant  Alibaba   NYSE BABA   which increased 1 11   Oil firm  BP   LON BP  PLC was up 0 41  after it declared a  0 10 dividend 
Meanwhile social media firm  Snap Inc   NYSE SNAP  slumped 1 00  and pharmaceutical firm Teva Pharma Industries Ltd ADR  NYSE TEVA  was down 1 19   Financial services firm  ING Group NV  ADR  NYSE ING  fell 0 61  while Chinese electronic retailer  Qudian Inc   NYSE QD  decreased 1 89  
Stocks in Europe recovered after dipping earlier on Monday when Germany failed to form a three way government coalition  Germany s DAX rose 41 points or 0 31  while in France the CAC 40 increased 19 points or 0 36  and in London  the FTSE 100 inched forward 11 points or 0 16   Meanwhile the pan European Euro Stoxx 50 rose ten and a half points or 0 30  while Spain s IBEX 35 was up 36 points or 0 37  
In commodities  gold futures fell 0 37  to  1 291 71 a troy ounce while crude oil futures slumped 0 58  to  56 38 a barrel  The U S  dollar index  which measures the greenback against a basket of six major currencies  inched forward 0 02  to 93 63 ",2017-11-20,Investing.com,https://www.investing.com/news/stock-market-news/stocks-us-futures-fall-as-tax-reform-uncertainty-sets-in-886043,886043
217363,438879,TEVA,Stocks  U S  Futures Point to Higher Opening on Wall Street,news,"Investing com   U S  futures were higher on Tuesday  as uncertainty over the tax cut bill eases 
The S P 500 futures inched forward five points or 0 20  as of 6 52 AM ET  11 52 AM GMT  while Dow futures jumped 56 points or 0 24   Meanwhile tech heavy Nasdaq 100 futures rose 16 points or 0 26  
Oil firm  BP   LON BP  PLC ADR  NYSE BP  was among the top gainers in pre market trading  rising 1 00  while steel production firm Arcelormittal  AS MT  was up 0 74   Meanwhile Chinese e commerce giant  Alibaba   NYSE BABA  increased 0 71  after reports that the firm was opening brick and mortar stores in China 
Financial stocks were down  Banking giant  HSBC Holdings   LON HSBA  PLC ADR  NYSE HSBC  inched down 0 27  while financial institution  ING Group NV  ADR  NYSE ING slipped 0 28   Elsewhere pharmaceutical firm Teva Pharma Industries Ltd ADR  NYSE TEVA  fell 0 61  while Chinese microlender  Qudian Inc   NYSE QD  was down 0 80  
On Monday U S  President Donald Trump said at a cabinet meeting that his administration was going to  give the American people a huge tax cut for Christmas   according to Associated Press 
House Republicans passed the tax cut bill on Thursday and a version of the bill is now making its way through the Senate  Some analysts are skeptical  that the tax cuts will get pushed through before the end of the year 
In economic news  the Chicago Fed National Activity Index comes out at 8 30 AM ET  1 30 PM GMT  while existing home sales is released at 10 00 AM ET  3 00 PM GMT  
On Tuesday Federal Reserve Chair Janet Yellen is expected to participate in a moderated discussion with British economist Mervyn King  Investors will be watching for any indication of a rate hike at the next Federal Open Market Committee meeting in December 
Stocks in Europe rallied  Germany s DAX rose 67 points or 0 52  while in France the CAC 40 increased 20 points or 0 41  and in London  the FTSE 100 inched forward 10 points or 0 14   Meanwhile the pan European Euro Stoxx 50 rose 11 points or 0 32  while Spain s IBEX 35 was up 14 points or 0 14  
In commodities  gold futures rose 0 29  to  1 279 02 a troy ounce while crude oil futures increased 0 34  to  56 61 a barrel  The U S  dollar index  which measures the greenback against a basket of six major currencies  inched forward 0 03  to 94 02 ",2017-11-21,Investing.com,https://www.investing.com/news/stock-market-news/stocks-us-futures-point-to-higher-opening-on-wall-street-892881,892881
217368,438884,TEVA,Jazz s  JAZZ  New Sleep Drug Sunosi Gets Schedule IV Status ,opinion,"Jazz Pharmaceuticals plc   NASDAQ JAZZ   announced that the U S  Drug Enforcement Agency   DEA   has designated its recently approved sleep drug  Sunosi  solriamfetol   as a Schedule IV medicine  The designation is given to drugs  composed of controlled substances or chemicals  based on their potential for abuse The Schedule IV designation for Sunosi suggests that the drug has low potential for abuse and low risk of dependence  This is likely to boost the drug s prospects and reach following its launch next month  However  the impact of this designation on the company s commercialization plan for Sunosi remains to be seen  Jazz may provide an update on the plans on the second quarter earnings call Please note that  was approved in March as a treatment to improve wakefulness and reduce excessive daytime sleepiness   EDS   in adult patients with narcolepsy or obstructive sleep apnea  Sunosi will be commercially available in the United States in two doses   75 mg and 150 mg tablets   starting early July Jazz s shares are up 4 1  so far this year compared with the  s increase of 5 1   We note that the company has developed solriamfetol for an indication similar to its sole marketed drug  Xyrem  However  Xyrem is a Schedule III controlled substance and the distribution of the drug is restricted to a single pharmacy under the FDA s risk evaluation and mitigation strategy   REMS    Moreover  the FDA continues to evaluate the  on an ongoing basis and may modify it if required  An adverse change by the agency can affect the sales of the blockbuster drug A Schedule IV designation for Sunosi may lead to the mitigation of the risk of dependence on a single pharmacy for distribution as is the case for Xyrem Moreover  Xyrem will start facing generic competition as early as 2023  Successful commercialization of Sunosi may help the company offset the loss in Xyrem sales  We remind investors that the company is developing a Xyrem  with low sodium content in late stage studies for EDS and cataplexy in narcolepsy patients Meanwhile  competition is increasing for Jazz as several companies are developing or marketing treatments for narcolepsy  Approved drugs for narcolepsy include Teva Pharma s   NYSE TEVA   Provigil and Novartis    NYSE NVS   Ritalin SR  Avadel Pharmaceuticals plc   NASDAQ AVDL   is developing a narcolepsy candidate Jazz Pharmaceuticals PLC Price
    Zacks RankJazz currently has Zacks Rank  2  Buy   You can see  Breakout Biotech Stocks with Triple Digit Profit PotentialThe biotech sector is projected to surge beyond  775 billion by 2024 as scientists develop treatments for thousands of diseases  They re also finding ways to edit the human genome to literally erase our vulnerability to these diseases Zacks has just released Century of Biology  7 Biotech Stocks to Buy Right Now to help investors profit from 7 stocks poised for outperformance  Our recent biotech recommendations have produced gains of  98    119  and  164  in as little as 1 month  The stocks in this report could perform even better ",2019-06-17,Zacks Investment Research,https://www.investing.com/analysis/jazzs-jazz-new-sleep-drug-sunosi-gets-schedule-iv-status-200432506,200432506
