,id,ticker,title,category,content,date,provider,url,article_id
21068,242583,BCPC,Zacks com Featured Expert Kevin Matras Highlights  Balchem  Methode Electronics  Chemed  Ubiquiti Networks And HEXO,opinion,"For Immediate Release
Chicago  IL   March 12  2019  Stocks in this week s article include Balchem Corp    NASDAQ BCPC    Methode Electronics  Inc    NYSE MEI    Chemed Corp    NYSE CHE    Ubiquiti Networks  Inc    NASDAQ UBNT   and HEXO Corp    TO HEXO    Kevin Matras screens for companies showing their  first  profit and explains why they are ones to watch Screen of the Week written by Kevin Matras of Zacks Investment Research 5 Stocks in Focus on New Analyst Coverage
New analyst coverage unearths extensive data on stocks for investors  Analysts are privy to vital information  which is crucial for investment decisions as lack of information creates chances of misinterpretation of stocks  over  or under valued  
Coverage initiation on a stock by analyst s  usually portrays higher investor inclination  Investors  on their part  often assume that there is something special in a stock to attract analysts to cover it  In other words  they believe that the company coming under the microscope definitely holds some value 
Obviously  stocks are not randomly chosen to cover  New coverage on a stock usually reflects a reassuring future envisioned by the analyst s   At times  increased investor focus on a stock motivates analysts to take a closer look at it  After all  who doesn t like to produce something that is already in demand  Hence  we often find that analysts  ratings on newly added stocks are more favorable than their ratings on continuously covered stocks 
Needless to say  the average change in broker recommendation is preferred over a single recommendation change 
Impact on Stock Price
The price movement of a stock is generally a function of the recommendations on it from new analysts  Stocks typically see an upward price movement with a new analyst coverage compared to what they witness with a rating upgrade under an existing coverage  Positive recommendations   Buy and Strong Buy   generally lead to a significantly more positive price reaction than Hold recommendations  On the contrary  analysts hardly initiate coverage with a Strong Sell or Sell recommendation 
Now  if an analyst gives a new recommendation on a company that has very few or no existing coverage  investors start paying more attention to it  Also  any new information attracts portfolio managers to build a position in the stock 
So  it s a good strategy to bet on stocks that have seen increased analyst coverage over the last few weeks 
For the rest of this Screen of the Week article please visit Zacks com at 
Disclosure  Officers  directors and or employees of Zacks Investment Research may own or have sold short securities and or hold long and or short positions in options that are mentioned in this material  An affiliated investment advisory firm may own or have sold short securities and or hold long and or short positions in options that are mentioned in this material 
About Screen of the Week
Zacks com created the first and best screening system on the web earning the distinction as the   1 site for screening stocks  by Money Magazine   But powerful screening tools is just the start  That is why Zacks created the Screen of the Week to highlight profitable stock picking strategies that investors can actively use 
Strong Stocks that Should Be in the News
Many are little publicized and fly under the Wall Street radar  They re virtually unknown to the general public  Yet today s 220 Zacks Rank  1  Strong Buys  were generated by the stock picking system that has more than doubled the market from 1988 through 2016  Its average gain has been a stellar  25  per year  
Follow us on Twitter   
Join us on Facebook  NASDAQ FB    
Zacks Investment Research is under common control with affiliated entities  including a broker dealer and an investment adviser   which may engage in transactions involving the foregoing securities for the clients of such affiliates 
Contact  Jim GiaquintoCompany  Zacks comPhone  312 265 9268Email  
Visit  
Zacks com provides investment resources and informs you of these resources  which you may choose to use in making your own investment decisions  Zacks is providing information on this resource to you subject to the Zacks  Terms and Conditions of Service  disclaimer   
Past performance is no guarantee of future results  Inherent in any investment is the potential for loss  This material is being provided for informational purposes only and nothing herein constitutes investment  legal  accounting or tax advice  or a recommendation to buy  sell or hold a security  No recommendation or advice is being given as to whether any investment is suitable for a particular investor  It should not be assumed that any investments in securities  companies  sectors or markets identified and described were or will be profitable  All information is current as of the date of herein and is subject to change without notice  Any views or opinions expressed may not reflect those of the firm as a whole  Zacks Investment Research does not engage in investment banking  market making or asset management activities of any securities  These returns are from hypothetical portfolios consisting of stocks with Zacks Rank   1 that were rebalanced monthly with zero transaction costs  These are not the returns of actual portfolios of stocks  The S P 500 is an unmanaged index  Visit for information about the performance numbers displayed in this press release ",2019-03-12,Zacks Investment Research,https://www.investing.com/analysis/zackscom-featured-expert-kevin-matras-highlights-balchem-methode-electronics-chemed-ubiquiti-networks-and-hexo-200396746,200396746
21069,242584,BCPC,Ecolab s Nalco Water To Boost Public Health With New Offering,opinion,Ecolab Inc    NYSE ECL   subsidiary Nalco Water recently unveiled a new offering  LegionGuard LG25  which is designed to lower the waterborne pathogen Legionella pneumophila in drinking water systems  The newly introduced offering is another feather in Nalco Water s cap in its persistent efforts to deliver solutions for the improvement of public health Notably  Nalco Water is the world s leading water treatment and process improvement company  The offering is likely to boost Ecolab s Global Industrial segment Legionnaires  Disease at a GlanceAccording to NCBI  National Center for Biotechnology Information  the discovery of Legionnaires  disease was first made by The 1976 American Legion Convention  The disease is a form of atypical pneumonia caused by Legionella bacteria Legionella is prevalent in natural bodies of water and can enter a building s water system from the municipal source  damaged water main or through construction or renovation projects  Per the Centers for Disease Control and Prevention  CDC   potable water is the most common source of exposure to the bacteria Legionnaires  disease is a very serious and deadly form of pneumonia that can spread through contaminated mists and aerosols from water used in showers  cooling towers  hot tubs and spas  decorative fountains  and misters According to WHO the disease occurs worldwide but the rate of occurrence is unknown as many countries lack good surveillance systems to diagnose and detect the disease  In Australia  Europe and the United States of America  there are about 10 15 cases detected per million Few Details about LegionGuard LG25LegionGuard LG25 is an on site generated chlorine dioxide product proven to reduce the bacteria in water that causes Legionnaires  disease  The new offering will provide supplemental treatment for potable  drinking  water and is the first product of its kind to be registered by the U S  Environmental Protection Agency  EPA  for this use LegionGuard LG25  another one of the many innovative technologies offered by Nalco Water  will be utilized as part of an overall water management program to lower the risk of Legionella  As part of a holistic approach to safeguard water for its customers and lower the risk of Legionella in their water systems  LegionGuard LG25 is an important method to protect public health Market ProspectsPer an article by   the global water treatment systems market size is anticipated to be valued at  44 01 billion by 2025 at a CAGR of 7 1   Increase in water pollution  and rising awareness of a healthy lifestyle  is predicted to bolster the market prospect Some other key players in the chemical specialty space are American Vanguard Corporation   NYSE AVD    Celanese Corporation   NYSE CE   and Balchem Corporation   NASDAQ BCPC   AbbA ULTRA and Assure II are two of American Vanguard Corporation s products that deserve mention Further  with respect to Celanese  Clarifoil and Celanex PBT are two products that have been witnessing robust demand ReaShure and NiaShure are two of Balchem s products that deserve mention Wall Street s Next Amazon  NASDAQ AMZN  Zacks EVP Kevin Matras believes this familiar stock has only just begun its climb to become one of the greatest investments of all time  It s a once in a generation opportunity to invest in pure genius ,2019-06-04,Zacks Investment Research,https://www.investing.com/analysis/ecolabs-nalco-water-to-boost-public-health-with-new-offering-200428604,200428604
