,id,ticker,title,category,content,date,provider,url,article_id
138088,359603,TMO,QIAGEN Partners With CENTOGENE  Boosts Bioinformatics Suite,opinion,"QIAGEN   NASDAQ QGEN   has been hogging the limelight on its recent partnership and co marketing agreement with CENTOGENE AG  The partnership aims at delivering complete Sample to Insight research and clinical testing solutions to end users in the field of rare genetic conditions Per the collaboration agreement  QIAGEN will integrate its bioinformatics suite with CENTOGENE s highly developed CentoMD rare disease variant database with the goal to improvise test understanding  Notably  this integration of CentoMD phenotype genotype database is expected to considerably enhance QIAGEN Knowledge Base and QIAGEN Clinical Insight  QCI  bioinformatics solution Under the co marketing agreement  QIAGEN will now act as the authorized and exclusive international commercial distribution partner of CentoMD  Also  QIAGEN s bioinformatics solutions will be licensed by CENTOGENE to support the latter s extensive rare disease diagnostic testing services In a bid to grow its bioinformatics portfolio that offers valuable observations into complex biological data  QIAGEN announced the acquisition of OmicSoft Corporation in January  Through this acquisition  QIAGEN gained access to OmicSoft s powerful multi omics data management infrastructure solutions as well as  omics  data bank We believe the company s latest partnership with CENTOGENE is strategic  taking into consideration the huge prospects of bioinformatics globally  According to a Markets and Markets report  the global bioinformatics market is projected to reach a worth of  16 18 billion by 2021  at a CAGR of 21 1  We believe increased spending on healthcare by government and private organizations  rising awareness triggering need for nucleic acid and protein sequencing and technological innovations and development on the back of successful partnerships between companies and research institutes will continue to drive growth in the bioinformatics market  Thus  the latest development will help QIAGEN cash in on the bountiful opportunities in the niche market Share Price PerformanceQIAGEN has been gaining investor confidence on consistently encouraging results  Over the last six months  the company s share price has outperformed the broader   The stock has gained 25 9   as compared to the broader industry s 12 3  gain  The company has also surpassed the 8 2  gain of the S P 500 market over the same time frame  
 Zacks Rank   Other Key PicksQIAGEN currently carries a Zacks Rank  2  Buy   Other top ranked stocks in the medical sector are Abbott   NYSE ABT    IDEXX Laboratories  Inc    NASDAQ IDXX   and Thermo Fisher Scientific Inc    NYSE TMO    Abbott  IDEXX Laboratories and Thermo Fisher carry a Zacks Rank  2  You can see Abbott has a long term expected earnings growth rate of 10 7   The stock has rallied roughly 25 4  over the last six months IDEXX Laboratories has a long term expected earnings growth rate of 19 8   The stock has gained 40 3  last year Thermo Fisher has a long term expected earnings growth rate of 16 3   The stock has gained 24 8  last year  Today s Stocks from Zacks  Hottest StrategiesIt s hard to believe  even for us at Zacks  But while the market gained  18 8  from 2016   Q1 2017  our top stock picking screens have returned  157 0    128 0    97 8    94 7   and  90 2  respectively And this outperformance has not just been a recent phenomenon  Over the years it has been remarkably consistent  From 2000   Q1 2017  the composite yearly average gain for these strategies has beaten the market more than 11X over  Maybe even more remarkable is the fact that we re willing to share their latest stocks with you without cost or obligation ",2017-10-09,Zacks Investment Research,https://www.investing.com/analysis/qiagen-partners-with-centogene-boosts-bioinformatics-suite-200217979,200217979
138089,359604,TMO,Pacific Biosciences  Bluebee Team Up For De Novo Sequencing,opinion,Pacific Biosciences of California  Inc    NASDAQ PACB   recently formed an alliance with genomic data driven medicine company  Bluebee  to develop an advanced de novo assembly pipeline that integrates both the company s technologies  The combined solution will be introduced at the American Society of Human Genetics   ASHG  annual meeting to be held next week in Orlando  FL Per the announcement  Menlo Park  CA based Pacific Biosciences  de novo assembly pipeline will now be integrated into the Bluebee genomics analysis platform  This integration will offer a simplified workflow and fully automated end to end data analysis solution to allow assembly of genome of any size  including the human variety  This will also include a guaranteed turn around time  enabling better planning and improved productivity With growing demand for Single Molecule  Real Time  SMRT  sequencing in the genomics community  both the companies expect a huge customer adoption of this new cloud based analysis option  Per Pacific Biosciences  this end to end solution integrates downstream data analysis in Bluebee s high security and regulatory compliant computing centers for Pacific Biosciences  global customers Notably  SMRT Sequencing provides a complete and an accurate picture of genomes  courtesy a superior performance of sequencing accuracy  uniformity of coverage  extremely long read lengths and an ability to characterize DNA base modifications  It is the perfect tool to investigate high sequence genetic complexities  otherwise difficult to resolve using short read technologies Industry Prospects Significantly  the prospects for long read sequencing market  where Pacific Biosciences is a leading name  are growing in leaps and bounds  Per a recent report by Decisive Bio Insights  the Next Generation Sequencing  NGS  manufacturer market size will reach  3 2 billion in 2017 and grow at a 12  per annum rate to touch  4 6 billion by 2020  primarily driven by adoption from worldwide clinical customers  We believe  Pacific Biosciences  slew of latest developments to be well timed within this industry Price Performance Over the past three months  the stock has surged more than 40   comparing favorably with the broader industry s gain of roughly 3 6  Zacks Rank   Key PicksPacific Biosciences currently carries a Zacks Rank  3  Hold   A few better ranked stocks in the medical sector are Abbott   NYSE ABT    Thermo Fisher Scientific Inc    NYSE TMO   and IDEXX Laboratories  Inc    NASDAQ IDXX    All the three stocks carry a Zacks Rank  2  Buy   You can see Abbott has a long term expected earnings growth rate of 10 7   The stock has rallied roughly 25 4  over the last six months Thermo Fisher has a long term expected earnings growth rate of 16 3   The stock has gained 21 4  last year IDEXX Laboratories has a long term expected earnings growth rate of 19 8   The stock has surged 35 8  last year Today s Stocks from Zacks  Hottest StrategiesIt s hard to believe  even for us at Zacks  But while the market gained  18 8  from 2016   Q1 2017  our top stock picking screens have returned  157 0    128 0    97 8    94 7   and  90 2  respectively And this outperformance has not just been a recent phenomenon  Over the years it has been remarkably consistent  From 2000   Q1 2017  the composite yearly average gain for these strategies has beaten the market more than 11X over  Maybe even more remarkable is the fact that we re willing to share their latest stocks with you without cost or obligation ,2017-10-09,Zacks Investment Research,https://www.investing.com/analysis/pacific-biosciences-bluebee-team-up-for-de-novo-sequencing-200217968,200217968
138090,359605,TMO,Express Scripts  ESRX  To Buy EviCore  Fortify PBM Business,opinion,Express Scripts Holding Company   NASDAQ ESRX   recently inked an agreement to acquire privately held eviCore healthcare from investors including General Atlantic  TA Associates and Ridgemont Equity Partners for  3 6 billion  The transaction is expected to close in the fourth quarter of 2017 eviCore provides evidence based and integrated medical benefit management services  MBM  solutions that drive cost reduction and quality care outcomes  Notably  eviCore will operate as a standalone business unit under Express Scripts Express Scripts  pharmacy benefit management coupled with eviCore s complementary medical benefits management is likely to build a comprehensive patient benefit management  PBM  solution  This buyout will provide Express Scriptsopportunities to cross sell to both client bases Financial ImpactThe acquisition is expected to prove accretive to Express Scripts  adjusted diluted earnings per share within the first full year of operation  excluding transaction related expenses and amortization of intangibles According to the company  this deal is likely to take care of the  1 trillion that is spent on healthcare annually Industry ProspectsAlthough PBM is a highly competitive industry  a report by Market Research projects the U S  pharmacy benefit management market to see a CAGR of 7 2  between 2014 and 2019  According to a Markets and Markets report  the global healthcare provider network management market will value  2 96 billion by 2020  at a CAGR of 10 7  during the 2015 to 2020 period  Taking this into account  Express Scripts has been consistently trying to expand its core PBM business   The company recently announced plans of expanding its customized workers  compensation pharmacy solutions through the acquisition of myMatrixx  a pharmacy benefit solutions provider for the workers  compensation industry  Furthermore  the company anticipates compounded annual EBITDA growth rate between 2  and 4  from 2017 through 2020 for the core PBM business  However  Express Scripts announced that its biggest customer  the leading health insurer Anthem Inc   ANTM   is not likely to extend its pharmacy benefits management agreement  which is slated for expiration by the end of 2019 Price PerformanceExpress Scripts  stock has underperformed the broader in the last one year  Specifically  the stock has lost 15 9  during this period as against the industry s gain of 1 9  Zacks Rank   Key PicksExpress Scripts currently carries a Zacks Rank  3  Hold   A few better ranked stocks in the medical sector are Abbott   NYSE ABT    IDEXX Laboratories  Inc    NASDAQ IDXX   and Thermo Fisher Scientific Inc    NYSE TMO    Abbott  IDEXX Laboratories and Thermo Fisher carry a Zacks Rank  2  Buy   You can see Abbott has a long term expected earnings growth rate of 10 7   The stock has rallied roughly 35 2  over the last year IDEXX Laboratories has a long term expected earnings growth rate of 19 8   The stock has gained 40 8  last year Thermo Fisher has a long term expected earnings growth rate of 11 7   The stock has gained 25 3  last year Wall Street s Next Amazon  NASDAQ AMZN Zacks EVP Kevin Matras believes this familiar stock has only just begun its climb to become one of the greatest investments of all time  It s a once in a generation opportunity to invest in pure genius ,2017-10-10,Zacks Investment Research,https://www.investing.com/analysis/express-scripts-esrx-to-buy-evicore-fortify-pbm-business-200218257,200218257
138091,359606,TMO,QIAGEN Banks On Tie Ups   Product Launches  Competition Rife,opinion,On Oct 10  we issued an updated research report on Netherlands based molecular diagnostics provider QIAGEN   NASDAQ QGEN    The company offers innovative technologies and products for pre analytical sample preparation and molecular diagnostics solutions We are upbeat about QIAGEN s partnership and co marketing agreement with CENTOGENE AG to boost its bioinformatics portfolio  Also  we are encouraged to note that post the receipt of FDA approval in June  QIAGEN announced the complete launch of the fourth generation of its blood test for tuberculosis  TB  infection   QuantiFERON TB Gold Plus  QFT Plus    in the United States Moreover  the company s strategic focus to drive growth through Sample to Insight offerings buoys optimism  QIAGEN is forming collaborations in the personalized homecare space as well   QIAGEN currently markets products in more than 100 countries  In the last reported second quarter of 2017  the company witnessed growth across all international regions  including the top seven emerging markets On the flip side  over the last three months  QIAGEN has been trading below the broader   As per the latest share price  the company has gained 2 9   compared to 7 1  gain of the broader industry  Moreover  adverse currency translation continues to be a drag on overall sales  Furthermore  declining HPV sales in the United States continues to be a drag  Competitive landscape and heavy dependence on collaborations continue to be concerns Zacks Rank   Other Key PicksQIAGEN currently carries a Zacks Rank  2  Buy   Other top ranked stocks in the medical sector are Abbott   NYSE ABT    IDEXX Laboratories  Inc    NASDAQ IDXX          and Thermo Fisher Scientific Inc    NYSE TMO    Abbott  IDEXX Laboratories and Thermo Fisher carry a Zacks Rank  2  You can see Abbott has a long term expected earnings growth rate of 10 7   The stock has rallied roughly 35 2  over the last year IDEXX Laboratories has a long term expected earnings growth rate of 19 8   The stock has gained 40 8  last year Thermo Fisher has a long term expected earnings growth rate of 11 7   The stock has gained 25 3  last year Wall Street s Next Amazon  NASDAQ AMZN Zacks EVP Kevin Matras believes this familiar stock has only just begun its climb to become one of the greatest investments of all time  It s a once in a generation opportunity to invest in pure genius ,2017-10-10,Zacks Investment Research,https://www.investing.com/analysis/qiagen-banks-on-tieups--product-launches-competition-rife-200218253,200218253
138092,359607,TMO,MedTech Players Eyeing Emerging Market Growth Opportunities ,opinion,"A few months down the line  the Republicans will complete a full year in power  Unfortunately  since the political power change  the healthcare community hasn t had many opportunities to rejoice 
A survey report by Gallup Analytics last month revealed that  U S  adults cited healthcare as the second major problem faced by the country under the new presidential administration  In fact  the debate over repealing the Affordable Care Act  ACA  or Obamacare has been raging for a while now  Per the report  it peaked when it reached the Congress in August  Considering the prevailing uncertainty in the implementation of the health policy  any respite from it in the near term seems unlikely 
MedTech in the United States  A Blurred Picture
Needless to say  the current crisis  in the U S  MedTech industry  an integral part of the broader healthcare space  shows no signs of abating  A few months back  companies  in the space were hopeful about the promised cancellation of the 2 3  MedTech tax of Obamacare under the new government  Unquestionably  the latest political developments have landed the MedTech space in an uncertain territory 
Investors are mulling over whether they should retain their existing MedTech stocks or forego their holdings  in favor of companies in other industries to boost their financial resources  That said  in spite of what the future may hold  we believe investors should stick to the MedTech space as it has shown signs of prosperity in recent times globally 
Yes  you read that right  Even considering the dull performance of the U S  medical device market  that still holds the leading position with almost one third of the world market share  on rising regulatory and legislative uncertainty  global growth has been quite encouraging  In 2016  this industry grew 5   a pace last seen before the financial crisis 
Emerging Markets Hold Immense Promise
The uncertainty in the United States along with the worsening economic condition in Europe automatically shifted the focus to emerging geographies like China  India  Latin America and others 
These emerging economies are seeing  a rise in the uptake of medical devices largely due to growing medical awareness and economic prosperity  An aging population  increasing wealth  government focus on healthcare infrastructure and expansion of medical insurance coverage make these markets a happy hunting ground for global medical device players  Add to it  rising healthcare spending and improving healthcare infrastructure  this growth should continue in 2017 and beyond 
Going by a recent BCG report  the share of emerging markets  which is currently less than a quarter of global MedTech revenues  is likely to increase to nearly one third of revenues by 2022  The MedTech market in China  currently the second largest in the world  is projected to grow about 13  annually from 2015 through 2022  India s Medtech market  the fifth largest in the world  is currently demonstrating 17  annual growth  If this continues  India may give good competition to Japan and Germany by 2022 
Among other emerging geographies  Latin America  even in the face of general economic stagnation  holds enormous potential  Per a January 2017 report by MedTech Intelligence  the Central and South American nations significantly increased per capita spending on healthcare in the period between 2008 and 2014  According to World Bank data  Guatemala increased spending by 27   Brazil 31   Chile 54   Colombia 58   Uruguay 95   Paraguay 115   Bolivia 138   and Ecuador 139   Lower domestic production in Latin America has made it as an open market for U S  exporters  
Investment in Emerging Market Players Looks Sensible
In such a scenario  we believe it will be wise of investors who are keen on MedTech stocks to keep an eye on companies who have turned the emerging markets into a happy hunting ground with their expertise and network  No wonder  these stocks  cashing in on the enormous growth potential of these emerging geographies have perfectly shielded themselves from the political turmoil within the United States 
Let us look at a few MedTech players with significant emerging market presence 
Given the huge potential in these regions  long back  Johnson   Johnson   NYSE JNJ   had set up manufacturing and R D centers in Brazil  China and India  The company s medical device segment of emerging markets is growing three to four times faster than the developed markets  It has been doing business in China for nearly 30 years and is expanding further here on the back of the Synthes acquisition  Johnson   Johnson Price and Consensus

    
Abbott   NYSE ABT   continues to lead the emerging market investment trend with about 50  of sales from this region  In recent quarters  sales in key emerging markets were up in double digits  driven by strength in BRIC as well as strong growth in several countries throughout Latin America  including Colombia  Mexico  Peru and Argentina Abbott Laboratories Price and Consensus

    
At Medtronic   NYSE MDT    in the last reported first quarter of fiscal 2017  businesses in China  Latin America  and Southeast Asia showed sustained strength  growing in double digits  Overall  Medtronic remains confident about its long term outlook for emerging markets  The company is focused on developing new public and private partnerships as well as executing channel optimization strategies Medtronic PLC Price and Consensus

    
Boston Scientific s   NYSE BSX   emerging markets business registered 14  organic growth in second quarter 2017  a significant increase from 8  growth in 2013  Business in China was once again remarkable  up 20  year over year   The company is currently looking forward to much better performance ahead in China  banking on the recent approval of SYNERGY in China Boston Scientific Corporation Price and Consensus

    
Thermo Fisher   NYSE TMO   too is leaving no stone unturned to expand its presence in emerging markets  The company garnered 20  of total revenue from the high growth Asia Pacific and emerging markets in 2016 from 10  in 2006 Thermo Fisher Scientific Inc Price and Consensus

    
Wall Street s Next Amazon  NASDAQ AMZN 
Zacks EVP Kevin Matras believes this familiar stock has only just begun its climb to become one of the greatest investments of all time  It s a once in a generation opportunity to invest in pure genius ",2017-10-12,Zacks Investment Research,https://www.investing.com/analysis/medtech-players-eyeing-emerging-market-growth-opportunities-200218535,200218535
138093,359608,TMO,CryoLife To Buy JOTEC  Preliminary Revenue Result Out For Q3,opinion,"CryoLife  Inc    NYSE CRY   recently entered into a definitive agreement to buy German based JOTEC AG  JOTEC   a privately held maker of technologically advanced endovascular stent grafts and cardiac and vascular surgical grafts focused on aortic repair  The company has been recording revenue CAGR of 17  over the last five years Under the financial terms of the agreement  CryoLife will pay an aggregate of up to  225 million for the deal  with around  168 75 million in cash and  56 25 million in shares of CryoLife s common stock issued to JOTEC s shareholders  The buyout is slated to complete later in 2017  subject to customary closing conditions Through this deal  CryoLife aims at expanding the existing portfolio with products focused on aortic surgery  thereby solidifying its footprint in the fast growing endovascular surgical market Per management  this deal will help CryoLife diversify its business by gaining access to the  2 billion global market for stent grafts used in endovascular and open repair of aortic diseases  The market is projected to value around  2 5 billion by 2021  Interestingly  CryoLife aims at delivering consistent  high single digit revenue growth through this deal The deal is also in line with the company s strategy to directly sell by eliminating distributors in Europe while creating cross selling opportunities for the company s product portfolios  In the last reported quarter  CryoLife began the process of direct selling in Canada  Belgium  the Netherlands and Luxembourg  expanding direct operations in Europe At the same time  management expects the newly added products to continue to post double digit growth outside the United States for at least the next five years  Moreover  the deal is expected to prove accretive to the company s non GAAP EPS at a CAGR of not less than 20  over the next five years  while contributing to gross and operating margin CryoLife expects to gain access to the  1 2 billion U S  stent graft market  which is projected to value roughly  1 5 billion by 2021 through the newly gained  highly competitive product portfolio and advanced research and development platform  Thus  the company expects this deal to drive growth through 2018 as well CryoLife also provided a sneak peek into its preliminary third quarter results  The company has recorded revenues of  44 0 million  This considers a negative impact of around  1 million from hurricanes  delay in receipt of re certification of Ascending Aortic Prosthesis  reversal of around  1 1 million of recorded revenues on repurchase of some inventory from third party distributors in order to sell directly We believe unhealthy lifestyle  favorable demographics  rising expenditure on healthcare by government and technological developments will continue to drive growth in the aortic aneurysm market  This fact is further substantiated by a Research and Markets report published by Nasdaq  Per the report  the global aortic aneurysm market is estimated to witness a CAGR of 6 6  between 2017 and 2023  Thus  this acquisition deal is expected to boost the top line of CryoLife Share Price PerformanceOver the last six months  CryoLife has been trading above the broader   The stock has gained 35 1   compared with the broader industry s 14 4  rise  

 Zacks Rank   Key PicksCryoLife currently carries a Zacks Rank  3  Hold   A few better ranked stocks in the medical sector are QIAGEN   NASDAQ QGEN    IDEXX Laboratories  Inc    NASDAQ IDXX   and Thermo Fisher Scientific Inc    NYSE TMO    QIAGEN  IDEXX Laboratories and Thermo Fisher carry a Zacks Rank  2  Buy   You can see QIAGEN has a long term expected earnings growth rate of 13 1   The stock has rallied roughly 31 9  last year IDEXX Laboratories has a long term expected earnings growth rate of 19 8   The stock has gained 42 8  last year Thermo Fisher has a long term expected earnings growth rate of 11 7   The stock has gained 27 2  last year Wall Street s Next Amazon  NASDAQ AMZN Zacks EVP Kevin Matras believes this familiar stock has only just begun its climb to become one of the greatest investments of all time  It s a once in a generation opportunity to invest in pure genius ",2017-10-12,Zacks Investment Research,https://www.investing.com/analysis/cryolife-to-buy-jotec-preliminary-revenue-result-out-for-q3-200218425,200218425
