,id,ticker,title,category,content,date,provider,url,article_id
156804,378320,NRG,The Zacks Analyst Blog Highlights  NRG Energy  Lannett Company  Genesis Healthcare  US Foods And Grocery Outlet,opinion,For Immediate ReleaseChicago  IL   October 18  2019   Zacks com announces the list of stocks featured in the Analyst Blog  Every day the Zacks Equity Research analysts discuss the latest news and events impacting stocks and the financial markets  Stocks recently featured in the blog include  NRG Energy  Inc    NYSE NRG    Lannett Company  Inc    NYSE LCI    Genesis Healthcare  Inc    NYSE GEN    US Foods Holding Corp    NYSE USFD   and Grocery Outlet Holding Corp    NASDAQ GO   Here are highlights from Thursday s Analyst Blog  Buy These 5 Defensive Stocks to Counter Market VolatilityU S retail sales fell in September  indicating that the trade war has taken a toll on consumers  September s manufacturing data also showed contraction and both data are pointing toward an economic slowdown  Further  emerging political issues between the United States and China clouded investors  sentiment In this highly volatile market scenario  investors should move toward purchasing safer defensive stocks  Here are the top five defensive stocks that can provide stable returns Poor Economic DataThe health of the U S  economy that rests on the strength of U S  consumers has also declined  As per the government s report on Oct 16  U S  retail sales fell 0 3  in September  for the first time in seven months  However  a revision in U S  retail sales in August was reported  Retail sales were raised to 0 6  from the original reading of the 0 4  increase In September  retail sales were weighed down by a 0 9  fall in auto sales  which is the biggest drop in eight months  Sales at gas stations declined 0 7   which is mostly due to the cheaper gasoline price Softness was reported in other sectors too  Sales at building materials stores dropped 0 1   while hobby  musical instrument and book stores posted a 0 1  drop in sales  Online and mail order retail sales also saw a drop of 0 3  for first time this year  Decrease in retail sales indicate that consumers are worried about the consequences of the trade war and hence restraining from spending Earlier this month  the Institute for Supply Management s  ISM  manufacturing index fell deeper into contraction  The ISM s factory index slipped to 47 8 in September  which is the lowest since June 2009  The reading reported on Oct 1 clearly indicates a downturn and spooked investors  putting major benchmarks in negative territory Looming Geopolitical TensionInvestors got a temporary relief after Oct 11 s U S  China high level talk that led to the announcement of a  Phase One  deal  This had eased the prevailing trade war tensions but President Donald Trump on Oct 16 said that he may not sign any trade deal with China before he meets China s President Xi Jinping at November s APEC forum in Chile The balance got tipped after the U S  House of Representatives on Oct 15 passed three bills overnight to support pro democracy protesters in Hong Kong  China vowed and threatened to retaliate over America s interference in their domestic issue  The three bills support the right of individuals to protest  allow the United States to check on China s influence over the territory and prevents U S  weapons from being used against protestors by Chinese police If the bills get passed as law  the  phase one  deal will be out of question and may damage all progress made in the U S  China trade talk 5 Defensive Stocks to BuyThe aforesaid factors are impacting the market deeply  making it highly volatile  Investors should now invest in defensive stocks that have a stable performance in any market gyration Defensive stocks like utilities  consumer staples and healthcare have stable earnings regardless of market condition  These stocks stay in demand irrespective of the business cycle as they are products or services of basic necessity  Even when consumers are spending less  demand for these products is unaffected as these products are required for people to survive We have thus shortlisted five such stocks that not only flaunts a Zacks Rank  1  Strong Buy  or 2  Buy  NRG Energy  Inc is a publicly traded company engaged in production  sale and delivery of energy to residential  industrial and commercial consumers across the United States  The company s expected earnings growth rate for the current year is 61 4   above the industry s projected rally of 5 1   The Zacks Consensus Estimate for current year earnings has improved 1  over the past 60 days NRG Energy carries a Zacks Rank  1 and has outperformed the  industry over the past one month period   1 5  vs  0 7    You can see the complete list of today s Zacks  1 Rank stocks here Lannett Company  Inc is a publicly traded company that manufactures and distributes high quality  affordable generic medications  The company s expected earnings growth rate for the next year is 33 6   above the industry s projected rally of 16   The Zacks Consensus Estimate for current year earnings has improved 26 3  over the past 60 days Lannett Company carries a Zacks Rank  1 and has outperformed the  industry over the past one year period   194 3  vs  20 6   Genesis Healthcare  Inc is a publicly traded company that provides long term care  assisted or senior living and rehabilitation therapy  The company s expected earnings growth rate for the next quarter is 88 1   in contrast to industry s decline of 169 8   The Zacks Consensus Estimate for current year earnings has improved 93 5  over the past 60 days Genesis Healthcare carries a Zacks Rank  1 and has outperformed the  industry on a year to date period   16 9  vs  9   US Foods Holding Corp is a publicly traded company that manufactures and distributes high quality  affordable generic medications  The company s expected earnings growth rate for the current year is 12 3   The Zacks Consensus Estimate for current year earnings has improved 2 7  over the past 60 days US Foods flaunt a Zacks Rank  1 and has outperformed the  industry over the past one year period   30 1  vs  1 1   Grocery Outlet Holding Corp is a publicly traded company that owns and operates a chain of grocery stores in the United States  The company s expected earnings growth rate for the next year is 14 1   The Zacks Consensus Estimate for current year earnings has improved 1 4  over the past 60 days Grocery Outlet carries a Zacks Rank  2 and has outperformed the  industry over the past one year period   17 2  vs  13 8   7 Best Stocks for the Next 30 DaysJust released  Experts distill 7 elite stocks from the current list of 220 Zacks Rank  1 Strong Buys  They deem these tickers  Most Likely for Early Price Pops  Since 1988  the full list has beaten the market more than 2X over with an average gain of  24 50  per year  So be sure to give these hand picked 7 your immediate attention Media ContactZacks Investment Research800 767 3771 ext  9339  Past performance is no guarantee of future results  Inherent in any investment is the potential for loss  This material is being provided for informational purposes only and nothing herein constitutes investment  legal  accounting or tax advice  or a recommendation to buy  sell or hold a security  No recommendation or advice is being given as to whether any investment is suitable for a particular investor  It should not be assumed that any investments in securities  companies  sectors or markets identified and described were or will be profitable  All information is current as of the date of herein and is subject to change without notice  Any views or opinions expressed may not reflect those of the firm as a whole  Zacks Investment Research does not engage in investment banking  market making or asset management activities of any securities  These returns are from hypothetical portfolios consisting of stocks with Zacks Rank   1 that were rebalanced monthly with zero transaction costs  These are not the returns of actual portfolios of stocks  The S P 500 is an unmanaged index  Visit  for information about the performance numbers displayed in this press release ,2019-10-17,Zacks Investment Research,https://www.investing.com/analysis/the-zacks-analyst-blog-highlights-nrg-energy-lannett-company-genesis-healthcare-us-foods-and-grocery-outlet-200475275,200475275
156805,378321,NRG,Top Ranked Momentum Stocks To Buy For October 22nd,opinion,Here are four stocks with buy rank and strong momentum characteristics for investors to consider today  October 22nd Costamare Inc   CMRE   This container ship and liner owning and chartering company has a Zacks Rank  1  Strong Buy  and witnessed the Zacks Consensus Estimate for its current year earnings increasing 7 1  over the last 60 days Costamare Inc  Price and Consensus   Costamare s shares gained 9 8  over the last one month above the S P 500 s increase 0 5   The company possesses a  of A Costamare Inc  Price   Lithia Motors  Inc   LAD   This automotive retailing company has a Zacks Rank  1 and witnessed the Zacks Consensus Estimate for its current year earnings increasing 0 4  over the last 60 days Lithia Motors  Inc  Price and Consensus   Lithia Motors  shares gained 3 5  over the last one month  The company possesses a Momentum Score of A Lithia Motors  Inc  Price   NRG Energy  NYSE NRG   Inc   NRG   This energy company has a Zacks Rank  1 and witnessed the Zacks Consensus Estimate for its current year earnings increasing nearly 1 8  over the last 60 days NRG Energy  Inc  Price and Consensus   NRG Energy s shares gained 2 7  over the last one month  The company possesses a Momentum Score of A NRG Energy  Inc  Price   Summit Therapeutics plc  SMMT   This bio pharmaceutical company has a Zacks Rank  1 and witnessed the Zacks Consensus Estimate for its current year earnings increasing 23 2  over the last 60 days Summit Therapeutics PLC Price and Consensus   Summit Therapeutics  shares gained 26 6  over the last one month  The company possesses a Momentum Score of A Summit Therapeutics PLC Price   See the Learn more about the  7 Best Stocks for the Next 30 DaysJust released  Experts distill 7 elite stocks from the current list of 220 Zacks Rank  1 Strong Buys  They deem these tickers  Most Likely for Early Price Pops  Since 1988  the full list has beaten the market more than 2X over with an average gain of  24 50  per year  So be sure to give these hand picked 7 your immediate attention ,2019-10-21,Zacks Investment Research,https://www.investing.com/analysis/top-ranked-momentum-stocks-to-buy-for-october-22nd-200476284,200476284
156806,378322,NRG,Top Ranked Growth Stocks To Buy For October 25th,opinion,Here are three stocks with buy ranks and strong growth characteristics for investors to consider today  October 25th Zumiez Inc   ZUMZ   This specialty retailer of apparel  footwear and accessories etc  which carries a Zacks Rank  1  Strong Buy   has witnessed the Zacks Consensus Estimate for its current year earnings increasing 14 3  over the last 60 days Zumiez Inc  Price and Consensus   Zumiez has a PEG ratio of 1 25 compared with 2 85 for the industry  The company possesses a  of A Zumiez Inc  PEG Ratio  TTM    NRG Energy  NYSE NRG   Inc   NRG  This producer of electricity  which carries a Zacks Rank  1  has witnessed the Zacks Consensus Estimate for its current year earnings increasing 1 8  over the last 60 days NRG Energy  Inc  Price and Consensus   NRG Energy has a PEG ratio of 0 28  compared with 2 93 for the industry  The company possesses a Growth Score of A NRG Energy  Inc  PEG Ratio  TTM    Woodward  Inc   WWD   This designer and manufacturer of control solutions for the aerospace and industrial markets  which carries a Zacks Rank  2  Buy   has witnessed the Zacks Consensus Estimate for its current year earnings increasing 0 4  over the last 60 days Woodward  Inc  Price and Consensus   Woodward has a PEG ratio of 1 61  compared with 2 43 for the industry  The company possesses a Growth Score of B Woodward  Inc  PEG Ratio  TTM    See the  Learn more about the  5 Stocks Set to DoubleEach was hand picked by a Zacks expert as the  1 favorite stock to gain  100  or more in 2020  Each comes from a different sector and has unique qualities and catalysts that could fuel exceptional growth Most of the stocks in this report are flying under Wall Street radar  which provides a great opportunity to get in on the ground floor ,2019-10-24,Zacks Investment Research,https://www.investing.com/analysis/top-ranked-growth-stocks-to-buy-for-october-25th-200478577,200478577
156829,378345,NRG,NRG Energy  NRG  Gains As Market Dips  What You Should Know,opinion,"In the latest trading session  NRG Energy  NYSE NRG  closed at  39 02  marking a  0 26  move from the previous day  This change outpaced the S P 500 s 1 56  loss on the day  At the same time  the Dow lost 1 19   and the tech heavy Nasdaq lost 1 67  
Coming into today  shares of the power company had gained 2 85  in the past month  In that same time  the Utilities sector gained 2 22   while the S P 500 lost 1 22  
Wall Street will be looking for positivity from NRG as it approaches its next earnings report date  In that report  analysts expect NRG to post earnings of  2 17 per share  This would mark year over year growth of 130 85  
For the full year  our Zacks Consensus Estimates are projecting earnings of  3 89 per share and revenue of  9 36 billion  which would represent changes of  61 41  and  10   respectively  from the prior year 
Any recent changes to analyst estimates for NRG should also be noted by investors  These revisions typically reflect the latest short term business trends  which can change frequently  As a result  we can interpret positive estimate revisions as a good sign for the company s business outlook 
Research indicates that these estimate revisions are directly correlated with near term share price momentum  We developed the Zacks Rank to capitalize on this phenomenon  Our system takes these estimate changes into account and delivers a clear  actionable rating model 
The Zacks Rank system ranges from  1  Strong Buy  to  5  Strong Sell   It has a remarkable  outside audited track record of success  with  1 stocks delivering an average annual return of  25  since 1988  Over the past month  the Zacks Consensus EPS estimate has moved 1 97  higher  NRG currently has a Zacks Rank of  2  Buy  
Investors should also note NRG s current valuation metrics  including its Forward P E ratio of 10 01  Its industry sports an average Forward P E of 21 61  so we one might conclude that NRG is trading at a discount comparatively 
Investors should also note that NRG has a PEG ratio of 0 28 right now  The PEG ratio is similar to the widely used P E ratio  but this metric also takes the company s expected earnings growth rate into account  NRG s industry had an average PEG ratio of 3 97 as of yesterday s close 
The Utility   Electric Power industry is part of the Utilities sector  This industry currently has a Zacks Industry Rank of 68  which puts it in the top 27  of all 250  industries 
The Zacks Industry Rank includes is listed in order from best to worst in terms of the average Zacks Rank of the individual companies within each of these sectors  Our research shows that the top 50  rated industries outperform the bottom half by a factor of 2 to 1 
Make sure to utilize Zacks  Com to follow all of these stock moving metrics  and more  in the coming trading sessions ",2019-10-08,Zacks Investment Research,https://www.investing.com/analysis/nrg-energy-nrg-gains-as-market-dips-what-you-should-know-200471639,200471639
156830,378346,NRG,Top Ranked Growth Stocks To Buy For October 14th,opinion,Here are four stocks with buy ranks and strong growth characteristics for investors to consider today  October 14th Career Education Corporation  CECO   This higher educationcompany which carries a Zacks Rank  1  Strong Buy   has witnessed the Zacks Consensus Estimate for its current year earnings increasing 9 7  over the last 60 days Career Education Corporation Price and Consensus   Career Education has a PEG ratio of 0 81 compared with 1 48 for the industry  The company possesses a of A Career Education Corporation PEG Ratio  TTM    NRG Energy  NYSE NRG   Inc   NRG   This energy company  which carries a Zacks Rank  1  has witnessed the Zacks Consensus Estimate for its current year earnings increasing 1 6  over the last 60 days NRG Energy  Inc  Price and Consensus   NRG Energy has a PEG ratio of 0 28  compared with 2 91 for the industry  The company possesses a Growth Score of A NRG Energy  Inc  PEG Ratio  TTM    BrightView Holdings  Inc   BV   This landscaping service company  which carries a Zacks Rank  1  has witnessed the Zacks Consensus Estimate for its current year earnings increasing 0 9  over the last 60 days BrightView Holdings  Inc  Price and Consensus   BrightView Holdings has a PEG ratio of 0 74  compared with 13 87 for the industry  The company possesses a Growth Score of A BrightView Holdings  Inc  PEG Ratio  TTM    Dell Technologies Inc   DELL   This computer software company  which carries a Zacks Rank  1  has witnessed the Zacks Consensus Estimate for its current year earnings increasing 13 6  over the last 60 days Dell Technologies Inc  Price and Consensus   Dell has a PEG ratio of 0 58  compared with 2 44 for the industry  The company possesses a Growth Score of A Dell Technologies Inc  PEG Ratio  TTM    See the Learn more about the Breakout Biotech Stocks with Triple Digit Profit PotentialThe biotech sector is projected to surge beyond  775 billion by 2024 as scientists develop treatments for thousands of diseases  They re also finding ways to edit the human genome to literally erase our vulnerability to these diseases Zacks has just released Century of Biology  7 Biotech Stocks to Buy Right Now to help investors profit from 7 stocks poised for outperformance  Our recent biotech recommendations have produced gains of  98    119  and  164  in as little as 1 month  The stocks in this report could perform even better ,2019-10-13,Zacks Investment Research,https://www.investing.com/analysis/top-ranked-growth-stocks-to-buy-for-october-14th-200473266,200473266
