,id,ticker,title,category,content,date,provider,url,article_id
26934,248449,AIMC,Manitex Names Crane Sales   Service As Knuckleboom Dealer,opinion,"Manitex International  Inc    NASDAQ MNTX   recently announced the appointment of Nebraska based Crane Sales   Service as a Manitex PM knuckleboom dealer for Nebraska  North Dakota  South Dakota   Iowa  It will expand the spread of the Midwest distribution for the knuckleboom cranes Crane Sales   Service handles a broad range of products and serves the knuckleboom truck market  Its combination with Manitex will provide customers with the industry s best products  service  and support Manitex s UpTime program is consistent with Crane Sales   Service s view of selling uptime to customer by providing cranes backed with industry leading parts  service  and support  Crane Sales   Service offers the full line of Manitex PM articulating and drywall cranes  and sales these high quality cranes to customers Manitex International  Inc  Price
    Manitex is taking initiatives for future growth by implementing cost reductions and reducing debt levels  Moreover  the company is elevating its competitive position in the market and witnessing market share gains in core businesses Shares of Manitex have outperformed the Zacks categorized  industry over the past six months  Its shares have gained 26 5   while the industry logged in a return of around 13 2  over the same period Manitex currently carries a Zacks Rank  3  Hold  Better ranked stocks in the same space include Altra Industrial Motion Corp    NASDAQ AIMC    Applied Industrial Technologies  Inc    NYSE AIT   and Graco Inc    NYSE GGG    All three stocks boast a Zacks Rank  1  Strong Buy    You can see Altra Industrial Motion has a positive average earnings surprise of 15 93  for the last four quarters  Applied Industrial Technologies delivered an average positive earnings surprise of 9 78  over the past four quarters  Graco generated an average positive earnings surprise of 13 88  over the trailing four quarters 3 Stocks to Ride a 588  Revenue ExplosionAt Zacks  we re mostly focused on short term profit cycles  but the hottest of all technology mega trends is starting to take hold   By last year  it was already generating  8 billion in global revenues  By 2020  it s predicted to blast through the roof to  47 billion  Famed investor Mark Cuban says it will produce  the world s first trillionaires   but that should still leave plenty of money for those who make the right trades early ",2017-06-14,Zacks Investment Research,https://www.investing.com/analysis/manitex-names-crane-sales---service-as-knuckleboom-dealer-200195484,200195484
26960,248475,AIMC,Here s Why AGCO Corporation  AGCO  Stock Is A Must Buy Now,opinion,AGCO Corporation   NYSE AGCO    a manufacturer and distributor of agricultural equipment and related replacement parts  has been performing well of late  Shares of this Zacks Rank  1  Strong Buy  stock have gained 10 5  year to date If you haven t taken advantage of the share price appreciation yet  the time is right for you to add the stock as AGCO looks promising and is poised to carry the momentum ahead  Additionally  the stock carries long term earnings growth rate of 12 11  What s Working in Favor of AGCO Estimates on the UpswingWe note that earnings estimates for AGCO have displayed a healthy uptrend  For 2017  all the 10 estimates moved up over the last 30 days  with the Zacks Consensus Estimate rising approximately 10  to  2 75  The Zacks Consensus Estimate for 2018 also jumped 8 4  over the same time period to  3 36 Positive Earnings Surprise HistoryAGCO has an impressive earnings surprise history  outpacing the Zacks Consensus Estimate in all the trailing four quarters  delivering a positive average earnings surprise of 40 39  Upbeat GuidanceAGCO raised its net sales guidance to approximately  7 7 billion for 2017  The company believes that its gross and operating margins are likely to improve from the 2016 levels due to the benefit of its fixed cost reduction efforts  as well as consistent progress on productivity and purchasing initiatives Based on these assumptions  earnings per share for 2017 are targeted to be approximately  2 70  AGCO projects capital expenditures to be nearly  200  225 million and free cash flow to be in the band of  225  250 million  Finally  the company guided its second quarter earnings per share to be about  1 00 per share Stock is UndervaluedAGCO has a trailing 12 month price earnings  P E  ratio of 27 22  while the Zacks categorized  sub industry s average trailing 12 month P E ratio is 27 14  Based on this ratio  the stock seems undervalued Other Stocks to ConsiderOther top ranked stocks in the same space include Deere   Company   NYSE DE    Altra Industrial Motion Corp    NASDAQ AIMC   and Applied Industrial Technologies  Inc    NYSE AIT    All three stocks sport a Zacks Rank  1  Strong Buy   You can see the Deere has a remarkable average positive earnings surprise of 70 41  for the last four quarters  Altra Industrial Motion generated an average positive earnings surprise of 15 93  over the trailing four quarters  Applied Industrial Technologies has delivered an average positive earnings surprise of 9 78  in the past four quarters More Stock News  8 Companies Verge on Apple Like RunDid you miss Apple  NASDAQ AAPL  s 9X stock explosion after they launched their iPhone in 2007  Now 2017 looks to be a pivotal year to get in on another emerging technology expected to rock the market  Demand could soar from almost nothing to  42 billion by 2025  Reports suggest it could save 10 million lives per decade which could in turn save  200 billion in U S  healthcare costs A bonus Zacks Special Report names this breakthrough and the 8 best stocks to exploit it  Like Apple in 2007  these companies are already strong and coiling for potential mega gains ,2017-05-29,Zacks Investment Research,https://www.investing.com/analysis/here's-why-agco-corporation-(agco)-stock-is-a-must-buy-now-200192180,200192180
26962,248477,AIMC,7 Reasons To Add Rockwell Automation To Your Portfolio Now,opinion,Shares of Rockwell Automation Inc    NYSE ROK    the original equipment manufacturer  OEM  of industrial automation equipment  application specific integrated software and consulting design services  have been performing well of late If you haven t taken advantage of the share price appreciation yet  the time is right for you to add the stock to portfolio as it looks promising and is poised to carry the momentum ahead  The Zacks Rank  1  Strong Buy  stock has an estimated long term earnings growth rate of 10 63  Estimates NorthboundEstimates for Rockwell Automation have moved up over the past 30 days  reflecting the optimistic outlook of analysts  The earnings estimate for third quarter fiscal 2017  fiscal 2017 and 2018 have all gone up in the last 30 days For third quarter fiscal 2017  the Zacks Consensus Estimate for earnings has gone up 5 8  over the past 30 days and is pegged at  1 64  depicting year over year growth of 5 8   The estimate for fiscal 2017 climbed 5 9  to  6 64  reflecting 20  year over year growth  The Zacks Consensus Estimate for fiscal 2018 also moved north 6 3  to  7 27 Positive Earnings Surprise HistoryRockwell Automation outpaced the Zacks Consensus Estimate over the trailing four quarters  generating a positive average earnings surprise of 9 89  Ahead of the IndustryThe company has outperformed the Zacks categorized  sub industry in the past one year  Shares have gained 29 1   while the industry recorded growth of 29  Stock Seems UndervaluedRockwell Automation has a trailing 12 month price earnings  P E  ratio of 24 14  while the Zacks categorized sub industry s average trailing 12 month P E ratio is 24 03  Based on this ratio  the stock seems undervalued Upbeat Q2Rockwell Automation reported record second quarter fiscal 2017 adjusted earnings per share of  1 55  up 13  from  1 37 earned in the prior year quarter  Earnings also outpaced the Zacks Consensus Estimate of  1 40  registering a positive earnings surprise of 11  Hiked GuidanceGiven the upbeat fiscal second quarter performance  Rockwell Automation raised its fiscal 2017 sales growth guidance to the range of 4 5 7 5   The company now anticipates adjusted EPS in the range of  6 45  6 75 per share for the fiscal year Growth DriversRockwell Automation s new Connected Enterprise  CE  integrated supply chain management system will prove conducive to growth  The company is increasing the number of industries  applications and geographies  as well as improving its investments to expand the value of CE  With average profitability well above the corporate average  CE sales will be an integral part of Rockwell s incremental growth and boost margins over the next few years Rockwell Automation continues to target long term revenue growth of 6 8   The company also maintains its objective of delivering double digit EPS growth  return on invested capital  ROIC  of more than 20  over the long term  and cash flow of around 100  of adjusted income  These long term goals will be supported by Rockwell Automation s strategy of diversifying its sales streams by expanding products portfolio  solutions and services  as well as global presence The company also aims to achieve growth rates in excess of the automation market by expanding its served market  strengthening competitive differentiation  and serving a wider range of industries and applications  Moreover  it will gain from increased investment  acquisitions and product launches Other Stocks to ConsiderOther top ranked stocks in the same sector are iRobot Corporation   NASDAQ IRBT    Altra Industrial Motion Corp    NASDAQ AIMC   and Parker Hannifin Corporation   NYSE PH    All the three stocks boast a Zacks Rank  1  Strong Buy   You can see iRobot Corporation has an average positive earnings surprise of 61 72  for the trailing four quarters  Altra Industrial Motion generated an average positive earnings surprise of 15 93  over the past four quarters  while Parker Hannifin has an average positive earnings surprise of 14 94  for the last four quarters Will You Make a Fortune on the Shift to Electric Cars Here s another stock idea to consider  Much like petroleum 150 years ago  lithium power may soon shake the world  creating millionaires and reshaping geo politics  Soon electric vehicles  EVs  may be cheaper than gas guzzlers  Some are already reaching 265 miles on a single charge With battery prices plummeting and charging stations set to multiply  one company stands out as the  1 stock to buy according to Zacks research It s not the one you think ,2017-05-17,Zacks Investment Research,https://www.investing.com/analysis/7-reasons-to-add-rockwell-automation-to-your-portfolio-now-200190047,200190047
26963,248478,AIMC,Deere  DE  Beats On Q2 Earnings   Revenues  Raises FY17 View,opinion,"Deere   Company s   NYSE DE   second quarter fiscal 2017  ended Apr 30  2017  earnings surged around 59 6  year over year to  2 49 per share  Earnings also beat the Zacks Consensus Estimate of  1 70 by a wide margin of 46 5  Operational UpdateNet sales of equipment operations  which comprise Agriculture and Turf  Construction and Forestry  came in at  7 260 billion  up 2  year over year  Revenues surpassed the Zacks Consensus Estimate of  7 244 billion Price realization had an impact of 2  in the quarter  Foreign currency rates did not have a material translation effect on net sale  Region wise  equipment net sales decreased 5  in the U S  and Canada  but increased 14  in the rest of the world  Total net sales  including financial services and others  were  8 287 billion  up 5  year over year Deere   Company Price  Consensus and EPS Surprise
 

   Cost of sales in the quarter edged down 1 6  year over year to  5 445 billion  Gross profit in the quarter came in at  1 815 billion  up 15  year over year  Selling  administrative and general expenses increased 8 5  to  775 million  Operating profit significantly improved 50  year over year to  1 271 billion Operating income from equipment operations jumped 61  year over year to  1 111 billion  driven by price realization  the impact of a favorable sales mix  favorable impact of foreign currency exchange and higher shipment volumes  partially offset by elevated warranty cost Segment PerformanceAgriculture   Turf segment s sales inched up 1  year over year to  5 794 billion  primarily due to price realization  Operating profit at the segment surged 63  year over year to  1 003 billion  stemmed by favorable sales mix  price realization and the favorable effects of foreign exchange Construction   Forestry sales increased 7  year over year to  1 466 billion  mainly as a result of higher shipment volumes and price realization  partially offset by higher warranty costs  The segment reported operating profit of  108 million compared with  74 million in the prior year quarter  The increase was driven by shipment volumes and price realization  partially offset by higher warranty costs and a less favorable sales mix Net revenue at Deere s Financial Services division totaled  716 million in the reported quarter  up 10  year over year  The segment s operating profit came in at  160 million  flat year over year  Net income at the segment was  114 4 million  as against  129 4 million recorded in the year earlier quarter Financial UpdateDeere reported cash and cash equivalents of  4 53 billion at the end of the fiscal second quarter  as against  4 13 billion at the end of second quarter 2016  The company reported cash used in operations of  175 million for the six month period ended Apr 30  2017  compared with  312 million in the comparable period in last year  At quarter end  long term borrowing totaled  23 2 billion  down from  24 6 billion recorded at the end of second quarter 2016 Looking AheadDeere raised its equipment sales growth forecast to about 9  year over year for fiscal 2017 from the prior view of 4   The company projects equipment sales to rise about 18  in third quarter fiscal 2017 compared with the year ago period  Foreign currency rates are not expected to have a material translation impact on equipment sales for the fiscal year or the fiscal third quarter  For fiscal 2017  Deere also boosted its outlook for net sales to climb 9  year over year and net income at  2 0 billion Segment wise  Deere estimates Agriculture and Turf equipment sales to increase about 8  in fiscal 2017  with currency translation not expected to have a material impact  Industry sales for agricultural equipment in the U S  and Canada are likely to be down 5  in fiscal 2017 owing to weakness in the livestock sector and the lingering impact of low crop prices  This is also expected to affect both large and small equipment In the EU28 region  sales will be flat to down 5  due to low commodity prices and farm income  In South America  industry sales of tractors and combines are likely to jump about 20  on the back of improving economic and political conditions in Brazil and Argentina  Sales in Asia are projected to remain nearly flat  triggered by higher sales in India  Deere anticipates sales growth of turf and utility equipment in the U S  and Canada to remain around flat for 2017 The company foresees global sales for Construction   Forestry equipment to be up about 13   with no material currency translation impact  The outlook for net income from Financial Services has been set at  475 million for fiscal 2017  Lower losses on lease residual values will be partially offset by less favorable financing spreads and an increased provision for credit losses Share Price PerformanceIn the last one year  Deere has underperformed the Zacks classified  sub industry with respect to price performance  The stock gained 36 9   while the industry recorded growth of 33 6  over the same time frame 
Zacks RankCurrently  Deere carries a Zacks Rank  2  Buy  Other top ranked stocks in the same space include AGCO Corp    NYSE AGCO    Altra Industrial Motion Corp    NASDAQ AIMC   and Applied Industrial Technologies  Inc    NYSE AIT    All three of these stocks sport a Zacks Rank  1  Strong Buy   You can see  AGCO has a remarkable positive average earnings surprise of 40 39  for the last four quarters  Altra Industrial Motion generated a positive average earnings surprise of 15 93  over the trailing four quarters  Applied Industrial Technologies has delivered an average positive earnings surprise of 9 78  in the past four quarters Zacks  Hidden TradesWhile we share many recommendations and ideas with the public  certain moves are hidden from everyone but selected members of our portfolio services  Would you like to peek behind the curtain today and view them Starting now  for the next month  I invite you to follow all Zacks  private buys and sells in real time from value to momentum   from stocks under  10 to ETF to option movers   from insider trades to companies that are about to report positive earnings surprises  we ve called them with 80   accuracy   You can even look inside portfolios so exclusive that they are normally closed to new investors ",2017-05-18,Zacks Investment Research,"https://www.investing.com/analysis/deere-(de)-beats-on-q2-earnings---revenues,-raises-fy17-view-200190245",200190245
26964,248479,AIMC,IDEX  IEX  Hits New 52 Week High On Solid Growth Drivers,opinion,Shares of industrial goods manufacturer IDEX Corporation   NYSE IEX   scaled a new 52 week high of  107 53 in Friday s trading session for a healthy one year return of 29 7   Barring minor hiccups  the company s share price has steadily been on an uptrend since mid April  This Zacks Rank  3  Hold  stock has the potential for further price appreciation with long term earnings growth expectations of 12 0  Growth DriversIDEX has historically generated a healthy cash flow that allows management the opportunity to invest in product innovations  acquisitions and business development  The company intends to optimize its cost structure  increase its competitiveness and reallocate resources to improve profitability  The long term growth prospects of the company therefore appear to be quite encouraging With a diligent execution of operational plans  IDEX has outperformed the Zacks categorized  sector in the last three months with an average return of 15 3  compared with a gain of 5 4  for the latter  IDEX is currently striving to expand its businesses in the emerging markets by focusing on organic growth  The company reported organic growth of 5  in the first quarter of 2017  It witnessed growth for the first time since the fourth quarter of 2014  owing to a steady performance  IDEX further aims to increase its market exposure and improve sales mix by continually developing new products  With a flexible yet disciplined focus on cost and productivity  IDEX expects to successfully tap newer markets to augment its revenues Acquisitions have been IDEX s most favored mode of penetrating unexplored markets  These acquisitions expand its geographic reach  fill technology gaps and strengthen foothold in the existing markets while expanding its product lines  The company reported strong first quarter results with healthy year over year increase in earnings and revenues  IDEX also generated record order levels and witnessed significantly higher demand in the North American industrial markets with a marked improvement in larger capital projects With solid quarterly results and robust demand patterns  IDEX raised its earlier guidance for 2017  The company currently expects 3 4  organic growth in 2017 with adjusted earnings of  4 00  4 17 per share  up from earlier projection of 1 2  organic growth and adjusted earnings of  3 87  3 95  The favorable growth dynamics offer an enticing investment proposition for the investors and probably raised investor confidence  driving the company s shares to a fresh 52 week high Stocks to ConsiderSome better ranked stocks in the industry include Altra Industrial Motion Corp    NASDAQ AIMC    Applied Industrial Technologies  Inc    NYSE AIT   and Graco Inc    NYSE GGG    each sporting a Zacks Rank  1  Strong Buy   You can see  Altra Industrial topped estimates in each of the trailing four quarters with an average positive earnings surprise of 15 9  Applied Industrial has a long term earnings growth expectation of 12   It surpassed estimates thrice in the trailing four quarters with an average positive earnings surprise of 9 8  Graco has a long term earnings growth expectation of 10 3   It surpassed estimates thrice in the trailing four quarters with an average positive earnings surprise of 13 9  Zacks  2017 IPO Watch ListBefore looking into the stocks mentioned above  you may want to get a head start on potential tech IPOs that are popping up on Zacks  radar  Imagine being in the first wave of investors to jump on a company with almost unlimited growth potential  This Special Report gives you the current scoop on 5 that may go public at any time One has driven from 0 to a  68 billion valuation in 8 years  Four others are a little less obvious but already show jaw dropping growth ,2017-05-22,Zacks Investment Research,https://www.investing.com/analysis/idex-(iex)-hits-new-52-week-high-on-solid-growth-drivers-200190604,200190604
26965,248480,AIMC,TriMas  TRS  Reaffirms 2017 Guidance Amid Macro Headwinds ,opinion,On Mar 29  we issued an updated research report on TriMas Corporation   NASDAQ TRS   After posting robust first quarter 2017 results  TriMas reaffirmed its full year 2017 earnings per share range of  1 35  1 45  The company will continue to assess product and facility performance under its new model  In addition  its performance improvement plans in the Energy and Aerospace segments  and innovation in the Packaging and Engineered Components segments will drive growth TriMas has taken many important realignment actions over the past several months to drive performance  Some actions undertaken in the previous quarter include the rationalization of two facilities in its Energy segment  First  the company exited the Wolverhampton  UK facility  in connection with de emphasizing certain products  Additionally  in the Energy segment  it decided to change direction on ramping up a new location in Reynosa  Mexico TriMas continues to focus on cash generation and related de leveraging  In the first quarter  the company reduced its net debt by  68 million to  344 million from the prior period last year  and reduced net debt by  9 7 million from the prior quarter  The company ended the quarter with ample liquidity and with leverage ratio of 2 5x as compared to its longer range target of less than 2x  Free cash flow for the quarter was  17 7 million as compared to use of  5 9 million cash in the same period last year Notably  TriMas experienced increased sales levels of its complex fastener products to both OE and distribution customers during the first quarter  The company continues to see more stable order patterns from its distribution customers  It also remains optimistic that improved demand levels will translate into increasing manufacturing efficiencies and operating leverage through the year However  TriMas  results will be adversely affected by currency volatility and uncertainty in the broader macroeconomic environment  Stronger dollar makes product exports more difficult and translation impacts hamper sales of the company s packaging and energy businesses  in Europe and the UK Additionally  lower oil prices have put significant pressure on TriMas  This decline has most directly affected the Arrow Engine business  which serves the upstream oil and natural gas markets at the well site  within its Engineered Components segment Moreover  Trimas experienced lower demand from upstream and downstream oil and gas customers  and continued to deemphasize certain underperforming regions and products in its energy segment  Further  in the packaging segment the company believes that the impact of softer sales demand experienced toward the end of the first quarter will continue through the second quarter Trimas currently carries a Zacks Rank  3  Hold  Share Price PerformanceIn the last one year  TriMas has outperformed the Zacks classified  sub industry with respect to price performance  The stock gained around 33 1   while the industry recorded growth of 23 3  Stocks to ConsiderSome better ranked stocks in the sector include The Timken Company   NYSE TKR    AGCO Corporation   NYSE AGCO   and Altra Industrial Motion Corp    NASDAQ AIMC    All three stocks boast a Zacks Rank  1  Strong Buy   You can see Timken has an earnings ESP of 12 22  for the trailing four quarters  AGCO has an average earnings surprise of 40 39  for the last four quarters  while Altra Industrial Motion has an average earnings surprise of 15 93  for the past four quarters Zacks  2017 IPO Watch ListBefore looking into the stocks mentioned above  you may want to get a head start on potential tech IPOs that are popping up on Zacks  radar  Imagine being in the first wave of investors to jump on a company with almost unlimited growth potential  This Special Report gives you the current scoop on 5 that may go public at any time One has driven from 0 to a  68 billion valuation in 8 years  Four others are a little less obvious but already show jaw dropping growth ,2017-05-22,Zacks Investment Research,https://www.investing.com/analysis/trimas-(trs)-reaffirms-2017-guidance-amid-macro-headwinds-200190595,200190595
