,id,ticker,title,category,content,date,provider,url,article_id
117591,339106,IAC,States refile lawsuits to block repeal of U S  net neutrality,news,By David Shepardson WASHINGTON  Reuters    A coalition of 22 state attorneys general and the District of Columbia on Thursday refiled legal challenges intended to block the Trump administration s repeal of landmark rules designed to ensure a free and open internet from taking effect  The Federal Communications Commission officially published its order overturning the net neutrality rules in the Federal Register on Thursday  a procedural step that allows for the filing of legal challenges   The states  along with Web browser developer Mozilla Corp and video sharing website Vimeo Inc  O IAC   had filed petitions preserving their right to sue in January  but agreed to withdraw them last Friday and wait for the FCC s publication  The Republican led FCC in December voted 3 2 to overturn 2015 rules barring service providers from blocking  slowing access to or charging more for certain content on the internet   Repealing net neutrality will allow internet service providers to put corporate profits over consumers by controlling what we see  do  and say online   said New York s attorney general  Eric Schneiderman  who is leading the coalition  Other members of the group include California  Illinois  Massachusetts  New Jersey and Pennsylvania  The attorneys general argue that the FCC cannot make  arbitrary and capricious  changes to existing policies and that it misinterpreted and disregarded  critical record evidence on industry practices and harm to consumers and businesses   FCC Chairman Ajit Pai is confident the order will be upheld  his office said in a statement  The White House Office of Management and Budget still must sign off on some aspects of the FCC reversal before it takes legal effect  That could take months  Congressional aides say the publication will trigger a 60 legislative day deadline for Congress to vote on whether to overturn the FCC s decision  U S  Senate Democrats  who hold 49 seats in the 100 person chamber  have the backing of 50 senators for repeal  leaving them one vote short of a majority  Democrats need 51 votes to win any proposal in the Republican controlled Senate because Vice President Mike Pence can break any tie  Even if Democrats do win a Senate majority  reinstatement of net neutrality would also require a favorable vote in the House of Representatives  where Republicans hold a larger majority  and would still be subject to a likely veto by President Donald Trump   The repeal of the net neutrality rules was a victory for internet service providers like AT T Inc  N T   Comcast Corp  O CMCSA  and  Verizon Communications  Inc  N VZ   conferring power over what content consumers can access  On the other side  technology companies including Alphabet Inc  O GOOGL  and  Facebook Inc   O FB  have thrown their weight behind the congressional bid to reverse the net neutrality repeal  The FCC December order also seeks to pre empt states from imposing their own net neutrality rules  But governors in Vermont  Hawaii  Montana  New Jersey and New York have signed orders pledging to do business only with internet providers that abide by net neutrality rules ,2018-02-22,Reuters,https://www.investing.com/news/technology-news/groups-refile-lawsuits-to-block-net-neutrality-reversal-1296227,1296227
117592,339107,IAC,Top 5 Things To Know In The Market On Wednesday,news,"Investing com   Here are the top five things you need to know in financial markets on Wednesday  May 9 
1  Oil Prices Shoot Higher
Oil prices rose around 3  to hit fresh three and a half year highs after U S  President Donald Trump walked away from an international nuclear deal with Iran  raising the risk of conflict in the Middle East and casting uncertainty over global oil supplies 
Brent crude futures at one point touched their highest since November 2014 at  77 20 per barrel  It was last at  76 95  up  2 11  or 2 8  
Meanwhile  New York traded WTI crude futures surged  2 00  or 2 9   to  71 06 a barrel  after reaching  71 17 earlier in the session  also highs last seen in late 2014 
In a televised speech Tuesday  Trump said the United States would withdraw from a 2015 international agreement designed to deny Tehran the ability to build nuclear weapons  and also reimpose  the highest level of economic sanctions  against Iran 
Some analysts have said the reinstatement of sanctions could lead to tighter global oil supplies as they make it more difficult for Iran to export oil 
Iran  which is a major Middle East oil producer and member of the Organization of the Petroleum Exporting Countries  OPEC   resumed its role as a major oil exporter in January 2016 when international sanctions against Tehran were lifted in return for curbs on Iran s nuclear program 
2  Weekly EIA Supply Figures Ahead
Besides Iran  oil market players looked ahead to fresh weekly data on U S  commercial crude inventories to gauge the strength of demand in the world s largest oil consumer and how fast output levels will continue to rise 
The U S  Energy Information Administration will release its official weekly oil supplies report for the week ended May 4 at 10 30AM ET  1430GMT   amid forecasts for an oil stock drop of 719 000 barrels 
Analysts also forecast a fall of 450 000 barrels for gasoline stockpiles  while distillate inventories are expected to drop by 1 3 million barrels 
After markets closed Tuesday  the American Petroleum Institute said that U S  oil inventories fell by nearly 1 9 million barrels last week  The API data also showed a decline of about 2 1 million barrels in gasoline stockpiles  while inventories of distillates dropped by 6 7 million barrels 
There are often sharp divergences between the API estimates and the official figures from EIA 
3  U S  Stock Futures Point To Upbeat Open
U S  stock futures pointed to an upbeat open  as investors continued to assess the implications of President Donald Trump walking away from the Iran nuclear deal 
The blue chip Dow futures rose 135 points  or about 0 6   the S P 500 futures tacked on 13 points  or around 0 5   while the tech heavy Nasdaq 100 futures indicated a gain of 26 points  or roughly 0 4  
On the earnings calendar  notable results expected out Wednesday include Twenty First Century Fox  NASDAQ FOX   Mylan  NASDAQ MYL   Groupon  NASDAQ GRPN    Office Depot   NASDAQ ODP    Roku   NASDAQ ROKU   and IAC InterActive  NASDAQ IAC  
Elsewhere  in Europe  the continent s major bourses were slightly higher  supported by strength in energy stocks 
Earlier  in Asia  markets in the region closed mixed  following an uninspiring overnight lead from Wall Street 
4  Dollar Rally Rolls On As Yields Climb Back Above 3 
The dollar continued to rally against a basket of currencies  reaching yet another 2018 high  bolstered by rising U S  bond yields 
The U S  dollar index  which measures the greenback s strength against a basket of six major currencies  rose to a session peak of 93 26 at one point  the most since December 19  It was last at 93 01  up around 0 1  
Meanwhile  the yield on 10 year U S  Treasury notes rose above the psychologically important 3  level to hit 3 014   the highest level in two weeks 
The recent bounce in the dollar and yields came as strengthening inflation prospects added to expectations of a more hawkish approach from the Federal Reserve this year 
5  Inflation Data  Weekly Oil Supply Figures In Focus
Wednesday s calendar features top tier U S  data on inflation  The Commerce Department will publish producer price inflation figures for April at 8 30AM ET  1230GMT  
Market analysts expect producer prices to inch up 0 2   weakening from March s 0 3  increase  while core PPI is forecast to rise 0 2   down from 0 3  a month earlier 
Consumer inflation data is released Thursday 
Rising inflation would be a catalyst to push the Federal Reserve toward raising interest rates at a faster pace than currently expected ",2018-05-09,Investing.com,https://www.investing.com/news/economy-news/top-5-things-to-know-in-the-market-on-wednesday-1438036,1438036
117614,339129,IAC,Adultery website seeks like minded investors for coming out party,news,"By Aashika Jain  Reuters    Ashley Madison  an online dating agency for cheating spouses  is betting on Europe s  laissez faire  attitude to extramarital affairs to succeed in London where it failed in North America  The website s Canadian parent plans to raise up to  200 million by listing its shares in London this year  five years after a lack of investor appetite caused it to pull an attempt to list at home   In Europe  we have simply got a more laissez faire attitude towards a business such as ours   Christoph Kraemer  director of international relations for Ashley Madison  told Reuters on Wednesday  With more than 34 million members worldwide  Ashley Madison claims to be the world s second largest dating website  Only Match com  owned by media mogul Barry Diller s IAC InterActive Corp  O IACI   is bigger  Avid Life Media  the parent company of Ashley Madison and websites such as Cougarlife com and EstablishedMen com  values itself at  1 billion  It reported revenue of  115 million in 2014  up 45 percent from the preceding year  The plan to list in London was first reported by Bloomberg  The company plans to launch its services in Russia  Ukraine and the Baltic states in late May or June  Kraemer told Reuters  Membership is growing quickest in India  South Korea and Japan  Visitors to Ashley Madison s website   tagline  Life is short  Have an affair    are greeted by a blonde woman  eyes out of shot and extending her finger across her lips in a shushing gesture  She is wearing what appears to be a wedding ring  The site allows members to sign up without disclosing personal information such as their name  telephone number or home address   It is for people who are married  who are seeking an affair and want to do so in a discreet environment   Kraemer said  Sometimes  he says  the website can even help married couples  
 The response we get from our members who have actually had an affair via the website is that they feel happier  invigorated and transmit that happiness  which actually reinforces and ignites a spark in their marriage and relationships   he said ",2015-04-16,Reuters,https://www.investing.com/news/technology-news/adultery-website-seeks-like-minded-investors-for-coming-out-party-337276,337276
117615,339130,IAC,IAC s profit beats estimates on strong dating business growth,news," Reuters    Media mogul Barry Diller s IAC InterActiveCorp  O IACI  reported a better than expected quarterly profit as more users signed up for its dating services and the paid version of its mobile app Tinder outperformed the company s expectations  Shares of IAC  whose portfolio also includes dating website Match com as well as Investopedia and Dictionary com  rose nearly 2 percent in trading after the bell on Tuesday  The company s search business is its largest  but the dating business Match Group is seen as the crown jewel of the conglomerate and has been driving strong results for the past few quarters  In a widely expected move  IAC said last month it plans to float about 20 percent of the business  which also houses OkCupid  OurTime and Princeton Review  by the end of this year  Match Group earlier this month agreed to buy dating website PlentyOfFish to push deeper into the lucrative mobile based dating business  which attracts users with its photo sharing  instant messaging and geolocation services  IAC on Tuesday said the paid version of Tinder  launched in March  was garnering good user response   Monetization continues to perform at or above our expectations on key metrics   Match Group Chairman Greg Blatt said in a statement   IAC said the number of paid subscribers for its dating services grew 18 percent to 4 1 million in the second quarter ended June 30  Revenue at Match Group  which contributes about a third of total revenue  rose 19 percent  Excluding the effect of foreign exchange  revenue rose 25 percent  The company s search and applications business  which houses brands such as Investopedia  About com and Dictionary com  fell 11 percent  The business accounts for half of total revenue  That dragged down total revenue growth to 2 percent  Still total revenue of  771 1 million beat analysts  average estimate of  776 million  according to Thomson Reuters I B E S  IAC s net income was  59 3 million  or 68 cents per share  compared with a net loss of  18 million  or 22 cents per share  On an adjusted basis  IAC earned 85 cents per share  easily beating estimates of 59 cents  
IAC s shares have risen more than 32 percent this year through Tuesday s close of  80 60 on the Nasdaq ",2015-07-28,Reuters,https://www.investing.com/news/technology-news/iac's-profit-beats-estimates-on-strong-dating-business-growth-353353,353353
117616,339131,IAC,Tinder  Match com owner seeks date with investors,news,By Sai Sachin R and Arathy S Nair  Reuters    Match Group Inc  the owner of dating services such as Tinder  OkCupid and Match com  filed with U S  regulators on Friday for an initial public offering of common stock  The company is owned by media mogul Barry Diller s IAC InterActiveCorp  O IACI   which said in June it would float less than 20 percent of Match in an IPO  Dating sites and apps have gained popularity in recent years with their instant messaging  photosharing and geolocation services  Revenue rose 10 3 percent to  888 1 million in 2014  according to the company s IPO filing  while it jumped 19 percent to  254 7 million in the second quarter ended June   It looks like it will be well received by the IPO market     it s got the financials that people are looking for   said Francis Gaskins  president of research firm IPO Desktop  The Match unit has driven solid results for the past few quarters at IAC  though the internet search and applications business is the largest  Match agreed to buy dating site PlentyOfFish for  575 million in July to expand in the lucrative mobile based dating services business  Market leader Match competes with No  2 eHarmony and companies such as Zoosk and Spark Networks  which owns JDate and ChristianMingle  in the more than  2 billion a year U S  online dating market  JP Morgan  Allen   Co LLC and BofA Merrill Lynch are the underwriters for the offering  Match said in a filing with the U S  Securities and Exchange Commission   Match said it plans to list its stock on the Nasdaq under the symbol  MTCH  and set a nominal fundraising target of  100 million   The amount of money a company says it plans to raise in its first IPO filings is used to calculate registration fees  The final size of the IPO could be different ,2015-10-16,Reuters,"https://www.investing.com/news/technology-news/tinder,-match.com-owner-seeks-date-with-investors-366621",366621
117617,339132,IAC,Yahoo shares rise as board meets and considers sale of Web business,news,"By Deborah M  Todd and Anya George Tharakan  Reuters    Plans by Yahoo Inc s  O YHOO  board to consider selling its struggling Internet business sent the company s shares up nearly 6 percent on Wednesday  as investors cheered a potential new way to separate Yahoo s traditional services from its valuable investment in Chinese Web merchant  Alibaba   Yahoo s board is weighing the sale of the Internet business at a three day board meeting starting on Wednesday  a source familiar with the matter told Reuters  The board did not reach a decision on Wednesday and will continue discussions on Thursday  CNBC reported  Chief Executive Marissa Mayer s attempts to revive the traditional business have born little fruit  and almost all of Yahoo s market capitalization of about  34 billion is ascribed to its stakes in Chinese e commerce company Alibaba Holding Group Ltd  N BABA  and Yahoo Japan Corp  T 4689   A separate Alibaba stake would be expected to be more highly valued by the market  but investors want to avoid a massive tax bill in the process  Selling the traditional business is seen as one way possibly to achieve that  Broken out as a separate company  Yahoo s email  Yahoo and Tumblr web sites and mobile services could fetch between  2 billion and  8 billion  analysts and bankers said  many seeing  4 billion as the likely price  After such a sale  all that would be left  essentially  is the Alibaba and Yahoo Japan stakes   Realizing value is far from assured  however   Pivotal analyst Brian Wieser wrote in a note   The big question is whether anyone would actually show up with a meaningful bid   Interested bidders could range from private equity companies attracted to Yahoo s still huge base of customers to technology companies eager for Yahoo s mobile and web content  following the model of  Verizon Communications  Inc  N VZ  buying AOL  The Wall Street Journal said potential bidders could include Verizon and IAC InterActiveCorp  O IACI   A source familiar with Verizon s thinking said currently there were no talks between the companies  IAC did not immediately respond to a request for comment  The Journal  which first reported that Yahoo might sell its Internet business  also reported on Tuesday that the board meeting would discuss how to proceed with the spinoff of the company s 15 percent stake in Alibaba  worth more than  30 billion if held separately   Yahoo s Internet business has been struggling to boost revenue from ad sales in the face of stiff competition from Alphabet Inc s  O GOOGL  Google and Facebook  O FB   According to a person familiar with the matter  activist investor Starboard Value LP is also disappointed in Yahoo s performance under Mayer and has lost confidence in the CEO  Starboard attributes the relatively low price of the Internet business to poor management of the division by Mayer and the Yahoo management team  The company s emerging businesses  which Mayer calls Mavens   mobile  video  native and social advertising   have been the bright spot for the company   To me that would be most valuable to sell   said Ivan Feinseth  an analyst at Tigress Financial Partners   I think private equity would be interested in the Mavens businesses   he said  Starboard asked Yahoo in November to drop plans to spin off its stake in Alibaba due to the tax concerns  and urged the company to sell its core search and display advertising businesses instead  
Yahoo shares closed up 5 8 percent at  35 65 on Nasdaq ",2015-12-02,Reuters,https://www.investing.com/news/stock-market-news/yahoo-shares-rise-as-board-meets-and-considers-sale-of-web-business-374143,374143
117644,339159,IAC,MercadoLibre  MELI  Q2 Earnings   Revenue Beat Estimates,opinion,"MercadoLibre  Inc    NASDAQ MELI   delivered second quarter 2019 earnings of 31 cents  which beat the Zacks Consensus Estimate by 3 cents and surged 138 5  sequentially  Notably  the figure shows an improvement from a loss of 25 cents per share in the year ago quarter Revenues increased 15 1  sequentially and 62 6  on a year over year basis  102 1  on an FX neutral basis  to  545 2 million  surpassing the Zacks Consensus Estimate of  498 million Increasing total payments volume  TPV  acted as the key catalyst in driving the second quarter top line  Moreover  solid performance by MercadoPago positively impacted the results  Also  merchant and consumer credit business performed well on the back of robust MercadoCredito Additionally  the company s online to offline payment offerings continued to gain traction in the reported quarter on the back of robust mobile point of sale  MPOS  business  which accounted for 41 9  of the total off platform payment volume  Further  the company witnessed rapid adoption of its Mobile Wallet Further  the company s solid performance across all its reporting regions and robust e commerce platform were major positives  Robust shipments via MercadoEnvios also aided revenues  primarily driven by the company s strengthening free shipment program All these contributed to the company s better than expected second quarter results  which in turn is aiding the stock gain momentum across investors Coming to the price performance  MercadoLibre has gained 135  on a year to date basis  outperforming the  s rally of 20 5  Top Line in DetailBrazil  Net revenues in the first quarter were  340 9 million  62 5  of total revenues   up 74  year over year  This can be attributed to improved gross billings  which surged 42 4  on a year over year basis  Further  gross merchandise volume  GMV  improved 27  year over year in this region  Additionally  strong device sales  growing momentum of MercadoLibre s e commerce app and launch of MELI Logistics contributed to the top line growth in the country Argentina  This market generated  113 9 million revenues  20 9  of revenues   which advanced 14  year over year  Gross billings in this country increased 14 8  from the year ago quarter  Further  the company experienced solid growth in GMV in this country  which was up 63  year over year  MercadoLibre gained momentum across apparel  home and garden verticals in the country  which contributed to the results  Further  proper execution of wallet initiatives and growing number of shipments via Mercado Envios  which reached 62  of the total items shipped in Argentina  also acted as tailwinds  Moreover  rising device sales and robust e commerce app were encouraging Mexico  Net revenues in the reported quarter were  64 4 million  11 8  of revenues   up 267 1  year over year  Year over year growth came on the back of robust GMV  which improved 45  from the prior year quarter  Additionally  gross billings were up 125 9  from the year ago quarter  Launch of MELI Logistics  strong fulfillment operations  rising adoption of e commerce app and growing device sales in the country were major positives Other countries  These markets generated revenues of  26 1 million  4 8  of total revenues   surging 19 2  on a year over year basis  The company s gross billings in these countries were up 16 5  on a year over year basis  However  GMV was down 3  from the year ago quarter Key MetricsGMV of  3 4 billion increased 8 4  year over year and 33  on FX neutral basis Total confirmed registered users at the end of the reported quarter were 292 5 million  improving 24 5  year over year  Further  new confirmed registered users during the period were 12 4 million  improving 5 1  on a year over year basis Number of successful items sold was 88 7 million  up 3 9  year over year  Moreover  number of successful items shipped surged 32 9  year over year to 70 2 million  This can be attributed to strong performance of MercadoEnvios driven by strong performance of MercadoEnvios and optimization strategies for the company s free shipping program Total payment volume  TPV  was up 47 2  on a year over year basis to  6 5 billion  driven by strong performance of MercadoPago Total volume of payments on marketplace was  3 1 billion up 11 6  year over year  Further  total payments transactions increased 112 4  year over year to 181 6 million Unique buyers improved 20 7  year over year to 20 4 million  Moreover  unique sellers were 4 3 million  up 2 4  from the prior year quarter MercadoLibre  Inc  Price  Consensus and EPS Surprise    Operating Details
For the second quarter  gross margin was 50   expanding 240 bps year over year Operating expenses as a percentage of total revenues came in 52 3   contracting 380 bps in the year ago quarter The company reported loss from operations of  12 5 million compared with the year ago quarter s loss of  28 2 million Balance Sheet   Cash FlowAs of Jun 30  2019  cash and cash equivalents were  1 12 billion  declining from  1 29 billion as of Mar 31  2019  Short term investments were  1 79 billion  up from  1 65 billion in the previous quarter In the second quarter  cash generated from operations was  27 6 million compared with  138 4 million in the first quarter Zacks Rank and Stocks to ConsiderMercadoLibre currently carries a Zacks Rank  3  Hold  Some top ranked stocks in the retail wholesale sector are IAC InterActiveCorp   NASDAQ IAC    Boot Barn Holdings  Inc    NYSE BOOT   and Sonic Automotive  Inc    NYSE SAH    All the three stocks flaunt a Zacks Rank  1  Strong Buy   You can see Long term earnings growth rate for IAC InterActiveCorp  Boot Barn Holdings and Sonic Automotive is projected to be 20 45   17  and 3   respectively Wall Street s Next Amazon  NASDAQ AMZN Zacks EVP Kevin Matras believes this familiar stock has only just begun its climb to become one of the greatest investments of all time  It s a once in a generation opportunity to invest in pure genius ",2019-08-08,Zacks Investment Research,https://www.investing.com/analysis/mercadolibre-meli-q2-earnings--revenue-beat-estimates-200453710,200453710
