,id,ticker,title,category,content,date,provider,url,article_id
117501,339016,IAC,IAC must face Tinder co founder s  2 billion lawsuit  NY appeals court,news,"By Jonathan Stempel
NEW YORK  Reuters    A New York state appeals court on Tuesday rejected IAC InterActiveCorp s  O IAC  bid to dismiss a  2 billion lawsuit by a group of Tinder founders  executives and early employees who said it undervalued the dating app to avoid paying them billions of dollars 
The Appellate Division in Manhattan said Tinder co founder Sean Rad and the other five plaintiffs  who also sued IAC s  Match Group Inc   O MTCH  unit  were not bound under their stock options agreements to what they considered artificially low valuations of their stakes 
 Although the parties agreed that the value of their stock options would be determined by the valuation process  nothing in the agreements provided that the valuation would be binding or final or that the parties would be precluded from fully disputing the valuation in court   the five judge panel said 
The decision affirmed a June 13 ruling by New York State Supreme Court Justice Saliann Scarpulla in Manhattan 
She had said the plaintiffs could pursue claims of breach of contract  and intentional interference with both contractual relations and prospective economic advantage 
In seeking a dismissal  New York based IAC and Dallas based Match had called the August 2018 lawsuit a belated and improper attack on a  binding expert appraisal  done 13 months earlier 
 This baseless lawsuit has no more merit today than it did over a year ago when it was filed   IAC said in a statement   We look forward to defending ourselves in court  
Orin Snyder  a lawyer for the plaintiffs  in a statement said his clients looked forward to a jury trial   IAC and Match cheated our clients and engaged in a brazen cover up   he said 
IAC and Match separately sued Rad in January  accusing him of having secretly copied files and other proprietary information 
They also filed a  400 million countersuit in September accusing him of having recorded conversations with his superiors without their consent 
Rad has sought to dismiss the January lawsuit  and in an Oct  17 court filing Snyder called the countersuit  legally without merit  and an effective attempt to bankrupt Rad 
IAC said on Oct  11 it intends to spin off its 80 5  stake in Match  which includes Tinder 
The appeals court case is Rad et al v IAC InterActiveCorp et al  New York State Supreme Court  Appellate Division  1st Department  No  9946  The cases in the New York State Supreme Court  New York County are Rad et al v IAC InterActiveCorp et al  No  654038 2018  and Match Group Inc et al v Rad  No  650287 2019 ",2019-10-29,Reuters,https://www.investing.com/news/stock-market-news/iac-must-face-tinder-cofounders-2-billion-lawsuit-ny-appeals-court-2006889,2006889
117502,339017,IAC,Tinder owner Match forecast hit by rising competition  shares down,news," Reuters    Tinder owner  Match Group Inc   O MTCH  forecast fourth quarter revenue below Wall Street estimates on Tuesday as it faces stiff competition from rival online dating services  sending its shares down about 15  in extended trading   Shares of parent IAC InterActiveCorp  O IAC  also down about 11  after the bell   Match has been facing increasing competition from a host of rivals including Bumble and Facebook Inc s  O FB  dating platform that recently launched in the U S  in September  Bumble also stepped up by launching its app in India late last year  a market with a huge potential for dating related services  Tinder   which has made  swipe left  and  swipe right  a point of pop culture conversations   added 437 000 average subscribers in the quarter  down from an addition of 503 000 in the previous quarter  The addition brought Tinder subscribers up to 5 7 million in the third quarter  To fend off competition  Match has boosted its marketing spend on its money spinner Tinder in emerging markets  including India and Latin America  as well on its other dating services  PlentyOfFish and Hinge  Match s total operating expenses rose about 20  to  364 9 million in the quarter  The owner of OkCupid and PlentyOfFish expects current quarter total revenue between  545 million and  555 million  below analysts  estimate of  559 3 million  according to IBES data from Refinitiv   The forecast overshadowed a better than expected quarterly revenue and a 19  growth in average subscribers that rose to 9 6 million from a year ago  including a rise of about 29  subscribers in its international markets   Last month  parent IAC said it intends to spin off its ownership stake in Match Group resulting in the full separation of the two companies  Match on Tuesday said it expects spin off related expense to be about  10 million in fiscal 2020  The revenue forecast comes at a time when Match is in the middle of a U S  Federal Trade Commission complaint related to the company s certain marketing related claims  Total revenue rose 22  to  541 5 million in the third quarter  edging past analysts  estimates of about  540 6 million  according to IBES data from Refinitiv   
The company s net earnings attributable to Match Group shareholders rose to  151 5 million  or 51 cents per share  for the three months ended Sept  30  from  130 2 million  or 44 cents per share  a year earlier ",2019-11-05,Reuters,https://www.investing.com/news/stock-market-news/tinder-helps-match-swipe-right-on-revenue-user-adds-2012696,2012696
117503,339018,IAC,Wall St  little changed but report trade deal could be delayed weighs,news,"By Caroline Valetkevitch
NEW YORK  Reuters    U S  stocks were near flat on Wednesday as a report that the U S  China deal could be delayed until December increased worries about how long the trade war will go on  while healthcare shares supported the market 
A senior official of the Trump administration told Reuters a meeting between U S  President Donald Trump and Chinese President Xi Jinping to sign a long awaited interim trade deal could be delayed until December  as discussions continue over terms and a venue 
Stocks were also on pause after their recent run to record highs 
The year end is typically a bullish time for stocks  but the trade war is still a risk  said Quincy Krosby  chief market strategist at Prudential Financial  NYSE PRU  in Newark  New Jersey 
Also   there s been concern the market was moving toward overbought conditions   she said 
 Humana Inc   N HUM  rose 3 9  as the health insurer reported quarterly profit that beat estimates on higher sales of its government backed Medicare Advantage health plans 
CVS Health Corp  N CVS  gained 4 9  after the pharmacy chain posted a better than expected quarterly profit  boosted by its Aetna  NYSE AET  health insurance business and pharmacy benefit management unit 
The Dow Jones Industrial Average  DJI  fell 2 91 points  or 0 01   to 27 489 72  the S P 500  SPX  lost 0 21 points  or 0 01   to 3 074 41 and the Nasdaq Composite  IXIC  dropped 28 29 points  or 0 34   to 8 406 39 
The recent rally had been fueled by signs of progress in the U S  China trade talks and a mostly upbeat earnings season 
The S P 500 energy index  SPNY  fell 2 3  following declines in oil prices  while the S P health care  SPLRCT  was up 0 6  
 Match Group Inc   O MTCH  slumped 4 9  as the Tinder owner forecast fourth quarter revenue below estimates in the face of stiff competition from rival online dating services  Its parent firm  IAC InterActiveCorp  O IAC   dropped 4 7  
Declining issues outnumbered advancing ones on the NYSE by a 1 16 to 1 ratio  on Nasdaq  a 1 65 to 1 ratio favored decliners 




The S P 500 posted 11 new 52 week highs and two new lows  the Nasdaq Composite recorded 62 new highs and 53 new lows ",2019-11-06,Reuters,https://www.investing.com/news/stock-market-news/wall-street-rally-loses-steam-after-record-run-2013348,2013348
117504,339019,IAC,IAC revenue beats on strong dating  homeservices business,news," Reuters    IAC InterActiveCorp  O IAC  reported third quarter revenue on Wednesday that edged past analysts  estimates  driven by strong growth across all its businesses  including Tinder owner Match Group  O MTCH  and ANGI Homeservices 
Match Group  which contributes nearly half of IAC s revenue  reported 22  rise in quarterly revenue while ANGI Homeservices  formed by merging IAC s HomeAdvisor and consumer review platform Angie s List  reported a rise of 18   from a year earlier 
Earlier in October  IAC said it intends to spin off its ownership stake in Match Group resulting in the full separation of the two companies  The proposal came after an initial announcement from IAC in August where it said it intended to distribute its stake in Match group and ANGI Homeservices to its shareholders 
Speaking to Reuters  Chief Financial Officer Glenn Schiffman said the company will not turn its attention to ANGI until the Match spin off is done 
The digital media company owns an 80 4  economic interest in Match and an 83 3  in ANGI  according to a regulatory filing in June 
IAC  owned by television giant Barry Diller  has a history of building businesses and later splitting them into separate companies 
Schiffman added that the company is actively looking for targets with a focus on consumer internet business 
The digital media company s revenue rose about 13  to  1 25 billion  above analysts  estimates of  1 24 billion  according to IBES data from Refinitiv 
Net income attributable to IAC shareholders fell to  128 5 million  or  1 35 per share  for the quarter ended Sept  30  from  145 8 million  or  1 49 per share  a year earlier ",2019-11-06,Reuters,https://www.investing.com/news/technology-news/iac-revenue-beats-on-strong-dating-homeservices-business-2013865,2013865
117505,339020,IAC,Why IAC InterActiveCorp Shares Gained 12  Last Month,news,"What happened
Shares of IAC InterActiveCorp  NASDAQ IAC  rose 11 9  in December 2019  according to data from S P Global Market Intelligence  The media and online content conglomerate gained 11  in the space of two days thanks to a couple of potentially game changing deals 

So what
First  IAC s stock went up 7 8  on the news that the company is selling off its holdings in Match Group   NASDAQ MTCH   creating two entirely separate companies  Before this deal  which had been coming for some time  IAC owned 80  of the Tinder parent s shares 
The next day  IAC announced a tender offer of  15 per share in a buyout bid for family care specialist Care com  NYSE CRCM  
Shareholders applauded both the Match Group split and the Care com acquisition 

IAC data by YCharts 
Now what
The Match Group deal should bolster IAC s balance sheet with a net cash infusion of at least  700 million  The company is also expected to move roughly  1 7 of long term debt to Match Group s balance sheet  The  550 million Care com buyout looks small next to these big financial transactions  but it could be the first of many smaller deals that combine to move IAC into a lower risk market 
IAC s shares have now gained a total of 46 4  over the last year  trading at a reasonable valuation of 25 times free cash flows  The company is rebuilding itself under a business model with lower top line growth but stronger cash flows  Market makers are embracing the new and improved IAC InterActiveCorp ",2020-01-06,The Motley Fool,https://invst.ly/pedxd,2053388
