,id,ticker,title,category,content,date,provider,url,article_id
32846,254361,ORLY,Is Vanguard Small Cap Growth Index Admiral  VSGAX  A Strong Mutual Fund Pick Right Now ,opinion,"Investors in search of an Index fund might want to consider looking at Vanguard Small Cap Growth Index Admiral  VSGAX   While this fund is not tracked by the Zacks Mutual Fund Rank  we were able to examine other factors like performance  volatility  and cost 
History of Fund Manager
Vanguard Group is based in Malvern  PA  and is the manager of VSGAX  Vanguard Small Cap Growth Index Admiral debuted in September of 2011  Since then  VSGAX has accumulated assets of about  10 38 billion  according to the most recently available information  The fund s current manager  Gerard C  O Reilly  NASDAQ ORLY   has been in charge of the fund since September of 2011 
Performance
Of course  investors look for strong performance in funds  This fund in particular has delivered a 5 year annualized total return of 8 71   and is in the top third among its category peers  If you re interested in shorter time frames  do not dismiss looking at the fund s 3 year annualized total return of 15 76   which places it in the top third during this time frame 
When looking at a fund s performance  it is also important to note the standard deviation of the returns  The lower the standard deviation  the less volatility the fund experiences  The standard deviation of VSGAX over the past three years is 15 02  compared to the category average of 8 45   Over the past 5 years  the standard deviation of the fund is 15 15  compared to the category average of 9 13   This makes the fund more volatile than its peers over the past half decade 
Risk Factors
Investors should always remember the downsides to a potential investment  and this segment carries some risks one should be aware of 
Investors should note that the fund has a 5 year beta of 1 18  so it is likely going to be more volatile than the market at large  Another factor to consider is alpha  as it reflects a portfolio s performance on a risk adjusted basis relative to a benchmark in this case  the S P 500  VSGAX s 5 year performance has produced a negative alpha of  3 22  which means managers in this portfolio find it difficult to pick securities that generate better than benchmark returns 
Holdings
Investigating the equity holdings of a mutual fund is also a valuable exercise  This can show us how the manager is applying their stated methodology  as well as if there are any inherent biases in their approach  For this particular fund  the focus is primarily on equities that are traded in the United States 
Right now  79 2  of this mutual fund s holdings are stocks  with an average market capitalization of  4 46 billion  The fund has the heaviest exposure to the following market sectors  Technology Finance Other Industrial Cyclical Health With turnover at about 22   this fund makes fewer trades than its comparable peers Expenses
Costs are increasingly important for mutual fund investing  and particularly as competition heats up in this market  And all things being equal  a lower cost product will outperform its otherwise identical counterpart  so taking a closer look at these metrics is key for investors  In terms of fees  VSGAX is a no load fund  It has an expense ratio of 0 07  compared to the category average of 0 76   So  VSGAX is actually cheaper than its peers from a cost perspective 
While the minimum initial investment for the product is  3 000  investors should also note that each subsequent investment needs to be at least  1 
Bottom Line
Want even more information about VSGAX  Then go over to Zacks com and check out our mutual fund comparison tool  and all of the other great features that we have to help you with your mutual fund analysis for additional information  Want to learn even more  We have a full suite of tools on stocks that you can use to find the best choices for your portfolio too  no matter what kind of investor you are ",2019-05-02,Zacks Investment Research,https://www.investing.com/analysis/is-vanguard-smallcap-growth-index-admiral-vsgax-a-strong-mutual-fund-pick-right-now-200415460,200415460
32847,254362,ORLY,U S  stocks remain in tight range  as plunging oil prices limit gains,news,"Investing com    U S  stocks were relatively flat on Thursday  remaining in tight  range bound trade  as a disappointing quarter from Ford Motor Company  NYSE F  and continued declines in oil prices offset momentum from strong results in the technology sector on the busiest day of second quarter earnings season 
The Dow Jones Industrial Average fell 15 82 or 0 09  to 18 456 35  closing lower for the fourth consecutive session and the fifth time in the last six trading days  Despite the recent sell off the Dow remains less than 1  from last week s record high of 18 622 01 at the completion of a nine day  Post Brexit rally  At session lows  the Dow fell by as much as 103 points 
The NASDAQ Composite index gained 15 17 or 0 30  to 5 154 98  while the S P 500 Composite index added 13 48 or 0 16  to 2 170 06  Buoyed by the stellar earnings among a host of large cap tech stocks  the NASDAQ is on pace for its fifth consecutive positive week  On the S P 500  seven of 10 sectors closed in the green as stocks in the Consumer Services  Technology and Financial industries led  Stocks in the Telecom  Energy and Industrials sectors lagged  all closing in negative territory for the session 
With roughly 55  of companies on the S P 500 reporting second quarter results  earnings have fallen by approximately 2 8  on an annual basis  in line with consensus estimates  By comparison  aggregate earnings of S P 500 companies on Monday were down by 3 7  from net profits over the same period a year ago  Analysts  however  are concerned with the prospects of reduced forward guidance from major companies in the energy sector as oil prices continue to plummet  In Thursday s session  crude futures fell to fresh 3 month lows below  42 a barrel  amid prolonged fears of global oversupply 
Shares in Ford fell sharply after the automobile giant said its profits last quarter plunged 9  to  2 billion  as the new vehicle surge displayed signs of topping out  The slowdown comes amid broad declines in used vehicle prices  enhanced incentives for factories and dealers and indications of rising interest rates before the end of the year  Ford lost 1 13 or 8 16  to 12 17  suffering one of its worst single day declines in at least a year 
The top performer on the Dow was Apple Inc  NASDAQ AAPL   which added 2 95 or 2 17  to 133 01  Apple continues to rally from 52 week lows from earlier last quarter after reporting stronger than expected third quarter iPhone sales on Tuesday  Additionally  Apple also received some goodwill from an announcement in Wednesday s session that it reached a historical milestone with the sale of the company s one billionth iPhone  The worst performer was Boeing Company  NYSE BA   which fell 2 95 or 2 17  to 133 01  Earlier  Reuters reported that Boeing could halt production of its 747 models after earnings for the renowned jet posted its first quarterly loss this week since 2009 
The biggest gainer on the NASDAQ was O Reilly Automotive Inc  NASDAQ ORLY  which added 11 16 or 4 02  to 288 67 after analysts at Wedbush upgraded its rating of the auto parts company to an outperform on Thursday  It comes as a plethora of leading hedge funds and investments banks have increased their stake in O Reilly s in recent weeks  The worst performer was Whole Foods Market Inc  NASDAQ WFM   which plunged 3 03 or 9 01  to 30 61  Shares in Whole Foods fell sharply after the natural food grocer reported subdued earnings  amid heightened competition and declining food prices 
On the New York Stock Exchange  advancing issues outnumbered declining ones by a 1 530 1 420 margin ",2016-07-28,Investing.com,"https://www.investing.com/news/commodities-news/u.s.-stocks-remain-in-tight-range,-as-plunging-oil-prices-limit-gains-417238",417238
32848,254363,ORLY,Stocks flat as earnings roll in  Comcast drags Nasdaq,news,By Chuck Mikolajczak NEW YORK  Reuters    U S  stocks were little changed in a choppy session after the latest round of earnings reports  while a decline in Comcast shares pushed the Nasdaq into negative territory  The S P 500 healthcare index  SPXHC  rose 0 73 percent to help keep the S P 500 near the unchanged mark  buoyed by strong results and forecasts from Bristol Myers  N BMY   up 5 5 percent and Celgene  O CELG   up 6 6 percent  The two drugmakers were the top boosts to the S P 500  Profits at S P 500 companies have largely exceeded analysts  estimates for the third quarter so far  setting up the first profit growth since the second quarter of 2015  Thomson Reuters I B E S data shows third quarter earnings are now expected grow 2 6 percent  up from the 0 5 percent decline anticipated at the start of October   Sectors linked to interest rates weighed  however  as yields on benchmark 10 year Treasury notes  US10YT RR  touched a five month high of 1 87 percent   The S P real estate sector  was down 2 4 percent and on track for its worst decline in five weeks  while utilities  SPLRCU  shed 0 4 percent    Essentially we ve seen earnings  there are pockets of strength and weakness  but on the whole earnings have come in better than expected   David Lefkowitz  senior equity strategist at UBS Wealth Management Americas in New York   But on top of that today  some of the yield sensitive parts of the market are contending with this backup in interest rates  so that is putting a little bit of a depressant on some parts of the market    Comcast  O CMCSA  was among the top drags on the S P 500 and Nasdaq  falling 1 9 percent after  Barclays   LON BARC  and  Deutsche Bank   DE DBKGn  cut their price targets and cited increased competition from AT T owned DirecTV Now  The stock is down nearly 6 percent over the past three sessions   Comcast  along with O Reilly Auto  O ORLY   whose quarterly earnings missed expectations  were the primary drags on the consumer discretionary index  SPLRCD   which lost 0 7 percent  O Reilly shares touched a five month low and were on pace for their worst day in over four years   The Dow Jones industrial average  DJI  rose 16 85 points  or 0 09 percent  to 18 216 18  the S P 500  SPX  lost 0 44 points  or 0 02 percent  to 2 138 99 and the Nasdaq Composite  IXIC  dropped 18 51 points  or 0 35 percent  to 5 231 76  Google parent Alphabet  O GOOGL  was down 0 6 percent  while online retailer Amazon com  O AMZN  shed 0 3 percent ahead of their quarterly earnings scheduled for after the market close on Thursday   Declining issues outnumbered advancing ones on the NYSE by a 2 22 to 1 ratio  on Nasdaq  a 1 74 to 1 ratio favored decliners  The S P 500 posted 16 new 52 week highs and 10 new lows  the Nasdaq Composite recorded 63 new highs and 97 new lows ,2016-10-27,Reuters,https://www.investing.com/news/stock-market-news/futures-rise-as-earnings-continue-to-be-prime-focus-435177,435177
32849,254364,ORLY,U S  stocks lower at close of trade  Dow Jones Industrial Average down 0 16 ,news,"Investing com   U S  stocks were lower after the close on Thursday  as losses in the Industrials  Consumer Goods and Consumer Services sectors led shares lower 
At the close in NYSE  the Dow Jones Industrial Average fell 0 16   while the S P 500 index declined 0 30   and the NASDAQ Composite index declined 0 65  
The best performers of the session on the Dow Jones Industrial Average were  Verizon Communications  Inc  NYSE VZ   which rose 1 91  or 0 91 points to trade at 48 54 at the close  Meanwhile  EI du Pont de Nemours and Company  NYSE DD  added 1 78  or 1 22 points to end at 69 90 and International Business Machines  NYSE IBM  was up 1 05  or 1 60 points to 153 41 in late trade 
The worst performers of the session were Boeing Company  NYSE BA   which fell 1 52  or 2 21 points to trade at 143 33 at the close   Caterpillar  Inc  NYSE CAT  declined 1 34  or 1 12 points to end at 83 00 and  Chevron  Corporation  NYSE CVX  was down 1 23  or 1 24 points to 99 95 
The top performers on the S P 500 were Level 3 Communications Inc  NYSE LVLT  which rose 10 55  to 51 87   CenturyLink  Inc  NYSE CTL  which was up 9 73  to settle at 31 00 and  F5 Networks Inc   NASDAQ FFIV  which gained 9 58  to close at 130 99 
The worst performers were O Reilly Automotive Inc  NASDAQ ORLY  which was down 8 72  to 253 00 in late trade   Teradata  Corporation  NYSE TDC  which lost 8 08  to settle at 27 66 and National Oilwell Varco Inc  NYSE NOV  which was down 7 80  to 33 71 at the close 
The top performers on the NASDAQ Composite were Immune Pharmaceuticals Inc  NASDAQ IMNP  which rose 35 41  to 0 2505   Lightbridge Corp   NASDAQ LTBR  which was up 35 00  to settle at 1 6200 and PCM Inc  NASDAQ PCMI  which gained 28 96  to close at 23 96 
The worst performers were  Proteostasis Therapeutics Inc   NASDAQ PTI  which was down 33 77  to 8 51 in late trade   Rewalk Robotics Ltd   NASDAQ RWLK  which lost 28 09  to settle at 3 20 and Tronc Inc  NASDAQ TRNC  which was down 27 82  to 12 27 at the close 
Falling stocks outnumbered advancing ones on the New York Stock Exchange by 2258 to 897 and 94 ended unchanged  on the Nasdaq Stock Exchange  1591 fell and 838 advanced  while 165 ended unchanged 
Shares in F5 Networks Inc  NASDAQ FFIV  rose to 52 week highs  up 9 58  or 11 45 to 130 99  Shares in Rewalk Robotics Ltd  NASDAQ RWLK  fell to all time lows  falling 28 09  or 1 25 to 3 20  Shares in PCM Inc  NASDAQ PCMI  rose to all time highs  up 28 96  or 5 38 to 23 96  
The CBOE Volatility Index  which measures the implied volatility of S P 500 options  was up 7 87  to 15 36 
Gold for December delivery was up 0 19  or 2 40 to  1269 00 a troy ounce  Elsewhere in commodities trading  Crude oil for delivery in December rose 0 89  or 0 44 to hit  49 62 a barrel  while the December Brent oil contract fell 0 04  or 0 02 to trade at  50 34 a barrel 
EUR USD was up 0 02  to 1 0899  while USD JPY fell 0 06  to 105 22 
The US Dollar Index was up 0 33  at 98 92 ",2016-10-27,Investing.com,https://www.investing.com/news/stock-market-news/u.s.-stocks-lower-at-close-of-trade;-dow-jones-industrial-average-down-0.16-435415,435415
32850,254365,ORLY,U S  stocks lower at close of trade  Dow Jones Industrial Average down 0 06 ,news,"Investing com   U S  stocks were lower after the close on Monday  as losses in the Industrials  Consumer Services and Basic Materials sectors led shares lower 
At the close in NYSE  the Dow Jones Industrial Average fell 0 06   while the S P 500 index fell 0 16   and the NASDAQ Composite index fell 0 29  
The best performers of the session on the Dow Jones Industrial Average were UnitedHealth Group Incorporated  NYSE UNH   which rose 0 96  or 1 58 points to trade at 165 59 at the close  Meanwhile   Verizon Communications  Inc  NYSE VZ  added 0 88  or 0 43 points to end at 49 18 and  Visa Inc   NYSE V  was up 0 55  or 0 49 points to 89 36 in late trade 
The worst performers of the session were E I du Pont de Nemours   Co  NYSE DD   which fell 0 82  or 0 66 points to trade at 79 67 at the close   American Express  Company  NYSE AXP  declined 0 66  or 0 52 points to end at 78 59 and Cisco Systems Inc  NASDAQ CSCO  was down 0 65  or 0 22 points to 33 58 
The top performers on the S P 500 were Incyte Corporation  NASDAQ INCY  which rose 3 63  to 138 52   Newmont Mining  Corporation  NYSE NEM  which was up 2 82  to settle at 33 89 and Cigna Corporation  NYSE CI  which gained 1 98  to close at 149 39 
The worst performers were  CarMax Inc   NYSE KMX  which was down 4 31  to 56 67 in late trade  Frontier Communications Corporation  NASDAQ FTR  which lost 4 21  to settle at 2 05 and O Reilly Automotive Inc  NASDAQ ORLY  which was down 4 13  to 258 69 at the close 
The top performers on the NASDAQ Composite were  Cyclacel Pharmaceuticals  Inc  NASDAQ CYCC  which rose 87 72  to 6 4200   Novocure Ltd   NASDAQ NVCR  which was up 37 04  to settle at 11 10 and  Steadymed Ltd   NASDAQ STDY  which gained 29 31  to close at 7 500 
The worst performers were DryShips Inc  NASDAQ DRYS  which was down 18 79  to 1 34 in late trade   Orexigen Therapeutics  Inc  NASDAQ OREX  which lost 17 73  to settle at 2 830 and Ekso Bionics Holdings Inc  NASDAQ EKSO  which was down 17 07  to 3 40 at the close 
Falling stocks outnumbered advancing ones on the New York Stock Exchange by 1833 to 1382 and 31 ended unchanged  on the Nasdaq Stock Exchange  1843 fell and 676 advanced  while 97 ended unchanged 
Shares in Steadymed Ltd  NASDAQ STDY  rose to 52 week highs  rising 29 31  or 1 700 to 7 500  
The CBOE Volatility Index  which measures the implied volatility of S P 500 options  was up 0 08  to 12 38 
Gold Futures for June delivery was up 0 28  or 3 45 to  1254 65 a troy ounce  Elsewhere in commodities trading  Crude oil for delivery in May fell 0 73  or 0 37 to hit  50 23 a barrel  while the June Brent oil contract fell 0 80  or 0 43 to trade at  53 10 a barrel 
EUR USD was up 0 15  to 1 0671  while USD JPY fell 0 44  to 110 91 
The US Dollar Index Futures was down 0 06  at 100 36 ",2017-04-03,Investing.com,https://www.investing.com/news/stock-market-news/u.s.-stocks-lower-at-close-of-trade;-dow-jones-industrial-average-down-0.06-470951,470951
32851,254366,ORLY,Morgan Stanley lowers estimates on O Reilly Automotive,news,O Reilly Automotive  ORLY  2 6   falls after  Morgan Stanley   NYSE MS  lowers estimates due to pressured revenue trends amid increasing e commerce competition  The firm now expects O Reilly to report 2017 EPS of  12 20 vs   12 25 prior and 2018 EPS of  13 60 vs   13 75 prior Source  Bloomberg Shares of O Reilly are down 9  over the last week as sentiment on the auto retailer sector continues to trend negative  Now read  O Reilly  Struggling,2017-05-01,Seeking Alpha,https://www.investing.com/news/stock-market-news/morgan-stanley-lowers-estimates-on-o'reilly-automotive-479088,479088
32883,254398,ORLY,O Reilly Automotive  ORLY  Down 3 7  Since Last Earnings Report  Can It Rebound ,opinion,"It has been about a month since the last earnings report for O Reilly Automotive  NASDAQ ORLY   Shares have lost about 3 7  in that time frame  underperforming the S P 500 
Will the recent negative trend continue leading up to its next earnings release  or is O Reilly Automotive due for a breakout  Before we dive into how investors and analysts have reacted as of late  let s take a quick look at its most recent earnings report in order to get a better handle on the important drivers  O Reilly Earnings   Revenues Lag Estimates in Q1O Reilly s adjusted earnings per share were  4 05 in first quarter 2019  marking 12  rise from  3 61 in the prior year quarter  However  the figure missed the Zacks Consensus Estimate of  4 06 During the reported quarter  net income improved 5  to  321 million  13 3  of sales  from  305 million  13 4  of sales  recorded in the year ago period The company s quarterly revenues rose 6  year over year to  2 41 billion  missing the Zacks Consensus Estimate of  2 44 billion  O Reilly s comparable store sales increased 3 2  from 3 4  recorded in the prior year quarter Gross profit went up 6  to  1 28 billion  or 53 1  of sales  from  1 2 billion  or 52 6  of sales  reported in the year ago quarter  Selling  general and administrative expenses rose 7  year over year to  835 million  34 6  of sales  from  778 million  34 1  of sales  in first quarter 2018  Operating income increased 5  to  445 million  or 18 5  of sales  from  423 million  or 18 5  of sales  reported a year ago Financial PositionO Reilly reported cash and cash equivalents of  56 7 million at the end of the first quarter  up from  38 5 million at the end of the year ago period  Its long term debt increased to  3 5 billion as of Mar 31  2019  from  3 2 billion as of Mar 31  2018 At the end of the first quarter  O Reilly generated  440 6 million in cash from operating activities compared with  432 million recorded in the same period of 2018  During the period  capital expenditure was  153 million compared with  115 million in the year ago period  Further  free cash flow declined to  279 2 million from  311 million witnessed in the last year Store InformationO Reilly opened 64 stores in first quarter 2019  The total store count was 5 306 as of Mar 31  2019  compared with 5 097 in the last year  Sales per weighted average store increased to  452 000 from  447 000 in the prior year quarter Share RepurchasesDuring the reported quarter  O Reilly repurchased 0 9 million shares for  322 million  reflecting average price of  347 09 per share  From the end of the first quarter to the date of the earnings release  the company did not repurchase any additional shares OutlookFor second quarter 2019  O Reilly projects earnings of  4 55  4 65 per share  Further  the company expects 3 5  rise in consolidated comparable store sales For 2019  O Reilly reiterated total revenues projection of  10  10 3 billion and earnings per share of  17 37  17 47 
How Have Estimates Been Moving Since Then 
In the past month  investors have witnessed an upward trend in fresh estimates 
VGM Scores
Currently  O Reilly Automotive has a nice Growth Score of B  though it is lagging a lot on the Momentum Score front with a D  Charting a somewhat similar path  the stock was allocated a grade of C on the value side  putting it in the middle 20  for this investment strategy 
Overall  the stock has an aggregate VGM Score of C  If you aren t focused on one strategy  this score is the one you should be interested in 
Outlook
Estimates have been broadly trending upward for the stock  and the magnitude of these revisions looks promising  Notably  O Reilly Automotive has a Zacks Rank  3  Hold   We expect an in line return from the stock in the next few months ",2019-05-23,Zacks Investment Research,https://www.investing.com/analysis/oreilly-automotive-orly-down-37-since-last-earnings-report-can-it-rebound-200424832,200424832
32884,254399,ORLY,O Reilly Approves Additional  1B Repurchase Authorization,opinion,To the delight of its shareholders  O Reilly Automotive  Inc  s   NASDAQ ORLY   board approved an increase in the share repurchase authorization program by an additional  1 billion  This raised the aggregate authorization under the program to  12 75 billion O Reilly is a leading specialty retailer of automotive aftermarket parts  tools  supplies  equipment and accessories in the United States  The company sells products to Do it Yourself  DIY  customers and Do it for Me  DIFM  or professional installers  Strong cash flow aids O Reilly to pursue an aggressive share repurchase policy  which continues to boost earnings per share  In the first quarter of 2019  the company repurchased 0 9 million shares for  322 million  In 2018  it bought back 6 1 million shares for  1 71 billion The additional  1 billion authorization is effective for a three year period  beginning on May 31  2019   In first quarter 2019  O Reilly s adjusted earnings per share were  4 05  marking 12  rise from  3 61 in the prior year quarter  However  the figure missed the Zacks Consensus Estimate of  4 06 A few other stocks in the auto space are Ford Motor Company   NYSE F    Fox Factory Holding Corp    NASDAQ FOXF   and Cummins Inc    NYSE CMI    Ford  Fox Factory and Cummins have expected long term growth rates of 7 3   16 4  and 8   respectively Wall Street s Next Amazon  NASDAQ AMZN Zacks EVP Kevin Matras believes this familiar stock has only just begun its climb to become one of the greatest investments of all time  It s a once in a generation opportunity to invest in pure genius ,2019-06-04,Zacks Investment Research,https://www.investing.com/analysis/oreilly-approves-additional-1b-repurchase-authorization-200428610,200428610
