,id,ticker,title,category,content,date,provider,url,article_id
33026,254541,ORLY,Top Analyst Reports For Bank Of America  Merck   Netflix ,opinion,"Monday  January 21  2018
The Zacks Research Daily presents the best research output of our analyst team  Today s Research Daily features new research reports on 16 major stocks  including Bank of America  BAC   Merck  MRK  and Netflix  NASDAQ NFLX   These research reports have been hand picked from the roughly 70 reports published by our analyst team today 
You can see 
Buy ranked Bank of America s shares have outperformed the Zacks Major Regional Banks in the past year  losing  8 2  vs   14 5   Also  the company possesses an impressive earnings surprise history  beating expectations in each of the trailing four quarters  Its fourth quarter 2018 results were driven by rise in net interest income  lower operating expenses and decline in provisions  
The Zacks analyst thinks rise in loan and deposit balances  higher interest rates and efforts to control expenses will likely support profitability  While dismal performance of capital markets has been hurting the company s investment banking operations  its initiatives to expand into new markets and digital offerings are expected to further enhance cross selling opportunities  Also  the bank s steady capital deployments reflect a strong liquidity position 
 You can   
Shares of Buy ranked Merck have gained  23 9  in the past year  significantly outperforming the Zacks Large Cap Pharmaceuticals industry  which has lost  0 8  over the same period  The Zacks analyst thinks Merck s new products like Keytruda  Lynparza  and Bridion are contributing meaningfully to the top line  Keytruda sales are gaining momentum with approval for additional indications  especially in the first line lung cancer setting as it is the only anti PD 1 approved in this setting  
Animal health and vaccine products are also performing strongly and remain core growth drivers for Merck  Meanwhile  Merck will continue to focus on cost cutting initiatives to drive the bottom line  However  generic competition for several drugs and pricing pressure will continue to be overhangs on the top line  
Rising competitive pressure on the diabetes franchise and on products like Isentress  HIV   Zepatier  HCV  and Zostavax  vaccine  remains  Estimates have gone down slightly ahead of Q4 results  Merck has a positive record of earnings surprises in the recent quarters 
 You can   
Netflix s shares have increased  49  in the past year  significantly outperforming the Zacks Broadcast Radio and Television industry s gain of  9  during the same period  The Zacks analyst thinks Netflix s fourth quarter 2018 subscriber addition rate reflects growing appeal of the streaming platform  which is primarily driven by a solid content portfolio  This is also helping the company counter competition from the likes of HBO  Amazon  NASDAQ AMZN  Prime video and YouTube  
Moreover  partnerships with telcos like Telefonica  MC TEF  in Spain  KDDI in Japan  Comcast  NASDAQ CMCSA  and T Mobile in the United States  and Sky in the U K  and Germany are expected to drive subscriber addition  However  management s weak guidance for U S  streaming paid net additions for the first quarter of 2019 is expected drag down shares  
Netflix s decision to raise prices is likely to boost top line growth and offset increasing marketing expenditure  However  continuing cash burn and huge debt level are primary concerns 
 You can   
Other noteworthy reports we are featuring today include Amgen  AMGN   IBM  IBM  and The Bank of New York Mellon  NYSE BK  
Zacks  Top 10 Stocks for 2019
In addition to the stocks discussed above  would you like to know about our 10 finest buy and holds for the year 
Who wouldn t  Our annual Top 10s have beaten the market with amazing regularity  In 2018  while the market dropped  5 2   the portfolio scored well into double digits overall with individual stocks rising as high as  61 5   And from 2012 2017  while the market boomed  126 3  Zacks  Top 10s reached an even more sensational  181 9  

Mark VickerySenior Editor
Note  Sheraz Mian heads the Zacks Equity Research department and is a well regarded expert of aggregate earnings  He is frequently quoted in the print and electronic media and publishes the weekly and reports  If you want an email notification each time Sheraz publishes a new article  please 
Today s Must Read
Branch Expansion  Cost Control Support BofA s  BAC  Growth


New Drugs Drive Merck s  MRK  Sales as Competition Soars


Subscriber Additions  Content Strength Drives Netflix  NFLX 


Featured Reports
Amgen  AMGN  Boasts of Strong Branded   Biosimilar Pipeline
The Zacks analyst says Amgen s pipeline is progressing well  Approval of migraine candidate  Aimovig was a huge boost  Its strong biosimilars pipeline could be an important long term growth driver 

Robust Demand for z14 Mainframe   Power Products Aids IBM
Per the Zacks analyst  IBM s blockchain  cloud and machine learning capabilities  among others  poises its offerings for robust adoption  Strong demand for z14 Mainframe is also a positive 

Higher Rates Support BNY Mellon  BK   Rising Expenses A Woe
The Zacks analyst believes higher rates  rise in demand for loans and global reach will aid BNY Mellon s profitability 

O Reilly  NASDAQ ORLY  to Grow on Store Openings   Stable Economy
Per the Zacks analyst  store openings in large as well as in scarcely populated markets will aid growth 

Restructuring to Aid PPG Industries  NYSE PPG   Input Costs Ail
While PPG Industries faces margin pressure from raw material cost inflation  cost savings from restructuring actions should lend support to its earnings in 2019  per the Zacks analyst 

Acquisitions Boost Knight Swift  KNX  Amid High Costs
The Zacks analyst likes the company s growth by acquisition policy   Favorable freight rates are also aiding the company 

Bank OZK  OZK  Grows on Expansion Strategies  High Costs Ail
Per the Zacks analyst  de novo branching and inorganic growth strategies  and strong balance sheet will support Bank OZK s revenues 

New Upgrades
Expansion of Biosimilars Portfolio Fuel Mylan  NASDAQ MYL  s Growth
Per the Zacks analyst  Mylan s biosmilar portfolio continues to gain traction driven by collaborations with Biocon and Momenta  Strategic acquisitions should further fuel growth 

Solid Momentum in Vans Brand Aids Growth at V F  Corp  VFC 
Per the Zacks analyst  V F  Corp s Vans brand is displaying strength globally with growth across all regions  channels and product categories  Sales for Vans grew 27  in third quarter fiscal 2019 

Buybacks   Upbeat Traffic Buoy Ryanair  RYAAY 
The Zacks analyst appreciates the company s efforts to reward shareholders through buybacks  Impressive traffic growth on the back of strong demand for air travel also raises optimism 

New Downgrades
Teva s  TEVA  Organic Growth Unlikely to Resume in 2019
Though Teva is progressing well with its restructuring activities  the Zacks analyst believes that stability is still some way off  Resumption of organic growth is also unlikely until 2020 

Higher Input Costs Weigh on Spectrum Brands   SPB  EBITDA
Per the Zacks analyst  input cost inflation along with higher distribution costs have been hurting Spectrum Brands  EBITDA for a while now  This might weigh on its overall profitability 

High Capex  Debt Weigh on Ryder System  NYSE R 
Ryder s high capital expenditures and debt levels have made the Zacks analyst turn bearish on the stock  High capex has the potential to hamper bottom line growth in the long term ",2019-01-21,Zacks Investment Research,https://www.investing.com/analysis/top-analyst-reports-for-bank-of-america-merck--netflix-200377748,200377748
33031,254546,ORLY,Is Vanguard Value Index Admiral  VVIAX  A Strong Mutual Fund Pick Right Now ,opinion,"If investors are looking at the Large Cap Value fund category  Vanguard Value Index Admiral  VVIAX  could be a potential option  VVIAX carries a Zacks Mutual Fund Rank of 1  Strong Buy   which is based on nine forecasting factors like size  cost  and past performance 
Objective
Large Cap Value mutual funds invest in stocks with a market capitalization of  10 billion or more  but whose share prices do not reflect their intrinsic value  this value investing strategy often leads to low P E ratios and high dividend yields  though growth levels are often curtailed  The high growth opportunity of these funds are slowed even further  as large cap securities are generally in stable industries with low to moderate growth prospects  Therefore  Large Cap Value funds are usually more appealing to investors who are interested in a stable income stream 
History of Fund Manager
Vanguard Group is based in Malvern  PA  and is the manager of VVIAX  Since Vanguard Value Index Admiral made its debut in November of 2000  VVIAX has garnered more than  17 43 billion in assets  The fund s current manager  Gerard C  O Reilly  NASDAQ ORLY   has been in charge of the fund since November of 2000 
Performance
Of course  investors look for strong performance in funds  This fund carries a 5 year annualized total return of 10 28   and it sits in the top third among its category peers  Investors who prefer analyzing shorter time frames should look at its 3 year annualized total return of 11 13   which places it in the top third during this time frame 
When looking at a fund s performance  it is also important to note the standard deviation of the returns  The lower the standard deviation  the less volatility the fund experiences  VVIAX s standard deviation over the past three years is 9 11  compared to the category average of 8 96   The fund s standard deviation over the past 5 years is 9 7  compared to the category average of 9 19   This makes the fund more volatile than its peers over the past half decade 
Risk Factors
Investors cannot discount the risks to this segment though  as it is always important to remember the downside for any potential investment  In the most recent bear market  VVIAX lost 53 91  and underperformed its peer group by 3 21   This makes the fund a possibly worse choice than its peers during a sliding market environment 
Investors should not forget about beta  an important way to measure a mutual fund s risk compared to the market as a whole  VVIAX has a 5 year beta of 0 93  which means it is likely to be less volatile than the market average  Another factor to consider is alpha  as it reflects a portfolio s performance on a risk adjusted basis relative to a benchmark in this case  the S P 500  The fund has produced a negative alpha over the past 5 years of  0 18  which shows that managers in this portfolio find it difficult to pick securities that generate better than benchmark returns 
Holdings
Investigating the equity holdings of a mutual fund is also a valuable exercise  This can show us how the manager is applying their stated methodology  as well as if there are any inherent biases in their approach  For this particular fund  the focus is largely on equities that are traded in the United States 
Right now  85 03  of this mutual fund s holdings are stocks  and these companies have an average market capitalization of  163 15 billion  The fund has the heaviest exposure to the following market sectors  Finance Technology With turnover at about 18   this fund is making fewer trades than the average comparable fund Expenses
As competition heats up in the mutual fund market  costs become increasingly important  Compared to its otherwise identical counterpart  a low cost product will be an outperformer  all other things being equal  Thus  taking a closer look at cost related metrics is vital for investors  In terms of fees  VVIAX is a no load fund  It has an expense ratio of 0 05  compared to the category average of 1 03   VVIAX is actually cheaper than its peers when you consider factors like cost 
Investors need to be aware that with this product  the minimum initial investment is  10 000  each subsequent investment needs to be at least  1 
Bottom Line
Overall  Vanguard Value Index Admiral   VVIAX   has a high Zacks Mutual Fund rank  and in conjunction with its comparatively strong performance  average downside risk  and lower fees  this fund looks like a good potential choice for investors right now 
Don t stop here for your research on Large Cap Value funds  We also have plenty more on our site in order to help you find the best possible fund for your portfolio  Make sure to check out  for more information about the world of funds  and feel free to compare VVIAX to its peers as well for additional information  And don t forget  Zacks has all of your needs covered on the equity side too  Make sure to check out Zacks com for more information on our screening capabilities  Rank  and all our articles as well ",2018-12-12,Zacks Investment Research,https://www.investing.com/analysis/is-vanguard-value-index-admiral-vviax-a-strong-mutual-fund-pick-right-now-200367315,200367315
33032,254547,ORLY,Is Vanguard Growth Index Institutional  VIGIX  A Strong Mutual Fund Pick Right Now ,opinion,"If you ve been stuck searching for Large Cap Growth funds  consider Vanguard Growth Index Institutional  VIGIX  as a possibility  VIGIX holds a Zacks Mutual Fund Rank of 1  Strong Buy   which is based on nine forecasting factors like size  cost  and past performance 
Objective
We classify VIGIX in the Large Cap Growth category  an area rife with potential choices  Large Cap Growth funds invest in many large U S  companies that are expected to grow much faster compared to other large cap stocks  To be considered large cap  companies must have a market cap over  10 billion 
History of Fund Manager
VIGIX finds itself in the Vanguard Group family  based out of Malvern  PA  Since Vanguard Growth Index Institutional made its debut in May of 1998  VIGIX has garnered more than  13 55 billion in assets  Gerard C  O Reilly  NASDAQ ORLY  is the fund s current manager and has held that role since May of 1998 
Performance
Investors naturally seek funds with strong performance  VIGIX has a 5 year annualized total return of 11 73  and it sits in the middle third among its category peers  If you re interested in shorter time frames  do not dismiss looking at the fund s 3 year annualized total return of 11 88   which places it in the middle third during this time frame 
When looking at a fund s performance  it is also important to note the standard deviation of the returns  The lower the standard deviation  the less volatility the fund experiences  The standard deviation of VIGIX over the past three years is 11 14  compared to the category average of 9 59   Looking at the past 5 years  the fund s standard deviation is 11 45  compared to the category average of 9 71   This makes the fund more volatile than its peers over the past half decade 
Risk Factors
Investors should always remember the downsides to a potential investment  and this segment carries some risks one should be aware of  In VIGIX s case  the fund lost 47 07  in the most recent bear market and outperformed its peer group by 1 71   This could mean that the fund is a better choice than comparable funds during a bear market 
Even still  the fund has a 5 year beta of 1 09  so investors should note that it is hypothetically more volatile than the market at large  Because alpha represents a portfolio s performance on a risk adjusted basis relative to a benchmark  which is the S P 500 in this case  one should pay attention to this metric as well  The fund has produced a negative alpha over the past 5 years of  0 23  which shows that managers in this portfolio find it difficult to pick securities that generate better than benchmark returns 
Holdings
Examining the equity holdings of a mutual fund is also a valuable exercise  This can show us how the manager is applying their stated methodology  as well as if there are any inherent biases in their approach  For this particular fund  the focus is mostly on equities that are traded in the United States 
This fund is currently holding about 87 54  stock in stocks  with an average market capitalization of  287 65 billion  The fund has the heaviest exposure to the following market sectors  Technology Retail Trade Non Durable This fund s turnover is about 20   so the fund managers are making fewer trades than comparable funds Expenses
For investors  taking a closer look at cost related metrics is key  since costs are increasingly important for mutual fund investing  Competition is heating up in this space  and a lower cost product will likely outperform its otherwise identical counterpart  all things being equal  In terms of fees  VIGIX is a no load fund  It has an expense ratio of 0 04  compared to the category average of 1 10   Looking at the fund from a cost perspective  VIGIX is actually cheaper than its peers 
This fund requires a minimum initial investment of  5 million  and each subsequent investment should be at least  1 
Bottom Line
Overall  Vanguard Growth Index Institutional   VIGIX   has a high Zacks Mutual Fund rank  and in conjunction with its comparatively similar performance  average downside risk  and lower fees  this fund looks like a good potential choice for investors right now 
Want even more information about VIGIX  Then go over to Zacks com and check out our mutual fund comparison tool  and all of the other great features that we have to help you with your mutual fund analysis for additional information  For analysis of the rest of your portfolio  make sure to visit Zacks com for our full suite of tools which will help you investigate all of your stocks and funds in one place ",2018-12-17,Zacks Investment Research,https://www.investing.com/analysis/is-vanguard-growth-index-institutional-vigix-a-strong-mutual-fund-pick-right-now-200368578,200368578
33033,254548,ORLY,Has O Reilly Automotive  ORLY  Outpaced Other Retail Wholesale Stocks This Year ,opinion,"Investors focused on the Retail Wholesale space have likely heard of O Reilly Automotive  NASDAQ ORLY   but is the stock performing well in comparison to the rest of its sector peers  One simple way to answer this question is to take a look at the year to date performance of ORLY and the rest of the Retail Wholesale group s stocks 
O Reilly Automotive is one of 226 companies in the Retail Wholesale group  The Retail Wholesale group currently sits at  6 within the Zacks Sector Rank  The Zacks Sector Rank includes 16 different groups and is listed in order from best to worst in terms of the average Zacks Rank of the individual companies within each of these sectors 
The Zacks Rank is a successful stock picking model that emphasizes earnings estimates and estimate revisions  The system highlights a number of different stocks that could be poised to outperform the broader market over the next one to three months  ORLY is currently sporting a Zacks Rank of  2  Buy  
Within the past quarter  the Zacks Consensus Estimate for ORLY s full year earnings has moved 1 23  higher  This is a sign of improving analyst sentiment and a positive earnings outlook trend 
Based on the most recent data  ORLY has returned 42 65  so far this year  In comparison  Retail Wholesale companies have returned an average of  2 94   This means that O Reilly Automotive is outperforming the sector as a whole this year 
To break things down more  ORLY belongs to the Automotive   Retail and Wholesale   Parts industry  a group that includes 5 individual companies and currently sits at  13 in the Zacks Industry Rank  This group has gained an average of 25 23  so far this year  so ORLY is performing better in this area 
Investors with an interest in Retail Wholesale stocks should continue to track ORLY  The stock will be looking to continue its solid performance ",2018-12-27,Zacks Investment Research,https://www.investing.com/analysis/has-oreilly-automotive-orly-outpaced-other-retailwholesale-stocks-this-year-200371603,200371603
33034,254549,ORLY,5 GARP Stocks To Scoop Up For Maximum Returns,opinion,Growth at a reasonable price or GARP is an excellent way for investors to make some quick gains  This strategy helps investors gain exposure to stocks that have impressive prospects and are trading at a discount The GARP approach leads to the identification of stocks that are priced below the market or any reasonable target determined by fundamental analysis  These stocks also have solid prospects in terms of cash flow  revenues  earnings per share  EPS  and so on That means a portfolio created on the basis of GARP strategy is expected to have stocks that offer the best of both value and growth investing GARP Metrics   Mix of Growth   Value MetricsThe GARP strategy seeks to offer an ideal investment by utilizing the best features of both value and growth investing  Investors adopting the GARP approach will prefer to buy stocks that are priced below the market or any reasonable target determined by fundamental analysis  These stocks also have solid prospects in cash flow  revenues  earnings per share  EPS  and so on Growth MetricsBoth strong earnings growth history and impressive earnings prospects are the main concepts that GARP investors borrow from the growth investing strategy  However  instead of super normal growth rates  pursuing stocks with a more stable and reasonable growth rate is also a tactic of GARP investors  Hence  growth rates between 10  and 20  are considered ideal under the GARP strategy Another growth metric that is considered by both growth and GARP investors is return on equity  ROE   GARP investors look for strong and higher ROE compared to the industry average to identify superior stocks  Moreover  stocks with positive cash flow find precedence under the GARP plan Value MetricsGARP investing gives priority to one of the popular value metrics   price to earnings  P E  ratio  Though this investing style picks stocks with higher P E ratios compared to value investors  it avoids companies with extremely high P E ratios  Moreover  the price to book value  P B  ratio is also considered Using the GARP principle  we have run a screen to identify stocks that should offer solid returns in the near term Screening ParametersAlong with the criteria discussed in the above section  we have considered a favorable Zacks Rank  1  Strong Buy  or 2  Buy  Last 5 year EPS   projected 3 5 year EPS growth rates between 10  and 20   Strong EPS growth history and prospects ensure improving business  ROE  over the past 12 months  greater than the industry average  Higher ROE compared to the industry average indicates superior stocks  P E and P B ratios less than M industry average  P E and P B ratios less than that of the industry indicate that the stocks are undervalued  Here are five of the eight stocks that made it through the screen Allison Transmission Holdings  Inc    NYSE ALSN   is a designer and manufacturer of fully automatic transmissions for commercial and defense vehicles  The company sports a Zacks Rank  1  It delivered average four quarter earnings surprise of 29 88   You can see Restoration Hardware Holdings Inc    NYSE RH   is a luxury retailer in the home furnishing space  which offers merchandise assortments across various categories like furniture  lighting  textiles  bath ware  d cor and many more  The company sports a Zacks Rank  1  It delivered average positive earnings surprise of 23 51  in the trailing four quarters Cigna Corporation   NYSE CI   is a health service organization that offers health insurance  related benefits and other health services  The company carries a Zacks Rank  2  It delivered average positive earnings surprise of 13 46  in the trailing four quarters Encompass Health Corporation   NYSE EHC   offers facility based and home based patient care services through its network of inpatient rehabilitation hospitals  home health agencies and hospice agencies  The company carries a Zacks Rank  2  It delivered average positive earnings surprise of 13 84  in the trailing four quarters O Reilly Automotive  Inc    NASDAQ ORLY   is a specialty retailer of automotive aftermarket parts  tools  supplies  equipment and accessories in the United States  It sells products to both Do it Yourself  DIY  customers  Do it for Me  DIFM  and professional installers  The company carries a Zacks Rank  2  It delivered average positive earnings surprise of 3 87  in the trailing four quarters Get the rest of the stocks on the list and start putting this and other ideas to the test  It can all be done with the Research Wizard stock picking and back testing software The Research Wizard is a great place to begin  It s easy to use  Everything is in plain language  And it s very intuitive  Start your Research Wizard trial today  And the next time you read an economic report  open up the Research Wizard  plug your finds in  and see what gems come out Disclosure  Officers  directors and or employees of Zacks Investment Research may own or have sold short securities and or hold long and or short positions in options that are mentioned in this material  An affiliated investment advisory firm may own or have sold short securities and or hold long and or short positions in options that are mentioned in this material Disclosure  Performance information for Zacks  portfolios and strategies are available at   ,2018-12-27,Zacks Investment Research,https://www.investing.com/analysis/5-garp-stocks-to-scoop-up-for-maximum-returns-200371582,200371582
