,id,ticker,title,category,content,date,provider,url,article_id
34519,256034,MIDD,Middleby s  MIDD  Q4 Earnings Meet  Revenues Miss Estimates,opinion,"Machinery behemoth The Middleby Corporation   NASDAQ MIDD   reported moderate fourth quarter 2017 results Earnings and Revenues  Quarterly adjusted earnings came in at  1 48 per share  in line with the Zacks Consensus Estimate  However  the bottom line came in higher than the year ago tally of  1 44 per share Adjusted earnings for 2017 came in at  6 16 per share  outpacing the Zacks Consensus Estimate of  5 39  Also  the bottom line came in higher than the year ago figure of  5 10 per share Net sales in the reported quarter came in at  632 9 million  up 6  year over year  However  the top line missed the Zacks Consensus Estimate of  647 million  The upswing was backed by favorable foreign currency translation impact and acquisition benefits   Net sales of Commercial Foodservice Equipment Group were up 13 7  year over year  However  revenues of the Food Processing Equipment and Residential Kitchen Equipment Groups slipped 1 8  and 5  respectively Net sales for full year 2017 came in at  2 34 billion  up 3  year over year  missing the Zacks Consensus Estimate of  2 35 billion by a whisker   The Middleby Corporation Price  Consensus and EPS Surprise
    Costs and MarginsCost of sales in the fourth quarter was  392 7 million compared to  357 6 million recorded in the year ago quarter  Gross profit margin in the quarter came in at 37 9   shrinking 220 basis points  bps  year over year  Gross margin dipped in the quarter due to reduced margins secured from acquired businesses Selling  general and administrative expenses totaled  110 8 million  as against  110 3 million incurred in the year ago period  Operating margin came in at 10 9   contracting 1030 basis points  bps  year over year Gross margin for the year was 39 1   as against 39 7  recorded in the comparable period last year  Operating margin for 2017 came in at 17 6   as against 19 7  recorded in the year ago period   Balance SheetMiddleby exited the fourth quarter with cash and cash equivalents of  89 7 million  as against  68 5 million recorded at the end of 2016  Long term debt was  1 023 7 million compared with  726 2 million recorded as of Dec 31  2016 Operating cash flow for 2017 was  304 5 million versus  294 1 million recorded in 2016 During 2017  Middleby repurchased shares worth  239 8 million and deployed  300 2 million capital for acquisitions OutlookThis Zacks Rank  2  Buy  company believes elevated demand for chain restaurant customers will bolster revenues of its Commercial Foodservice Equipment Group  In addition  sturdy demand for the recently launched products and solutions is anticipated to drive revenues of the Food Processing Equipment and Residential Kitchen Equipment Groups in the near term Other Stocks to ConsiderOther top ranked stocks within the same space are listed below Applied Industrial Technologies  Inc    NYSE AIT   sports a Zacks Rank of 1  Strong Buy   The company s earnings per share  EPS  are projected to be up 12  in the next three to five years  You can see    Dover Corporation   NYSE DOV   flaunts a Zacks Rank of 1  The company s earnings per share  EPS  are estimated to be up 13  over the next three to five years RBC Bearings Incorporated   NASDAQ ROLL   sports a Zacks Rank of 1  The company s earnings per share  EPS  are projected to grow 5 87  during the same time frame Wall Street s Next Amazon  NASDAQ AMZN Zacks EVP Kevin Matras believes this familiar stock has only just begun its climb to become one of the greatest investments of all time  It s a once in a generation opportunity to invest in pure genius ",2018-02-28,Zacks Investment Research,https://www.investing.com/analysis/middlebys-midd-q4-earnings-meet-revenues-miss-estimates-200295132,200295132
34520,256035,MIDD,Middleby  MIDD  Down 3 9  Since Earnings Report  Can It Rebound ,opinion,"It has been about a month since the last earnings report for The Middleby Corporation   NASDAQ MIDD    Shares have lost about 3 9  in that time frame 
Will the recent negative trend continue leading up to its next earnings release  or is MIDD due for a breakout  Before we dive into how investors and analysts have reacted as of late  let s take a quick look at its most recent earnings report in order to get a better handle on the important drivers Fourth Quarter 2017 ResultsMiddleby reported reports in line fourth quarter 2017 adjusted earnings Earnings and RevenuesQuarterly adjusted earnings came in at  1 48 per share  in line with the Zacks Consensus Estimate  However  the bottom line came in higher than the year ago tally of  1 44 per share Adjusted earnings for 2017 came in at  6 16 per share  outpacing the Zacks Consensus Estimate of  5 39  Also  the reported figure came in higher than the year ago figure of  5 10 per share Net sales in the quarter under review came in at  632 9 million  up 6  year over year  However  the top line missed the Zacks Consensus Estimate of  647 million  The upswing was backed by favorable foreign currency translation impact and acquisition benefits Net sales of Commercial Foodservice Equipment Group were up 13 7  year over year  However  revenues of the Food Processing Equipment and Residential Kitchen Equipment Groups slipped 1 8  and 5   respectively For full year 2017  net sales came in at  2 34 billion  up 3  year over year but missed the Zacks Consensus Estimate of  2 35 billion by a whisker Costs and MarginsCost of sales in the fourth quarter was  392 7 million compared with  357 6 million in the year ago quarter  Gross profit margin came in at 37 9   declining 220 basis points  bps  year over year  Gross margin dipped in the quarter due to reduced margins secured from acquired businesses Selling  general and administrative expenses totaled  110 8 million compared with  110 3 million incurred in the year ago period  Operating margin came in at 10 9   contracting 1030 basis points  bps  year over year Gross margin for the year was 39 1  slightly lower than 39 7  in the comparable period last year  Operating margin for 2017 came in at 17 6  compared with 19 7  in the year ago period Balance SheetMiddleby exited the fourth quarter with cash and cash equivalents of  89 7 million than  68 5 million recorded at the end of 2016  Long term debt was  1 023 7 million compared with  726 2 million as of Dec 31  2016 Operating cash flow for 2017 was  304 5 million higher than  294 1 million in 2016 During 2017  Middleby repurchased shares worth  239 8 million and deployed  300 2 million capital for acquisitions OutlookThe company believes elevated demand for chain restaurant customers will bolster revenues of its Commercial Foodservice Equipment Group  In addition  sturdy demand for the recently launched products and solutions is anticipated to drive revenues of the Food Processing Equipment and Residential Kitchen Equipment Groups in the near term 
How Have Estimates Been Moving Since Then 
In the past month  investors have witnessed an upward trend in fresh estimates  There have been two revisions higher for the current quarter compared to one lower 
The Middleby Corporation Price and Consensus   VGM Scores
At this time  MIDD has a nice Growth Score of B  however its Momentum is doing a bit better with an A  However  the stock was allocated a grade of D on the value side  putting it in the bottom 40  for this investment strategy 
Overall  the stock has an aggregate VGM Score of B  If you aren t focused on one strategy  this score is the one you should be interested in 
Our style scores indicate that the stock is more suitable for momentum investors than growth investors 
Outlook
Estimates have been broadly trending upward for the stock and the magnitude of these revisions looks promising  Notably  MIDD has a Zacks Rank  3  Hold   We expect an in line return from the stock in the next few months ",2018-03-28,Zacks Investment Research,https://www.investing.com/analysis/middleby-midd-down-39-since-earnings-report-can-it-rebound-200301902,200301902
34521,256036,MIDD,Middleby Buys Firex To Boost Kitchen Equipment Portfolio,opinion,The Middleby Corporation   NASDAQ MIDD   recently reinforced its inorganic growth trajectory by acquiring Italian kitchen equipment company   Firex Srl   for an undisclosed amount Firex manufactures state of the art steam cooking equipment for the global commercial foodservice industry  The company not only produces innovative products but also owns automated features that will help in reducing labor and increasing standardization  as well as capacity of cooking procedures  Annually  Firex generates nearly  20 million revenues Middleby believes the Firex buyout will solidify its existing sous vide and steam cooking product offerings  These products  which help prepare healthy food  have been gaining popularity in the market  of late  The company believes this acquisition will strengthen its customer relationships and infrastructure across all end markets Over the last month  Middleby s shares have rallied 3 6   as against the 2 1  loss incurred by the   This Zacks Rank  3  Hold  stock is currently following an acquisition based growth strategy In this context  the company s QualServ  August 2017  and Globe acquisitions  October 2017  are worth mentioning  Both deals are expected to bolster revenues of its Commercial Foodservice Equipment Group in the near term  Also  the Burford  May 2017  and CVP Systems  June 2017  buyouts are projected to improve near term revenues of the company s Food Processing Equipment segment  Additionally  the recently concluded Hinds Bock Corporation buyout  February 2018  will strengthen the company s existing processing and bakery systems in the near future The latest Firex buyout will also likely help drive the company s top line performance over the long term Key PicksSome better ranked stocks in the same space are listed below Kawasaki Heavy Industries Ltd    OTC KWHIY   sports a Zacks Rank  1  Strong Buy   The company s earnings per share  EPS  are projected to be up 21 6  in the next three to five years  You can see  Dover Corporation   NYSE DOV   holds a Zacks Rank  2  Buy   The company s EPS is estimated to rise 13  over the next three to five years EnPro Industries   NYSE NPO   is another Zacks  2 Ranked company  Its EPS is predicted to grow 22 3  during the same time frame Wall Street s Next Amazon  NASDAQ AMZN Zacks EVP Kevin Matras believes this familiar stock has only just begun its climb to become one of the greatest investments of all time  It s a once in a generation opportunity to invest in pure genius ,2018-04-03,Zacks Investment Research,https://www.investing.com/analysis/middleby-buys-firex-to-boost-kitchen-equipment-portfolio-200303007,200303007
34522,256037,MIDD,Middleby  MIDD  Misses On Q1 Earnings   Revenue Estimates ,opinion,"Machinery behemoth The Middleby Corporation   NASDAQ MIDD   reported weaker than expected results for first quarter 2018   Earnings and Revenues  Quarterly adjusted earnings came in at  1 18 per share  beating the Zacks Consensus Estimate of  1 39  However  the bottom line came in lower than the year ago tally of  1 26 per share  Middleby stated that the ongoing restructuring expenses hurt the company s earnings in the reported quarter Net sales in the quarter came in at  584 8 million  surpassing the Zacks Consensus Estimate of  603 million  In addition  the figure improved 10 3  year over year  driven by acquisition benefits  the Accounting Standards Codification 606 adoption  and favorable foreign currency translation impact   Segmental Break UpNet sales of the Commercial Foodservice Equipment Group were up 15 3  year over year to  359 9 million  Also  the Food Processing Equipment Group s revenues climbed 14 6  year over year to  88 6 million in the quarter However  the Residential Kitchen Equipment Group revenues dipped 3 2  to  136 3 million in the reported quarter The Middleby Corporation Price  Consensus and EPS Surprise
    Costs and MarginsCost of sales in the first quarter was  373 2 million compared to  320 8 million recorded in the year ago quarter  Gross profit margin in the quarter came in at 36 2   shrinking 330 basis points  bps  year over year  Gross margin slipped in the quarter due to reduced margins resulting from acquired businesses  unfavorable mix of the Food Processing Equipment segment and lesser volumes Selling  general and administrative expenses totaled  122 9 million  as against  115 million incurred in the year ago period  Operating margin came in at 14 9   contracting 260 bps year over year Balance SheetMiddleby exited the first quarter with cash and cash equivalents of  103 3 million  as against  89 7 million recorded at the end of 2017  Long term debt was  1 043 9 million compared with  1 023 7 million recorded as of Dec 31  2017 Operating cash flow for the first quarter was  44 7 million versus  46 9 million posted in the year ago quarter OutlookMiddleby expects that the recently made acquisitions will continue to boost its revenues and profitability in the upcoming quarters  This Zacks Rank  3  Hold  company believes the restructuring moves and product launches will also help strengthen its competency   Stocks to Consider  Some better ranked stocks in the same space are listed below Applied Industrial Technologies  Inc    NYSE AIT   sports a Zacks Rank  1  Strong Buy   The company s earnings per share  EPS  are predicted to be up 12  in the next three to five years  You can see    Graco Inc    NYSE GGG   also flaunts a Zacks Rank of 1  The company s EPS is estimated to rise 10 33   over the next three to five years Atlas Copco AB   OTC ATLKY   holds a Zacks Rank  2  Buy   The company s EPS will likely be up 12 50   during the same time frame Wall Street s Next Amazon  NASDAQ AMZN Zacks EVP Kevin Matras believes this familiar stock has only just begun its climb to become one of the greatest investments of all time  It s a once in a generation opportunity to invest in pure genius ",2018-05-09,Zacks Investment Research,https://www.investing.com/analysis/middleby-midd-misses-on-q1-earnings--revenue-estimates-200315197,200315197
34523,256038,MIDD,Can Middleby s  MIDD  Stock Rebound On Business Buyouts  ,opinion,The Middleby Corporation   NASDAQ MIDD   has been trying to strengthen its business on the back of numerous acquisitions  but the ongoing brand consolidation and restructuring moves have been depressing the company s revenues and profitability Acquisition Story  Middleby recently announced that it has inked a definitive agreement to acquire Taylor Company from UTC Climate  Controls   Security   a business division of United Technologies Corporation   NYSE UTX    The company noted that this  1 billion buyout deal will aid in strengthening its position in the global commercial foodservice industry  going forward Taylor Company provides state of the art ice cream and soft serve dispensing equipment  frozen drink machines  beverage solutions and automated double sided grills in the market  The company generated roughly  315 million revenues and  65 million adjusted earnings before interest  taxes and depreciation in 2017 Middleby stated that the Taylor buyout will strengthen its presence among foodservice and chain restaurant customers  moving ahead  This transaction is anticipated to bring out roughly  16 million cash tax benefits annually and be accretive to the company s earnings per share within the first 12 months of the deal s closure  Moreover  Middleby targets to secure  15 million synergies from the acquisition The company will finance this all cash deal with its existing revolving credit facility and expects to close it by early third quarter  The agreement is currently subject to regulatory approvals Middleby is currently following an acquisition based growth strategy  In the first quarter  acquisition related benefits drove the company s sales by  63 9 million  The acquisitions of Sveba Dahlen  QualServ  L2F and Globe  all closed in 2017  are expected to drive revenues of the company s Commercial Foodservice Equipment Group  Also  the Burford  CVP Systems  and Scanico buyouts  all closed in 2017  will likely bolster revenues of its Food Processing Equipment Group  Notably  buyouts made this year  like Josper S A and Firex Srl  will likely drive the company s top line results in the quarters ahead Existing ConcernsOver the past month  Middleby s shares have lost 18   underperforming 2 7  growth recorded by the   Eliminating the impact of Accounting Standards Codification 606  favorable foreign exchange and acquisitions  revenues of this Zacks Rank  5  Strong Sell  company fell 7 2  year over year in the first quarter  Sluggish market conditions in the U K  might continue to dent sales of the company s AGA Rangemaster business  going forward  Moreover  consolidation of premium brands  like Lynx and LaCornue  and ongoing restructuring moves might dampen revenues in the upcoming quarters  In addition  the company believes delay in few large projects will dent its Food Processing Equipment segment s top line  in the near term  Reduced sales volume in the near term quarters might continue to weigh over the company s margins in the quarters ahead Over the past 30 days  the Zacks Consensus Estimate for the company s earnings in 2018 moved 6 6  south to  6 06 for 2018 and  6 61 in 2019  Moreover  per our estimates  the company s earnings are expected to edge down 1 6  year over year in 2018 Stocks to ConsiderTwo better ranked stocks in the industry are listed below Applied Industrial Technologies  Inc    NYSE AIT   sports a Zacks Rank of 1  Strong Buy   The company s earnings per share  EPS  are predicted to grow 12   in the next three to five years  You can see  Graco Inc    NYSE GGG   also flaunts a Zacks Rank of 1  The company s EPS is estimated to rise 10 33   over the next three to five years Looking for Stocks with Skyrocketing Upside Zacks has just released a Special Report on the booming investment opportunities of legal marijuana       Ignited by new referendums and legislation  this industry is expected to blast from an already robust  6 7 billion to  20 2 billion in 2021  Early investors stand to make a killing  but you have to be ready to act and know just where to look ,2018-05-20,Zacks Investment Research,https://www.investing.com/analysis/can-middlebys-midd-stock-rebound-on-business-buyouts-200317859,200317859
34534,256049,MIDD,United Technologies Middleby Ink Deal For Taylor Company Sale,opinion,United Technologies Corporation s   NYSE UTX   operating segment   Climate  Controls   Security   recently entered into a definitive agreement with The Middleby Corporation   NASDAQ MIDD    Per the deal  this segment will sell Taylor Company to Middleby   a manufacturer of commercial foodservice equipment  This  1 billion deal is expected to close early in the third quarter of 2018 Our TakeUnited Technologies serves various end markets such as aerospace  defense and commercial construction  This business mix and diversification allows the company to generate profit even during tough economic times by delivering consistent earnings and dividend growth  Also  the company s continuous investment in innovative products  through higher engineering expenditures  secures orders that might drive the top line in future In the past six months  shares of United Technologies have gained 7 2  against the  s decline of 6 2    Moreover  the company s strong aftermarket services business remains relatively stable compared to new product delivery  This  in turn  helps United Technologies to offset the impact of downturns in the new products market  For instance  in first quarter 2018  its aftermarket business witnessed robust sales across the segments with commercial and military up 18  and 13   respectively Meanwhile  the company also revamped its aerospace unit  including an overhaul of its organizational structure  Per United Technologies  its streamlined organizational set up might enable the company to better serve its customers However  the Zacks Rank  3  Hold  company relies on suppliers  including third party contract manufacturing and commodity markets  to secure raw materials  parts  components and sub systems  Therefore  any disruption in deliveries from suppliers  capacity constraints  production disruptions  price changes  or decreased availability of raw materials or commodities may adversely impact United Technologies  ability to meet delivery schedules and increase operating costs Stocks to ConsiderSome better ranked stocks from the same space are Honeywell International Inc    NYSE HON   and Danaher Corporation   NYSE DHR    Both these companies carry a Zacks Rank  2  Buy   You can see  Honeywell surpassed estimates in the trailing four quarters  with an average positive earnings surprise of 1 5  Danaher exceeded estimates in the trailing four quarters  with an average positive earnings surprise of 4 1  Looking for Stocks with Skyrocketing Upside Zacks has just released a Special Report on the booming investment opportunities of legal marijuana      Ignited by new referendums and legislation  this industry is expected to blast from an already robust  6 7 billion to  20 2 billion in 2021  Early investors stand to make a killing  but you have to be ready to act and know just where to look ,2018-05-20,Zacks Investment Research,https://www.investing.com/analysis/united-technologiesmiddleby-ink-deal-for-taylor-company-sale-200318040,200318040
