,id,ticker,title,category,content,date,provider,url,article_id
26645,248160,AIMC,Dover  DOV  Beats On Q3 Earnings  Reaffirms  17 EPS View,opinion,"Dover Corporation   NYSE DOV   reported third quarter 2017 adjusted earnings per share from continuing operations of  1 16  which surged 40  from 83 cents recorded in the prior year quarter  Earnings also beat the Zacks Consensus Estimate of  1 11 On a reported basis  Dover posted earnings per share of  1 14 for the quarter  up 37  year over year  The reported quarter included disposition and Wellsite separation related costs of 2 cents  while the year earlier quarter did not have any such adjustments Total revenues increased 17  year over year to  2 billion in the quarter  which came ahead of the Zacks Consensus Estimate of  1 98 billion  The year over year increase was driven by acquisition growth of 10   organic growth of 9  and a favorable impact from foreign exchange of 1   partly offset by a 3  impact from dispositions Dover Corporation Price  Consensus and EPS Surprise
    Costs and MarginsCost of sales climbed 17  year over year to  1 26 billion in the reported quarter  Gross profit rose 17 8  year over year to  744 million  Gross margin remained flat year over year at 37  Selling  general and administrative expenses increased to  470 5 million from  421 million recorded in the prior year quarter  Operating profit jumped 30  to  273 8 million from  210 7 million in the year ago quarter  Operating margin expanded 130 basis points  bps  to 13 6  Segmental PerformanceEnergy revenues climbed 31  year over year to  359 3 million in the quarter  The segment reported an operating profit of  51 9 million compared to  13 3 million recorded in the comparable period last year Revenues in the Engineered Systems segment advanced to  645 8 million from  570 6 million recorded in the year earlier quarter  The segment s income inched up 1 1  year over year to  98 3 million Revenues in the Fluids segment were up 36  year over year to  562 8 million in the reported quarter  The segment s income surged 32  year over year to  87 2 million The Refrigeration   Food Equipment segment s revenues dropped 2 8  to  438 8 million from  451 3 million recorded in the prior year quarter  The segment reported an operating income of  65 4 million  up from  64 million in the prior year period Bookings and BacklogDover s bookings at the end of the third quarter were worth  1 94 billion  up from  1 69 billion at the end of third quarter 2016  Backlog also increased to  1 27 billion at the end of the reported quarter from  1 08 billion recorded at the year ago quarter end Financial PositionDover generated free cash flow of  214 5 million in the quarter compared with  188 8 million in the prior year quarter  Cash flow from operations came in at  268 million in the reported quarter compared with  231 7 million witnessed in the year ago quarter Dover continues to make strides in simplifying its portfolio  Along with planned Wellsite separation  the company recently signed an agreement to sell the consumer and industrial winch business of Warn for  250 million  This deal will help it focus on core growth platforms  The Warn sale is expected to close in the fourth quarter  subject to closing conditions OutlookDover reaffirmed its earnings per share guidance range of  4 23  4 33 for full year 2017  The company raised revenue guidance and projects it to grow in the range of 14 15  compared with the previous outlook of 12 14   The revenue growth guidance comprises organic growth of 6 7  and acquisition growth of approximately 10   partially offset by a 2  impact from the dispositions Share Price PerformanceOver the last year  Dover underperformed the  with respect to price performance  The stock gained 34 8   while the industry recorded growth of 35 8  during the same time frame Zacks RankDover currently carries a Zacks Rank  2  Buy  Other top ranked companies in the same sector are Barnes Group Inc    NYSE B    Altra Industrial Motion Corp    NASDAQ AIMC   and Graco Inc    NYSE GGG    While Barnes Group sports a Zacks Rank  1  Strong Buy   Altra Industrial Motion and Graco carry a Zacks Rank  2  You can see Barnes Group has a long term expected earnings growth rate of 9  Altra Industrial Motion has a long term expected earnings growth rate of 8  Graco has a long term expected earnings growth rate of 10 5  Today s Stocks from Zacks  Hottest StrategiesIt s hard to believe  even for us at Zacks  But while the market gained  18 8  from 2016   Q1 2017  our top stock picking screens have returned  157 0    128 0    97 8    94 7   and  90 2  respectively And this outperformance has not just been a recent phenomenon  Over the years it has been remarkably consistent  From 2000   Q1 2017  the composite yearly average gain for these strategies has beaten the market more than 11X over  Maybe even more remarkable is the fact that we re willing to share their latest stocks with you without cost or obligation ",2017-10-19,Zacks Investment Research,https://www.investing.com/analysis/dover-dov-beats-on-q3-earnings-reaffirms-17-eps-view-200219910,200219910
26669,248184,AIMC,Middleby Buys QualServ To Boost Kitchen Equipment Business,opinion,The Middleby Corporation   NASDAQ MIDD   recently fortified its footprint in the global commercial foodservice equipment market by acquiring QualServ Solutions  LLC   QualServ   Over the last three years  shares of this Zacks Rank  3  Hold  stock yielded a return of 34 8   outperforming 16 8  growth recorded by the  The company is poised to grow on the back of product launches  strategic business acquisitions  ongoing integration moves and greater cost discipline Inside the HeadlinesQualServ offers unique equipment solutions and services in the worldwide commercial foodservice industry  and is well known for its premium kitchen engineering  designing  and manufacturing services  The company  which also provides a number of product management services  is known to generate annualized revenues of around  100 million Middleby noted that its restaurant chain customers currently demand engineering and logistic solutions for both front and back end of restaurants  The company believes that the QualServ buyout would strengthen its kitchen fabrication business in the near term  This  in turn  would aid in expanding its services globally to the restaurant chain customers  Notably  apart from the kitchen equipment sales  Middleby intends to provide state of the art broader and data analytics services to the end users on the back of the QualServ acquisition Key PicksBetter ranked stocks in the industry are listed below EnPro Industries   NYSE NPO   currently sports a Zacks Rank  1  Strong Buy  and has  expected earnings growth rate of 15 9  for the next three to five years  You can see  Altra Industrial Motion Corp  s   NASDAQ AIMC   holds a Zacks Rank  2  Buy  at present and has expected earnings growth rate of 8  for the next three to five years Applied Industrial Technologies  Inc    NYSE AIT   holds a Zacks Rank  2 at present and has expected earnings growth rate for the same time frame More Stock News  This Is Bigger than the iPhone          It could become the mother of all technological revolutions  Apple  NASDAQ AAPL  sold a mere 1 billion iPhones in 10 years but a new breakthrough is expected to generate more than 27 billion devices in just 3 years  creating a  1 7 trillion market Zacks has just released a Special Report that spotlights this fast emerging phenomenon and 6 tickers for taking advantage of it  If you don t buy now  you may kick yourself in 2020 ,2017-08-31,Zacks Investment Research,https://www.investing.com/analysis/middleby-buys-qualserv-to-boost-kitchen-equipment-business-200211079,200211079
26670,248185,AIMC,Kaman s Aerosystems Restructuring To Lower Costs From 2019,opinion,"Kaman Corporation   NYSE KAMN   recently announced a plan to restructure its Aerosystems business  for improving profitability  The move is in sync with the company s existing initiatives to strengthen the Aerosystems business  capacity utilization and operating efficiency The company  reportedly  operates under two segments  namely  Distribution and Aerospace  The Aerospace business has exhibited steady growth over time  accounting for 35 3  of total revenues in 2014 to 38 8  in 2016  Within this segment  the company deals with manufacturing of composite aerostructure  complex assembling  tooling design and manufacture  and conducting helicopter maintenance  repair and overhaul  MRO  activities  A Peek Into the HeadlinesThrough its announced restructuring plans  Kaman intends to shut down its Composite Structures division in Bloomfield  CT  by transferring its operations to Wichita  KS based composites facility and Bloomfield  CT based Air Vehicles and MRO division Additionally  Kaman intends to transfer fabricated products operations at its Hyde facility in the U K  to Darwen facility  This move might result in workforce reduction  Financial Aspects of This RestructuringThe Aerosystems restructuring efforts  initiated in the third quarter of 2017  are anticipated to be completed in the fourth quarter of 2018  During this implementation phase  Kaman expects to incur pre tax restructuring charges of  8  10 million  including  5 5  6 5 million cash expenses related to facility closure and employee separation  and  2 5  3 5 million non cash charges related to assets impairment and inventory write down  Of the total estimated expenses  roughly  5 million will be incurred in 2017 Upon completion of the restructuring initiatives  Kaman anticipates realizing annualized cost savings of  4 million Kaman Corporation Price and Consensus
    Zacks Rank   Key PicksWith a market capitalization of  1 4 billion  Kaman currently carries a Zacks Rank  3  Hold   Despite initiatives to improve business portfolio and curb costs  the company s share price performance has weak over time  Its second quarter 2017 results was weak  with adjusted earnings per share falling short of the Zacks Consensus Estimate by 2 04  and lagging the year ago tally by 25  Notably  since the results release on Jul 31  2017  the company s shares have lost nearly 4 8   wider than the decline of 1 9  recorded by the it belongs to Some better ranked stocks in the industry are EnPro Industries   NYSE NPO    Kadant Inc    NYSE KAI   and Altra Industrial Motion Corporation   NASDAQ AIMC    While both EnPro Industries and Kadant sport a Zacks Rank  1  Strong Buy   Altra Industrial Motion carries a Zacks Rank  2  Buy   You can see  EnPro Industries  earnings estimates for 2017 and 2018 were revised upward in the last 60 days  Also  its earnings are anticipated to grow 15 9  in the next three to five years Kadant s average earnings surprise for the last four quarters was a positive 19 29   Also  earnings expectations for 2017 and 2018 improved over the past 60 days Altra Industrial Motion s earnings estimates for 2017 and 2018 were revised upward in the last 60 days  Also  the company pulled off an average positive earnings surprise of 16 95  for the last four quarters  More Stock News  This Is Bigger than the iPhone  It could become the mother of all technological revolutions  Apple  NASDAQ AAPL  sold a mere 1 billion iPhones in 10 years but a new breakthrough is expected to generate more than 27 billion devices in just 3 years  creating a  1 7 trillion market Zacks has just released a Special Report that spotlights this fast emerging phenomenon and 6 tickers for taking advantage of it  If you don t buy now  you may kick yourself in 2020 ",2017-09-07,Zacks Investment Research,https://www.investing.com/analysis/kamans-aerosystems-restructuring-to-lower-costs-from-2019-200212151,200212151
26671,248186,AIMC,Regal Beloit Retains Competitive Edge With Six Sigma Tools,opinion,On Sep 11  we issued an updated research report on industrial goods manufacturer  Regal Beloit Corporation   NYSE RBC   Regal Beloit continues to focus on simplification initiatives to lower operating costs and improve margins in the future  The company expects organic growth for 2017 in low single digits with modest demand trends  Its long term strategy involves organic growth through innovative products  broadening customer base  exploitation of new opportunities and tactical investments in emerging markets  The company has also expanded technologically and geographically on the back of its aggressive acquisition policy  Management further indicated that it plans to continue seeking accretive acquisitions as part of its overall growth strategy Over the years  Regal Beloit has consolidated its product lines and streamlined brands to evolve as a dynamic enterprise  In order to drive continuous improvement  the company has strictly followed  Compass Operating System  that encompasses a common set of business processes  disciplines and lean Six Sigma tools  Backed by an  open door  management style  this has helped Regal Beloit gain a competitive advantage and reach more people in diverse markets around the world In addition  the company has continually focused on prudent investment decisions for a disciplined capital allocation  strong and flexible balance sheet position and cash flow enhancement to support dividend growth  We believe that such moves along with a robust operating platform and an efficient management team will help in the execution of its strategic priorities and drive net asset value in the future  The company s strong free cash generation is another positive  providing it an opportunity to pursue accretive acquisitions and unlock additional value  Going forward  Regal Beloit remains confident of generating robust operating cash flow to fund its organic and inorganic growth as well as return significant capital to its shareholders Despite core strengths  Regal Beloit has barely managed to outperform the  with an average year to date return of 9 1  compared with an 8 5  gain for the latter  The company continues to face increased concentration risks as a significant amount of its revenues is obtained from a handful of customers  In addition  adverse foreign currency translation  soft oil   gas markets and a challenging Chinese economy remain potential headwinds  The cyclical business is further dependent on industrial and consumer spending and continues to be affected by macroeconomic industrial cycles  both in domestic and international markets  Regal Beloit s earnings are also susceptible to exchange rate volatility  which poses a concern Regal Beloit currently carries a Zacks Rank  3  Hold  stock  Better ranked stocks in the industry include Graco Inc    NYSE GGG    Altra Industrial Motion Corp    NASDAQ AIMC   and Applied Industrial Technologies  Inc    NYSE AIT    each carrying a Zacks Rank  2  Buy   You can see  Graco has a long term earnings growth expectation of 10 5   It topped estimates in each of the trailing four quarters with an average positive earnings surprise of 24  Altra Industrial Motion has a long term earnings growth expectation of 8   It topped estimates in each of the trailing four quarters with an average positive earnings surprise of 17  Applied Industrial Technologies has a long term earnings growth expectation of 12   It surpassed estimates in each of the trailing four quarters with an average positive earnings surprise of 10 1  More Stock News  This Is Bigger than the iPhone It could become the mother of all technological revolutions  Apple  NASDAQ AAPL  sold a mere 1 billion iPhones in 10 years but a new breakthrough is expected to generate more than 27 billion devices in just 3 years  creating a  1 7 trillion market Zacks has just released a Special Report that spotlights this fast emerging phenomenon and 6 tickers for taking advantage of it  If you don t buy now  you may kick yourself in 2020 ,2017-09-11,Zacks Investment Research,https://www.investing.com/analysis/regal-beloit-retains-competitive-edge-with-six-sigma-tools-200212554,200212554
26672,248187,AIMC,Dover Seeks Diligent Options To Separate Wellsite Business,opinion,"In order to restructure its portfolio  Dover Corporation   NYSE DOV   announced the separation of its upstream energy businesses in the Energy segment  The maker of industrial products and manufacturing equipment is searching for sound alternatives to separate the business either by a tax free spin off  sale or other strategic combination Dover s upstream energy business which comprises Dover Artificial Lift  Dover Energy Automation  and US Synthetic is jointly known as the Wellsite business  The business operates in the oil   gas drilling and production industry Dover anticipates the Wellsite business to generate approximately  1 billion revenues and  250 million earnings  before interest  taxes  depreciation and amortization in 2017  However  the company remains cautious and predicts that its oil   gas exposed businesses will remain turbulent due to volatile oil prices Dover Corporation Price
    Notably  the above discussed separation will help Dover focus on core platforms of market leading businesses which are less volatile with bright prospects  Without Wellsite  Dover is expected to witness strong organic growth though with lower volatility Dover expects to complete its assessment of strategic separation alternatives by the end of this year  The company has appointed Lazard and Centerview Partners as financial advisors and Simpson Thacher   Bartlett LLP as legal counsel to support the company in evaluating the alternatives Dover anticipates robust organic revenue growth and margin expansion over the next few years The company has built and expanded its positions  serving growth markets through platforms like marking and coding  fueling   transport and pumps  It has significant potential to boost its revenues and margin through consistent focus on operating model and inorganic investment Year to date  Dover has outperformed the  it belongs to  The company s shares gained around 17 5  during this period compared with 16  growth recorded by the industry Zacks Rank   Stocks to ConsiderCurrently  Dover carries a Zacks Rank  3  Hold  Better ranked stocks in the sector include Altra Industrial Motion Corp    NASDAQ AIMC    Terex Corporation   NYSE TEX   and AGCO Corporation   NYSE AGCO    All three stocks sport a Zacks Rank  1  Strong Buy   You can see  Altra Industrial Motion has an expected long term earnings growth rate of 8  Terex has an expected long term earnings growth rate of 19 7  AGCO has an expected long term earnings growth rate of 13 5  More Stock News  This Is Bigger than the iPhone It could become the mother of all technological revolutions  Apple  NASDAQ AAPL  sold a mere 1 billion iPhones in 10 years but a new breakthrough is expected to generate more than 27 billion devices in just 3 years  creating a  1 7 trillion market Zacks has just released a Special Report that spotlights this fast emerging phenomenon and 6 tickers for taking advantage of it  If you don t buy now  you may kick yourself in 2020 ",2017-09-12,Zacks Investment Research,https://www.investing.com/analysis/dover-seeks-diligent-options-to-separate-wellsite-business-200213051,200213051
26673,248188,AIMC,5 Strong Buy Stocks That Just Hit All Time Highs,opinion,It s been a dramatic past few weeks around the world  and that has led to some hesitant trading  In fact  since early August  it has looked like the red hot market will finish 2017 a bit slower than it started the year  Nevertheless  our major indices are still near their all time highs  and several notable individual stocks are hitting new peaks as well Indeed  according to   77 different stocks had reached new all time highs through early afternoon trading on Wednesday  including Wall Street titans like Alibaba  NYSE BABA   Home Depot  NYSE HD   and Unitedhealth  UNH  What s more interesting than that is the fact that a handful of today s new highs are also on our Zacks Rank  1  Strong Buy  list  Some investors may be hesitant to buy a stock at its all time peak  but if the Zacks Rank is indicating that shares could move even higher  it could be a unique opportunity to ride a strong company s momentum So what are these elusive companies  Check out five Zacks Rank  1  Strong Buy  stocks that just touched new all time highs today 1  First American Financial    NYSE FAF   First American Financial is a provider of title insurance  escrow  property and casualty insurance  and homeowners insurance services  The stock has been hovering near its all time high for the past few trading days  and earlier this morning  shares reached a new peak of  49 57  FAF is now up over 32 5  year to date  On top of its strong Zacks Rank  this stock is also sporting an  A  grade for Value in our Style Scores system  and the company offers a respectable 3 08  dividend  2  Altra Industrial Motion    NASDAQ AIMC   Altra Industrial Motion is a designer and manufacturer of electromechanical power transmission products  After starting the day relatively flat  AIMC surged more than 1 2  to hit a new all time high of  47 05 per share in early afternoon trading  The stock has now gained nearly 75  over the past year  and with a strong Zacks Rank  it could continue climbing  AIMC is also sporting a  B  grade for Growth and is expected to improve its earnings by more than 30  this year  3  Dana Incorporated    NYSE DAN   Dana is a provider of technology drivetrain  sealing  and thermal management products  The stock has been climbing throughout the majority of Wednesday  and shares touched a new all time high of  25 26 in early afternoon hours  In addition to its strong Zacks Rank  Dana is sitting atop an industry that is in the top 17  of the Zacks Industry Rank  The stock also has an  A  grade for Value  and the company is currently sporting a P E ratio of just 10 46  4  Estee Lauder    NYSE EL   Estee Lauder is a leading global manufacturer of skin care  makeup  fragrance and hair care products  The stock opened higher today  eventually reaching a new all time high of  109 97 per share in early afternoon hours  EL is now up nearly 43  this year  making it one of the hottest stocks in the cosmetics industry  Furthermore  Estee Lauder is sporting  B  grades for Growth and Momentum  and with a beta rating of 0 67  this stock is also hypothetically less volatile than the market average  5  Etegris  Inc     NASDAQ ENTG   Etegris is a leading material provider for the semiconductor manufacturing and disk manufacturing markets  Shares started surging in early afternoon trading and moved about 0 65  higher than Tuesday s close  touching a new all time high of  27 35 in the process  Etegris is a leading an industry that is currently sitting in the top 4  of the Zacks Industry Rank  and the company has told a remarkable growth story so far this year  For the full year  we expect Etegris to report earnings growth of more than 35  and sales growth of 11   Want more stock market analysis from this author  Make sure to follow   on Twitter  More Stock News  This Is Bigger than the iPhone It could become the mother of all technological revolutions  Apple  NASDAQ AAPL  sold a mere 1 billion iPhones in 10 years but a new breakthrough is expected to generate more than 27 billion devices in just 3 years  creating a  1 7 trillion market Zacks has just released a Special Report that spotlights this fast emerging phenomenon and 6 tickers for taking advantage of it  If you don t buy now  you may kick yourself in 2020 ,2017-09-13,Zacks Investment Research,https://www.investing.com/analysis/5-strong-buy-stocks-that-just-hit-alltime-highs-200213124,200213124
