,id,ticker,title,category,content,date,provider,url,article_id
15268,236783,WHR,Damages for Grenfell fire victims may total just  5 million  Reuters analysis,news,"By Tom Bergin LONDON  Reuters    The bill for compensating families of those who died in the Grenfell Tower fire in London may be as low as 4 million pounds   5 million   according to several lawyers and a Reuters analysis of how damages laws apply in England  The blaze engulfed a 24 storey social housing block in west London on June 14  killing an estimated 80 people in the country s deadliest fire since World War Two  While similar disasters in the United States have led to massive payouts  any compensation for Grenfell would be far lower because English laws offer less generous damages and don t allow punitive claims  even if companies are found criminally responsible  said Brett Dixon  president of the Association of Personal Injury Lawyers  APIL   The four main firms that have been linked to the Grenfell fire   U S  companies Arconic Inc  and Whirlpool Corp  NYSE WHR   and Britain s Harley Facades and Rydon Group   declined to comment on the size or calculation of potential payouts  The Reuters calculation of a bill of 4 million pounds is based on the compensation amounts stipulated in the Fatal Accidents Act of 1976  precedents set in previous cases and the individual circumstances of the 70 victims identified so far  Three personal injury lawyers have verified the methodology used by Reuters and said the estimate for the total payout is reasonable  If the courts find there was no unlawful behavior by any of the companies or public bodies involved  victims will not be entitled to sue for compensation and would only get the financial support and temporary housing already provided by the government and public donations  personal injury lawyers said   The British judicial system is not renowned for being generous   said Rebecca Thomas of law firm Duncan Lewis  which is representing some victims  families   It s not about money for the families   said Tim Murphy  whose brother Denis  a disabled former painter who lived on the 14th floor  died in the fire   Nothing can ease our pain   but  I think it s quite insulting   The U S  legal system sees punitive damages as a way of encouraging companies to behave lawfully  but British and European governments have taken the view this approach would put excessive burdens on the judicial system  businesses  insurers and state bodies that might be liable  some legal experts say  While APIL said the Grenfell Tower disaster demonstrated the inadequacy of payouts to victims  Duncan Fairgrieve  who has advised the UK government on compensation rules  said more generous payouts could also harm society  They could drive up insurance costs for all and lead to big claims against government bodies such as the National Health Service and the police  he said   There is an affordability issue   said Fairgrieve  a Senior Research Fellow at the British Institute of International and Comparative Law  FEW DEPENDENTS If the courts find someone was wrongfully killed  the claim categories are a flat 12 980 pounds per victim for bereavement  costs such as funeral bills  dependency damages where minors or dependent spouses are left behind  and property damage   all to be paid by the party found responsible  Under the 1976 law  only family members who were supported by those who died can claim dependency damages  Reuters has identified only five people who died leaving dependents who could definitely claim damages   on the basis they were financially dependent on the deceased  Daniel Machover  a lawyer at Hickman and Rose  which is representing some victims  families  also said he didn t expect there to be many claims  Most of the others who died in the fire were minors  single or elderly and did not leave family members who were financially dependent upon them  The biggest dependency payout will be for children who lost both parents  said lawyers representing some of the victims  One six year old girl  Tasnim Belkadi  lost her mother  father and all her siblings in the fire  Lawyers said she could get 300 000 pounds  based on a share of her parents  income and some childcare costs up to her 18th birthday  Her aunt  with whom she now lives  declined to comment on the Reuters calculation  Grenfell plaintiffs can also claim expenses they incurred as the result of a death  such as the cost of a modest funeral  Heirs to the deceased could also claim the value of goods lost in the fire  The Association of British Insurers puts the cost of replacing the contents of an average three bedroom home at 55 000 pounds  However  Thomas said Grenfell claims would probably be less than 30 000 pounds per property because compensation is based on the market value of personal belongings rather than replacement value  and the flats destroyed had only one or two bedrooms  Based on the victims  circumstances  Reuters has calculated the payout for dependency damages could be 1 2 million pounds  for property it could be 1 4 million and for bereavement it could come to 1 0 million  Other smaller claims for costs and loss of parental guidance take the total to 4 million pounds  TENS OF MILLIONS Police said the fire started in a fridge freezer made by a subsidiary of U S  company Whirlpool and have been investigating whether the tower s cladding  made by U S  firm Arconic Inc   played a role in the spread of the blaze  Arconic said it was up to contractors to ensure its products were used correctly  Whirlpool said it was investigating the fire  Rydon Group  the contractor that oversaw the refurbishment when the new cladding was added  said it had complied with all regulations  Sub contractor Harley Facades Ltd said it was not aware of any link between the fire and the cladding  Fears among investors that companies linked to Grenfell could be sued for large sums in the United States hit their shares  Whirlpool s market value fell about  250 million on June 23 when police identified the maker of the appliance as Hotpoint  a brand owned by Indesit  which is a subsidiary of Whirlpool based in Italy  More than  1 billion was wiped off Arconic Inc  s value after Reuters reported in June that internal emails showed it had supplied flammable cladding panels  knowing they would be used on the tower and despite warning in its brochures that only non combustible panels should be used on tall buildings  Arconic s share price has recovered since its late June lows but it and Whirlpool s stock are below the levels they were at just before the fire  while the Dow Jones Industrial Average has climbed 7 percent over the same period  Awards against companies in U S  courts have run into the tens of millions of dollars per family in some cases  In 1980  a fire blamed in part on inadequate fire safety measures killed 85 people at the MGM Grand Hotel in Nevada and injured hundreds  The hotel operator and contractors agreed to pay victims  families and survivors more than  200 million  Foreigners have often tried to sue U S  corporations in U S  courts over alleged wrongdoing abroad  However  judges have consistently ruled they lacked jurisdiction in such cases  saying adequate tribunals existed in the plaintiff s own country and that it would be hard for defendants to make their case in the United States  Machover at Hickman and Rose said he was considering whether Grenfell victims could bring a U S  case on the basis that two of the companies involved were based there  But Thomas at Duncan Lewis and Leigh Day partner Jill Paterson were skeptical that U S  courts would agree to hear Grenfell claims given the United Kingdom offers a reasonable forum for redress and because the U S  companies were involved through European registered subsidiaries   I can t see any circumstances under which they could bring this in the United States   said Thomas  
Arconic and Whirlpool declined to comment on the possibility of legal claims against them ",2017-10-18,Reuters,https://www.investing.com/news/world-news/damages-for-grenfell-fire-victims-may-total-just-5-million-reuters-analysis-543412,543412
15269,236784,WHR,GOLDMAN SACHS  Here s the only strategy you need to crush earnings season,news,"Earnings season is here  and Goldman Sachs  NYSE GS  has some money making ideas 
Their recommendations involve options trades on single stocks that are designed to capture potential gains in share prices 

We all know the old adage  buy low and sell high 
That s exactly what Goldman Sachs recommends for stock traders heading into earnings season   except their suggested method involves options 
The focal point of their strategy involves identifying downtrodden stocks with strong fundamentals since they ll be the most likely to spring higher in the event of a better than expected report 
The firm says to buy calls   or bets a stock will rise   on companies with either buy or neutral ratings that have underperformed the S P 500 by 3  or more in the two weeks ahead of earnings  Dating back to 1996  implementing this strategy would ve yielded a 17  return  Goldman finds 
Getting further into the mechanics of the strategy  Goldman recommends buying one month call contracts with exercise prices that are higher than where the stock is currently trading 
The bank s analysts have constructed a list of the 19 companies that best fit these criteria 
But the firm s suggestions don t stop there  They also offer up three specific options strategies for stocks they think could be more volatile than is presently priced 

Buy GE puts expiring in November to hedge October 20 earnings and November 13 analyst day risks
Buy WHR  Whirlpool  NYSE WHR   October 27 straddles for October 23 earnings and potential news from the International Trade Commission regarding the company s quest to stem competitor appliances from flooding the US market
Put AMD October 27 puts for earnings on October 24",2017-10-19,Business Insider,https://www.investing.com/news/stock-market-news/goldman-sachs-heres-the-only-strategy-you-need-to-crush-earnings-season-544228,544228
15270,236785,WHR,Whirlpool s washer war is balancing act for Trump,news,"By Timothy Aeppel Clyde  Ohio Reuters    In the middle of Whirlpool Corp s bustling washer factory in northern Ohio there is an empty patch of concrete floor   a reminder of a  60 million expansion plan the appliance maker says fell victim to unfair foreign competition   We cleared that out to hold more plastic molding machines   says Daniel O Brien  the factory s vice president of operations  Whirlpool  N WHR  halted the upgrade two years ago blaming South Korea s  LG Electronics Inc   KS 066570  and  Samsung Electronics Co Ltd   KS 005930  for the setback  In a string of trade cases the Benton Harbor  Michigan based manufacturer has argued the Koreans have undercut its U S  business by exporting washers at unfairly low prices  Since the Nov  8 presidential election  Whirlpool has been fighting with renewed vigor  seeking more protection  President Donald Trump s administration is the first one in decades that openly says it is searching for ways to hit back at foreign producers it finds are hurting domestic manufacturers  But the washer case has a twist  Since the election  both Korean producers have announced plans for big U S  factories and that confronts the administration with a dilemma  how do you weigh interests of a U S  manufacturer against investment plans of foreign competitors and which jobs are more important   Whirlpool s sprawling complex in Clyde   stretching nearly a mile from corner to corner   employs 3 200 well paid union workers  Now  LG is spending  250 million to build a 600 worker factory in Tennessee  while Samsung is investing  380 million to renovate an old  Caterpillar  Inc  NYSE CAT   factory in South Carolina that will employ 950  Both states are dominated by Republicans   POLITICAL BACKING The investment in Tennessee has attracted support from local  state and federal officials  many of whom attended a groundbreaking ceremony in August  LG spokesman John Taylor said   We got terrific feedback from Commerce Secretary  Wilbur  Ross when he was at the groundbreaking   Both LG and Samsung said their investments followed years of preparations  though Taylor said the timing of the announcement was  opportune  given Trump s focus on manufacturing jobs  Whirlpool remains the leader in the  7 5 billion U S  washer market  but the rivals are closing in  The company s brands  which include Maytag and Amana  account for just under 35 percent of domestic sales  down from over 38 percent in 2013  according to Stevenson Co s TraQline  a market research company  Over the same period  Samsung s share doubled to just under 20 percent  while LG s held steady around 16 percent  The Korean producers argue innovation and more choice for the consumers rather than prices have driven their growth and say Whirlpool s five straight years of record results weaken its case  Both companies deny they have violated U S  trade laws   Whirlpool s stock price more than tripled from 2012 to 2015  It is hard to see how such an industry is suffering material injury   LG lead outside counsel Daniel Porter told the International Trade Commission  a federal agency that investigates trade issues  in a meeting earlier this year  The Commerce Department declined to comment for this story because of the pending ITC case brought by Whirlpool  Nevertheless  the Korean manufacturers are nervous  At the groundbreaking for the LG plant in August  the company pulled forward the date for completion by six months to the first quarter of 2019   an extremely fast construction window for such a factory  Whirlpool  which won two anti dumping cases against the Korean firms in the past four years  took its fight one step further and filed a  safeguard petition  in May  seeking broader protection than anti dumping measures provide   A safeguard targets imports from any country and the petitioner does not need to prove that the goods are being sold at unfairly low prices just that the influx of products is disrupting the U S  market and causing  serious injury  to domestic producers  The ITC is due to vote on Thursday whether washing machine imports cause harm to U S  producers  If it rules in Whirlpool s favor  the commission will recommend remedies  such tariffs  import quotas or other measures  to Trump in early December   RARE SAFEGUARDS U S  producers have seldom sought such protections  in part because they are often challenged at the World Trade Organization  The last case was in 2002  when President George W  Bush imposed tariffs of up to 30 percent on certain imported steel products  Clark Packard  a policy analyst at the R Street Institute  a libertarian think tank  says the safeguards should be reserved for rare instances of unforeseen surges in imports  but that the  atmosphere is ripe in Washington  for these cases   Whirlpool says it is seeking broader protection because the Korean producers were able to avoid anti dumping tariffs by moving production from country to country  After the ITC imposed anti dumping tariffs against South Korean washers made in South Korea and Mexico in 2013  the production moved to China and when the ITC slapped tariffs on those washers  LG and Samsung began making them in Vietnam and Thailand   The only plausible explanation for these moves was to dodge the U S  anti dumping orders and avoid duties   said Whirlpool Chairman Jeff Fettig  in testimony before the ITC in September   As part of the safeguard petition  Whirlpool also wants curbs on the import of large washing machine components  arguing otherwise the Korean companies could merely set up assembly plants running primarily on foreign parts  While the case has worked its way through the system  the mood in Clyde has darkened as investment plans were scaled back   Leading the way up to a cluster of idle machines  O Brien  the plant vice president  says   This is  3 million worth of machinery   and it only runs two or three hours a day    The equipment was installed in 2015 before the other investments were put on hold  he notes  Elsewhere in the plant  a giant poster  painted by a worker  shows an anthropomorphic Whirlpool washing machine  pushing past stumbling washers labeled LG and Samsung   a far more upbeat take on the rivalry than the mood on the factory floor   Everyone here feels the frustration   says Lori Frasure  a 30 year old factory worker   it s a frustration that we re not all playing by the same rules   The only other large domestic manufacturer of washing machines is GE Appliances  now owned by China s Haier Group  HK 1169   Earl Jones  the company s senior counsel  says GE is not party in the Whirlpool case  but it has also cut investments and reassigned workers inside their appliance manufacturing complex in Louisville  Kentucky   We re on the record of supporting their petition   
Follow Trump s impact on energy  environment  healthcare  immigration and the economy at The Trump Effect  ",2017-10-04,Reuters,https://www.investing.com/news/stock-market-news/whirlpools-washer-war-is-balancing-act-for-trump-536597,536597
15271,236786,WHR,Panel finds U S  washing machine makers hurt by LG  Samsung imports,news,"By David Lawder WASHINGTON  Reuters    The U S  International Trade Commission found on Thursday that surging imports of large residential washing machines harmed domestic producers  a major step toward the imposition of broad duties or quotas on foreign made Samsung  and LG brand machines   The case  brought by U S  appliance giant Whirlpool Corp  N WHR   sought  global safeguard  restrictions to stop South Korean rivals  Samsung Electronics Co Ltd   KS 005930  and  LG Electronics Inc   KS 066570  from flooding the U S  market with cheaper washers  The commission  voting 4 0 in favor of a finding that the large number of imports was hurting domestic manufacturers  will recommend remedies by Dec  4 to President Donald Trump  who is expected to make a final decision by early next year   A public hearing on possible remedies has been scheduled for Oct  19  an ITC spokeswoman said  The panel did not find that washers made specifically in South Korea  already subject to anti dumping duties  were responsible for harming U S  manufacturers  Whirlpool Chairman Jeff Fettig said the decision was another vindication in the company s years long anti dumping battle with Samsung and LG  in which he had accused them of moving production around the world in order to avoid U S  duties   This type of corrective action will create U S  manufacturing jobs   Fettig said  Samsung and LG both issued statements saying that import curbs would hurt consumers by raising prices  limiting choice and stifling innovation  They emphasized their own investments worth hundreds of millions of dollars in new appliance factories in the United States  both announced since Trump took office in January  LG accused Whirlpool of using U S  trade laws to restrain an innovative competitor   Soon  competition in the washer market will not be about domestic vs  foreign production   LG said its statement   It will be about competition among washers made in the United States  in Ohio  Kentucky  Tennessee and South Carolina   The washer case represents a dilemma for Trump and his  America First  trade agenda  potentially putting him in the position of punishing companies that have pledged investments to bring manufacturing jobs to the United States  The ITC s decision is the second in two weeks that the panel has found injury in a  global safeguard  case  after ruling that cheap solar panel imports from China and other countries were hurting domestic producers SolarWorld America  F SWVKk  and Suniva Inc  majority owned by China s Shunfeng International Clean Energy Ltd  HK 1165   The washer and solar cases were filed under Section 201 of the Trade Act of 1974  a statute that hasn t been invoked since 2002  when George W  Bush imposed broad temporary tariffs on steel imports  
The steel duties were withdrawn 21 months later after the World Trade Organization found the action a violation of U S  tariff rate commitments ",2017-10-05,Reuters,https://www.investing.com/news/stock-market-news/commission-finds-us-makers-of-washers-harmed-by-south-korean-imports-537411,537411
15284,236799,WHR,Macron fights  president of the rich  tag after ending wealth tax,news,"By Michel Rose PARIS  Reuters    President Emmanuel Macron fought off accusations of favoring the rich on Tuesday after making good on a campaign pledge to scrap France s wealth tax   a symbol of social justice that has scared off thousands of millionaires from French shores  Macron s move to replace the tax with a levy targeting only real estate in last week s 2018 budget was used by political opponents to brand him the  president of the rich   a label the ex Rothschild banker has been struggling to shake off since taking office in May  In a visit to a Whirlpool  NYSE WHR  factory in his native town of Amiens  scene of a showdown six months ago with his then far right challenger Marine Le Pen in the presidential election contest  Macron defended the policy   It s all well and good to want to spread wealth  but you first need to produce  to create wealth before redistributing  that s how it works   he told journalists  After many European countries abolished their own  France was left as the only EU member with a wealth tax  a charge introduced by the Socialists in the 1980s which was levied on individuals with assets above 1 3 million euros   1 5 million   That led to thousands of rich French families to move to countries such as Belgium to avoid paying the tax  including most famously  Green Card  actor Gerard Depardieu and members of the Mulliez family  owners of the Auchan supermarket chain  Prime Minister Edouard Philippe has estimated some 10 000 people with 35 billion euros worth of assets left in the past 15 years  But coming after the government s decision to cut a housing allowance enjoyed by millions of poorer French people  the move on the wealth tax   which will cost the treasury 3 2 billion euros in lost revenue   has sparked outrage in opposition ranks   The better off will be those who get richer while they sleep   former Socialist finance minister Michel Sapin said  quoting late president Francois Mitterrand  who introduced the wealth tax  More worryingly for Macron  the move has also caused unease within his own centrist majority  which will start discussing the budget bill in parliament later this month   Yachts  private jets  race horses  races cars or gold ingots are no longer included in the new wealth tax  That can t be   Joel Giraud  an allied lawmaker charged with steering the budget through parliamentary committees told Le Parisien daily   These kinds of symbols must be taxed much more  A yacht is bling bling  It isn t productive for the economy   he said  While leaving the door open to raising specific levies on yachts or cars  Finance Minister Bruno Le Maire warned lawmakers not to hit a luxury sector in which France is a leader   And why not tax jewellery  furs and wine cellars   he asked  
  1   0 8501 euros ",2017-10-03,Reuters,https://www.investing.com/news/economy-news/macron-fights-president-of-the-rich-tag-after-ending-wealth-tax-536282,536282
15287,236802,WHR,Sears to sell Kenmore appliances on Amazon  shares jump,news,"By Sruthi Ramakrishnan  Reuters    Sears Holdings Corp s shares soared as much as 24 percent after the struggling retailer said it would sell its Kenmore home appliances on Amazon com  NASDAQ AMZN  and integrate the brand s smart gadgets with the online giant s Alexa digital assistant  The deal will expand the distribution reach of Kenmore products at a time when the retailer is shutting stores following years of declining sales amid intensifying competition from Wal Mart Stores Inc  NYSE WMT  and Amazon  Sears sells big ticket Kenmore appliances such as refrigerators and air conditioners only in its Sears  Kmart and Sears Hometown stores  Sears  which flagged doubts earlier this year about its ability to remain in business  said this month it would shut 43 stores  in addition to the 150 it announced in January  Sears  stock pared some of the early gains but was still up 14 percent  on track for its best day in about four months  Syncing Kenmore gadgets with Alexa  which will allow users to control the gadgets with voice commands  could add to the brand s appeal  The deal to sell Alexa activated devices could provide a modest boost to Sears  sagging sales  Retail Metrics President Ken Perkins said  Sears joins an increasing number of retailers and manufacturers  including Whirlpool Corp  NYSE WHR   Ford Motor  NYSE F  Co and Starbucks  NASDAQ SBUX   which are integrating their products with Alexa as they look to garner sales through the popular digital assistant  Alexa controls Amazon Echo  a speaker which lets the user call a cab  order pizza or shop on Amazon among other things  Sears  deal with Amazon could even eat into in store sales and hit margins  warned Neil Saunders  managing director of retail at research firm GlobalData   It puts Sears into a marketplace that is very price competitive and where fulfillment costs are high  this is something that may be challenging for margins   The move  nevertheless  underscores the broader trend of store based retailers increasingly looking to sell more online  
Footwear maker  Nike  Inc  NYSE NKE  also said last month it would start selling a limited product assortment directly on Amazon  rather than through third party and unlicensed dealers ",2017-07-20,Reuters,https://www.investing.com/news/stock-market-news/sears-to-sell-kenmore-appliances-on-amazon-507831,507831
