,id,ticker,title,category,content,date,provider,url,article_id
4630,226145,POLYP,Russia stocks lower at close of trade  MICEX down 0 19 ,news,"Investing com   Russia stocks were lower after the close on Wednesday  as losses in the Manufacturing  Mining and Power sectors led shares lower 
At the close in Moscow  the MICEX fell 0 19  
The best performers of the session on the MICEX were MVideo  MCX MVID   which rose 5 74  or 9 70 points to trade at 178 70 at the close  Meanwhile  AFK Sistema  MCX AFKS  added 4 20  or 0 710 points to end at 17 600 and Polymetal International PLC  MCX POLY  was up 3 47  or 16 50 points to 492 50 in late trade 
The worst performers of the session were RDR United Company RUSAL PLC  MCX RUALR   which fell 5 59  or 20 50 points to trade at 346 00 at the close  LSR  MCX LSRG  declined 3 84  or 27 0 points to end at 676 0 and Rosseti ao  MCX RSTI  was down 3 71  or 0 0193 points to 0 5006 
Falling stocks outnumbered advancing ones on the Moscow Stock Exchange by 115 to 71 and 7 ended unchanged 
The Russian VIX  which measures the implied volatility of MICEX options  was down 1 09  to 41 000 a new 3 month low 
Gold for April delivery was up 0 48  or 5 70 to  1197 10 a troy ounce  Elsewhere in commodities trading  Crude oil for delivery in May rose 1 79  or 0 85 to hit  48 36 a barrel  while the May Brent oil contract rose 1 46  or 0 81 to trade at  55 91 a barrel 
USD RUB was down 0 56  to 57 438  while EUR RUB fell 0 09  to 62 983 
The US Dollar Index was down 0 31  at 97 12 ",2015-03-25,Investing.com,https://www.investing.com/news/stock-market-news/russia-stocks-lower-at-close-of-trade;-micex-down-0.19-334133,334133
4631,226146,POLYP,Russia stocks higher at close of trade  MICEX up 1 98 ,news,"Investing com   Russia stocks were higher after the close on Tuesday  as gains in the Oil   Gas  Power and Mining sectors led shares higher 
At the close in Moscow  the MICEX gained 1 98  to hit a new 1 month high 
The best performers of the session on the MICEX were Rosseti ao  MCX RSTI   which rose 7 03  or 0 0370 points to trade at 0 5630 at the close  Meanwhile  Surgut pref  MCX SNGS p  added 6 46  or 2 510 points to end at 41 360 and Pharmstandard JSC  MCX PHST  was up 6 12  or 60 0 points to 1040 0 in late trade 
The worst performers of the session were Polyus Gold International Ltd  MCX PGIL   which fell 3 29  or 4 90 points to trade at 144 00 at the close  Polymetal International PLC  MCX POLY  declined 2 33  or 10 00 points to end at 419 00 and Magnit  MCX MGNT  was down 2 15  or 242 0 points to 11038 0 
Rising stocks outnumbered declining ones on the Moscow Stock Exchange by 122 to 78 and 9 ended unchanged 
The Russian VIX  which measures the implied volatility of MICEX options  was up 2 36  to 35 610 
Gold for June delivery was up 0 46  or 5 40 to  1192 20 a troy ounce  Elsewhere in commodities trading  Crude oil for delivery in June rose 3 14  or 1 85 to hit  60 78 a barrel  while the June Brent oil contract rose 2 39  or 1 58 to trade at  68 03 a barrel 
USD RUB was down 3 15  to 50 442  while EUR RUB fell 2 79  to 56 480 
The US Dollar Index was down 0 40  at 95 20 ",2015-05-05,Investing.com,https://www.investing.com/news/stock-market-news/russia-stocks-higher-at-close-of-trade;-micex-up-1.98-340352,340352
4632,226147,POLYP,Russia stocks higher at close of trade  MICEX up 1 28 ,news,"Investing com   Russia stocks were higher after the close on Friday  as gains in the Manufacturing  Oil   Gas and Telecoms sectors led shares higher 
At the close in Moscow  the MICEX gained 1 28  
The best performers of the session on the MICEX were Polymetal International PLC  MCX POLY   which rose 6 07  or 25 50 points to trade at 445 50 at the close  Meanwhile  Pharmstandard JSC  MCX PHST  added 5 83  or 60 0 points to end at 1090 0 and AK Transneft OAO Pref  MCX TRNF p  was up 3 75  or 4470 points to 123570 in late trade 
The worst performers of the session were Moskovskaya Birzha OAO  MCX MOEX   which fell 3 30  or 2 51 points to trade at 73 49 at the close  DIXY Group ao  MCX DIXY  declined 2 32  or 9 50 points to end at 400 50 and Mos obl sb  MCX MSRS  was down 1 61  or 0 0150 points to 0 9150 
Rising stocks outnumbered declining ones on the Moscow Stock Exchange by 126 to 57 and 7 ended unchanged 
The Russian VIX  which measures the implied volatility of MICEX options  was up 18 35  to 40 370 
Gold for June delivery was up 0 40  or 4 70 to  1186 90 a troy ounce  Elsewhere in commodities trading  Crude oil for delivery in June rose 0 63  or 0 37 to hit  59 31 a barrel  while the June Brent oil contract fell 0 28  or 0 18 to trade at  65 36 a barrel 
USD RUB was up 1 17  to 50 893  while EUR RUB rose 0 49  to 57 080 
The US Dollar Index was up 0 08  at 94 81 ",2015-05-08,Investing.com,https://www.investing.com/news/stock-market-news/russia-stocks-higher-at-close-of-trade;-micex-up-1.28-340991,340991
4634,226149,POLYP,Russia stocks higher at close of trade  MICEX up 0 83 ,news,"Investing com   Russia stocks were higher after the close on Friday  as gains in the Oil   Gas  Telecoms and Mining sectors led shares higher 
At the close in Moscow  the MICEX gained 0 83  
The best performers of the session on the MICEX were VTB  MCX VTBR   which rose 5 03  or 0 0033 points to trade at 0 0684 at the close  Meanwhile  MMK  MCX MAGN  added 4 36  or 0 642 points to end at 15 352 and AK Transneft OAO Pref  MCX TRNF p  was up 3 88  or 4670 points to 124900 in late trade 
The worst performers of the session were Yandex NV  MCX YNDX   which fell 2 16  or 21 00 points to trade at 950 00 at the close  Polymetal International PLC  MCX POLY  declined 1 93  or 8 50 points to end at 432 50 and Bashneft ANK ao  MCX BANE  was down 1 92  or 42 0 points to 2148 0 
Rising stocks outnumbered declining ones on the Moscow Stock Exchange by 103 to 86 and 6 ended unchanged 
The Russian VIX  which measures the implied volatility of MICEX options  was down 6 32  to 31 440 a new 6 months low 
Gold for June delivery was down 0 16  or 1 90 to  1223 30 a troy ounce  Elsewhere in commodities trading  Crude oil for delivery in June fell 0 87  or 0 52 to hit  59 36 a barrel  while the July Brent oil contract fell 0 26  or 0 17 to trade at  66 53 a barrel 
USD RUB was down 1 22  to 49 492  while EUR RUB fell 1 16  to 56 545 
The US Dollar Index was unchanged 0 00  at 93 41 ",2015-05-15,Investing.com,https://www.investing.com/news/stock-market-news/russia-stocks-higher-at-close-of-trade;-micex-up-0.83-342068,342068
4635,226150,POLYP,Russia stocks lower at close of trade  MICEX down 1 36 ,news,"Investing com   Russia stocks were lower after the close on Wednesday  as losses in the Telecoms  Oil   Gas and Manufacturing sectors led shares lower 
At the close in Moscow  the MICEX lost 1 36  to hit a new 1 month low 
The best performers of the session on the MICEX were SG mechel  MCX MTLR   which rose 9 27  or 5 48 points to trade at 64 60 at the close  Meanwhile  Polymetal International PLC  MCX POLY  added 3 20  or 13 50 points to end at 435 00 and FSK EES  MCX FEES  was up 2 61  or 0 0017 points to 0 0672 in late trade 
The worst performers of the session were RDR United Company RUSAL PLC  MCX RUALR   which fell 3 72  or 11 50 points to trade at 297 50 at the close  Bashneft ANK ao  MCX BANE  declined 3 53  or 72 0 points to end at 1968 0 and ANK Bashneft OAO Pref  MCX BANE p  was down 3 21  or 49 0 points to 1476 0 
Falling stocks outnumbered advancing ones on the Moscow Stock Exchange by 115 to 74 and 9 ended unchanged 
The Russian VIX  which measures the implied volatility of MICEX options  was up 0 70  to 34 300 
Gold for June delivery was up 0 14  or 1 70 to  1208 40 a troy ounce  Elsewhere in commodities trading  Crude oil for delivery in July rose 1 41  or 0 82 to hit  58 81 a barrel  while the July Brent oil contract rose 1 29  or 0 82 to trade at  64 84 a barrel 
USD RUB was up 0 62  to 49 854  while EUR RUB rose 0 15  to 55 354 
The US Dollar Index was up 0 34  at 95 69 ",2015-05-20,Investing.com,https://www.investing.com/news/stock-market-news/russia-stocks-lower-at-close-of-trade;-micex-down-1.36-342759,342759
4642,226157,POLYP,Russia stocks higher at close of trade,news,"Investing com   Russia stocks were higher after the close on Thursday  as gains in the Telecom  Oil and Gas and Manufacturing sectors led shares higher 
At the close in Moscow  the RTSI rose 2 60   while the MICEX index added 0 56  
The best performers of the session on the RTSI were Verhnesald MPO  MCX VSMO   which rose 9 33  or 820 0 points to trade at 9610 0 at the close  Meanwhile  Polymetal International PLC  MCX POLY  added 5 80  or 32 50 points to end at 593 00 and Rosneft  MCX ROSN  was up 4 96  or 10 40 points to 219 90 in late trade 
The worst performers of the session were Gruppa Cherkizovo ao  MCX GCHE   which fell 4 45  or 31 0 points to trade at 666 0 at the close  ALROSA ao  MCX ALRS  declined 4 32  or 3 100 points to end at 68 600 and MMC Norilsk Nickel  MCX GMKN  was down 3 23  or 310 0 points to 9290 0 
The top performers on the MICEX were Verhnesald MPO  MCX VSMO  which rose 9 33  to 9610 0  Polymetal International PLC  MCX POLY  which was up 5 80  to settle at 593 00 and Rosneft  MCX ROSN  which gained 4 96  to close at 219 90 
The worst performers were Gruppa Cherkizovo ao  MCX GCHE  which was down 4 45  to 666 0 in late trade  ALROSA ao  MCX ALRS  which lost 4 32  to settle at 68 600 and MMC Norilsk Nickel  MCX GMKN  which was down 3 23  to 9290 0 at the close 
Falling stocks outnumbered advancing ones on the Moscow Stock Exchange by 70 to 70 and 5 ended unchanged 
Shares in Verhnesald MPO  MCX VSMO  rose to all time highs  gaining 9 33  or 820 0 to 9610 0  Shares in Verhnesald MPO  MCX VSMO  rose to all time highs  gaining 9 33  or 820 0 to 9610 0  
Gold for February delivery was up 2 24  or 27 60 to  1262 10 a troy ounce  Elsewhere in commodities trading  Crude Oil for delivery in February fell 1 18  or 0 57 to hit  47 91 a barrel  while the March Brent Oil contract fell 0 07  or 0 04 to trade at  49 83 a barrel 
USD RUB was up 1 71  to 65 375  while EUR RUB fell 0 47  to 75 516 
The US Dollar Index was up 0 58  at 92 84 ",2015-01-15,Investing.com,https://www.investing.com/news/stock-market-news/russia-stocks-higher-at-close-of-trade-323658,323658
4652,226167,POLYP,European stocks hold gains on positive data  Dax up 0 47 ,news,"Investing com   European stocks held gains on Thursday  still supported by the release of broadly positive manufacturing and service sector data from the euro zone  as well as an earlier report out of China 
During European afternoon trade  the DJ Euro Stoxx 50 advanced 0 85   France s CAC 40 climbed 0 77   while Germany s DAX gained 0 47  
Market research group Markit said that its preliminary manufacturing purchasing managers  index rose to 51 9 this month  up from a final reading of 51 8 in June  Analysts had expected the index to ease down to 51 7 in July 
Meanwhile  the bloc s preliminary services purchasing managers  improved to 54 4 in July from a reading of 52 8 in June  Analysts had expected the index to dip to 52 7 this month 
In Germany  the manufacturing PMI rose to 52 9 this month from a final reading of 52 0 in June  while the preliminary services PMI improved to a 37 month high of 56 6  up from a reading of 54 6 
France s manufacturing PMI fell to 47 6 this month from a final reading of 48 2 in June  while the preliminary services PMI improved to 50 4 from 48 2 
Market sentiment had improved earlier  after data showed that China s HSBC Flash Manufacturing PMI rose to an 18 month high of 52 0 in June  from a reading of 50 7 the previous month  exceeding expectations for an increase to 51 0 
Financial stocks were broadly higher  as French lenders BNP Paribas  PARIS BNPP  and Societe Generale  PARIS SOGN  rallied 2 01  and 2 52   while Germany s Deutsche Bank  XETRA DBKGn  jumped 1 64  
Among peripheral lenders  Italy s Unicredit  MILAN CRDI  and Intesa Sanpaolo  MILAN ISP  surged 2 94  and 2 96  respectively  while Spanish banks Banco Santander  MADRID SAN  and BBVA  MADRID BBVA  gained 1 98  and 2 21  
Elsewhere  Roche  SIX ROG  advanced 1 54  after confirming its full year forecast 
Nokia Oyj  ST NOKI  added to gains and soared 7 43  after it posted second quarter earnings above estimates 
In London  commodity heavy FTSE 100 edged up 0 14   supported by the financial sector 
Shares in Lloyds Banking  LONDON LLOY  edged up 0 07  and the Royal Bank of Scotland  LONDON RBS  gained 0 83   while Barclays  LONDON BARC  and HSBC Holdings  LONDON HSBA  jumped 0 96  and 2 08  respectively 
In the mining sector  stocks were mixed as Fresnillo  LONDON FRES  plummeted 1 82  and Polymetal  LONDON POLYP  dove 2 64   while Rio Tinto  LONDON RIO  added 0 07  and Antofagasta  LONDON ANTO  climbed 0 84  
Meanwhile  Kingfisher  LONDON KGF   down 7 57   continued to lead losses on the index following reports the company is set to be declared a wilful defaulter by its lenders 
In the U S   equity markets pointed to a higher open  The Dow 30 futures pointed to a 0 16  rise  S P 500 futures signaled a 0 12  gain  while the Nasdaq 100 futures indicated a 0 26  increase 
Later in the day  the U S  was to produce data on unemployment claims  manufacturing activity and new home sales ",2014-07-24,Investing.com,https://www.investing.com/news/stock-market-news/european-stocks-hold-gains-on-positive-data;-dax-up-0.47-297560,297560
4653,226168,POLYP,European stocks remain mostly higher in thin trade  Dax down 0 12 ,news,"Investing com   European stocks remained mostly higher in thin trade on Monday  as no major economic reports were due out from the euro zone  while investors continued to monitor developments in the Middle East and Ukraine 
During European afternoon trade  the DJ Euro Stoxx 50 rose 0 25   France s CAC 40 gained 0 42   while Germany s DAX fell 0 12  
In Gaza  fighting slightly subsided on Sunday after Hamas Islamist militants said they backed a 24 hour humanitarian truce in light of the Muslim holiday Eid al Fitr 
Meanwhile  the European Union agreed to impose economic sanctions against Russia for its role in the Ukraine crisis  Moscow reacted to the sanctions by warning that they would hamper cooperation on global security issues 
Financial stocks were mixed  as BNP Paribas  PARIS BNPP  gained 0 38  and Societe Generale  PARIS SOGN  slid 0 38  in France  while Germany s Deutsche Bank  XETRA DBKGn  declined 0 49  
Among peripheral lenders  Italy s Intesa Sanpaolo  MILAN ISP  and Unicredit  MILAN CRDI  added 0 30  and 0 37  respectively  while Spanish banks Banco Santander  MADRID SAN  and BBVA  MADRID BBVA  fell 0 33  and 0 50  
Elsewhere  Danone  PARIS DANO  rallied 1 27  amid reports the French consumer products maker is in talks with Hospira as a potential buyer for a medical nutrition unit 
On the downside  Wincor Nixdorf  XETRA WING  saw shares plunge 8 22  after the maker of automated teller machines posted third quarter revenue that misses analysts  estimates 
In London  FTSE 100 edged up 0 15   still led by Reckitt Benckiser  LONDON RB   up 3 40   after the company said it plans to spin off its pharmaceutical business 
Ryanair  LONDON RYA  added to gains  surging 4  after the airliner lifted its fiscal full year profit goal and posted first quarter profit that more than doubled 
Meanwhile  financial stocks were mostly higher  Shares in Barclays  LONDON BARC  gained 0 46  and Lloyds Banking  LONDON LLOY  advanced 0 51   while HSBC Holdings  LONDON HSBA  rallied 1 26   The Royal Bank of Scotland  LONDON RBS  underperformed however  down 2 69  
In the mining sector  stocks turned broadly lower  Bhp Billiton  LONDON BLT  retreated 0 67  and Rio Tinto  LONDON RIO  tumbled 0 92   while Glencore Xstrata  LONDON GLEN  and Polymetal  LONDON POLYP  plummeted 1 89  and 2 21  
In the U S   equity markets pointed to a moderately lower open  The Dow 30 futures pointed to a 0 09  fall  S P 500 futures signaled a 0 09  loss  while the Nasdaq 100 futures indicated a 0 05  dip 
Later in the day  the U S  was to release data on pending home sales ",2014-07-28,Investing.com,https://www.investing.com/news/stock-market-news/european-stocks-remain-mostly-higher-in-thin-trade;-dax-down-0.12-298290,298290
4655,226170,POLYP,European stocks higher  eyes on ECB meeting  Dax up 0 08 ,news,"Investing com   European stocks were higher on Monday  despite downbeat Spanish employment data  as investors eyed a policy meeting by the European Central Bank later in the week 
During European morning trade  the DJ Euro Stoxx 50 gained 0 46   France s CAC 40 advanced 0 46   while Germany s DAX edged up 0 08  
Data late last week showed that the annual rate of inflation in the euro area slowed to 0 4  last month from 0 5  in June  adding to pressure on the ECB to implement measures to avert the risk of deflation in the region 
Earlier Monday  official data showed that the number of unemployed people in Spain dropped by 29 800 last month  compared to expectations for a decline of 116 300  In June  the number of unemployed people in Spain declined by 122 700 
Meanwhile  in the U S   disappointing employment data on Friday eased speculation over the timing of a possible rate hike by the Federal Reserve 
Financial stocks were broadly higher  as French lenders BNP Paribas  PARIS BNPP  and Societe Generale  PARIS SOGN  jumped 1 41  and 1 38   while Germany s Commerzbank  XETRA CBKG  gained 1 23  
Among peripheral lenders  Italy s Intesa Sanpaolo  MILAN ISP  and Unicredit  MILAN CRDI  rallied 1 77  and 1 83  respectively  while Spanish banks Banco Santander  MADRID SAN  and BBVA  MADRID BBVA  advanced 0 90  and 0 95  
In Portugal  the central bank announced that it took control of Banco Espirito Santo  LISBON BES  in a  4 9 billion bailout 
Elsewhere  Daimler  XETRA DAIGn  shares climbed 0 66  after the German automaker said it will cut spare part prices for its Mercedes Benz cars in China by an average 15  from next month amid a government investigation into whether carmakers manipulated prices 
In London  FTSE 100 rose 0 19   as U K  lenders tracked their European counterparts higher 
Shares in HSBC Holdings  LONDON HSBA  edged up 0 19  and the Royal Bank of Scotland  LONDON RBS  added 0 26   while Barclays  LONDON BARC  and Lloyds Banking  LONDON LLOY  climbed 0 56  and 0 59  respectively 
In the mining sector  stocks were mixed as Glencore Xstrata  LONDON GLEN  jumped 1 05  and Rio Tinto  LONDON RIO  advanced 1 10   while Polymetal  LONDON POLYP  slipped 0 20  and Vedanta Resources  LONDON VED  declined 0 74  
Meanwhile  Barratt Developments  LONDON BDEV  was the worst performer on the index  with shares plummeting 1 76   after Deutsche Bank restated the stock s  buy  rating 
In the U S   equity markets pointed to a higher open  The Dow 30 futures pointed to a 0 35  gain  S P 500 futures signaled a 0 37  increase  while the Nasdaq 100 futures indicated a 0 28  rise ",2014-08-04,Investing.com,"https://www.investing.com/news/stock-market-news/european-stocks-higher,-eyes-on-ecb-meeting;-dax-up-0.08-300409",300409
4656,226171,POLYP,European stocks hold gains with eyes on ECB  Dax up 0 27 ,news,"Investing com   European stocks held gains on Monday  despite downbeat Spanish employment data  as investors awaited a highly anticipated policy meeting by the European Central Bank later in the week 
During European afternoon trade  the DJ Euro Stoxx 50 gained 0 66   France s CAC 40 advanced 0 74   while Germany s DAX rose 0 27  
Earlier Monday  official data showed that the number of unemployed people in Spain dropped by 29 800 last month  compared to expectations for a decline of 116 300  In June  the number of unemployed people in Spain declined by 122 700 
Data late last week showed that the annual rate of inflation in the euro area slowed to 0 4  last month from 0 5  in June  adding to pressure on the ECB to implement measures to avert the risk of deflation in the region
Meanwhile  in the U S   disappointing employment data on Friday eased speculation over the timing of a possible rate hike by the Federal Reserve 
Financial stocks remained broadly higher  as French lenders BNP Paribas  PARIS BNPP  and Societe Generale  PARIS SOGN  jumped 1 89  and 1 51   while Germany s Commerzbank  XETRA CBKG  gained 1  
Among peripheral lenders  Italy s Intesa Sanpaolo  MILAN ISP  and Unicredit  MILAN CRDI  rallied 1 82  and 1 83  respectively  while Spanish banks BBVA  MADRID BBVA  and Banco Santander  MADRID SAN  advanced 0 90  and 0 97  
In Portugal  the central bank announced that it took control of Banco Espirito Santo in a  4 9 billion bailout 
Elsewhere  Daimler  XETRA DAIGn  shares climbed 1 27  after the German automaker said it will cut spare part prices for its Mercedes Benz cars in China by an average 15  from next month amid a government investigation into whether carmakers manipulated prices 
In London  FTSE 100 gained 0 49   as U K  lenders continued to track their European counterparts higher and data showed that the U K  construction purchasing managers  index slowed to 62 4 from 62 6 in June  but was still slightly ahead of expectations for a reading of 62 0 
Shares in Barclays  LONDON BARC  advanced 0 84  and the Royal Bank of Scotland  LONDON RBS  rallied 1 44   while Lloyds Banking  LONDON LLOY  and HSBC Holdings  LONDON HSBA  surged 1 74  and 2 82  respectively 
In the mining sector  stocks turned broadly higher  Polymetal  LONDON POLYP  rose 0 20  and Bhp Billiton  LONDON BLT  climbed 0 47   while Rio Tinto  LONDON RIO  gained 0 75  and Glencore Xstrata  LONDON GLEN  jumped 1 10  
Meanwhile  Barratt Developments  LONDON BDEV  remained one of the worst performer on the index  with shares plummeting 1 47   after Deutsche Bank restated the stock s  buy  rating 
In the U S   equity markets pointed to a higher open  The Dow 30 futures pointed to a 0 31  gain  S P 500 futures signaled a 0 37  increase  while the Nasdaq 100 futures indicated a 0 29  rise ",2014-08-04,Investing.com,https://www.investing.com/news/stock-market-news/european-stocks-hold-gains-with-eyes-on-ecb;-dax-up-0.27-300439,300439
4657,226172,POLYP,European stocks edge lower in quiet trade  Dax down 0 09 ,news,"Investing com   European stocks edged lower in quiet trade on Tuesday  although the European Central Bank s latest policy statement still lent some support and as markets continued to monitor developments in Ukraine 
During European afternoon trade  the DJ Euro Stoxx 50 slipped 0 13   France s CAC 40 fell 0 14   while Germany s DAX edged 0 09  lower 
European equities strengthened broadly last week after the ECB cut rates to record lows across the euro zone and announced an asset backed securities and covered bond purchasing program in an attempt to shore up slowing growth and inflation in the region 
Meanwhile  European Union governments put on hold for at least a  few days  new sanctions against Russia  allowing more time to assess the viability of a cease fire in Ukraine 
The planned sanctions reportedly include barring some Russian state owned defense and energy companies from raising capital in the EU 
Financial stocks were mixed  as French lenders BNP Paribas  PARIS BNPP  and Societe Generale  PARIS SOGN  slipped 0 28  and 0 14   while Germany s Deutsche Bank  XETRA DBKGn  gained 0 52  
Among peripheral lenders  Intesa Sanpaolo  MILAN ISP  edged up 0 08  and Unicredit  MILAN CRDI  fell 0 20  in Italy  while Spanish banks Banco Santander  MADRID SAN  and BBVA  MADRID BBVA  declined 0 60  and 0 67  
Elsewhere  Alstom  PARIS ALSO  rose 0 29  after the French multinational company said it paid about  6 6 million in bribes over a six year period to win transport contracts  according to filings from U K  prosecutors released ahead of the case s first court hearing today 
In London  FTSE 100 dipped 0 08   weighed by sharp losses in energy stocks 
Royal Dutch Shell A  LONDON RDSa  tumbled 1 34  and Royal Dutch Shell B  LONDON RDSb  lost 1 65   while rival BP  LONDON BP  saw shares retreat 1 03  
Meanwhile  mining stocks remained mostly higher  Bhp Billiton  LONDON BLT  and Glencore Xstrata  LONDON GLEN  gained 0 24  and 0 55  respectively  while Rio Tinto  LONDON RIO  climbed 0 56  and Polymetal  LONDON POLYP  jumped 1 09  
In the financial sector  stocks were also mostly higher  Shares in Barclays  LONDON BARC  and the Royal Bank of Scotland  LONDON RBS  advanced 0 61  and 0 66  respectively  while Lloyds Banking  LONDON LLOY  rallied 1 48  
Earlier Tuesday  the U S  unit of Royal Bank of Scotland Group  Citizens Financial Group said it is seeking to raise as much as  3 5 billion in the largest initial offering of a U S  bank since Goldman Sachs went public in 1999 
Also in the U K   official data showed that manufacturing production rose 0 3  in July  in line with expectations  while a separate report showed that the trade deficit widened unexpectedly to  10 19 billion in July 
In addition  a new opinion poll showed that support for Scottish pro independence voters increased ahead of next week s vote 
In the U S   equity markets pointed to a steady open  The Dow 30 futures pointed to a 0 04  gain  S P 500 futures signaled a 0 01  uptick  while the NASDAQ 100 futures indicated a 0 08  rise ",2014-09-09,Investing.com,https://www.investing.com/news/stock-market-news/european-stocks-edge-lower-in-quiet-trade;-dax-down-0.09-308700,308700
