,id,ticker,title,category,content,date,provider,url,article_id
217471,438987,TEVA,Should Value Investors Buy Teva Pharmaceutical Industries Ltd   TEVA  Stock ,opinion,"While the proven Zacks Rank places an emphasis on earnings estimates and estimate revisions to find strong stocks  we also know that investors tend to develop their own individual strategies  With this in mind  we are always looking at value  growth  and momentum trends to discover great companies 
Of these  value investing is easily one of the most popular ways to find great stocks in any market environment  Value investors use a variety of methods  including tried and true valuation metrics  to find these stocks 
In addition to the Zacks Rank  investors looking for stocks with specific traits can utilize our Style Scores system  Of course  value investors will be most interested in the system s  Value  category  Stocks with  A  grades for Value and high Zacks Ranks are among the best value stocks available at any given moment 
One company to watch right now is Teva Pharmaceutical Industries Ltd   NYSE TEVA   TEVA is currently sporting a Zacks Rank of  2  Buy   as well as a Value grade of A  The stock has a Forward P E ratio of 6 06  This compares to its industry s average Forward P E of 8 09  Over the past year  TEVA s Forward P E has been as high as 9 03 and as low as 4 91  with a median of 7 65 
Value investors also frequently use the P S ratio  This metric is found by dividing a stock s price with the company s revenue  This is a prefered metric because revenue can t really be manipulated  so sales are often a truer performance indicator  TEVA has a P S ratio of 0 84  This compares to its industry s average P S of 2 04 
These are only a few of the key metrics included in Teva Pharmaceutical Industries Ltd  s strong Value grade  but they help show that the stock is likely undervalued right now  When factoring in the strength of its earnings outlook  TEVA looks like an impressive value stock at the moment ",2018-12-19,Zacks Investment Research,https://www.investing.com/analysis/should-value-investors-buy-teva-pharmaceutical-industries-ltd-teva-stock-200369924,200369924
217472,438988,TEVA,Teva Pharm says media reports of up to 6 000 layoffs incorrect,news,"JERUSALEM  Reuters    Teva Pharmaceutical Industries   TA TEVA  plans to end unprofitable activities and freeze recruitment  but said Israeli media reports of up to 6 000 layoffs were incorrect  Earlier on Thursday  two of Israel s leading financial news websites carried separate reports that Teva  the world s biggest generic drug maker and Israel s largest company  planned to fire between 2 000 and 6 000 workers   or as much as 11 percent of the workforce  A Teva spokesperson had initially declined to comment on the report  but the company later put out a statement saying the figures the media gave were inaccurate   The efficiency program is an integral part of Teva s business reality  The program includes  among other things  ending unprofitable activities and consolidating functions  in addition to freezing recruitment and natural employee turnover   the company said   These processes are conducted through a continuous open dialogue with the employees  This will be the practice  including in Israel  as necessary  We would like to stress that the numbers which were published in the media are incorrect   it said  Teva  N TEVA  employs around 57 000 people globally  It has had a rough year  though  with a series of costly acquisitions  along with delayed drug launches  sending its stock plummeting 72 percent to  32 61 the past 12 months  That forced former chief executive Erez Vigodman to step down in February  with Chairman Yitzhak Peterburg replacing him on a temporary basis  
One of the websites  Calcalist  said Teva has already reduced its workforce in Israel by around 100 people as part of the efficiency plan ",2017-03-23,Reuters,"https://www.investing.com/news/stock-market-news/teva-pharm-may-fire-6,000-workers:-israeli-media-report-468221",468221
217473,438989,TEVA,FDA OKs Teva s Austedo for HD chorea  shares ahead 2  premarket,news,"Teva Pharmaceutical Industries  NYSE TEVA  is up 2  premarket on modestly higher volume in response to its announcement that the FDA has approved AUSTEDO  deutetrabenazine  tablets for the treatment of chorea  abnormal involuntary movements  associated with Huntington s disease  HD   an Orphan Drug indication 
HD is a neurodegenerative disease that affects more than 35K Americans each year ",2017-04-04,Seeking Alpha,https://www.investing.com/news/stock-market-news/fda-oks-teva's-austedo-for-hd-chorea;-shares-ahead-2-premarket-471170,471170
217474,438990,TEVA,Teva launches new asthma meds,news,Teva Pharmaceutical Industries  TEVA  0 3   announces the simultaneous U S  launch of AirDuo RespiClick  fluticasone propionate and salmeterol  and its authorized generic for the treatment of asthma patients at least 12 years old who are inadequately controlled on an inhaled corticosteroid or whose disease severity warrants the use of an ICS LABA combination The company says it expects the bulk of sales to come from the generic product Now read  Analysts Tag Stein Mart Top  Safe  Sector Leader Dividend Dog For February,2017-04-20,Seeking Alpha,https://www.investing.com/news/stock-market-news/teva-launches-new-asthma-meds-475874,475874
217475,438991,TEVA,Israel stocks lower at close of trade  TA 35 down 0 57 ,news,"Investing com   Israel stocks were lower after the close on Sunday  as losses in the Insurance  Oil   Gas and Banking sectors led shares lower 
At the close in Tel Aviv  the TA 35 lost 0 57  
The best performers of the session on the TA 35 were Teva  TA TEVA   which rose 1 06  or 120 points to trade at 11400 at the close  Meanwhile   Ormat Technologies   TA ORA  added 1 01  or 210 points to end at 21080 and  Isramco  L  TA ISRAp  was up 0 76  or 0 5 points to 66 1 in late trade 
The worst performers of the session were  ICL  Israel Chemicals Ltd  TA ICL   which fell 2 45  or 37 points to trade at 1475 at the close   Bazan  Oil Refineries Ltd  TA ORL  declined 2 32  or 3 4 points to end at 143 3 and Partner  TA PTNR  was down 2 30  or 44 points to 1866 
Falling stocks outnumbered advancing ones on the Tel Aviv Stock Exchange by 236 to 132 and 46 ended unchanged 
Crude oil for June delivery was down 2 17  or 1 10 to  49 61 a barrel  Elsewhere in commodities trading  Brent oil for delivery in July unchanged 0 00  or 0 00 to hit  52 44 a barrel  while the June Gold Futures contract rose 0 13  or 1 70 to trade at  1285 50 a troy ounce 
USD ILS was up 0 22  to 3 6799  while EUR ILS rose 0 04  to 3 9366 
The US Dollar Index Futures was down 0 05  at 99 66 ",2017-04-23,Investing.com,https://www.investing.com/news/stock-market-news/israel-stocks-lower-at-close-of-trade;-ta-35-down-0.57-476510,476510
217476,438992,TEVA,Teva Pharmaceutical CFO to step down  media,news,"TEL AVIV  Reuters    The chief financial officer of Teva Pharmaceutical  NYSE TEVA  Industries  TA TEVA   Eyal Desheh  is stepping down and will likely be appointed chairman of Isracard  Bank Hapoalim s  TA POLI  credit card company  Israeli news websites reported on Tuesday  Desheh joined Teva as CFO in 2008 and briefly served as acting CEO from October 2013 to February 2014  Teva was left without a permanent chief executive in February after Erez Vigodman stepped down  leaving new management to restore confidence in the world s biggest generic drugmaker after a series of missteps  A string of costly acquisitions  along with delayed drug launches  have sent Teva shares plummeting and led to calls for management and structural changes  including a possible split into separate generic and branded medicine units  Officials at Teva declined to comment on the reports   Hapoalim is now considering the selection of a new chairman for Isracard   Israel s biggest bank said in a statement  noting there were a number of candidates   The selection of a chairman will be subject to the recommendation of Bank Hapoalim s board of directors and the decision of Isracard s board   The appointment would also need approval from the Bank of Israel  
 When a decision is made  we will announce it to the public   Hapoalim said ",2017-04-25,Reuters,https://www.investing.com/news/stock-market-news/teva-pharmaceutical-cfo-to-step-down:-media-477251,477251
217481,438997,TEVA,Regeneron  REGN  Rides On Eylea And Dupixent s Performance,opinion,"Shares of Regeneron Pharmaceuticals Inc    NASDAQ REGN   have gained 11  in the past six months  against a decline of 9 6  for the  

 
Tarrytown  New York based Regeneron s key areas of focus include eye diseases  heart diseases  allergic and inflammatory diseases  pain  cancer  infectious diseases and rare diseases 
Regeneron s key growth driver  Eylea continues to drive revenues for the company  Regeneron has co developed Eylea with the HealthCare unit of Bayer  DE BAYGN  AG   OTC BAYRY    Eylea is approved in the United States  EU  Japan and other countries for the treatment of wet AMD  diabetic macular edema  DME   and macular edema following retinal vein occlusion  which includes macular edema following central retinal vein occlusion and macular edema following branch retinal vein occlusion 
Meanwhile  Regeneron is working on expanding Eylea s label into additional indications  The FDA recently approved a 12 week dosing interval of Eylea injection in patients with wet AMD based on physician s assessment 
Consequently  Eylea is now the only anti VEGF drug for the treatment of wet AMD that offers the flexibility to optimally treat patients  regardless of whether they require fixed interval dosing of 4  8 or 12 weeks  The FDA also accepted for review the supplemental Biologics License Application  sBLA  of Eylea for the treatment of diabetic retinopathy  with a target action date of May 13  2019 
Label expansion of other approved drugs will also boost sales for the company 
Dupixent s performance has been strong so far after the drug was approved last year for the treatment of adults with moderate to severe atopic dermatitis  AD   The company and partner Sanofi   NYSE SNY   are also working to expand Dupixent s label  which should diversify the company s revenue base and reduce dependence on the lead drug 
In October 2018  the FDA approved Dupixent as an add on maintenance therapy in patients aged 12 years or older with moderate to severe asthma  The drug is also under review in Europe for this indication and a decision is expected in the second quarter of 2019  The FDA has also accepted for priority review the sBLA for AD in adolescent patients and set a target action date of Mar 11  2019 
Regeneron is working to expand its portfolio pipeline  In September 2018  the FDA approved Libtayo for the treatment of patients with metastatic or locally advanced CSCC who are not candidates for curative surgery or curative radiation  The drug is also under review in Europe and a decision is expected in the first half of 2019  Libtayo is also being evaluated for the treatment of non small cell lung cancer in a phase III study  which is currently enrolling 
The company is also working to expand its PCSK9 inhibitor Praluent s label  The FDA approved Praluent for the treatment of patients with heterozygous familial hypercholesterolemia  HeFH  undergoing apheresis  The agency also accepted an sBLA for Praluent as a potential treatment to reduce major adverse cardiovascular events and had set a target action date of Apr 28  2019 
Approval of new drugs will further boost the top line  Earlier  the company and partner Teva Pharmaceutical Industries Ltd    NYSE TEVA   announced positive top line results from a phase III study on pipeline candidate  fasinumab in patients suffering from chronic pain from osteoarthritis  OA  of the knee or hip 
We expect a solid performance from the company in the coming quarters as well 
Zacks Rank
Regeneron currently carries a Zacks Rank  2  Buy    You can see   
Today s Stocks from Zacks  Hottest Strategies
It s hard to believe  even for us at Zacks  But while the market gained  21 9  in 2017  our top stock picking screens have returned  115 0    109 3    104 9    98 6  and  67 1  
And this outperformance has not just been a recent phenomenon  Over the years it has been remarkably consistent  From 2000   2017  the composite yearly average gain for these strategies has beaten the market more than 19X over  Maybe even more remarkable is the fact that we re willing to share their latest stocks with you without cost or obligation ",2018-11-16,Zacks Investment Research,https://www.investing.com/analysis/regeneron-regn-rides-on-eylea-and-dupixents-performance-200360167,200360167
217482,438998,TEVA,Israel stocks higher at close of trade  TA 35 up 0 50 ,news,"Investing com   Israel stocks were higher after the close on Monday  as gains in the Biomed  Insurance and Technology sectors led shares higher 
At the close in Tel Aviv  the TA 35 added 0 50  
The best performers of the session on the TA 35 were Teva  TA TEVA   which rose 4 77  or 570 points to trade at 12510 at the close  Meanwhile  Tower Semiconductor Ltd  TA TSEM  added 1 57  or 133 points to end at 8588 and  Airport City   TA ARPT  was up 1 41  or 59 points to 4254 in late trade 
The worst performers of the session were  Delek Group   TA DLEKG   which fell 1 38  or 1100 points to trade at 78500 at the close   Frutarom   TA FRUT  declined 1 28  or 260 points to end at 20090 and Delek Drilling LP  TA DEDRp  was down 1 26  or 16 points to 1253 
Rising stocks outnumbered declining ones on the Tel Aviv Stock Exchange by 230 to 145 and 60 ended unchanged 
Shares in Tower Semiconductor Ltd  TA TSEM  rose to 5 year highs  up 1 57  or 133 to 8588  
Crude oil for March delivery was down 1 88  or 1 01 to  52 85 a barrel  Elsewhere in commodities trading  Brent oil for delivery in April fell 2 10  or 1 19 to hit  55 51 a barrel  while the April Gold Futures contract fell 0 94  or 11 65 to trade at  1224 25 a troy ounce 
USD ILS was up 0 01  to 3 7510  while EUR ILS fell 0 32  to 3 9784 
The US Dollar Index Futures was up 0 27  at 100 99 ",2017-02-13,Investing.com,https://www.investing.com/news/stock-market-news/israel-stocks-higher-at-close-of-trade;-ta-35-up-0.50-459575,459575
217483,438999,TEVA,Israel stocks higher at close of trade  TA 35 up 0 54 ,news,"Investing com   Israel stocks were higher after the close on Sunday  as gains in the Real Estate  Communication and Technology sectors led shares higher 
At the close in Tel Aviv  the TA 35 rose 0 54  to hit a new 1 month high 
The best performers of the session on the TA 35 were Tower Semiconductor Ltd  TA TSEM   which rose 3 52  or 289 points to trade at 8495 at the close  Meanwhile  Partner  TA PTNR  added 3 34  or 74 points to end at 2292 and Teva  TA TEVA  was up 2 69  or 360 points to 13750 in late trade 
The worst performers of the session were  Azrieli Group   TA AZRG   which fell 0 69  or 120 points to trade at 17180 at the close  Leumi  TA LUMI  declined 0 68  or 11 points to end at 1606 and Poalim  TA POLI  was down 0 65  or 15 points to 2290 
Rising stocks outnumbered declining ones on the Tel Aviv Stock Exchange by 218 to 168 and 55 ended unchanged 
Shares in Partner  TA PTNR  rose to 52 week highs  up 3 34  or 74 to 2292  
Crude oil for April delivery was unchanged 0 00  or 0 00 to  53 78 a barrel  Elsewhere in commodities trading  Brent oil for delivery in April rose 0 14  or 0 08 to hit  55 73 a barrel  while the April Gold Futures contract fell 0 46  or 5 75 to trade at  1235 85 a troy ounce 
USD ILS was down 0 19  to 3 7034  while EUR ILS fell 0 72  to 3 9320 
The US Dollar Index Futures was up 0 44  at 100 89 ",2017-02-19,Investing.com,https://www.investing.com/news/stock-market-news/israel-stocks-higher-at-close-of-trade;-ta-35-up-0.54-460851,460851
217484,439000,TEVA,Israel stocks lower at close of trade  TA 35 down 0 26 ,news,"Investing com   Israel stocks were lower after the close on Thursday  as losses in the Biomed  Technology and Banking sectors led shares lower 
At the close in Tel Aviv  the TA 35 lost 0 26  
The best performers of the session on the TA 35 were  Delek Group   TA DLEKG   which rose 4 35  or 3550 points to trade at 85150 at the close  Meanwhile   Azrieli Group   TA AZRG  added 1 82  or 320 points to end at 17950 and Avner L  TA AVNRp  was up 1 67  or 4 0 points to 243 0 in late trade 
The worst performers of the session were Teva  TA TEVA   which fell 1 93  or 260 points to trade at 13200 at the close   OPKO Health Inc   TA OPK  declined 1 49  or 47 points to end at 3108 and  Isramco  L  TA ISRAp  was down 0 95  or 0 6 points to 62 6 
Falling stocks outnumbered advancing ones on the Tel Aviv Stock Exchange by 219 to 165 and 57 ended unchanged 
Shares in Azrieli Group  TA AZRG  rose to all time highs  up 1 82  or 320 to 17950  
Crude oil for April delivery was up 2 13  or 1 14 to  54 73 a barrel  Elsewhere in commodities trading  Brent oil for delivery in April rose 2 24  or 1 25 to hit  57 09 a barrel  while the April Gold Futures contract rose 1 41  or 17 35 to trade at  1250 65 a troy ounce 
USD ILS was down 0 05  to 3 6955  while EUR ILS rose 0 29  to 3 9144 
The US Dollar Index Futures was down 0 43  at 100 87 ",2017-02-23,Investing.com,https://www.investing.com/news/stock-market-news/israel-stocks-lower-at-close-of-trade;-ta-35-down-0.26-461762,461762
217485,439001,TEVA,Israel stocks lower at close of trade  TA 35 down 0 95 ,news,"Investing com   Israel stocks were lower after the close on Monday  as losses in the Communication  Biomed and Technology sectors led shares lower 
At the close in Tel Aviv  the TA 35 lost 0 95  
The best performers of the session on the TA 35 were Harel  TA HARL   which rose 1 80  or 35 points to trade at 1979 at the close  Meanwhile   Isramco  L  TA ISRAp  added 0 78  or 0 5 points to end at 64 8 and  Mizrahi Tefahot   TA MZTF  was up 0 57  or 35 points to 6157 in late trade 
The worst performers of the session were Cellcom  TA CEL   which fell 3 63  or 149 points to trade at 3960 at the close  Partner  TA PTNR  declined 3 42  or 81 points to end at 2286 and Teva  TA TEVA  was down 3 29  or 420 points to 12350 
Falling stocks outnumbered advancing ones on the Tel Aviv Stock Exchange by 269 to 114 and 61 ended unchanged 
Shares in Mizrahi Tefahot  TA MZTF  rose to all time highs  rising 0 57  or 35 to 6157  
Crude oil for April delivery was down 0 08  or 0 04 to  53 29 a barrel  Elsewhere in commodities trading  Brent oil for delivery in May rose 0 16  or 0 09 to hit  55 99 a barrel  while the April Gold Futures contract rose 0 19  or 2 35 to trade at  1228 85 a troy ounce 
USD ILS was down 0 60  to 3 6744  while EUR ILS fell 0 82  to 3 8941 
The US Dollar Index Futures was up 0 17  at 101 52 ",2017-03-06,Investing.com,https://www.investing.com/news/stock-market-news/israel-stocks-lower-at-close-of-trade;-ta-35-down-0.95-464066,464066
217486,439002,TEVA,Israel stocks higher at close of trade  TA 35 up 0 44 ,news,"Investing com   Israel stocks were higher after the close on Monday  as gains in the Communication  Real Estate and Banking sectors led shares higher 
At the close in Tel Aviv  the TA 35 added 0 44  
The best performers of the session on the TA 35 were Tower Semiconductor Ltd  TA TSEM   which rose 2 64  or 219 points to trade at 8529 at the close  Meanwhile  Cellcom  TA CEL  added 2 54  or 96 points to end at 3880 and Alony Hetz Properties and Investments Ltd  TA ALHE  was up 2 11  or 72 points to 3485 in late trade 
The worst performers of the session were  Ormat Technologies   TA ORA   which fell 0 90  or 190 points to trade at 20940 at the close   OPKO Health Inc   TA OPK  declined 0 89  or 26 points to end at 2910 and Teva  TA TEVA  was down 0 49  or 60 points to 12160 
Rising stocks outnumbered declining ones on the Tel Aviv Stock Exchange by 206 to 175 and 77 ended unchanged 
Crude oil for May delivery was down 0 55  or 0 27 to  49 04 a barrel  Elsewhere in commodities trading  Brent oil for delivery in May fell 0 08  or 0 04 to hit  51 72 a barrel  while the April Gold Futures contract rose 0 23  or 2 80 to trade at  1233 00 a troy ounce 
USD ILS was down 0 29  to 3 6260  while EUR ILS fell 0 14  to 3 8994 
The US Dollar Index Futures was down 0 06  at 100 08 ",2017-03-20,Investing.com,https://www.investing.com/news/stock-market-news/israel-stocks-higher-at-close-of-trade;-ta-35-up-0.44-467459,467459
217490,439006,TEVA,Is Teva Pharmaceutical Industries  TEVA  Outperforming Other Medical Stocks This Year ,opinion,"Investors focused on the Medical space have likely heard of Teva Pharmaceutical Industries  NYSE TEVA   but is the stock performing well in comparison to the rest of its sector peers  A quick glance at the company s year to date performance in comparison to the rest of the Medical sector should help us answer this question 
Teva Pharmaceutical Industries is one of 845 companies in the Medical group  The Medical group currently sits at  3 within the Zacks Sector Rank  The Zacks Sector Rank considers 16 different groups  measuring the average Zacks Rank of the individual stocks within the sector to gauge the strength of each group 
The Zacks Rank is a successful stock picking model that emphasizes earnings estimates and estimate revisions  The system highlights a number of different stocks that could be poised to outperform the broader market over the next one to three months  TEVA is currently sporting a Zacks Rank of  2  Buy  
Over the past 90 days  the Zacks Consensus Estimate for TEVA s full year earnings has moved 3 79  higher  This shows that analyst sentiment has improved and the company s earnings outlook is stronger 
Based on the latest available data  TEVA has gained about 21 85  so far this year  At the same time  Medical stocks have gained an average of 2 55   This means that Teva Pharmaceutical Industries is outperforming the sector as a whole this year 
To break things down more  TEVA belongs to the Medical   Generic Drugs industry  a group that includes 24 individual companies and currently sits at  165 in the Zacks Industry Rank  Stocks in this group have lost about 1 86  so far this year  so TEVA is performing better this group in terms of year to date returns 
Investors in the Medical sector will want to keep a close eye on TEVA as it attempts to continue its solid performance ",2018-11-06,Zacks Investment Research,https://www.investing.com/analysis/is-teva-pharmaceutical-industries-teva-outperforming-other-medical-stocks-this-year-200356188,200356188
217491,439007,TEVA,Israel stocks higher at close of trade  TA 25 up 0 18 ,news,"Investing com   Israel stocks were higher after the close on Thursday  as gains in the Communication  Biomed and Banking sectors led shares higher 
At the close in Tel Aviv  the TA 25 gained 0 18  
The best performers of the session on the TA 25 were Teva  TA TEVA   which rose 2 90  or 360 points to trade at 12790 at the close  Meanwhile   OPKO Health Inc   TA OPK  added 1 73  or 55 points to end at 3232 and  Strauss Group   TA STRS  was up 1 05  or 63 points to 6083 in late trade 
The worst performers of the session were  Israel Corp   TA ILCO   which fell 3 26  or 2460 points to trade at 73090 at the close   ICL  Israel Chemicals Ltd  TA ICL  declined 2 43  or 44 points to end at 1769 and Delek Drilling LP  TA DEDRp  was down 2 21  or 29 points to 1283 
Rising stocks outnumbered declining ones on the Tel Aviv Stock Exchange by 183 to 163 and 95 ended unchanged 
Crude oil for March delivery was up 1 97  or 1 04 to  53 79 a barrel  Elsewhere in commodities trading  Brent oil for delivery in March rose 2 23  or 1 23 to hit  56 31 a barrel  while the February Gold contract fell 0 99  or 11 80 to trade at  1186 00 a troy ounce 
USD ILS was up 0 20  to 3 7912  while EUR ILS fell 0 50  to 4 0461 
The US Dollar Index was up 0 70  at 100 61 ",2017-01-26,Investing.com,https://www.investing.com/news/stock-market-news/israel-stocks-higher-at-close-of-trade;-ta-25-up-0.18-455903,455903
217492,439008,TEVA,Israel stocks lower at close of trade  TA 25 down 1 29 ,news,"Investing com   Israel stocks were lower after the close on Monday  as losses in the Banking  Financials and Communication sectors led shares lower 
At the close in Tel Aviv  the TA 25 fell 1 29  
The best performers of the session on the TA 25 were Teva  TA TEVA   which rose 0 23  or 30 points to trade at 13030 at the close  Meanwhile   Azrieli Group   TA AZRG  fell 0 18  or 30 points to end at 17070 and Perrigo  TA PRGO  was down 0 47  or 130 points to 27800 in late trade 
The worst performers of the session were  Delek Group   TA DLEKG   which fell 2 72  or 2260 points to trade at 80950 at the close  Delek Drilling LP  TA DEDRp  declined 2 52  or 32 points to end at 1237 and Avner L  TA AVNRp  was down 2 41  or 5 8 points to 234 4 
Falling stocks outnumbered advancing ones on the Tel Aviv Stock Exchange by 176 to 157 and 81 ended unchanged 
Crude oil for March delivery was down 1 35  or 0 72 to  52 45 a barrel  Elsewhere in commodities trading  Brent oil for delivery in April fell 1 04  or 0 58 to hit  55 12 a barrel  while the April Gold Futures contract rose 0 74  or 8 85 to trade at  1199 95 a troy ounce 
USD ILS was up 0 01  to 3 7740  while EUR ILS fell 0 07  to 4 0336 
The US Dollar Index Futures was down 0 11  at 100 45 ",2017-01-30,Investing.com,https://www.investing.com/news/stock-market-news/israel-stocks-lower-at-close-of-trade;-ta-25-down-1.29-456605,456605
