,id,ticker,title,category,content,date,provider,url,article_id
137486,359001,TMO,Canopy Growth  CGC  Q2 Earnings   Revenues Miss Estimates,opinion,"Canopy Growth Corporation   NYSE CGC   incurred loss per share of 82 cents  CDN  1 08  on a GAAP basis in the second quarter of fiscal 2020  which is wider than the year ago loss of 76 cents  CDN  3 70   Further  the bottom line lagged the Zacks Consensus Estimate of a loss of 27 cents The loss per share excludes certain non recurring expenses like fair value changes in biological assets  share based compensation expenses  acquisition related costs  and depreciation and amortization expenses Total RevenuesGross revenues  without considering any returns and pricing adjustments  primarily related to oils and softgels  and certain excise tax  were  89 6 million  CDN  118 3 million   up from the year ago figure of  17 8 million  CDN  23 3 million  Canopy Growth Corporation Price  Consensus and EPS Surprise
    Net revenues skyrocketed to  58 million  CDN  76 6 million  from the second quarter of fiscal 2019  However  the metric lagged the Zacks Consensus Estimate by 24 7  Compared with the fiscal first quarter figures  company owned recreational same store sales growth was 17  and global medical organic growth was 23   These were fueled by consumer demand for cannabis Revenues by Product CategoriesThe company has two major reporting segments   Canadian cannabis and International medical cannabis In the last reported quarter  Canadian cannabis registered gross revenues of  58 million  CDN  76 6 million   up from  15 2 million  CDN  19 9 million  reported a year ago  International medical cannabis revenues were  13 7 million  CDN  18 1 million   up from  1 7 million  CDN  2 2 million  a year ago MarginInventory production costs expensed to cost of sales were  65 4 million  CDN  86 3 million  in the quarter  reflecting a remarkable improvement from the year ago figure of  11 9 million  CDN  15 6 million  Sales and marketing expenses rose year over year to  45 8 million  CDN  60 5 million  due to pre revenue investments in brand awareness  product marketing and consumer education initiatives  The company incurred these expenses as it is increasingly focusing on the launch of Cannabis 2 0 products in Canada  and the rollout of cannabidiol   CBD   products in the United States and other international markets in the coming months Canopy Growths  research and development expenses grew year over year to  9 million  CDN  11 9 million   thanks to an increased focus on new research and development efforts The company s general and administration costs rose year over year to  66 6 million  CDN  87 9 million   fueled by expenses like compliance and litigation costs Adjusted operating loss was  128 million  CDN  169 9 million  in the quarter under discussion  wider than  54 7 million  CDN  71 5 million  in the year ago quarter Financial PositionCanopy Growth exited the second quarter of fiscal 2020 with cash and cash equivalents of  833 1 million  CDN  1 1 billion  compared with  328 6 million  CDN  429 4 million  a year ago Year to date  the company used  272 1 million  CDN  359 3 million  in operating activities  compared with  151 6 million  CDN  198 1 million  a year ago Our TakeCanopy Growth exited the second quarter of fiscal 2020 on a mixed note as its revenues grew substantially  while loss per share widened  Per the company  it is facing challenges in the Canadian cannabis market as provinces have reduced purchases to lower inventory levels  retail store openings have fallen short of expectations and delay in the launch of Cannabis 2 0 products However  Canopy Growth is optimistic about its retail store sales  on both overall and same store basis  The impressive revenue performance of International medical cannabis  both an organic and inorganic basis  buoys optimism However  the continued widening of loss per share and increasing general and administration costs are concerning for the company Zacks Rank and Stocks to ConsiderCurrently  Canopy Growth carries a Zacks Rank  3  Hold  Some better ranked medical device companies  which posted solid results this earnings season  are ResMed Inc   NYSE RMD    NuVasive  Inc   NASDAQ NUVA   and Thermo Fisher Scientific Inc   NYSE TMO   ResMed  with a Zacks Rank  2  Buy   reported first quarter fiscal 2020 adjusted earnings per share  EPS  of 93 cents  surpassing the Zacks Consensus Estimate by 6 9   Its revenues of  681 1 million outpaced the consensus mark by 3 7  NuVasive s third quarter 2019 adjusted EPS of 59 cents surpassed the Zacks Consensus Estimate by 9 3   Its revenues totaled  290 8 million  which outpaced the consensus estimate by 2 4   The company currently carries a Zacks Rank  2  You can see Thermo Fisher  with a Zacks Rank  2  delivered third quarter 2019 adjusted EPS of  2 94  beating the Zacks Consensus Estimate by 2 1   Its revenues of  6 27 billion surpassed the Zacks Consensus Estimate by 1 3  7 Best Stocks for the Next 30 DaysJust released  Experts distill 7 elite stocks from the current list of 220 Zacks Rank  1 Strong Buys  They deem these tickers  Most Likely for Early Price Pops  Since 1988  the full list has beaten the market more than 2X over with an average gain of  24 5  per year  So be sure to give these hand picked 7 your immediate attention ",2019-11-17,Zacks Investment Research,https://www.investing.com/analysis/canopy-growth-cgc-q2-earnings--revenues-miss-estimates-200486032,200486032
137514,359029,TMO,Insulet  PODD  Beats On Q3 Earnings  Ups  19 Revenue View,opinion,Insulet Corporation s   NASDAQ PODD   adjusted earnings per share  EPS  of 9 cent in third quarter improved significantly from the year ago GAAP EPS  The reported figure also outpaced the Zacks Consensus Estimate of 3 cents  The quarter s adjustment includes certain one time  non cash charge related to the extinguishment of the company s 2021 convertible notes Revenues in the third quarter totaled  192 1 million  beating the Zacks Consensus Estimate by 7 4   Moreover  the top line figure jumped 27 1  from the year ago number Insulet delivered third quarter U S  Omnipod revenues of  109 5 million  reflecting an increase of 34  year over year International Omnipod revenues of  67 7 million were up 35  The Drug Delivery business  revenues totaled  14 9 million  down 21  year over year Insulet Corporation Price  Consensus and EPS Surprise    MarginsGross profit in the reported quarter was  123 1 million  up 20 7  from the prior year quarter  However  gross margin of 64 1  contracted 343 basis points  bps   Although total operating expenses of  106 1 million escalated 11 5  from the year ago figure  the operating margin expanded 431 bps to 8 9  in the third quarter 2019 GuidanceFor 2019  the company has raised its revenue expectation to the range of  722 million to  730 million  from the prior estimate of  700  715 million  This  in turn  suggests growth of roughly 28 29  from the level achieved in 2018  earlier expected growth rate was 24 27    The Zacks Consensus Estimate for revenues is pegged at  710 2 million  below the guided range For the fourth quarter of 2019  Insulet projects revenues in the  193  201 million band  indicating an increase of 17 22  from the year ago reported number  The Zacks Consensus Estimate for the metric is pegged at  189 1 million  lower than the guided range Our TakeInsulet exited the third quarter on a promising note  with better than expected numbers  The year over year improvement in revenues on the solid uptake of Omnipod system  both in the United States and across international markets  looks encouraging  The lifted outlook for 2019 and the company s announcement to be on track for meeting its 2021 financial targets also buoy optimism on the stock  The recent FDA clearance of the Alternate Controller Enabled  ACE  Infusion Pump is impressive  We are upbeat about the completion of the full market commercial launch of the Omnipod DISPLAY and Omnipod VIEW apps for use with the Omnipod DASH System  We are  however  disappointed with the revenue decline in its Drug Delivery segment during the third quarter  Also  Insulet is exposed to risks associated with a weaker global economy and lower reimbursement rates Zacks Ranks   Earnings of Other MedTech Majors at a GlanceInsulet carries a Zacks Rank  3  Hold  Some better ranked companies  which posted solid results this earnings season  are Edwards Lifesciences   NYSE EW    Thermo Fisher Scientific   NYSE TMO   and ResMed   NYSE RMD    each carrying a Zacks Rank  2  Buy   You can see  Edwards Lifesciences delivered third quarter 2019 adjusted EPS of  1 41  outpacing the Zacks Consensus Estimate by 15 6   Net sales of  1 09 billion surpassed the Zacks Consensus Estimate by 5 5  Thermo Fisher delivered third quarter 2019 adjusted EPS of  2 94  which surpassed the Zacks Consensus Estimate by 2 1   Revenues of  6 27 billion outpaced the consensus estimate by 1 3  ResMed reported first quarter fiscal 2020 adjusted EPS of 93 cents  which beat the Zacks Consensus Estimate of 87 cents by 6 9   Revenues came in at  681 1 million  surpassing the Zacks Consensus Estimate by 3 6  Wall Street s Next Amazon  NASDAQ AMZN Zacks EVP Kevin Matras believes this familiar stock has only just begun its climb to become one of the greatest investments of all time  It s a once in a generation opportunity to invest in pure genius ,2019-11-06,Zacks Investment Research,https://www.investing.com/analysis/insulet-podd-beats-on-q3-earnings-ups-19-revenue-view-200483436,200483436
137515,359030,TMO,Cardinal Health  CAH  Q1 Earnings   Revenues Beat Estimates,opinion,Cardinal Health  Inc    NYSE CAH   reported first quarter fiscal 2020 adjusted earnings of  1 27 per share  which surpassed the Zacks Consensus Estimate of  1 09 by 16 5   However  the reported figure declined 1 6  year over year Revenues increased 6  on a year over year basis to  37 34 billion and beat the Zacks Consensus Estimate by 0 9  Segmental AnalysisPharmaceutical SegmentIn the fiscal first quarter  pharmaceutical revenues improved 6 4  to  33 43 billion on a year over year basis  The upside can be attributed to sales growth from Pharmaceutical Distribution and Specialty Solutions customers Pharmaceutical witnessed a decline of 2 7  in profits to  398 million thanks to an adverse impact of Pharmaceutical Distribution customer contract renewals  However  benefits from cost savings initiatives and performance of Specialty Solutions partially offset the downside Medical SegmentIn the quarter under review  revenues at this segment rose 3 1  to  3 92 billion on account of organic growth across the segment  led by products and distribution  and Cardinal Health at Home  However  divestiture of the naviHealth business partially offset the upside Medical segment profit improved 25 9  to  170 million owing to benefits from cost savings initiatives  growth in products and distribution  services  and Cardinal Health at Home  The divestiture of the naviHealth business partially offset the upside Cardinal Health  Inc  Price  Consensus and EPS Surprise    Margin AnalysisGross profit inched up 0 7  year over year to  1 68 billion As a percentage of revenues  gross margin in the reported quarter was 4 5   down 20 bps on a year over year basis Distribution  selling  general and administrative expenses totaled  1 17 billion  down 4 2  year over year  Adjusted operating income totaled  577 million  up 6 5  from the year ago quarter The company reported operating loss of  5 26 billion in the quarter under review  against the year ago quarter s income of  816 million Financial UpdateAs of Sep 30  2019  cash and cash equivalents amounted to  1 21 billion  plunging 52 1  from sequentially Cash from operating activities totaled   653  million  against that of  365 million in the year ago quarter 2020 Guidance ReaffirmedThe company has reaffirmed fiscal 2020 adjusted earnings per share  which will range between  4 85 and  5 10  The mid point of the latest guidance range of  4 98 is lower than the Zacks Consensus Estimate of  4 99 Per the company s previously issued fiscal 2020 guidance  the company stated that the abovementioned guidance includes an expected incremental  130 million in cost savings associated with actions intended to optimize and simplify its operating model and cost structure In ConclusionCardinal Health exited the fiscal first quarter on a strong note  wherein both earnings and revenues outpaced the consensus mark  The Pharmaceutical segment witnessed solid growth in Pharmaceutical Distribution and Specialty Solutions customers  Moreover  the Medical segment exhibited a solid performance in the quarter under review  These apart  the company s extension of agreements with CVS Health  NYSE CVS   collaboration with PANTHERx Specialty Pharmacy and buyout of mscripts raise optimism However  contraction in gross margin remains a woe  Further  investments in Pharmaceutical IT platform and lackluster generics performance are likely to mar Cardinal Health s operational efficiencies in the days ahead  Intense competition and customer concentration are other concerns Zacks RankCurrently  Cardinal Health carries a Zacks Rank  3  Hold  Earnings of Other MedTech Majors at a GlanceSome better ranked stocks that reported solid results this earning season are Edwards Lifesciences   NYSE EW    Thermo Fisher Scientific Inc    NYSE TMO   and ResMed Inc    NYSE RMD    each carrying a Zacks Rank  2  Buy   You can see  Edwards Lifesciences delivered third quarter 2019 adjusted EPS of  1 41  outpacing the Zacks Consensus Estimate by 15 6   Third quarter net sales of  1 09 billion surpassed the Zacks Consensus Estimate by 5 5  Thermo Fisher delivered third quarter 2019 adjusted EPS of  2 94  which surpassed the Zacks Consensus Estimate by 2 1   Revenues of  6 27 billion outpaced the Zacks Consensus Estimate by 1 3  ResMed reported third quarter 2019 adjusted EPS of 93 cents  which beat the Zacks Consensus Estimate of 87 cents by 6 9   Revenues were  681 1 million  surpassing the Zacks Consensus Estimate by 3 6  Wall Street s Next Amazon  NASDAQ AMZN  Zacks EVP Kevin Matras believes this familiar stock has only just begun its climb to become one of the greatest investments of all time  It s a once in a generation opportunity to invest in pure genius ,2019-11-06,Zacks Investment Research,https://www.investing.com/analysis/cardinal-health-cah-q1-earnings--revenues-beat-estimates-200483603,200483603
137516,359031,TMO,Hologic s  HOLX  Q4 Earnings Meet  Revenues Top Estimates,opinion,"Hologic  Inc    NASDAQ HOLX   reported fourth quarter fiscal 2019 adjusted earnings per share  EPS  of 65 cents  up 12 1  year over year  The reported figure was in line with the Zacks Consensus Estimate On a GAAP basis  the company s earnings of 15 cents per share reflect a 16 7  drop from the year ago quarter For fiscal 2019  adjusted EPS came in at  2 43  up 8 9  from the year ago figure  However  the metric missed the consensus mark by a penny Revenues in DetailRevenues grossed  865 8 million in the reported quarter  up 6 4  year over year  up 7 3  at constant exchange rate or CER   The metric beat the Zacks Consensus Estimate of  843 30 million  by 2 7  Hologic  Inc  Price  Consensus and EPS Surprise
    For fiscal 2019  total revenues were  3 37 billion  up 4 6  from the year ago tally  Moreover  the figure surpassed the Zacks Consensus Estimate by 0 6  Excluding the divested Blood Screening business  total revenues in the fourth quarter came in at  849 1 million  up 6 1 year over year and 6 9  at CER Geographically  revenues in the United States rose 6 7  year over year to  656 2 million in the quarter  International revenues were up 5 7   up 9 2  at CER  to  209 6 million as well  primarily on strong contributions from the Breast Health  Molecular Diagnostics and GYN Surgical businesses Segments in DetailRevenues at the Diagnostics segment  excluding the divested Blood Screening business  rose 5 1  year over year  up 6 1  at CER  to  290 1 million in the quarter under review with Molecular Diagnostics being a major driver  Molecular Diagnostics revenues of  172 1 million climbed 8 9   up 9 8  at CER   marking the fourth consecutive quarter of double digit constant currency growth despite a challenging prior year comparison However  Cytology and Perinatal revenues of  118 million were flat year over year  up 1  at CER  Revenues at the Breast Health segment increased 6 3   up 7 1  at CER  to  342 6 million  Domestic sales drove Breast Health growth in the quarter with 6 4  revenue rise year over year  whereas outside the United States  Breast Health sales climbed 9 4   at CER   primarily on the company s focus on rising product sales Revenues at the GYN Surgical business grew 6 6   up 7 3  at CER  to  114 5 million  whereas Medical Aesthetic business revenues of  76 9 million reflect an 8 9  uptick  up 10 3  at CER  in the reported quarter Revenues at Skeletal Health grew 2 6   up 3 7  at CER  to   25 million Operational UpdateIn the fiscal fourth quarter  Hologic s adjusted gross margin contracted 19 basis points  bps  to 61 5  primarily due to higher manufacturing costs  an adverse product sales mix  trade tariffs in China and stronger U S  dollar The company witnessed a 6 2  and 14 6  hike in selling and marketing  and research and development expenses  respectively    141 8 million and  60 4 million   However  general and administrative expenses contracted 29 1  to  83 7 million Adjusted operating expenses amounted to  286 million  down 6  year over year  Also  adjusted operating margin expanded 419 bps to 28 4  Financial UpdateHologic exited fiscal 2019 with cash and cash equivalents of  601 8 million compared with  666 7 million at the end of fiscal 2018  Total long term debt was  2 78 billion in the reported quarter  compared with  2 70 billion at the end of the year ago quarter Full year net cash provided by operating activities was  649 5 million compared with  732 9 million a year ago Guidance IssuedHologic has issued first quarter and fiscal 2020 guidance  The company expects adjusted revenues for fiscal 2020 in the range of  3 45  3 50 billion  a projection of 3 4 5  growth at CER   The Zacks Consensus Estimate for revenues stands at  3 48 billion  which lies within the guided range The company envisions adjusted EPS of   2 60  2 65 for fiscal 2020  The consensus mark for the metric is pinned at  2 64  which is within and close to the high end of the estimated range For first quarter fiscal 2020  Hologic anticipates adjusted revenues of  835  850 million  indicating 1 2 3  growth at CER  The consensus estimate for revenues stands at   857 9 million  above the projected range Adjusted EPS is estimated at 59 61 cents for first quarter fiscal 2020  The Zacks Consensus Estimate for the same is pegged at 64 cents  above the company s expected range Our TakeHologic exited the fourth quarter of fiscal 2019 on a solid note  Strong top line growth was led by a year over year rise in core businesses like Breast Health  Molecular Diagnostics and GYN Surgical segments  We are also upbeat about the recent launches like Omni Lok cervical seal  and Definity cervical dilator along with the impressive revenue contributions from the recently launched TempSure Affirm and StimSure in Europe Meanwhile  the contraction in the gross margin is concerning Zacks Rank   Key PicksCurrently  Hologic carries a Zacks Rank  3  Hold  A few better ranked medical device companies  which posted solid results this earnings season  are ResMed Inc   NYSE RMD    NuVasive  Inc   NASDAQ NUVA   and Thermo Fisher Scientific Inc   NYSE TMO   ResMed  with a Zacks Rank  2  Buy   reported first quarter fiscal 2020 adjusted EPS of 93 cents  surpassing the Zacks Consensus Estimate by 6 9   Its revenues of  681 1 million outpaced the consensus mark by 3 7  NuVasive s third quarter 2019 adjusted EPS of 59 cents surpassed the Zacks Consensus Estimate by 9 3   Its revenues totaled  290 8 million  which surpassed the consensus estimate by 2 4   The stock currently carries a Zacks Rank  2  You can see Thermo Fisher  with a Zacks Rank  2  delivered third quarter 2019 adjusted EPS of  2 94  beating the Zacks Consensus Estimate by 2 1   Its revenues of  6 27 billion beat the Zacks Consensus Estimate by 1 3  Wall Street s Next Amazon  NASDAQ AMZN Zacks EVP Kevin Matras believes this familiar stock has only just begun its climb to become one of the greatest investments of all time  It s a once in a generation opportunity to invest in pure genius ",2019-11-06,Zacks Investment Research,https://www.investing.com/analysis/hologics-holx-q4-earnings-meet-revenues-top-estimates-200483566,200483566
137517,359032,TMO,Globus Medical  GMED  Q3 Earnings Meet Mark  Revenue View Up,opinion,"Globus Medical  Inc    NYSE GMED   reported third quarter 2019 adjusted earnings per share  EPS  of 43 cents  in line with the Zacks Consensus Estimate  However  the metric improved 10 3  from the year ago figure The adjusted EPS excludes certain non recurring expenses like litigation related charges  amortization of intangibles and acquisition related costs Without the adjustments  the company registered GAAP earnings of 38 cents per share  reflecting an 8 6  rise from the year ago quarter Revenue DetailsThird quarter 2019 worldwide sales summed  196 2 million  up 15 9   up 16  at constant exchange rate or CER  year over year  The figure also trumped the Zacks Consensus Estimate by 5 2  Globus Medical  Inc  Price  Consensus and EPS Surprise
    Sales generated in the United States including robotic improved 16 9  year over year on continued pull through from robotic placements in the reported period Meanwhile  international sales rose 11 2  from the year earlier quarter  up 11 3  at CER  Moreover  Musculoskeletal Solutions products generated revenues of  182 3 million  up 11 8  year over year  However  Enabling Technologies products revenues of  13 9 million in the quarter represented a 125 2  surge from the prior year figure of  6 2 million MarginGross profit in the reported quarter rose 14 8  year over year to  150 8 million  However  gross margin contracted 77 basis points  bps  to 76 9  on a 19 9  rise in cost of goods sold to  45 4 million Selling  general and administrative expenses in the reported quarter were  88 5 million  up 17 7  from the year ago quarter  Research and development expenses  however  contracted 6 6  to  14 5 million Operating profit grew 17 5  year over year to  47 9 million while operating margin expanded 33 bps to 24 4  in the quarter under review Cash PositionGlobus Medical exited the third quarter with cash and cash equivalents and short term marketable securities of  277 6 million compared with  240 4 million at the end of the second quarter  Year to date  net cash provided by the operating activities was  117 7 million compared with  137 4 million a year ago 2019 GuidanceThe company reaffirmed its 2019 adjusted EPS guidance at  1 72  The Zacks Consensus Estimate for the metric is pegged at  1 71  which lies below the company s issued guidance The company  however  raised 2019 sales guidance to  783 million from  775 million  The Zacks Consensus Estimate for the same is pegged at  776 4 million  above the company s projection Our TakeGlobus Medical posted mixed third  quarter results with earnings meeting the Zacks Consensus Estimate and revenues beating the mark  Both Musculoskeletal Solutions and Enabling Technologies registered strong sequential growth  Also  the global spine business demonstrated solid year over year improvement  The company is also optimistic about maintaining the upside in implant sales with ExcelsiusGPS technology Meanwhile  the operating margin expansion buoys optimism  A raised sales outlook for 2019 boosts investors  confidence However  the contraction in gross margin is concerning Zacks Rank   Key PicksCurrently  Globus Medical carries a Zacks Rank  3  Hold  A few better ranked medical device companies  which posted solid results this earnings season  are ResMed Inc   NYSE RMD    NuVasive  Inc   NASDAQ NUVA   and Thermo Fisher Scientific Inc   NYSE TMO   ResMed  with a Zacks Rank  2  Buy   reported first quarter fiscal 2020 adjusted EPS of 93 cents  surpassing the Zacks Consensus Estimate by 6 9   Its revenues of  681 1 million outpaced the consensus mark by 3 7  NuVasive s third quarter 2019 adjusted EPS of 59 cents surpassed the Zacks Consensus Estimate by 9 3   Its revenues totaled  290 8 million  which surpassed the consensus estimate by 2 4   The stock currently carries a Zacks Rank  2  You can see Thermo Fisher  with a Zacks Rank  2  delivered third quarter 2019 adjusted EPS of  2 94  beating the Zacks Consensus Estimate by 2 1   Its revenues of  6 27 billion beat the Zacks Consensus Estimate by 1 3  Wall Street s Next Amazon  NASDAQ AMZN Zacks EVP Kevin Matras believes this familiar stock has only just begun its climb to become one of the greatest investments of all time  It s a once in a generation opportunity to invest in pure genius ",2019-11-06,Zacks Investment Research,https://www.investing.com/analysis/globus-medical-gmed-q3-earnings-meet-mark-revenue-view-up-200483544,200483544
