,id,ticker,title,category,content,date,provider,url,article_id
26285,247800,AIMC,IDEX  IEX  Beats Q4 Earnings Estimates  2018 View Solid,opinion,"IDEX Corporation   NYSE IEX   reported strong fourth quarter 2017 results driven by significant organic growth and diligent execution of operational plans  GAAP earnings for the reported quarter were  93 7 million or  1 21 per share compared with  57 3 million or 75 cents per share in the year earlier quarter  The year over year improvement was primarily attributable to top line growth  Excluding restructuring and other non recurring items  adjusted earnings for the reported quarter were  1 12 per share  which beat the Zacks Consensus Estimate of  1 07  The company reported adjusted earnings of  4 31 per share for full year 2017  GAAP earnings for the year were  337 3 million or  4 36 per share compared with  271 1 million or  3 53 per share in the prior year Net sales in the reported quarter came in at  585 9 million compared with  530 4 million in the year ago quarter  Quarterly sales exceeded the Zacks Consensus Estimate of  573 million  The top line increase was primarily attributable to organic growth of 9   By successfully investing in product innovations  business development and reallocating resources  there was growth in revenues across all segments of the company which helped drive total revenues For 2017  the company reported total revenues of  2 287 3 million compared with  2 113 million in the previous year IDEX Corporation Price  Consensus and EPS Surprise
    Segmental DetailsNet sales of Fluid   Metering Technologies were  222 1 million compared with  207 1 million in the prior year quarter primarily led by organic growth of 7  in the quarter Aggregate quarterly revenues from Health   Science Technologies came in at  208 9 million compared with  188 3 million in the year ago quarter  driven by organic growth of 11  Fire   Safety Diversified Products revenues were  155 5 million  up from  135 million in the year ago quarter  with organic growth of 12  MarginsAdjusted operating income for the reported quarter was  129 6 million compared with  109 4 million in the year ago period with adjusted operating margin of 22 1    up 150 basis points year over year  The increase in adjusted operating income  despite rise in operating expenses  is due to significant top line growth  Adjusted EBITDA  earnings before interest  taxes depreciation and amortization  was  149 4 million with adjusted EBITDA margin of 25 5  compared with  134 8 million and 25 4   respectively  in the year ago period Adjusted operating income for Fluid   Metering Technologies increased 11 1  year over year to  63 million with margin expansion of 100 bps  making the adjusted operating margin 28 4  Adjusted operating income of Health   Science Technologies increased 30 2  year over year to  46 6 million with margin expansion of 330 bps  making the adjusted operating margin 22 3  Adjusted operating profit of Fire   Safety Diversified Products increased 26 8  year over year to  41 2 million with margin expansion of 250 bps  making the adjusted operating margin 26 5  Balance Sheet and Cash FlowIDEX exited 2017 with cash and cash equivalents of  376 million compared with  236 million of the previous year  Long term debt was  858 8 million compared with  1 014 2 million of the prior year For 2017  the company generated net cash of  432 8 million from its operating activities  up from  400 million recorded a year ago Free cash flow for the quarter totaled  120 4 million  up 14  from the prior year period OutlookIDEX is poised to gain from robust organic growth  disciplined capital deployment and a favorable global macroeconomic environment  Backed by these positives  this Zacks Rank  3  Hold  company has given bullish full year 2018 earnings guidance  Full year 2018 EPS is currently anticipated to lie within the  4 90  5 10 per share range with EPS for the first quarter expected in the range of  1 20 to  1 24 Stocks to ConsiderBetter ranked stocks worth considering in the industry include EnPro Industries  Inc    NYSE NPO    Illinois Tool Works Inc    NYSE ITW   and Altra Industrial Motion Corp    NASDAQ AIMC   each carrying a Zacks Rank  2  Buy   You can see  EnPro Industries has an expected long term earnings growth rate of 15 5  Illinois Tool Works has an expected long term earnings growth rate of 10 1  Altra Industrial Motion Corp has exceeded estimates in each of the trailing four quarters with an average beat of 17 3  Don t Even Think About Buying Bitcoin Until You Read ThisThe most popular cryptocurrency skyrocketed last year  giving some investors the chance to bank 20X returns or even more  Those gains  however  came with serious volatility and risk  Bitcoin sank 25  or more 3 times in 2017 Zacks has just released a new Special Report to help readers capitalize on the explosive profit potential of Bitcoin and the other cryptocurrencies with significantly less volatility than buying them directly ",2018-01-29,Zacks Investment Research,https://www.investing.com/analysis/idex-iex-beats-q4-earnings-estimates-2018-view-solid-200284859,200284859
26332,247847,AIMC,What Makes Nordson  NDSN  Stock A Solid Investment Choice ,opinion,We issued a research report on Nordson Corporation   NASDAQ NDSN   on Nov 27  We believe that a solid product portfolio  wide international operations and synergistic benefits from acquired assets have strengthened the company s prospects  It currently has  7 4 billion market capitalization It currently carries a Zacks Rank  2  Buy  Below we briefly discuss the company s potential growth drivers Diversification Benefits  Nordson is poised to gain from its vast customer base in the packaging  nonwovens  polymer processing  products assembly  electronic systems  fluid management  test and inspection  container coating  curing and drying systems  liquid finishing and powder coating end markets  Also  its technologically advanced products  including single use components  stand alone units for low volume operations and microprocessor based automated systems for high speed  high volume production lines  give it a competitive edge Furthermore  international diversity has played a major role in the company s profitability over time  It has operations in more than 35 countries  with manufacturing facilities primarily in the United States  People s Republic of China  Germany  Mexico  the Netherlands  Thailand and the United Kingdom  In third quarter fiscal 2017  ended Jul 31  2017   the company sourced nearly 69  of its revenues from international operations Inorganic Initiatives Drive Growth  Acquired assets have over time helped Nordson leverage benefits from easy penetration into unexplored markets and expanded product offerings  In this regard  assets acquired in fiscal 2017 are worth mentioning  In January  the company acquired certain assets of ACE Production Technologies  Inc   a manufacturer of selective soldering systems  In February  the company bought 100  shares of Plas Pak Industries  Inc  and InterSelect GmbH  While Plas Pak Industries specializes in manufacturing plastic dispensing products  InterSelect GmbH designs and manufactures selective soldering systems  In March  the company acquired Advanced Technologies business of Vention Medical  manufacturer of medical single use components and devices  All these assets have strengthened the company s businesses under Advanced Technology Systems segment  ACE Production Technologies and InterSelect are projected to deliver mid to high single digit growth over the next several years Healthy Fiscal  17 Guidance   Long Term Targets  Nordson is scheduled to release its fourth quarter and fiscal year 2017  ended October  results on Dec 13 after the market closes  The company anticipates sales to increase in the range of 4 8  year over year in the fiscal fourth quarter  Acquisitions are likely to contribute 10  to sales growth while foreign currency movements are expected add 1   Operating margin will likely be 21   For the year  organic revenue growth is predicted to be 6  while adjusted earnings per share are anticipated to increase 12  year over year to  5 24 Over the long term  2017 to 2022   the company anticipates revenue growth to be roughly twice the global Gross Domestic Product percentage while aims to improve its operating margin in excess of revenue growth percentage Price Performance and Earnings Estimates  Market sentiments have been positive for Nordson over time  In the last three months  the company s shares have yielded 18 2  return  outperforming the 12 1  rally of the it belongs to The stock s earnings estimates for fiscal 2017 have been revised upward by one analyst while that for fiscal 2018 have been raised by two in the last 60 days  Currently  the Zacks Consensus Estimate for the stock stands at  5 32 for fiscal 2017 and  5 82 for fiscal 2018  representing growth of 1 cent from their respective estimates 60 days ago Its earnings in the next three to five years are predicted to grow 15  versus 12 2  expected for the industry it belongs to Other Stocks to ConsiderSome other stocks worth considering in the industry are Kadant Inc    NYSE KAI    Sun Hydraulics Corporation   NASDAQ SNHY   and Altra Industrial Motion Corporation   NASDAQ AIMC    While Kadant and Sun Hydraulics sport a Zacks Rank  1  Strong Buy   Altra Industrial Motion carries a Zacks Rank of 2   You can see  Kadant pulled off an average positive earnings surprise of 20 32  over the last four quarters  Also  earnings estimates for 2017 and 2018 were revised upward in the last 60 days Sun Hydraulics delivered an average positive earnings surprise of 9 58  in the trailing four quarters  Also  bottom line expectations for 2017 and 2018 improved over the past 60 days Altra Industrial Motion s financial performance was impressive  with an average positive earnings surprise of 17 30  in the last four quarters  Also  earnings estimates for 2017 and 2018 were revised upward over the last 60 days Today s Stocks from Zacks  Hottest StrategiesIt s hard to believe  even for us at Zacks  But while the market gained  18 8  from 2016   Q1 2017  our top stock picking screens have returned  157 0    128 0    97 8    94 7   and  90 2  respectively And this outperformance has not just been a recent phenomenon  Over the years it has been remarkably consistent  From 2000   Q1 2017  the composite yearly average gain for these strategies has beaten the market more than 11X over  Maybe even more remarkable is the fact that we re willing to share their latest stocks with you without cost or obligation ,2017-11-27,Zacks Investment Research,https://www.investing.com/analysis/what-makes-nordson-ndsn-stock-a-solid-investment-choice-200268766,200268766
26333,247848,AIMC,Illinois Tool Provides Long Term Goals  Initiates 2018 View,opinion,Industrial tool maker Illinois Tool Works Inc    NYSE ITW   hosted its Investors Day 2017 on Dec 1  The company focused on its long term growth targets and also initiated forecast for 2018  A brief discussion on the event has been provided below For the five years from 2018 to 2022  the company anticipates to gain from its solid product portfolio and growth strategies  From 2018 and beyond  it expects organic revenue growth to be in the 3 5  range  operating margin to be in excess of 25   incremental margin to be 35  and earnings per share to grow 8 10  in each year  Also  after tax return on invested capital is projected to be above 20   Free cash flow will likely be more than 100  of net income  By 2020  the company anticipates distributing 50  of its free cash flow  up from the current distribution rate of 43  In addition  Illinois Tool Works initiated its financial guidance for 2018  The company anticipates GAAP earnings to be within  7 05  7 25 per share  Organic revenue growth is predicted to be within 3 4  and operating margin to be 25 25 5   The projections for 2017 have been reaffirmed  with earnings per share still anticipated to be  6 62  6 72  reflecting growth of 17  at mid point from the previous year In the last three months  the company s shares have yielded 20 8  return  outperforming 13 5  rally recorded by the it belongs to  We believe that better than expected third quarter results  with an earnings beat of 3 64   primarily drove the company s share price Also  stock s earnings estimates for 2017 have been revised upward by five brokerage firms while estimates for 2018 have been raised by five firms and lowered by one in the last 60 days  Currently  the Zacks Consensus Estimate is pegged at  6 69 for 2017 and  7 14 for 2018  reflecting growth of 3 1  and 0 7  from their respective 60 day ago tallies Illinois Tool Works Inc  Price and Consensus    Zacks Rank   Key PicksWith a market capitalization of  56 5 billion  Illinois Tool Works carries a Zacks Rank  3  Hold   Despite the company s solid growth prospects  we believe that adverse impact of price costs on margins in 2017 as well as risks from unfavorable foreign currency movements  industry rivalry  volatilities in input price   supply and economic uncertainties remain concerns Some better ranked stocks in the industry are Kadant Inc    NYSE KAI    Sun Hydraulics Corporation   NASDAQ SNHY   and Altra Industrial Motion Corporation   NASDAQ AIMC    While Kadant and Sun Hydraulics sport a Zacks Rank  1  Strong Buy   Altra Industrial Motion carries a Zacks Rank  2  Buy   You can see  Kadant pulled off an average positive earnings surprise of 20 32  in the last four quarters  Also  earnings estimates for 2017 and 2018 were revised upward in the last 60 days Sun Hydraulics delivered an average positive earnings surprise of 9 58  in the trailing four quarters  Also  bottom line expectations for 2017 and 2018 improved over the past 60 days Altra Industrial Motion s financial performance was impressive  with an average positive earnings surprise of 17 30  in the last four quarters  Also  earnings estimates for 2017 and 2018 were revised upward over the last 60 days  Zacks  Best Private Investment IdeasWhile we are happy to share many articles like this on the website  our best recommendations and most in depth research are not available to the public Starting today  for the next month  you can follow all Zacks  private buys and sells in real time  Our experts cover all kinds of trades  from value to momentum       from stocks under  10 to ETF and option moves       from stocks that corporate insiders are buying up to companies that are about to report positive earnings surprises  You can even look inside exclusive portfolios that are normally closed to new investors ,2017-12-03,Zacks Investment Research,https://www.investing.com/analysis/illinois-tool-provides-longterm-goals-initiates-2018-view-200270255,200270255
26334,247849,AIMC,Actuant Shuffles Energy Wing With Viking Sale  Mirage Buyout,opinion,Machinery company Actuant Corporation   NYSE ATU   announced that it has successfully divested its Viking SeaTech business to Acteon Group Limited and acquired Mirage Machines  Ltd  from the same  Both these transactions were originally announced on Aug 16 Viking SeaTech business was part of Actuant s Energy segment and primarily delivered mooring solutions in the offshore oil   gas exploration  drilling and well development end markets  On the other hand  Mirage Machines manufactures industrial and energy maintenance tools  Details of the Twin TransactionsAs noted  the Viking SeaTech business generated roughly  20 million revenues in the trailing 12 months  Actuant received proceeds of approximately  12 million from Acteon for this divestment For Mirage Machines acquisition  the company paid roughly  16 million to Acteon and promised additional consideration based on future performance In fiscal 2017  ended August 2017   Actuant recorded impairment and divestiture related charges of  117 million while predicts to incur  15  20 million of these charges in second quarter fiscal 2018  Benefits From the TransactionsIn fourth quarter fiscal 2017  Actuant s Energy segment s sales totaled  68 6 million  decreasing 24 9  year over year  Core sales dipped 25  year over year  Poor upstream offshore oil   gas demand and lower sales accrued from the company s Hydratight business  dented the segment s sales in the quarter Actuant believes that both these transactions were in sync with its intention of streamlining its Energy business to provide superior benefits to shareholders  The Viking divestment will limit the company s exposure to upstream  offshore oil   gas markets while the addition of Mirage Machines will broaden product offerings in the flange facing and hot tapping categories  Specifically  the buyout will complement the Energy segment s Hydratight business and create rental and service business opportunities In a month  the company s shares have yielded 4 1  return  outperforming 2 6  gain of the   Zacks Rank   Other Stocks to ConsiderWith a market capitalization of nearly  1 6 billion  Actuant currently carries a Zacks Rank  2  Buy   The stock s Zacks Consensus Estimate is currently pegged at  1 08 per share for fiscal 2018  ending August 2018  and at  1 32 for fiscal 2019  These estimates represent year over year growth of 30 3  for fiscal 2018 and 22 2  for fiscal 2019 Actuant Corporation Price and Consensus    Other stocks worth considering in the machinery industry include Kennametal Inc    NYSE KMT    Stanley Black   Decker  Inc    NYSE SWK   and Altra Industrial Motion Corporation   NASDAQ AIMC    While Kennametal sports a Zacks Rank  1  Strong Buy   both Stanley Black   Decker and Altra Industrial Motion carry a Zacks Rank of 2  You can see  Kennametal s earnings for fiscal 2018 and fiscal 2019 improved in the last 60 days  Also  the company pulled off an average positive earnings surprise of 20 56  in the last four quarters Stanley Black   Decker delivered an average positive earnings surprise of 4 26  in the last four quarters  Also  its earnings estimates for 2017 and 2018 improved in the last 60 days Altra Industrial Motion s financial performance was impressive  with an average positive earnings surprise of 17 30  in the last four quarters  Also  earnings estimates for 2017 and 2018 were revised upward over the last 60 days  Zacks  Best Private Investment IdeasWhile we are happy to share many articles like this on the website  our best recommendations and most in depth research are not available to the public Starting today  for the next month  you can follow all Zacks  private buys and sells in real time  Our experts cover all kinds of trades  from value to momentum       from stocks under  10 to ETF and option moves       from stocks that corporate insiders are buying up to companies that are about to report positive earnings surprises  You can even look inside exclusive portfolios that are normally closed to new investors ,2017-12-03,Zacks Investment Research,https://www.investing.com/analysis/actuant-shuffles-energy-wing-with-viking-sale-mirage-buyout-200270253,200270253
26335,247850,AIMC,Applied Industrial Poised On Solid Operations  Buyout Gains,opinion,We issued an updated research report on Applied Industrial Technologies  Inc    NYSE AIT   on Dec 8  We believe that a diversified business structure  initiatives to return higher value to shareholders and inorganic activities makes this stock an attractive choice for investors seeking exposure in the machinery industry It currently carries a Zacks Rank  2  Buy   Its investment appeal is further accentuated by a favorable  of A Applied Industrial s earnings are projected to grow 12  in the next three to five years  Notably  its earnings estimates for fiscal 2018  ending June 2018  have been raised by three brokerage firms and that for fiscal 2019 by one  Currently  the Zacks Consensus Estimate is pegged at  3 19 for fiscal 2018 and  3 43 for fiscal 2019  representing growth of 3 6  and 1 8  from their respective tallies 60 days ago Also  market sentiments have been positive for Applied Industrial  with the stock yielding 4 1  return in a month s time  This gain is above 2 6  growth of the S P 500 Below we discuss why investors should consider buying Applied Industrial s stock Business Diversification a Boon  Applied Industrial   a leading distributor of industrial products   serves original equipment manufacturer and maintenance  repair and operations customers in various end markets including agriculture  food processing  automotive  chemicals  petrochemicals  fabricated metals  forest products  industrial machinery and equipment  mining  oil and gas  primary metals  transportation  utilities and government entities  Such diversification prevents the company from losses in the event of loss of business from any particular customer  Notably  revenues sourced from any customer do not exceed 3  Furthermore  international diversity has played a major role in Applied Industrial s profitability over time  The company operated in the United States  Puerto Rico  Canada  Mexico  Australia  New Zealand  and Singapore through its 552 facilities at the end of fiscal 2017 Inorganic Initiatives Drive Growth Opportunities  Acquired assets have over time contributed to Applied Industrial s expansion  Notably  acquired assets contributed roughly 1 2  to year over year sales growth in fiscal 2017  while added 0 8  in first quarter fiscal 2018 In fiscal 2017  the company acquired Sentinel Fluid Controls   a premium distributer of lubrication and hydraulic solutions  systems and components  This buyout has been strengthening the company s Fluid Power segment  Moreover  in the first quarter of fiscal 2018  the company acquired a Mexico based distributor of components and accessories for lubrication and hydraulic systems  This acquisition is anticipated to fortify the company s Service Center Based Distribution segment Shareholders  Return  Share buybacks and dividend payments are the prime means of returning value to shareholders for Applied Industrial  In first quarter fiscal 2018  the company repurchased 247 500 shares for  13 8 million while authorization to buyback roughly 1 2 million shares was left at the quarter end The company s dividend payments have grown 13 9   CAGR  since fiscal 2004  In third  quarter fiscal 2017  the company raised its quarterly dividend rate by 3 6    the eighth hike since 2010 Over the long term  the company anticipates returning higher value to its shareholders through dividend payments  share buybacks  solid business execution and strategic investments Promising Fiscal 2018 Guidance   Long Term Targets  Applied Industrial anticipates gaining from its strengthening service center distribution  upstream oil and gas and fluid power operations in the quarters ahead  For fiscal 2018  the company revised its revenue growth guidance from 3 5  to 4 5   with the mid point increasing from 4  to 4 5   Also  earnings are predicted to come within the  3 10  3 20 per share range  with mid point increasing from  3 10 to  3 15 By 2020  the company anticipates generating approximately  3 3 million in revenues  with more than 20  coming in from international operations  In fiscal 2017  the company generated  2 6 billion revenues and sourced 16  of sales from operations outside the United States  Organic revenues are predicted to grow in low to mid single digit and acquired assets are expected to contribute in excess of  150 million annually  Also  earnings before interest  tax  depreciation and amortization margin will range within 9 10   up from 8 3  in fiscal 2017 on the back of sales expansion and cost   operational discipline Other Stocks to ConsiderApplied Industrial currently carries a market capitalization of  2 5 billion  We believe that the above mentioned positives clearly justify the stock s current ranking Some other stocks worth considering in the are Kadant Inc    NYSE KAI    Sun Hydraulics Corporation   NASDAQ SNHY   and Altra Industrial Motion Corporation   NASDAQ AIMC    While Kadant and Sun Hydraulics sport a Zacks Rank  1  Strong Buy   Altra Industrial Motion carries a Zacks Rank  2  You can see  Kadant pulled off an average positive earnings surprise of 20 32  in the last four quarters  Also  earnings estimates for 2017 and 2018 were revised upward in the last 60 days Sun Hydraulics delivered an average positive earnings surprise of 9 58  in the trailing four quarters  Also  bottom line expectations for 2017 and 2018 improved over the past 60 days Altra Industrial Motion s financial performance was impressive  with an average positive earnings surprise of 17 30  in the last four quarters  Also  earnings estimates for 2017 and 2018 were revised upward over the last 60 days Today s Stocks from Zacks  Hottest StrategiesIt s hard to believe  even for us at Zacks  But while the market gained  18 8  from 2016   Q1 2017  our top stock picking screens have returned  157 0    128 0    97 8    94 7   and  90 2  respectively And this outperformance has not just been a recent phenomenon  Over the years it has been remarkably consistent  From 2000   Q1 2017  the composite yearly average gain for these strategies has beaten the market more than 11X over  Maybe even more remarkable is the fact that we re willing to share their latest stocks with you without cost or obligation ,2017-12-10,Zacks Investment Research,https://www.investing.com/analysis/applied-industrial-poised-on-solid-operations-buyout-gains-200272141,200272141
