,id,ticker,title,category,content,date,provider,url,article_id
157103,378619,NRG,Why Is NRG  NRG  Up 9 6  Since Last Earnings Report ,opinion,"It has been about a month since the last earnings report for NRG Energy  NYSE NRG   Shares have added about 9 6  in that time frame  outperforming the S P 500 
Will the recent positive trend continue leading up to its next earnings release  or is NRG due for a pullback  Before we dive into how investors and analysts have reacted as of late  let s take a quick look at its most recent earnings report in order to get a better handle on the important catalysts  NRG Energy Lags Q3 Earnings Estimates  Tops RevenuesNRG Energy delivered earnings of 94 cents per share in third quarter 2018 results  missing the Zacks Consensus Estimate of  1 12 per share by 16   Earnings improved 56 7  year over year on the back of improved performance by the integrated retail and generation platforms RevenuesNRG Energy posted revenues of  3 061 million in the quarter  beating the Zacks Consensus Estimate of  2 960 million by 3 4   Quarterly revenues improved 11 7  year over year Highlights of the ReleaseTotal operating costs and expenses in the third quarter was  2 659 million  up 8 8  from the year ago quarter s tally Adjusted EBITDA in the third quarter was  677 million compared with  552 million a year ago Through the third quarter of 2018  the company realized   375 million of cost savings target in 2018 under the Transformation Plan Financial HighlightsAs of Sep 30  2018  NRG Energy had cash and cash equivalents of  1 359 million compared with  767 million as of Dec 31  2017 As of Sep 30  2018  the company s long term debt and capital leases were  6 658 million compared with  9 180 million as of Dec 31  2017 The company s net cash provided operating activities at the end of the first nine months of 2018 was  1 082 million compared with  736 million at the end of the first nine months of  2017 Capital expenditure at the end of Sep 30  2018  was  345 million compared with  172 million at the end of Sep 30  2017 GuidanceNRG Energy narrowed the 2018 adjusted EBITDA guidance to a range of  1 700  1 800 million from  2 800  3 000 million and free cash flow before growth investments to the range of  1 240  1 340 million from  1 550  1 750 million  The narrowed guidance reflects the completion of sale of the NRG Yield and the Renewables Platform  as well as the previously announced divestment of the South Central business unit The company initiated 2019 adjusted EBITDA guidance in the range of  1 850  2 050 million and free cash flow before growth investments in the range of  1 405  1 605 million  
How Have Estimates Been Moving Since Then 
It turns out  fresh estimates have trended downward during the past month  The consensus estimate has shifted  39 29  due to these changes 
VGM Scores
Currently  NRG has a great Growth Score of A  though it is lagging a lot on the Momentum Score front with an F  However  the stock was allocated a grade of B on the value side  putting it in the top 40  for this investment strategy 
Overall  the stock has an aggregate VGM Score of B  If you aren t focused on one strategy  this score is the one you should be interested in 
Outlook
Estimates have been broadly trending downward for the stock  and the magnitude of this revision indicates a downward shift  Notably  NRG has a Zacks Rank  3  Hold   We expect an in line return from the stock in the next few months ",2018-12-07,Zacks Investment Research,https://www.investing.com/analysis/why-is-nrg-nrg-up-96-since-last-earnings-report-200366298,200366298
157104,378620,NRG,Twitter  TWTR  Stock Surges To Become S P 500 s Top Monthly Gainer,opinion,"At one point during Wednesday trading hours  shares of Twitter   NYSE TWTR   were up more than 6   bringing the social media company s month to date gains up to 17  and giving it the strongest December rally of any stock in the S P 500 
With no obvious news to cite for today s surge  investors were pointing to favorable technical patterns to explain why Twitter was in the green once again  Regardless  the stock has clearly returned to favor in recent weeks  despite lingering uncertainty in broader markets 
The story of Twitter s latest bout of momentum starts back in July  The stock had become one of 2018 s top momentum picks  tallying gains of about 90  en route to a 52 week high of  47 79 per share  But shares moved sharply lower after Twitter warned of a drop in users amid its purging of fake accounts and efforts to prevent malicious content 
While Twitter still has a long way to go if it wants to see those mid summer levels again  it s recent run has been impressive  Shares found a bottom in October as the rest of the market was sputtering and the internet company managed to rally more than 20  in what was a brutal month for most major indexes  At today s high of  37 14  Twitter shares were nearly 39  above that October low and on track to carry some serious momentum into the New Year 
The next best December performer in the S P 500 is NRG Energy   NYSE NRG    which had gained almost 11  on the month through late afternoon trading hours Wednesday  The index itself is down more than 2 5  so far this month  as investors worried about trade disputes and global economic conditions have not quite found their  Santa Claus Rally  
Twitter is currently sporting a Zacks Rank  1  Strong Buy   This is because earnings estimate revisions have been largely positive as of late  In fact  the company has witnessed 13 upward revisions against just two downward revisions to its fiscal 2018 earnings estimates within the last 60 days  Twitter is now expected to finish the year with EPS growth in excess of 84  
Looking for Stocks with Skyrocketing Upside 
Zacks has just released a Special Report on the booming investment opportunities of legal marijuana 
Ignited by new referendums and legislation  this industry is expected to blast from an already robust  6 7 billion to  20 2 billion in 2021  Early investors stand to make a killing  but you have to be ready to act and know just where to look ",2018-12-12,Zacks Investment Research,https://www.investing.com/analysis/twitter-twtr-stock-surges-to-become-sp-500s-top-monthly-gainer-200367519,200367519
157116,378632,NRG,4 Stocks Poised To Jump  COLL  GEMP  OCUL  TNDM,opinion,"Collegium Pharmaceutical Inc  NASDAQ COLL   after the consolidation of several months  following the big 5 wave move up  is now ready for another wave up to the high 30 s  On Tuesday  it popped 1 78  or 7   to 26 74  on 827 331 shares traded  Volume is increasing  I think it s ready to break out  We will see if it can get above 27 90 on Wednesday  and then take out 30  If that happens  this stock is on its way 
Gemphire Therapeutics Inc  NASDAQ GEMP  reversed off the pullback low off of the trendline on Tuesday and popped 70 cents  or 11   to 7 22  on 147 198 shares traded  It s a thinly traded stock  but if it takes our 7 1 2  it could rocket to 8 1 2  and then 11 00 
Swing trade Ocular Therapeutix Inc  NASDAQ OCUL  broke out of a base on Tuesday  jumping 46 cents  or 6 34   to 7 71  on 719 977 shares traded  I m really liking the way it s setting up  There s an inverse head and shoulders type base with a huge channel forming  I m pretty convinced that if this stock gets some volume  it will make a run at 9 9 1 4  and then 11 1 2 12 
Tandem Diabetes Care Inc  NASDAQ TNDM  is amazing  having gone from 2 00 to almost 18  9 fold that quickly  It s oversold  it s overbought  it s overextended  On Tuesday  it ran 1 37  or 8 39   to 17 70  on 2 1 million shares  I would not be shocked to see it head to low to mid 20 s  and even as high as 30 eventually 
Stocks on the long side included Collegium Pharmaceutical  Inc   COLL   Cardiome Pharma Corp   CORV   Ceragon Networks Ltd   CRNT   Carvana Co   CVNA   CohBar  Inc   CWBR   3D Systems Corporation  DDD   Eloxx Pharmaceuticals  Inc   ELOX   Fitbit  Inc   FIT   Gemphire Therapeutics Inc   GEMP   Galmed Pharmaceuticals Ltd   GLMD   GoPro  Inc   GPRO   Iridium Communications Inc   IRDM   KMG Chemicals  Inc   KMG   Kopin Corporation  KOPN   Lands  End  Inc   LE   NRG Energy  Inc   NYSE NRG   Nutanix  Inc   NTNX   Ocular Therapeutix  Inc   OCUL   Rent A Center  Inc   RCII   Sunrun Inc   RUN   Skyline Champion Corporation  SKY   Teladoc  Inc   TDOC   Teva Pharmaceutical Industries Limited  NYSE TEVA   Tandem Diabetes Care  Inc   TNDM   Twilio Inc   TWLO   an Twitter  Inc   TWTR  
Watch video here ",2018-06-13,Harry Boxer,https://www.investing.com/analysis/coll-gemp-ocul-tndm-200324399,200324399
157117,378633,NRG,Alliant Energy Furthers Green Plans  Partners EDF Renewables,opinion,Alliant Energy   NYSE LNT   announced that it has signed an agreement with EDF  PA EDF  Renewables  per which the latter will develop and construct up to 200 megawatts  MW  of its Golden Plains Wind Project  Alliant s focus on increasing electricity generation from renewable sources is undeniable and the company received an approval from the Iowa Utilities Board to add 1 000 MW of new wind energy to its existing portfolio Construction is already underway at the Upland Prairie Wind Farm  By the end of this year  Alliant Energy expects to begin construction at the English Farm  These two projects will come online by the end of 2019 and add 470 MW to its existing portfolio Alliant Energy s Green PlansAlliant Energy has been gradually lowering its carbon footprint through regular investments in its existing generation portfolio  Since 2010  Alliant Energy has retired or repowered its coal fired generation  It converted almost 40  of 2010 level coal fired generation  In addition  the company will retire nearly 75  of its oil and diesel fired generation capacity by the end of this year Alliant Energy is consistently investing in renewable and natural gas based electricity generation  and gradually lowering its coal based generation assets  The combined contribution from natural gas and renewable was 42  in 2005  which is expected to increase to 72  in 2024  eating coal s share in electricity production Alliant Energy has plans to invest nearly  5 4 billion during the 2018 2021 time frame  Post 2021  within the 2022 2026 time frame  the company plans to invest nearly  5 billion to strengthen its electric and natural gas distribution  and generation portfolio  The company is successfully completing major construction projects on time and at or below budget The assistance of EDF Renewables will help Alliant Energy meet its target of constructing the 1 000 MW wind project within 2020 Price MovementIn the past three months  shares of Alliant Energy have declined 1 2   narrower than its  s fall of 2 9  Zacks Rank and Other Key PicksAlliant Energy currently has a Zacks Rank  2  Buy   Other top ranked stocks from the same space are NRG Energy Inc    NYSE NRG   and TerraForm Power Inc    NASDAQ TERP    both sporting a Zacks Rank  1  Strong Buy   whereas IDACORP  Inc    NYSE IDA   carries the same rank as Alliant  You can see NRG Energy posted an average positive earnings surprise of 507 93  in the last four quarters  The Zacks Consensus Estimate for 2018 earnings has moved up 10 4  to  3 29 in the past 90 days TerraForm Power delivered an average positive earnings surprise of 114 71  in the last four quarters  The Zacks Consensus Estimate for 2018 earnings has risen 76 cents in the past 60 days IDACORP posted an average positive earnings surprise of 4 98  in the trailing four quarters  The Zacks Consensus Estimate for 2018 earnings has inched up 0 23  to  4 19 over the past 60 days Wall Street s Next Amazon  NASDAQ AMZN Zacks EVP Kevin Matras believes this familiar stock has only just begun its climb to become one of the greatest investments of all time  It s a once in a generation opportunity to invest in pure genius ,2018-06-14,Zacks Investment Research,https://www.investing.com/analysis/alliant-energy-furthers-green-plans-partners-edf-renewables-200325331,200325331
157122,378638,NRG,Top 5 ROE Stocks To Buy As Trump Keeps Trade War Fears Alive,opinion,The on again off again trade war between the United States and China took a new turn when President Trump imposed a fresh salvo of tariffs worth  50 billion on Chinese imports last week  This followed an immediate retaliation by China  which promised to match the scale of the trade restrictions on a vast array of U S  goods  The flurry of events caused a mild slide in most of the benchmark indices as tensions brewed among the investor community Although overall economic sentiments appear bullish with improving wages and promising labor market conditions prompting Fed to increase the interest rates  domestic trade concerns appear far from over and are likely to weigh on the equity markets As investors employ a wait and see approach in a classic example of  backing and filling  in the market  they could benefit from  cash cow  stocks that garner higher returns However  singling out cash rich stocks alone does not make for a solid investment proposition unless they are backed by attractive efficiency ratios like return on equity  ROE   A high ROE ensures that the company is reinvesting its cash at a high rate of return ROE  A Key MetricROE   Net Income Shareholders  EquityROE helps investors distinguish profit generating companies from profit burners and is useful in determining the financial health of a company  In other words  this financial metric enables investors to identify stocks that diligently deploy cash for higher returns Moreover  ROE is often used to compare the profitability of a company with other firms in the industry   the higher  the better  It measures how well a company is multiplying its profits without investing new equity capital and portrays management s efficiency in rewarding shareholders with attractive risk adjusted returns Parameters Used for ScreeningIn order to shortlist stocks that are cash rich with high ROE  we have added Cash Flow greater than  1 billion and ROE more than X Industry as our primary screening parameters  In addition  we have taken a few other criteria into consideration to arrive at a winning strategy Price Cash Flow less than X Industry  This metric measures how much investors pay for one dollar of free cash flow  A lower ratio indicates that investors need to pay less for a better cash flow generating stock Return on Assets  ROA  greater than X Industry  This metric determines how much profit a company earns for every dollar of asset  which includes cash  accounts receivable  property  equipment  inventory and furniture  The higher the ROA  the better it is for the company 5 Year EPS Historical Growth greater than X Industry  This criterion indicates that continued earnings momentum has translated into solid cash strength    Zacks Rank less than or equal to 2  Zacks Rank  1  Strong Buy  or 2  Buy  stocks are known to outperform irrespective of the market environment Here are five of the 17 stocks that qualified the screen General Motors Company   NYSE GM    Founded in 1908  Detroit  MI based General Motors is a leading global automotive firm  The company is engaged in designing  building and selling cars  trucks  crossovers and automobile parts worldwide  The company has a trailing four quarter average positive earnings surprise of 18 4  and long term earnings growth expectation of 5 5   General Motors currently carries a Zacks Rank  2 Boston Scientific Corporation   NYSE BSX    Headquartered in Natick  MA and founded in 1979  Boston Scientific manufactures medical devices and products used in various interventional medical specialties worldwide  The company currently has a Zacks Rank  2  It has a trailing four quarter average positive earnings surprise of 2 4  and long term earnings growth expectation of 10 1  NRG Energy  Inc    NYSE NRG    NRG Energy is engaged in the production  sale and delivery of energy and energy products and services to residential  industrial and commercial consumers in major competitive power markets in the United States  It has financial and commercial headquarters in Princeton  NJ and operational headquarters in Houston  TX  This Zacks Rank  1 stock has a stellar trailing four quarter average positive earnings surprise of 507 9  AMC Networks Inc    NASDAQ AMCX    Headquartered in New York  AMC Networks is engaged in producing programming and movie content  and owns and operates various cable televisions  The company has a trailing four quarter average positive earnings surprise of 28 4  and long term earnings growth expectation of 7 7   AMC Networks currently carries a Zacks Rank  2  You can see  Celanese Corporation   NYSE CE    Texas based Celanese is a global hybrid chemical company with diverse products that rank either first or second in their respective markets  based on market share  This Zacks Rank  1 stock has a trailing four quarter average positive earnings surprise of 7  and long term earnings growth projection of 8 9  You can get the rest of the stocks on this list by signing up now for your 2 week free trial to the Research Wizard and start using this screen in your own trading  Further  you can also create your own strategies and test them first before taking the investment plunge  The Research Wizard is a great place to begin  It s easy to use  Everything is in plain language  And it s very intuitive  Start your Research Wizard trial today  And the next time you read an economic report  open up the Research Wizard  plug your finds in  and see what gems come out  Disclosure  Officers  directors and or employees of Zacks Investment Research may own or have sold short securities and or hold long and or short positions in options that are mentioned in this material  An affiliated investment advisory firm may own or have sold short securities and or hold long and or short positions in options that are mentioned in this material  Disclosure  Performance information for Zacks  portfolios and strategies are available at   Zacks Restaurant Recommendations  Inaddition to dining at these special places  you can feast on their stock shares  A Zacks Special Report spotlights 5 recent IPOs to watch plus 2 stocks that offer immediate promise in a booming sector ,2018-06-18,Zacks Investment Research,https://www.investing.com/analysis/top-5-roe-stocks-to-buy-as-trump-keeps-trade-war-fears-alive-200325774,200325774
157123,378639,NRG,Zacks com Featured Highlights Include  General Motors  Boston Scientific  Antero NRG  AMC And Celanese,opinion,For Immediate ReleaseChicago  IL   June 19  2018   Stocks in this week s article General Motors Company   NYSE GM    Boston Scientific Corp    NYSE BSX    Antero NRG Energy  Inc    NYSE NRG    AMC Networks Inc    NASDAQ AMCX   and Celanese Corp    NYSE CE   Top 5 ROE Stocks to Buy as Trump Keeps Trade War Fears AliveThe on again off again trade war between the United States and China took a new turn when President Trump imposed a fresh salvo of tariffs worth  50 billion on Chinese imports last week  This followed an immediate retaliation by China  which promised to match the scale of the trade restrictions on a vast array of U S  goods  The flurry of events caused a mild slide in most of the benchmark indices as tensions brewed among the investor community Although overall economic sentiments appear bullish with improving wages and promising labor market conditions prompting Fed to increase the interest rates  domestic trade concerns appear far from over and are likely to weigh on the equity markets As investors employ a wait and see approach in a classic example of  backing and filling  in the market  they could benefit from  cash cow  stocks that garner higher returns However  singling out cash rich stocks alone does not make for a solid investment proposition unless they are backed by attractive efficiency ratios like return on equity  ROE   A high ROE ensures that the company is reinvesting its cash at a high rate of return ROE  A Key MetricROE   Net Income Shareholders  EquityROE helps investors distinguish profit generating companies from profit burners and is useful in determining the financial health of a company  In other words  this financial metric enables investors to identify stocks that diligently deploy cash for higher returns Moreover  ROE is often used to compare the profitability of a company with other firms in the industry   the higher  the better  It measures how well a company is multiplying its profits without investing new equity capital and portrays management s efficiency in rewarding shareholders with attractive risk adjusted returns For the rest of this Screen of the Week article please visit Zacks com at  Disclosure  Officers  directors and or employees of Zacks Investment Research may own or have sold short securities and or hold long and or short positions in options that are mentioned in this material  An affiliated investment advisory firm may own or have sold short securities and or hold long and or short positions in options that are mentioned in this material About Screen of the WeekZacks com created the first and best screening system on the web earning the distinction as the   1 site for screening stocks  by Money Magazine   But powerful screening tools is just the start  That is why Zacks created the Screen of the Week to highlight profitable stock picking strategies that investors can actively use Strong Stocks that Should Be in the NewsMany are little publicized and fly under the Wall Street radar  They re virtually unknown to the general public  Yet today s 220 Zacks Rank  1  Strong Buys  were generated by the stock picking system that has more than doubled the market from 1988 through 2016  Its average gain has been a stellar  25  per year  Follow us on Twitter   Join us on Facebook  NASDAQ FB    Zacks Investment Research is under common control with affiliated entities  including a broker dealer and an investment adviser   which may engage in transactions involving the foregoing securities for the clients of such affiliates Contact  Jim GiaquintoCompany  Zacks comPhone  312 265 9268Email  Visit  Zacks com provides investment resources and informs you of these resources  which you may choose to use in making your own investment decisions  Zacks is providing information on this resource to you subject to the Zacks  Terms and Conditions of Service  disclaimer   Past performance is no guarantee of future results  Inherent in any investment is the potential for loss  This material is being provided for informational purposes only and nothing herein constitutes investment  legal  accounting or tax advice  or a recommendation to buy  sell or hold a security  No recommendation or advice is being given as to whether any investment is suitable for a particular investor  It should not be assumed that any investments in securities  companies  sectors or markets identified and described were or will be profitable  All information is current as of the date of herein and is subject to change without notice  Any views or opinions expressed may not reflect those of the firm as a whole  Zacks Investment Research does not engage in investment banking  market making or asset management activities of any securities  These returns are from hypothetical portfolios consisting of stocks with Zacks Rank   1 that were rebalanced monthly with zero transaction costs  These are not the returns of actual portfolios of stocks  The S P 500 is an unmanaged index  Visit  for information about the performance numbers displayed in this press release ,2018-06-18,Zacks Investment Research,https://www.investing.com/analysis/zackscom-featured-highlights-include-general-motors-boston-scientific-antero-nrg-amc-and-celanese-200326099,200326099
