,id,ticker,title,category,content,date,provider,url,article_id
200302,421818,BSX,VREX Or BSX  Which Is The Better Value Stock Right Now ,opinion,"Investors looking for stocks in the Medical   Products sector might want to consider either VAREX IMAGING  VREX  or Boston Scientific  BSX   But which of these two stocks is more attractive to value investors  We ll need to take a closer look to find out 
The best way to find great value stocks is to pair a strong Zacks Rank with an impressive grade in the Value category of our Style Scores system  The Zacks Rank is a proven strategy that targets companies with positive earnings estimate revision trends  while our Style Scores work to grade companies based on specific traits 
Right now  VAREX IMAGING is sporting a Zacks Rank of  2  Buy   while Boston Scientific has a Zacks Rank of  3  Hold   This system places an emphasis on companies that have seen positive earnings estimate revisions  so investors should feel comfortable knowing that VREX is likely seeing its earnings outlook improve to a greater extent  But this is only part of the picture for value investors 
Value investors also tend to look at a number of traditional  tried and true figures to help them find stocks that they believe are undervalued at their current share price levels 
Our Value category highlights undervalued companies by looking at a variety of key metrics  including the popular P E ratio  as well as the P S ratio  earnings yield  cash flow per share  and a variety of other fundamentals that have been used by value investors for years 
VREX currently has a forward P E ratio of 19 94  while BSX has a forward P E of 24 50  We also note that VREX has a PEG ratio of 1 99  This figure is similar to the commonly used P E ratio  with the PEG ratio also factoring in a company s expected earnings growth rate  BSX currently has a PEG ratio of 2 25 
Another notable valuation metric for VREX is its P B ratio of 2 32  The P B ratio is used to compare a stock s market value with its book value  which is defined as total assets minus total liabilities  For comparison  BSX has a P B of 5 73 
These are just a few of the metrics contributing to VREX s Value grade of A and BSX s Value grade of C 
VREX sticks out from BSX in both our Zacks Rank and Style Scores models  so value investors will likely feel that VREX is the better option right now ",2019-05-29,Zacks Investment Research,https://www.investing.com/analysis/vrex-or-bsx-which-is-the-better-value-stock-right-now-200426633,200426633
200307,421823,BSX,Boston Scientific  BSX  Q4 Earnings And Revenues Beat Estimates,opinion,"Boston Scientific  BSX  came out with quarterly earnings of  0 39 per share  beating the Zacks Consensus Estimate of  0 37 per share  This compares to earnings of  0 34 per share a year ago  These figures are adjusted for non recurring items 
This quarterly report represents an earnings surprise of 5 41   A quarter ago  it was expected that this medical device manufacturer would post earnings of  0 34 per share when it actually produced earnings of  0 35  delivering a surprise of 2 94  
Over the last four quarters  the company has surpassed consensus EPS estimates four times 
Boston Scientific  which belongs to the Zacks Medical   Products industry  posted revenues of  2 56 billion for the quarter ended December 2018  surpassing the Zacks Consensus Estimate by 0 11   This compares to year ago revenues of  2 41 billion  The company has topped consensus revenue estimates three times over the last four quarters 
The sustainability of the stock s immediate price movement based on the recently released numbers and future earnings expectations will mostly depend on management s commentary on the earnings call 
Boston Scientific shares have added about 6 8  since the beginning of the year versus the S P 500 s gain of 9 2  
What s Next for Boston Scientific 
While Boston Scientific has underperformed the market so far this year  the question that comes to investors  minds is  what s next for the stock 
There are no easy answers to this key question  but one reliable measure that can help investors address this is the company s earnings outlook  Not only does this include current consensus earnings expectations for the coming quarter s   but also how these expectations have changed lately 
Empirical research shows a strong correlation between near term stock movements and trends in earnings estimate revisions  Investors can track such revisions by themselves or rely on a tried and tested rating tool like the Zacks Rank  which has an impressive track record of harnessing the power of earnings estimate revisions 
Ahead of this earnings release  the estimate revisions trend for Boston Scientific was mixed  While the magnitude and direction of estimate revisions could change following the company s just released earnings report  the current status translates into a Zacks Rank  3  Hold  for the stock  So  the shares are expected to perform in line with the market in the near future  You can see the complete list of today s Zacks  1 Rank  Strong Buy  stocks here 
It will be interesting to see how estimates for the coming quarters and current fiscal year change in the days ahead  The current consensus EPS estimate is  0 37 on  2 54 billion in revenues for the coming quarter and  1 57 on  10 62 billion in revenues for the current fiscal year 
Investors should be mindful of the fact that the outlook for the industry can have a material impact on the performance of the stock as well  In terms of the Zacks Industry Rank  Medical   Products is currently in the top 42  of the 250 plus Zacks industries  Our research shows that the top 50  of the Zacks ranked industries outperform the bottom 50  by a factor of more than 2 to 1 ",2019-02-06,Zacks Investment Research,https://www.investing.com/analysis/boston-scientific-bsx-q4-earnings-and-revenues-beat-estimates-200384287,200384287
200308,421824,BSX,Company News For Feb 7  2019,opinion,Capri Holdings Ltd  s   NYSE CPRI   shares surged 11 3  after reporting third quarter fiscal 2019 adjusted earnings per share of  1 76  surpassing the Zacks Consensus Estimate of  1 57Shares of Boston Scientific Corp    NYSE BSX   climbed 2 7  after posting fourth quarter 2018 adjusted earnings per share of  0 39  beating the Zacks Consensus Estimate of  0 37General Motors Co    NYSE GM    shares gained 1 6  after the company posted fourth quarter 2018 adjusted earnings per share of  1 43  outpacing the Zacks Consensus Estimate of  1 21Shares of Snap Inc    NYSE SNAP   jumped 22  after the company reported fourth quarter 2018 adjusted loss per share of  0 04  narrower than the Zacks Consensus Estimate of a loss per share of  0 08,2019-02-06,Zacks Investment Research,https://www.investing.com/analysis/company-news-for-feb-7-2019-200384997,200384997
200309,421825,BSX,Boston Scientific  BSX  Up 1 9  Since Last Earnings Report  Can It Continue ,opinion,"A month has gone by since the last earnings report for Boston Scientific  BSX   Shares have added about 1 9  in that time frame  outperforming the S P 500 
Will the recent positive trend continue leading up to its next earnings release  or is Boston Scientific due for a pullback  Before we dive into how investors and analysts have reacted as of late  let s take a quick look at its most recent earnings report in order to get a better handle on the important catalysts  Boston Scientific Sees Growth In All Lines and Geographies in Q4Boston Scientific posted adjusted earnings per share  EPS  of 39 cents in the fourth quarter of 2018  up 14 7  from the year ago quarter  Earnings surpassed the Zacks Consensus Estimate of 37 cents  Further  adjusted EPS exceeded the company s guided range of 30 32 cents Reported EPS for the forth quarter was 27 cents in comparison with loss of 45 cents per share in the year ago quarter Full year adjusted EPS came in at  1 47  a 16 7  improvement from the year ago period  This also surpassed the Zacks Consensus Estimate of  1 39 as well as the company provided guidance of  1 38  1 40 Revenues in DetailRevenues in the fourth quarter were up 6 4  year over year on a reported basis  up 8 2  on an operational basis  at constant exchange rate or CER  and up 7  on an organic basis  adjusted for foreign currency fluctuations and certain recent acquisitions  to  2 56 billion  Revenues exceeded the Zacks Consensus Estimate by 0 11  For the year 2018  revenues were  9 82 billion  up 8 6  on a reported basis  up 8  on an operational basis and up 7 2  on an organic basis  In the fourth quarter  the company achieved 7  growth in the United States on a reported basis  same operationally   5 1  rise in Europe  Middle East and Africa region  up 9 2    up 5 2  in the Asia Pacific region  up 7 1    up 7 2  in Latin America and Canada  up 22 2   and up 16 8  in the emerging markets  up 27 2   Segment AnalysisBoston Scientific currently has three global reportable segments  Cardiovascular  Rhythm and Neuro and MedSurg The company generates maximum revenues from Cardiovascular  Sales from its subsegments   Interventional Cardiology and Peripheral Interventions   were  668 million  up 6 1  year over year organically  and  302 million  up 11 2    respectively in the fourth quarter Boston Scientific s Rhythm and Neuro business comprises Cardiac Rhythm Management  CRM   Electrophysiology and Neuromodulation  CRM reflected an 1 7  year over year increase in organic sales to  488 million in the reported quarter Electrophysiology sales went up 8  year over year organically to  81 million Neuromodulation sales rose 18 9  year over year organically to  220 million Other segments like Endoscopy and Urology and Pelvic Health  under the MedSurg broader group  recorded sales of  458 million  up 6 6  organically  and  342 million  up 5 6    respectively MarginsGross margin in the fourth quarter contracted 52 basis points  bps  year over year to 71 5  due to an 8 3  rise in cost of products sold  Adjusted operating margin contracted 117 bps to 22 4  in the reported quarter During the quarter  selling  general and administrative expenses went up 7 6  to  953 million and research and development expenses rose 9 1  to  288 million  Royalty expenses of  18 million remain in line with the previous quarter GuidanceBoston Scientific has provided a guidance for 2019  The company projects revenue growth in the range of 7 9  on a reported basis and around 7 8 5  on an organic basis  at CER  excluding contribution of approximately 110 bps from certain acquisitions with no prior period related net sales   The Zacks Consensus Estimate 2019 revenues is pegged at  10 62 billion The company expects adjusted 2019 EPS in the band of  1 53  1 58  The Zacks Consensus Estimate of  1 57 is within but near to the higher end of the guided band The company also provided its first quarter of 2019 financial outlook  It projects revenue growth in the range of 6 on a reported basis and around 7 on an organic basis   Adjusted EPS is expected in the band of 35 36 cents  The consensus mark for EPS stands at 37 cents while the same for revenues is at  2 54 billion 
How Have Estimates Been Moving Since Then 
In the past month  investors have witnessed a downward trend in fresh estimates 
VGM Scores
Currently  Boston Scientific has a poor Growth Score of F  however its Momentum Score is doing a bit better with a D  Charting a somewhat similar path  the stock was allocated a grade of C on the value side  putting it in the middle 20  for this investment strategy 
Overall  the stock has an aggregate VGM Score of F  If you aren t focused on one strategy  this score is the one you should be interested in 
Outlook
Estimates have been broadly trending downward for the stock  and the magnitude of these revisions indicates a downward shift  Notably  Boston Scientific has a Zacks Rank  3  Hold   We expect an in line return from the stock in the next few months ",2019-03-07,Zacks Investment Research,https://www.investing.com/analysis/boston-scientific-bsx-up-19-since-last-earnings-report-can-it-continue-200395834,200395834
200316,421832,BSX,Boston Scientific  BSX  To Buy Residual Shares Of Millipede,opinion,Following its purchase of a portion of Milipede earlier in 2018  Boston Scientific   NYSE BSX   has been exercising its option to buy the remaining stakes of this privately held developer of IRIS Transcatheter Annuloplasty Ring System for the treatment of severe mitral regurgitation  MR   This decision comes close on the heels of the recent successful completion of a first in human clinical study The deal is expected to close in the first quarter of 2019  subject to customary closing conditions Notably  in January 2018  Boston Scientific purchased  90 million of existing and newly issued Millipede shares  The company also kept an alternative to acquire the remaining interests in Millipede  for  325 million at closing with a  125 million payment becoming available  at any point of time prior to the closure of a first in human clinical study that meets certain parameters The acquisition will integrate Millipede s IRIS Transcatheter Annuloplasty Ring System in Boston Scientific s Structural Heart portfolio Post wrap up  the transaction is expected to be dilutive to Boston Scientific s adjusted earnings per share  EPS  for each of the next several years  However  the company expects this dilutive effect to be absorbed via internal trade offs  resulting in no net adjusted EPS impact Notably  MR occurs by a leaking mitral valve causing blood to regurgitate from the left ventricle to the left atrium of the heart  This condition can gradually trigger heart failure and heart rhythm problems  Patients with severe MR often complain of compromised heart functions and cannot tolerate open heart surgery for the repair or replacement of the leaking valve Management is optimistic about the large patient population in this space  which is unfortunately underserved at the moment  Hence  this area represents a lucrative market to tap into  The unattended patient population could benefit from a fully percutaneous transcatheter procedure that can fix the dilated mitral annulus and reduce regurgitation without undergoing surgery Encouragingly  the Millipede IRIS annuloplasty ring claims to be highly customizable to a specific patient s anatomy and disease state  This device is supplied via a transcatheter transseptal delivery system and follows the standard surgical approach to mend and decrease the size of a dilated mitral annulus On a positive note  the global transcatheter mitral valve replacement market is witnessing a stupendous CAGR of approximately 22  over the 2016 2020 period per the data provided by Technavio Share Price PerformanceOver the past year  shares of Boston Scientific have surged 39 9  versus the  s 4 9  decline Key PicksBoston Scientific currently carries a Zacks Rank  4  Sell  Some better ranked stocks in the broader medical space are Integer Holdings Corporation   NYSE ITGR    Surmodics  Inc    NASDAQ SRDX   and Veeva Systems   NYSE VEEV   Integer Holdings has an earnings growth rate of 31 2  for the first quarter of 2019  The stock has a Zacks Rank  2  Buy  Surmodics  long term earnings growth rate is projected at 10   The stock carries a Zacks Rank of 2 currently Veeva Systems  long term earnings growth rate is estimated at 19 5   The stock flaunts a Zacks Rank  1  Strong Buy  at present  You can see  Looking for Stocks with Skyrocketing Upside Zacks has just released a Special Report on the booming investment opportunities of legal marijuana Ignited by new referendums and legislation  this industry is expected to blast from an already robust  6 7 billion to  20 2 billion in 2021  Early investors stand to make a killing  but you have to be ready to act and know just where to look ,2018-12-30,Zacks Investment Research,https://www.investing.com/analysis/boston-scientific-bsx-to-buy-residual-shares-of-millipede-200371925,200371925
200317,421833,BSX,Boston Scientific Gains On Impressive Preliminary Q4 Results,opinion,Boston Scientific Corporation   NYSE BSX   recently announced preliminary revenue results for fourth quarter 2018  The company is slated to release its comprehensive financial results for the period on Feb 6 Boston Scientific projects an impressive fourth quarter performance and expects to meet the high end of its own expectations on the revenue front  Following this announcement  shares rallied 2 8  to reach  35 38 at yesterday s close In the to be reported quarter  Boston Scientific expects total revenue growth of 6 3   up 8 2  on operational basis after excluding the impact of foreign currency fluctuations  on a year over year basis to  2 56 billion  in line with the current Zacks Consensus Estimate  However  this meets the high end of the company s earlier provided revenue guidance of  2 525  2 565 billion  The solid top line is primarily expected on the back of growth across all of the company s segments and geographical regions Revenues in DetailOrganic revenue growth in the quarter  excluding the impact of changes in foreign currency exchange rates and sales from the buyouts of Symetis SA  NxThera  Claret Medical and Augmenix  with no prior year comparable sales  is approximately 7  year over year The company achieved 7  growth in the United States on a reported basis  same operationally   5 1  in Europe  Middle East and Africa region  up 9 2    5 2  in the Asia Pacific region  up 7 1    and 7 2  in Latin America and Canada  up 22 2   Segment AnalysisBoston Scientific currently has three global reportable segments  Cardiovascular  Rhythm and Neuro and MedSurg The company generates maximum revenues from Cardiovascular  Sales from its Interventional Cardiology subsegment were up 5 1  on a reported basis  up 7 6  operationally  on a year over year basis  Also  sales from the Peripheral Interventions business were up 9 3   up 11 4    in the fourth quarter Boston Scientific s Rhythm and Neuro business comprises Cardiac Rhythm Management  CRM   Electrophysiology and Neuromodulation  CRM reflected a 0 2  year over year increase  up 1 8   in the to be reported quarter Electrophysiology sales went up 6 4  year over year  up 8 1   Neuromodulation sales rose 18 1  year over year  up 19 1   Within other segments like Endoscopy and Urology and Pelvic Health  under the MedSurg broader group   sales rose 5 1  year over year  up 6 7   and 10 9  year over year  up 12 3    respectively While reporting financial results for the third quarter of fiscal 2018  Boston Scientific provided its business outlook for the fourth quarter of 2018  Adjusted earnings per share  EPS  are expected in the band of 30 32 cents  The consensus mark for EPS stands at 37 cents Share Price MovementBoston Scientific has consistently outperformed its  over the past three months  The stock has lost 2  compared with 10 7  decline of the industry Zacks Rank   Key PicksBoston Scientific carries a Zacks Rank  4  Sell  at present Some better ranked stocks in the broader medical space are Veeva Systems   NYSE VEEV    Surmodics  Inc    NASDAQ SRDX   and athenahealth  Inc    NASDAQ ATHN   Veeva Systems  long term earnings growth rate is estimated at 19 5   The stock flaunts a Zacks Rank  1  Strong Buy   You can see  Surmodics  long term earnings growth rate is projected at 10   The stock carries a Zacks Rank of 2  Buy  athenahealth s long term earnings growth rate is projected at 17 7   The stock carries a Zacks Rank of 2 Today s Stocks from Zacks  Hottest StrategiesIt s hard to believe  even for us at Zacks  But while the market gained  21 9  in 2017  our top stock picking screens have returned  115 0    109 3    104 9    98 6   and  67 1  And this outperformance has not just been a recent phenomenon  Over the years it has been remarkably consistent  From 2000   2017  the composite yearly average gain for these strategies has beaten the market more than 19X over  Maybe even more remarkable is the fact that we re willing to share their latest stocks with you without cost or obligation ,2019-01-09,Zacks Investment Research,https://www.investing.com/analysis/boston-scientific-gains-on-impressive-preliminary-q4-results-200373985,200373985
200318,421834,BSX,VREX Vs  BSX  Which Stock Is The Better Value Option ,opinion,"Investors with an interest in Medical   Products stocks have likely encountered both VAREX IMAGING  VREX  and Boston Scientific  BSX   But which of these two companies is the best option for those looking for undervalued stocks  Let s take a closer look 
The best way to find great value stocks is to pair a strong Zacks Rank with an impressive grade in the Value category of our Style Scores system  The Zacks Rank favors stocks with strong earnings estimate revision trends  and our Style Scores highlight companies with specific traits 
Currently  VAREX IMAGING has a Zacks Rank of  2  Buy   while Boston Scientific has a Zacks Rank of  3  Hold   This means that VREX s earnings estimate revision activity has been more impressive  so investors should feel comfortable with its improving analyst outlook  But this is just one piece of the puzzle for value investors 
Value investors also try to analyze a wide range of traditional figures and metrics to help determine whether a company is undervalued at its current share price levels 
The Value category of the Style Scores system identifies undervalued companies by looking at a number of key metrics  These include the long favored P E ratio  P S ratio  earnings yield  cash flow per share  and a variety of other fundamentals that help us determine a company s fair value 
VREX currently has a forward P E ratio of 20 61  while BSX has a forward P E of 23 43  We also note that VREX has a PEG ratio of 2 06  This metric is used similarly to the famous P E ratio  but the PEG ratio also takes into account the stock s expected earnings growth rate  BSX currently has a PEG ratio of 2 14 
Another notable valuation metric for VREX is its P B ratio of 2 46  The P B is a method of comparing a stock s market value to its book value  which is defined as total assets minus total liabilities  By comparison  BSX has a P B of 6 15 
These are just a few of the metrics contributing to VREX s Value grade of B and BSX s Value grade of C 
VREX stands above BSX thanks to its solid earnings outlook  and based on these valuation figures  we also feel that VREX is the superior value option right now ",2019-01-28,Zacks Investment Research,https://www.investing.com/analysis/vrex-vs-bsx-which-stock-is-the-better-value-option-200380471,200380471
