,id,ticker,title,category,content,date,provider,url,article_id
122907,344422,WHR,Household Appliances Industry s Near Term Outlook Lacks Spark,opinion,The  industry covers companies that manufacture and market home appliances and other related products  Household or domestic appliances include electrical and mechanical devices that support household functions like cooking  laundry or food preservation Companies in this industry manufacture refrigerators  washing machines  water coolers and heaters  microwave ovens  toasters and coffee makers  to name a few  These companies sell products through a network of mass merchandisers  retailers  distributors  dealers  and other retail outlets Let s take a look at the industry s three major themes      Higher spending on technology and innovation dents margins of companies operating in this space  Raw material cost inflation is another concern  Volatility in prices of raw materials  particularly steel  oil  plastic  resin  aluminum among others  is affecting the companies  performances  Additionally  higher tariffs on steel  which is a key raw material  have been bumping up operational costs  These factors have been eating into margins and overall profitability  For instance  leading home appliances maker  Whirlpool Corporation  NYSE WHR  expects 2019 results to be hurt by lower industry demand coupled with raw material and tariff inflation      In addition  softness in housing and construction activities might lead to lower demand for home appliances  Apparently  sales of new single family homes in the United States dropped 6 9  in April from the prior month  Moreover  sales of existing homes fell in the same period  However  analysts expect the Household Appliances Market to reach a worth of  763 45 billion globally by 2025  representing a CAGR of 5 4  in the 2018 2025 period      On the positive front  household appliances are gradually becoming more high tech  embedded with smart sensors and the Internet of things  IoT  enabled technology  In fact  technology is playing a major role in the field of electronics  As a result  industry players are largely investing in product innovation and Research   Development  R D  to make differentiated and convenient products  These companies are also committed toward manufacturing appliances that are a one stop solution for major household tasks  Additionally  appliance makers are installing smart grids  thermostats  digital inverter compressors and other monitoring sensors to make devices more energy efficient  These innovations can contribute significantly in boosting the top lines of these companies  Meanwhile  companies are resorting to higher pricing actions and cost productivity programs to boost margins and profitability Zacks Industry Rank Indicates Gloomy ProspectsThe Household Appliances industry is housed within the broader Zacks  sector  It carries a Zacks Industry Rank  223  which places it at the bottom 13  of more than 250 Zacks industries The group s   which is basically the average of the Zacks Rank of all the member stocks  indicates gloomy prospects in the near term  Our research shows that the top 50  of the Zacks ranked industries outperforms the bottom 50  by a factor of more than 2 to 1 The industry s position in the bottom 50  of the Zacks ranked industries is a result of negative earnings outlook for the constituent companies in aggregate  Looking at the aggregate earnings estimate revisions  it appears that analysts are gradually losing confidence in this group s earnings growth potential  In the past year  the industry s earnings estimate for the current year has gone down 16 5  Before we present a few stocks that you may want to consider for your portfolio  let s take a look at the industry s recent stock market performance and valuation picture Industry Lags in Terms of Shareholder ReturnsThe Zacks Household Appliances industry has underperformed the broader Consumer Discretionary sector and the S P 500 index over the past year Stocks in this industry have collectively lost 9 7   compared with the Consumer Discretionary sector s 4 2  decline  On the contrary  the S P 500 Composite has registered growth of 3 1  in the same period One Year Price PerformanceHousehold Appliances Industry s ValuationOn the basis of forward 12 month price to earnings  P E  ratio  a commonly used multiple for valuing Consumer Discretionary stocks  the industry is currently trading at 8 37X compared with the S P 500 s 16 67X  Further  the sector s forward 12 month P E ratio stands at 18 61X Over the last five years  the industry has traded as high as 13 34X  as low as 6 37X and at the median of 10 38X as the chart below shows Price to Earnings Ratio  Past 5 Years Bottom LineWhile product launches and innovation along with upgraded technologies act as key catalysts for the industry  higher raw material costs are a major deterrent  Moreover  higher investments and tariff inflation might show on companies  margins and profitability  Furthermore  a slowdown in housing and construction activities will probably affect demand for household appliances  An unimpressive Zacks Industry Rank also signifies bleak prospects While none of the stocks in the Household Appliances industry currently sports a Zacks Rank  1  Strong Buy   we suggest holding on to the following stocks with a Zacks Rank  3  Hold   You can see  Whirlpool Corporation  WHR   This Benton Harbor  MI based home appliances  leader has gained 25 4  in the past six months  Further  the Zacks Consensus Estimate for its current year earnings per share has been revised 0 7  upward in the past 60 days Price and Consensus  WHRHowden Joinery Group Plc  HWDJY   The consensus earnings estimate for this London based company has been stable for the current year in the past 30 days  The company has advanced 23 4  in the past six months Price and Consensus  HWDJYAB Electrolux  ELUXY   This Swedish home appliance manufacturer has gained 17 8  in the past three months  The Zacks Consensus Estimate for 2019 earnings has been steady over the past 30 days Price and Consensus  ELUXYBreakout Biotech Stocks with Triple Digit Profit PotentialThe biotech sector is projected to surge beyond  775 billion by 2024 as scientists develop treatments for thousands of diseases  They re also finding ways to edit the human genome to literally erase our vulnerability to these diseases Zacks has just released Century of Biology  7 Biotech Stocks to Buy Right Now to help investors profit from 7 stocks poised for outperformance  Our recent biotech recommendations have produced gains of  98    119  and  164  in as little as 1 month  The stocks in this report could perform even better ,2019-06-17,Zacks Investment Research,https://www.investing.com/analysis/household-appliances-industry39s-nearterm-outlook-lacks-spark-200432582,200432582
122908,344423,WHR,Whirlpool  WHR  Earnings Expected To Grow  Should You Buy ,opinion,"Wall Street expects a year over year increase in earnings on lower revenues when Whirlpool  WHR  reports results for the quarter ended June 2019  While this widely known consensus outlook is important in gauging the company s earnings picture  a powerful factor that could impact its near term stock price is how the actual results compare to these estimates 
The earnings report  which is expected to be released on July 22  2019  might help the stock move higher if these key numbers are better than expectations  On the other hand  if they miss  the stock may move lower 
While management s discussion of business conditions on the earnings call will mostly determine the sustainability of the immediate price change and future earnings expectations  it s worth having a handicapping insight into the odds of a positive EPS surprise 
Zacks Consensus Estimate
This maker of Maytag  KitchenAid and other appliances is expected to post quarterly earnings of  3 78 per share in its upcoming report  which represents a year over year change of  18 1  
Revenues are expected to be  4 90 billion  down 4 6  from the year ago quarter 
Estimate Revisions Trend
The consensus EPS estimate for the quarter has remained unchanged over the last 30 days  This is essentially a reflection of how the covering analysts have collectively reassessed their initial estimates over this period 
Investors should keep in mind that an aggregate change may not always reflect the direction of estimate revisions by each of the covering analysts 
Price  Consensus and EPS Surprise

Earnings Whisper
Estimate revisions ahead of a company s earnings release offer clues to the business conditions for the period whose results are coming out  Our proprietary surprise prediction model    the Zacks Earnings ESP  Expected Surprise Prediction     has this insight at its core 
The Zacks Earnings ESP compares the Most Accurate Estimate to the Zacks Consensus Estimate for the quarter  the Most Accurate Estimate is a more recent version of the Zacks Consensus EPS estimate  The idea here is that analysts revising their estimates right before an earnings release have the latest information  which could potentially be more accurate than what they and others contributing to the consensus had predicted earlier 
Thus  a positive or negative Earnings ESP reading theoretically indicates the likely deviation of the actual earnings from the consensus estimate  However  the model s predictive power is significant for positive ESP readings only 
A positive Earnings ESP is a strong predictor of an earnings beat  particularly when combined with a Zacks Rank  1  Strong Buy   2  Buy  or 3  Hold   Our research shows that stocks with this combination produce a positive surprise nearly 70  of the time  and a solid Zacks Rank actually increases the predictive power of Earnings ESP 
Please note that a negative Earnings ESP reading is not indicative of an earnings miss  Our research shows that it is difficult to predict an earnings beat with any degree of confidence for stocks with negative Earnings ESP readings and or Zacks Rank of 4  Sell  or 5  Strong Sell  
How Have the Numbers Shaped Up for Whirlpool 
For Whirlpool  the Most Accurate Estimate is lower than the Zacks Consensus Estimate  suggesting that analysts have recently become bearish on the company s earnings prospects  This has resulted in an Earnings ESP of  3 70  
On the other hand  the stock currently carries a Zacks Rank of  3 
So  this combination makes it difficult to conclusively predict that Whirlpool will beat the consensus EPS estimate 
Does Earnings Surprise History Hold Any Clue 
Analysts often consider to what extent a company has been able to match consensus estimates in the past while calculating their estimates for its future earnings  So  it s worth taking a look at the surprise history for gauging its influence on the upcoming number 
For the last reported quarter  it was expected that Whirlpool would post earnings of  3 04 per share when it actually produced earnings of  3 11  delivering a surprise of  2 30  
Over the last four quarters  the company has beaten consensus EPS estimates three times 
Bottom Line
An earnings beat or miss may not be the sole basis for a stock moving higher or lower  Many stocks end up losing ground despite an earnings beat due to other factors that disappoint investors  Similarly  unforeseen catalysts help a number of stocks gain despite an earnings miss 
That said  betting on stocks that are expected to beat earnings expectations does increase the odds of success  This is why it s worth checking a company s Earnings ESP and Zacks Rank ahead of its quarterly release  Make sure to utilize our Earnings ESP Filter to uncover the best stocks to buy or sell before they ve reported 
Whirlpool doesn t appear a compelling earnings beat candidate  However  investors should pay attention to other factors too for betting on this stock or staying away from it ahead of its earnings release ",2019-07-14,Zacks Investment Research,https://www.investing.com/analysis/whirlpool-whr-earnings-expected-to-grow-should-you-buy-200439818,200439818
122909,344424,WHR,Whirlpool  WHR  Beats Q2 Earnings And Revenue Estimates,opinion,"Whirlpool  WHR  came out with quarterly earnings of  4 01 per share  beating the Zacks Consensus Estimate of  3 80 per share  This compares to earnings of  3 20 per share a year ago  These figures are adjusted for non recurring items 
This quarterly report represents an earnings surprise of 5 53   A quarter ago  it was expected that this maker of Maytag  KitchenAid and other appliances would post earnings of  3 04 per share when it actually produced earnings of  3 11  delivering a surprise of 2 30  
Over the last four quarters  the company has surpassed consensus EPS estimates four times 
Whirlpool  which belongs to the Zacks Household Appliances industry  posted revenues of  5 19 billion for the quarter ended June 2019  surpassing the Zacks Consensus Estimate by 5 17   This compares to year ago revenues of  5 14 billion  The company has topped consensus revenue estimates just once over the last four quarters 
The sustainability of the stock s immediate price movement based on the recently released numbers and future earnings expectations will mostly depend on management s commentary on the earnings call 
Whirlpool shares have added about 38 7  since the beginning of the year versus the S P 500 s gain of 18 7  
What s Next for Whirlpool 
While Whirlpool has outperformed the market so far this year  the question that comes to investors  minds is  what s next for the stock 
There are no easy answers to this key question  but one reliable measure that can help investors address this is the company s earnings outlook  Not only does this include current consensus earnings expectations for the coming quarter s   but also how these expectations have changed lately 
Empirical research shows a strong correlation between near term stock movements and trends in earnings estimate revisions  Investors can track such revisions by themselves or rely on a tried and tested rating tool like the Zacks Rank  which has an impressive track record of harnessing the power of earnings estimate revisions 
Ahead of this earnings release  the estimate revisions trend for Whirlpool was mixed  While the magnitude and direction of estimate revisions could change following the company s just released earnings report  the current status translates into a Zacks Rank  3  Hold  for the stock  So  the shares are expected to perform in line with the market in the near future  You can see the complete list of today s Zacks  1 Rank  Strong Buy  stocks here 
It will be interesting to see how estimates for the coming quarters and current fiscal year change in the days ahead  The current consensus EPS estimate is  3 72 on  4 99 billion in revenues for the coming quarter and  14 75 on  20 09 billion in revenues for the current fiscal year 
Investors should be mindful of the fact that the outlook for the industry can have a material impact on the performance of the stock as well  In terms of the Zacks Industry Rank  Household Appliances is currently in the top 40  of the 250 plus Zacks industries  Our research shows that the top 50  of the Zacks ranked industries outperform the bottom 50  by a factor of more than 2 to 1 ",2019-07-22,Zacks Investment Research,https://www.investing.com/analysis/whirlpool-whr-beats-q2-earnings-and-revenue-estimates-200442791,200442791
122948,344463,WHR,Whirlpool  WHR  Down 5 3  Since Last Earnings Report  Can It Rebound ,opinion,"A month has gone by since the last earnings report for Whirlpool  WHR   Shares have lost about 5 3  in that time frame  underperforming the S P 500 
Will the recent negative trend continue leading up to its next earnings release  or is Whirlpool due for a breakout  Before we dive into how investors and analysts have reacted as of late  let s take a quick look at the most recent earnings report in order to get a better handle on the important catalysts  Whirlpool Q1 Earnings Surpass Estimates   Rise Y YWhirlpool reported mixed first quarter 2019 results  wherein earnings outpaced the Zacks Consensus Estimate but sales missed the same  Notably  this marked the company s third consecutive quarter of positive earnings surprise  with eighth straight sales miss Effective implementation of price increase  margin expansion and cost containment efforts fueled bottom line growth  Also  robust margin growth at the company s North America segment despite sluggish industry demand and higher costs aided the quarterly performance  Furthermore  management raised the GAAP earnings view for 2019 Whirlpool delivered adjusted earnings of  3 11 per share  which outpaced the Zacks Consensus Estimate of  3 04  The bottom line also increased 10 7  from  2 81 per share earned in the year ago quarter  On a GAAP basis  the company reported earnings of  7 31 per share  significantly up from  1 30 in the prior year quarter  This upside was mainly driven by gains from certain tax related items Net sales were  4 760 million  down 3 1  from the year ago period number  The top line also lagged the Zacks Consensus Estimate of  4 884 million  This underperformance can be attributed to sales declines across all of the company s segments  except for the North America division  On a currency neutral basis  the metric grew 1  Adjusted operating profit  EBIT  inched up about 1  to  298 million from  295 million in the year ago quarter  Also  operating margin expanded 30 basis points  bps  to 6 3   driven by favorable product price mix and restructuring benefits  Growth was somewhat offset by cost inflation  lower unit volume and adverse currency Regional PerformanceSales from North America remained flat at  2 5 billion while the same grew 1 1  on a currency neutral basis  Operating profit margin expanded 90 bps to 12 3   primarily backed by favorable product price mix that was partly negated by higher costs and decline in unit volume  In dollar terms  operating profit increased 8 3  to  312 million Sales from Latin America declined 2 6  year over year to  875 million  However  excluding currency translations  the metric grew 6 7   Operating margin of 5 1  contracted 120 bps mainly due to adverse currency  which was offset by higher unit volume and favorable product price mix  In dollar terms  operating income decreased 21 1  to  45 million Sales from EMEA declined 9 1  to  1 billion  Nonetheless  the metric inched up 1 6  on a currency neutral basis  Whirlpool incurred operating loss of  21 million in the first quarter compared with operating loss of  27 million in the year ago quarter  Decline in production levels and inventory liquidation charges in Turkey hurt the segment s performance  This was partly compensated by higher unit volume and gains from restructuring Sales from Asia fell 17 2  to  371 million from the prior year quarter figure  Excluding currency effects  the metric declined 11 5   Further  the segment reported operating profit of  7 million  which plunged 63 2  from the year ago period  Also  operating margin contracted 230 bps to 1 9  as gains from favorable product price mix was more than offset by decline in unit volume and adverse productivity in China Financial PositionWhirlpool had cash and cash equivalents of  1 163 million as of Mar 31  2019  and long term debt of  4 137 million  During the first three months of 2019  the company used  895 million in cash in operating activities and reported negative free cash flow of  969 million  Meanwhile  it incurred capital expenditure of  85 million in the first quarter Furthermore  Whirlpool bought back shares worth  50 million and paid dividends of  73 million in the first quarter  It also announced a 4 3  hike in the quarterly dividend to  1 20 per share  Management plans to buy back shares throughout the remainder of the year 2019 GuidanceWhirlpool continues to envision adjusted earnings per share of  14  15 compared with  15 16 earned in 2018  However  on a GAAP basis  it now anticipates earnings of  14 05  15 05 per share  up from the prior projection of  12 75  13 75  Markedly  the GAAP guidance includes restructuring costs of about  100 million and divestiture related transition expenses of roughly  23 million as well as gains from Brazil indirect tax credit of  127 million For 2019  the company continues to expect operating cash flow of  1 4  1 5 billion and free cash flow of  800  900 million 
How Have Estimates Been Moving Since Then 
In the past month  investors have witnessed an upward trend in fresh estimates 
VGM Scores
At this time  Whirlpool has a subpar Growth Score of D  a grade with the same score on the momentum front  However  the stock was allocated a grade of B on the value side  putting it in the top 40  for this investment strategy 
Overall  the stock has an aggregate VGM Score of D  If you aren t focused on one strategy  this score is the one you should be interested in 
Outlook
Estimates have been broadly trending upward for the stock  and the magnitude of these revisions looks promising  Notably  Whirlpool has a Zacks Rank  3  Hold   We expect an in line return from the stock in the next few months ",2019-05-21,Zacks Investment Research,https://www.investing.com/analysis/whirlpool-whr-down-53-since-last-earnings-report-can-it-rebound-200423849,200423849
