,id,ticker,title,category,content,date,provider,url,article_id
174158,395674,WDC,Toshiba  Western Digital nearing deal over chip unit sale dispute  media,news,"TOKYO  Reuters    Toshiba Corp  T 6502  and  Western Digital  Corp  O WDC  are close to settling a legal dispute that has threatened to become a major stumbling block in the embattled Japanese conglomerate s plans to sell its  18 billion semiconductor unit  media reported  Toshiba agreed in September to sell the unit  the world s second biggest producer of NAND chips  to a consortium led by Bain Capital LP and including South Korean chipmaker SK Hynix  KS 000660   But Western Digital  Toshiba s chip joint venture partner and jilted suitor in the auction of the unit  argues that no deal can proceed without its consent and is seeking an injunction and a ruling from the International Court of Arbitration  Jiji news agency reported that while Toshiba and Western Digital have agreed to work towards a settlement  the amount of influence that SK Hynix will exert over the chip unit remains a sticking point between Bain and Western Digital   Bloomberg news reported  citing people familiar with the matter  that the two sides were close to an agreement and that the U S  firm would drop its efforts to block the deal in exchange for an extension of their joint venture agreements  Toshiba is always open to a settlement with Western Digital although nothing concrete has been decided  a spokeswoman for the company said  A representative for Western Digital was not immediately available for comment outside regular business hours  Toshiba s shares were up 2 percent in early afternoon trade on Friday  
Toshiba  which needs to sell the unit to cover billions of dollars in liabilities at its bankrupt U S  nuclear reactor maker Westinghouse  gained more negotiating power in its talks with Western Digital after arranging a  5 4 billion new share issue to more than 30 overseas investors ",2017-12-01,Reuters,https://www.investing.com/news/stock-market-news/toshiba-western-digital-to-settle-dispute-bloomberg-938206,938206
174159,395675,WDC,Toshiba  Western Digital aiming to settle chip dispute next week  sources,news,"By Makiko Yamazaki TOKYO  Reuters    Toshiba Corp  T 6502  and  Western Digital  Corp  O WDC  have agreed in principle to settle a dispute over the Japanese firm s plans to sell its  18 billion chip unit and aim to have a final agreement in place next week  sources familiar with the matter said  The board of the embattled Japanese conglomerate approved a framework for a settlement on Wednesday  one of the sources said  The potential for Western Digital   Toshiba s partner in its main semiconductor plant and jilted suitor in the auction   to block a deal has been seen as the main obstacle to the planned sale of the unit to a Bain Capital led consortium  The settlement under discussion calls for Western Digital to drop arbitration claims seeking to stop the sale in exchange for Toshiba allowing it to invest in a new production line for advanced flash memory chips that is slated to start next year  two sources said  All sources declined to be identified as they were not authorized to speak to the media  A Toshiba spokesman said that while the company was open to a settlement  it would not disclose discussion specifics or details of board of directors meetings   It is not a fact that we have reached an agreement with Western Digital   he said  Western Digital declined to comment  Toshiba was forced to put the unit   the world s no  2 producer of NAND chips   on the block to cover billions of dollars in liabilities arising from its now bankrupt U S  nuclear power unit Westinghouse  The deal with the Bain led consortium will  however  see it reinvest in the unit and together with Hoya Corp  T 7741   a maker of parts for chip devices  Japanese firms will hold more than 50 percent of the business   a keen wish of the Japanese government  DEAL DETAILS As part of the planned settlement  Toshiba and Western Digital would extend existing agreements for their chip joint ventures in Yokkaichi  central Japan  one of the sources said  The current agreements are set to start expiring from 2021  Western Digital would also invest in a completely new chip plant that Toshiba will start building next year in northern Japan  the source said  Western Digital  one of world s leading makers of hard disk drives  paid some  16 billion last year to acquire SanDisk  Toshiba s chip joint venture partner since 2000   With data storage key to most next generation technologies from artificial intelligence and autonomous driving to the Internet of Things  NAND chips have only grown in importance and Western Digital has been desperate to keep the business out of the hands of rival chipmakers  South Korean chipmaker SK Hynix s  KS 000660  participation in the Bain consortium has infuriated Western Digital and a key sticking point in recent weeks has been how to ensure it will be blocked from accessing proprietary information that belongs to the chip unit  separate sources have previously said  While it was not immediately clear if this issue had been completely resolved  one of the sources said agreements on aspects that had been under contention were  not far off   Toshiba gained the upper hand in negotiations with Western Digital after securing a  5 4 billion cash injection from overseas funds that will allow it to bolster its balance sheet before the end of March and avoid a delisting  
The sale still needs to clear regulatory reviews but they are not expected to scuttle the deal ",2017-12-08,Reuters,https://www.investing.com/news/stock-market-news/toshiba-western-digital-aiming-to-settle-chip-dispute-next-week-sources-968805,968805
174175,395691,WDC,Western Digital  WDC  Surges  Stock Moves 6 7  Higher,opinion,Western Digital Corp    NASDAQ WDC   was a big mover last session  as the company saw its shares rise nearly 7  on the day  The move came on solid volume too with far more shares changing hands than in a normal session  This breaks the recent trend of the company  as the stock is now trading above the volatile price range of  35 65 to  40 03 in the past one month time frame The company reported its second quarter fiscal 2019 results  ended Dec 28  2018  that missed analyst expectations  However  the upside was perhaps driven by expectations that the company s top line may improve in the upcoming quarters  courtesy of cost and expense restructuring actions    The company has seen three negative estimate revisions in the past few weeks  while its Zacks Consensus Estimate for the current quarter has also moved lower over the past few weeks  suggesting there may be trouble down the road  So make sure to keep an eye on this stock going forward  to see if this recent move higher can last Western Digital currently has a Zacks Rank  5  Strong Sell  while its  is negative Western Digital Corp  Price   A better ranked stock in the Computer   Storage Devices industry is Pure Storage  Inc    NYSE PSTG    which currently carries a Zacks Rank  1  Strong Buy   You can see  Is WDC going up  Or down  Predict to see what others think  Up or DownThe Hottest Tech Mega Trend of AllLast year  it generated  8 billion in global revenues  By 2020  it s predicted to blast through the roof to  47 billion  Famed investor Mark Cuban says it will produce  the world s first trillionaires   but that should still leave plenty of money for regular investors who make the right trades early ,2019-01-24,Zacks Investment Research,https://www.investing.com/analysis/western-digital-wdc-surges-stock-moves-67-higher-200379410,200379410
174176,395692,WDC,Western Digital Up 10  After Missing Earnings,opinion,"Summary 

Western Digital Corporation  NASDAQ WDC  rose by 12  at one point  after posting earnings even after missing Wall Street expectations 
The stock s market cycles and recent momentum provide positive indicators will likely push it even higher in the near term 


The data storage producer reported earnings of  1 45 per share and revenue of  4 23 billion  below analyst estimates of  1 50 and  4 26 billion  With respect to the current quarter  management expects earnings of  0 40 0 60 and revenue of  3 60 3 80  which were below expectations 
Nonetheless  CEO Steve Milligan sees revenue improving in the second half of 2019 and announced the firm s intention to cut costs   We are taking actions to right size our factory production while ensuring we are maintaining our competitiveness and technology leadership  
Our analysis of the stock s market cycles shows that it is in the rising phase of its current cycle  However  today s move brought it to resistance  as shown on the weekly chart on the left  On the right  the gap up and positive momentum suggest near term higher prices  with a target of  48 51 ",2019-01-25,Steve Miller,https://www.investing.com/analysis/western-digital-pops-10-after-missing-earnings-200379688,200379688
174191,395707,WDC,Western Digital will not drop merger objections in Toshiba talks  CEO,news,"By Stephen Nellis  Reuters     Western Digital  Corp  NASDAQ WDC  on Thursday refused demands from Toshiba Corp that it drop a set of legal rights it believes would allow the company to block Toshiba s  18 billion sale of its memory chip unit to SK Hynix as part of negotiations over a joint chip investment between Toshiba and Western Digital  Because of the impasse over the terms  Western Digital does not believe it will take part in a coming round of investment in Toshiba s so called Fab 6 chip factory in Yokkaichi  Japan  Western Digital Chief Executive Officer Steve Milligan made the comments on an investor call for the fiscal first quarter  The company posted a net income of  681 million  or  2 23 per share  in the first quarter ended Sept  29  compared with a net loss of  366 million  or  1 28 per share  a year earlier  Shares were down 2 2 percent after hours at  87 40  After a long  contentious auction  Toshiba agreed last month to sell its prized chip unit to a consortium led by Bain Capital LP  overcoming a hurdle as it scrambles for funds to cover billions of dollars in liabilities arising from its now bankrupt U S  nuclear unit Westinghouse  Western Digital  which became Toshiba s chip venture partner with its acquisition of SanDisk last year  has sought an injunction with the International Court of Arbitration  arguing that any deal will need its consent  While the conflict over the merger plays out  Toshiba has moved forward with plans to invest in its new Fab 6 facility  Toshiba made an initial  1 7 billion investment in the factory this year  a move Western Digital is contesting in an arbitration proceeding because it believes it was entitled to participate  This month  Toshiba said it was in discussions for a second   980 million round of investment in the facility  Milligan revealed some details of those negotiations on Western Digital s investor call   We will not agree to terms such as SanDisk unilaterally waiving or negating its consent rights as a condition to participate  which is what Toshiba has proposed  Consequently  at this time  we are not confident that an agreement would be reached on this next investment tranche either   Milligan said  
Toshiba did not immediately respond for a request for comment  But both Toshiba and Bain Capital LP  SK Hynix s financial backer in the merger  have repeatedly said believe Western Digital s consent rights are limited and do not give it the power to stop a deal ",2017-10-26,Reuters,https://www.investing.com/news/stock-market-news/western-digital-will-not-drop-merger-objections-in-toshiba-talks-ceo-548863,548863
174192,395708,WDC,Western Digital forecasts quarterly revenue below estimates,news,By Sonam Rai  Reuters    Data storage device maker  Western Digital  Corp  NASDAQ WDC  on Thursday forecast current quarter revenue below analysts  estimates  and said it would not agree to partner Toshiba s terms to participate in a new chip production unit  The company s shares were down 2 1 percent at  87 50 in after hours trading  They have surged 31 5 percent this year  Western Digital has sought an injunction against Toshiba Corp s sale of its chip unit to a group led by Bain Capital LP that includes the U S  company s rivals Seagate and SK Hynix Inc  Toshiba said earlier this month it was discussing joint investment in a new chip production line  Fab 6  with Western Digital as it looks to repair the relationship  However  Western Digital said on Thursday it would not agree to Toshiba s terms of waiving consent rights that will help it block the deal as a condition to participate in the joint investment   At this time  we are not confident that an agreement would be reached on this next investment tranche either   said Chief Executive Stephen Milligan on a post earnings call   The wrangling has worried investors over Western Digital  s ability to access crucial NAND chips supply  Milligan allayed such concerns during the call   Based on the JV agreements  we remain confident in our planned supply bid growth rate of 35 percent to 45 percent for calendar 2018 and calendar 2019  irrespective of these initial investments in Fab 6   said Milligan  Western Digital said it expected second quarter revenue of  5 2 billion to  5 3 billion and adjusted earnings of  3 60 per share to  3 70 per share  Analysts on average were expecting earnings of  3 51 per share and revenue of  5 33 billion  according to Thomson Reuters I B E S  Western Digital beat analysts  estimates for revenue and profit in the first quarter as it benefited from strong demand for its memory chips from smartphone makers and data center operators as well as higher prices  NAND pricing has been stable for last two months and there would be excess demand at least for the second quarter and that should support margins  said Benchmark Co analyst Mark Miller   Western Digital posted a net income of  681 million  or  2 23 per share  in the first quarter ended Sept  29  compared with a net loss of  366 million  or  1 28 per share  a year earlier  Excluding items  the company earned  3 56 cents per share  Net revenue rose 9 9 percent to  5 18 billion   Analysts on average had expected earnings of  3 29 per share and revenue of  5 14 billion ,2017-10-26,Reuters,https://www.investing.com/news/stock-market-news/western-digital-forecasts-quarterly-revenue-below-estimates-548781,548781
174193,395709,WDC,Filing  Comcast settled Sprint patent claims for  250M,news,Comcast  CMCSA  0 8   settled a patent infringement case from Sprint  S  0 9   for  250M  according to its 10 Q filing  In a Contingencies section  the filing notes the original lawsuit filed in December 2011 alleged that Comcast Digital Voice and Xfinity Voice infringed 12 Sprint patents  In the years since  some of the claims were resolved  Comcast says it entered into a settlement Oct  16 and took a charge of  250M in Q3 in connection with the case  Sprint had been seeking nearly  1B in damages  Now read ,2017-10-27,Seeking Alpha,https://www.investing.com/news/stock-market-news/filing-comcast-settled-sprint-patent-claims-for-250m-549394,549394
174194,395710,WDC,Samsung appoints new CFO amid organizational changes,news,Samsung Electronics  KS 005930   OTC SSNNF  OTC SSNLF  appoints Roh Hee chan as its new CFO after appointing a slate of new top managers earlier in the week                Roh previously served as the CFO of Samsung Display                    Samsung Electronics also plans to establish a new organizational body to streamline communications between the main company and affiliates like Samsung SDI                       The previous organizational body was disbanded early this year amid the scandal leading to the arrest  and later bribery conviction  of Vice Chairman Jay Y  Lee     Previously  More record profits at Samsung Electronics  Oct  31 Now read ,2017-11-02,Seeking Alpha,https://www.investing.com/news/stock-market-news/samsung-appoints-new-cfo-amid-organizational-changes-762998,762998
174195,395711,WDC,Chip boom drives Toshiba profit surge  raises questions about future earnings,news,"By Makiko Yamazaki TOKYO  Reuters    Japan s Toshiba Corp  T 6502  reported a 76 percent jump in second quarter operating profit on Thursday  driven almost entirely by a strong performance from its memory chip unit which it recently agreed to sell for  18 billion  The robust results on the back of soaring demand for chips used in smartphones and data center servers underscore the difficulty Toshiba will face in generating substantial earnings once the unit   the world s No  2 producer of NAND flash memory semiconductors   is sold  Toshiba  desperate for funds to cover liabilities arising from it U S  nuclear unit Westinghouse  agreed in late September to sell Toshiba Memory to a group led by Bain Capital  although under the deal it plans to repurchase 40 percent of the business  Operating profit for July September jumped to 135 billion yen   1 2 billion   its best ever result for a second quarter and beating a consensus estimate of 125 billion yen  Its chips and devices division accounted for 97 percent of that profit   We are aware that the proportion of the memory chip business in our overall profit is extremely high   Chief Finiancial Officer Masayoshi Hirata told an earnings briefing  But he added that earnings from the conglomerate s energy and social infrastructure businesses were expected to improve as the company  has tightened risk control over the past year to focus on profits instead of scale   Hirata also said Toshiba may look at completely withdrawing from loss making operations that have already been scaled back such as its TV and personal computer businesses  The struggling conglomerate  which has spent most of the past year in financial crisis  still faces a slew of risks including the likelihood that the sale of the chip unit may not close before the end of the financial year in March as regulatory reviews usually take at least six months  If it doesn t get the deal done in time  it could end the year in negative net worth for a second year in a row  putting pressure on the Tokyo Stock Exchange to delist it  Hirata stressed  however  that Toshiba was making preparations in case the deal did not close by end March  saying it had  launched a working group to consider various measures  to raise capital  The deal also faces legal challenges from estranged business partner  Western Digital   O WDC   which argues no deal can proceed without its consent  LNG WOES Another key concern for Toshiba investors has been its 20 year contract to buy liquefied natural gas from Freeport LNG in Texas  a deal it struck as part of a plan to sweeten sales of turbines for power plants   Amid a plunge in Asian gas prices  it must find buyers for the LNG or pay a fixed gas processing fee to Freeport of about  370 million per year for the life of the contract  which begins in 2019   Hirata said that Toshiba could be hit with a charge of 200 billion yen   1 8 billion  in relation to the contract if oil prices stay at current levels  While that is quite a big hit  it is much less than some analysts  speculation of billions of dollars in charges if no buyers are found  Toshiba maintained its full year operating profit forecast of 430 billion yen  of which 419 4 billion yen would come from memory chips  As flagged last month  the company said it expects an annual net loss of 110 billion yen due to taxes related to the sale of the memory chip unit  That does not reflect expected gains from the 2 trillion yen sale as the deal has yet to receive regulatory approval   Toshiba also said it would boost investment in the chip business this financial year to 600 billion yen from a previous plan of 400 billion yen  mainly to speed up the installation of a memory chip production line  The global chip market boom has boosted demand for chip producing equipment to the extent that equipment manufacturers are telling Toshiba to book orders early or will not be able to get the equipment in time  Hirata said  
  1   113 5400 yen ",2017-11-09,Reuters,https://www.investing.com/news/stock-market-news/chip-boom-drives-toshiba-profit-surge-raises-questions-about-future-earnings-840880,840880
174196,395712,WDC,Toshiba will sell TV unit to Hisense for  113 6M,news,Toshiba  OTCPK TOSBF  OTCPK TOSYY  will sell its TV unit to Hisense for  113 6M  according to Nikkei Asian Review                    Toshiba will retain a 5  stake in Toshiba Visual Solutions after the sale                    The company needs to divest businesses adding to its overall losses as it faces a potential delisting due to a bankrupt energy business  The TV unit had over  103M in losses as of last March                Toshiba has selected a seller for its chip unit  and the deal would keep the company afloat and listed  But the chip sale still faces regulatory hurdles and  Western Digital   NASDAQ WDC  lawsuits  And the departing unit would also take along most of Toshiba s profits       Previously  Toshiba shareholders  meeting report  99  vote for chip unit sale  Oct  27 Previously  Toshiba s Q2 posts 76  profit increase from departing chip unit  Nov  9 Previously  Toshiba weighs major capital raise  Nov  10 Now read ,2017-11-14,Seeking Alpha,https://www.investing.com/news/stock-market-news/toshiba-will-sell-tv-unit-to-hisense-for-1136m-858452,858452
174211,395727,WDC,Western Digital  WDC  Gains As Market Dips  What You Should Know,opinion,"Western Digital  WDC  closed at  36 69 in the latest trading session  marking a  0 3  move from the prior day  The stock outpaced the S P 500 s daily loss of 1 58   At the same time  the Dow lost 1 99   and the tech heavy Nasdaq lost 1 63  
Heading into today  shares of the maker of hard drives for businesses and personal computers had lost 22  over the past month  lagging the Computer and Technology sector s loss of 2 81  and the S P 500 s loss of 6 62  in that time 
Investors will be hoping for strength from WDC as it approaches its next earnings release  which is expected to be January 24  2019  On that day  WDC is projected to report earnings of  1 49 per share  which would represent a year over year decline of 62 28   Meanwhile  our latest consensus estimate is calling for revenue of  4 27 billion  down 20 01  from the prior year quarter 
For the full year  our Zacks Consensus Estimates are projecting earnings of  6 98 per share and revenue of  17 93 billion  which would represent changes of  52 61  and  13 14   respectively  from the prior year 
Any recent changes to analyst estimates for WDC should also be noted by investors  These recent revisions tend to reflect the evolving nature of short term business trends  With this in mind  we can consider positive estimate revisions a sign of optimism about the company s business outlook 
Research indicates that these estimate revisions are directly correlated with near term share price momentum  We developed the Zacks Rank to capitalize on this phenomenon  Our system takes these estimate changes into account and delivers a clear  actionable rating model 
Ranging from  1  Strong Buy  to  5  Strong Sell   the Zacks Rank system has a proven  outside audited track record of outperformance  with  1 stocks returning an average of  25  annually since 1988  Over the past month  the Zacks Consensus EPS estimate has moved 3 98  lower  WDC currently has a Zacks Rank of  5  Strong Sell  
Digging into valuation  WDC currently has a Forward P E ratio of 5 24  Its industry sports an average Forward P E of 13 2  so we one might conclude that WDC is trading at a discount comparatively 
Meanwhile  WDC s PEG ratio is currently 0 28  This metric is used similarly to the famous P E ratio  but the PEG ratio also takes into account the stock s expected earnings growth rate  The Computer  Storage Devices was holding an average PEG ratio of 0 93 at yesterday s closing price 
The Computer  Storage Devices industry is part of the Computer and Technology sector  This group has a Zacks Industry Rank of 225  putting it in the bottom 12  of all 250  industries 
The Zacks Industry Rank gauges the strength of our individual industry groups by measuring the average Zacks Rank of the individual stocks within the groups  Our research shows that the top 50  rated industries outperform the bottom half by a factor of 2 to 1 
To follow WDC in the coming trading sessions  be sure to utilize Zacks com ",2018-12-20,Zacks Investment Research,https://www.investing.com/analysis/western-digital-wdc-gains-as-market-dips-what-you-should-know-200370049,200370049
