,id,ticker,title,category,content,date,provider,url,article_id
141964,363479,PFG,Principal Financial Announces  250M Share BuyBack Program ,opinion,The board of directors of Principal Financial Group  Inc    NYSE PFG   recently authorized a share buyback program to return more value to investors  The latest authorization will allow the company to spend up to  250 million to repurchase its common stock As of Mar 31  2017  the company is left with about  100 million under the  400 million share buyback program approved on Feb 23  2016  With the new authorization  the company now has  350 million left under the buyback program The investment manager remains focused in boosting shareholders  value through share repurchases and dividends  The company s solid operational performance should support these endeavors  Notably  the company anticipates capital deployment between  800 million and  1 1 billion  via quarterly dividends  strategic acquisitions and share buy backs  in 2017  To that end  the company deployed  248 million of capital in the first quarter of 2017  which included  130 million in dividends and  118 million in share buy backs Principal Financial is confident about its capital deployment capabilities  This balanced approach to capital deployment supports the company s diversified and integrated businesses  meets the needs of clients and creates long term shareholder value Share repurchases benefit the company s earnings per share  book value as well as shareholder equity as shares outstanding reduce  Therefore  share repurchase programs raise optimism among investors and boost their confidence on the stock Share Price MovementShares of Principal Financial lost 5 80  since the release of first quarter 2017 results  underperforming the Zacks categorized  industry s decline of 3 82   However  we expect growth in both top line and bottom line  along with higher net investment income  strong segmental performance and robust capital position to help the stock to turn around in the near term Zacks RankCurrently  Principal Financial holds a Zacks Rank  2  Buy   You can see  Other Stocks to ConsiderInvestors interested in other stocks from the finance sector can consider CNA Financial Corporation   NYSE CNA    Fidelity National Financial  Inc    NYSE FNF   and ProAssurance Corporation   NYSE PRA    Each of these stocks holds a Zacks Rank  2  Buy  CNA Financial offers commercial P C insurance products primarily in the United States  The company delivered positive surprises in three of the last four quarters with an average beat of 12 45  Fidelity National provides title insurance  and technology and transaction services to the real estate and mortgage industries in the United States  The company delivered positive surprises in three of the last four quarters with an average beat of 8 47  ProAssurance Corporation offers P C insurance  and reinsurance products in the United States  The company delivered positive surprises in all of the last four quarters with an average beat of 16 59  Will You Make a Fortune on the Shift to Electric Cars Here s another stock idea to consider  Much like petroleum 150 years ago  lithium power may soon shake the world  creating millionaires and reshaping geo politics  Soon electric vehicles  EVs  may be cheaper than gas guzzlers  Some are already reaching 265 miles on a single charge With battery prices plummeting and charging stations set to multiply  one company stands out as the  1 stock to buy according to Zacks research It s not the one you think ,2017-05-17,Zacks Investment Research,https://www.investing.com/analysis/principal-financial-announces-$250m-share-buyback-program-200190056,200190056
141994,363509,PFG,Principal Financial  PFG   What s Up This Earnings Season ,opinion,Principal Financial Group Inc    NYSE PFG   is set to report third quarter 2016 results on Oct 27  after the market closes  Last quarter  the company posted a positive earnings surprise of 8 49   Let s see how things are shaping up for this announcement Factors to be Considered this QuarterWe expect Principal Financial to report operating earnings growth in the third quarter on the back of its diversified and integrated business model  Also  continued share buyback should aid the bottom line In addition  the company is likely to witness a rise in operating earnings at Principal Global Investors and US Insurance Solution in the third quarter Moreover  the company is expected to experience an increase in Asset Under Management  AUM  in the to be reported quarter  primarily due to better results at three asset management and asset accumulation segments However  a soft interest rate environment has likely weighed on the company s investment results With respect to the surprise trend  the company delivered positive surprise in one of the last four quarters  with an average beat of 0 67  PRINCIPAL FINL Price and EPS Surprise    Earnings WhispersOur proven model does not conclusively show that Principal Financial is likely to beat on earnings this quarter  This is because a stock needs to have both a positive  and a Zacks Rank  1  Strong Buy   2  Buy  or 3  Hold  for this to happen  That is not the case here as you will see below  Please check our  that enables you to find stocks that are expected to come out with earnings surprises Zacks ESP  Principal Financial has an Earnings ESP of 0 00   This is because both the Most Accurate estimate and the Zacks Consensus Estimate stand at  1 12 Zacks Rank  Principal Financial carries a Zacks Rank  2 Please note that we caution against Sell rated stocks  Zacks Rank  4 or 5  going into the earnings announcement  especially when the company is seeing negative estimate revisions Stocks to ConsiderHere are some companies from the same space that you may want to consider as these have the right combination of elements to post an earnings beat this quarter Oaktree Capital Group  LLC   NYSE OAK    which is slated to report third quarter earnings on Oct 28  has an Earnings ESP of  1 47  and a Zacks Rank  2  You can see  OM Asset Management plc   NYSE OMAM   has an Earnings ESP of  3 33  and a Zacks Rank  2  The company is slated to report third quarter earnings on Nov 2 Fortress Investment Group LLC   NYSE FIG   has an Earnings ESP of  4 00  and a Zacks Rank  3  The company is set to report third quarter earnings on Nov 3 Confidential from ZacksBeyond this Analyst Blog  would you like to see Zacks  best recommendations that are not available to the public  Our Executive VP  Steve Reitmeister  knows when key trades are about to be triggered and which of our experts has the hottest hand ,2016-10-24,Zacks Investment Research,https://www.investing.com/analysis/principal-financial-(pfg):-what's-up-this-earnings-season-200160553,200160553
141995,363510,PFG,Is Principal Financial  PFG  Worth Adding To Your Portfolio  ,opinion,"Shares of Principal Financial Group  Inc    NYSE PFG   gained 28 26  year to date  much above the Zacks categorized Investment Management industry s 1 77   This price performance has been backed by positive estimate revision  The company has seen its 2016 and 2017 estimates moving north by more than 1  over the last 60 days Why Should You Add In Your PortfolioPrincipal Financial s businesses across most lines and segments continue to deliver solid results  Deeper focus on fee based revenue sources  about 70  expected from these by 2018  have been helping Principal Financial earn steadily apart from limiting exposure to interest rate environment Principal Financial s assets under management  AUM  shows a steady increase  driven by better results at three asset management and asset accumulation segments  Principal Financial envisions  1 trillion in AUM in five to seven years on the strength of various growth drivers and its leadership position Principal Financial has been deploying capital effectively to enhance shareholders  value  The company expects capital deployment between  800 million and  1 billion in 2016  in quarterly dividends  strategic acquisitions and share buybacks   Over the long term  Principal Financial intends to spend 65  to 70  of net income in such activities  We expect such endeavors to be well supported by the company s solid operational performance  and a robust balance sheet with sufficient liquidity and strong cash flows Recently  Zacks Investment Research upgraded Principal Financial to Zacks Rank  2  Buy   The investment manager delivered positive surprises in two of the last four quarters with an average beat of 1 57   The long term expected earnings growth is pegged at 8 40   Also  the price earnings growth ratio  which determines the relative trade off between the price of a stock  the earnings generated per share  and the company s expected growth  is 1 53   better than the industry average of 1 49 PRINCIPAL FINL Price and Consensus   Valuation is also attractive at present as the stock is currently trading at a forward P E of 13 0x  a 6 5  discount to the industry average of 13 9x  Principal Financial has a trailing 12 month return on equity  ROE  of 12 8   higher than the industry average of 11 2  Stocks to ConsiderSome better ranked stocks from the same space include Alleghany Corporation   NYSE Y    NMI Holdings  Inc    NASDAQ NMIH   and Arch Capital Group Ltd    NASDAQ ACGL    Each of these stocks sports a Zacks Rank  1  Strong Buy   You can see  Alleghany Corporation deals with P C reinsurance and insurance businesses in the U S  and internationally  The company delivered positive surprises in three of the last four quarters with an average beat of 20 52  NMI Holdings offers private mortgage guaranty insurance services in the U S  The company delivered positive surprises in all of the last four quarters with an average beat of 62 80  Arch Capital offers property  casualty  and mortgage insurance and reinsurance products worldwide  It delivered positive surprises in all of the last four quarter with an average beat of 9 27  
Confidential from Zacks Beyond this Analyst Blog  would you like to see Zacks  best recommendations that are not available to the public  Our Executive VP  Steve Reitmeister  knows when key trades are about to be triggered and which of our experts has the hottest hand    ",2016-11-30,Zacks Investment Research,https://www.investing.com/analysis/is-principal-financial-(pfg)-worth-adding-to-your-portfolio-200167696,200167696
141996,363511,PFG,Principal Financial Provides Guidance For 2017  Shares Down,opinion,Principal Financial Group Inc    NYSE PFG   recently provided the projections for 2017 and divulged its capital deployment plans  However  shares lost about 0 08  in the last trading session to finally close at  59 42 on Dec 6 Principal Financial estimates net revenue growth in the range of 2 5  at Retirement and Income Solutions   Fees  and 5 10  at Retirement and Income Solutions   Spread Revenues are estimated to increase in the range of 4 8  at Principal Global Investors  The pre tax return on revenues estimate is 34 37   While management believes that the merger of Principal Global Investors and Principal Funds to create synergies over time  a sustained strong investment performance and product development will drive growth Principal International is expected to deliver net revenue growth between 11  and 14  in 2017  Management expects slight weakening of the U S  dollar While solid sales and retention as well as employment recovery will drive Specialty Benefits premiums and fees by 7 9   loss ratio is estimated at 62 68  due to improved underwriting Premiums and fees at Individual Life is projected to increase in the range of 3 6  Operating losses at Corporate and Other is expected in the band of  200  225 million in 2017 Principal Financial estimates the tax rate to be approximately 21 23  Over the past few years  the company has set aside capital for deployment in either strategic acquisitions or for enhancing shareholders  value  In 2017  the company intends to utilize  0 8  1 1 billion for quarterly dividends  strategic acquisitions and share buybacks as well as to deleverage its balance sheet  For 2016  management expects to deploy capital on the higher end of the  0 8  1 billion guided range  of which it has already deployed  768 million  Management intends to use 65 70  of the net income for capital deployment over the long term Principal Financial expects shares outstanding at year end 2017 of 288 292 million Notably  Principal Financial has aligned itself to focus more on the strategic opportunities in the growing asset accumulation and asset management businesses  Also  it is well positioned on the back of its extensive distribution footprint  best in class solutions and operational discipline  Deeper focus on fee based revenue sources has been helping the company earn steadily and limit exposure to the adverse interest rate environment  We believe that these attributes will help it to meet its expectations going forward Year to date  the Principal Financial stock has gained 32 1   surpassing the 3 9  growth for the Zacks categorized Investment Management industry  This price outperformance was supported by upward estimate revisions  Principal Financial presently carries a Zacks Rank  3  Hold   Stocks to ConsiderSome better ranked insurers are Alleghany Corporation   NYSE Y    First American Financial Corporation   NYSE FAF   and Arch Capital Group Ltd    NASDAQ ACGL    Each of these stocks sports a Zacks Rank  1  You can see  Alleghany Corporation deals with property   casualty reinsurance and insurance businesses in the U S  and internationally  The company delivered positive surprises in three of the last four quarters  with an average beat of 20 52  First American Financial is a leading provider of title insurance and settlement services to the real estate and mortgage industries in the U S  It outpaced estimates in all the trailing four quarters with an average beat of 14 32  Arch Capital offers property  casualty  and mortgage insurance and reinsurance products worldwide  It delivered positive surprises in all of the last four quarters  with an average beat of 9 27  Confidential from ZacksBeyond this Analyst Blog  would you like to see Zacks  best recommendations that are not available to the public  Our Executive VP  Steve Reitmeister  knows when key trades are about to be triggered and which of our experts has the hottest hand ,2016-12-06,Zacks Investment Research,https://www.investing.com/analysis/principal-financial-provides-guidance-for-2017;-shares-down-200168728,200168728
141997,363512,PFG,3 Strong Buy Principal Financial Mutual Funds To Buy,opinion,Founded in 1879  Principal Financial Group  NYSE PFG  manages assets worth over  595 8 billion  as of September 30  2016  based on assets raised in the country or region  It invests in equities  multi assets  fixed income real estates and alternative markets  The main objective of the company is to meet the long term interest of the investorsThe fund family aims to support the requirements of both individual and institutional investors with their asset management services  insurance and retirement solutions  It offers investment management strategies and services in 18 countries  It invests in equities  multi assets  fixed income real estates and alternative markets Below we share with you 3 top rated Principal Financial mutual funds  Each has earned a   1  Strong Buy  and we expect the fund to outperform its peers in the future  Investors can  Principal SmallCap S P 600 Index R5  invests a bulk of its assets in securities of companies from the S P SmallCap 600 Index  In this index  the market cap of companies ranges between  58 0 million and  4 5 billion  PSSPX seeks capital growth for the long run  Principal SmallCap S P 600 Index R5 returned 20  over the last one year period PSSPXhas an expense ratio of 0 42  compared to the category average of 1 23  Principal Short Term Income J  seeks growth of income and stability of principal  PSJIX invests mainly in fixed income debt securities  including high quality short term bonds  which are rated Baa3 or higher by Moody s or BBB  or higher by S P s Rating Service  Principal Short Term Income J returned 1 9  over the last one year period As of October 2016  PSJIX held 422 issues  with 1 35  of its assets invested in FNMA 1 5  Principal LargeCap Value A  invests majority of its assets in equity securities of large cap companies from the Russell 1000 Value Index  According to the index  large cap companies are those whose market cap ranges between  383 0 million and  448 8 billion  PCACX seeks appreciation of capital for the long run  Principal LargeCap Value A returned 5 1  over the last one year period Joel Fortney is the one of the fund managers and has managed PCACX since 2014 To view the Zacks Rank and past performance of all Principal Financial mutual funds  investors can  Want key mutual fund info delivered straight to your inbox Zacks  free Fund Newsletter will brief you on top news and analysis  as well as top performing mutual funds  each week ,2016-12-06,Zacks Investment Research,https://www.investing.com/analysis/3-strong-buy-principal-financial-mutual-funds-to-buy-200168714,200168714
