,id,ticker,title,category,content,date,provider,url,article_id
188374,409890,PPL,PPL Corporation  PPL  Down 4 6  Since Earnings Report  Can It Rebound ,opinion,"A month has gone by since the last earnings report for PPL Corporation   NYSE PPL    Shares have lost about 4 6  in that time frame 
Will the recent negative trend continue leading up to its next earnings release  or is PPL due for a breakout  Before we dive into how investors and analysts have reacted as of late  let s take a quick look at its most recent earnings report in order to get a better handle on the important catalysts PPL Corp  U S  Contribution Leads to Q1 Earnings BeatPPL Corporation reported first quarter 2018 adjusted earnings of 74 cents per share  beating the Zacks Consensus Estimate of 66 cents by 12 1   Earnings also improved 19 4  year over year The year over year improvement in earnings is primarily due to strong performance from its domestic segments On a GAAP basis  the company reported earnings per share of 65 cents in the quarter compared with 59 cents a year ago  The difference between GAAP and operating earnings in the reported quarter was due to one time impact of 9 cents from foreign currency hedges Total RevenuesPPL Corp  posted revenues of  2 126 million in the first quarter  beating the Zacks Consensus Estimate of  1 983 million by 7 2    Revenues also improved 8 9  year over year Segment ResultsU K  Regulated  Adjusted earnings decreased 17 8  from the prior year quarter to 37 cents per share  The decline was primarily due to lower volumes and impact from share dilution Kentucky Regulated  Adjusted earnings were 19 cents  up 35 7  from the year ago quarter  primarily driven by higher base electricity and gas rates effective Jul 1  2017 and rise in sales volumes due to favorable weather Pennsylvania Regulated  Adjusted earnings in the quarter were 21 cents  up 75 0  from the year ago quarter  The year over year improvement was due to higher transmission earnings due to additional capital investments Corporate and Other  It includes unallocated corporate level financing and other costs  The segment reported a loss of 3 cents in the quarter compared with a loss of 9 cents in the prior year quarter Operational HighlightsPPL Corp  s total operating expenses increased 6 9  year over year to   1 275 million in the reported quarter The company reported operating income of  851 million  up 12 3  from the prior year quarter Interest expenses increased 10 1  to  239 million compared with the year ago quarter s figure of  217 million Financial PositionAs of Mar 31  2018  PPL Corp  had cash and cash equivalents of  629 million compared with  485 million as of Dec 31  2017 Long term debt  excluding debts due within one year  was  20 214 million as of Mar 31  2018  compared with  19 847 million at the end of 2017 In the first quarter of 2018  net cash flow from operating activities was  566 million compared with  135 million in the first quarter of 2017 GuidancePPL Corp  reaffirmed its 2018 adjusted earnings to be in the range of  2 20  2 40 per share  The company also provided compound earnings growth guidance of 5 6  from 2018 through 2020  with 2018 midpoint as the base 
How Have Estimates Been Moving Since Then 
In the past month  investors have witnessed a downward trend in fresh estimates  There have been two revisions lower for the current quarter 
PPL Corporation Price and Consensus   VGM Scores
At this time  PPL has a nice Growth Score of B  though it is lagging a bit on the momentum front with a C  Following the exact same course  the stock was also allocated a grade of C on the value side  putting it in the middle 20  for this investment strategy 
Overall  the stock has an aggregate VGM Score of B  If you aren t focused on one strategy  this score is the one you should be interested in 
Based on our scores  the stock is more suitable for growth investors than those looking for value and momentum 
Outlook
Estimates have been broadly trending downward for the stock and the magnitude of these revisions indicates a downward shift  Interestingly  PPL has a Zacks Rank  3  Hold   We expect an in line return from the stock in the next few months ",2018-06-04,Zacks Investment Research,https://www.investing.com/analysis/ppl-corporation-ppl-down-46-since-earnings-report-can-it-rebound-200321835,200321835
188387,409903,PPL,Is PPL Corporation  PPL  A Great Stock For Value Investors ,opinion,Value investing is easily one of the most popular ways to find great stocks in any market environment  After all  who wouldn t want to find stocks that are either flying under the radar and are compelling buys  or offer up tantalizing discounts when compared to fair value One way to find these companies is by looking at several key metrics and financial ratios  many of which are crucial in the value stock selection process  Let s put PPL Corporation   NYSE PPL   stock into this equation and find out if it is a good choice for value oriented investors right now  or if investors subscribing to this methodology should look elsewhere for top picks PE RatioA key metric that value investors always look at is the Price to Earnings Ratio  or PE for short  This shows us how much investors are willing to pay for each dollar of earnings in a given stock  and is easily one of the most popular financial ratios in the world  The best use of the PE ratio is to compare the stock s current PE ratio with  a  where this ratio has been in the past  b  how it compares to the average for the industry sector  and c  how it compares to the market as a whole On this front  PPL Corporation has a trailing twelve months PE ratio of 13 5  as you can see in the chart below This level actually compares pretty favorably with the market at large  as the PE for the S P 500 compares in at about 21 9  If we focus on the stock s long term PE trend  the current level puts PPL Corporation s current PE ratio tad below its midpoint over the past five years Further  the stock s PE also compares favorably with the industry s trailing twelve months PE ratio  which stands at 19  At the very least  this indicates that the stock is relatively undervalued right now  compared to its peers We should also point out that PPL Corporation has a forward PE ratio  price relative to this year s earnings  of just 13 3  which is roughly in line with the current level  Hence the forward earnings estimates are already incorporated in the company s current share price P S RatioAnother key metric to note is the Price Sales ratio  This approach compares a given stock s price to its total sales  where a lower reading is generally considered better  Some people like this metric more than other value focused ones because it looks at sales  something that is far harder to manipulate with accounting tricks than earnings Right now  PPL Corporation has a P S ratio of about 2 9  which is lower than its industry s average of 7 5 right now If anything  this suggests some level of undervalued trading at least compared to historical norms Broad Value OutlookIn aggregate  PPL Corporation currently has a Zacks Value Style Score of B  putting it into the top 40  of all stocks we cover from this look  This makes PPL Corporation a solid choice for value investors  and some of its other key metrics make this pretty clear too For example  the P CF ratio of PPL Corporation  another great indicator of value  comes in at 7 9  which is lower than the industry average of 9  Clearly  PPL is a solid choice on the value front from multiple angles What About the Stock Overall Though PPL Corporation might be a good choice for value investors  there are plenty of other factors to consider before investing in this name  In particular  it is worth noting that the company has a Growth grade of D and a Momentum score of D  This gives PPL a Zacks VGM score or its overarching fundamental grade of C   You can read more about the Zacks Style Scores  Meanwhile  the company s recent earnings estimates have been encouraging  The current quarter has seen no estimate go higher or lower in the past sixty days  while the full year estimate has seen one upward and no downward revisions in the same time period The current quarter consensus estimate has increased 2  in the past two months  while the full year estimate has increased 0 5   You can see the consensus estimate trend and recent price action for the stock in the chart below PPL Corporation Price and Consensus   This bullish trend is why the stock boasts a Zacks Rank  2  Buy  and why we are expecting outperformance from the company in the near term Bottom LinePPL Corporation is an inspired choice for value investors  as it is hard to beat its incredible lineup of statistics on this front  However  with a sluggish industry rank  among bottom 27   it is hard to get too excited about this company overall  In fact  over the past two years  its industry has underperformed the broader market  as you can see below So  value investors might want to wait for broader factors to turn around in this name first  but once that happens  this stock could be a compelling pick 5 Medical Stocks to Buy NowZacks names 5 companies poised to ride a medical breakthrough that is targeting cures for leukemia  AIDS  muscular dystrophy  hemophilia  and other conditions New products in this field are already generating substantial revenue and even more wondrous treatments are in the pipeline  Early investors could realize PPLeptional profits ,2018-01-07,Zacks Investment Research,https://www.investing.com/analysis/is-ppl-corporation-ppl-a-great-stock-for-value-investors-200278501,200278501
188408,409924,PPL,PPL Corp Hits 52 Week High On Planned Capital Investment,opinion,Share price of PPL Corporation   NYSE PPL    an electric and power company  hit a new 52 week high of  40 00 on May 26  closing a tad lower at  39 86  In the last six months the stock has returned about 16 5  compared with the Zacks categorized  industry s gain of 8 1  In the last 52 weeks  PPL Corp  s share price has ranged from a low of  32 08 to a high of  40  Average volume of shares traded in the last three months is approximately 3 1 million Factors behind the PerformancePPL Corp s shares have been on the rise following strong first quarter 2017 results that were declared on May 4  The company posted earnings per share of 62 cents  in line with the Zacks Consensus Estimate  even though the demand was vastly affected by mild weather conditions last winter The company has been a consistent performer  delivering positive earnings surprises in three of the trailing four quarters with an average surprise of 6 96   The long term earnings growth of the company is presently pegged at 5 0  The management of PPL Corp  believes in low risk  Since the company has a significant presence in the U K   it reduced the risks associated with the foreign currency exchange rates to a great extent with the help of its hedging program  Even with the Brexit  the company is well positioned to deliver projected growth in the upcoming quarters even if the currency rate declines PPL Corp  s focuses on customer satisfaction in the areas it serves and has been consistently improving its operation and infrastructure  The company plans to invest  15 9 billion in the 2017 2021 timeframe  aiming to build a smarter and more secure energy grid and to build a cleaner tomorrow with green energy initiatives Keeping in mind the interest of the shareholders  PPL Corp  targets annual dividend growth of 4  through 2020  To live up to this commitment  the company increased annualized dividend by 4  in February from  1 52 per share to  1 58 Stocks to ConsiderPPL Corp s currently carries a Zacks Rank  3  Hold   Investors can consider better ranked stocks from the same industry like RWE AG   OTC RWEOY    sporting a Zacks Rank  1  Strong Buy  and Avangrid  Inc    NYSE AGR   and Brookfield Infrastructure Partners LP   NYSE BIP   carrying Zacks Rank  2  Buy   You can see  RWE AG s Zacks Consensus Estimate for 2017 moved up nearly 24 7  to  2 02 per share in the last 60 days Avangrid delivered a positive earnings surprise of 7 35  in the first quarter of 2017  Its 2017 estimates have risen by 0 5  to  2 21 per share in the last 60 days Brookfield Infrastructure Partners  Zacks Consensus Estimate for 2017 moved up nearly 2 5  to  3 22 per share in the last 60 days Looking for Ideas with Even Greater Upside Today s investment ideas are short term  directly based on our proven 1 to 3 month indicator  In addition  I invite you to consider our long term opportunities  These rare trades look to start fast with strong Zacks Ranks  but carry through with double and triple digit profit potential  Starting now  you can look inside our home run  value  and stocks under  10 portfolios  plus more ,2017-05-28,Zacks Investment Research,https://www.investing.com/analysis/ppl-corp-hits-52-week-high-on-planned-capital-investment-200191967,200191967
188409,409925,PPL,PPL Corporation  PPL  Beats On Q2 Earnings  Revenues Miss,opinion,"PPL Corporation   NYSE PPL    a diversified utility holding company  has operations in the U S  and the UK  PPL Corp  s organic growth strategy  systematic investments in utility infrastructure development projects and focus on enhancing customer service are commendable However  volatility in fuel prices  stringent environmental regulation and unpredictable weather patterns remain potential setbacks Estimate Trend   Surprise HistoryInvestors should note that Zacks Consensus Estimate for the second quarter for earnings of 50 cents per share has increased by 1 cent over the last 90 days Coming to the earnings surprise  PPL Corp  has surpassed the Zacks Consensus Estimate in four out of the last four trailing quarters  resulting in a positive average surprise of 6 96  Zacks Rank  Currently  PPL Corp  has a Zacks Rank  2  Buy   You can see  However  since the latest earnings performance is yet to be reflected in the estimate revisions  the rank is subject to change We have mentioned below some of the vital information from this just revealed announcement PPL Corporation Price and EPS Surprise
    
 Earnings  PPL Corp  reported second quarter 2017 earnings of 52 cents per share  beating the Zacks Consensus Estimate of 50 cents by 4  Revenue  PPL Corp  posted revenues of  1 725 million in the second quarter  down 2 9  compared with Zacks Consensus Estimate of  1 776 million Stock Price  It would be interesting to see how the market reacts to the results during the trading session today More Stock News  Tech Opportunity Worth  386 Billion in 2017From driverless cars to artificial intelligence  we ve seen an unsurpassed growth of high tech products in recent months  Yesterday s science fiction is becoming today s reality  Despite all the innovation  there is a single component no tech company can survive without  Demand for this critical device will reach  387 billion this year alone  and it s likely to grow even faster in the future  Zacks has released a brand new Special Report to help you take advantage of this exciting investment opportunity  Most importantly  it reveals 4 stocks with massive profit potential ",2017-08-03,Zacks Investment Research,https://www.investing.com/analysis/ppl-corporation-ppl-beats-on-q2-earnings-revenues-miss-200205060,200205060
188422,409938,PPL,Telephone And Data Systems  TDS   Earnings Preview For Q1,opinion,"Telephone and Data Systems Inc    NYSE TDS    a leading regional wireline voice and video service provider in the U S   is slated to report first quarter 2017 results on May 5  before the opening bell Last quarter  the company s bottom line matched the Zacks Consensus Estimate  However  the company s earnings lagged the Zacks Consensus Estimate in two of the previous four quarters  with an average negative surprise of 10 10  Let s see how things are shaping up for this announcement Factors at PlayThe price performance of Telephone   Data Systems looks depressing  Over the past three months  shares of Telephone   Data Systems registered a negative return of 6 2  compared with the Zacks categorized   industry s decline of 4 4  Telephone   Data Systemscontinues to compete with the likes of CenturyLink Inc    NYSE CTL   and Frontier Communications Corp    NASDAQ FTR   to name a few  Additionally  the company s wireless division   United States Cellular Corp    NYSE USM     continues to operate in an intensely competitive wireless market and remains significantly challenged by the offering of service plans from lower cost mobile operators We further believe that high costs associated with network integration and construction of new cell sites  aggressive equipment pricing  increasing capacity in existing cell sites  wireless technology upgrades and spectrum licensing will put considerable pressure on the company s finances The company s dismissal performance in certain metrics in the fourth quarter of 2016 was a major setback  We look forward to seeing whether these metrics perform better or worse in the to be reported quarter We appreciate Telephone and Data Systems  efforts to reward its shareholders with a first quarter 2017 dividend of 15 5 cents per Common Share and Series A Common Share  The dividend was paid on Mar 31  2017  to shareholders of record as of Mar 17  2017 Moreover  Telephone   Data Systems continues to expand its business in the managed hosting and cloud service market through a new cloud based storage service and managed IP connection  Also  Telephone and Data Systems  flexible cash position and liquidity opens up scope for investments  The launch of Shared Data plans for consumers and businesses at nominal prices have helped the company gain consumers  We expect the trend to have continued in the first quarter  The rollout of IPTV also bodes well  Moreover  the company experienced strong smartphone demand at United States Cellular Corp The acquisition of InterLinx Communications LLC surely boosted the fiber optics suite of the company Earnings Whispers Our proven model does not conclusively show that Telephone and Data Systems is likely to beat the Zacks Consensus Estimate this quarter  This is because a stock needs to have both a positive  and a Zacks Rank  1  Strong Buy   2  Buy  or 3  Hold  for this to happen  Unfortunately  that is not the case here as elaborated below Zacks ESP  Telephone and Data Systems has an Earnings ESP of 0 00   This is because both the Most Accurate estimate and the Zacks Consensus Estimate are pegged at a loss of 1 cents  You can uncover the best stocks to buy or sell before they re reported with our  Zacks Rank  Telephone and Data Systems has a Zacks Rank  4 We caution against stocks with a Zacks Rank  4 or 5  Sell rated  going into the earnings announcement  especially when the company is seeing negative estimate revisions Telephone and Data Systems  Inc  Price and EPS Surprise
 

   Key PickHere is a company in the Zacks categorized broader  sector   which houses Telephone and Data Systems   that has the right combination of elements to post an earnings beat this quarter PPL Corporation   NYSE PPL   is expected to report first quarter 2017 results on May 4  It has an Earnings ESP of  1 61  and a Zacks Rank  3  You can see  PPL Corp s earnings surpassed the Zacks Consensus Estimate in three of the previous four quarters  with an average beat of 4 29  Will You Make a Fortune on the Shift to Electric Cars  Here s another stock idea to consider  Much like petroleum 150 years ago  lithium power may soon shake the world  creating millionaires and reshaping geo politics  Soon electric vehicles  EVs  may be cheaper than gas guzzlers  Some are already reaching 265 miles on a single charge With battery prices plummeting and charging stations set to multiply  one company stands out as the  1 stock to buy according to Zacks research It s not the one you think ",2017-05-02,Zacks Investment Research,https://www.investing.com/analysis/telephone-and-data-systems-(tds):-earnings-preview-for-q1-200186783,200186783
188423,409939,PPL,PPL Corp   PPL  Meets Q1 Earnings Estimates  Revenue Miss,opinion,PPL Corporation   NYSE PPL    a diversified utility holding company  has operations in the U S  and the UK  PPL Corp  s organic growth strategy  systematic investments in utility infrastructure development projects and focus on enhancing customer service are commendable However  volatility in fuel prices  stringent environmental regulation and unpredictable weather patterns remain potential setbacks Estimate Trend   Surprise HistoryInvestors should note that Zacks Consensus Estimate for the first quarter for earnings of 62 cents per share has increased by 1 cent over the last 60 days Coming to the earnings surprise  PPL Corp  has surpassed the Zacks Consensus Estimate in three out of the last four trailing quarters  resulting in a positive average surprise of 4 29  Zacks Rank  Currently  PPL Corp  has a Zacks Rank  3  Hold   You can see  However  since the latest earnings performance is yet to be reflected in the estimate revisions  the rank is subject to change We have mentioned below some of the vital information from this just revealed announcement Earnings  PPL Corp  reported first quarter 2017 earnings of 62 cents per share  in line with Zacks Consensus Estimate PPL Corporation Price and EPS Surprise   Revenue  PPL Corp  missed the revenue estimates in the first quarter  The company posted revenues of  1 951 million in the first quarter  down 5 2  compared with our consensus estimate of  2 057 million Stock Price  It would be interesting to see how the market reacts to the results during the trading session today Will You Make a Fortune on the Shift to Electric Cars Here s another stock idea to consider  Much like petroleum 150 years ago  lithium power may soon shake the world  creating millionaires and reshaping geo politics  Soon electric vehicles  EVs  may be cheaper than gas guzzlers  Some are already reaching 265 miles on a single charge With battery prices plummeting and charging stations set to multiply  one company stands out as the  1 stock to buy according to Zacks research It s not the one you think ,2017-05-03,Zacks Investment Research,"https://www.investing.com/analysis/ppl-corp.-(ppl)-meets-q1-earnings-estimates,-revenue-miss-200187096",200187096
188440,409956,PPL,Should You Sell PPL Corp   PPL  Before Earnings ,opinion,Investors are always looking for stocks that are poised to beat at earnings season and PPL Corporation   NYSE PPL   may be one such company  The firm has earnings coming up pretty soon  and events are shaping up quite nicely for their report That is because PPL Corp  is seeing favorable earnings estimate revision activity as of late  which is generally a precursor to an earnings beat  After all  analysts raising estimates right before earnings with the most up to date information possible is a pretty good indicator of some favorable trends underneath the surface for PPL in this report In fact  the Most Accurate Estimate for the current quarter is currently at 60 cents per share for PPL  compared to a broader Zacks Consensus Estimate of 59 cents per share  This suggests that analysts have very recently bumped up their estimates for PPL  giving the stock a Zacks Earnings ESP of 1 70  heading into earnings season PPL CORP Price and EPS Surprise   Why is this Important A positive reading for the Zacks Earnings ESP has proven to be very powerful in producing both positive surprises  and outperforming the market  Our recent 10 year backtest shows that stocks that have a positive Earnings ESP and a Zacks Rank  3  Hold  or better show a positive surprise nearly 70  of the time  and have returned over 28  on average in annual returns  see more   Given that PPL has a Zacks Rank  3  Hold  and an ESP in positive territory  investors might want to consider this stock ahead of earnings  You can see  Clearly  recent earnings estimate revisions suggest that good things are ahead for PPL Corp   and that a beat might be in the cards for the upcoming report Confidential from ZacksBeyond this Tale of the Tape  would you like to see Zacks  best recommendations that are not available to the public  Our Executive VP  Steve Reitmeister  knows when key trades are about to be triggered and which of our experts has the hottest hand ,2016-10-30,Zacks Investment Research,https://www.investing.com/analysis/should-you-sell-ppl-corp.-(ppl)-before-earnings-200161809,200161809
