,id,ticker,title,category,content,date,provider,url,article_id
174608,396124,WDC,Zacks com Featured Highlights  Fortuna Silver Mines  Ritter Pharmaceuticals   Organovo Holdings  Western Digital And Willdan Group,opinion,For Immediate ReleaseChicago  IL   November 20  2017   Stocks in this week s article Fortuna Silver Mines Inc    NYSE FSM    Ritter Pharmaceuticals Inc    NASDAQ RTTR    Organovo Holdings  Inc    NASDAQ ONVO    Western Digital Corporation   NASDAQ WDC   and Willdan Group Inc    NASDAQ WLDN  Take the Road Less Traveled  Rising P E for 5 Winning StocksPicking undervalued stocks with a low price to earnings  P E  ratio is a common investing strategy  The logic is simple   the stock s current price does not reflect its higher earnings and therefore leaves room for upside But very few believe that stocks with a rising P E are worth buying  Let s discuss this less favored strategy in details Strength of Increasing P EThe concept is that as earnings rise  so should the price of the stock  As forecasts for expected earnings come in higher  strong demand for the stock should continue to drive its price  After all  a stock s P E gives an indication of how much investors are ready to shell out per dollar of earnings Suppose an investor wants to buy a stock with a P E ratio of 30  it means that he is willing to pay  30 for only  1 worth of earnings  Now if the P E ratio becomes 35 within a short spell of time  it means that the person is now ready to pay  35 for only  1 worth of earnings  It shows that the investor expects earnings of the company to rise at a faster pace in the future owing to strong fundamentals So  if the P E of a stock is rising steadily  it means that investors are assured of its inherent strength and expect some strong positives out of it  Also  studies have revealed that stocks have seen their P E ratios jump over 100  from their breakout point in the cycle  So  if you can pick stocks early in their breakout cycle  you can end up seeing considerable gains For the rest of this Screen of the Week article please visit Zacks com at  Disclosure  Officers  directors and or employees of Zacks Investment Research may own or have sold short securities and or hold long and or short positions in options that are mentioned in this material  An affiliated investment advisory firm may own or have sold short securities and or hold long and or short positions in options that are mentioned in this material About Screen of the WeekZacks com created the first and best screening system on the web earning the distinction as the   1 site for screening stocks  by Money Magazine   But powerful screening tools is just the start  That is why Zacks created the Screen of the Week to highlight profitable stock picking strategies that investors can actively use Strong Stocks that Should Be in the NewsMany are little publicized and fly under the Wall Street radar  They re virtually unknown to the general public  Yet today s 220 Zacks Rank  1  Strong Buys  were generated by the stock picking system that has more than doubled the market from 1988 through 2016  Its average gain has been a stellar  25  per year  Follow us on Twitter   Join us on Facebook  NASDAQ FB    Zacks Investment Research is under common control with affiliated entities  including a broker dealer and an investment adviser   which may engage in transactions involving the foregoing securities for the clients of such affiliates Contact  Jim GiaquintoCompany  Zacks comPhone  312 265 9268Email  Visit  Zacks com provides investment resources and informs you of these resources  which you may choose to use in making your own investment decisions  Zacks is providing information on this resource to you subject to the Zacks  Terms and Conditions of Service  disclaimer   Past performance is no guarantee of future results  Inherent in any investment is the potential for loss  This material is being provided for informational purposes only and nothing herein constitutes investment  legal  accounting or tax advice  or a recommendation to buy  sell or hold a security  No recommendation or advice is being given as to whether any investment is suitable for a particular investor  It should not be assumed that any investments in securities  companies  sectors or markets identified and described were or will be profitable  All information is current as of the date of herein and is subject to change without notice  Any views or opinions expressed may not reflect those of the firm as a whole  Zacks Investment Research does not engage in investment banking  market making or asset management activities of any securities  These returns are from hypothetical portfolios consisting of stocks with Zacks Rank   1 that were rebalanced monthly with zero transaction costs  These are not the returns of actual portfolios of stocks  The S P 500 is an unmanaged index  Visit for information about the performance numbers displayed in this press release ,2017-11-19,Zacks Investment Research,https://www.investing.com/analysis/zackscom-featured-highlights-fortuna-silver-mines-ritter-pharmaceuticals--organovo-holdings-western-digital-and-willdan-group-200266729,200266729
174620,396136,WDC,China s chip crusade to intensify sector s record M A run,news,"By Miyoung Kim and Makiko Yamazaki TAIPEI TOKYO  Reuters    China s unabashed interest in foreign chipmakers in an already record year of deals has been quickly read by rivals as a sign that mergers and acquisitions  M As  will get more competitive and target companies will get more expensive  Chipmakers have announced over  80 billion worth of M As in 2015  Chipmakers are acquiring peers to expand capacity and capabilities ahead of an explosion in demand for all kinds of semiconductors necessitated by the Internet of Things   The days of growing organically through technological advantage are over   said Hidetoshi Shibata  chief financial officer of Japan s  Renesas Electronics Corp   T 6723    Scale and having a wide variety of solutions have become crucial   But a Chinese buying spree could push the value of merger targets beyond rivals  reach  Tsinghua Unigroup Ltd is leading China s development of a national semiconductor industry with  10 billion spent on M As over the past two years and plans for almost  50 billion more over the next five   Chinese companies do pay quite a lot   Shibata said in an interview   The concerns are that they jack up M A valuations and that they become huge rivals   Many Chinese deals are by privately held parties  such as Tsinghua  which this month earmarked almost  13 billion for a memory chip factory  In April  a group of Chinese investors agreed to buy U S  smartphone camera chip maker OmniVision Technologies Inc  O OVTI  for about  1 9 billion in cash   It s not over   Handel Jones  chief executive of chips consultancy International Business Strategies  said of overall chip sector M As   We know of a number of additional activities going on  some will be announced in the next couple of weeks   Jones said he expects consolidation among companies making chips for memory and power management  NO PANIC Chipmakers  strategies have diverged since the 2011 peak of the industry s mainstay market of personal computers  PCs   Some have bet on energy efficient chips for smartphones  fail safe chips for vehicles  hefty server chips powering databases  or chips for myriad household goods under the Internet of Things   There are simply too many potential variables in play for any participant to feel secure  and both industries  chips and PCs  have a history of creating big winners and big losers based on correctly anticipating the technology path   said Bob Merritt  an independent consultant to the chip industry  The result is firms merging to pool skills and technology  with early movers prodding those fearful of being left behind   Microsemi Corp   O MSCC  of the United States became the latest dealmaker on Tuesday with a  2 5 billion offer for compatriot PMC Sierra Inc  O PMCS    There is no panic but there certainly is a sense of urgency   said Pallavi Madakasira of Lux Research  CONFUSION China s role has been as much to confuse as galvanize  Some deals  such as Tsinghua s 15 percent purchase of  Western Digital  Corp  O WDC   involve low margin  commodity type hard disk drives and memory chips with seemingly limited growth prospects   Some of the activity I don t quite understand   Mark Liu  president and co chief executive officer at Taiwan Semiconductor Manufacturing Co Ltd  TW 2330   said in an interview  Analysts attribute much of the activity to Chinese aspirations as an emerging superpower to become self sufficient in stand out industries  by controlling all aspects of a business and developing products to rival established players  With the industry already in flux  China s ambition makes it increasingly difficult to predict how the landscape will change   As people sort of rationalize these acquired businesses and cut back on development  where is your growth coming from in three to five years   said analyst Gus Richard at Northland Securities  
 It s hard to start making predictions because people are doing things outside of what I would think would be normal behavior  ",2015-11-25,Reuters,https://www.investing.com/news/technology-news/china's-chip-crusade-to-intensify-sector's-record-m-amp;a-run-373002,373002
174621,396137,WDC,Western Digital investor Alken pushes to cancel SanDisk deal,news," Reuters    Alken Asset Management  one of the biggest shareholders of hard disk drive maker  Western Digital  Corp  O WDC   has asked the company to consider cancelling its deal to buy SanDisk Corp  O SNDK   citing a high purchase price  Western Digital agreed to buy SanDisk in a  19 billion deal in October to help increase its ability to make flash memory storage chips used in smartphones and tablets  The London based investment manager  Alken Asset  said weakness in the storage chip market has hurt Sandisk s stock price which in turn will hurt Western Digital if the deal goes through   The price being paid for SanDisk is excessive in light of the changing landscape for SanDisk s products and capital markets considerations   said Vincent Rech  analyst at Alken Asset Management  Shares of Western Digital have fallen about 40 percent since the deal was announced  They were up 3 39 percent in afternoon trading  
SanDisk s stock has dropped about 16 5 percent year to date as it grappled with falling prices in the flash memory market and lean inventory levels ",2016-02-22,Reuters,https://www.investing.com/news/technology-news/western-digital-investor-alken-pushes-to-cancel-sandisk-deal-385849,385849
174624,396140,WDC,Western Digital says China s Unisplendour drops investment plan,news,"By Arathy S Nair  Reuters     Western Digital  Corp  O WDC  said China s Unisplendour Corp Ltd  000938 SZ  backed out from buying a stake in the hard disk maker  forcing the U S  company to cut the price of its proposed offer for rival SanDisk Corp  O SNDK  by 9 percent  Unisplendour  a unit of China s state backed Tsinghua Holdings Co Ltd  had said in September it would buy a 15 percent stake in Western Digital for  3 78 billion   The Chinese company scrapped its investment plan after a decision by the Committee on Foreign Investment in the United States  CFIUS  to investigate the deal  Western Digital said  Western Digital shares were down 7 4 percent in premarket trading  Shares of SanDisk  which the latest offer values at  15 78 billion  were down 3 2 percent  SanDisk did not immediately reply to requests for comment  Western Digital affirmed its commitment to buy SanDisk Corp  O SNDK  on Tuesday  the day after shareholder Alken Asset Management asked the company to drop the deal  saying the price was too high  Western Digital  which reached a deal to buy SanDisk for  19 billion in October  had said then it would revise the cash and stock offer if the Unisplendour investment fell through  Based on Western Digital s Monday close  the company said it would now pay  78 50 per share in cash and stock for SanDisk  compared with its previous offer of  86 50   Western Digital said it has received regulatory approvals for the SanDisk deal from the United States and European Union among others  CFIUS  an inter agency panel led by the Treasury Department  assesses potential mergers to ensure they do not endanger national security  The agency s objections have created roadblocks for some Chinese deals  
Fairchild Semiconductor  O FCS  rejected an offer from China Resources Microelectronics Ltd  CHRMI UL  and Hua Capital Management Co Ltd this month  citing concerns about U S  approvals ",2016-02-23,Reuters,https://www.investing.com/news/stock-market-news/western-digital-says-china's-unisplendour-drops-investment-plan-385992,385992
174625,396141,WDC,U S  lawmaker to introduce bill to broaden CFIUS mandate beyond security concerns,news,By Diane Bartz WASHINGTON  Reuters    A Democratic lawmaker will introduce a bill on Thursday that seeks to broaden the powers of a U S  government panel that reviews mergers for national security concerns  including giving it the ability to block a deal if it could cause job losses  but it faces an uphill battle in the Republican controlled House  According to a draft copy of the proposed legislation reviewed by Reuters  the multi agency Committee on Foreign Investment in the United States  CFIUS  would be able to review a deal  to determine whether such transaction is of net benefit to the United States   If the legislation passed  CFIUS would consider a proposed deal s effect on employment  product innovation  and public health and safety  as well as national security  according to the draft reviewed by Reuters  It would also consider factors like whether a foreign company purchasing a U S  company abides by U S  rules concerning disclosure and transparency  But it is unclear whether the measure  which will be introduced by Connecticut Rep  Rosa DeLauro  has support from other lawmakers in the House  A spokesman for Republicans in the House Committee on Financial Services  which considered an earlier version of the bill in 2014  did not immediately respond to a request for comment  Even if the DeLauro bill passed the House  there would need to be companion legislation passed in the Senate and then it would still need to get signed into law by President Barack Obama  There is currently no companion bill in the Senate  according to a source on Capitol Hill  DeLauro introduced her previous bill following the U S  approval of China based Shuanghui International Holdings Ltd s  4 7 billion acquisition of pork producer Smithfield Foods Inc  but it never went to the full House for a vote  TALL ORDER While the House bill does not target China specifically  it could have most implications for the country  In 2014  the last year for which data is available  CFIUS looked at more deals involving China than any other country for the third year in a row  It comes amid signs of increased concerns in Washington about a flurry of proposed takeovers of American companies by Chinese entities  Still  such sweeping legislation could be a tall order for the administration at a time of already tense Sino U S  relations  Earlier this month  46 U S  lawmakers  most of them Republicans  urged CFIUS to take a hard look at a bid by a Chinese company  Chongqing Casin Enterprise Group  to buy the storied Chicago Stock Exchange because of fears that the deal would give China access to the data of U S  companies who use the exchange  In the past few weeks alone  CFIUS concerns have killed three proposed Chinese investments  On Tuesday   Western Digital  Corp  O WDC  said China s Unisplendour Corp Ltd  000938 SZ  backed out of buying a stake in the U S  company because CFIUS planned to probe it ,2016-02-24,Reuters,https://www.investing.com/news/politics-news/u.s.-lawmaker-to-introduce-bill-to-broaden-cfius-mandate-beyond-security-concerns-386376,386376
174638,396154,WDC,Chipmaker Synaptics rejects Chinese firm s offer  Bloomberg,news, Reuters    Touchscreen chip maker Synaptics Inc rejected an offer from a Chinese investment group valuing the company at nearly  4 billion  Bloomberg reported on Wednesday  The Chinese state backed group bid  110 per share for Synaptics  Bloomberg reported  citing people familiar with the matter   The offer price is a near 70 percent premium to Synaptics  Tuesday close   The company s shares rose as much as 26 percent to  81 86 on Wednesday   Synaptics is not interested in selling at that level  one person told Bloomberg  and added that Synaptics might be holding out for a bid as high as  125 per share  A  125 per share bid would value Synaptics at  4 5 billion  based on the company s outstanding shares on Aug  14   The Bloomberg report did not name the Chinese company  A Synaptics spokesman declined to comment  Earlier on Wednesday  U S  data storage company  Western Digital  Corp  NASDAQ WDC  said a unit of Tsinghua Holdings Co Ltd would buy a 15 percent stake in the company for  3 78 billion ,2015-09-30,Reuters,https://www.investing.com/news/technology-news/chipmaker-synaptics-rejects-chinese-firm's-offer:-bloomberg-364048,364048
174639,396155,WDC,Western Digital in advanced talks to acquire SanDisk  sources,news,"By Greg Roumeliotis  Reuters    Hard disk drive maker  Western Digital  Corp  O WDC  is in advanced talks to acquire memory chipmaker SanDisk Corp  O SNDK   people familiar with the matter said on Monday  as a frenzy of dealmaking in the semiconductor sector continued  Western Digital has so far prevailed over other suitors for SanDisk  which has a market capitalization of  14 6 billion  the people said  The negotiations are ongoing and a deal is not certain  the people added  Bloomberg News  which reported on the advanced talks earlier on Monday  said the two companies could reach a deal as soon as this week  Western Digital declined to comment  SanDisk did not immediately respond to a request seeking comment  Demand for cheaper chips and new products  as well a driver from technology companies to consolidate suppliers  has led to record levels of dealmaking in the semiconductor sector this year   Any deal with SanDisk will require a sign off from Toshiba  SanDisk uses Toshiba s foundries to make its chips and the two have an important intellectual property sharing joint venture  Analysts have said Toshiba is more likely to accept Western Digital as a buyer for SanDisk than Micron  a rival memory chip maker  Western Digital  which has a market capital of about  22 billion  is also expected to receive a  4 billion cash infusion from China s state backed Tsinghua Holdings Co Ltd  TSHUAA UL   if the deal passes regulatory scrutiny in the United States  
SanDisk  which is scheduled to report quarterly results on Wednesday  has grappled with falling prices in the flash memory market and lean inventory levels ",2015-10-19,Reuters,https://www.investing.com/news/technology-news/sandisk-in-advanced-talks-to-sell-itself-to-western-digital:-bloomberg-366908,366908
174663,396179,WDC,Malaysia police arrest 42 foreigners after riot at export factory,news,By Trinna Leong  KUALA LUMPUR  Reuters    Malaysian police have arrested 42 men after a riot by up to 1 000 mostly Nepalese workers sparked fires and destroyed parts of an electronics export factory  highlighting accusations of poor conditions for many of the estimated four million foreign workers in the Southeast Asian country   The riot broke out in the southern industrial hub of Johor state on Tuesday at a factory run by JCY International  KL JCYI   a Malaysian firm that makes parts for electronic giants including Samsung   Hitachi  T 6501  and Western Digital  O WDC    Workers had accused the firm of negligence after an employee at a nearby JCY factory died last Thursday after complaining of chest pains  according to local news reports   The unrest spilled over to the firm s other factory in Kulaijaya  police said  culminating in a stand off between riot police and protesters  The factory suspended operations on Wednesday    This was caused by a misunderstanding between the employer and employees over the terms of their work   the district s deputy police chief  Mohad Idris Samsuri  told Reuters   Those arrested would be charged under the anti rioting law  he said   JCY  which specializes in manufacturing parts for hard disk drives  issued a statement to the stock exchange saying that the unrest would not impact its business    The company is currently taking active steps and measures to address the above matter and to reach an amicable settlement with the workers   it said   Malaysia s record on treating foreign workers is under scrutiny after the U S State Department downgraded the country in June to Tier 3 in its 2014 Trafficking in Persons Report  triggering potential sanctions  The report cited widespread problems of forced labor and a lack of enforcement by the authorities as major reasons for the downgrade   Malaysia s large electronics  plantation and construction industries rely heavily on unskilled foreign labor from countries such as Indonesia  Bangladesh and Nepal   The immigrants often arrive in Malaysia heavily in debt after paying high fees to labor agencies and are commonly given substantially lower salaries and even different jobs to the ones they were promised  according to studies by advocacy groups   Verite  a non profit organization that deals with labor issues  says companies commonly withhold workers  passports and have poor health and safety practices In 2010  over 5 000 foreign workers protested against JCY after a similar incident when a Nepalese employee died from a high fever  Workers had alleged that the management was slow in sending the employee to hospital   Last week  three Bangladeshi workers died when a 300 tonne concrete section fell on them at a railway construction site line in Kuala Lumpur     Reporting By Trinna Leong  Editing by Stuart Grudgings ,2014-08-27,Reuters,https://www.investing.com/news/world-news/malaysia-police-arrest-42-foreigners-after-riot-at-export-factory-305797,305797
174664,396180,WDC,NSA chief declines comment on spyware reports  says programs lawful,news,"By Warren Strobel WASHINGTON  Reuters    The head of the National Security Agency refused to comment on Monday on reports that the U S  government implants spyware on computer hard drives for surveillance purposes  saying  we fully comply with the law   U S  Navy Admiral Michael Rogers was responding to reports that the NSA had embedded spyware in computers on a vast scale and that along with its British counterpart  had hacked into the world s biggest manufacturer of cellphone SIM cards   Clearly I m not going to get into the specifics of allegations  But the point I would make is  we fully comply with the law   Rogers said at a Washington forum sponsored by the New America think tank  The Moscow based security software maker Kaspersky Lab said last week that the NSA had figured out how to embed spy software deep within hard drives by Western Digital  NASDAQ WDC O   Seagate  Toshiba and other top manufacturers  giving the agency the means to eavesdrop on a majority of the world s computers  Another report  based on documents provided by former NSA contractor Edward Snowden and published by the Intercept site  said the U S  agency and its British counterpart hacked into Gemalto  AMS GTO   which produces SIM cards  That would potentially allow intelligence agencies to monitor the calls  texts and emails of billions of people  the report said   ID nL5N0VU1CG  Rogers  whose agency has come under intense scrutiny since 2013 when Snowden exposed details of its widespread surveillance programs  said   I am not going to chase every allegation out there  I don t have time   Even as he declined comment on the reports of aggressive NSA operations  Rogers argued that U S  intelligence  along with law enforcement agencies  needs the legal means to break strong encryption increasingly built into operating systems such as those of Apple or Google   Most of the debate that I ve seen has been   It s all or nothing  It s either total encryption or no encryption at all    Rogers said  
If a specific phone is being used to commit a crime or threaten national security   can t there be a legal framework for how we access that   he asked ",2015-02-23,Reuters,"https://www.investing.com/news/technology-news/nsa-chief-declines-comment-on-spyware-reports,-says-program-are-lawful-329247",329247
