,id,ticker,title,category,content,date,provider,url,article_id
34660,256175,MIDD,Middleby  MIDD  Beats Q3 Earnings On Acquisition Benefits  ,opinion,"Machinery behemoth  The Middleby Corporation   NASDAQ MIDD    reported mixed third quarter 2016 results  Though the company s top line lagged the Zacks Consensus Estimate  the bottom line surpassed expectations The company s quarterly earnings of  1 33 cents per share surpassed the Zacks Consensus Estimate of  1 25  Also  the bottom line improved from the year ago tally by 54 7   The impressive year over year growth was primarily backed by higher sales and productive integration initiatives undertaken by the company Net sales came in at  574 2 million  up 27 9  year over year  The upside stemmed from higher sales accrued from Middleby s acquired businesses  Notably  excluding the adverse impact of foreign currency translations  quarterly year over year organic sales growth was 1 4  However  the top line fell short of the Zacks Consensus Estimate of  598 million Segmental DetailsMiddleby reports its net sales under three heads segments  The segmental results are briefly discussed below Revenues from the Commercial Foodservice Equipment Group totaled  331 6 million  up 14  year over year  The year over year improvement was driven by higher sales generated by Follett Corporation  Middleby had closed the acquisition on May 31  2016  However  organic net sales of the segment inched up by 0 6  year over year   Revenues from the Food Processing Equipment Group grew 10 8  year over year to  82 2 million  The segment s organic sales were up 11 2  year over year  eliminating the foreign exchange impact Revenues from the Residential Kitchen Equipment Group were  160 5 million  up 91 3  year over year  The remarkable upside was driven by higher sales generated from AGA Rangemaster Group plc and Lynx Grills  Inc  Middleby had successfully acquired the two companies in 2015 MarginsIn the reported quarter  Middleby s cost of sales jumped 26  year over year to  342 5 million  This represents 59 6  of net sales compared with 60 5  in the year ago quarter  Gross margin expanded 90 basis points  bps  year over year to 40 4   on the back of the benefits generated from the company s integration initiatives Selling and distribution expenses came in at  56 6 million  up 27 2  year over year while operating income surged 51 8  to  121 4 million Balance SheetMiddleby exited the third quarter with cash and cash equivalents of  61 8 million compared with  55 5 million recorded at the end of 2015  Long term debt was  826 5 million compared with  734 million reported at the end of 2015 OutlookMiddleby believes that higher demand of restaurant chain customers would likely boost sales of Commercial Foodservice Equipment Group segment in the quarters ahead  Fresh product launches of the Viking range and superior customer services are expected to reinforce revenue of the company s Residential Kitchen Equipment Group  Also  higher demand for novel equipment solutions is estimated to drive revenue of Middleby s Food Processing Equipment Group moving ahead MIDDLEBY CORP Price  Consensus and EPS Surprise
    Zacks Rank and Stocks to ConsiderMiddleby currently carries a Zacks Rank  3  Hold   You can see  Some better ranked stocks within the industry that warrant a look include ACCO Brands Corporation   NYSE ACCO   currently sports a Zacks Rank  1 and has an average positive earnings surprise of 23 93  over the four trailing quarters Applied Industrial Technologies  Inc    NYSE AIT   currently carries a Zacks Rank  2  Buy  and has an average positive earnings surprise of 4 93  over the last four quarters AO Smith Corp    NYSE AOS   currently carries a Zacks Rank  2 and has an average positive earnings surprise of 5 88  over the trailing four quarters Zacks  Best Private Investment IdeasIn addition to the recommendations that are available to the public on our website  how would you like to follow all Zacks  private buys and sells in real time Our experts cover all kinds of trades  from value to momentum       from stocks under  10 to ETF and option moves       from stocks that corporate insiders are buying up to companies that are about to report positive earnings surprises  You can even look inside exclusive portfolios that are normally closed to new investors  Starting today  for the next month  you can have unrestricted access ",2016-11-09,Zacks Investment Research,https://www.investing.com/analysis/middleby-(midd)-beats-q3-earnings-on-acquisition-benefits-200163633,200163633
34661,256176,MIDD,ABB Wins Order To Supply Transformers For Indian Railways,opinion,Swiss technology giant ABB Ltd    NYSE ABB   recently announced that it has won an order from Alstom  PA ALSO  to supply 1600 traction transformers for 800 new electric freight locomotives in India Indian Railways   the worlds  second largest rail network   manages more than 12 500 trains and 23 million passengers daily  The new locomotives have been added to expand its capacity on busy routes for both freight and passenger services  The transformers will be manufactured in ABB s Vadodara facility in Gujarat to support the Indian government s  Make in India  initiative Per the contract  ABB will provide 25 kilovolt  kV  50 hertz  Hz  underframe traction transformers for the 800 locomotives  The company s transformers have been engineered to deliver flawless performance even in challenging conditions  including extreme temperatures and voltage fluctuations  ABB s traction transformers have earned a solid reputation among clients  supplying feed power at safe voltages for essential train functions like traction  brakes  lighting  heating and ventilation ABB LTD ADR Price    This new order from Alstom strengthens ABB s long standing partnership with the company  As a matter of fact  ABB has been winning strategic awards that can fuel its growth momentum  During fourth quarter 2016  the company won an order of  40 million to provide advanced power equipment to the 800 kV Dianxibei Guangdong ultra high voltage direct current  UHVDC  transmission link in China ABB is one of the best managed industrial infrastructure  power and automation companies in the world  It that stands to benefit from investments made in the upgrade of power infrastructure and its focus on reduction of energy intensity across all end markets  Over the long haul  this Zacks Rank  3  Hold  company believes that its prospects are bright for all the three major markets  namely utilities  industry  and transport   infrastructure Stocks to ConsiderBetter ranked stocks in the industry include Applied Industrial Technologies  Inc    NYSE AIT    The Middleby Corporation   NASDAQ MIDD   and Smith Corp    NYSE AOS    All three stocks carry a Zacks Rank  2  Buy   You can see  Applied Industrial Technologies is one of North America s leading distributors of bearings  linear technologies  power transmission components  rubber products and specialty maintenance items to the MRO and OEM markets  The company managed to beat estimates thrice over the trailing four quarters and has a positive earnings surprise of 4 9  Headquartered in Milwaukee  WI  A O  Smith is one of the leading manufacturers of commercial and residential water heating equipment  as well as water treatment products in the world  The company has an excellent earnings surprise history  beating estimates each time over the trailing four quarters  with an average positive surprise of 5 9  Elgin  IL based Middleby Corporation provides cooking  warming  food preparation and packaging equipment to commercial  industrial processing and residential markets  The company has beaten earnings in each of the trailing four quarters  resulting in an average surprise of 15 9  The Best Place to Start Your Stock SearchToday  you are invited to download the full list of 220 Zacks Rank  1   Strong Buy   stocks   absolutely free of charge  Since 1988  Zacks Rank  1 stocks have nearly tripled the market  with average gains of  26  per year  Plus  you can access the list of portfolio killing Zacks Rank  5   Strong Sells   and other private research ,2016-11-15,Zacks Investment Research,https://www.investing.com/analysis/abb-wins-order-to-supply-transformers-for-indian-railways-200164962,200164962
34662,256177,MIDD,Republic Services Hits 52 Week High On Solid Q3 Results,opinion,"Shares of Republic Services  Inc    NYSE RSG   hit a 52 week high of  54 92 on Nov 15  closing a notch lower at  54 91  reflecting a healthy year to date return of 24 8   Despite the strong price appreciation  this Zacks Rank  3  Hold  stock still has more room to run  The stock is currently trading at a forward P E of 24 7x and has long term earnings growth expectation of 8 5  Growth DriversRepublic Services continued with its steady performance in third quarter 2016 with adjusted earnings of  212 6 million or 62 cents per share  compared with  184 7 million or 53 cents in the year earlier quarter  Adjusted earnings in the reported quarter exceeded the Zacks Consensus Estimate by 4 cents Revenues improved 2 8  year over year to  2 409 3 million and were in line with the Zacks Consensus Estimate  The upside in revenues was driven by a 2 1  rise in average yield and a 0 6  increase in volume  partially offset by lower fuel recovery fees of 0 6   Core price boosted revenues by 3 2  during the quarter REPUBLIC SVCS Price and Consensus
    In concurrence with the solid quarterly results and expectations that recycled commodity prices will remain at current levels for the remainder of the year  management raised the guidance for 2016  The company expects adjusted earnings in the range of  2 19  2 20 per share  up from the prior guidance of  2 13  2 17  Additionally  adjusted free cash flow is projected in the band of  840  850 million  above the earlier projection of  820  840 million  The current Zacks Consensus Estimate for 2016 is pegged at  2 19  well within the guided range Republic Services also offered a preliminary outlook for 2017 on the basis of the current economic conditions  Adjusted earnings are expected within  2 31  2 36 per share  while adjusted free cash flow is expected between  875 million and  900 million  Both the performance metrics represent mid to high single digit growth compared to 2016 The company is currently focusing on increasing its operational efficiency by converting to compressed natural gas collection vehicles and conversion of rear loading trucks to automated side loaders  which will reduce cost and improve profitability  Republic Services is focused on enhancing its operations by streamlining the cost structure  improving revenue quality and seeking growth through profitable investment opportunities The company is also realigning its field support functions by combining two organizational layers and expects these initiatives to rake in approximately  25 million of annual cost savings starting 2018  As part of the realignment program  the company centralized the management structure for recycling operations  The new organizational structure is likely to ensure a clear ownership for the recycling and processing market vertical  Republic Services is further transitioning to a fee based recycling processing model to cover processing costs and generate a healthy ROI These strategic steps along with the healthy third quarter 2016 results might have boosted investor confidence  catapulting the shares to a new 52 week high Stocks to ConsiderSome better ranked stocks in the industry include Waste Management  Inc    NYSE WM    Applied Industrial Technologies  Inc    NYSE AIT   and Middleby Corp    NASDAQ MIDD    each carrying a Zacks Rank  2  Buy   You can see  Waste Management is currently trading at a forward P E of 23 2x and has beaten estimates in each of the trailing four quarters  the average earnings surprise being 4 8  Applied Industrial has a long term earnings growth expectation of 12  and is currently trading at a forward P E of 21 8x Middleby has a long term earnings growth expectation of 22  and is currently trading at a forward P E of 25 9x The Best Place to Start Your Stock SearchToday  you are invited to download the full list of 220 Zacks Rank  1  Strong Buy  stocks   absolutely free of charge  Since 1988  Zacks Rank  1 stocks have nearly tripled the market  with average gains of  26  per year  Plus  you can access the list of portfolio killing Zacks Rank  5  Strong Sells  and other private research ",2016-11-15,Zacks Investment Research,https://www.investing.com/analysis/republic-services-hits-52-week-high-on-solid-q3-results-200164925,200164925
34700,256215,MIDD,What Led Stanley Black   Decker To A New 52 Week High ,opinion,"Shares of Stanley Black   Decker  Inc    NYSE SWK   reached a new 52 week high of  118 47 on Jul 14  before closing the trading session slightly lower at  117 46  This apex improved upon the last 52 week high of  117 61 reached on Jul 13  2016 
The machinery company yielded a year to date return of 11 2   The trading volume for the session was 0 59 million shares  Positive earnings estimate revisions for 2016  along with an expected earnings growth rate of 10 2  for the next five years indicate the scope for further stock price appreciation Growth DriversStanley Black   Decker s financial results have been impressive in three out of four trailing quarters  with an average positive earnings surprise of 4 54   Last quarter  the company s earnings of  1 32 per share surpassed the Zacks Consensus Estimate of  1 19 by 10 9   The company s share price has gained roughly 5 1  since the first quarter earnings release on Apr 21 For 2016  Stanley Black   Decker anticipates earnings per share to be within  6 20  6 40 range  above  6 00  6 20 projected earlier  Organic revenue is expected to grow within 3 4  as compared with 3  anticipated earlier  The revised forecast is driven by improved Tools   Storage business as well as lower currency headwinds 
On a segmental basis  organic revenues are projected to increase in mid single digit range for Tools   Storage segment and in low single digits for Security segments  For the Industrial segment  organic revenue is predicted to be relatively flat  In addition  Stanley Black   Decker remains focused on development of innovative products as well as enhancement of global cost competitiveness  Also  industrial production in the U S improved 0 6  month on month in April but inched down 0 4  in May  Despite these mixed data  we believe improvements in the industrial production in the country will help machinery companies like Stanley Black   Decker to boost their businesses Estimate Revisions Show PotencyOver the last 60 days  the Zacks Consensus Estimate for Stanley Black   Decker grew 0 16  to  6 36 for 2016  while the same grew 1 2  to  1 71 for second quarter 2016  These estimates represent year over year growth of 3 9  for 2016 and 10 8  for the second quarter  Also  the company has an  of  1 10  for 2016 STANLEY B D INC Price and Consensus
   With a market capitalization of  17 6 billion  Stanley Black   Decker currently carries a Zacks Rank  3  Hold   Some better ranked stocks in the machinery industry include Middleby Corp    NASDAQ MIDD    Nordson Corp    NASDAQ NDSN   and IDEX Corp    NYSE IEX    While both Middleby and Nordson sport a Zacks Rank  1  Strong Buy   IDEX Corporation carries a Zacks Rank  2  Buy  ",2016-07-15,Zacks Investment Research,https://www.investing.com/analysis/what-led-stanley-black---decker-to-a-new-52-week-high-200142188,200142188
34760,256275,MIDD,3 Stocks To Watch  LMAT  NVRO  SIEN,opinion,"The stock market had a nasty little slide in the morning on Monday  new lows for the pullback  and then a nice rally  particularly in the last forty minutes to pick the markets up  dramatically 70 points on the Nasdaq  and then a little pullback at the end with a nice close  Let s see if there is a pullback on Tuesday  We re going to take a look at some longs and shorts 
LeMaitre Vascular  Inc   O LMAT   which is one of our swing trades  after pulling back to the trendline  50  and price support  bounced nicely on Monday  up 67 cents to 15 76  or 4 4   on 219 600 shares traded  In the midst of the morning market it was up  too  That s not heavy volume  but okay for this stock  Eventually it will get up into the 20 range  but the target is 18 1 2 
Nevro Corp   N NVRO  popped out of a 4 week flag pattern on Monday  up 3 82 to 68 50  or 5 9   on 1 1 million shares  but traded as high as 72 51  Look for it to reach the mid to high 80s 
Sientra  Inc   O SIEN  completed a head and shoulder pattern  consolidated  moved up  pulled back  closed poorly on Friday  and then on Monday it had an inside day  but a positive one  jumping 1 36 to 7 94  or 21   on 2 3 million shares  The gap may be tested as early as Tuesday at 8 85  If it gets through that the target is 11 1 2 
Stocks on the long side included VelocityShares 3x Inverse Crude Oil ETN  N DWTI   ProShares UltraShort Bloomberg Crude Oil  N SCO   Direxion Daily Energy Bear 3X ETF  N ERY   FXCM Inc   N FXCM   Direxion Daily S P Biotech Bear 3X ETF  N LABD   and Lululemon Athletica Inc   O LULU  
Stocks on the short side included ACADIA Pharmaceuticals Inc   O ACAD   AmSurg Corp   O AMSG   ANI Pharmaceuticals  Inc   O ANIP   BioMarin Pharmaceutical Inc   O BMRN   Criteo SA  O CRTO   Global Payments Inc   N GPN   Inogen  Inc   O INGN   Middleby Corp   O MIDD   and The WhiteWave Foods Company  N WWAV  ",2016-01-11,Harry Boxer,"https://www.investing.com/analysis/lmat,-nvro,-sien-379589",379589
34761,256276,MIDD,3 Stocks To Watch  CREE  SIEN  XON,opinion,"It was a tough day on Wall Street on Monday  but there was a nice rally at the end of the day that brought a lot of stocks back  What s interesting is how the gold is acting  Of course  with the market pulling back gold is up and vice versa  Several of the stocks that we expected to move did move right up to the resistance zone and backed off  Let s take a look at what others stocks are doing 
Cree  Inc   O CREE  didn t do much on Monday  but for a down day this stock was up a nickel to 28 93  on 2 5 million shares  It held its own on a nice day above support with a breakout from the base  It needs more volume  That s one of the things it was missing on the breakout  Watch it carefully  I could see it consolidating  Target is 32 00 
Sientra  Inc   O SIEN   after news on Monday that they will resume selling their breast implant devices in the US  shot up to 10 45  and pulled back to 9 96  up 1 36 or 16   on 2 44 million shares  It was a good day for this stock  OBV hit new highs  It looks to me like it still wants to go higher  Targets are 12 1 2 and 13 3 4 
Intrexon Corporation  N XON  had a nice inside day on a low volume of 1 9 million shares on Monday  the lowest volume in about 7 sessions  It was actually down 95 cents to 35 02  or 2 64   It looks like it wants to go higher  Target is in the 41 44 zone 
Other stocks on the long side included Barrick Gold Corporation  N ABX   Direxion Daily Jr Gld Mnrs Bull 3X ETF  N JNUG   Direxion Daily Gold Miners Bull 3X ETF  N NUGT   Cree  Inc   CREE   Direxion Daily S P Biotech Bear 3X ETF  N LABD   Direxion Daily S P Biotech Bull 3X ETF  N LABU  ProShares UltraShort Bloomberg Crude Oil  N SCO   Sientra  Inc   SIEN   Supernus Pharmaceuticals  Inc   O SUPN   and Intrexon Corporation  XON  
Stocks on the short side included AmSurg Corp   O AMSG   Criteo SA  O CRTO   Comfort Systems USA Inc   N FIX   Global Payments Inc   N GPN   Luxoft Holding  Inc   N LXFT   Middleby Corp   O MIDD   Qlik Technologies  Inc   O QLIK   Qualys  Inc   O QLYS   and LendingTree  Inc   O TREE  ",2016-02-08,Harry Boxer,"https://www.investing.com/analysis/cree,-sien,-xon-383732",383732
34762,256277,MIDD,Can Middleby  MIDD  Stock Continue To Grow Earnings  ,opinion,Growth stocks can be some of the most exciting picks in the market  as these high flyers can captivate investors  attention  and produce big gains as well  However  these can also lead on the downside when the growth story is over  so it is important to find companies which are still seeing strong growth prospects in their businesses One such company that might be well positioned for future earnings growth is Middleby Corp    NASDAQ MIDD    This firm  which is in the Machinery General Industrial space  saw EPS growth of 12 7  last year  and is looking great for this year too In fact  the current growth estimate for this year calls for earnings per share growth of 18 4   Furthermore  the long term growth rate is currently an impressive 22   suggesting pretty good prospects for the long haul And if this wasn t enough  the stock has actually seen estimates rise over the past month for the current fiscal year by about 0 9   Thanks to this rise in earnings estimates  MIDD has a Zacks Rank  2  Buy  which further underscores the potential for outperformance in this company So if you are looking for a fast growing stock that is still seeing plenty of opportunities on the horizon  make sure to consider MIDD  Not only does it have double digit earnings growth prospect  but its impressive Zacks Rank suggests that analysts believe better days are ahead for MIDD as well ,2016-05-23,Zacks Investment Research,https://www.investing.com/analysis/can-middleby-(midd)-stock-continue-to-grow-earnings-200131862,200131862
34763,256278,MIDD,Middleby  MIDD  Upgraded To Buy On Strong Growth Drivers,opinion,On Mar 23  2016  Zacks Investment Research upgraded Middleby Corp    NASDAQ MIDD   to a Zacks Rank  2  Buy  from a Zacks Rank  3  Hold   Going by the Zacks model  companies carrying a Zacks Rank   2 have better chances of performing than the broader market over the upcoming quarters Why the Upgrade Middleby is steadily improving its profitability and sales on the back of its solid product portfolio  new product launches as well as diversified business growth  Middleby aims to improve its financial performance as well as customer base over the next five years through suitable business initiatives  The company aims to gain sustainability through food waste reduction and energy saving  These initiatives are expected to help the organization improve margins and bolster earnings in the upcoming quarters  Moreover  Middleby hopes to generate greater amount of cash flows from its operating activities on the back of efficient cost saving strategies  The company aims to utilize the savings for lucrative capital deployment programs to improve its shareholders  returns in the near future  We even believe that the company s latest acquisition of renowned companies such as Induc Commercial Electronics Co  Ltd  and Follett Corporation would further help in boosting sales in the near term Other Stocks to ConsiderOther well ranked stocks within the industry include Gorman Rupp Co    NYSE GRC    Kadant Inc    NYSE KAI   and Luxfer Holdings PLC   NYSE LXFR    All the three stocks presently sport a Zacks Rank  1  Strong Buy  Want the latest recommendations from Zacks Investment Research  Today  you can download 7 Best Stocks for the Next 30 Days ,2016-05-23,Zacks Investment Research,https://www.investing.com/analysis/middleby-(midd)-upgraded-to-buy-on-strong-growth-drivers-200131837,200131837
34764,256279,MIDD,How Middleby Corp   MIDD  Stock Stands Out In A Strong Industry,opinion,One stock that might be an intriguing choice for investors right now is Middleby Corporation   NASDAQ MIDD    This is because this security in the Machinery General Industrial space is seeing solid earnings estimate revision activity  and is in great company from a Zacks Industry Rank perspective This is important because  often times  a rising tide will lift all boats in an industry  as there can be broad trends taking place in a segment that are boosting securities across the board  This is arguably taking place in the Machinery General Industrial space as it currently has a Zacks Industry Rank of 46 out of more than 250 industries  suggesting it is well positioned from this perspective  especially when compared to other segments out there Meanwhile  Middleby Corp   is actually looking pretty good on its own too  The firm has seen solid earnings estimate revision activity over the past month  suggesting analysts are becoming a bit more bullish on the firm s prospects in both the short and long term In fact  over the past month  current quarter estimates have risen from  1 08 per share to  1 09 per share  while current year estimates have risen from  4 41 per share to  4 53 per share  This has helped MIDD to earn a Zacks Rank  2  Buy   further underscoring the company s solid position So  if you are looking for a decent pick in a strong industry  consider Middleby Corp  Not only is its industry currently in the top third  but it is seeing solid estimate revisions as of late  suggesting it could be a very interesting choice for investors seeking a name in this great industry segment ,2016-06-03,Zacks Investment Research,https://www.investing.com/analysis/how-middleby-corp.-(midd)-stock-stands-out-in-a-strong-industry-200133916,200133916
