,id,ticker,title,category,content,date,provider,url,article_id
24740,246255,LAMR,Extra Space  EXR  Surpasses Q3 FFO Estimates  Lifts View,opinion,Extra Space Storage Inc  s   NYSE EXR   third quarter 2017 funds from operations  FFO  as adjusted per share of  1 13 surpassed the Zacks Consensus Estimate of  1 10  The figure also came in 10 8  higher than  1 02 cents recorded in the prior year quarter Results reflect growth in property rental revenues and improvement in same store net operating income  NOI   Further  higher occupancy and rental rates supported growth Quarterly revenues of  284 2 million climbed 10 5  year over year and also outpaced the Zacks Consensus Estimate of  277 million  Extra Space Storage Inc Price  Consensus and EPS Surprise    Note  The EPS numbers presented in the above chart represent funds from operations  FFO  per share Behind the HeadlinesSame store revenues were up 4 8  year over year to  220 million during the third quarter  while same store NOI climbed 5 5  to  160 9 million  The increase in same store revenues was driven by higher rental rates for both new and existing customers  as well as gains in occupancy  Same store occupancy was 93 9  as of Sep 30  2017  up 140 basis points from 92 5  as of Sep 30  2016 Notably  year to date Las Vegas  Los Angeles  Orlando and Sacramento were the major markets which recorded revenues growth above the company s portfolio average  However  markets which performed below the company s portfolio average included Boston  Dallas  Denver and Houston Portfolio ActivityExtra Space Storage acquired three operating stores and one store at completion of construction  for a total price of around  31 8 million  Also  the company purchased one Certificate of Occupancy store with a joint venture partner for  8 8 million Notably  as of Sep 30  2017  the company managed 485 stores for third party owners  Moreover  with an additional 184 stores owned and operated in joint ventures  the company s total stores under management reached 669 Balance SheetExtra Space Storage exited third quarter 2017  with roughly  63 7 million of cash and cash equivalents  up from  43 9 million at the end of 2016  As of Sep 30  2017  the company s percentage of fixed rate debt to total debt was 80 8  In addition  the company had  349 4 million available for issuance under the ATM program as of Sep 30  2017 OutlookExtra Space Storage revised its outlook for 2017  The company now anticipates FFO as adjusted per share in the band of  4 32  4 35  against the prior guided range of  4 25  4 32  The Zacks Consensus Estimate for the same is currently pegged at  4 30 The company projects same store property revenue growth of 4 5 5  and same store property NOI growth of around 5 75 6 5  for the year In ConclusionWe are encouraged with the better than expected performance of Extra Space Storage in the third quarter  It has a high brand value  We are also impressed by the company s business expansion efforts which has led to an increase in its branded store count as well as stores managed for third party owners Subsequently  the company has also made efforts to expand its footprint and fortify its position in core markets Extra Space Storage currently has a Zacks Rank  2  Buy   You can see The stock has gained 5 6  year to date  outperforming 4  growth registered by the  We are now looking forward to the earnings releases of Lamar Advertising Company   NASDAQ LAMR    EPR Properties   NYSE EPR   and Outfront Media Inc    NYSE OUT   all of which are expected to report in the upcoming days Note  FFO  a widely used metric to gauge the performance of REITs  is obtained after adding depreciation and amortization and other non cash expenses to net income Zacks  Best Private Investment IdeasWhile we are happy to share many articles like this on the website  our best recommendations and most in depth research are not available to the public Starting today  for the next month  you can follow all Zacks  private buys and sells in real time  Our experts cover all kinds of trades  from value to momentum       from stocks under  10 to ETF and option moves       from stocks that corporate insiders are buying up to companies that are about to report positive earnings surprises  You can even look inside exclusive portfolios that are normally closed to new investors ,2017-11-01,Zacks Investment Research,https://www.investing.com/analysis/extra-space-exr-surpasses-q3-ffo-estimates-lifts-view-200257961,200257961
24767,246282,LAMR,HCP Tops Q3 FFO  Guides Up  To Lower Brookdale Concentration,opinion,HCP Inc    NYSE HCP     a healthcare real estate investment trust  REIT    reported third quarter 2017 funds from operations  FFO  as adjusted of 48 cents per share  beating the Zacks Consensus Estimate of 46 cents  Comparable FFO as adjusted in the prior year quarter was 50 cents per share Results were driven by growth in the three month same property portfolio  SPP  cash net operating income  NOI   Also  the company raised its 2017 FFO as adjusted guidance range Moreover  HCP generated revenues of  454 0 million  which surpassed the Zacks Consensus Estimate of  450 4 million  However  it compared unfavorably with the year ago tally of  530 6 million Notably  HCP announced that it has entered into transactions that offer a way to lower the company s Brookdale concentration to around 15 7   The company would sell residual 40  investment in RIDEA II to Columbia Pacific Advisors  Further  HCP also announced coming back to the Boston life science market with  228 million acquisition of the Hayden Research Campus HCP  Inc  Price  Consensus and EPS Surprise    Note  The EPS numbers presented in the above chart represent funds from operations   FFO   per share Behind the HeadlinesHCP attained year over year three month cash SPP NOI growth of 3 2   Results were supported by 5 3  increase in Senior housing operating portfolio  SHOP  cash NOI  4 0  growth in Life science  2 7  uptick in Senior housing triple net and 2 5  rise in Medical office portfolio During the third quarter  HCP announced  113 million of additional acquisitions  This brought its year to date announced acquisitions and developments to  447 million  Further  the company sold two triple net senior housing assets leased to Brookdale for  15 million  At the quarter end  HCP s development pipeline aggregated  870 million  Also  the company added  63 million of new projects to its development and redevelopment pipelines HCP exited third quarter 2017 with cash and cash equivalents of around  133 9 million  up from  94 7 million recorded at the end of 2016  It ended the quarter with  1 5 billion of liquidity from a combination of cash and availability under its  2 0 billion credit facility 2017 OutlookHCP raised its 2017 FFO as adjusted guidance range and expects it to be in the band of  1 92  1 96 per share  denoting 2 cents per share increase at the mid point  The Zacks Consensus Estimate for the same is pegged at  1 92 In addition  the company reaffirmed aggregate 2017 SPP cash NOI growth guidance in the range of 2 5 3 5  ConclusionWe believe HCP is well poised to benefit from its diversified portfolio  rise in healthcare spending and an aging population over the long run  Strategic divestitures  efforts to lower the Brookdale portfolio concentration and focus on deleveraging augur well for long term growth  However  rise in interest rates and cut throat competition are major concerns  Also  dilutive impact on earnings in the near term from sale of assets is unavoidable HCP currently has a Zacks Rank  4  Sell   You can see  We now look forward to the earnings releases of Welltower Inc    NYSE HCN    Mack Cali Realty Corporation   NYSE CLI   and Lamar Advertising Company   NASDAQ LAMR    all of which are expected to report in the next week Note   FFO  a widely used metric to gauge the performance of REITs  is obtained after adding depreciation and amortization and other non cash expenses to net income Zacks  Best Private Investment IdeasWhile we are happy to share many articles like this on the website  our best recommendations and most in depth research are not available to the public Starting today  for the next month  you can follow all Zacks  private buys and sells in real time  Our experts cover all kinds of trades  from value to momentum       from stocks under  10 to ETF and option moves       from stocks that corporate insiders are buying up to companies that are about to report positive earnings surprises  You can even look inside exclusive portfolios that are normally closed to new investors ,2017-11-01,Zacks Investment Research,https://www.investing.com/analysis/hcp-tops-q3-ffo-guides-up-to-lower-brookdale-concentration-200257958,200257958
24775,246290,LAMR,Taubman Centers  TCO  Q3 FFO Lags Estimates  Revenues Up Y Y,opinion,Retail real estate investment trust  REIT  Taubman Centers Inc    NYSE TCO   reported third quarter 2017 adjusted funds from operations  FFO  per share of 83 cents  which missed the Zacks Consensus Estimate of 89 cents  The figure also came 11 7  below the year ago tally of 94 cents However  revenues came in at  153 2 million  beating the Zacks Consensus Estimate of  149 0 million  Revenues were also up 3 5  from the prior year quarter The quarter experienced higher rent per square foot  and lower general and administrative expenses Taubman Centers  Inc  Price  Consensus and EPS Surprise    Note  All EPS numbers presented in this write up represent funds from operations  FFO  per share Quarter in DetailTotal portfolio net operating income  NOI  climbed 6 7  for the quarter  However  comparable center NOI edged down 1 3  year over year  Average rent per square foot came in at  60 61  up 0 6  year over year  For the period ended Sep 30  2017  the trailing 12 month releasing spreads per square foot were 6 7  Moreover  comparable center mall tenant sales per square foot inched up 1 6  in the quarter  Further  trailing 12 month comparable center mall tenant sales per square foot was  802  marking increase of 2 8  As of Sep 30  2017  leased space in comparable centers was 96 3   which was 2 7  higher than in place occupancy  Moreover  ending occupancy in comparable centers was 93 6  on Sep 30  2017  reflecting a contraction of 1 4  from the prior year  However  the company anticipates ending occupancy in comparable centers to achieve 96  level by year end LiquidityTaubman Centers exited the third quarter with cash and cash equivalents of  37 8 million  down from  40 6 million at year end 2016 GuidanceTaubman Centers reaffirmed its prior 2017 adjusted FFO per share guidance in the range of  3 67  3 77  However  the company revised its FFO per share guidance to  3 49  3 59 per share from the previous range of  3 53  3 63  The Zacks Consensus Estimate for the year is currently pegged at  3 72 Notably  the company expects its 2017 adjusted FFO more possibly to come in the lower end of the range  This is because the operations of The Mall of San Juan will be affected by Hurricane Maria Yet  the company reaffirmed its prior comparable center NOI guidance and expects it to be in the range of 1 3  for the year  including lease cancellation income Our ViewpointThe company s solid retail portfolio  high quality retailers and diligent restructuring initiatives are likely to support its growth  However  dwindling mall traffic and store closures amid aggressive growth in online sales have kept retail REITs on tenterhooks  This has emerged as a pressing concern for Taubman  Nevertheless  the company is making concerted efforts to backfill spaces created by store closures and tenant bankruptcies  But margins are likely to remain restricted in the near term Currently  Taubman Centers has a Zacks Rank  3  Hold   You can see  The stock has lost 14 3  of its value in the past three months  underperforming the 3 7  decline of the  it belongs to Let us now look forward to the earnings releases of Welltower Inc    NYSE HCN    Mack Cali Realty Corporation   NYSE CLI   and Lamar Advertising Company   NASDAQ LAMR    all of which are expected to report quarterly figures in the next week Note   FFO  a widely used metric to gauge the performance of REITs  is obtained after adding depreciation and amortization and other non cash expenses to net income Zacks  Best Private Investment IdeasWhile we are happy to share many articles like this on the website  our best recommendations and most in depth research are not available to the public Starting today  for the next month  you can follow all Zacks  private buys and sells in real time  Our experts cover all kinds of trades  from value to momentum       from stocks under  10 to ETF and option moves       from stocks that corporate insiders are buying up to companies that are about to report positive earnings surprises  You can even look inside exclusive portfolios that are normally closed to new investors ,2017-11-02,Zacks Investment Research,https://www.investing.com/analysis/taubman-centers-tco-q3-ffo-lags-estimates-revenues-up-yy-200257983,200257983
24776,246291,LAMR,DDR Corp  DDR  Q3 FFO Beats Estimates  Stock Up More Than 6 ,opinion,DDR Corp  s   NYSE DDR   third quarter 2017 funds from operations  FFO  per share of 30 cents surpassed the Zacks Consensus Estimate of 27 cents  However  the figure declined 3 cents from the prior year quarter Results reflect higher than expected business in the company s Continental U S  portfolio and balance sheet improvement efforts  However  the dilutive effect of deleveraging generated through sale of assets was primarily responsible for the decline in FFO from the prior year quarter The company generated revenues of  220 1 million for the third quarter  marginally missing the Zacks Consensus Estimate of  222 2 million  The figure also came in lower than  245 2 million recorded in the year ago quarter Amid these  shares of DDR Corp  climbed 6 68  to  8 30 during regular trading session on Nov 2 DDR Corp  Price  Consensus and EPS Surprise    Note  The EPS numbers presented in the above chart represent funds from operations  FFO  per share Quarter in DetailDDR executed 315 new and renewal leases for 1 8 million square feet of space during the reported quarter  On a pro rata basis and including Puerto Rico  the company generated new leasing spreads of 6 8  and renewal leasing spreads of 6 1  for the quarter  However  same store net operating income  NOI   including Puerto Rico  edged down 0 9  year over year on a pro rata basis As of Sep 30  2017  on a pro rata basis  the company s portfolio was 93 4  leased  down 200 basis points from the prior year quarter end  Annualized base rent per occupied square foot increased 5 2  on a pro rata basis to  16 16 as of Sep 30  2017  from  15 36 at the end of the year ago quarter Notably  during the third quarter  DDR sold 16 shopping centers and land parcels for a total of  392 1 million  aggregating  173 1 million at DDR s share Moreover  the company extended the maturity of its revolving credit facilities and enhanced borrowing capacity to  1 0 billion  Also  the company extended the maturity of  200 million of  400 million unsecured term loan DDR exited the third quarter with  18 3 million in cash compared with  30 4 million as of Dec 31  2016 OutlookThe company revised its expected annual growth in same store NOI range to  0 5 0 5  for the Continental U S  Portfolio at DDR s share from the prior range of  1 0 0 5   Further  the company projects leased rate at year end for the Continental U S  Portfolio at 93 25 93 75  Notably  it withdrew the Puerto Rico same store NOI guidance  This is due to the uncertainties surrounding the timing of business interruption insurance payments Bottom LineDDR is likely to benefit from its diversified portfolio in prosperous regions and presence of well capitalized tenants on its roster  In addition to this  aggressive capital recycling program  balance sheet improvement efforts  improved liquidity and maturity schedule are likely to drive its growth over the long term  Nevertheless  the choppy retail real estate environment remains a concern while effects of divestitures cannot be ignored  Further  rate hike add to its woes   Currently  DDR carries a Zacks Rank  2  Buy  You can see  We now look forward to the earnings releases of Welltower Inc    NYSE HCN    Mack Cali Realty Corporation   NYSE CLI   and Lamar Advertising Company   NASDAQ LAMR    all of which are expected to report next week Note   FFO  a widely used metric to gauge the performance of REITs  is obtained after adding depreciation and amortization and other non cash expenses to net income Looking for Stocks with Skyrocketing Upside Zacks has just released a Special Report on the booming investment opportunities of legal marijuana Ignited by new referendums and legislation  this industry is expected to blast from an already robust  6 7 billion to  20 2 billion in 2021  Early investors stand to make a killing  but you have to be ready to act and know just where to look ,2017-11-02,Zacks Investment Research,https://www.investing.com/analysis/ddr-corp-ddr-q3-ffo-beats-estimates-stock-up-more-than-6-200258117,200258117
24777,246292,LAMR,Annaly Capital s  NLY  Q3 Earnings Beat Estimates  NII Dips,opinion,Annaly Capital Management  Inc    NYSE NLY   reported third quarter 2017 adjusted core earnings of 30 cents per share  surpassing the Zacks Consensus Estimate of 29 cents  Also  earnings compared favorably with the prior year quarter figure of 29 cents Results highlight an increase in the to be announced dollar roll income Net interest income  NII  in the third quarter totaled  353 6 million  representing year over year decline of 0 8  Annaly Capital Management Inc Price  Consensus and EPS Surprise    Quarter in DetailIn the reported quarter  average yield on interest earning assets excluding  premium amortization adjustment  PAA  was 2 97   up 25 basis points  bps  year over year Net interest rate spread  excluding PAA  of 1 15  for the quarter remained unchanged year over year  Net interest margin  excluding PAA  came in at 1 47  compared with 1 42  recorded in the year earlier period The company s investment at fair value  including Agency mortgage backed securities and Agency debentures  was  85 8 billion as of Sep 30  2017  up from  74 billion as of Sep 30  2016 Annaly s book value per share came in at  11 42 as of Sep 30  2017  compared with  11 19 as of Jun 30  2017  At the end of the third quarter  the company s capital ratio  representing the ratio of stockholders  equity to total assets  was 12 3   down year over year Leverage was 5 4 1 as of Sep 30  2017  compared with 5 3 1 as of Sep 30  2016  The company offered an annualized core return on average equity of 10 57  in the reported quarter  up from 10 09  in the year ago period Our TakeWe are impressed by Annaly s better than expected results  The company continued to pay the same dividend of 30 cents per share for the 16th consecutive quarter and maintained a decent return on equity  This boosts investor s confidence in the stock Further  in the third quarter  the company completed the previously announced sale of Pingora Holdings L P  It maintained ownership interests in mortgage servicing rights However  Annaly s exposure to fluctuations in mortgage backed securities and broader financial markets make it volatile  Moreover  competition from several players and adverse macroeconomic conditions remain concerns  A rise in interest rate may further add to its woes Currently  Annaly carries a Zacks Rank  3  Hold   You can see The stock has climbed 13 2  year to date  outperforming 7 9  growth recorded by the  it belongs to We are now looking forward to the earnings releases of Lamar Advertising Company   NASDAQ LAMR    EPR Properties   NYSE EPR   and Outfront Media Inc    NYSE OUT   all of which are expected to report in the upcoming days Looking for Stocks with Skyrocketing Upside Zacks has just released a Special Report on the booming investment opportunities of legal marijuana Ignited by new referendums and legislation  this industry is expected to blast from an already robust  6 7 billion to  20 2 billion in 2021  Early investors stand to make a killing  but you have to be ready to act and know just where to look ,2017-11-02,Zacks Investment Research,https://www.investing.com/analysis/annaly-capitals-nly-q3-earnings-beat-estimates-nii-dips-200258116,200258116
24778,246293,LAMR,Lamar Advertising  LAMR  Q3 FFO   Revenues Beat Estimates,opinion,Lamar Advertising Co    NASDAQ LAMR   reported third quarter 2017 adjusted funds from operations  FFO  of  1 40 per share  comfortably surpassing the Zacks Consensus Estimate of  1 32  Also  the figure came in higher than the year ago tally of  1 37 Net revenues for the reported quarter increased 3 1  year over year to  399 3 million  In addition  the top line surpassed the Zacks Consensus Estimate of  393 million Results reflected year over year rise in operating income  adjusted EBITDA and cash flow from operating activities Lamar Advertising Company Price  Consensus and EPS Surprise    Note  The EPS numbers presented in the above chart represent funds from operations  FFO  per share Quarter in DetailOperating income increased to  131 7 million from  119 8 million recorded in the prior year period  Adjusted earnings before interest  taxes  depreciation and amortization rose 3 3  year over year to  182 8 million  Additionally  free cash flow was up 5 4  year over year to  122 2 million At the third quarter end  Lamar had total liquidity of  376 3 million  of which  346 9 million was available under its revolving senior credit facility  and  29 4 million in cash and cash equivalents The company closed 13 acquisition transactions during the quarter for total purchase consideration of  91 8 million Our TakeLamar s efforts to upgrade its portfolio and increase occupancy in the company s existing advertising displays prove conducive to its top line growth  These efforts also help raise advertising rates  In fact  the company holds significant market share in the U S  outdoor advertising business  which is encouraging In August  the company announced the acquisition of assets from Steen Outdoor Advertising  in a bid to expand its footprint and add high quality assets in its portfolio  These assets include around 460 billboards  and are mainly located in and around Philadelphia Outdoor advertising is a low cost and wide reaching medium  Therefore  the company is expanding its footprint to tap growth opportunities  This positions the company for long term growth Lamar currently has a Zacks Rank  3  Hold   You can see The stock has gained 11 4  year to date  underperforming 3 6  growth recorded by the  it belongs to Performance of Other REITsVentas  Inc    NYSE VTR   reported third quarter 2017 normalized FFO of  1 04 per share  in line with the Zacks Consensus Estimate  The figure also came in a penny higher than the year ago quarter tally  Results reflected improved property performance and accretive investments Cousins Properties Incorporated   NYSE CUZ   reported third quarter 2017 FFO per share of 15 cents  in line with the Zacks Consensus Estimate  The quarter witnessed considerable improvement in rental property revenues  which aided results to quite an extent  However  elevated expenses were a headwind PS Business Parks  Inc    NYSE PSB   reported third quarter 2017 core FFO of  1 54 per share  surpassing the Zacks Consensus Estimate by a penny  Also  the figure came in 7 7  higher than  1 43 recorded in the prior year quarter  The rise stemmed from higher net operating income  NOI   reduced general and administrative expenses  and savings from lower preferred distributions Note  FFO  a widely used metric to gauge the performance of REITs  is obtained after adding depreciation and amortization and other non cash expenses to net income Zacks  Hidden TradesWhile we share many recommendations and ideas with the public  certain moves are hidden from everyone but selected members of our portfolio services  Would you like to peek behind the curtain today and view them Starting now  for the next month  I invite you to follow all Zacks  private buys and sells in real time from value to momentum   from stocks under  10 to ETF to option movers   from insider trades to companies that are about to report positive earnings surprises  we ve called them with 80   accuracy   You can even look inside portfolios so exclusive that they are normally closed to new investors ,2017-11-06,Zacks Investment Research,https://www.investing.com/analysis/lamar-advertising-lamr-q3-ffo--revenues-beat-estimates-200263252,200263252
