,id,ticker,title,category,content,date,provider,url,article_id
15447,236962,WHR,U S  stocks mixed as Apple  Twitter and IBM help create volatile session,news,"Investing com    Stocks on the U S  equities markets were mixed on Tuesday  amid a flurry of earnings report and ahead of Wednesday s release of U S  GDP growth for the first quarter 
The Dow Jones Industrial Average and S P 500 Composite index edged up to reverse Monday s losses  while the NASDAQ Composite index closed slightly lower tamped down by a volatile day of trading in Apple Inc  NASDAQ AAPL  stock 
Bolstered by strong sessions from International Business Machines  NYSE IBM   Merck   Company Inc  NYSE MRK  and Microsoft Corporation  NASDAQ MSFT   the Dow gained 72 17 or 0 40  to 18 110 14  The S P 500 rose 5 84 or 0 28  to 2 114 76  as eight of 10 sectors closed in the green  while the NASDAQ dropped 4 83 or 0 10  to 5 055 42  Stocks in the Telecommunication and Utilities sectors led  while stocks in Consumer Goods and Consumer Services lagged 
A possible earnings leak of Twitter  NYSE TWTR  precipitated a frenetic scene late in the afternoon  as trading of shares in the social networking service was halted with less than an hour left in the session  Shares in Twitter began to fall rapidly after data mining company Selerity published the San Francisco based company s quarterly earnings  before it was scheduled to release the report later on Tuesday  While Selerity reported that Twitter s adjusted earnings per share of 0 07 beat estimates of 0 04  the data mining company also reported that Twitter posted quarterly revenue of  436 million    far below estimates of  436 million  When trading resumed with mere minutes left in the session  Twitter opened under  41 a share  following a bid ask spread of  38  43  After plunging more than 20  on the day  Twitter closed the session at 42 27  down 9 39 or 18 18  
Twitter was investigating the source of the leak  company officials told CNBC after the bell 
The top performer on the Dow was Merck  which gained 3 22 or 5 64  to 60 32  after the pharmaceutical company s study on diabetes drug Januvia showed promising results for heart safety   IBM  also rose 2 31 or 3 94  to 174 67  after the American multinational technology and consulting company hiked its quarterly dividend by 18   its biggest increase in five years  The worst performer was Apple  which dropped 1 81 or 1 36  to 130 84 after reaching an all time record high earlier in the session 
The biggest gainer on the NASDAQ was Microsoft  which rose 1 03 or 2 13  to 49 06  The worst performer  meanwhile  was CH Robinson Worldwide Inc  NASDAQ CHRW  which fell 3 33 or 4 83  to 65 61 
Merck was also the top performer on the S P 500  ahead of mining company Freeport McMoRan which gained 0 86 or 3 94  to 22 68  The worst performer was Whirlpool Corporation  NYSE WHR   which fell 14 13 or 7 14  to 183 70 after the company slashed its profit and sales estimates  blaming a strong dollar and Brazil s struggling economy ",2015-04-28,Investing.com,"https://www.investing.com/news/stock-market-news/u.s.-stocks-mixed-as-apple,-twitter-and-ibm-help-create-volatile-session-339344",339344
15450,236965,WHR,Anemic U S  factory data points to moderate growth bounce,news,"By Lucia Mutikani
WASHINGTON  Reuters    U S  factory activity failed to gain steam in April after slowing for five straight months  but stronger than expected vehicle sales suggested the economy was finding some momentum after almost stalling in the first quarter 
Still  the sluggishness in the manufacturing sector and other data on Friday showing construction spending hit a six month low in March indicated that the anticipated acceleration in growth in the second quarter could disappoint 
That could see the Federal Reserve delaying raising interest rates until later this year 
The economy expanded at a 0 2 percent annual pace in the first three months of the year  slammed by bad weather  a strong dollar and a now resolved labor dispute at the West Coast ports  as well as lower oil prices  which have undercut domestic energy production 
 The reacceleration in growth will not come fast enough for many  especially those looking for a liftoff by the Fed to happen sooner   said Diane Swonk  chief economist at Mesirow Financial in New York 
The Institute for Supply Management said its index of national factory activity was at 51 5 in April  matching the March reading  which had been the lowest since May 2013 
The index had declined since November and economists had expected it to rise to 52 in April  A reading above 50 indicates expansion in the manufacturing sector 
While new orders rose last month  a gauge of factory employment contracted for the first time since May 2013 and recorded its lowest reading since September 2009 
Manufacturing has been hit by the dollar s 12 percent appreciation against the currencies of the United States  main trading partners since June 
The buoyant currency has hurt export growth and profits of multinational corporations  including Procter   Gamble Co  N PG   the world s largest household products maker  and prompted Colgate Palmolive  N CL  and healthcare conglomerate Johnson   Johnson  N JNJ  to cut their profit forecasts for the full year 
Whirlpool Corp  N WHR   the world s largest maker of home appliances  lowered its profit forecast and sales outlook for 2015 
Manufacturing  which accounts for about 12 percent of the U S  economy  is also being pressured by the lower oil prices  which have caused oil field companies to slash spending on exploration and well drilling 
 Caterpillar  Inc  N CAT  has warned the dollar and weak oil prices will hurt profits this year 
U S  stocks were trading higher  The dollar rose against a basket of currencies  while U S  Treasury debt prices fell 
REGAINING FOOTING
Despite the economy s struggles  there is no doubt it is starting to regain its footing  General Motors Co  N GM  and  Ford Motor Co   N F  reported stronger than expected U S  auto sales in April on robust demand for trucks and crossover and sports utility vehicles 
Demand for autos is likely to remain solid in the months ahead  In a separate report  the University of Michigan said its overall index on consumer sentiment rose to 95 9 this month  the second highest level since 2007  from 93 0 in March 
Consumers were upbeat about both current conditions and expectations for the future  More consumers said it was a good time to buy a major household item and a vehicle  There was also an increase in consumers saying it was a good time to buy and sell a house  which should support home sales 
 This suggests that there may be some upside risk for durable goods spending in the second quarter     and that perhaps housing market activity will pick up in the months ahead   said Mark Vitner  a senior economist at  Wells Fargo   NYSE WFC  Securities in Charlotte  North Carolina 
Separately  the Commerce Department said construction spending slipped 0 6 percent to an annual rate of  966 6 billion in March  the lowest level since September 
Construction spending was weighed down by a 1 6 percent decline in private residential construction spending  the biggest such decline since June  Public construction outlays were also weak 
 We think the outlook for residential construction is positive in 2015 as household formation appears to have picked up and as house price gains have remained firm   said John Ryding  chief economist at RDQ Economics in New York ",2015-05-01,Reuters,https://www.investing.com/news/economic-indicators/u.s.-factory-activity-growth-slows-in-april:-markit-339864,339864
15461,236976,WHR,Whirlpool wins first trial over  moldy  washers,news,"By Jessica Dye  NEW YORK  Reuters    Whirlpool Corp was found not liable Thursday by a U S  jury in the first lawsuit to go to trial accusing the company of selling front loading washing machines containing a design flaw that made them prone to developing mold    The jury cleared Whirlpool following a three week trial in federal court in Ohio  according to lawyers for approximately 150 000 residents in that state who were part of the class action against the company    The class plaintiffs were all Ohio residents who had purchased one of 20 models of front loading Whirlpool Duet washing machines between 2001 and 2009  They said in their lawsuit that a defect in the machines caused residue to accumulate  leading to mold and musty odors    The plaintiffs said they were not warned about the problem until after they had purchased the machines and were forced to undertake costly and time consuming measures to remedy them    Benton Harbor  Michigan based Whirlpool has denied that it is liable  and said in court filings that more than 95 percent of customers who had purchased one of the machines had never complained about a mold or odor problem    In a statement  Eric Sharon  a litigation counsel at Whirlpool  called it a major victory for the company   While other companies might have opted to settle this case out of court  Whirlpool firmly believed in the rule of law and that the facts were in our corner    A lawyer for the plaintiffs  Jonathan Selbin  said he was disappointed with the verdict and intends to appeal  He noted in an email to Reuters that it was the first of what would likely be dozens of trials over the machines     Until Whirlpool takes responsibility for selling defective washers  the fight will continue   he said    The company had fought fiercely against a court order that allowed the Ohio consumers to sue as a group  rather than pursue their claims individually  Whirlpool argued that since many of the customers did not actually suffer any harm and had purchased a range of different machines  they did not have enough in common to sue as a group    The company appealed the class certification decision to the U S  Supreme Court twice  Although the high court originally vacated the decision and sent it back to a lower appeals court for further consideration  the appeals court upheld class certification once again and the Supreme Court denied further review    The Ohio suit is among 11 that have been consolidated in the Ohio federal court  according to court statistics  and there are additional lawsuits filed in other states    
The case is Glazer v  Whirlpool  U S  District Court for the Northern District of Ohio  No  08 65000      Reporting by Jessica Dye  Editing by Alexia Garamfalvi and Steve Orlofsky ",2014-10-30,Reuters,https://www.investing.com/news/stock-market-news/whirlpool-wins-first-trial-over-'moldy'-washers-314846,314846
15462,236977,WHR,U S  futures edge lower  fresh earnings ahead  Dow Jones down 0 05 ,news,"Investing com   U S  stock futures pointed to a moderately lower open on Wednesday  after U S  equity markets closed at record highs on Tuesday and as investors eyed the release of a fresh string of earnings reports throughout the session 
Ahead of the open  the Dow 30 futures pointed to a 0 05  dip  S P 500 futures signaled a 0 10  loss  while the Nasdaq 100 futures indicated a 0 13  fall 
Keurig Green Mountain  NASDAQ GMCR  was expected to remain in focus after Coca Cola  NYSE CCE  on Tuesday increased its stake in the company  making it the largest shareholder 
Tech stocks were also likely to be active  after the European Union s top court ruled citizens have a  right to be forgotten  online 
In other words  people will now have the right to ask search engine owners to remove personal information and request that a court or data protection authority step in if a company does not comply 
Separately  Google  NASDAQ GOOGL   up 0 14  in early trading  opened sales of its Glass Explorer Edition devices to anyone in the U S   after mostly being available only via invitation and referral 
Elsewhere  Boeing Company  NYSE BA  edged up 0 07  in after hour trade  following reports the company will sell 50 737 aircraft worth at least  3 8 billion to a low cost carrier being set up by China s Juneyao Airlines 
Whirlpool  NYSE WHR  shares climbed 0 46  in extended trade  after tumbling over 2  on Tuesday when Longbow Research downgraded the appliance maker to  neutral  from  buy  
Other stocks likely to be in focus included Macy s  NYSE M   SodaStream  NASDAQ SODA   Cisco Systems  NASDAQ CSCO   Deere   Company  NYSE DE  and Seaworld  NYSE SEAS   scheduled to report quarterly results later in the day 
Across the Atlantic  European stock markets were lower  The DJ Euro Stoxx 50 slipped 0 14   France s CAC 40 edged 0 15  lower  Germany s DAX dipped 0 01   while Britain s FTSE 100 eased 0 04  
During the Asian trading session  Hong Kong s Hang Seng jumped 1 03   while Japan s Nikkei 225 fell 0 14  
Later in the day  the U S  was to release data on producer price inflation ",2014-05-14,Investing.com,"https://www.investing.com/news/stock-market-news/u.s.-futures-edge-lower,-fresh-earnings-ahead;-dow-jones-down-0.05-284114",284114
15463,236978,WHR,Samsung  Intel  Dell team up on standards for connected gadgets,news,"By Noel Randewich  SAN FRANCISCO  Reuters    Samsung Electronics  Intel Corp and Dell have joined to establish standard ways for household gadgets like thermostats and light bulbs to talk to each other  at odds with a framework backed by Qualcomm  LG Electronics and other companies   The new Open Interconnect Consortium  like the Qualcomm supported AllSeen Alliance  aims to establish how smart devices work together in a trend increasingly called the Internet of Things   Manufacturers are rolling out growing numbers of Internet connected burglar alarms  televisions and light switches  But like the early days of video cassette recorders  current smart home products are often incompatible with each other   The new consortium  which also includes chipmakers Broadcom and Atmel  was announced in a news release late on Monday    Doug Fisher  general manager of Intel s Software and Services Group  told Reuters that the framework to be developed by the new consortium would address security and other issues not adequately handled by the AllSeen group   The potential emergence of smart household products made by manufacturers using two sets of incompatible standards would be incidental  he said    We re not out to create that  We just think the industry has spoken and there s this approach that s needed   Fisher said   We re certainly welcoming others to participate     Last week  Microsoft became the 51st member of the AllSeen Alliance  which also includes Sharp Corp and other consumer electronics manufacturers   Rob Chandhok  senior vice president of Qualcomm Technologies Inc  compared the two competing standards groups to walled off online services in the early 1990s before widespread Internet use    It s better for us to have an industry wide shared platform than to be divided   Chandhok said   I don t want to get to a  Prodigy and CompuServe  of the Internet of Things    Technology heavyweights Apple and Google are also pursuing their own ways of interconnecting household devices   
Apple  known for strictly controlling how other companies  products interact with its own  in June announced HomeKit  which will integrate control of devices like lights and thermostats    Google s Nest has also partnered with companies including Whirlpool Corp and light bulb maker LIFX to integrate their products with its thermostats and smoke detectors       Reporting by Noel Randewich  Editing by Jan Paschal ",2014-07-08,Reuters,"https://www.investing.com/news/economy-news/samsung,-intel,-dell-team-up-on-standards-for-connected-gadgets-293465",293465
15464,236979,WHR,Whirlpool cuts outlook as sales outside North America fall,news,"By James B  Kelleher   Reuters    Whirlpool Corp  N WHR  on Wednesday reported a lower than expected quarterly profit as sales fell in every region except North America  The company also cut its full year earnings outlook  citing expenses from two pending acquisitions   The news sent shares of Whirlpool  the world s largest maker of home appliances  down as much as 5 5 percent   The company posted second quarter earnings of  179 million  or  2 25 a share  down from  198 million  or  2 44 a share  a year earlier   That was well below the  2 91 a share profit that analysts had expected  according to Reuters estimates   Whirlpool  which sells its washers and dryers  stoves  and refrigerators under its own name as well as brands including Maytag  KitchenAid and Jenn Air  said it had sold  4 7 billion in goods during the quarter  unchanged from a year earlier   The Benton Harbor  Michigan based company said sales gains in North America were offset by weakness in the rest of the world  including Latin America  Europe and Asia    The U S  did very well  but if you look at all the other regions  they re down   said S P Capital IQ equity analyst Efraim Levy   Whirlpool said it now expected to report full year net earnings of  10 30 to  10 80 a share  down from a previous forecast range of  11 50 to  12 00   The company said the outlook cut reflected costs associated with its pending acquisitions of majority stakes in Hefei Rongshida Sanyo Electric Co Ltd  SS 600983  and Indesit  MI IND    
Whirlpool shares were down 4 4 percent at  136 84 in morning trading after falling as low as  135 37 earlier in the session     Reporting by James B  Kelleher in Chicago  Editing by Lisa Von Ahn ",2014-07-23,Reuters,"https://www.investing.com/news/stock-market-news/whirlpool-posts-lower-profit,-cuts-outlook-on-acquisition-expenses-297091",297091
15465,236980,WHR,Sluggish Latin American results show risks for U S  companies ,news,"By Lewis Krauskopf  Reuters    U S  companies are reporting sluggish financial results in Latin America  showing the risks they face in relying on Brazil and other emerging markets in the region for growth 
Companies ranging from Ford Motor Co to 3M Co and Caterpillar Inc reported second quarter earnings that highlighted weakness in their Latin or South American operations 
While Venezuela s weak currency valuation previously weighed on U S  corporate finances  the latest results indicate broader struggles  Several companies reported tepid performance in Brazil  the biggest economy in Latin America  where some economists fear the country is on the verge of a recession 
 The place where we see a little bit more of a challenge is Latin America   3M Chief Executive Officer Inge Thulin told analysts on the company s quarterly conference call on Thursday  The diversified manufacturer  whose products include office supplies and industrial adhesives  cut its full year revenue forecast for the region  the worst performing in the quarter  hurt by a sales decline in Brazil 
U S  companies that have looked to emerging Latin American economies for growth have seen those expectations dented in recent months by Brazil s political and economic turmoil  Venezuela s currency woes and Argentina s renewed battle with major creditors 
 This is kind of the up and down of emerging markets   said J  Bryant Evans  who manages an international equity income portfolio at Cozad Asset Management in Champaign  Illinois 
 NOT HAPPENING 
A poll of more than 60 economists from earlier this month found that Latin American economies will probably grow at a slower pace than previously thought this year  Economies in Brazil  Argentina and Chile are expected to be weaker this year than in 2013  while Mexico is far from achieving the fast growth promised by sweeping economic reforms  the poll found 
U S  corporate prospects in Latin America have also been dampened by competition  lack of expected growth among the middle class and fluctuations in commodity prices  said Rafael Amiel  director for Latin America economics at research firm IHS 
 For multinational companies  the growth they were expecting in many Latin American markets is not happening   Amiel said 
South America was the only region in the world where Ford posted a quarterly loss     295 million  compared with a  151 million profit a year earlier 
South American countries  remain largely closed markets that have trade barriers up across many sectors of their economies  so they are actually pretty uncompetitive on a global basis  and that includes the automotive industry   Ford Chief Financial Officer Bob Shanks told Reuters   Now that that capital is flowing out  those economies are suffering  
The importance of the Brazilian market to U S  companies has been rising over the past few years  Though South America has held steady at about 1 6 percent of sales at S P 500 companies over the past three years  Brazil s portion of sales within the region more than doubled between the start of 2010 and 2014  according to Thomson Reuters data 
Earlier this week  the Brazilian government lowered its economic growth forecast for 2014 to 1 8 percent from 2 5 percent  Economists think the growth could be even more tepid    0 97 percent  according to a weekly survey 
MEXICAN CRACKS
Caterpillar  which reported a 16 percent decline in second quarter Latin American sales  lowered its overall sales outlook in part because of worries over Brazil  Chief Financial Officer Brad Halverson told Reuters in an interview 
 We are concerned about Brazil   Halverson said   They raised interest rates last year  The economy is slowing  Consumer confidence is plunging along with business confidence  
Whirlpool Corp reported a lower operating profit in Latin America and downgraded its forecast for appliance market sales in the region for 2014  Still  company executives said weakness in Brazil was more of a short term concern and expressed optimism about the economy 

 We continue to believe that the macroeconomic indicators in Brazil point to long term healthy demand growth   Mike Rodman  president of Whirlpool International  told analysts 
Some cracks also emerged in Mexico  the region s second largest economy  For example  a new tax in Mexico has put pressure on U S  food companies such as PepsiCo Inc  n Pep   which blamed the tax for sales declines in its food business 
While companies such as 3M reported solid results from the country  the Mexican economy grew by only 0 3 percent in the first quarter  John Gerspach  the chief financial officer of Citigroup  n C   which has about  11 7 billion of credit card loans in Latin America  told analysts last week that  as the Mexico economy continues to struggle to really regain the momentum that everyone thought that it would have  consumer spending has not been robust  
 Additional reporting by James B  Kelleher in Chicago  Bernie Woodall in Detroit  Dan Wilchins in New York and Silvio Cascione in Brasilia  Editing by John Pickering ",2014-07-25,Reuters,https://www.investing.com/news/world-news/sluggish-latin-american-results-show-risks-for-u.s.-companies-297914,297914
15466,236981,WHR,European stocks rise ahead of Fed statement  Dax up 0 15 ,news,"Investing com   European stocks were higher on Wednesday  as investors eyed the Federal Reserve s upcoming policy statement due later in the day and as comments by the International Monetary Fund on Tuesday continued to support 
During European morning trade  the DJ Euro Stoxx 50 rose 0 30   France s CAC 40 added 0 27   while Germany s DAX edged up 0 15  
European equities found support on Tuesday after the IMF said the European Central Bank should consider all unconventional measures  including quantitative easing  and should implement them as soon as they are ready 
Investors remained cautious however  after Reuters reported on Monday that a Russian soldier had shot dead a Ukrainian naval officer in Crimea 
This came after a pro Russian protest in eastern Ukraine on Sunday  where demonstrators stormed government buildings in several major cities 
Financial stocks were mixed  as BNP Paribas  BNPP PAR  added 0 16  and Societe Generale  SOGN PAR  edged down 0 24  in France  while Germany s Deutsche Bank  DBKGn XETRA  slipped 0 18 
Among peripheral lenders  Unicredit  CRDI MILAN  tumbled 1 26  and Intesa Sanpaolo  ISP MILAN  gained 0 68  in Italy  while Spanish banks BBVA  BBVA MADRID  and Banco Santander  SAN MADRID  added 0 13  and 0 30  respectively 
Elsewhere  Daimler  DAIGn XETRA  rose 0 39  after the automaker said it is maintaining forecasts that sales will grow faster than those of competitors and operating profit will  significantly  rise this year 
Indesit Company  INDm BS  was also on the upside  with shares surging 3 03   following reports Whirlpool Corporation  NYSE WHR  may offer to buy the company 
In London  FTSE 100 gained 0 38   supported by gains in the financial sector 
Shares in Barclays  BARC LSE  inched up 0 01  and the Royal Bank of Scotland  RBS LSE  advanced 0 84   while HSBC Holdings  HSBA LSE  and Lloyds Banking  LLOY LSE  jumped 1 07  and 1 21  respectively 
Improvement retailer Kingfisher  KGF LSE  added to gains  up 1 42   after UBS recommended that investors buy the stock 
Meanwhile  mining stocks were broadly lower  as Bhp Billiton  BLT LSE  slipped 0 29  and Fresnillo  FRES LSE  dropped 0 52   while Rio Tinto  RIO LSE  declined 0 61  and Antofagasta  ANTO LSE  plummeted 1 09  
In the U S   equity markets pointed to a moderately higher open  The Dow 30 futures pointed to a 0 10  rise  S P 500 futures signaled a 0 02  uptick  while the Nasdaq 100 futures indicated a 0 09  gain 
Also Wednesday  official data showed that Germany s trade surplus narrowed to  15 7 billion  from  17 3 billion in January  whose figure was revised up from an initially estimated surplus of  17 2 billion 
Analysts had expected the trade surplus to expand to  17 8 billion in February ",2014-04-09,Investing.com,https://www.investing.com/news/stock-market-news/european-stocks-rise-ahead-of-fed-statement;-dax-up-0.15-276530,276530
