,id,ticker,title,category,content,date,provider,url,article_id
14381,235896,PFG,Principal Global bullish on U S  stocks despite increased tail risk CEO,news,"By Tomo Uetake TOKYO  Reuters    Principal Global Investors bought U S  shares on recent market dips as the asset management firm saw the U S  economy chugging along in spite of worries about a trade war  Chief Executive Jim McCaughan said on Monday  McCaughan said the ongoing trade spat between the United States and China is likely to ultimately lead to a compromise  rather than a full scale trade war   Most likely  you get concessions  you get a face saving compromise and both can declare a victory   McCaughan told Reuters in an interview  but warned that the risk of a trade war was not negligible   It s more serious than a  tail risk   which is usually a 5 percent probability or less    Diversification can act as a counter balance   he said  Headline risks stemming from a potential U S  China trade war and geopolitical tensions on the Korean Peninsula and Iran could lead to higher market volatility  said McCaughan  estimating an about 20 30 percent negative tail risk   In many of our strategies  we have a strategic allocation and we ll rebalance when they get out of whack  So weakness in equities would tend to make us a buyer   he said    In terms of volatility  markets so far this year have actually been more like the markets in the 80s and 90s  Back then  1 percent move  in a day  was pretty common  Those days were back   Despite the market volatility  McCaughan expects U S  economy to continue to grow between 2 3 percent with inflation well contained around 2 percent in the next three years  He expects only one more U S  interest rate increase by the Federal Reserve this year  while many market participants estimate two to three rate raises   On a 70 or 80 percent probability  you ll probably see equities going up and you ll see bond yields stay pretty close to the current levels  maybe go up a little bit  My best guess of the 10 year treasury yield  US10YT RR   a year from now  is 2 80 percent   PGI is the asset management arm of Principal Financial Group  NASDAQ PFG   headquartered in Des Moines  Iowa  and had  454 billion in assets under management as of Dec  31  
 We have been quite bullish of U S  equities for a number of years  That has paid off well  and we ll continue to do so  Our favorite areas will be small  and mid cap U S  equities   McCaughan said ",2018-04-09,Reuters,https://www.investing.com/news/economy-news/principal-global-bullish-on-us-stocks-despite-increased-tail-riskceo-1384299,1384299
14390,235905,PFG,Stocks   S P Bags Weekly Win Despite Report Trump Ready to Launch Tariffs,news,"Investing com   The S P 500 notched a weekly win Friday  shaking off fears of ramp up in U S  trade tensions amid reports President Donald Trump was ready to hit China with a hefty round of tariffs 
The Dow Jones Industrial Average rose about 0 03   The S P 500 rose 0 03   while the Nasdaq Composite fell 0 05  
For the week  the S P ended up about 1 2  
Trump instructed aides on Thursday to proceed with tariffs on about  200 billion more in Chinese products  but the announcement has been delayed as the administration considers revisions based on concerns raised in public comments  Bloomberg reported  citing sources 
This comes just days after Treasury Secretary Steven Mnuchin reached out to Chinese officials with an invitation to resumed trade talks 
Trump s willingness to press ahead with tariffs drummed up renewed fears of a full blown trade war and raised questions about how committed the administration was to ending the trade dispute with China 
The rise in trade tensions wiped out early session gains  which followed a surge in financials  mostly banks 
Goldman Sachs  NYSE GS    Citigroup   NYSE C  and  Morgan Stanley   NYSE MS  closed higher  buoyed by a rise in U S  bond yields on signs of underlying economic strength 
The U S  10 year Treasury yields flirted with the important psychological 3  yield as traders cheered an upward revision to July s retail sales data  ignoring weaker retail sales for August 
Rising Treasury yields are seen as boon for banks  boosting their net interest margin  the difference between the interest income generated by banks and the amount of interest paid out to their lenders 
Wall Street s positive week was fraught with violent swings in tech  A wave of selling emerged across semiconductors  while Apple s product launch triggered a broad based rally 
A rally in Adobe Systems  NASDAQ ADBE  also added steel to the tech performance after the software maker posted above forecast fiscal third quarter earnings and guidance 
Energy  meanwhile  played its part to firm the broader market  as oil prices sidestepped data pointing to a rise in domestic crude output 
On the New York Mercantile Exchange  crude futures for October delivery rose 0 58  to settle at  68 99 a barrel 
On the political front  traders assessed the potential damage to Trump after his former campaign chairman  Paul Manafort  pleaded guilty to two counts of conspiracy and agreed to cooperate with Robert Mueller s inquiry into Russian interference in the 2016 U S  election 
Top S P 500 Gainers and Losers Today 
Advanced Micro Devices  NASDAQ AMD   L Brands Inc  NYSE LB  and Principal Financial Group  NASDAQ PFG  were among the top S P 500 gainers for the session 
NiSource  NYSE NI   Under Armour  NYSE UA  and Coty  NYSE COTY  were among the worst S P 500 performers of the session ",2018-09-14,Investing.com,https://www.investing.com/news/stock-market-news/stocks--sp-bags-weekly-win-despite-report-trump-ready-to-launch-tariffs-1611338,1611338
14391,235906,PFG,U S  stocks mixed at close of trade  Dow Jones Industrial Average up 0 03 ,news,"Investing com   U S  stocks were mixed after the close on Friday  as gains in the Oil   Gas  Industrials and Financials sectors led shares higher while losses in the Utilities  Telecoms and Consumer Services sectors led shares lower 
At the close in NYSE  the Dow Jones Industrial Average gained 0 03  to hit a new 6 months high  while the S P 500 index climbed 0 03   and the NASDAQ Composite index fell 0 05  
The best performers of the session on the Dow Jones Industrial Average were United Technologies Corporation  NYSE UTX   which rose 1 68  or 2 28 points to trade at 137 80 at the close  Meanwhile   Boeing Co   NYSE BA  added 1 22  or 4 34 points to end at 359 80 and  Chevron  Corp  NYSE CVX  was up 0 93  or 1 08 points to 117 38 in late trade 
The worst performers of the session were Walt  Disney  Company  NYSE DIS   which fell 1 27  or 1 41 points to trade at 109 26 at the close  Apple Inc  NASDAQ AAPL  declined 1 14  or 2 57 points to end at 223 84 and McDonald s Corporation  NYSE MCD  was down 0 96  or 1 56 points to 160 84 
The top performers on the S P 500 were Advanced Micro Devices Inc  NASDAQ AMD  which rose 7 35  to 32 720  L Brands Inc  NYSE LB  which was up 5 58  to settle at 28 97 and Principal Financial Group Inc  NASDAQ PFG  which gained 3 83  to close at 56 94 
The worst performers were NiSource Inc  NYSE NI  which was down 11 72  to 24 79 in late trade   Under Armour  Inc A  NYSE UAA  which lost 3 56  to settle at 18 96 and Under Armour Inc C  NYSE UA  which was down 3 32  to 17 740 at the close 
The top performers on the NASDAQ Composite were  My Size Inc   NASDAQ MYSZ  which rose 28 57  to 1 35   Champions Oncology  Inc  NASDAQ CSBR  which was up 24 76  to settle at 10 5800 and Kandi Technologies Group Inc  NASDAQ KNDI  which gained 23 38  to close at 4 750 
The worst performers were Altimmune Inc  NASDAQ ALT  which was down 27 34  to 5 450 in late trade   Vital Thera   NASDAQ VTL  which lost 29 75  to settle at 0 35 and  Agile Thrpe   NASDAQ AGRX  which was down 25 36  to 0 36 at the close 
Falling stocks outnumbered advancing ones on the New York Stock Exchange by 1514 to 1507 and 141 ended unchanged  on the Nasdaq Stock Exchange  1341 rose and 1217 declined  while 156 ended unchanged 
Shares in Advanced Micro Devices Inc  NASDAQ AMD  rose to 5 year highs  up 7 35  or 2 240 to 32 720  Shares in Champions Oncology Inc  NASDAQ CSBR  rose to 3 years highs  rising 24 76  or 2 1000 to 10 5800  Shares in Vital Thera  NASDAQ VTL  fell to all time lows  losing 29 75  or 0 15 to 0 35  
The CBOE Volatility Index  which measures the implied volatility of S P 500 options  was down 2 18  to 12 10 
Gold Futures for December delivery was down 0 76  or 9 20 to  1199 00 a troy ounce  Elsewhere in commodities trading  Crude oil for delivery in October rose 0 48  or 0 33 to hit  68 92 a barrel  while the November Brent oil contract fell 0 13  or 0 10 to trade at  78 08 a barrel 
EUR USD was down 0 54  to 1 1627  while USD JPY rose 0 06  to 111 99 
The US Dollar Index Futures was up 0 42  at 94 93 ",2018-09-14,Investing.com,https://www.investing.com/news/stock-market-news/us-stocks-mixed-at-close-of-trade-dow-jones-industrial-average-up-003-1611383,1611383
14392,235907,PFG,Stocks Moving After Hours  Apple  AMD  eBay  Stryker  Principal Financial,news,"Investing com   Stocks moving after hours include 
  Apple  NASDAQ AAPL  shares were up more than 5  to about  163 as investors seemed bullish on first quarter results  Earnings and revenue beat estimates  although came in lower than a year ago  Problems in China and with iPhone sales held sales and profit back  But Apple still has  130 billion in cash at its disposal 
  Shares of chipmaker Advanced Micro Devices  NASDAQ AMD  moved higher as the company said it sees a stronger than expected performance in 2019  Fourth quarter revenue missed estimates  however 
  Medical equipment maker  Stryker   NYSE SYK  shares were up nearly 5  to  169 after hours after fourth quarter revenue beat estimates 
  Shares of eBay  NASDAQ EBAY  were down nearly 1  to  33 40  even as fourth quarter earnings and revenue beat estimates  The stock has largely recovered its steep decline between August and Christmas  But the shares are still off about 29  from its 52 week high reached in January 2018 
  Principal Financial Group  NASDAQ PFG  shares were flat at  49 62  They did slide as much as 3 2  after hours  The Des Moines  Iowa  based insurance and financial services company reported operating earnings of  1 11  below the Street estimate by 18 cents",2019-01-29,Investing.com,https://www.investing.com/news/stock-market-news/stocks-moving-after-hours-apple-amd-ebay-stryker-principal-financial-1762356,1762356
14393,235908,PFG,Principal Financial close to Wells Fargo retirement unit acquisition sources,news,"By David French  Reuters    Principal Financial Group Inc  NASDAQ PFG  is in advanced talks to acquire  Wells Fargo   NYSE WFC    Co s retirement plan services business  in a deal that could exceed  1 billion  people familiar with the matter said on Sunday  Wells Fargo has been seeking to streamline its business as it grapples with the fallout of customer abuse scandals  The bank is prohibited from growing in size after the Federal Reserve slapped it with an unprecedented asset cap in February 2018  citing  widespread consumer abuses and compliance breakdowns   The bank s retirement plan services unit  which includes Wells  401 k  savings accounts business  would expand a similar business of Principal Financial  If the negotiations are concluded successfully  a deal could be announced later this month  according to the sources  who spoke on condition of anonymity as the information is confidential  Wells Fargo and Principal Financial declined to comment  Based in Des Moines  Iowa  Principal Financial is a life insurance and financial services group with a market capitalization of  14 5 billion  It is the latest in a series of divestments pursued by Wells Fargo   In 2018  Wells Fargo announced deals to sell 52 branches spread across Indiana  Michigan  Ohio and Wisconsin to Flagstar Bancorp Inc  as well as a  1 7 billion deal to offload its Puerto Rico auto finance business to the local unit of Popular Inc  
The disclosure three years ago that Wells Fargo created millions of fake customer accounts prompted regulatory probes into mortgage foreclosures  auto insurance sales and its wealth management businesses  resulting in billions of dollars in fines ",2019-03-17,Reuters,https://www.investing.com/news/stock-market-news/principal-financial-close-to-wells-fargo-retirement-unit-acquisitionsources-1809991,1809991
14394,235909,PFG,Principal Financial to buy Wells Fargo s retirement unit for  1 2 billion,news, Reuters    Top U S  retirement plan administrator Principal Financial Group  NASDAQ PFG  said on Tuesday it would buy  Wells Fargo   NYSE WFC    Co s retirement plan services business for  1 2 billion  as it seeks a larger presence in markets serving mid sized companies  The agreement includes an earnout of up to  150 million tied to better than expected revenue retention  payable two years after closing  likely in the third quarter  Principal Financial said    Principal will gain a strong foothold with mid sized employers as more than two thirds of Wells Fargo s institutional retirement assets are in plans ranging from  10 million to  1 billion   the company said   The deal will be financed with cash and debt and will add to net income and adjusted earnings per share in 2020  Principal Financial said   Wells Fargo has been looking to trim its business ever since it came under regulatory scrutiny following a sales practice scandal  In 2018  the Federal Reserve slapped it with an unprecedented asset cap  citing  widespread consumer abuses and compliance breakdowns   The bank is scheduled to announce its first quarter results on Friday   Lazard is the financial adviser to Principal  while Debevoise   Plimpton provided legal counsel ,2019-04-09,Reuters,https://www.investing.com/news/stock-market-news/principal-financial-to-buy-wells-fargos-retirement-unit-for-12-billion-1831251,1831251
