,id,ticker,title,category,content,date,provider,url,article_id
200255,421771,BSX,3 Fidelity Mutual Funds For A Steady Portfolio,opinion,Fidelity Investments is considered one of the leaders in the financial services industry with presence in eight countries of North America  Europe  Asia and Australia  and more than 400 research professionals  The company carries out operations in the United States through 196 Investor Centers Fidelity offers investment advice  discount brokerage services  retirement services  wealth management services  securities execution  and clearance and life insurance products to its clients  It serves more than 27 million individual investors At Fidelity  a large group of investment professionals carry out extensive and in depth research to provide potential investment avenues worldwide for investors  Fidelity had total assets of about  2 trillion under management  as of Aug 31  2019   The company manages over 504 mutual funds across a wide range of categories including both domestic as well as foreign funds  and equity and fixed income funds Below we share with you three top ranked Fidelity mutual funds  Each has earned a  and is expected to outperform its peers in the future  Investors can  Fidelity Select Software   IT Services Portfolio  fund invests the majority of its assets in companies whose primary operations are related to software or information based services  It primarily focuses on acquiring common stocks of both domestic and foreign companies  FSCSX has three year annualized returns of 25 2  Ali Khan has been the fund manager of FSCSX since 2014 Fidelity Select Medical Technology And Devices Portfolio  fund invests a large portion of its assets in securities of companies engaged in the manufacturing and distribution of medical devices and equipment  The fund invests in both U S  and non U S  stocks  FSMEX has three year annualized returns of 23 7  As of October 2019  FSMEX held 54 issues with almost 10 52  of its assets invested in Boston Scientific Corp  NYSE BSX  Fidelity Select Semiconductors Portfolio  fund invests the bulk of its assets in common stocks of companies involved in the manufacture  design and sale of electronic equipment and components  FSELX seeks growth of capital  The fund invests in both U S  and non U S  companies  FSELX has three year annualized returns of 23 3  FSELX has an expense ratio of 0 73  compared with the category average of 1 30  To view the Zacks Rank and past performance of all Fidelity mutual funds  investors can  Want key mutual fund info delivered straight to your inbox Zacks  free Fund Newsletter will brief you on top news and analysis  as well as top performing mutual funds  each week ,2019-12-11,Zacks Investment Research,https://www.investing.com/analysis/3-fidelity-mutual-funds-for-a-steady-portfolio-200491764,200491764
200256,421772,BSX,Boston Scientific s First Single Use Duodenoscope Gets FDA Nod,opinion,"Boston Scientific Corporation   NYSE BSX   received the FDA approval for its EXALT Model D single use duodenoscope  which is to be used in endoscopic retrograde cholangiopancreatography  ERCP  procedures Beside the approval  the FDA granted Breakthrough Device Designation to the duodenoscope to ensure timely access to the device by patients and healthcare providers  Notably  the EXALT Model D duodenoscope is the first and only FDA cleared single use  disposable  duodenoscope currently available in the market Per the medical fraternity  apart from performing high quality ERCP procedures  the latest version of the duodenoscope will have an added advantage of using a brand new sterile device for each patient With the FDA clearance  the company aims to strengthen its endoscopy business on a global scale  Notably  endoscopy is a segment under the broader MedSurg arm of Boston Scientific  
 Why is the Clearance Significant The EXALT Model D single use duodenoscope is being touted as a pathbreaking device as it can be used as an alternative to reusable duodenoscopes  thus removing the need for duodenoscope reprocessing and repairs Notably  more than 1 5 million ERCPs are performed worldwide  using duodenoscopes  to diagnose  and treat various pancreatic and biliary conditions  However  there have been cases where infections have been transmitted to patients through contaminated devices despite adherence to established protocols of rigorous disinfection processes The FDA  in an effort to counter the problem  issued a recommendation to shift to duodenoscopes with disposable components or fully disposable devices  With the recent clearance  the EXALT Model D duodenoscope will provide the solution to the aforementioned concern Boston Scientific conducted a consecutive case series of the EXALT Model D duodenoscope  It concluded that expert endoscopists were able to complete ERCPs across a wide range of complexity using the single use duodenoscope Industry ProspectsPer a report by   the global endoscopy devices market size was estimated at  30 011 13 million in 2018  and is expected to reach a market capitalization of  45 390 million by 2026  witnessing a CAGR of 5 4  between 2019 and 2026  The key factors driving the market are the increasing prevalence of diseases requiring endoscopy devices and technological advancements in endoscopes that can be used for early detection of diseases With the given market potential  the clearance has been well  timed Recent Regulatory ApprovalsOf late  Boston Scientific is witnessing a slew of regulatory approvals and product launch In September 2019  the company received the FDA clearance for its Premarket Approval  PMA  application to market the Eluvia Drug Eluting Vascular Stent system  The stent system has been developed specifically for the treatment of peripheral artery disease  PAD  Boston Scientific received the FDA nod in August 2019 for its ImageReady MRI labeling for the Vercise Gevia Deep Brain Stimulation  DBS  system  which will be used in a full body magnetic resonance imaging  MRI  environment The company launched the WATCHMAN Left Atrial Appendage Closure Device in Japan  upon securing positive local reimbursement in the third quarter of 2019  In September 2019  it also announced receiving the CE Mark for the SYNERGY MEGATRON Bioabsorbable Polymer Stent  designed for use in large proximal vessels Price PerformanceShares of Boston Scientific have gained 32 4  in the past year compared with the  s 13 7  growth Zacks Rank   Key PicksCurrently  the company carries a Zacks Rank  3  Hold  Some better ranked stocks from the broader medical space are Haemonetics Corporation   NYSE HAE    National Vision Holdings  Inc   NASDAQ EYE   and ResMed Inc   NYSE RMD   Haemonetics currently has a Zacks Rank  2  Buy  and a projected long term earnings growth rate of 13 5  National Vision s long term earnings growth rate is estimated at 17 8   The company currently carries a Zacks Rank  2  You can see ResMed s long term earnings growth rate is estimated at 14   It currently flaunts a Zacks Rank  1 Today s Best Stocks from ZacksWould you like to see the updated picks from our best market beating strategies  From 2017 through Q3 2019  while the S P 500 gained  39 6   five of our strategies returned  51 8    57 5    96 9    119 0   and even  158 9  This outperformance has not just been a recent phenomenon  From 2000   Q3 2019  while the S P averaged  5 6  per year  our top strategies averaged up to  54 1  per year ",2019-12-15,Zacks Investment Research,https://www.investing.com/analysis/boston-scientifics-first-singleuse-duodenoscope-gets-fda-nod-200492832,200492832
200257,421773,BSX,Boston Scientific Hits New 52 Week High  What s Driving It ,opinion,"Shares of Boston Scientific Corporation   NYSE BSX   reached a new 52 week high of  45 27 on Dec 13  closing the session marginally lower at  45 09  The stock has rallied 12 5  since its third quarter earnings announcement on Oct 23 The company s better than expected earnings results in the third quarter of 2019  backed by robust segmental and global revenue growth  drove the rally Let s delve deeper  
 Q3 PerformanceThe company exited the third quarter of 2019 on a solid note  with better than expected numbers  It witnessed year over year revenue improvements in all segments as well as globally  which bode well Investors are upbeat about the solid year over year improvement in both domestic and global businesses  We are also optimistic about the company s efforts to strengthen its core businesses and invest in the new technologies as well as the global markets  These resulted in the uptick in third quarter sales across most geographies Despite incurring an escalation in production costs  the company registered rise in gross profit on solid top line performance Over and above  the raised yearly revenue guidance buoyed investors  optimism as this indicates that the bullish trend will continue through the rest of the year Other Growth DriversProduct Approvals and Launches  Investors have been optimistic about Boston Scientific s slew of regulatory approvals of late  The company received the FDA clearances for its products like EXALT Model D Single Use duodenoscope  Premarket Approval  PMA  application to market the Eluvia Drug Eluting Vascular Stent system and ImageReady MRI labeling for the Vercise Gevia Deep Brain Stimulation  DBS  system The company launched the WATCHMAN Left Atrial Appendage Closure Device in Japan upon securing positive local reimbursement in the third quarter of 2019  It is also quite upbeat about the robust performance of the LOTUS Edge Aortic Valve system on the FDA clearance received in April 2019  and subsequent commercial launch in the United States and Europe Acquisitions  Boston Scientific s acquisition of BTG  completed in August 2019  is expected to be a major boost for its Peripheral Intervention  PI  business  under the broader Cardiovascular segment  in the upcoming quarters  Other than this  acquisitions like Millipede  within Structural Heart   Claret Medical  VENITI and Augmenix are significant value additions to the company s portfolios Focus on Emerging Markets  Investors are also optimistic about the company maintaining the ongoing growth momentum in the emerging markets of Europe and Asia  Boston Scientific launched SYNERGY MEGATRON in Europe as an effort to boost the emerging market strategy  It is encouraged by strong customer adoption of the next generation Watchman FLX in Europe  As a part of the company s focus on emerging markets  it is planning to launch ACURATE neo2 in Europe Zacks Rank   Key PicksCurrently  the company carries a Zacks Rank  3  Hold  Some better ranked stocks from the broader medical space are Haemonetics Corporation   NYSE HAE    National Vision Holdings  Inc   NASDAQ EYE   and ResMed Inc   NYSE RMD   Haemonetics currently has a Zacks Rank  2  Buy  and a projected long term earnings growth rate of 13 5  National Vision s long term earnings growth rate is estimated at 17 8   The company currently carries a Zacks Rank  2  You can see ResMed s long term earnings growth rate is estimated at 14   It currently flaunts a Zacks Rank  1 Today s Best Stocks from ZacksWould you like to see the updated picks from our best market beating strategies  From 2017 through Q3 2019  while the S P 500 gained  39 6   five of our strategies returned  51 8    57 5    96 9    119 0   and even  158 9  This outperformance has not just been a recent phenomenon  From 2000   Q3 2019  while the S P averaged  5 6  per year  our top strategies averaged up to  54 1  per year ",2019-12-15,Zacks Investment Research,https://www.investing.com/analysis/boston-scientific-hits-new-52week-high-whats-driving-it-200492819,200492819
200258,421774,BSX,3 Fidelity Mutual Funds For Stupendous Returns,opinion,Fidelity boasts huge mutual fund assets under management and a wide variety of funds  spanning a wide spectrum of sectors  Fidelity Investments is one of the largest and oldest mutual fund companies in the world  The company provides investment advice  discount brokerage services  retirement services  wealth management services  securities execution  and clearance and life insurance products to its clients At Fidelity  a large group of investment professionals carry out extensive and in depth research to provide potential investment avenues worldwide for investors  Fidelity had total assets of about  2 trillion under management  as of Aug 31  2019   The company manages over 504 mutual funds across a wide range of categories including both domestic as well as foreign funds  and equity and fixed income funds Below we share with you three top ranked Fidelity mutual funds  Each has earned a  and is expected to outperform its peers in the future  Investors can  Fidelity International Capital Appreciation Fund  invests its assets heavily in securities of foreign issuers  primarily those from the emerging economies  FIVFX seeks to invest in common stocks and aims at maximizing long term growth of capital by allocating investments across different nations and regions of the world  FIVFX has returned 16 5  in the past three year period Sammy Simnegar has been the fund manager of FIVFX since 2008 Fidelity Select Medical Technology And Devices Portfolio  fund invests a large portion of its assets in securities of companies engaged in the manufacturing and distribution of medical devices and equipment  The fund invests in both U S  and non U S  stocks  FSMEX has three year annualized returns of 24  As of November 2019  FSMEX held 53 issues with almost 10 83  of its assets invested in Boston Scientific Corp  NYSE BSX  Fidelity Equity Income Fund  seeks reasonable income and capital appreciation  FEQIX normally invests at least 80  of its assets in equity securities  The fund also spends on income producing securities that lead to investments in large capital  value stocks  Moreover  it invests in domestic and foreign issuers  FEQIX has three year annualized returns of 9 9  FEQIX has an expense ratio of 0 61  compared with the category average of 1 01  To view the Zacks Rank and past performance of all Fidelity mutual funds  investors can  Want key mutual fund info delivered straight to your inbox Zacks  free Fund Newsletter will brief you on top news and analysis  as well as top performing mutual funds  each week ,2020-01-09,Zacks Investment Research,https://www.investing.com/analysis/3-fidelity-mutual-funds-for-stupendous-returns-200497948,200497948
200267,421783,BSX,Boston Scientific  BSX  Q3 Earnings And Revenues Beat Estimates,opinion,"Boston Scientific  BSX  came out with quarterly earnings of  0 39 per share  beating the Zacks Consensus Estimate of  0 38 per share  This compares to earnings of  0 35 per share a year ago  These figures are adjusted for non recurring items 
This quarterly report represents an earnings surprise of 2 63   A quarter ago  it was expected that this medical device manufacturer would post earnings of  0 38 per share when it actually produced earnings of  0 39  delivering a surprise of 2 63  
Over the last four quarters  the company has surpassed consensus EPS estimates three times 
Boston Scientific  which belongs to the Zacks Medical   Products industry  posted revenues of  2 71 billion for the quarter ended September 2019  surpassing the Zacks Consensus Estimate by 2 36   This compares to year ago revenues of  2 39 billion  The company has topped consensus revenue estimates two times over the last four quarters 
The sustainability of the stock s immediate price movement based on the recently released numbers and future earnings expectations will mostly depend on management s commentary on the earnings call 
Boston Scientific shares have added about 8  since the beginning of the year versus the S P 500 s gain of 19 5  
What s Next for Boston Scientific 
While Boston Scientific has underperformed the market so far this year  the question that comes to investors  minds is  what s next for the stock 
There are no easy answers to this key question  but one reliable measure that can help investors address this is the company s earnings outlook  Not only does this include current consensus earnings expectations for the coming quarter s   but also how these expectations have changed lately 
Empirical research shows a strong correlation between near term stock movements and trends in earnings estimate revisions  Investors can track such revisions by themselves or rely on a tried and tested rating tool like the Zacks Rank  which has an impressive track record of harnessing the power of earnings estimate revisions 
Ahead of this earnings release  the estimate revisions trend for Boston Scientific was mixed  While the magnitude and direction of estimate revisions could change following the company s just released earnings report  the current status translates into a Zacks Rank  3  Hold  for the stock  So  the shares are expected to perform in line with the market in the near future  You can see the complete list of today s Zacks  1 Rank  Strong Buy  stocks here 
It will be interesting to see how estimates for the coming quarters and current fiscal year change in the days ahead  The current consensus EPS estimate is  0 44 on  2 90 billion in revenues for the coming quarter and  1 56 on  10 68 billion in revenues for the current fiscal year 
Investors should be mindful of the fact that the outlook for the industry can have a material impact on the performance of the stock as well  In terms of the Zacks Industry Rank  Medical   Products is currently in the top 31  of the 250 plus Zacks industries  Our research shows that the top 50  of the Zacks ranked industries outperform the bottom 50  by a factor of more than 2 to 1 ",2019-10-23,Zacks Investment Research,https://www.investing.com/analysis/boston-scientific-bsx-q3-earnings-and-revenues-beat-estimates-200476553,200476553
200268,421784,BSX,Boston Scientific  BSX  Catches Eye  Stock Jumps 5 ,opinion,Boston Scientific Corporation   NYSE BSX   was a big mover last session  as the company saw its shares rise 5  on the day  The move came on solid volume too with far more shares changing hands than in a normal session  This stock  which remained volatile and traded within the range of  37 87   42 35 in the past one month time frame  witnessed a sharp increase yesterday The move came after the company reported better than expected third quarter 2019 results The company has seen a mixed track record when it comes to estimate revision of one increase and no decrease over the past few weeks  while the Zacks Consensus Estimate for the current quarter has remained unchanged  The recent price action is encouraging though  so make sure to keep a close watch on this firm in the near futureBoston Scientific currently has a Zacks Rank  3  Hold  while its  is positive Boston Scientific Corporation Price   Investors interested in the Medical   Products industry may consider Owens   Minor  Inc    NYSE OMI    which has a Zacks Rank  1  Strong Buy   You can see the complete list of today s Zacks  1 Rank stocks here Is BSX going up  Or down  Predict to see what others think Up or DownToday s Best Stocks from ZacksWould you like to see the updated picks from our best market beating strategies  From 2017 through 2018  while the S P 500 gained  15 8   five of our screens returned  38 0    61 3    61 6    68 1   and  98 3  This outperformance has not just been a recent phenomenon  From 2000   2018  while the S P averaged  4 8  per year  our top strategies averaged up to  56 2  per year ,2019-10-23,Zacks Investment Research,https://www.investing.com/analysis/boston-scientific-bsx-catches-eye-stock-jumps-5-200477462,200477462
200269,421785,BSX,Boston Scientific  BSX  Up 4 5  Since Last Earnings Report  Can It Continue ,opinion,"It has been about a month since the last earnings report for Boston Scientific  BSX   Shares have added about 4 5  in that time frame  outperforming the S P 500 
Will the recent positive trend continue leading up to its next earnings release  or is Boston Scientific due for a pullback  Before we dive into how investors and analysts have reacted as of late  let s take a quick look at the most recent earnings report in order to get a better handle on the important catalysts  Boston Scientific Sees Growth In All Lines in Q3Boston Scientific posted adjusted earnings per share of 39 cents in the third quarter of 2019  up 11 4  from the year ago quarter  The same exceeded the Zacks Consensus Estimate by a penny as well  Meanwhile  the figure matched the upper end of the company s guided range of 37 39 cents Reported EPS in the third quarter was 11 cents compared with earnings of 31 cents per share in the year ago quarter Revenues in DetailRevenues in the third quarter rose 13 1  year over year reportedly  up 14 2  on an operational basis  at constant exchange rate or CER  and up 9 3  on an organic basis  adjusted for foreign currency fluctuations and certain recent acquisitions  to  2 71 billion  Revenues also surpassed the Zacks Consensus Estimate of  2 64 billion by 2 7  Excluding the impact of BTG buyout  in the third quarter  the company achieved 10 6  growth in the United States on a reported basis  same operationally   6 3  improvement in the Europe  Middle East and Africa region  up 10 8    13 8  growth in the Asia Pacific zone  up 14 2    6 9  rise in Latin America and Canada  up 9 1   and 16 1  increase in the emerging markets  up 19 3   Segmental AnalysisBoston Scientific currently has three global reportable segments  Cardiovascular  Rhythm and Neuro plus MedSurg The company generates maximum revenues from Cardiovascular  Sales from its subsegments   Interventional Cardiology and Peripheral Interventions   were  700 million  up 14 6  year over year organically  and  311 million  up 8 2    respectively  in the third quarter Boston Scientific s Rhythm and Neuro business comprises Cardiac Rhythm Management  CRM   Electrophysiology and Neuromodulation  CRM reflected a 1 8  year over year increase in organic sales to  478 million in the reported quarter Electrophysiology sales went up 7  year over year organically to  81 million  Neuromodulation sales grew 7 9  year over year organically to  222 million Other segments like Endoscopy plus Urology and Pelvic Health  under the MedSurg broader group  recorded sales of  486 million  up 10 4  organically  and  359 million  up 10 5    respectively Boston Scientific noted that its operational results include the outcomes of BTG following the acquisition date of Aug 19  2019  BTG currently has two reporting segments  Interventional Medicine and Specialty Pharma  From Aug 19 to the quarter end  Interventional Medicine registered revenues of  48 million while Specialty Pharma reported revenues of  23 million MarginsGross margin in the third quarter contracted 62 basis points  bps  year over year to 71 3  due to a 15 6  rise in the cost of products sold Adjusted operating margin declined 72 bps to 22 1  in the reported quarter  Selling  general and administrative expenses increased 16 3  to  1 01 billion while research and development expenses rose 5 9  to  306  Meanwhile  royalty expenses of  15 million fell 11 8  year over year GuidanceBoston Scientific has raised its earlier provided reported revenues outlook for 2019  The company projects revenue growth in the 9 9 5  range on a reported basis  earlier guidance was 7 8    Organically  revenues are projected to be 7 5   the mid point of the earlier range of 7 8   The Zacks Consensus Estimate for 2019 revenues is pegged at  10 68 billion The company has also narrowed its 2019 adjusted EPS expectation to a band of  1 55  1 58  earlier expectation was  1 54  1 58   The Zacks Consensus Estimate of  1 56 is within the guided range The company also provided its fourth quarter 2019 financial outlook  It envisions revenue growth in the range of 13 15  on a reported basis and at 8 9  on an organic basis  Adjusted EPS is anticipated within 42 45 cents  The consensus mark for EPS stands at 44 cents while the same for revenues is pegged at  2 9 billion 
How Have Estimates Been Moving Since Then 
It turns out  fresh estimates have trended downward during the past month 
VGM Scores
Currently  Boston Scientific has a strong Growth Score of A  though it is lagging a lot on the Momentum Score front with a C  Charting a somewhat similar path  the stock was allocated a grade of D on the value side  putting it in the bottom 40  for this investment strategy 
Overall  the stock has an aggregate VGM Score of B  If you aren t focused on one strategy  this score is the one you should be interested in 
Outlook
Estimates have been broadly trending downward for the stock  and the magnitude of this revision has been net zero  Notably  Boston Scientific has a Zacks Rank  3  Hold   We expect an in line return from the stock in the next few months ",2019-11-21,Zacks Investment Research,https://www.investing.com/analysis/boston-scientific-bsx-up-45-since-last-earnings-report-can-it-continue-200487823,200487823
