,id,ticker,title,category,content,date,provider,url,article_id
14114,235629,ORLY,JD com  Inc   JD  Hits Fresh High  Is There Still Room To Run ,opinion,"Have you been paying attention to shares of JD com  JD   Shares have been on the move with the stock up 16  over the past month  The stock hit a new 52 week high of  37 76 in the previous session  JD com has gained 7 1  since the start of the year compared to the 1 6  move for the Zacks Retail Wholesale sector and the 3 2  return for the Zacks Internet   Commerce industry 
What s Driving the Outperformance 
The stock has a great record of positive earnings surprises  as it hasn t missed our earnings consensus estimate in any of the last four quarters  In its last earnings report on November 15  2019  JD com  Inc  reported EPS of  0 29 versus consensus estimate of  0 18 while it beat the consensus revenue estimate by 2 53  
For the current fiscal year  JD com  Inc  is expected to post earnings of  1 47 per share on  81 17 billion in revenues  Meanwhile  for the next fiscal year  the company is expected to earn  1 88 per share on  96 94 billion in revenues  This represents a year over year change of 38 68  and 19 44   respectively 
Valuation Metrics
JD com  Inc  may be at a 52 week high right now  but what might the future hold for the stock  A key aspect of this question is taking a look at valuation metrics in order to determine if the company is due for a pullback from this level 
On this front  we can look at the Zacks Style Scores  as they provide investors with an additional way to sort through stocks  beyond looking at the Zacks Rank of a security   These styles are represented by grades running from A to F in the categories of Value  Growth  and Momentum  while there is a combined VGM Score as well  Investors should consider the style scores a valuable tool that can help you to pick the most appropriate Zacks Rank stocks based on their individual investment style 
JD com  Inc  has a Value Score of D  The stock s Growth and Momentum Scores are B and B  respectively  giving the company a VGM Score of B 
In terms of its value breakdown  the stock currently trades at 25 7X current fiscal year EPS estimates  On a trailing cash flow basis  the stock currently trades at 58 3X versus its peer group s average of 19 9X  This isn t enough to put the company in the top echelon of all stocks we cover from a value perspective 
Zacks Rank
We also need to consider the stock s Zacks Rank  as this supersedes any trend on the style score front  Fortunately  JD com  Inc  currently has a Zacks Rank of  1  Strong Buy  thanks to favorable earnings estimate revisions from covering analysts 
Since we recommend that investors select stocks carrying Zacks Rank of 1  Strong Buy  or 2  Buy  and Style Scores of A or B  it looks as if JD com  Inc  fits the bill  Thus  it seems as though JD com  Inc  shares could have a bit more room to run in the near term 
How Does JD com  Inc  Stack Up to the Competition 
Shares of JD com  Inc  have been moving higher  and the company still appears to be a decent choice  but what about the rest of the industry  Some of its industry peers are also solid potential picks  including ASOS  LON ASOS  PLS  ASOMY   RH  RH   and O Reilly Automotive  NASDAQ ORLY   all of which currently have a Zacks Rank of at least  2 and a VGM Score of at least B  making them well rounded choices 
However  it is worth noting that the Zacks Industry Rank for this group is in the bottom half of the ranking  so it isn t all good news for JD com  Inc  Still  the fundamentals for JD com  Inc  are promising  and it still has potential despite being at a 52 week high ",2020-01-02,Zacks Investment Research,https://www.investing.com/analysis/jdcom-inc-jd-hits-fresh-high-is-there-still-room-to-run-200496255,200496255
14116,235631,ORLY,Why Is O Reilly Automotive  ORLY  Down 0 5  Since Last Earnings Report ,opinion,"It has been about a month since the last earnings report for O Reilly Automotive  ORLY   Shares have lost about 0 5  in that time frame  underperforming the S P 500 
Will the recent negative trend continue leading up to its next earnings release  or is O Reilly Automotive due for a breakout  Before we dive into how investors and analysts have reacted as of late  let s take a quick look at its most recent earnings report in order to get a better handle on the important catalysts  O Reilly s Q3 Earnings Top   Up Y YO Reilly Automotive  NASDAQ ORLY  Inc  reported diluted earnings per share of  5 08 in third quarter 2019  up 13  from  4 50 in the prior year quarter  Moreover  the figure surpassed the Zacks Consensus Estimate of  4 78 The company s quarterly revenues rose 7  year over year to  2 67 billion  Moreover  the figure beat the Zacks Consensus Estimate of  2 63 billion  O Reilly witnessed comparable store sales growth of 5  in the quarter ended Sep 30  2019  compared with 3 9  rise in the year ago quarter Net income amounted to  391 million for the quarter  up from  366 million recorded in the year ago quarter Q3 HighlightsGross profit grew 8  to  1 42 billion from  1 32 billion in the year ago quarter  Selling  general and administrative expenses rose 7  year over year to  886 million from  831 million in third quarter 2018  Operating income grew 11  to  536 million from  485 million reported in the prior year quarter Share RepurchasesDuring the reported quarter  O Reilly repurchased 1 million shares for  387 million at an average price of  377 85 per share  From the end of the quarter to the date of the earnings release  the company repurchased an additional 0 1 million shares of its common stock for  32 million at an average price of  393 33 per share Financial PositionThe company had cash and cash equivalents of  42 8 million at the end of the third quarter compared with  40 million in the year ago period  Its long term debt increased to  3 7 billion as of Sep 30  2019  from  3 1 billion as of Sep 30  2018 At the end of the third quarter  O Reilly generated  642 7 million in cash from operating activities compared with  466 8 million recorded a year ago  During the period  capital expenditure amounted to  185 6 million compared with  126 3 million in the year ago period  Further  free cash flow rose to  454 7 million from  327 million a year ago OutlookFor fourth quarter 2019  O Reilly projects earnings of  4 12  4 22 per share  Further  the company expects 3 5  rise in consolidated comparable store sales For 2019  O Reilly reiterated total revenue projection at  10  10 3 billion and earnings per share at  17 75  17 85 For the year  the company expects free cash flow of  1 0  1 1 billion 
How Have Estimates Been Moving Since Then 
It turns out  estimates revision have trended upward during the past month 
VGM Scores
At this time  O Reilly Automotive has a great Growth Score of A  though it is lagging a lot on the Momentum Score front with a C  Following the exact same course  the stock was allocated a grade of C on the value side  putting it in the middle 20  for this investment strategy 
Overall  the stock has an aggregate VGM Score of B  If you aren t focused on one strategy  this score is the one you should be interested in 
Outlook
Estimates have been trending upward for the stock  and the magnitude of these revisions looks promising  It comes with little surprise O Reilly Automotive has a Zacks Rank  2  Buy   We expect an above average return from the stock in the next few months ",2019-11-21,Zacks Investment Research,https://www.investing.com/analysis/why-is-oreilly-automotive-orly-down-05-since-last-earnings-report-200487820,200487820
14117,235632,ORLY,What Makes O Reilly Automotive  ORLY  A Strong Momentum Stock  Buy Now ,opinion,"Momentum investing revolves around the idea of following a stock s recent trend in either direction  In the  long  context  investors will be essentially be  buying high  but hoping to sell even higher   With this methodology  taking advantage of trends in a stock s price is key  once a stock establishes a course  it is more than likely to continue moving that way  The goal is that once a stock heads down a fixed path  it will lead to timely and profitable trades 
While many investors like to look for momentum in stocks  this can be very tough to define  There is a lot of debate surrounding which metrics are the best to focus on and which are poor quality indicators of future performance  The Zacks Momentum Style Score  part of the Zacks Style Scores  helps address this issue for us 
Below  we take a look at O Reilly Automotive  NASDAQ ORLY   a company that currently holds a Momentum Style Score of B  We also talk about price change and earnings estimate revisions  two of the main aspects of the Momentum Style Score 
It s also important to note that Style Scores work as a complement to the Zacks Rank  our stock rating system that has an impressive track record of outperformance  O Reilly Automotive currently has a Zacks Rank of  2  Buy   Our research shows that stocks rated Zacks Rank  1  Strong Buy  and  2  Buy  and Style Scores of A or B outperform the market over the following one month period 
You can see the current list of Zacks  1 Rank Stocks here    
Set to Beat the Market 
Let s discuss some of the components of the Momentum Style Score for ORLY that show why this auto parts retailer shows promise as a solid momentum pick 
Looking at a stock s short term price activity is a great way to gauge if it has momentum  since this can reflect both the current interest in a stock and if buyers or sellers have the upper hand at the moment  It s also helpful to compare a security to its industry  this can show investors the best companies in a particular area 
For ORLY  shares are up 0 92  over the past week while the Zacks Automotive   Retail and Wholesale   Parts industry is down 0 33  over the same time period  Shares are looking quite well from a longer time frame too  as the monthly price change of 1 13  compares favorably with the industry s 0 52  performance as well 
While any stock can see a spike in price  it takes a real winner to consistently outperform the market  Shares of O Reilly Automotive have increased 7 59  over the past quarter  and have gained 26 62  in the last year  On the other hand  the S P 500 has only moved 6 95  and 12 92   respectively 
Investors should also take note of ORLY s average 20 day trading volume  Volume is a useful item in many ways  and the 20 day average establishes a good price to volume baseline  a rising stock with above average volume is generally a bullish sign  whereas a declining stock on above average volume is typically bearish  Right now  ORLY is averaging 375 745 shares for the last 20 days 
Earnings Outlook
The Zacks Momentum Style Score encompasses many things  including estimate revisions and a stock s price movement  Investors should note that earnings estimates are also significant to the Zacks Rank  and a nice path here can be promising  We have recently been noticing this with ORLY 
Over the past two months  9 earnings estimates moved higher compared to none lower for the full year  These revisions helped boost ORLY s consensus estimate  increasing from  17 52 to  17 90 in the past 60 days  Looking at the next fiscal year  9 estimates have moved upwards while there have been no downward revisions in the same time period 
Bottom Line
Taking into account all of these elements  it should come as no surprise that ORLY is a  2  Buy  stock with a Momentum Score of B  If you ve been searching for a fresh pick that s set to rise in the near term  make sure to keep O Reilly Automotive on your short list ",2019-12-04,Zacks Investment Research,https://www.investing.com/analysis/what-makes-oreilly-automotive-orly-a-strong-momentum-stock-buy-now-200490077,200490077
14118,235633,ORLY,As 2020 Draws Closer  Here re The Best Stocks Of The Past Decade,opinion,As 2019 is drawing to a close  it s time to take a look at the best performing stocks of the past decade  and not just end of the year winners The Dow and the S P 500  in particular  have returned 165  and 244  since the end of 2009  Compounded annually  these figures would be 10 2  for the Dow and 13 2  for the S P 500 at the end of 2019  Thus  the average growth for the S P 500 in the last decade is much better compared with the 10  average of the past 100 years Having said that  the entire decade hasn t been smooth  especially the year 2018  Investors were expecting the stock market to crumble on worries about an imminent recession  But fortunately  that isn t the case  The U S  economy is growing at a steady pace  with third quarter GDP of this year expanding 2 1  and November jobs data remaining healthy  After all  hourly wages continued to increase at a faster rate  indicating a growing economy and the lowest unemployment level in 50 years Nonetheless  among individual stocks  Netflix  Inc    NASDAQ NFLX   has gained the most in the past decade with a whopping return of 3 767   which translates into a CAGR of 44 1   Netflix s partnership with Telefonica  MC TEF   KDDI  AT T  NYSE T   Comcast  NASDAQ CMCSA   DISH  Verizon  NYSE VZ   Charter  Altice  T Mobile and Sky is certainly doing good for its streaming platform  The company s subscriber base has been boosted by its content strength and focus on originals across various genres Other major behemoths  including Amazon com  Inc    NASDAQ AMZN   and Apple Inc    NASDAQ AAPL    have also been among the top performers  Amazon saw its shares gain a spectacular 1 209   while Apple s shares climbed 899  Amazon  particularly  has gained from solid Prime momentum owing to robust grocery services and strong content portfolio  Strengthening its AWS services  improving Alexa skills and expanding smart home products are some of the other major tailwinds  And when it comes to Apple  the company has benefitted from its services segment and improved iPhone sales  owing to the trade in programs Favorite Stocks of the Past DecadeWe have thus picked stocks that have not only been among the best performers of the past decade but also flaunt a Zacks Rank  1  Strong Buy  or 2  Buy  now NVIDIA Corporation   NASDAQ NVDA   operates as a visual computing company worldwide  It operates through two segments  GPU and Tegra Processor  The current limited trade agreement between Washington and Beijing bodes well for NVIDIA  as the Zacks Rank  2 company has significant exposure in China Over the past decade  NVIDIA has surged 1 231 7   higher than the  industry s rise of 292 1   What s more  NVIDIA is projected to see earnings growth of 29 7  next year  compared with the industry s expected rise of 13 1   Over the past two months  the company have seen eight earnings estimates move higher  compared with two lower  at least when looking at the next year time frame  The Zacks Consensus Estimate for its next year earnings has moved up 1 7  over the past 60 days Fortinet  Inc    NASDAQ FTNT   provides broad  integrated and automated cybersecurity solutions worldwide  It offers FortiGate hardware and software licenses that provide various security and networking functions  The Zacks Rank  1 company is benefiting from solid growth in Fortinet Security Fabric  cloud and SD WAN offerings  You can see  In the past 10 year period  Fortinet has gained 1 101 8   higher than the  industry s rise of 348 1   Fortinet is expected to see earnings growth of 12 5  next year versus the S P 500 s expected growth of 5 5   Over the past two months  the company have seen 11 earnings estimates move higher  compared with none lower  at least when looking at the next year time frame  The Zacks Consensus Estimate for its next year earnings has climbed 13 9  over the past 60 days Charter Communications  Inc    NASDAQ CHTR   provides cable services to residential and commercial customers in the United States  The Zacks Rank  2 company is benefiting from growth in Internet  mobile  commercial and video revenues  Increase in Internet speed at no extra cost is also aiding subscriber growth Over the past decade  Charter Communications has surged 1 145 7   higher than the  industry s rise of 328 9   What s more  Charter Communications is projected to see earnings growth of 97 5  next year versus the industry s estimated rise of 18 9   Over the past two months  the company have seen 12 earnings estimates move north  compared with one lower  at least when looking at the next year time frame  The Zacks Consensus Estimate for its next year earnings has risen 8 7  over the past 60 days O Reilly Automotive  Inc    NASDAQ ORLY   engages in the retail of automotive aftermarket parts  tools  supplies  equipment  and accessories in the United States  A customer centric business model and growing demand for high quality auto parts are currently working in favor of O Reilly In the past 10 year period  O Reilly has jumped 1 075 3   compared with the  industry s rise of 475 9   The Zacks Rank  2 company is also projected to see earnings growth of 11 6  next year versus the S P 500 s expected growth of 5 5   Over the past two months  the company have seen 10 earnings estimates move higher  compared with none lower  at least when looking at the next year time frame  The Zacks Consensus Estimate for its next year earnings has moved up nearly 2  over the past 60 days Zacks Top 10 Stocks for 2020In addition to the stocks discussed above  would you like to know about our 10 top tickers for the entirety of 2020 These 10 are painstakingly hand picked from over 4 000 companies covered by the Zacks Rank  They are our primary picks to buy and hold ,2019-12-15,Zacks Investment Research,https://www.investing.com/analysis/as-2020-draws-closer-herere-the-best-stocks-of-the-past-decade-200492802,200492802
14119,235634,ORLY,CarMax  KMX  Poised For An Earnings Beat In Q3  Here s Why,opinion,CarMax Inc    NYSE KMX   is set to release fiscal third quarter 2019 results on Dec 20  before the opening bell  The Zacks Consensus Estimate for the quarter to be reported is a profit of  1 15 on revenues of  4 67 billion The specialty retailer of used and new vehicles came up with better than expected results in the last reported quarter on the back of higher than expected sales in the used vehicle segment  Moreover  the bottom line increased 7 2  year over year As far as earnings surprises are concerned  CarMax   whose peers include Advance Auto Parts  Inc    NYSE AAP    O Reilly Automotive  Inc    NASDAQ ORLY   and AutoZone  Inc    NYSE AZO     is on an excellent footing  having surpassed the Zacks Consensus Estimate in each of the last four quarters  with average of 7 1   This is depicted in the graph below CarMax  Inc  Price and EPS Surprise   Investors are keeping their fingers crossed and hoping that the company can continue winning ways by topping earnings estimates this time around too  Encouragingly  our model also indicates an earnings beat for CarMax in the to be reported quarter Trend in Estimate RevisionThe Zacks Consensus Estimate for fiscal third quarter earnings per share has been upwardly revised by a penny in the past 30 days to  1 15  This indicates an improvement from the year ago reported earnings of  1 09 per share  The Zacks Consensus Estimate for revenues is pegged at  4 673 million  suggesting an improvement from  4 296 million reported in the prior year quarter What the Zacks Model SaysOur proven model predicts an earnings beat for CarMax this time around  The combination of a positive  and a Zacks Rank  1  Strong Buy   2  Buy  or 3  Hold  increases the odds of an earnings beat  You can uncover the best stocks to buy or sell before they re reported with our  Earnings ESP  The company has an Earnings ESP of  0 21  Zacks Rank  CarMax currently has a Zacks Rank of 3  You can see  Factors at PlayCarMax s extensive focus on the used vehicle market is likely to have buoyed earnings in the quartertobe reported Expensive new vehicles led to robust demand for cheaply available used vehicles This is anticipated to have driven sales  Evidently  the Zacks Consensus Estimate for used vehicles sales  which contribute to bulk of its revenues  is pegged at  3 906 million  This indicates an increase from the year ago level of  3 548 million  Used vehicle gross profit per unit is also expected to rise to  2 139 from  2 133 in the year ago quarter The firm s aggressive store expansion initiatives are expected to reflect on the upcoming results  The Zacks Consensus Estimate for net sales of wholesale vehicles is pegged at  634 million  pointing to an increase from  604 million generated in the year ago quarter  Further  the consensus estimate for revenues from other segments is  154 million  implying an increase from  144 million recorded a year ago Overall  CarMax is likely to have benefited from increased revenues from used vehicle and wholesale segments  Nonetheless  as the firm is undertaking aggressive store expansion initiatives  SG A expenses are likely to have soared in the to be reported quarter  thereby denting margins to some extent Today s Best Stocks from Zacks Would you like to see the updated picks from our best market beating strategies  From 2017 through Q3 2019  while the S P 500 gained  39 6   five of our strategies returned  51 8    57 5    96 9    119 0   and even  158 9  This outperformance has not just been a recent phenomenon  From 2000   Q3 2019  while the S P averaged  5 6  per year  our top strategies averaged up to  54 1  per year ,2019-12-16,Zacks Investment Research,https://www.investing.com/analysis/carmax-kmx-poised-for-an-earnings-beat-in-q3-heres-why-200492749,200492749
