,id,ticker,title,category,content,date,provider,url,article_id
137279,358794,TMO,Daimler drives European shares lower as data stirs more fears,news,"By Sruthi Shankar
 Reuters    European shares dipped on Thursday  as a warning from German carmaker  Daimler  and lackluster economic data from Asia and Europe countered a handful of positive corporate updates 
By 0929 GMT  the pan European STOXX 600 index  STOXX  slipped 0 1   with German shares  GDAXI  dropping 0 2  
Data showed Germany s economy narrowly avoided slipping into recession in the third quarter but growth remained close to zero and that in central and eastern European economies that rely heavily on its demand are crumbling 
Daimler  DE DAIGn  dropped about 3  after the carmaker said tougher emissions rules would hit earnings in 2020 and 2021  forcing it to seek more than 1 billion euros on staffing costs at Mercedes Benz by the end of 2022 
 Clearly  either side of zero is not great  It doesn t indicate a strong German economy   said Chris Bailey  European strategist at Raymond James 
 The thoughts now are to what extent will you see the German authorities stimulate their economy  
Daimler s warning spurred a 1  fall in the European auto index  SXAP   leading declines among the major sectors 
Other numbers on Thursday showed China s factory output growth slowed significantly more than expected in October and Japan s economy ground to a near standstill 
The gloom took European shares further from a four year peak hit last week driven by optimism about the chances of a  phase one  trade deal between the United States and China and some better than expected earnings 
Shares in Germany s biggest electricity producer  DE RWEG  also fell 2 5  and science and technology company Merck KGaA  DE MRCG  dropped 1 5  despite raising their 2019 forecasts 
The STOXX 600 s biggest gainer was genetic testing company  Qiagen   DE QIA   up 13 1  after Bloomberg reported scientific instruments maker Thermo Fisher Scientific  N TMO  had approached company about a potential deal 
Defensive sectors including real estate  SX86P   utilities  SX6P  and healthcare  SXDP   considered safer during times of economic uncertainty  also inched higher 
London s FTSE 100  FTSE  was down 0 4  as a drop in private equity company  3i   LON III  and a handful of stocks trading ex dividend overshadowed an earnings driven surge in luxury brand  Burberry  
Burberry s shares  L BRBY  rose about 6  after it said the popularity of collections by designer Riccardo Tisci boosted sales in its second quarter 
Official data showed British consumers  whose spending has helped the economy weather three years of Brexit turmoil  cut back on their shopping in October  adding to signs of weak overall economic growth ",2019-11-14,Reuters,https://www.investing.com/news/stock-market-news/daimler-drives-european-shares-lower-as-data-stirs-more-fears-2020517,2020517
137280,358795,TMO,Here s Why Thermo Fisher Scientific Jumped 45 1  in 2019,news,"What happened
Shares of Thermo Fisher Scientific  NYSE TMO  lept over 45  last year  according to data provided by S P Global Market Intelligence  The scientific research products monopoly didn t do anything impressive  but its massive market position means it didn t have to  The growth stock easily bested the roughly 29  gain of the S P 500 in 2019 
In the first nine months of 2019  the business reported revenue of  18 7 billion  marking a 4 8  increase from the year ago period  Operating income barely budged  although that was entirely due to a  442 million restructuring charge  Investors are nonetheless content with the company s moves to position itself for future growth 

So what
Thermo Fisher Scientific continued to make investments to keep up with the fast pace of innovation in biological technologies  In May  the business completed the  1 7 billion acquisition of viral vector manufacturing leader Brammer Bio  The move allows Thermo Fisher Scientific to play in the quickly growing area of clinical and commercial gene therapy manufacturing 
The scientific research products leader also acquired a pharmaceutical manufacturing facility in Cork  Ireland for approximately  117 million  which will bolster its production of active pharmaceutical ingredients  
And in a quiet move that may have been overlooked by investors  Thermo Fisher Scientific announced plans to invest  50 million to expand its production footprint of single use bioreactors and other equipment  The products are increasingly important in both pharmaceutical and industrial biotech applications but have been in short supply in recent years  The business has responded by investing heavily in its TruBio brand of automated bioprocess systems  
Now what
Thermo Fisher Scientific wrapped up 2019 by announcing a  2 5 billion share repurchase program  which replaced the prior buyback plan that had  500 million remaining  Considering the massive financial resources and market reach of the company s business  investors may be expecting the momentum to continue for the foreseeable future ",2020-01-10,The Motley Fool,https://invst.ly/pgkc1,2057237
137281,358796,TMO,What s Behind Thermo Fisher Scientific s Q4 Revenue and Earnings Beats,news,"Thermo Fisher Scientific  NYSE TMO  shares skyrocketed 45  in 2019  The company didn t deliver awe inspiring revenue and earnings growth  However  investors liked the steps that Thermo Fisher took to pave the way for future growth 
But were investors as thrilled after Thermo Fisher announced its fiscal 2019 fourth quarter and full year results before the market opened on Thursday  Here are the highlights from the company s Q4 update 

By the numbers
Thermo Fisher Scientific reported fourth quarter revenue of  6 83 billion  This reflected a 5  increase from the prior year period revenue total of  6 51 billion  It also topped the consensus Wall Street Q4 revenue estimate of  6 78 billion 
The company announced net income of  1 billion  or  2 49 per share  based on generally accepted accounting principles  GAAP   This result was a significant improvement over the GAAP net income of  898 million  or  2 22 per share  posted in the same period in 2018  
Thermo Fisher s adjusted net income in the fourth quarter was  3 55 per share  compared to adjusted earnings of  3 25 per share in the prior year period  It also narrowly beat the analysts  average adjusted earnings estimate of  3 54 per share 
Behind the numbers
The company s biggest moneymaker  its laboratory products and services segment  delivered revenue of  2 83 billion in Q4  up 9  year over year  The segment s adjusted operating margin also increased to 13 8  from 13 1  in the prior year period 
Thermo Fisher s life sciences solutions segment s Q4 revenue rose 8  year over year to  1 84 billion  Its adjusted operating margin increased by 0 7  from the same quarter in 2018 to 37 5  
Analytical instruments segment revenue in the fourth quarter slipped a little  from  1 57 billion in the year ago period to  1 52 billion in the latest quarter  Its adjusted operating margin also declined to 26  from 26 6  
Thermo Fisher s smallest unit  its specialty diagnostics segment  delivered Q4 revenue of  0 94 billion  down slightly from the  0 95 billion reported in the fourth quarter of 2018 due to the sale of the company s anatomical pathology business  The segment s adjusted operating margin also slid to 23 7  from 24 5   
Looking ahead
The company stated in its Q4 conference call that it expects full year 2020 revenue between  26 61 billion and  27 01 billion    up 4  to 6  year over year  Thermo Fisher looks for adjusted earnings per share of  13 49 to  13 67  an increase of 9  to 11  over its 2019 result  
However  some healthcare stocks  especially those with exposure to the Chinese market like Thermo Fisher  could face headwinds this year from the coronavirus outbreak that originated in China and has spread to the U S  and other countries  Thermo Fisher said that its full year 2020 guidance doesn t include any potential impact from the viral epidemic ",2020-01-30,The Motley Fool,https://invst.ly/pp2p6,2072141
