,id,ticker,title,category,content,date,provider,url,article_id
22996,244511,CORE,U S  Economy Likely To Sustain Longest Expansion  5 Top Picks,opinion,With the advent of July 2019  the U S  economy officially entered into the longest stretch of economic expansion at least since 1854  According to the National Bureau of Economic Research  NBER   the country is in the 121st month of economic expansion  outpacing the previous longest chain of March 1991 to March 2001  Notably  per NEBR  the current expansion started in June 2009 Meanwhile  economists and financial experts are divided on the continuation of economic momentum  A section of economists and financial experts are concerned that the next downturn is approaching  However  fundamentals of the U S  economy remain solid although the pace has slowed down  Despite the presence of near term concerns  a closer look at the U S  economy has a different story to tell  with enough reasons for further expansions U S  Economy on Solid GroundDuring the current expansion period  the U S  economy has grown at an average of around 2 3   much lower than the average growth of 4 2  during previous expansions  However  the reality is that  the current expansion started once the economy got rid of the great recession of 2008 2009  which was the severest downturn for the U S  economy since the great depression of 1930s  It takes time for the economy to grow fast after collapsing U S  GDP grew at 2 9  in 2018 and 3 1  in the first quarter of 2019  Major decisions by the Trump administration like tax cut to a historic low level  increase in government spending and deregulation helped the economy to increase pace  However  trade related concerns raised questions about the future growth of the economy  Meanwhile  the Fed is still projecting that the U S  economy to grow by 2 2  in 2019 U S  Economy Still Best GloballyThe most important driver of the current expansion is the U S  labor market  Despite a slowdown of in nonfarm payroll in May  the economy continues to add fabulous number of jobs with unemployment rate at its 69 year low of 3 6   The wage rate started picking up a healthy rate in the last three years  Despite these  inflation remains muted at just 1 6  far below the 2  target rate of the Fed The IHS Markit reported that U S  manufacturing PMI rose 50 6 in June from 50 1 in May  This is a significant achievement given the fact that trade negotiations between the United States and China broke down abruptly in early May  However  manufacturing PMI of China  Eurozone  especially Germany   the U K  and Russia fell below 50  hinting at contraction Moreover  U S  industrial production recorded its highest gain in May since December 2018  Most importantly  U S  manufacturing output registered its first monthly gain of 2019  In addition  core durable goods order    a key metric to track business investment plan    jumped significantly in May  These two metrics provide a major relief to the market s concern that investment softened in the manufacturing sector  which constitutes 12  of the U S  GDP Meanwhile  year to date  three major stock indexes of Wall Street     the Dow  S P 500 and Nasdaq Composite     jumped 14 8   18 6  and 22 2   respectively Trade and Fed to Play Major RolesAt present  major concerns of the U S  economy is the trade conflict with China  Although a quick solution to this problem is out of question  companies will heave a sigh of relief if the tariff war does not escalate further  A solution to the trade spat will also inject global economic growth Moreover  a dovish stance taken by the Fed since the beginning of this year is considered as a major boost to the U S  economy  So far  the central bank has kept its benchmark leading rate at 2 25   2 5   and has hinted at rate cut this year itself On Jun 19  in his speech following the FOMC meeting the Fed has removed the term  patient   from its minutes and added that  the FOMC will closely monitor the implications of incoming information for the economic outlook and will act as appropriate to sustain the expansion   Investors are considering a rate cut at least by 25 basis points in July and one or two more cuts the rest of this year Our Top PicksAt this stage  it will be prudent to invest in stock with strong growth potential and a favorable Zacks Rank  We have narrowed down our search to five such stocks with a  of A and Zacks Rank  1  Strong Buy   You can see   Each of these stocks has moved higher year to date and still has upside left The chart below shows price performance of our five picks year to date Core Mark Holding Co  Inc    NASDAQ CORE   is one of the largest marketers of fresh and broad line supply solutions to the convenience retail industry in North America  The company has expected earnings growth of 13 7  for the current year  The Zacks Consensus Estimate for the current year has improved by 3 3  over the last 60 days  The stock has surged 69 8  year to date Repligen Corp    NASDAQ RGEN   develops  manufactures  and sells products used to enhance the interconnected phases of the biological drug manufacturing process in North America  Europe  APAC and internationally  The company has expected earnings growth of 27 4  for the current year  The Zacks Consensus Estimate for the current year has improved by 8 2  over the last 60 days  The stock has surged 62 4  year to date Aaron s Inc    NYSE AAN   operates as an omnichannel provider of lease purchase solutions to underserved and credit challenged customers  It operates in three segments  Progressive  NYSE PGR  Leasing  Aaron s Business  and DAMI  The company has expected earnings growth of 14  for the current year  The Zacks Consensus Estimate for the current year has improved by 0 8  over the last 60 days  The stock has surged 50 6  year to date HubSpot Inc    NYSE HUBS   provides a cloud based marketing and sales software platform for businesses in the Americas  Europe and the Asia Pacific  The company has expected earnings growth of 44 9  for the current year  The Zacks Consensus Estimate for the current year has improved by 12 2  over the last 60 days  The stock has surged 38 4  year to date Quanex Building Products Corp    NYSE NX   is an industry leading manufacturer of components sold to Original Equipment Manufacturers in building products industry  The company has expected earnings growth of 30 8  for the current year  The Zacks Consensus Estimate for the current year has improved by 11 8  over the last 60 days  The stock has surged 37  year to date The Hottest Tech Mega Trend of AllLast year  it generated  8 billion in global revenues  By 2020  it s predicted to blast through the roof to  47 billion  Famed investor Mark Cuban says it will produce  the world s first trillionaires   but that should still leave plenty of money for regular investors who make the right trades early ,2019-07-02,Zacks Investment Research,https://www.investing.com/analysis/us-economy-likely-to-sustain-longest-expansion-5-top-picks-200436793,200436793
22997,244512,CORE,The Zacks Analyst Blog Highlights  Core Mark  Repligen  Aaron s  HubSpot And Quanex Building Products,opinion,"For Immediate Release
Chicago  IL   July 5  2019   Zacks com announces the list of stocks featured in the Analyst Blog  Every day the Zacks Equity Research analysts discuss the latest news and events impacting stocks and the financial markets  Stocks recently featured in the blog include Core Mark Holding Co  Inc    NASDAQ CORE    Repligen Corp    NASDAQ RGEN    Aaron s Inc    NYSE AAN    HubSpot Inc    NYSE HUBS   and Quanex Building Products Corp    NYSE NX   
Here are highlights from Wednesday s Analyst Blog  
U S  Economy Likely to Sustain Longest Expansion  5 Top Picks
With the advent of July 2019  the U S  economy officially entered into the longest stretch of economic expansion at least since 1854  According to the National Bureau of Economic Research  NBER   the country is in the 121st month of economic expansion  outpacing the previous longest chain of March 1991 to March 2001  Notably  per NEBR  the current expansion started in June 2009 
Meanwhile  economists and financial experts are divided on the continuation of economic momentum  A section of economists and financial experts are concerned that the next downturn is approaching  However  fundamentals of the U S  economy remain solid although the pace has slowed down  Despite the presence of near term concerns  a closer look at the U S  economy has a different story to tell  with enough reasons for further expansions 
U S  Economy on Solid Ground
During the current expansion period  the U S  economy has grown at an average of around 2 3   much lower than the average growth of 4 2  during previous expansions  However  the reality is that  the current expansion started once the economy got rid of the great recession of 2008 2009  which was the severest downturn for the U S  economy since the great depression of 1930s  It takes time for the economy to grow fast after collapsing 
U S  GDP grew at 2 9  in 2018 and 3 1  in the first quarter of 2019  Major decisions by the Trump administration like tax cut to a historic low level  increase in government spending and deregulation helped the economy to increase pace  However  trade related concerns raised questions about the future growth of the economy  Meanwhile  the Fed is still projecting that the U S  economy to grow by 2 2  in 2019 
U S  Economy Still Best Globally
The most important driver of the current expansion is the U S  labor market  Despite a slowdown of in nonfarm payroll in May  the economy continues to add fabulous number of jobs with unemployment rate at its 69 year low of 3 6   The wage rate started picking up a healthy rate in the last three years  Despite these  inflation remains muted at just 1 6  far below the 2  target rate of the Fed 
The IHS Markit reported that U S  manufacturing PMI rose 50 6 in June from 50 1 in May  This is a significant achievement given the fact that trade negotiations between the United States and China broke down abruptly in early May  However  manufacturing PMI of China  Eurozone  especially Germany   the U K  and Russia fell below 50  hinting at contraction 
Moreover  U S  industrial production recorded its highest gain in May since December 2018  Most importantly  U S  manufacturing output registered its first monthly gain of 2019  In addition  core durable goods order    a key metric to track business investment plan    jumped significantly in May  These two metrics provide a major relief to the market s concern that investment softened in the manufacturing sector  which constitutes 12  of the U S  GDP 
Meanwhile  year to date  three major stock indexes of Wall Street     the Dow  S P 500 and Nasdaq Composite     jumped 14 8   18 6  and 22 2   respectively 
Trade and Fed to Play Major Roles
At present  major concerns of the U S  economy is the trade conflict with China  Although a quick solution to this problem is out of question  companies will heave a sigh of relief if the tariff war does not escalate further  A solution to the trade spat will also inject global economic growth 
Moreover  a dovish stance taken by the Fed since the beginning of this year is considered as a major boost to the U S  economy  So far  the central bank has kept its benchmark leading rate at 2 25   2 5   and has hinted at rate cut this year itself 
On Jun 19  in his speech following the FOMC meeting the Fed has removed the term  patient   from its minutes and added that  the FOMC will closely monitor the implications of incoming information for the economic outlook and will act as appropriate to sustain the expansion   Investors are considering a rate cut at least by 25 basis points in July and one or two more cuts the rest of this year 
Our Top Picks
At this stage  it will be prudent to invest in stock with strong growth potential and a favorable Zacks Rank  We have narrowed down our search to five such stocks with a  of A and Zacks Rank  1  Strong Buy   You can see   Each of these stocks has moved higher year to date and still has upside left 
Core Mark Holding Co  Inc is one of the largest marketers of fresh and broad line supply solutions to the convenience retail industry in North America  The company has expected earnings growth of 13 7  for the current year  The Zacks Consensus Estimate for the current year has improved by 3 3  over the last 60 days  The stock has surged 69 8  year to date 
Repligen Corp develops  manufactures  and sells products used to enhance the interconnected phases of the biological drug manufacturing process in North America  Europe  APAC and internationally  The company has expected earnings growth of 27 4  for the current year  The Zacks Consensus Estimate for the current year has improved by 8 2  over the last 60 days  The stock has surged 62 4  year to date 
Aaron s Inc  operates as an omnichannel provider of lease purchase solutions to underserved and credit challenged customers  It operates in three segments  Progressive  NYSE PGR  Leasing  Aaron s Business  and DAMI  The company has expected earnings growth of 14  for the current year  The Zacks Consensus Estimate for the current year has improved by 0 8  over the last 60 days  The stock has surged 50 6  year to date 
HubSpot Inc  provides a cloud based marketing and sales software platform for businesses in the Americas  Europe and the Asia Pacific  The company has expected earnings growth of 44 9  for the current year  The Zacks Consensus Estimate for the current year has improved by 12 2  over the last 60 days  The stock has surged 38 4  year to date 
Quanex Building Products Corp is an industry leading manufacturer of components sold to Original Equipment Manufacturers in building products industry  The company has expected earnings growth of 30 8  for the current year  The Zacks Consensus Estimate for the current year has improved by 11 8  over the last 60 days  The stock has surged 37  year to date 
The Hottest Tech Mega Trend of All
Last year  it generated  8 billion in global revenues  By 2020  it s predicted to blast through the roof to  47 billion  Famed investor Mark Cuban says it will produce  the world s first trillionaires   but that should still leave plenty of money for regular investors who make the right trades early 

Media Contact
Zacks Investment Research
800 767 3771 ext  9339
 
 
Past performance is no guarantee of future results  Inherent in any investment is the potential for loss  This material is being provided for informational purposes only and nothing herein constitutes investment  legal  accounting or tax advice  or a recommendation to buy  sell or hold a security  No recommendation or advice is being given as to whether any investment is suitable for a particular investor  It should not be assumed that any investments in securities  companies  sectors or markets identified and described were or will be profitable  All information is current as of the date of herein and is subject to change without notice  Any views or opinions expressed may not reflect those of the firm as a whole  Zacks Investment Research does not engage in investment banking  market making or asset management activities of any securities  These returns are from hypothetical portfolios consisting of stocks with Zacks Rank   1 that were rebalanced monthly with zero transaction costs  These are not the returns of actual portfolios of stocks  The S P 500 is an unmanaged index  Visit  for information about the performance numbers displayed in this press release ",2019-07-04,Zacks Investment Research,https://www.investing.com/analysis/the-zacks-analyst-blog-highlights-coremark-repligen-aarons-hubspot-and-quanex-building-products-200437312,200437312
22998,244513,CORE,5 Business Services Stocks To Buy As Job Gains Rebound ,opinion,In June  job additions recovered substantially from the severe slump experienced in the preceding month  Hiring widely exceeded estimates  putting to rest fears that the economy was headed for a slowdown  Gains were largely broad based  with only retailers shedding jobs during the month  Once again  healthcare and professional and technical services emerged as the leading recruiters A strong jobs report brings mixed tidings for investors  On the one hand  it reduces chances of a near term rate cut by the data dependent Federal Reserve  On the other hand  it does indicate that the labor market is still robust even as economic expansion moves into fresh record territory  Investing in business services stocks  the top hiring sector in June  looks prudent now Hiring Recovers  Unemployment Close to 50 Year LowThe U S  economy added 224 000 jobs in June  easily exceeding the consensus estimate of 161 000  However  May s dismal hiring numbers were revised marginally downward  from 75 000 to 72 000  Also  at 172 000  average job additions for the first half of 2019 were lower than 223 000 registered last year However  the decline in job growth does not detract from the fact that the economy is continuing to create jobs at a steady pace so far into the expansion  Meanwhile  the unemployment rate inched up from 3 6  to 3 7  as 335 000 individuals joined the workforce The U6 unemployment rate  which includes people forced into part time work and those only sporadically looking for jobs  edged up by 0 1  to 7 2   However  the labor force participation rate  a gauge of the share of working age Americans  who are employed or looking for a position  increased from 62 8  to 62 9  Healthcare  White Collar Firms Lead HiringJune s gains were largely broad based  Manufacturing added 17 000 jobs  a development which comes as a major boost to President Trump for whom the sector has been a priority  The increase is notable since the sector contributed only 3 000 jobs in both April and May  preceded by a contraction in March Meanwhile  construction companies added 21 000 workers  Transportation and warehousing added 24 000 jobs in June and have created 158 000 positions in the past 12 months  While 7 000 more couriers and messengers were added  hiring in air transportation increased by 3 000 Healthcare  and professional and technical services continued to lead jobs gains  Employment in healthcare increased by 35 000 jobs in June and by 403 000 in the past 12 months  While ambulatory health care services added 19 000 positions  hospitals recruited 11 000 more employees Professional and technical services added 51 000 jobs last month  A spurt in hiring in the consulting and computer system design domains is primarily powering jobs growth for the sector  The sector has created 303 000 jobs over the past 12 months Our ChoicesJune s jobs report will go a long way in allaying fears that the U S  economy is headed for a slowdown  Market watchers think it is heartening that steady job gains are continuing to flow in even as economic expansion chugs along  With trade tensions ebbing  better times could lie ahead for the economy This is why it makes good sense to add business services stocks to your portfolio  However  picking winning stocks may be difficult This is where our  comes in  Here V stands for Value  G for Growth and M for Momentum and the score is a weighted combination of these three scores  Such a score allows you to eliminate the negative aspects of stocks and select winners  However  it is important to keep in mind that each Style Score will carry a different weight while arriving at a VGM Score  We have narrowed down our search to the following stocks based on a good Zacks Rank and VGM Score Core Mark Holding Company  Inc    NASDAQ CORE   is one of the largest marketers of fresh and broad line supply solutions to the convenience retail industry in North America Core Mark has a Zacks Rank  1  Strong Buy  and VGM Score of A  The company s expected earnings growth for the current year is 13 9    Limbach Holdings  Inc    NASDAQ LMB   is a provider of commercial specialty contract services in the United States Limbach has a Zacks Rank  1 and VGM Score of B  The company s expected earnings growth for the current year is more than 100   The Zacks Consensus Estimate for the current year has improved by 35 4  over the past 60 days NV5 Global  Inc    NASDAQ NVEE   offers professional  technical consulting and certification solutions for public and private sector NV5 Global has a VGM Score of B  The company s expected earnings growth for the current year is 17 9   The stock sports a Zacks Rank  1  You can see  Booz Allen Hamilton   NYSE BAH   is a provider of management and technology consulting  analytics  engineering  digital solutions  mission operations and cyber expertise to the United States and international governments  corporations plus not for profit organizations Booz Allen has a Zacks Rank  2  Buy  and VGM Score of A  The company has expected earnings growth of 9 2  for the current year  The Zacks Consensus Estimate for the current year has improved by 1 7  over the past 60 days Broadridge Financial   NYSE BR   is a global financial technology company that offers investor communications and technology driven solutions to banks  broker dealers  asset managers and corporate issuers Broadridge has a Zacks Rank  2 and VGM Score of B  The company has expected earnings growth of 9 5  for the current year Looking for Stocks with Skyrocketing Upside Zacks has just released a Special Report on the booming investment opportunities of legal marijuana      Ignited by new referendums and legislation  this industry is expected to blast from an already robust  6 7 billion to  20 2 billion in 2021  Early investors stand to make a killing  but you have to be ready to act and know just where to look ,2019-07-08,Zacks Investment Research,https://www.investing.com/analysis/5-business-services-stocks-to-buy-as-job-gains-rebound-200437633,200437633
