,id,ticker,title,category,content,date,provider,url,article_id
117763,339278,IAC,Alibaba  BABA  Beats Q2 Earnings Estimates  Lags Revenues,opinion,"Alibaba Group Holding Limited   NYSE BABA   reported second quarter fiscal 2019 earnings of  1 40 per share  surpassing the Zacks Consensus Estimate by 28 cents  Also  earnings increased 14 8  year over year It reported revenues of RMB85 15 billion  US 12 4 billion   up 54  from the prior year quarter  The year over year revenue increase was driven by strength in the company s China commerce retail business  the consolidation of Ele me and Cainiao Network  as well as strong revenue growth of Alibaba Cloud However  its revenues missed the Zacks Consensus Estimate of US 12 65 billion Weaker than expected consumer spending impacted Alibaba s core retail business  resulting in weak sales of durable items  especially consumer electronics Coming to price performance  shares of the company have lost 14 4  on a year to date basis against the  s growth of 2 9    Revenues by SegmentsAlibaba has four reportable segments   Core Commerce  Cloud Computing  Digital Media and Entertainment  and Innovation Initiatives  The details of these segments are discussed below 
Core Commerce  This segment comprises marketplaces operating in retail and wholesale commerce in China  and international commerce  The segment s revenues in the quarter were RMB72 5 billion  US 10 5 billion   reflecting an increase of 56  on a year over year basis 
China commerce retail business  64  of the total revenues    The business vertical s revenues in the quarter were RMB54 2 billion  US 7 9 billion   reflecting an increase of 37  year over year  The increase was driven by robust growth in the company s New Retail businesses  mainly Tmall Import  Hema fresh food grocery business  Tmall Import and Intime Department Stores 
China commerce wholesale business  3  of the total revenues    This business generated revenues of RMB2 5 billion  US 364 million   reflecting an increase of 46  from the year ago quarter  The increase was due to a rise in average revenues from paying members 
International commerce retail business  5  of the total revenues    Revenues in the quarter were RMB4 5 billion  US 650 million   increasing 55  year over year  The increase was driven by robust GMV growth in two marketplaces  namely Lazada and AliExpress 
International commerce wholesale business  2  of the total revenues    This business generated revenues of RMB2 billion  US 294 million   increasing 22  from the prior year quarter  The growth was due to an increase in the number of paying members on alibaba com platform 
Cainiao logistics services  4  of the total revenues    This business generated revenues of RMB3 2 billion  US 467 million   The segment represents revenues from domestic and cross border fulfilment services provided by Cainiao Network  after elimination of inter company transactions 
Consumer services  6  of the total revenues    This business generated revenues of RMB5 billion  US 731 million  
Others business  1  of the total revenues    This business generated revenues of RMB1 1 billion  US 162 million   reflecting an increase of 68  year over year Cloud Computing  This segment comprises Alibaba Cloud that offers a complete suite of cloud services  Revenues in the quarter were RMB5 7 billion  US 825 million   up 90  from the year ago quarter  driven by an increase in the number of paying customers and improved revenue mix of higher value added services Digital Media and Entertainment  The segment operates businesses through media properties that include UCWeb  Youku Tudou  OTT TV service  Alibaba Music and Alibaba Sports  Revenues were RMB5 9 billion  US 865 million   reflecting an increase of 24  on a year over year basis  The segment s top line growth was driven by an increase in revenues from mobile value added services provided by UCWeb  such as news feeds and mobile search  along with subscription and advertising revenues from Youku Tudou Innovation Initiatives and Others  This segment includes businesses such as the YunOS operating system  AutoNavi  DingTalk enterprise messaging and others  Revenues in the quarter were RMB1 1 billion  US 155 million   up 20  year over year  driven by an increase in revenues from Tmall Genie Key MetricsMobile Monthly Active Users  MAUs    Mobile MAUs were 666 million  improving 21  from the prior year quarter and 5  sequentially  This improvement was caused by an increase in the adoption of mobile devices by consumers  as the primary method of accessing Alibaba s platforms Annual Active Buyers   China retail marketplaces had 601 million annual active buyers in the 12 month period ended Sep 30  2018  reflecting 23  year over year growth and 4 3  sequential improvement Operating ResultsPro forma gross margin was 45 1   down 1 500 basis points year over year Alibaba s operating expenses  product development   sales and marketing   general and administrative  of RMB22 3 billion increased 50 5  from a year ago Adjusted EBITDA margin decreased to 31  from 45  in the year ago quarter  primarily due to higher investments in New Retail and other expansion activities Balance SheetAlibaba exited fiscal second quarter with cash and cash equivalents  as well as short term investments of approximately RMB171 9 billion  US 25 billion  compared with RMB177 3 billion  US 26 8 billion  in the first quarter of fiscal 2019 Cash Flow Share RepurchaseNet cash flow from operations was RMB31 4 billion  US 4 6 billion  while free cash flow was RMB16 billion  US 2 3 billion  in the fiscal second quarter Fiscal 2019 GuidanceManagement lowered its fiscal 2019 revenue guidance by 4 6  to the range of RMB375 billion to RMB383 billion due to delayed monetization Management believes that the economic impact of a U S  China trade spat could lower the company s revenues ahead of its top sale season Alibaba Group Holding Limited Price  Consensus and EPS Surprise
    Zacks Rank and Stocks to ConsiderCurrently  Alibaba Group has a Zacks Rank  3  Hold   Some better ranked stocks in the broader technology sector are boohoo group plc   OTC BHOOY    IAC InterActiveCorp   NASDAQ IAC   and AMETEK  Inc    NYSE AME    each carrying a Zacks Rank  2  Buy   You can see Long term earnings growth rate for boohoo group  IAC InterActiveCorp and AMETEK is currently pegged at 25   15  and 10 97   respectively Looking for Stocks with Skyrocketing Upside Zacks has just released a Special Report on the booming investment opportunities of legal marijuana      Ignited by new referendums and legislation  this industry is expected to blast from an already robust  6 7 billion to  20 2 billion in 2021  Early investors stand to make a killing  but you have to be ready to act and know just where to look ",2018-11-04,Zacks Investment Research,https://www.investing.com/analysis/alibaba-baba-beats-q2-earnings-estimates-lags-revenues-200354808,200354808
117764,339279,IAC,WESCO  WCC  Beats Q3 Earnings Estimates  Lags Revenues,opinion,"WESCO International  Inc    NYSE WCC   reported third quarter 2018 adjusted earnings of 1 41 per share  which surpassed the Zacks Consensus Estimate by 5 cents  The figure increased 26  on a year over year basis and 15 6  sequentially 
Strong operating results  a lower tax rate and the benefit of share repurchases drove the year over year growth of its bottom line 
Net sales of  2 067 billion missed the Zacks Consensus Estimate of  2 106 billion  The figure increased 3 4  on a year over year basis but decreased 1 8  sequentially  Further  the sales growth came within management s guided range of 3 6  
Further  organic sales grew 4 2  from the prior year quarter 
The year over year sales growth was driven by strength in almost all its end markets  Additionally  growing contract wins in all the end markets remain a positive 
Notably  shares of WESCO have lost 20 8  on a year to date basis against the  s growth of 6 1  

Top Line in Detail
WESCO operates in four organized end markets  namely Industrial  Construction  Utility and CIG 
Industrial Market  The company recorded 1  year over year growth in organic sales  reflecting 3  sales improvement in the United States and 4  growth in Canada in local currency 
Construction Market  Organic sales increased 3  year over year  with 12  growth in Canada in local currency  This can be attributed to strong sales from the industrial and commercial contractors  Further  sales to non residential construction customers continued to accelerate in the quarter 
Additionally  backlog was down 3  sequentially but increased 7  year over year in the reported quarter  The company expects continuous investment in nonresidential construction projects  indicating a positive momentum 
Utility Market  The company experienced year over year sales growth of 11  in this market  This was driven by 13  improvement in the United States  partially offset by a decline of 4  in Canada in local currency  Strong performance in this market can be attributed to strengthening relationships with investor owned utility  public power and utility contractor customers  Further  WESCO continued to gain from the growing need for renewable energy 
CIG Market  The company recorded 8  year over year improvement in organic sales in this market  driven by strong performance in Canada  12  growth in local currency   Moreover  sales growth in international markets contributed significantly in the quarter 
The upside was driven by strong momentum across technology customers  with its robust supply chain solutions portfolio  Sales also gained from continuous growth in LED lighting solutions  fiber to the X deployments  broadband build outs  as well as physical and cyber security for critical infrastructure protection 
Operating Details
Gross margin was up 19 2  in the reported quarter  which contracted 10 basis points  bps  from the year ago quarter  This was due to an unfavorable business mix 
Selling  general and administrative expenses  SG A   as percentage of revenues  were 13 7   contracting 30 bps on a year over year basis 
WESCO s operating profit came in at  97 5 million  up 10  from the prior year quarter 
However  operating margin was 4 7   up 30 bps from the year ago quarter 
Balance Sheet   Cash Flow
At the end of the third quarter  cash   cash equivalents were  142 8 million compared with  110 9 million in the second quarter  Long term debt was  1 23 billion compared with  1 26 billion at the end of second quarter 2018 
Additionally  WESCO generated  87 7 million in cash from operations  up from  33 8 million at the end of the second quarter 
Free cash flow was  80 4 million  up from  25 1 million in the last reported quarter 
Guidance
For fourth quarter 2018  WESCO expects sales growth in the range of 1 4   The Zacks Consensus Estimate for sales is pegged at  2 09 billion 
For 2018  the company revised its sales growth guidance to 6 8  from prior expectation of 3 6   The Zacks Consensus Estimate for the same is pegged at  8 29 billion WESCO International  Inc  Price  Consensus and EPS Surprise
 

   Zacks Rank and Stocks to Consider
Currently  WESCO has a Zacks Rank  2  Buy  Other better ranked stocks in the broader technology sector are boohoo group plc   OTC BHOOY    IAC InterActiveCorp   NASDAQ IAC   and AMETEK  Inc    NYSE AME    each carrying a Zacks Rank  2  Buy   You can see 
Long term earnings growth rate for boohoo group  IAC InterActiveCorp and AMETEK is currently pegged at 25   15  and 10 97   respectively 
Will You Make a Fortune on the Shift to Electric Cars  
Here s another stock idea to consider  Much like petroleum 150 years ago  lithium power may soon shake the world  creating millionaires and reshaping geo politics  Soon electric vehicles  EVs  may be cheaper than gas guzzlers  Some are already reaching 265 miles on a single charge 
With battery prices plummeting and charging stations set to multiply  one company stands out as the  1 stock to buy accordingto Zacks research 
It s not the one you think ",2018-11-07,Zacks Investment Research,https://www.investing.com/analysis/wesco-wcc-beats-q3-earnings-estimates-lags-revenues-200356432,200356432
117765,339280,IAC,IAC  Expedia Beat Q4 Expectations,opinion,"Internet services conglomerate IAC InterActiveCorp   NASDAQ IAC   reported Q4 earnings results after the closing bell Thursday  with earnings of  2 04 per share way outperforming the expected 99 cents per share  Revenues grew 16  year over year to  1 104 billion  better than the  1 07 billion in the Zacks consensus  The majority investor of several online service brands has now beaten earnings estimates in 4 of the last 5 quarters  with a trailing 4 quarter average beat of 58  Angie s List grew 25  to  279 million in the quarter  while Match com was up 17  to  8 2 million  The company cited increases in Average Revenue per User  ARPU  at Match owned Tinder in the quarter  Yet these numbers were already somewhat baked into the stock s performance  as Match com   NASDAQ MTCH   reported earnings themselves yesterday afternoon Shares are not moving much in late trading  likely because of the Match com numbers already being out as of Wednesday  Also  the stock had already climbed 18  since the first of the year  Further clarification can be expected on the company s conference call  which is scheduled for tomorrow Internet travel site Expedia   NASDAQ EXPE   also topped expectations on both sales and earnings for its Q4 report  bringing  1 18 per share versus  1 07 expected on revenues of  2 56 billion which outpaced the  2 54 billion our analysts were looking for  Revenues grew 10  year over year  and also included sales from the now spun off Trivago travel site  Gross bookings grew 13  year over year  and the company notably crossed the 1 million mark of properties available through their service 
Zacks  Top 10 Stocks for 2019
In addition to the stocks discussed above  wouldn t you like to know about our 10 finest buy and holds for the year 
From more than 4 000 companies covered by the Zacks Rank  these 10 were picked by a process that consistently beats the market  Even during 2018 while the market dropped  5 2   our Top 10s were up well into double digits  And during bullish 2012   2017  they soared far above the market s  126 3   reaching  181 9  
This year  the portfolio features a player that thrives on volatility  an AI comer  and a dynamic tech company that helps doctors deliver better patient outcomes at lower costs ",2019-02-07,Zacks Investment Research,https://www.investing.com/analysis/iac-expedia-beat-q4-expectations-200385444,200385444
117766,339281,IAC,These 5 Top Stocks May Surprise You With An Earnings Beat ,opinion,"Just earnings growth is not enough to keep investors happy these days  A positive earnings surprise or a  BEAT  is what matters  irrespective of earnings growth  A positive earnings surprise or earnings beat is typically the case when actual or reported earnings come in above the consensus estimate 
Why Is a Positive Earnings Surprise So Important 
Historically  stocks of companies with solid quarterly earnings  on a nominal basis  tank if they miss or merely meet market expectations  After all  a 20  earnings rise  though apparently looks good  doesn t tell you if it has been decelerating 
Seasonal fluctuations also come into play  If a company s Q1 is seasonally weak and Q4 is strong  it is likely to report a sequential earnings decline  In such cases  growth rates are misleading while judging the true health of a company 
It s only after significant research and analysis on a company s financials and initiatives that Wall Street analysts project its earnings  They also take a company s guidance into consideration when deriving an earnings estimate 
Thus  outperforming that estimate is almost equivalent to beating the company s own expectation as well as the market perception  If the margin of earnings surprise is big  it typically drives the stock higher right after the release  Thus  more than anything else  an earnings surprise can push a stock higher 
 How to Locate Potential Outperformers  
Investors tend to look for stocks that have the potential to beat on the bottom line but might not always succeed  One way of identifying the winners beforehand is by looking at the earnings surprise history of a company 
An impressive track record in this regard generally acts as a driver  It indicates the company s ability to exceed estimates  Investors generally believe that the company will have the same trick up its sleeve to deliver yet another earning beat in its upcoming release 
The Winning Strategy
In order to shortlist stocks that are likely to come up with an earnings surprise  we chose the following as our primary screening parameters 
Last EPS Surprise greater than or equal to 10  Stocks delivering positive surprise in the last quarter tend to surprise again 
Average EPS Surprise in the last four quarters greater than 20  We lifted the bar for outperformance slightly higher by setting the average EPS surprise for the last four quarters at 20  
Average EPS Surprise in the last two quarters greater than 20  This points to a more consistent surprise history and makes the case for another surprise even stronger 
In addition  we place a few other criteria that push up the chance of a surprise 
Zacks Rank less than or equal to 2  Only companies with a Zacks Rank of  1  Strong Buy  or 2  Buy  can get through 
greater than zero  A stock needs to have both a positive Earnings ESP and a Zacks Rank of  1  2 or 3  Hold  for an earnings beat to happen  as per our proven model 
In order to zero in on those that have long term growth potential and high trading liquidity we have added the following parameters too 
Next 3 5 Years Estimated EPS Growth  Per Year  greater than 10   Solid expected earnings growth exhibits the stock s long term growth prospects 
Average 20 day Volume greater than 100 000  High trading volume implies that the stocks have adequate liquidity 
A handful of criteria narrowed down the universe from over 7 700 stocks to just seven 
Here are five out of the seven stocks 
IAC InterActiveCorp    NASDAQ IAC     This is a leading media and Internet company  The stock carries a Zacks Rank  2  You can see  
Tactile Systems Technology Inc     NASDAQ TCMD     This is a medical technology company  which develops medical devices for the treatment of chronic diseases at home  It has a Zacks Rank  2 and belongs to a top ranked Zacks industry  top 41   
Martin Marietta Materials Inc     NYSE MLM     The Zacks Rank  2 company is engaged principally in the building materials business  including aggregates  cement  ready mixed concrete  and asphalt and paving product lines  It hails from a top ranked Zacks industry  top 36   
Fortinet Inc     NASDAQ FTNT     This Zacks Rank  2 company is a provider of network security appliances and Unified Threat Management network security solutions to enterprises  service providers and government entities worldwide  The company belongs to a top ranked Zacks industry  top 17   
Intuit Inc    NASDAQ INTU    The Zacks Rank  2 company provides financial management  and compliance products and services for small businesses  consumers  self employed and accounting professionals  It hails from a top ranked Zacks Industry  top 26   
You can get the rest of the stocks on this list by signing up now for your 2 week free trial to the Research Wizard and start using this screen in your own trading  Further  you can also create your own strategies and test them first before taking the investment plunge 
The Research Wizard is a great place to begin  It s easy to use  Everything is in plain language  And it s very intuitive  Start your Research Wizard trial today  And the next time you read an economic report  open up the Research Wizard  plug your finds in  and see what gems come out 
 
Disclosure  Officers  directors and or employees of Zacks Investment Research may own or have sold short securities and or hold long and or short positions in options that are mentioned in this material  An affiliated investment advisory firm may own or have sold short securities and or hold long and or short positions in options that are mentioned in this material 
Disclosure  Performance information for Zacks  portfolios and strategies are available at   ",2019-05-17,Zacks Investment Research,https://www.investing.com/analysis/these-5-top-stocks-may-surprise-you-with-an-earnings-beat-200422439,200422439
117767,339282,IAC,Applied Materials   AMAT  Q2 Earnings And Revenues Beat,opinion,"Applied Materials Inc    NASDAQ AMAT   reported robust fiscal second quarter 2019 results  with both the top and bottom lines surpassing the Zacks Consensus Estimate The company s pro forma earnings per share  EPS  of 70 cents beat the consensus mark by 4 cents and came in within the guided range of 62 70 cents  However  the bottom line was down 42 6  year over year and 13 6  sequentially Revenues of  3 54 billion surpassed the Zacks Consensus Estimate of  3 48 billion and were within the guided range of  3 33  3 63 billion However  the top line decreased 5 7  sequentially and 22 7  year over year Following strong fiscal second quarter results  its share price increased 6 10   However  shares have lost 18 5  in the past year compared with its  s decline of 7 1  Management expects inventory levels to normalize in the near term  creating a favorable environment for capacity investments in 2020  In foundry logic  management expects spending to be up year over year However  management continues to expect overall wafer fab equipment spending in 2019 to be down mid to high teens Also  management expects 2019 display revenues to decline from a year ago as customers push out investments  However  the company is positive about the display market over the long term as it is becoming more technology intensive and increasingly dependent on materials innovation  Moreover  Mobile OLEDs and large screen televisions are opening new market opportunities for Applied Materials The company sees significant opportunities from emerging trends on the semiconductor and display fronts such as artificial intelligence  big data  cloud infrastructure  Internet of Things  IoT   virtual reality and smart vehicles We believe that Applied Materials is in a great position to grow sustainably and profitably  based on its strong pipeline of enabling technologies  supported by expanding opportunities on the semiconductor  service and display fronts Let s delve deeper into the numbers Revenues by SegmentThe Semiconductor Systems Group  SSG  contributed 62  to its total revenues  reflecting a decrease of 3 7  sequentially and 24 7  year over year Applied Global Services  AGS  was the second largest contributor with 28  revenue share  The segment s revenues increased 2 3  sequentially and 4 1  from the prior year quarter Revenues from the Display segment  accounting for 10  of the total revenues  were down 31 4  sequentially and 51 6  from the year ago level Revenues by GeographyChina contributed 28   Taiwan 22   Japan 15   United States 13   Korea 12   Europe 6  and Southeast Asia 3  to the total revenues United States and Taiwan increased both on a sequential and year over year basis  All other countries  except China and Japan  decreased on a sequential and year over year basis  China increased on a sequential basis and Japan was up 3 6  from the year ago quarter Operating ResultsPro forma gross margin was 43 5   down 240 basis points  bps  from the year ago quarter Applied Materials  operating expenses of  754 million decreased 1 3  from the year ago quarter Pro forma operating margin of 22 4  decreased 690 bps year over year Balance SheetAt the end of the fiscal second quarter  inventories were  3 68 billion versus  3 72 billion in the prior quarter  Accounts receivables decreased to  2 26 billion from  2 44 billion in the fiscal first quarter  Cash and cash equivalent balance was  3 11 billion compared with  3 19 billion in the fiscal first quarter The company returned  625 million and  189 million through stock repurchases and cash dividends  respectively GuidanceApplied Materials provided guidance for the third quarter of fiscal 2019  Revenues are expected to be  3 525 billion      150 million   The Zacks Consensus Estimate for the same is pegged at  3 57 billion Non GAAP EPS is expected in the range of 67 75 cents  The corresponding Zacks Consensus Estimate is pegged at 70 cents per share Applied Materials  Inc  Price  Consensus and EPS Surprise
    
Zacks Rank and Stocks to ConsiderCurrently  Applied Materials carries a Zacks Rank  3  Hold   Some better ranked stocks in the broader technology sector include Facebook  Inc    NASDAQ FB    IAC InterActiveCorp   NASDAQ IAC   and AXT  Inc    NASDAQ AXTI    each carrying a Zacks Rank  2  Buy   You can see  Long term earnings growth for Facebook  IAC InterActiveCorp and AXT is currently projected at 20 2   20 5  and 15   respectively Breakout Biotech Stocks with Triple Digit Profit PotentialThe biotech sector is projected to surge beyond  775 billion by 2024 as scientists develop treatments for thousands of diseases  They re also finding ways to edit the human genome to literally erase our vulnerability to these diseases Zacks has just released Century of Biology  7 Biotech Stocks to Buy Right Now to help investors profit from 7 stocks poised for outperformance  Our recent biotech recommendations have produced gains of  98    119  and  164  in as little as 1 month  The stocks in this report could perform even better ",2019-05-17,Zacks Investment Research,https://www.investing.com/analysis/applied-materials-amat-q2-earnings-and-revenues-beat-200422435,200422435
