,id,ticker,title,category,content,date,provider,url,article_id
141660,363175,PFG,Wells Fargo  WFC  To Divest Majority Interest In Eastdil,opinion,Earlier this week  Wells Fargo   Company  NYSE WFC    NYSE C   announced plans to divest its private real estate investment banking division  Eastdil Secured  Though terms of the deal were not disclosed  the company will retain a minority ownership interest in Eastdil  The transaction is expected to close in fourth quarter 2019 Eastdil s management is reclaiming ownership in the firm  in partnership with Guggenheim Investments clients and Singaporean sovereign wealth fund Temasek Holdings Post sale  Wells Fargo will retain the public market real estate investment bankers of Eastdil  which will form the Real Estate  Gaming  Lodoging  and Leisure   REGAL   industry coverage group within Corporate   Investment Banking Through REGAL  Wells Fargo will provide a full range of investment banking and capital markets services  including advisory solutions on mergers and acquisition  debt and equity origination and structuring  Also  Wells Fargo disclosed that REGAL will continue its long standing partnership with Wells Fargo s Commercial Real Estate group  This newly dedicated Real Estate  Gaming  Lodging  and Leisure investment banking coverage group will leverage partnerships across the bank  with a deep pool of talent and expertise  to serve clients in these key industries and their complex financial needs   said Rob Engel  co head of Wells Fargo Corporate   Investment Banking In April 2019  Wells Fargo had announced that it will divest the Institutional Retirement   Trust business to Principal Financial Group  NASDAQ PFG  based in Des Moines  IA  for  1 2 billion  Wells Fargo s efforts to offload unprofitable businesses bode well  Also  ongoing investment in the businesses to enhance compliance and risk management capability encourages us  However  post breakout of the sales scandal  Wells Fargo continues to suffer from several sanctions  including a cap imposed by the Federal Reserve on asset growth in early 2018 In six months  time  shares of Wells Fargo have lost 2 9  against 9  growth recorded by the  Currently  the stock carries a Zacks Rank  3  Hold   You can see  Stocks to ConsiderCitigroup   NYSE C   has witnessed 2 4  upward estimate revision over the past 60 days  Also  the company s shares have risen nearly 24  in the past six months  It has a Zacks Rank  2  Buy  at present BankUnited s   NYSE BKU   earnings estimates for the current year have been revised 2 5  upward over the past 60 days  Also  the company s shares have risen 10 8  in the past six months  It carries a Zacks Rank  2 The Zacks Consensus Estimate for JPMorgan Chase   Co  s   NYSE JPM   earnings for the current year has been revised 1 8  upward over the past 60 days  Also  the company s shares have risen nearly 11  in the past six months  It currently carries a Zacks Rank of 2 Will you retire a millionaire One out of every six people retires a multimillionaire  Get smart tips you can do today to become one of them in a new Special Report   7 Things You Can Do Now to Retire a Multimillionaire  ,2019-06-14,Zacks Investment Research,https://www.investing.com/analysis/wells-fargo-wfc-to-divest-majority-interest-in-eastdil-200431734,200431734
141661,363176,PFG,Are You Looking For A High Growth Dividend Stock  Principal Financial  PFG  Could Be A Great Choice,opinion,"Whether it s through stocks  bonds  ETFs  or other types of securities  all investors love seeing their portfolios score big returns  But when you re an income investor  your primary focus is generating consistent cash flow from each of your liquid investments 
While cash flow can come from bond interest or interest from other types of investments  income investors hone in on dividends  A dividend is that coveted distribution of a company s earnings paid out to shareholders  and investors often view it by its dividend yield  a metric that measures the dividend as a percent of the current stock price  Many academic studies show that dividends make up large portions of long term returns  and in many cases  dividend contributions surpass one third of total returns 
Principal Financial in Focus
Based in Des Moines  Principal Financial  PFG  is in the Finance sector  and so far this year  shares have seen a price change of 27 17   The financial services company is currently shelling out a dividend of  0 54 per share  with a dividend yield of 3 85   This compares to the Financial   Investment Management industry s yield of 3 12  and the S P 500 s yield of 1 94  
In terms of dividend growth  the company s current annualized dividend of  2 16 is up 2 9  from last year  Over the last 5 years  Principal Financial has increased its dividend 5 times on a year over year basis for an average annual increase of 12   Future dividend growth will depend on earnings growth as well as payout ratio  which is the proportion of a company s annual earnings per share that it pays out as a dividend  Principal Financial s current payout ratio is 39   meaning it paid out 39  of its trailing 12 month EPS as dividend 
PFG is expecting earnings to expand this fiscal year as well  The Zacks Consensus Estimate for 2019 is  5 69 per share  representing a year over year earnings growth rate of 2 89  
Bottom Line
From greatly improving stock investing profits and reducing overall portfolio risk to providing tax advantages  investors like dividends for a variety of different reasons  However  not all companies offer a quarterly payout 
High growth firms or tech start ups  for example  rarely provide their shareholders a dividend  while larger  more established companies that have more secure profits are often seen as the best dividend options  Income investors must be conscious of the fact that high yielding stocks tend to struggle during periods of rising interest rates  With that in mind  PFG presents a compelling investment opportunity  it s not only an attractive dividend play  but the stock also boasts a strong Zacks Rank of  2  Buy  ",2019-06-19,Zacks Investment Research,https://www.investing.com/analysis/are-you-looking-for-a-highgrowth-dividend-stock-principal-financial-pfg-could-be-a-great-choice-200433371,200433371
141662,363177,PFG,Principal Financial  PFG  Earnings Expected To Grow  Should You Buy ,opinion,"Principal Financial  PFG  is expected to deliver a year over year increase in earnings on higher revenues when it reports results for the quarter ended June 2019  This widely known consensus outlook gives a good sense of the company s earnings picture  but how the actual results compare to these estimates is a powerful factor that could impact its near term stock price 
The stock might move higher if these key numbers top expectations in the upcoming earnings report  which is expected to be released on July 25  On the other hand  if they miss  the stock may move lower 
While management s discussion of business conditions on the earnings call will mostly determine the sustainability of the immediate price change and future earnings expectations  it s worth having a handicapping insight into the odds of a positive EPS surprise 
Zacks Consensus Estimate
This financial services company is expected to post quarterly earnings of  1 40 per share in its upcoming report  which represents a year over year change of  3 7  
Revenues are expected to be  3 82 billion  up 20 4  from the year ago quarter 
Estimate Revisions Trend
The consensus EPS estimate for the quarter has been revised 0 23  higher over the last 30 days to the current level  This is essentially a reflection of how the covering analysts have collectively reassessed their initial estimates over this period 
Investors should keep in mind that an aggregate change may not always reflect the direction of estimate revisions by each of the covering analysts 
Price  Consensus and EPS Surprise

Earnings Whisper
Estimate revisions ahead of a company s earnings release offer clues to the business conditions for the period whose results are coming out  Our proprietary surprise prediction model    the Zacks Earnings ESP  Expected Surprise Prediction     has this insight at its core 
The Zacks Earnings ESP compares the Most Accurate Estimate to the Zacks Consensus Estimate for the quarter  the Most Accurate Estimate is a more recent version of the Zacks Consensus EPS estimate  The idea here is that analysts revising their estimates right before an earnings release have the latest information  which could potentially be more accurate than what they and others contributing to the consensus had predicted earlier 
Thus  a positive or negative Earnings ESP reading theoretically indicates the likely deviation of the actual earnings from the consensus estimate  However  the model s predictive power is significant for positive ESP readings only 
A positive Earnings ESP is a strong predictor of an earnings beat  particularly when combined with a Zacks Rank  1  Strong Buy   2  Buy  or 3  Hold   Our research shows that stocks with this combination produce a positive surprise nearly 70  of the time  and a solid Zacks Rank actually increases the predictive power of Earnings ESP 
Please note that a negative Earnings ESP reading is not indicative of an earnings miss  Our research shows that it is difficult to predict an earnings beat with any degree of confidence for stocks with negative Earnings ESP readings and or Zacks Rank of 4  Sell  or 5  Strong Sell  
How Have the Numbers Shaped Up for Principal Financial 
For Principal Financial  the Most Accurate Estimate is higher than the Zacks Consensus Estimate  suggesting that analysts have recently become bullish on the company s earnings prospects  This has resulted in an Earnings ESP of  1 08  
On the other hand  the stock currently carries a Zacks Rank of  2 
So  this combination indicates that Principal Financial will most likely beat the consensus EPS estimate 
Does Earnings Surprise History Hold Any Clue 
While calculating estimates for a company s future earnings  analysts often consider to what extent it has been able to match past consensus estimates  So  it s worth taking a look at the surprise history for gauging its influence on the upcoming number 
For the last reported quarter  it was expected that Principal Financial would post earnings of  1 32 per share when it actually produced earnings of  1 43  delivering a surprise of  8 33  
Over the last four quarters  the company has beaten consensus EPS estimates just once 
Bottom Line
An earnings beat or miss may not be the sole basis for a stock moving higher or lower  Many stocks end up losing ground despite an earnings beat due to other factors that disappoint investors  Similarly  unforeseen catalysts help a number of stocks gain despite an earnings miss 
That said  betting on stocks that are expected to beat earnings expectations does increase the odds of success  This is why it s worth checking a company s Earnings ESP and Zacks Rank ahead of its quarterly release  Make sure to utilize our Earnings ESP Filter to uncover the best stocks to buy or sell before they ve reported 
Principal Financial appears a compelling earnings beat candidate  However  investors should pay attention to other factors too for betting on this stock or staying away from it ahead of its earnings release ",2019-07-17,Zacks Investment Research,https://www.investing.com/analysis/principal-financial-pfg-earnings-expected-to-grow-should-you-buy-200441388,200441388
141690,363205,PFG,Earnings Preview  Principal Financial  PFG  Q1 Earnings Expected To Decline,opinion,"Principal Financial  PFG  is expected to deliver a year over year decline in earnings on higher revenues when it reports results for the quarter ended March 2019  This widely known consensus outlook gives a good sense of the company s earnings picture  but how the actual results compare to these estimates is a powerful factor that could impact its near term stock price 
The stock might move higher if these key numbers top expectations in the upcoming earnings report  which is expected to be released on April 25  On the other hand  if they miss  the stock may move lower 
While the sustainability of the immediate price change and future earnings expectations will mostly depend on management s discussion of business conditions on the earnings call  it s worth handicapping the probability of a positive EPS surprise 
Zacks Consensus Estimate
This financial services company is expected to post quarterly earnings of  1 32 per share in its upcoming report  which represents a year over year change of  5 7  
Revenues are expected to be  3 66 billion  up 25 9  from the year ago quarter 
Estimate Revisions Trend
The consensus EPS estimate for the quarter has been revised 1 98  higher over the last 30 days to the current level  This is essentially a reflection of how the covering analysts have collectively reassessed their initial estimates over this period 
Investors should keep in mind that the direction of estimate revisions by each of the covering analysts may not always get reflected in the aggregate change 
Price  Consensus and EPS Surprise

Earnings Whisper
Estimate revisions ahead of a company s earnings release offer clues to the business conditions for the period whose results are coming out  Our proprietary surprise prediction model    the Zacks Earnings ESP  Expected Surprise Prediction     has this insight at its core 
The Zacks Earnings ESP compares the Most Accurate Estimate to the Zacks Consensus Estimate for the quarter  the Most Accurate Estimate is a more recent version of the Zacks Consensus EPS estimate  The idea here is that analysts revising their estimates right before an earnings release have the latest information  which could potentially be more accurate than what they and others contributing to the consensus had predicted earlier 
Thus  a positive or negative Earnings ESP reading theoretically indicates the likely deviation of the actual earnings from the consensus estimate  However  the model s predictive power is significant for positive ESP readings only 
A positive Earnings ESP is a strong predictor of an earnings beat  particularly when combined with a Zacks Rank  1  Strong Buy   2  Buy  or 3  Hold   Our research shows that stocks with this combination produce a positive surprise nearly 70  of the time  and a solid Zacks Rank actually increases the predictive power of Earnings ESP 
Please note that a negative Earnings ESP reading is not indicative of an earnings miss  Our research shows that it is difficult to predict an earnings beat with any degree of confidence for stocks with negative Earnings ESP readings and or Zacks Rank of 4  Sell  or 5  Strong Sell  
How Have the Numbers Shaped Up for Principal Financial 
For Principal Financial  the Most Accurate Estimate is the same as the Zacks Consensus Estimate  suggesting that there are no recent analyst views which differ from what have been considered to derive the consensus estimate  This has resulted in an Earnings ESP of 0  
On the other hand  the stock currently carries a Zacks Rank of  2 
So  this combination makes it difficult to conclusively predict that Principal Financial will beat the consensus EPS estimate 
Does Earnings Surprise History Hold Any Clue 
While calculating estimates for a company s future earnings  analysts often consider to what extent it has been able to match past consensus estimates  So  it s worth taking a look at the surprise history for gauging its influence on the upcoming number 
For the last reported quarter  it was expected that Principal Financial would post earnings of  1 33 per share when it actually produced earnings of  1 11  delivering a surprise of  16 54  
Over the last four quarters  the company has beaten consensus EPS estimates just once 
Bottom Line
An earnings beat or miss may not be the sole basis for a stock moving higher or lower  Many stocks end up losing ground despite an earnings beat due to other factors that disappoint investors  Similarly  unforeseen catalysts help a number of stocks gain despite an earnings miss 
That said  betting on stocks that are expected to beat earnings expectations does increase the odds of success  This is why it s worth checking a company s Earnings ESP and Zacks Rank ahead of its quarterly release  Make sure to utilize our Earnings ESP Filter to uncover the best stocks to buy or sell before they ve reported 
Principal Financial doesn t appear a compelling earnings beat candidate  However  investors should pay attention to other factors too for betting on this stock or staying away from it ahead of its earnings release ",2019-04-17,Zacks Investment Research,https://www.investing.com/analysis/earnings-preview-principal-financial-pfg-q1-earnings-expected-to-decline-200408305,200408305
141691,363206,PFG,Zacks com Featured Expert Kevin Matras Highlights  Quanta Services  Chaparral Energy  DXC Technology  TOTAL And Principal Financial,opinion,"For Immediate Release
 Chicago  IL   April 23  2019   Stocks in this week s article include Quanta Services  Inc    NYSE PWR    Chaparral Energy  Inc    NYSE CHAP    DXC Technology Company   NYSE DXC    TOTAL S A    NYSE TOT   and Principal Financial Group  Inc    NASDAQ PFG    Kevin Matras screens for companies showing their  first  profit and explains why they are ones to watch Screen of the Week written by Kevin Matras of Zacks Investment Research 5 Value Stocks with Amazingly Low EV EBITDA Ratios to Own Now
The price to earnings  P E  ratio is the most commonly used tool for evaluating a firm s value due to its simplicity  A widely favored approach by value investors is to chase for stocks that have a low P E ratio  However  even this broadly used valuation multiple is not without its shortcomings 
Why EV EBITDA is a Better Choice 
Although P E enjoys great popularity among value investors  a more complicated metric called EV EBITDA is sometimes viewed as a better alternative  EV EBITDA gives the true picture of a company s valuation and earning potential  Additionally  it has a more comprehensive approach to valuation  
EV EBITDA is essentially the enterprise value  EV  of a stock divided by its earnings before interest  taxes  depreciation and amortization  EBITDA   The first constituent of the ratio  EV  is a firm s market capitalization plus the market value of its debt and preferred equity minus cash 
EBITDA  the other element of the ratio  is a true reflection of a company s profitability as it removes the impact of non cash expenses like depreciation and amortization that depress net earnings  It is also often used as a proxy for cash flows 
Just like P E  the lower the EV EBITDA ratio  the more appealing it is  A low EV EBITDA ratio could imply that a stock is potentially undervalued and vice versa 
EV EBITDA takes into account the debt on a company s balance sheet that P E ratio does not  Given this reason  EV EBITDA is usually used to value possible acquisition targets  Stocks with a low EV EBITDA multiple could be seen as potential takeover candidates 
Moreover  P E can t be used to value a loss making firm  A company s earnings are also subject to accounting estimates and management manipulation  In contrast  EV EBITDA is difficult to manipulate and can also be used to value companies that are making loss but are EBITDA positive 
EV EBITDA is also a useful tool in measuring the value of firms with a debt laden balance sheet and have a high degree of depreciation  It also allows the comparison of companies with different debt levels 
But EV EBITDA is not without its limitations  The ratio varies across industries  a high growth industry typically has higher multiple and vice versa  and is usually not appropriate while comparing stocks in different industries given their diverse capital requirements 
Thus  instead of solely relying on EV EBITDA  you can combine it with the other major ratios such as price to book  P B   P E and price to sales  P S  to achieve the desired results For the rest of this Screen of the Week article please visit Zacks com at  Disclosure  Officers  directors and or employees of Zacks Investment Research may own or have sold short securities and or hold long and or short positions in options that are mentioned in this material  An affiliated investment advisory firm may own or have sold short securities and or hold long and or short positions in options that are mentioned in this material About Screen of the Week Zacks com created the first and best screening system on the web earning the distinction as the   1 site for screening stocks  by Money Magazine  But powerful screening tools is just the start  That is why Zacks created the Screen of the Week to highlight profitable stock picking strategies that investors can actively use  Strong Stocks that Should Be in the NewsMany are little publicized and fly under the Wall Street radar  They re virtually unknown to the general public  Yet today s 220 Zacks Rank  1  Strong Buys  were generated by the stock picking system that has more than doubled the market from 1988 through 2016  Its average gain has been a stellar  25  per year    Follow us on Twitter   Join us on Facebook  NASDAQ FB    Zacks Investment Research is under common control with affiliated entities  including a broker dealer and an investment adviser   which may engage in transactions involving the foregoing securities for the clients of such affiliates  Contact  Jim GiaquintoCompany  Zacks comPhone  312 265 9268Email  Visit   Zacks com provides investment resources and informs you of these resources  which you may choose to use in making your own investment decisions  Zacks is providing information on this resource to you subject to the Zacks  Terms and Conditions of Service  disclaimer    Past performance is no guarantee of future results  Inherent in any investment is the potential for loss  This material is being provided for informational purposes only and nothing herein constitutes investment  legal  accounting or tax advice  or a recommendation to buy  sell or hold a security  No recommendation or advice is being given as to whether any investment is suitable for a particular investor  It should not be assumed that any investments in securities  companies  sectors or markets identified and described were or will be profitable  All information is current as of the date of herein and is subject to change without notice  Any views or opinions expressed may not reflect those of the firm as a whole  Zacks Investment Research does not engage in investment banking  market making or asset management activities of any securities  These returns are from hypothetical portfolios consisting of stocks with Zacks Rank   1 that were rebalanced monthly with zero transaction costs  These are not the returns of actual portfolios of stocks  The S P 500 is an unmanaged index  Visit  for information about the performance numbers displayed in this press release ",2019-04-22,Zacks Investment Research,https://www.investing.com/analysis/zackscom-featured-expert-kevin-matras-highlights-quanta-services-chaparral-energy-dxc-technology-total-and-principal-financial-200409411,200409411
141692,363207,PFG,Moving Average Crossover Alert  Principal Financial Group,opinion,Principal Financial Group  Inc    NASDAQ PFG   is looking like an interesting pick from a technical perspective  as the company is seeing favorable trends on the moving average crossover front  Recently  the 50 Day Moving Average for PFG broke out above the 200 Day Simple Moving Average  suggesting a short term bullish trend This has already started to take place  as the stock has moved higher by 2  in the past four weeks  Plus  the company currently has a Zacks Rank  2  Buy  suggesting that now could definitely be the time for this breakout candidate More bullishness may especially be the case when investors consider what has been happening for PFG on the earnings estimate revision front lately  No estimate has gone lower in the past two months  compared to 3 higher  while the consensus estimate has also moved higher too So  given this move in estimates  and the positive technical factors  investors may want to watch this breakout candidate closely for more gains in the near future  You can see  Will you retire a millionaire One out of every six people retires a multimillionaire  Get smart tips you can do today to become one of them in a new Special Report   7 Things You Can Do Now to Retire a Multimillionaire  ,2019-04-24,Zacks Investment Research,https://www.investing.com/analysis/moving-average-crossover-alert-principal-financial-group-200410019,200410019
