,id,ticker,title,category,content,date,provider,url,article_id
24542,246057,LAMR,Moving Average Crossover Alert  Lamar Advertising,opinion,"Lamar Advertising Company  REIT    NASDAQ LAMR   is looking like an interesting pick from a technical perspective  as the company is seeing favorable trends on the moving average crossover front  Recently  the 50 Day Moving Average for LAMR broke out above the 200 Day Simple Moving Average  suggesting a short term bullish trend 
This has already started to take place  as the stock has moved higher by 5 5  in the past four weeks  Plus  the company currently has a Zacks Rank  1  Strong Buy  suggesting that now could definitely be the time for this breakout candidate 
More bullishness may especially be the case when investors consider what has been happening for LAMR on the earnings estimate revision front lately  No estimates have gone lower in the past two months  compared to 1 higher  while the consensus estimate has also moved higher too 
So given this move in estimates  and the positive technical factors  investors may want to watch this breakout candidate closely for more gains in the near future  You can see  
Today s Best Stocks from Zacks 
Would you like to see the updated picks from our best market beating strategies  From 2017 through 2018  while the S P 500 gained  15 8   five of our screens returned  38 0    61 3    61 6    68 1   and  98 3  
This outperformance has not just been a recent phenomenon  From 2000   2018  while the S P averaged  4 8  per year  our top strategies averaged up to  56 2  per year ",2019-03-07,Zacks Investment Research,https://www.investing.com/analysis/moving-average-crossover-alert-lamar-advertising-200395760,200395760
24552,246067,LAMR,OUTFRONT Begins The Points Guy s 1st OOH Campaign In New York,opinion,OUTFRONT Media Inc    NYSE OUT   recently announced that lifestyle media brand   The Points Guy   has chosen the former for its first ever OOH campaign The companies have collaborated to launch a billboard campaign that will be running till Jan 6  2019  at three high traffic locations  including Port Authority  42nd Street and 8th Avenue   Times Square  NYSE SQ   Broadway and West 45th Street   and Penn Station  33rd Street and 7th Avenue  The campaign location is a strategic fit  given the high pedestrian motor vehicle traffic  Further  since these locations witness high tourists during the holiday season  the campaign content can be shared with audiences worldwide Hence  per management  the campaign will provide fantastic exposure for The Points Guy since the brand can take advantage of the social sharing potential of these sites OUTFRONT Media is known to successfully increase overall awareness among key targeted audiences through its vast network of strategically located media assets  This has made the company a crucial component of any campaign s marketing mix  Hence  the above mentioned campaign is not just a strategic fit for The Points Guy  but also enables OUTFRONT Media to utilize its OOH assets efficiently Notably  OOH advertising has been growing at a rapid pace and continues to increase its market share in comparison with other forms of media  Furthermore  visual diversity and affordability has contributed to the soaring popularity of this media  Additionally  fragmentation across other advertising media and technological advancements in the OOH segment are facilitating the shift to outdoor advertising  Banking on this trend  the company is expanding its footprint in strategic markets and providing a unique technology platform to marketers in order to tap growth opportunities Nevertheless  the pattern of advertising is seasonal in nature  leading to fluctuation in the company s bottom line performance  Also  it faces stiff competition from other outdoor advertisers  like Lamar Advertising Company   NASDAQ LAMR   and Clear Channel Outdoor Holdings  Inc    NYSE CCO    Shares of OUTFRONT Media have underperformed the  it belongs to  in the past three months  During this period  shares of this Zacks Rank  3  Hold  company have declined 5 9  compared to the 3 5  loss incurred by its industry A better ranked stock that investors can consider is PS Business Parks  Inc    NYSE PSB    The stock  currently carrying a Zacks Rank of 2  Buy   has gained 2 2  over the past three months  You can see More Stock News  This Is Bigger than the iPhone It could become the mother of all technological revolutions  Apple  NASDAQ AAPL  sold a mere 1 billion iPhones in 10 years but a new breakthrough is expected to generate more than 27 billion devices in just 3 years  creating a  1 7 trillion market Zacks has just released a Special Report that spotlights this fast emerging phenomenon and 6 tickers for taking advantage of it  If you don t buy now  you may kick yourself in 2020 ,2019-01-02,Zacks Investment Research,https://www.investing.com/analysis/outfront-begins-the-points-guys-1st-ooh-campaign-in-new-york-200372508,200372508
24555,246070,LAMR,Rayonier s  RYN  Q3 Net Income   Revenues Surpass Estimates,opinion,"Rayonier Inc    NYSE RYN   reported third quarter 2018 net income per share of 18 cents  comfortably beating the Zacks Consensus Estimate of six cents  However  the bottom line came in lower than the prior year figure of 19 cents Post the third quarter earnings release on Oct 31  shares of Rayonier closed 3 1  higher at  31 15 during regular trading session on Nov 1  reflecting investors  reaction toward better than expected results Total sales for the third quarter came in at  200 9 million  up 8 9  year over year  handily outpacing the Zacks Consensus Estimate of  190 million Segmental PerformanceDuring the reported quarter  operating income in the company s Southern  NYSE SO  Timber segment decreased to  9 2 million from  11 5 million recorded in the year ago quarter The Pacific Northwest Timber posted operating income of  1 9 million compared to  1 1 million of operating income reported in third quarter 2017 New Zealand Timber reported operating income of  16 4 million  down from the prior year tally of  19 3 million Real Estate s operating income was  24 7 million  higher than the year ago tally of  11 4 million Trading segment s operating income came in at  0 3 million  down from the year earlier figure of  1 1 million Lastly  the Corporate and Other segment posted loss of  6 2 million compared with a loss of  5 1 million incurred in the comparable period last year LiquidityRayonier ended the third quarter with  146 3 million in cash and cash equivalents  up from  112 7 million recorded as of Dec 31  2017  Total long term debt was  972 4 million  down from the figure of  1 02 billion as on Dec 31  2017 2018 OutlookThe company expects to achieve its previously announced guidance  before considering the impact of the New Zealand timberland sale during third quarter 2018 that represents an upside to the guidance Earlier  it had provided 2018 earnings per share of 63 68 cents  while net income for the year is projected at  82  89 million ConclusionRayonier s better than expected results are encouraging  While robust demand for rural higher and better uses  HBU  properties will likely drive its near term revenues  a disciplined acquisition strategy ensures inorganic growth in the long term Nevertheless  stiff competition from its substitutes and other market players in the timberland sector  along with strict regulatory requirements  might impact the company s business Rayonier Inc  Price  Consensus and EPS Surprise 
   Currently  Rayonier carries a Zacks Rank  3  Hold   You can see We  now  look forward to the earnings releases of Lamar Advertising Company   NASDAQ LAMR    Jones Lang LaSalle Incorporated   NYSE JLL   and Outfront Media Inc    NYSE OUT    all of which are scheduled to report their quarterly numbers next week Note  Anything related to earnings presented in this write up represent funds from operations  FFO    a widely used metric to gauge the performance of REITs Today s Stocks from Zacks  Hottest StrategiesIt s hard to believe  even for us at Zacks  But while the market gained  21 9  in 2017  our top stock picking screens have returned  115 0    109 3    104 9    98 6   and  67 1  And this outperformance has not just been a recent phenomenon  Over the years it has been remarkably consistent  From 2000   2017  the composite yearly average gain for these strategies has beaten the market more than 19X over  Maybe even more remarkable is the fact that we re willing to share their latest stocks with you without cost or obligation ",2018-11-01,Zacks Investment Research,https://www.investing.com/analysis/rayoniers-ryn-q3-net-income--revenues-surpass-estimates-200353935,200353935
24556,246071,LAMR,Host Hotels  HST  Beats On Q3 FFO   Revenues  Revises Outlook,opinion,Host Hotels   Resorts  Inc    NYSE HST   reported third quarter 2018 adjusted funds from operations  FFO  of 37 cents per share  which outpaced the Zacks Consensus Estimate of 35 cents  Adjusted FFO per share also increased 12 1  from the year ago tally of 33 cents The company generated total revenues of around  1 3 billion  which surpassed the Zacks Consensus Estimate of  1 28 billion  and increased 3 6  year over year Results reflect improvements in food and beverage sales  as well as operations of the three hotel Hyatt portfolio acquired in 2018  These were partly muted by the disposition of eight hotels in 2017 and 2018  The company also experienced broad productivity gains that aided profitability Behind the HeadlinesDuring the quarter under review  comparable hotel revenues increased 2 8  year over year to around  1 1 billion  Comparable hotel RevPAR  on a constant dollar basis  was up 1 6  year over year  aided by a 1 5  increase in average room rate and an expansion of 10 basis points  bps  in occupancy  For domestic properties  comparable hotel RevPAR was up 1 4   while the same for International properties climbed 10 8  For the Sep end quarter  comparable hotel EBITDA increased 4 6   Comparable hotel EBITDA margin advanced 50 bps Finally  the company exited third quarter 2018 with around  1 27 billion of unrestricted cash  not including  205 million in the FF E escrow reserve  and  702 million of available capacity under the revolver part of its credit facility  In addition  as of Sep 30  2018  total debt was  4 1 billion  having an average maturity of 4 3 years and an average interest rate of 4 1   Notably  the company has no debt maturities until 2020 Host Hotels did not buy back any shares in 2018  It has  500 million of capacity available under its current repurchase program  Additionally  earlier the company entered into a distribution agreement through which it may issue and sell shares of common stock  having a total offering price of up to  500 million from time to time  So far this year  no shares have been issued under this agreement Portfolio ActivityNotably  during the reported quarter  Host Hotels made efforts to enhance its portfolio quality through strategic dispositions  aiming at lowering the company s international and New York exposure  It sold the JW Marriott Hotel Mexico City and reached a deal to sell its interest in the European joint venture to its present partners  Further  in New York  the company accomplished the sale of the W New York   Union Square  NYSE SQ   as well as placed the Westin New York Grand Central hotel under contract for  300 million  including FF E funds  Also  the company sold the retail space at the New York Marriott Marquis to Vornado Realty Trust   NYSE VNO    for  442 million The asset sales that have already closed  as well as those that the company expects to complete  aggregate around  1 2 billion  With these proceeds  the company has flexibility to add properties to its portfolio  invest in existing assets or go for share repurchases Capital InvestmentsDuring the Jul Sep quarter  the company expended around  119 million on capital expenditures    48 million was return on investment  ROI  capital projects  and  71 million for renewal and replacement projects OutlookHost Hotels has revised its outlook for full year 2018  The company now expects 2018 adjusted FFO per share of  1 74  1 76  denoting a 1 5 cent increase at the mid point from the earlier guidance of  1 71  1 76  The Zacks Consensus Estimate for the same is currently pegged at  1 75 The company s full year projection includes comparable hotel RevPAR  constant U S  dollar basis  growth of 1 9 2 1   reflecting a contraction of 12 5 bps at the mid point  Additionally  the company projects capital expenditures of  475  520 million for the year  This comprises  195  220 million in ROI projects  and  280  300 million in renewal and replacement projects In ConclusionWe are encouraged with the better than anticipated performance of Host Hotels in the third quarter  Although the company has a solid portfolio of upscale hotels across potential markets and focuses on strategic capital recycling efforts  elevated supply in some of the company s key markets is expected to affect its pricing power  Moreover  dilutive impact on earnings from sale of assets and hike in interest rate adds to its woes Host Hotels currently has a Zacks Rank  4  Sell  You can see  Host Hotels   Resorts  Inc  Price  Consensus and EPS Surprise    We  now  look forward to the earnings releases of Lamar Advertising Company   NASDAQ LAMR    Host Omega Healthcare Investors  Inc    NYSE OHI   and Outfront Media Inc    NYSE OUT    all of which are scheduled to report their quarterly numbers next week Note  Anything related to earnings presented in this write up represent funds from operations  FFO    a widely used metric to gauge the performance of REITs Today s Stocks from Zacks  Hottest StrategiesIt s hard to believe  even for us at Zacks  But while the market gained  21 9  in 2017  our top stock picking screens have returned  115 0    109 3    104 9    98 6   and  67 1  And this outperformance has not just been a recent phenomenon  Over the years it has been remarkably consistent  From 2000   2017  the composite yearly average gain for these strategies has beaten the market more than 19X over  Maybe even more remarkable is the fact that we re willing to share their latest stocks with you without cost or obligation ,2018-11-01,Zacks Investment Research,https://www.investing.com/analysis/host-hotels-hst-beats-on-q3-ffo--revenues-revises-outlook-200354086,200354086
24557,246072,LAMR,Aimco s  AIV  Q3 FFO Surpasses Estimates  Revenues Down,opinion,Apartment Investment and Management Company   NYSE AIV    better known as Aimco  reported third quarter 2018 pro forma funds from operations  FFO  of 63 cents per share  surpassing the Zacks Consensus Estimate of 61 cents  Also  the figure remained unchanged as compared with the year ago tally The company witnessed decent growth in same store property net operating income  NOI   Further  it exited the quarter with higher same store average daily occupancy  However  these positives were offset by lower rental and other property revenues of partnerships served by its Asset Management business  Notably  total revenues of  242 5 million also outpaced the Zacks Consensus Estimate of  241 2 million  However  the reported figure came in lower than the prior year quarter s tally of  254 6 million Quarter in DetailSame store revenues  before utility reimbursements  increased 3 1  year over year to  148 9 million  while expenses  net of utility reimbursements  flared up 4 5  from the prior year quarter to  39 million  Consequently  same store NOI climbed 2 6  to  109 9 million on a year over year basis Same store average daily occupancy expanded 30 basis point  bps  year over year to 96 3   Rental rates on new leases were up 2 2   whereas rental rates on renewal leases were up 4 2  from the expiring lease rates As of Sep 30  2018  Aimco had cash and restricted cash on hand of  5 7 billion  Moreover  the estimated fair market value of the company s unencumbered apartment communities was around  2 3 billion Furthermore  at the end of the quarter under review  Aimco had borrowing capacity of  593 million under its revolving credit facility  after consideration of  7 million of letters of credit backed by the facility Portfolio ActivityDuring the reported quarter  Aimco invested  37 million in redevelopment and development activities  In addition  the company is revamping its portfolio through property sales  and reinvesting the proceeds in select apartment homes with higher rents  superior margins and higher than expected growth Through these efforts  the company increased its average revenues per apartment home by 6  to  2 131  Additionally  NOI margin remained unchanged year over year at 72   The company s percentage of A  B and C  home was 51   33  and 16   respectively  in third quarter 2018 GuidanceFor full year 2018  the company updated its pro forma FFO per share guidance to  2 45  2 49 from  2 41  2 49 provided earlier  The Zacks Consensus Estimate for the same is  2 44 The company s full year projections are backed by assumptions of same store revenue growth of 3  and NOI improvement of 2 90 3 10  For third quarter 2018  Aimco provided pro forma FFO per share guidance of 61 65 cents  The Zacks Consensus Estimate for the same is pinned at 61 cents DividendOn Oct 31  Aimco announced a quarterly cash dividend of 38 cents per share of Class A Common Stock for the Sep end quarter  The dividend will be paid on Nov 30  to stockholders of record as of Nov 16  2018 Bottom LineWhile Aimco continues to revamp its portfolio through recycling capital from non core properties to select apartment homes that offer higher internal rates of return as compared to the sold assets  the dilutive impact on earnings from such asset dispositions cannot be bypassed in the near term Furthermore  new supply in various markets is anticipated to dampen the company s rent growth and new lease pricing ability  moving ahead  Hike in interest rate adds to its woes Apartment Investment and Management Company Price  Consensus and EPS Surprise    Aimco currently carries a Zacks Rank  4  Sell  You can see  We  now  look forward to the earnings releases of Lamar Advertising Company   NASDAQ LAMR    Jones Lang LaSalle Incorporated   NYSE JLL   and Outfront Media Inc    NYSE OUT    all of which are scheduled to report their quarterly numbers next week Note  Anything related to earnings presented in this write up represent funds from operations  FFO    a widely used metric to gauge the performance of REITs Today s Stocks from Zacks  Hottest StrategiesIt s hard to believe  even for us at Zacks  But while the market gained  21 9  in 2017  our top stock picking screens have returned  115 0    109 3    104 9    98 6   and  67 1  And this outperformance has not just been a recent phenomenon  Over the years it has been remarkably consistent  From 2000   2017  the composite yearly average gain for these strategies has beaten the market more than 19X over  Maybe even more remarkable is the fact that we re willing to share their latest stocks with you without cost or obligation ,2018-11-01,Zacks Investment Research,https://www.investing.com/analysis/aimcos-aiv-q3-ffo-surpasses-estimates-revenues-down-200354084,200354084
24558,246073,LAMR,Equinix  EQIX  Beats On Q3 AFFO   Revenues  Updates  18 View,opinion,Equinix Inc    NASDAQ EQIX   posted better than expected results for third quarter 2018  wherein the top and bottom lines surpassed the Zacks Consensus Estimate  and improved from the year ago quarter as well The company s adjusted funds from operations  AFFO  advanced from  4 97 per share reported in the year earlier quarter to  5 01 per share  The Zacks Consensus Estimate was pegged at  4 95  The uptick primarily stemmed from robust top line growth and strong operating performance  partially offset by an elevated cost of revenues Quarter in DetailTotal revenues came in at  1 28 billion  up 11 3  from the prior year quarter  and beating the Zacks Consensus Estimate of  1 27 billion  Encouragingly  this also marks the 63rd quarter of consecutive revenue growth Recurring revenues came in at around  1 21 billion  up approximately 10 8  from the year ago tally  Non recurring revenues climbed 19 6  to  75 9 million Revenues from the three geographic regions increased on a year over year basis as well  Revenues from the Americas  EMEA and the Asia Pacific were up 4 9   17  and 20 4  to  625 7 million   396 7 million and  261 3 million  respectively Gross margin was 48 6   marginally down from 49 4  reported in the comparable period last year  primarily due to elevated cost of revenues as a percentage of sales  Total operating expenses flared up around 3 7  to  357 7 million year over year  Nonetheless  operating expenses shrunk 340 basis points  bps  as a percentage of revenues to 27 9  Adjusted earnings before interest  taxes  depreciation and amortization  EBITDA  came in at  613 million  up 11 4   Adjusted EBITDA margins came in at 48  flat year over year  AFFO depreciated 6  sequentially to  402 million during the Sep end quarter Balance Sheet   Cash FlowEquinix exited the third quarter with cash and cash equivalents of nearly  870 5 million  The company s total debt principal outstanding was  11 4 billion as of Sep 30  2018  It generated cash of nearly  417 2 million from operating activities in the quarter under review Dividend UpdateConcurrent with its third quarter earnings release  on Nov 1  Equinix s board of directors approved a quarterly cash dividend of  2 28 per share  The dividend will be paid on Dec 12  to shareholders of record on Nov 14  2018 GuidanceEquinix provided an outlook for the fourth quarter and revised a few full year 2018 projections For 2018  the company now anticipates revenues of  5 060  5 070 billion  prior guidance was  5 037  5 077 billion   reflecting an increase of 16  year over year  The Zacks Consensus Estimate is pegged at  5 06 billion The company now predicts adjusted EBITDA of  2 4  2 41 billion  prior guidance was  2 379  2 419 billion  Equinix anticipates full year 2018 AFFO to be in the  1 619  1 639 billion band  Earlier  the AFFO figure was estimated between  1 596 and  1 636 billion Coming to the current quarter  Equinix projects revenues in the range of  1 299  1 309 billion  The Zacks Consensus Estimate is pinned at  1 28 billion  Adjusted EBITDA is likely to lie between  604 million and  614 million Our TakeDuring the third quarter  Equnix completed nine expansion projects across eight markets  Further  it recorded high bookings in the content and digital media vertical  Also  the enterprise vertical continues to be the fastest growing one  along with the manufacturing  healthcare and travel sub segments in the quarter under review Nevertheless  rising debt burden and intensifying competition from established Internet data center operators remain growth hurdles for Equinix Equinix  Inc  Price  Consensus and EPS Surprise    Equinix carries a Zacks Rank  4  Sell  You can see  We  now  look forward to the earnings releases of Lamar Advertising Company   NASDAQ LAMR    Jones Lang LaSalle Incorporated   NYSE JLL   and Outfront Media Inc    NYSE OUT    all of which are scheduled to report their quarterly numbers next week Note  Anything related to earnings presented in this write up represent funds from operations  FFO    a widely used metric to gauge the performance of REITs Today s Stocks from Zacks  Hottest StrategiesIt s hard to believe  even for us at Zacks  But while the market gained  21 9  in 2017  our top stock picking screens have returned  115 0    109 3    104 9    98 6   and  67 1  And this outperformance has not just been a recent phenomenon  Over the years it has been remarkably consistent  From 2000   2017  the composite yearly average gain for these strategies has beaten the market more than 19X over  Maybe even more remarkable is the fact that we re willing to share their latest stocks with you without cost or obligation ,2018-11-01,Zacks Investment Research,https://www.investing.com/analysis/equinix-eqix-beats-on-q3-affo--revenues-updates-18-view-200354076,200354076
