,id,ticker,title,category,content,date,provider,url,article_id
188441,409957,PPL,Stock Market News  4 3 2017,opinion,"Markets  The market hit record highs again this week  with the S P 500 gaining for the 6th straight week  Fed Chief Yellen s speech on Friday indicated a strong likelihood of a rate hike when the Fed meets in mid March 
Dividend Stocks Update  These high dividend stocks go ex dividend this coming week  Bandera Gold Ltd  V BGL   General Motors Company  NYSE GM   Occidental Petroleum Corporation  NYSE OXY   PPL Corporation  NYSE PPL   TELUS Corporation  NYSE TU   Gaming   Leisure Properties  NASDAQ GLPI  
Volatility  The VIX fell 4 4  this week  finishing at  10 96  
Currency  The USD rose vs  most major currencies  except the euro  on the back of increase in the probability of a Fed rate hike this month 

Market Breadth  18 of the DOW 30 stocks rose this week  vs  21 last week  57  of the S P 500 rose  vs  67  last week  
US Economic News  Core PCE   Personal Consumption Expenditures   one of the Fed s favorite inflation gauges  rose 0 3  to a 1 9  y o y change  the highest since 2012 
Q4 GDP grew 1 9  
4 week average Job Claims fell to 234 25k 
Consumer confidence hit a new high  rising from 111 8 to 114 8 
Pending home sales fell 2 8   and December was revised down from 1 6  to 0 8  
Week Ahead Highlights  The Non Farm Payrolls report and Unemployment Rate come out on Friday  along with avg  hourly earnings and workweek  The ADP report on Wednesday may give us an additional clue as to which way jobs are headed 

Sectors   Futures  Financials led this week  with Telecoms and Real Estate trailing 

Crude Oil futures fell this week  while Natural Gas gained  The US rig count continued to increase   it s now up to 609   ",2017-03-05,Double Dividend Stocks,https://www.investing.com/analysis/stock-market-news:-3-4-17-200177775,200177775
188442,409958,PPL,PPL Corp  PPL  Up 4 4  Since Earnings Report  Can It Continue ,opinion,"A month has gone by since the last earnings report for PPL Corporation   NYSE PPL    Shares have added about 4 4  in that time frame  underperforming the market 
Will the recent positive trend continue leading up to the stock s next earnings release  or is it due for a pullback  Before we dive into how investors and analysts have reacted as of late  let s take a quick look at its most recent earnings report in order to get a better handle on the important drivers 
PPL Corp  Beats on Q4 Earnings  Reaffirms  17 ViewPPL Corp  reported fourth quarter 2016 adjusted earnings of  0 60 per share  topping the Zacks Consensus Estimate of  0 52 by 15 4   Reported earnings also surged 39 5  on a year over year basis On a GAAP basis  the company posted earnings per share of  0 68 in the quarter  compared with  0 59 a year ago  The difference between GAAP and operating earnings in the reported quarter was due to  0 08 of foreign currency related economic hedges Full year adjusted earnings came in at  2 45  up 10 8  from  2 21 in 2015 and beat the Zacks Consensus Estimate of  2 37 by 3 4  Full year GAAP earnings amounted to  2 79  up 176  year over year Total RevenuePPL Corp  s total revenue of  1 832 million in the fourth quarter missed the Zacks Consensus Estimate of  2 209 million but were up 2 9  from the year ago tally of  1 780 million Full year revenues amounted to  7 517 million  down 2  from  7 669 million in 2015  The Zacks Consensus Estimate was  7 800 million Segment ResultsUK Regulated  Adjusted earnings of  0 40 per share surged 38  from the prior year figure of  0 29  This was primarily backed by the Apr 1  2016 price increase  and lower operation and maintenance expenses  partially offset by the adverse impact of lower British pound sterling exchange rates Kentucky Regulated  Adjusted earnings increased by 3 cents to 12 cents per share  This was primarily due to higher sales volumes  which in turn resulted from favorable weather and lower operation and maintenance expense Pennsylvania Regulated  Adjusted earnings in the reported quarter increased by 2 cents per share to 11 cents driven primarily by higher base electricity rates for distribution effective Jan 1  2016  and higher transmission margins Corporate and Other  It includes unallocated corporate level financing and other costs  Adjusted loss narrowed from 4 cents to 3 cents per share Operational HighlightsPPL Corp  s total operating expenses decreased 3 9  year over year to  1 118 million in the reported quarter  primarily due to a decline in other operation and maintenance expenses The company registered operating income of  714 million  up 15 7  from  617 million a year ago Interest expenses were down to  217 million from  226 million a year ago Financial PositionAs of Dec 31  2016  PPL Corp  had cash and cash equivalents of  341 million  compared with  836 million as of Dec 31  2015 Long term debt  excluding debts due within one year  was  17 808 million as of Dec 31  2016  compared with  18 563 million as of 2015 end In 2016  net cash flow from operating activities  continuing operations  was  2 890 million  compared with  2 272 million in the prior year period GuidancePPL Corp  has reiterated its 2017 adjusted earnings guidance in the range of  2 05  2 25 per share  midpoint   2 15 per share  The midpoints of the adjusted earnings guidance for UK Regulated  Kentucky Regulated and Pennsylvania Regulated are  1 18  58 cents and 50 cents  respectively  for the year The company expects annual earnings growth of 5 6  between 2017 and 2020 
How Have Estimates Been Moving Since Then 
Following the release  investors have witnessed a downward trend in fresh estimates PPL Corporation Price and Consensus
    VGM Scores
Currently  PPL Corp  s stock has a subpar Growth Score of  D   however its Momentum is doing a bit better with a  C   Following the exact same course  the stock was allocated also a grade of  C  on the value side  putting it in the middle 20  for this investment strategy 
Overall  the stock has an aggregate VGM Score of  D   If you aren t focused on one strategy  this score is the one you should be interested in 
Zacks  style scores indicate that the stock is suitable for value and momentum investors 
Outlook
The stock has a Zacks Rank  3  Hold   We are expecting an inline return from stock in the next few months ",2017-04-13,Zacks Investment Research,https://www.investing.com/analysis/ppl-corp-(ppl)-up-4.4-since-earnings-report:-can-it-continue-200182726,200182726
188443,409959,PPL,What Awaits Frontier Communications  FTR  In Q1 Earnings ,opinion,"Frontier Communications Corporation  NASDAQ FTR    NYSE T    a leading regional telecommunication company in the U S   is scheduled to report first quarter 2017 results on May 2  after market close Last quarter  the bottom line of Frontier Communications missed the Zacks Consensus Estimate by 33 33   However  the company s bottom line surpassed the Zacks Consensus Estimate in two of the past four quarters  resulting in an average beat of 34 45  Over the past three months  shares of Frontier Communications lost 45 00  compared with the Zacks categorized  industry s loss of 20 00  Let s see how things are shaping up for this announcement Factors at PlayFrontier Communications has been facing numerous issues such as outages  poor telephone services and billing problems  The company continues to suffer from the loss of legacy fixed telephony business to wireless and decline in access lines and wireless backhaul revenues due to customer migration to Ethernet solutions at lower price points However  we are impressed with Frontier Communications  focus on generating more profits through customer retention  market share gain  product introductions  broadband expansion  and improved sales and marketing initiatives  The company has been trying to derive benefits from the growing Business Service Segment  Frontier Communications  Vantage TV service rollout in North Carolina is likely to leverage from its recent acquisition of Verizon Communications  wireline assets in the state  By foraying into North Carolina  Frontier Communications will challenge major incumbents like AT T Inc    NYSE T   and Charter Communications   NYSE T   Meanwhile  the company s decision to reward its stockholders with a quarterly cash dividend of  0 105 per share of common stock  paid on Mar 31  2017 to holders of record at the close of business on Mar 15  2017  was encouraging Earnings Whispers Our proven model does not conclusively show a beat for FrontierCommunications this quarter  This is because a stock needs to have both a positive  and a Zacks Rank  1  Strong Buy   2  Buy  or 3  Hold  for this to happen  Unfortunately  that is not the case here as elaborated below Zacks ESP  Frontier Communications has an Earnings ESP of  40 00   This is because the Most Accurate estimate is pegged at a loss of 7 cents  while the Zacks Consensus Estimate is pegged at a loss of 5 cents  You can uncover the best stocks to buy or sell before they re reported with our  Zacks Rank  Frontier Communications has a Zacks Rank  3 which increases the predictive power of ESP  However  the company s negative ESP makes surprise prediction difficult We caution against stocks with a Zacks Rank  4 or 5  Sell rated  going into the earnings announcement  especially when the company is seeing negative estimate revisions Frontier Communications Corporation Price and EPS Surprise
 

   Stock to ConsiderHere is a company in the Zacks categorized broader  sector   which houses Frontier Communications   that has the right combination of elements to post an earnings beat this quarter PPL Corporation   NYSE PPL   is expected to report first quarter 2017 results on May 4  It has an Earnings ESP of  1 61  and a Zacks Rank  3  You can see  PPL Corp s earnings surpassed the Zacks Consensus Estimate in three of the previous four quarters  with an average beat of 4 29  The Best   Worst of ZacksToday you are invited to download the full  up to the minute list of 220 Zacks Rank  1  Strong Buys  free of charge  From 1988 through 2015 this list has averaged a stellar gain of  25  per year  Plus  you may download 220 Zacks Rank  5  Strong Sells   Even though this list holds many stocks that seem to be solid  it has historically performed 6X worse than the market ",2017-04-26,Zacks Investment Research,https://www.investing.com/analysis/what-awaits-frontier-communications-(ftr)-in-q1-earnings-200185722,200185722
188458,409974,PPL,PPL Corporation s U K  Operations To Be Unhurt By Brexit,opinion,Diversified utility PPL Corporation   NYSE PPL   announced that the decision of British citizens to move out of the European Union is not going to impact its existing operations in the U K   PPL Corporation through its regulated distribution network serves nearly 7 8 million customers across 21 600 square miles in Wales and southwest and central England United Kingdom ExposureUtilities operating in the U S  primarily have a domestic focus while PPL Corp  is an exception  In excess of 30  of revenues of the company comes from U K  Operations  The full implication of Brexit is yet to be ascertained and can take months to gauge the ultimate impact it will have on British citizens and for that matter on overseas companies with exposure in Britain View of PPL Corp  Management expects the decision of leaving the European Union will not significantly impact its operations in the country  Management also added that it might think about altering the earnings guidance for 2016  if the value of the pound depreciates beyond their expectation over the long term Pound Suffers The Brexit vote has resulted in a sharp fall in the value of the pound sterling  The pound was trading at  1 45 compared to a dollar before the referendum on hopes of a  remain  and now it is currently trading at nearly  1 35 PPL CORP Price   Guidance MaintainedPPL Corp  has maintained its ongoing earnings guidance of  2 25 to  2 45 per share  In addition  the company said it is not changing its previously announced projection of 5  to 6  compound annual earnings growth through 2018 Our ViewThanks to PPL Corp  s effective hedging program  fluctuations in the pound to dollar exchange rate will not hurt the company through 2017  This utility serves a strong customer base of nearly 7 8 million  Moreover  the demand for basic necessities is likely to stay even if Britain were to enter a period of downcycle    Zacks RankPPL Corporation currently has a Zacks Rank  3  Hold   Some better ranked stocks in the same space are Avangrid  Inc    NYSE AGR    Avista Corp    NYSE AVA   and Black Hills Corporation   NYSE BKH    all carrying a Zacks Rank  2  Buy  Want the latest recommendations from Zacks Investment Research  Today  you can download 7 Best Stocks for the Next 30 Days ,2016-06-26,Zacks Investment Research,https://www.investing.com/analysis/ppl-corporation's-u.k.-operations-to-be-unhurt-by-brexit-200138507,200138507
188459,409975,PPL,Are Utilities In A Bubble ,opinion,"Utilities are on a tear  Without accounting for dividends  the Utilities Select Sector SPDR ETF  NYSE XLU  is up 17  so far in 2016 and 28  over the past three years  in both cases outperforming the S P 500  via SPDR S P 500  NYSE SPY    Stocks that are supposed to be safe income plays have delivered major capital gains 
It s not hard to figure out why this is happening  Interest rates have been at historic lows for several years now  As the Fed continues to push back its timetable for raising rates  bond investors are capitulating and turning to Utilities as a source of yield 
This run up has many people uttering an unusual phrase   Utilities Bubble   Could these traditionally safe stocks be dangerously overvalued and setting up for a crash  And if so  how should investors manage their portfolios to mitigate this risk 
Utilities  Profits Do Not Justify The Stock Performance
Let s quickly dispense with one possible counterargument  that the strong run for Utilities stocks is based on improved financial performance and not yield chasing investors  Figure 1  which shows the trends in average return on invested capital  ROIC  and cumulative after tax operating profit  NOPAT  for the sector over the past few years  clearly shows that profits are flat to down and not driving stock valuations higher 
Figure 1  Utilities ROIC And NOPAT

Sources  New Constructs  LLC and company filings 
Nor do macro industry trends support hope for growth in future cash flows  In fact  the exact opposite is true 
Solar panel installations are projected to  in 2016 
The market for energy efficient LED lighting is   part of a larger move towards greater energy efficiency in US households 
With shrinking demand  Utilities will be forced to raise rates on remaining customers  leading to an even higher adoption of solar power and energy saving devices    half of electric utility executives expect these trends to send their industry into a  death spiral  within the next decade 
Underlying cash flows and industry trends do not support the recent outperformance of Utilities stocks 
Current Valuations Imply Unrealistic Profit Growth
Utilities tend to be one of the slowest growing sectors in the economy  Moreover  with the growing threat to the core business model  you d expect to see them trading at a discount to the rest of the market 
Instead  when we measure the profit growth implied by the market s valuation  we see that XLU and SPY have the same exact price to economic book value  PEBV  ratio of 2 8  Based on their valuations  Utilities are expected to grow at the same rate as the rest of the S P 500  which seems unrealistic 
With inferior profitability  a below par profit growth outlook  and valuations on par with the rest of the market  Utilities pose quite a risk to investors  portfolios 
Figure 2  Ratings Breakdown

Sources  New Constructs  LLC and company filings 
Figure 2 shows that the Utilities sector has a much higher concentration of Dangerous and Very Dangerous rated stocks than the rest of the market  In fact  only one stock in the sector earns our Attractive or Very Attractive rating  whereas every other sector has at least nine companies that are Attractive or better 
Low Rates Can t Keep Propping Up Utilities   Dividend Yields Are At Risk
There are two ways for the bubble in Utilities to end  The simplest mechanism would be if interest rates started rising again  This trend would push investors back into bonds and cause the price of Utilities to fall back to a level that better reflects their cash flows and risks 
However  even if interest rates stay low for an extended period of time  Utilities investors are still at risk 
The high dividends that have attracted so many investors to this space are unsustainable  The 75 Utilities companies that we cover have had negative free cash flow in four of the past five years  with a cumulative cash burn of almost  150 billion over that time  The profits simply aren t there to cover the high dividends that investors prize 
In addition  rising equity values for Utilities offsets the advantages that cheap debt has for their cost of capital  Even with interest rates at record lows  the weighted average cost of capital  WACC  for Utilities companies has been rising this year as equity becomes a larger and larger portion of their capital structure 
Where To Turn In The Sector
Unfortunately  many advisors and portfolio managers are stuck with a mandated exposure to the Utilities sector  forcing them to search for a way to hit targeted allocations without jeopardizing client portfolios  While there is only one stock that earns our Attractive or better rating in the sector  there are a couple that are not egregiously overvalued 
UGI Corporation  NYSE UGI  is the most profitable stocks in the sector  with an ROIC of 8   It s also the cheapest with a PEBV of 0 9  In addition  it has delivered three consecutive years of positive free cash flow  which suggests its dividend could be sustainable  On a fundamental basis  it clearly appears to be the best in the sector  Unfortunately  its 2 1  dividend yield might be on the low side for those that require income from their investments 
PPL Corporation  NYSE PPL  is another Utilities stock that has some margin of safety  It has a much higher dividend yield of 4 2   and  like UGI  it has delivered positive free cash flow for three consecutive years  In addition  its price to economic book value of 1 6 is well below the industry average  In part  this seems to be due to overstated concerns about the company s exposure to the UK  even though it is highly hedged to protect against the drop in the pound  Investors needing exposure to the sector should take advantage of this comparatively cheap valuation 
Disclosure  David Trainer and Sam McBride receive no compensation to write about any specific stock  sector  style  or theme ",2016-08-12,David Trainer,https://www.investing.com/analysis/are-utilities-in-a-bubble-200147530,200147530
188472,409988,PPL,PPL Corp Hit By Warm Weather  Investments To Spur Growth,opinion,On May 9  2016  we have issued an updated research report on PPL Corporation   NYSE PPL    a diversified utility holding company with a presence in both the U S  and the UK  PPL Corp  s businesses are sensitive to commodity prices and weather fluctuations  Nevertheless  its disciplined capital investment program  stable financial position and customer centric strategies are expected to offset these headwinds PPL Corporation s first quarter 2016 performance was softer than expected  with both earnings and revenues lagging the respective Zacks Consensus Estimate  Sales were hurt by unseasonably warm weather in the company s service territories On the bright side  PPL Corporation continues to follow an organic growth strategy to expand and upgrade its utility systems in order to enhance service reliability as well as to attract new customers and retain existing ones  The company has plans to make capital investment of  16 billion during the 2016 2020 time frame  comprising nearly  3 2  3 3 billion annually  Such customer centric strategies undertaken by the company will allow it to achieve annual earnings growth of 5 6  through 2018  off a 2014 base We remind investors that favorable rate case outcomes in Pennsylvania and Kentucky are also expected to accelerate bottom line growth throughout the year and generate substantial revenues  going forward On the other hand  PPL Corp  generates a substantial portion of electricity from coal fired facilities  Its dependence on coal facilities remains a major concern for the company as it has to invest substantially in low emission facilities to meet regulatory mandates  which may put margins under pressure  In fact  to comply with the EPA s new Coal Combustion Residuals rule  the company expects to begin investing in environmental improvements in the second half of 2016  which will continue through 2023 Zacks Rank   Key PicksPPL Corporation currently has a Zacks Rank  2  Buy  A few other well placed stocks in the utility electric power space include Avangrid  Inc    NYSE AGR   Spark Energy  Inc    NASDAQ SPKE   and Avista Corporation   NYSE AVA    While both Avangrid and Spark Energy sport a Zacks Rank  1  Strong Buy   Avista Corporation carries the same rank as PPL Corp ,2016-05-09,Zacks Investment Research,https://www.investing.com/analysis/ppl-corp-hit-by-warm-weather;-investments-to-spur-growth-200129128,200129128
