,id,ticker,title,category,content,date,provider,url,article_id
200237,421753,BSX,NeuroMetrix reports Q4 results,news,"NeuroMetrix  NASDAQ NURO   Q4 net loss of  1 1M
Revenue of  1 71M   54 2  Y Y 
Shares  4 21  PM 
Press Release",2020-01-27,Seeking Alpha,https://invst.ly/pncr8,2068251
200238,421754,BSX,What to Like    and Dislike    About Boston Scientific s Q4 Results,news,"You might say that Boston Scientific  NYSE BSX  delivered an average performance in 2019  But while the stock delivered a gain that nearly exactly matched that of the S P 500 index last year  it s hard to look at a 28  jump as just average 
This year hasn t started off as positively for the medical device maker  though  But Boston Scientific announced its fourth quarter results before the market opened on Wednesday  giving investors some good news    along with some news that wasn t as good  Here are the highlights from the company s Q4 update 

By the numbers
Boston Scientific reported fourth quarter revenue of  2 91 billion  This reflected a 13 4  year over year jump  but it fell a little short of Wall Street s consensus Q4 revenue estimate of  2 92 billion  However  the revenue figure was within the company s guidance for the fourth quarter 
The company announced net income of  4 billion  or  2 83 per share  in the fourth quarter based on generally accepted accounting principles  GAAP   This represented a significant improvement from GAAP net income of  386 million  or  0 27 per share  reported in the same quarter of 2018  
Boston Scientific posted adjusted net income of  0 46 per share  up from adjusted earnings of  0 39 per share in the prior year period  It also beat the analysts  average earnings estimate of  0 44 per share 
Behind the numbers
The cardiovascular segment ranked as Boston Scientific s strongest unit in Q4  with sales jumping 18 7  year over year to  1 15 billion  Peripheral intervention products delivered especially strong growth  with revenue soaring 33 2  to  403 million  Interventional cardiology sales rose 12 1  to  748 million 
Sales for the company s MedSurg segment increased by 9 8  year over year in Q4 to  878 million  Its urology and pelvic health business led the way  with sales climbing 11 1  to  379 million  Endoscopy sales grew 8 8  to  499 million 
Boston Scientific s weakest link in the fourth quarter was its rhythm and neuro segment  Revenue for this segment rose 3 5  year over year to  817 million  Cardiac rhythm management sales slipped 3 3  from the prior year period to  473 million  This was offset by an 18 7  year over year sales gain for neuromodulation and a 3  gain for electrophysiology to  261 million and  84 million  respectively 
The company also reported  58 million in sales in Q4 for its specialty pharmaceuticals business  Boston Scientific picked up this business with its acquisition of BTG in August 2019 
Looking ahead
Some healthcare stocks are being impacted by the coronavirus outbreak in China that has also spread to other parts of the world  Boston Scientific isn t an exception 
The company expects revenue growth of between 10  and 12  in the first quarter of 2020  with organic growth of 5  to 7   This outlook includes a negative sales impact of between  10 million and  40 million due to the potential effects of the coronavirus scare on procedure volumes in China 
For full year 2020  Boston Scientific anticipates revenue growth to be in a range of 10  to 12   The company also projected 2020 earnings per share  EPS  to come in between  0 95 and  1 00  Adjusted EPS is expected to be between  1 74 and  1 79 ",2020-02-05,The Motley Fool,https://invst.ly/priph,2077003
