,id,ticker,title,category,content,date,provider,url,article_id
21541,243056,RDWR,5 Stocks With Rising P E That Won t Let You Down,opinion,"Picking bargain hunting stocks or in other words stocks with a low price to earnings  P E  ratio is a popular investing strategy   This is especially true in the current scenario as U S  equities are hitting all time highs and investors might be interested in looking out for cheap or value stocks 
Investors believe that the lower the P E  the higher will be the value of the stock  The logic is simple   a stock s current market price does not justify its higher earnings and therefore leaves room for upside 
But there is more to this whole P E story as not only low P E  stocks with a rising P E can also fetch solid returns 
Rising P E  An Useful Tool
Generally  the price of a stock rallies on a rise in earnings  As forecasts for expected earnings move higher  demand for the stock should drive its price  After all  astock s P E gives an indication of how much investors are ready to shell out for every dollar of earnings  Thus  if the P E of a stock is rising steadily  it means that investors are pinning their hopes on the company s inherent strength 
Also  studies have revealed that stocks have seen their P E ratios jump over 100  from their breakout point in the cycle  So  if you can pick stocks early in their breakout cycle  you can end up seeing considerable gains 
The Winning Strategy
In order to shortlist stocks that are exhibiting an increasing P E  we chose the following as our primary screening parameters 
EPS growth estimate for the current year is greater than or equal to last year s actual growth
Percentage change in last year EPS should be greater than or equal to zero
 These two criteria point to flat earnings or a growth trend over the years  
Percentage change in price over four weeks greater than the percentage change in price over 12 weeks
Percentage change in price over 12 weeks greater than percentage change in price over 24 weeks
 These two criteria show that price of the stock is increasing consistently over the said timeframes  
Percentage price change for four weeks relative to the S P 500 greater than the percentage price change for 12 weeks relative to the S P 500
Percentage price change for 12 weeks relative to the S P 500 greater than the percentage price change for 24 weeks relative to the S P 500
 Here  the case for consistent price gains gets even stronger as it displays percentage price changes relative to the S P 500  
Percentage price change for 12 weeks is 20  higher than or equal to the percentage price change for 24 weeks  but it should not exceed 100 
 A 20  increase in the price of a stock from the breakout point gives cues of an impending uptrend  But a jump of over 100  indicates that there is limited scope for further upside and that the stock might be due for a reversal  
In addition  we place a few other criteria that lead us to some likely outperformers 
Zacks Rank less than or equal to 2  Only companies with a Zacks Rank  1  Strong Buy  or 2  Buy  can get through 
Average 20 day Volume greater than or equal to 50 000  High trading volume implies that the stocks have adequate liquidity 
Just these few criteria narrowed down the universe from over 7 700 stocks to just 41 
Here are five of the 41 stocks 
Civeo Corporation    NYSE CVEO     It is a provider of long term and temporary remote site accommodations  logistics and facility management services  The stock carries a Zacks Rank  2  You can see  
InspireMD Inc     NYSE NSPR     It is a medical device company focusing on the development and commercialization of its proprietary stent system technology  MGuard  It belongs to a favorable Zacks industry  placed at the top 38  of 250  industries   The stock carries a Zacks Rank  2 
Westport Fuel Systems Inc     NASDAQ WPRT     This Zacks Rank  2 company is a developer  manufacturer and supplier of advanced alternative fuel systems and components 
Genesco Inc     NYSE GCO     The specialty retailer  sells footwear  headwear and accessories in retail stores in the United States and Canada carries a Zacks Rank  1  It comes from a favorable Zacks industry  top 16   
Radware Ltd     NASDAQ RDWR     It develops  manufactures and markets products that manage and direct Internet traffic among network resources to enable continuous access to Web sites and other services  applications and content based on Internet protocol  It has a Zacks Rank  2 and hails from a favorable Zacks industry  top 7   
You can get the rest of the stocks on this list by signing up now for your 2 week free trial to the Research Wizard and start using this screen in your own trading  Further  you can also create your own strategies and test them first before taking the investment plunge 
The Research Wizard is a great place to begin  It s easy to use  Everything is in plain language  And it s very intuitive  Start your Research Wizard trial today  And the next time you read an economic report  open up the Research Wizard  plug your finds in  and see what gems come out 
 
Disclosure  Officers  directors and or employees of Zacks Investment Research may own or have sold short securities and or hold long and or short positions in options that are mentioned in this material  An affiliated investment advisory firm may own or have sold short securities and or hold long and or short positions in options that are mentioned in this material 
Disclosure  Performance information for Zacks  portfolios and strategies are available at   ",2019-12-18,Zacks Investment Research,https://www.investing.com/analysis/5-stocks-with-rising-pe-that-wont-let-you-down-200493366,200493366
21542,243057,RDWR,Zacks com Featured Highlights Include  Civeo  InspireMD  Westport Fuel Systems  Genesco And Radware,opinion,For Immediate ReleaseChicago  IL   December 19  2019   Stocks in this week s article are Civeo Corporation   NYSE CVEO    InspireMD Inc    NYSE NSPR    Westport Fuel Systems Inc    NASDAQ WPRT    Genesco Inc    NYSE GCO   and Radware Ltd    NASDAQ RDWR   5 Stocks with Rising P Es that Won t Let You DownPicking bargain hunting stocks or in other words stocks with a low price to earnings  P E  ratio is a popular investing strategy   This is especially true in the current scenario as U S  equities are hitting all time highs and investors might be interested in looking out for cheap or value stocks Investors believe that the lower the P E  the higher will be the value of the stock  The logic is simple   a stock s current market price does not justify its higher earnings and therefore leaves room for upside But there is more to this whole P E story as not only low P E  stocks with a rising P E can also fetch solid returns Rising P E  An Useful ToolGenerally  the price of a stock rallies on a rise in earnings  As forecasts for expected earnings move higher  demand for the stock should drive its price  After all  a stock s P E gives an indication of how much investors are ready to shell out for every dollar of earnings  Thus  if the P E of a stock is rising steadily  it means that investors are pinning their hopes on the company s inherent strength Also  studies have revealed that stocks have seen their P E ratios jump over 100  from their breakout point in the cycle  So  if you can pick stocks early in their breakout cycle  you can end up seeing considerable gains For the rest of this Screen of the Week article please visit Zacks com at  Disclosure  Officers  directors and or employees of Zacks Investment Research may own or have sold short securities and or hold long and or short positions in options that are mentioned in this material  An affiliated investment advisory firm may own or have sold short securities and or hold long and or short positions in options that are mentioned in this material About Screen of the WeekZacks com created the first and best screening system on the web earning the distinction as the   1 site for screening stocks  by Money Magazine   But powerful screening tools is just the start  That is why Zacks created the Screen of the Week to highlight profitable stock picking strategies that investors can actively use Strong Stocks that Should Be in the NewsMany are little publicized and fly under the Wall Street radar  They re virtually unknown to the general public  Yet today s 220 Zacks Rank  1  Strong Buys  were generated by the stock picking system that has more than doubled the market from 1988 through 2016  Its average gain has been a stellar  25  per year  Follow us on Twitter   Join us on Facebook  NASDAQ FB    Zacks Investment Research is under common control with affiliated entities  including a broker dealer and an investment adviser   which may engage in transactions involving the foregoing securities for the clients of such affiliates Contact  Jim GiaquintoCompany  Zacks comPhone  312 265 9268Email  Visit  Zacks com provides investment resources and informs you of these resources  which you may choose to use in making your own investment decisions  Zacks is providing information on this resource to you subject to the Zacks  Terms and Conditions of Service  disclaimer   Past performance is no guarantee of future results  Inherent in any investment is the potential for loss  This material is being provided for informational purposes only and nothing herein constitutes investment  legal  accounting or tax advice  or a recommendation to buy  sell or hold a security  No recommendation or advice is being given as to whether any investment is suitable for a particular investor  It should not be assumed that any investments in securities  companies  sectors or markets identified and described were or will be profitable  All information is current as of the date of herein and is subject to change without notice  Any views or opinions expressed may not reflect those of the firm as a whole  Zacks Investment Research does not engage in investment banking  market making or asset management activities of any securities  These returns are from hypothetical portfolios consisting of stocks with Zacks Rank   1 that were rebalanced monthly with zero transaction costs  These are not the returns of actual portfolios of stocks  The S P 500 is an unmanaged index  Visit  for information about the performance numbers displayed in this press release ,2019-12-18,Zacks Investment Research,https://www.investing.com/analysis/zackscom-featured-highlights-include-civeo-inspiremd-westport-fuel-systems-genesco-and-radware-200493759,200493759
21543,243058,RDWR,4 Hot Cybersecurity Stocks To Invest In For A Prosperous 2020,opinion,The year 2019 has been a good year overall for the cybersecurity industry as a number of cyber attacks and data breaches plus the consequences of old violations kept the stocks rallying throughout Here we paint a general picture based on the expected trends  which are likely to shape the cybersecurity landscape in 2020 Top Risks   Trends of 2020IoT Security  Growing number of connected devices among enterprises is expected to increase the need for efficient monitoring and management of threats on real time basis  Detection and prevention of advanced attacks are likely to gain more significance than device profiling and inventory  which have been the focus of IoT technology providers so far  However  lack of end to end IoT focused security service solutions is a headwind  Industrial Security  With the advent of industry 4 0  new risks crept in this year  which might pose major threats in 2020  Development of the Industrial IoT  digitization of factories and the infusion of AI made industrial networks more connected  thereby exposing the industrial sector to even more security perils  Growing Adoption of the Zero Trust Approach  As more and more enterprises transition their workloads and data to the cloud  every point in the network is becoming more vulnerable to security infringement  Therefore  perimeter security is no longer enough to protect the organization from safety lapses  Summing up  the model follows one rule   Never Trust  Always Verify   Serverless Security  Emergence of serverless computing technologies  such as AWS Lambda  is projected to drive demand for security solutions  which have the ability to prevent any breach that happens due to increased misconfigurations and security gaps  Emergence of SASE Technology  SASE  secure access service edge  was recently acknowledged by Gartner as one of the most promising technology in enterprise networking  Uptake of this technology is likely to be driven by an ongoing architectural transformation of traditional data center centric networking and security to the cloud technology for better catering to the current mobile workforce as well as achieving higher acceptance of the same  Data Breaches  This continues to be the biggest cybersecurity concern  Web application flaws are a leading source of data breaches  making web application security a top priority for all organizations as they approach the new year  Per Cybersecurity Ventures  cybercrime is to cost businesses globally by more than  6 trillion annually within 2021  Automation and Integration  Security professionals are forced to do more with less  So  automation and integration are becoming necessary across the board  By integrating security with agile processes  such as DevOps  organizations can effectively manage risk  Numerous web applications combining multiple web services are difficult to secure while automated solutions are becoming necessary to reduce the workload on security teams Cyber Security Stocks to Gain From These TrendsWhile frequency of cyber attacks doesn t bode well for most organizations  the players operating in the cybersecurity industry are positioned to benefit immensely  Notably  president Donald Trump proposed a of  17 4 billion for cybersecurity related activities  reflecting a 5  year over year increase in 2020 Considering the higher spending and aforementioned trends  we highlighted four cybersecurity stocks with potential to make the most of the teeming opportunities in this space These stocks either have a Zacks Rank  1  Strong Buy  or 2  Buy   making them good investment opportunities You can see  Moreover  these stocks also have a market capital of more than  1 billion Best BetsQualys   NASDAQ QLYS   solutions are provided through its QualysGuard Cloud Platform  which offers enterprises instant visibility of their IT assets and global security practices  The company s cloud based security and compliance stack are being received positively by new and existing customers The stock has a Zacks Rank of 1 and a market cap of  3 3 billion  The Zacks Consensus Estimate for its 2020 earnings has been revised 1 2  upward to  2 49 over the past 30 days Fortinet   NASDAQ FTNT   is focused on expanding and enhancing its Security Fabric product suite  which is witnessing strong global demand owing to digital transformation across most industries The stock is Zacks  1 Ranked and has a market cap of  18 29 billion  The Zacks Consensus Estimate for its 2020 earnings has been raised 13 9  to  2 71 over the past 60 days CyberArk Software Ltd    NASDAQ CYBR   is benefiting from its Privileged Access Security Solution  a powerful technology to enable customers to lower security hazards across their operations in the cloud The stock has a Zacks Rank of 2 and a market cap of  4 39 billion  The Zacks Consensus Estimate for its 2020 earnings has moved 5  north to  2 72 over the past 60 days  2 Ranked stock Radware s   NASDAQ RDWR   fully managed Cloud WAF and Cloud DDoS solution is gaining momentum across industries  The company has a market cap of  1 18 billion The Zacks Consensus Estimate for its 2020 earnings has increased 4 3  to 96 cents over the past 60 days Zacks Top 10 Stocks for 2020In addition to the stocks discussed above  would you like to know about our 10 top tickers for the entirety of 2020 These 10 are painstakingly hand picked from over 4 000 companies covered by the Zacks Rank  They are our primary picks to buy and hold ,2019-12-23,Zacks Investment Research,https://www.investing.com/analysis/4-hot-cybersecurity-stocks-to-invest-in-for-a-prosperous-2020-200494767,200494767
21544,243059,RDWR,CyberArk  CYBR  Jumps  Stock Rises 6 1 ,opinion,CyberArk Software Ltd    NASDAQ CYBR   was a big mover last session  as the company saw its shares rise more than 6  on the day  The move came on solid volume too with far more shares changing hands than in a normal session  This breaks the recent trend of the company  as the stock is now trading above the volatile price range of  123 55 to  133 94 in the past one month time frame The company has seen no changes when it comes to estimate revision over the past few weeks  while the Zacks Consensus Estimate for the current quarter has also remained unchanged  The recent price action is encouraging though  so make sure to keep a close watch on this firm in the near future  CyberArk currently has a Zacks Rank  2  Buy  while its  is 0 00  CyberArk Software Ltd  Price   Investors interested in the Security industry may consider Radware Ltd    NASDAQ RDWR    which has a Zacks Rank  2  You can see  Is CYBR going up  Or down  Predict to see what others think  Up or DownRadical New Technology Creates  12 3 Trillion OpportunityImagine buying Microsoft  NASDAQ MSFT  stock in the early days of personal computers  or Motorola  NYSE MSI  after it released the world s first cell phone  These technologies changed our lives and created massive profits for investors Today  we re on the brink of the next quantum leap in technology  7 innovative companies are leading this  4th Industrial Revolution    and early investors stand to earn the biggest profits ,2019-07-15,Zacks Investment Research,https://www.investing.com/analysis/cyberark-cybr-jumps-stock-rises-61-200440354,200440354
21584,243099,RDWR,The Zacks Analyst Blog Highlights  Qualys  Fortinet  CyberArk And Radware,opinion,For Immediate ReleaseChicago  IL  December 26  2019   Zacks com announces the list of stocks featured in the Analyst Blog  Every day the Zacks Equity Research analysts discuss the latest news and events impacting stocks and the financial markets  Stocks recently featured in the blog include  Qualys   NASDAQ QLYS    Fortinet   NASDAQ FTNT    CyberArk Software Ltd    NASDAQ CYBR   and Radware   NASDAQ RDWR   Here are highlights from Tuesday s Analyst Blog 4 Hot Cybersecurity Stocks to Invest in for a Prosperous 2020The year 2019 has been a good year overall for the cybersecurity industry as a number of cyber attacks and data breaches plus the consequences of old violations kept the stocks rallying throughout Here we paint a general picture based on the expected trends  which are likely to shape the cybersecurity landscape in 2020 Top Risks   Trends of 2020IoT Security  Growing number of connected devices among enterprises is expected to increase the need for efficient monitoring and management of threats on real time basis  Detection and prevention of advanced attacks are likely to gain more significance than device profiling and inventory  which have been the focus of IoT technology providers so far  However  lack of end to end IoT focused security service solutions is a headwind  Industrial Security  With the advent of industry 4 0  new risks crept in this year  which might pose major threats in 2020  Development of the Industrial IoT  digitization of factories and the infusion of AI made industrial networks more connected  thereby exposing the industrial sector to even more security perils  Growing Adoption of the Zero Trust Approach  As more and more enterprises transition their workloads and data to the cloud  every point in the network is becoming more vulnerable to security infringement  Therefore  perimeter security is no longer enough to protect the organization from safety lapses  Summing up  the model follows one rule   Never Trust  Always Verify   Serverless Security  Emergence of serverless computing technologies  such as AWS Lambda  is projected to drive demand for security solutions  which have the ability to prevent any breach that happens due to increased misconfigurations and security gaps  Emergence of SASE Technology  SASE  secure access service edge  was recently acknowledged by Gartner as one of the most promising technology in enterprise networking  Uptake of this technology is likely to be driven by an ongoing architectural transformation of traditional data center centric networking and security to the cloud technology for better catering to the current mobile workforce as well as achieving higher acceptance of the same  Data Breaches  This continues to be the biggest cybersecurity concern  Web application flaws are a leading source of data breaches  making web application security a top priority for all organizations as they approach the new year  Per Cybersecurity Ventures  cybercrime is to cost businesses globally by more than  6 trillion annually within 2021  Automation and Integration  Security professionals are forced to do more with less  So  automation and integration are becoming necessary across the board  By integrating security with agile processes  such as DevOps  organizations can effectively manage risk  Numerous web applications combining multiple web services are difficult to secure while automated solutions are becoming necessary to reduce the workload on security teams Cyber Security Stocks to Gain From These TrendsWhile frequency of cyber attacks doesn t bode well for most organizations  the players operating in the cybersecurity industry are positioned to benefit immensely  Notably  president Donald Trump proposed a of  17 4 billion for cybersecurity related activities  reflecting a 5  year over year increase in 2020 Considering the higher spending and aforementioned trends  we highlighted four cybersecurity stocks with potential to make the most of the teeming opportunities in this space These stocks either have a Zacks Rank  1  Strong Buy  or 2  Buy   making them good investment opportunities  You can see  Moreover  these stocks also have a market capital of more than  1 billion Best BetsQualys solutions are provided through its QualysGuard Cloud Platform  which offers enterprises instant visibility of their IT assets and global security practices  The company s cloud based security and compliance stack are being received positively by new and existing customers The stock has a Zacks Rank of 1 and a market cap of  3 3 billion  The Zacks Consensus Estimate for its 2020 earnings has been revised 1 2  upward to  2 49 over the past 30 days Fortinet is focused on expanding and enhancing its Security Fabric product suite  which is witnessing strong global demand owing to digital transformation across most industries The stock is Zacks  1 Ranked and has a market cap of  18 29 billion  The Zacks Consensus Estimate for its 2020 earnings has been raised 13 9  to  2 71 over the past 60 days CyberArk Software Ltd is benefiting from its Privileged Access Security Solution  a powerful technology to enable customers to lower security hazards across their operations in the cloud The stock has a Zacks Rank of 2 and a market cap of  4 39 billion  The Zacks Consensus Estimate for its 2020 earnings has moved 5  north to  2 72 over the past 60 days  2 Ranked stock Radware s fully managed Cloud WAF and Cloud DDoS solution is gaining momentum across industries  The company has a market cap of  1 18 billion The Zacks Consensus Estimate for its 2020 earnings has increased 4 3  to 96 cents over the past 60 days Zacks Top 10 Stocks for 2020In addition to the stocks discussed above  would you like to know about our 10 top tickers for the entirety of 2020 These 10 are painstakingly hand picked from over 4 000 companies covered by the Zacks Rank  They are our primary picks to buy and hold  Media ContactZacks Investment Research800 767 3771 ext  9339 Past performance is no guarantee of future results  Inherent in any investment is the potential for loss  This material is being provided for informational purposes only and nothing herein constitutes investment  legal  accounting or tax advice  or a recommendation to buy  sell or hold a security  No recommendation or advice is being given as to whether any investment is suitable for a particular investor  It should not be assumed that any investments in securities  companies  sectors or markets identified and described were or will be profitable  All information is current as of the date of herein and is subject to change without notice  Any views or opinions expressed may not reflect those of the firm as a whole  Zacks Investment Research does not engage in investment banking  market making or asset management activities of any securities  These returns are from hypothetical portfolios consisting of stocks with Zacks Rank   1 that were rebalanced monthly with zero transaction costs  These are not the returns of actual portfolios of stocks  The S P 500 is an unmanaged index  Visit  for information about the performance numbers displayed in this press release ,2019-12-25,Zacks Investment Research,https://www.investing.com/analysis/the-zacks-analyst-blog-highlights-qualys-fortinet-cyberark-and-radware-200494947,200494947
